,0,1,2,3,4,5,6,7,8,9
45,House for Sale in Kegalle, 6 Jun  9:57 am,"Kegalle, Kegalle","3,500,000",කෑගල්ල නගරය අාසන්නයේඅඩක් නිමකරනලද නිවස විකිණීමටනිදන කාමර 3 යිනාන කාමර 1 යිසාලය / කෑම කාමරය/ මුලුතැන්ගෙය ඉඩම පර්චස් 10 යිනිරවුල් ඔප්පුජලය විදුලිය අැතුලු සියලු පහසුකම් සහිතයිකොළඹ - මහනුවර පුුුධාන මාර්ගයට මිටර් 800 යිකෑගල්ල පිටත වටරවුම් මාර්ගයටකි.මි 1 යිකෑගලු බාලිකා විදුහලට / කෑගලු විදයාලයට කි.මි 3 යිමිළගණන් සාකච්චාකරගතහැකHOUSE FOR SALE KEGALLEHALF  COMPLETED  HOUSENEAR THE KEGALLE TOWN3 BED ROOMS1 BATH ROOMLIVING / DINING / KITCHEN 10 PERCHES LANDCLEAR DOCUMENTWATER / ELECTRICITY AND ALL FACILITIES AVAILABLE800 M TO COLOMBO - KANDY MAIN ROAD1 KM TO BYPASS3 KM FROM KEGALU BALIKA  & KEGALU VIDYALAYA,3,1,"1,260.0 sqft",10.0 perches,
46,House for Sale in Polgahawela Kegalle, 8 Jun  9:51 am,"Kegalle, Kegalle","3,000,000","*Good residential closed to polgahawela town*Commercial development along polgahawela-kegalle rd about 4km *polgahawela -Moragalla rd about 500m away from the property. *Electricity ,water,Telephone links available.","Ibulgusdeniya,Moragolla Estate,polgahawela.",2,1,"1,150.0 sqft",14.5 perches
47,House for Sale Hemathagama,25 Jun 10:54 am,"Mawanella, Kegalle","6,800,000","75 Metesr to  Hemmathagama CitySLT LINE , Water  , Electricity  Hemmathagama Nagaragiri School in Hemmathagama City in 50 meters",Pesan Guard Hemmathagama,4,1,"1,700.0 sqft",22.5 perches
48,House for Sale in - Mawanella,30 May  2:53 pm,"Mawanella, Kegalle","7,000,000","Demahal Niwase Pahala Mahala 80% Weda Nimawa Etha. Mulu Idamama Perch 145 Samaga Niwasa 7,000,000 Niwasa Kotasa Pamanak Perch 30-40 Niwasa Samaga 4,800,000 Idame Niwasa Pihiti Kotase Hera Denata Adayam Labana Mattame Gammiris Wagawak Etha. Jalaya Widuliya Pahasukam Etha. Manaram Parisarayaka Pihita Ethi Athara Colombo Kandy Margaux Ganethenna Gampola Aluthin Idiwana Maragaye Niwasa Ha Idama Pihita Etha, Mawanella Nagayata 8km Colombo Kandy Margayata 4km, Siyalu Oppu Ha Plan Pradeshiya Sabawe Anumatha Kara Etha, Denata Banku Nayamudalak Labagenimata Ukasata Thaba Ethi Athara Naya Mudala Piyawa Diya Heka, Escalator Washayen Padinchiya Wenas Jurists Wikine ",2,1,"1,400.0 sqft",145.0 perches,
49,Luxury House For Sale - Kegalle,28 May  3:17 pm,"Kegalle, Kegalle","27,500,000",අංග සම්පූර්ණ Bed rooms 4යි සියලුම ගෘහ භාණ්ඩ සහිතවA/C RoomsCCTV Camera ඕස්ට්‍රේලියන් තණකොල වලට වෝටර් සෙන්සර් වර්ග අඩි 3600 නිවස සවන්ට් රෑම් සමග සවන්ට් ටොයිලට් අංග සම්පූර්ණ පැන්ට්රි කබඩ් අමතන්න ප්‍රසාද්,"Kandewatta road,Kegalle",4,2,"3,600.0 sqft",18.0 perches
50,House for sale in Rambukkana,28 May  2:33 pm,"Rambukkana, Kegalle","6,000,000","රඹුක්කන ,කෑගල්ල මාර්ගයේ දළුග්ගල පර්චස්  20 අංග  සම්පූර්ණ  නිවසක් ඉතා ඉක්මනින් විකිණේ .ප්‍රධාන පාසල ඉදිරිපිට පොලිසිය , දුම්රිය ස්ථානය සහ රජයේ ආයතන ආසන්නයකින්No.76/22 , Nikagollawaththa,Daluggala, Rambukkana.","76/22, Nikagollawatta, Daluggala, Rambukkana",3,1,"1,150.0 sqft",20.0 perches
51,වගාවක් සිහිත නිවසක් විකිනීමට - යට්ටෝටෝගොඩ,27 May 10:24 am,"Galigamuwa, Kegalle","7,500,000",කොළබ නුවර ප්ර0දාන මාර්ගයේ  බල්ලපාන නගරයේ යට්ටෝටෝගොඩ මංසන්දියේ සිට මීටර් 700 පමණ දුරින් පිහිටා ඇති පර්චස් 120 ඉඩම සහීත නිවාසය විකිනීමට ඇත *  කාමර 5 *  මුළුතැන්ගෙය *  බුද්ධ මන්දියරය ,yattogoda,5,1,"1,202.0 sqft",120.0 perches
52,House for Sale Ruwanwella,23 May  1:32 pm,"Ruwanwella, Kegalle","4,500,000","House for sale there is a house 150m to aguruwella town across Avissawella Kandy, warakapola road. it's10 perches land with full completed house with large open verandah, large living room and dining room. Included with large tow bed rooms and one large Barth room with all components. It have been tilled all floors. Also ceiling has completed.  The kitchen with pantry.  Three phase current and water board tap line are included in this house.","no. c/131/2 karaudeniya, Kurahan waththa, Aguruwella. ruwanwella",2,1,"1,177.0 sqft",10.0 perches
