,0,1,2,3,4,5,6,7,8
0,title,posted date,location,price,description,Property type:,Beds:,Baths:,
1,Selagala Hotel - Anuradhapura, 4 Jun  9:30 am,"Anuradhapura, Anuradhapura","1,500","Selagala Hotel is a comfortable place to stay. Walking distance to new town and very close to old town bus stand. Can reach to the city and sacred city  in a few minutes. The hotel has comfortable double bedrooms and family bedrooms. Some rooms have air conditioned facility. Restaurant, living room and lobby area available. Large garden area comes with parking space. Room basis and the entire premises can be taken for groups.Budget room Rs.1500/ - Rs.3000/Standard Room  Rs.2500/-  Rs.3500/We have small budget house with an attached bathroom and outdoor bathroom. Television is available.Rs.2500/ for 5 guestsRs.4000/ for 10 guestsRs.5000/ for guests",Holiday bungalow,5,5,
2,"['Selagala Hotel - Anuradhapura', ' 4 Jun  9:30 am', 'Anuradhapura, Anuradhapura', '1,500', 'Selagala Hotel is a comfortable place to stay. Walking distance to new town and very close to old town bus stand. Can reach to the city and sacred city  in a few minutes. The hotel has comfortable double bedrooms and family bedrooms. Some rooms have air conditioned facility. Restaurant, living room and lobby area available. Large garden area comes with parking space. Room basis and the entire premises can be taken for groups.Budget room Rs.1500/ - Rs.3000/Standard Room  Rs.2500/-  Rs.3500/We have small budget house with an attached bathroom and outdoor bathroom. Television is available.Rs.2500/ for 5 guestsRs.4000/ for 10 guestsRs.5000/ for guests', 'Holiday bungalow', '5', '5']","['title', 'posted date', 'location', 'price', 'description', 'Property type:', 'Beds:', 'Baths:']",,,,,,,
3,ABC Holly day Homes in - Anuradhpura,18 Jul  5:59 pm,"Anuradhapura, Anuradhapura","5,000","Two new separate apartments with  2 rooms and three rooms about  5-6 minutes to Sri Mahabodhi. Each apartment   consist with attached bathrooms,living area,kitchen with appliances ,parking facilities,T.V. and refrigerator, Fully tiled.Specially for the families who seek a clean green and calm place.( families only)",school  Lane   airport road  Anuradhpura (near the Janadhipathi collage,Holiday bungalow,2,2
4,Sineli Family Villa Anuradhapura,18 Jul  5:37 pm,"Anuradhapura, Anuradhapura","2,500",අනුරාධපුර නව නගරයේ කාශ්‍යප මාවතේ සිත් ගන්නාසුලු නිසංසල පරිසරයක පිහිටි සිනේලි ෆැමිලි විලා තුලින් ඉතාම නවින පන්නයේ නානකාමර පහසුකම් සහිත ආකර්ෂණීය කාමර පහසුකම් ( සෑම කාමරයක් සදහාම නානකාමර පහසුකම් සහිතයි )ආහාර ගැනිමේ පහසුකම් රියදුරු නැවතිමේ පහසුකම් වාහන නැවතිමේ ඉඩකඩ සහිත අලංකාර වටපිටාවකින් යුත් ගෙවත්ත මෙම නිවාඩු නිකේතනයේ සිට ජය ශ්‍රී මහා බෝධියට රුවන්වැලිසෑය විනාඩි 10 තුල ළගා විය හැකි දුර  අවශ්‍යතා අනුව ප්‍රවාහන පහසුකම් සැකසා දිය හැකඔබද වෙනස අත්විදින පැමිනෙන නවින පන්නයේ Attached bath room සහිත  5 දෙනෙකු සදහා වු AC සහිත කාමරය   රු 4000 /=නවින පන්නයේ Attached bath room සහිත  4 දෙනෙකු සදහා වු AC සහිත කාමරය   රු 3500 /=නවින පන්නයේ Attached bath room සහිත  4 දෙනෙකු සදහා වු AC රහිත කාමරය   රු 2500 /=AC සහිත 20 දෙනකුට එකවර පහසුකම් ලබාගැනීමට 13000/=AC රහිත 20 දෙනෙකුට එකවර පහසුකම් ලබාගැනීමට  12000/=,කාශ්‍යප මාවත 3 වන පියවර අනුරාධපුර,Seasonal room,4,4
5,House For Your Holiday Reservation In Anuradhapura,16 Jul  5:10 pm,"Anuradhapura, Anuradhapura","5,000",3 Bed rooms1 Living room1 Bathroom and 1 Attached bathroomසියලුම කුස්සියේ උපකරන වලින් සමන්විතයි.තනිව කෑම පිසගත හැක.කිරි ආහාර සකසා ගැනීමේ පහසුකම් වලින් යුක්තයි.වාහන park කල හැක.නිශ්ශබ්ද හා සන්සුන් වටපිටාවක්නිවස පූජනීය නගරයේම පිහිටා ඇත ශ්‍රී මහා බෝධියට විනාඩි 10 ක දුර එකවර 15 දෙනෙකුට නිදාගත හැක මුදල් කතාකර අඩුකර ගත හැක.,"LOT B,Ruwanveli city,Anuradhapura",Holiday bungalow,8,2
6,Sasoba Family Resort - Anuradhapura,16 Jul  1:59 pm,"Anuradhapura, Anuradhapura","1,000","Sasoba Family Resort is a large bungalow near Anuradhapura city. 3 km from the center of the town and 10 minutes to Puja Nagaraya. The two storied house-7 bedrooms come with 6 bathrooms. Has bedding facility for 28 guests. The land is well covered and secure parking area and large open space. Can stay large groups. We rent single, double and family rooms separately. Room rates Rs.1000/ - Rs.4000/Entire bungalow  Rs.12000/ up","Wijayapura, Anuradhapura",Holiday bungalow,7,6
7,Welkin Hotel - Anuradhapura,16 Jul 11:39 am,"Anuradhapura, Anuradhapura","1,000","Welkin Hotel for the best place for your stay next visit in Anuradhapura. Located at Pothanegama, Anuradhapura. Walking distance to Tisawewa and five minutes away from the sacred city. Very relax place with calm village environment and not far from the city. We have some range of room types to suit your budget. Non Ac room rates start from Rs.1000/.  Ac room rates from Rs.2500/ upwards. Garden areaVehicle Parking MealsBicycle rentals/ car hiresStation pick ups/ drops",Holiday bungalow,10+,10+,
8,Family resort Anuradhapura,15 Jul  7:08 pm,"Anuradhapura, Anuradhapura",500,"අනුරාධපුර නව නගරයේ පූජා භූමියට 2km දුරකින් නිසසල පරිසරයක පිහිටා ඇත.සම්පූර්ණ නිවස කාමර 3කින් සමන්විත වන අතර වායු සමනය කල කාමරයකින්ද යුක්තයි.එක් කාමරයක ඇදන් 3 බැගින් කාමර දෙකකින්ද තනි ඇදක් සහිත කාමරයක්ද වේ.කාමරයටම අලලා සැකසුණු නාන කාමරද සහිතයි.සාලයකින්,නාන කාමර දෙකකින් සහ කුස්සියකින්ද යුක්ත වන අතර කුම්බිච්චන්කුලම වැවට සහ ළමා උද්‍යානයට ඉතාමත් ආසන්න වේ.එකවර 15 දෙනෙකුට නවාතැන් ගැනීමට හැකිය.",Seasonal room,7,2,
9,Seasonal Rooms For Rent In Anuradhapura,15 Jul 11:44 am,"Anuradhapura, Anuradhapura",999,"පුජා නගරයට 1.5 කිලෝ මිටර් , කිරි ආහර නොමිලේ ,ඉතා පිරිසිදු සුපිරි තත්වයෙ යාබද නාන කමර","nuwarawewawatta, mihintalaya road, jaffna junctuion,Anuradhapura",Seasonal room,10+,10+
10,Holiday Bungalow at Anuradhapura,13 Jul 12:45 pm,"Anuradhapura, Anuradhapura",500,අනුරාධපුර නගරයේ සුවපහසු ආරක්ශිත නවාතැන් පහසුකම් අංග සමිපුර්ණ මුලුතැන්ගෙය හා TV  ශිතකරණ විදුලි පංකා සමග අංග සම්පුර්ණ නිවසේ ආරක්ශිත නවාතැන් පහසුකම් ජය ශ්‍රී මහා බෝධියට අනුරාධපුර නගරයට විනාඩි 10 දුරනගරයට කි.මි.2 අයකිරිම එක් අයෙක් සදහා රු 500/= වන අතර 10 දෙනෙකු සදහා රු 5000/= ඊට වැඩි වන සැම අයෙකු සදහා රු 300/= බැගින් අය කෙරේ,Holiday bungalow,3,2,
11,Vega Holiday Rest - Anuradhapura, 5 Jul 10:44 am,"Anuradhapura, Anuradhapura","1,800","Vega Holiday Rest is a clean & comfortable up-stair apartment. Well located in city limits and 200 meters off air port road.  The apartment with air conditioned 1 twin/double room and 1 family room. There are 2 bathrooms and 1 has hot water facility. Living room, dining area, balcony, kitchen and secure on site parking available.10 minutes drive to sacred area.Accommodation for 6 guests or more can stay with sharing.Non Ac Double Room  Rs.1800/Ac Double Room         Rs.2800/Entire house  Rs.4500/-  Rs.6000/",Airport Road,Holiday bungalow,2,2
12,Lakeside Villa Anuradhapura, 5 Jul 10:00 am,"Anuradhapura, Anuradhapura","1,500","The newly opened two storied bungalow located near (100 meters) Kubichan kulama Lake and children park. 500 meters away from Anuradhapura New Town bus stand & railway station. Can reach to Jaya Srmabodhi and Ruwanweliseya  in  5-10 minutes..4 deluxe double rooms, triple room and a family room with hot water attached bathrooms, balcony, dining area and a kitchen.Non Ac Double Room   Rs.1500/- Rs.2000/Non Ac Triple Room     Rs.2500/Non Ac Family Room    R.3000/Ac Double Room          Rs.2500/Ac Triple Room             Rs.3000/Ac Family Room           Rs.3500/Full Bungalow   Rs.11000/-  Rs.13500Address: Bulankulama Disa Mawatha, Anuradhapura",Holiday bungalow,4,4,
13,Ruhunupura Family Rest, 3 Jul  7:26 pm,"Anuradhapura, Anuradhapura","1,500","රුහුණුපුර ෆැමිලි රෙස්ට්  නිදන්ගල වත්ත මල්වතුඔය අසල දහයියාගම අනුරාධපුර යාබද නානකාමර සහිත කාමර තුනක්, සාලය කැම කාමරය මුලුතැන්ගෙය සහිත සම්පුර්ණ නිවස රු 6500/=එක් කාමරයක් එක් රාත්‍රියක් සදහා රු 1500/=AC කාමරද සහිතයිවාහන නැවතිමේ පහසුකම් ආහාර පියලියල කර ගැනිමේ පහසුකම් සහිතයි සුන්දර මල්වතු ඔයට සමිපව පිහිටා ඇත",Dahaiyagama anuradhapura,Seasonal room,3,3
14,Amal Residence - Anuradhapura, 3 Jul 11:45 am,"Anuradhapura, Anuradhapura","5,000",අනුරාධපුර මාතලේ හන්දියේ සුවපහසු නිස්කලන්ක පරිසරයක පිහිටි සුඛෝපභෝගී Amal Residence නවාතැන් ඔබට ලබාගත හැක.,"Amal Residence ,214/F, මතලේහංදිය ,අනුරාධපුර .",Holiday bungalow,9,3
15,Punchi Walawwa Holiday Bungalow Anuradhapura, 3 Jul  9:56 am,"Anuradhapura, Anuradhapura","2,500","Punchi Walawwa is a two storied new holiday bungalow with all facilities. Has 7 specious bedrooms and attached bathrooms. Nice garden area ,terrace  and a balcony available. Living areas at both floors along with ding facility. Parking inside the premises. Located at Anuradhapra New Town. Walking distance to general hospital and Nuwarawewa. A few minutes away from sacred city.Room rates Rs.2500/ upwards",Holiday bungalow,7,7,
16,Heritage Home - Anuradhapura, 2 Jul  3:32 pm,"Anuradhapura, Anuradhapura","1,350","03 Nos Family Bed Rooms (upstairs & downstairs)Separate Entrance,Balcony,Kitchen. Parking Facility,Meals Available.Full Privacy Safe.Very Closed to Main Railway Station,Ruwanweli Seya,Srima Bodhiya & Nuwara Wewa,Rout Finder :See On Google map Search From Your Location to Heritage Home Anuradhapura.","30/69,Badhuwaththa Land,Ramakele,Walawwaththa,, Anuradhapura.",Seasonal room,6,3
17,Anuradhapura Bungalow / Rooms,30 Jun 11:46 am,"Anuradhapura, Anuradhapura","1,750",4 bedroom bungalow near Dahaiyagama junction. Walking distance from New Town. Very close to sacred city.  3 family rooms and 1 double room available. Living room  with a Tv. Large parking slot. Kitchen facility available (additional charge). 15-20 guests can stay.Double Room Rs.1750/Family Room Rs.2500/Full bungalow Rs.7500/-  Rs.12000/,Holiday bungalow,4,3,
18,Short Term Rooms for Rent in - Sithgimanhala,24 Jun  1:48 pm,"Anuradhapura, Anuradhapura","2,900","Luxury AC/ Non AC Rooms in front of Thisawewa. Very calm and peaceful environment. Get your Village experience under our roof.Very close to Jaya Sri Maha Bodhiya, Atamasthanaya, All Tanks and Anuradhapura City. You can enter this location through Old Puttlam Road. For more details, Please contact us...Thank you...","No.5360/A,Old Puttlam Road,Thisawewa,Anuradhapura",Holiday bungalow,10,5
19,Resort in Anuradhapura,21 Jun 11:17 am,"Anuradhapura, Anuradhapura","2,000","The guest house located in Anuradhapura city. Only 4.5 km distance (10 minutes) to Jaya Sri Maha Bodhiya and Ruwanweliseya.The property consists of A/C & Non-A/C bedrooms with attached bathrooms. There are bedrooms including single, double, triple and family rooms.Large garden area,Parking space available,Free wi-fi.Meals can be provided in the outside locations as your wish.Non-A/C Double room Rs.1500/=Non-A/C Triple room Rs.2000/=Non-A/C Family room(4 person) Rs.2500/=A/C Double room Rs.3000/=A/C Family room(4 person) Rs.4500/=","17/1 A, Wijaya Mawatha, Isurupura, Anuradhapura Town, Sri Lanka",Holiday bungalow,10+,6
20,Holiday Bungalow in Anuradhapura,19 Jun  3:15 pm,"Anuradhapura, Anuradhapura","5,750",Non A/C full Bungalow -5750 - Maximum 12 paxA/C full Bungalow -7000 - Maximum 12 paxඅනුරාධපුර නගරට නුදුරින් පිහිටි ඉතා නිදහස්  දිනොරා නිවාඩු නිකේතනය තුළින් ආරක්ෂිත සුවපහසු නවාතැන් පහසුකම් ඔබට ලබා ගත හැකිය. සුවපහසුව  දොළොස් දෙනෙකු සඳහා නවාතැන් පහසුකම් ගත හැක,"No. 03, Unagaswewa road, Anuradhapura",Holiday bungalow,6,3
21,Ranweli Resort Anuradhapura, 4 Jul  5:45 pm,"Anuradhapura, Anuradhapura","4,000","Ranweli Resort consists of 3 elegant villas with 2 deluxe double rooms and 4 deluxe family rooms. Located at Kawarakkulama, on 10 minutes to Anuradhapura city. Easy access to Nachchaduwa tank and Mihinthale. The rooms have attached bathrooms and Most of the rooms with air conditioned. Inside parking space, buffet style restaurant and attractive large garden area. Room rates  Rs.4000/-  Rs.4800/","Kandy Road, Kawarakkulama, Anuradhapura",Holiday bungalow,6,6
22,Rooms for Rent in Anuradhapura,14 Jun  8:26 pm,"Anuradhapura, Anuradhapura","1,500",අනුරාධපුර නගරයේ මාතලේ හංදියේ පිහිටි පබොධා හොම් ස්ටේ තුලින් සුව පහසු ආරක්ශිත නවාතැන් පහසුකම් ජය ශ්‍රී මහා බෝධියට විනාඩි 10 දුරමිහින්තලය විනාඩි 10ඔනෑම ස්ථානය පහසුවෙන් ලගාවිය හැකි සියලුම පහසුකම් සහිත මුලිතැන්ගෙය ඇදුම් මැදිමේ වාහන නැවතිමේ පහසුකම් ,mathale junction Anuradhapura,Seasonal room,3,3
23,Apartment for Rent in Anuradhapura,16 Jul  2:06 pm,"Anuradhapura, Anuradhapura","3,500","Vibhawa Apartment is an elegantly designed  property with stunning view. This very ideal place for your next holiday. Well located at Nagadeepa Mawatha within close distance to the main sacred places and 1.5 km from the city. The apartment has 1 Ac triple room and 1 Ac double room with balconies, fully furnished living area including dining table, refrigerator, large television, office room and a common balcony.  The property is surrounded by lush green paddy fields and can see peacocks and other birds in the area. Lodging facility available for 5-6 guests and meals can be served on request.Ac Double room Rs.2000/-     Ac Family Room Rs.3500/Full apartment Rs.5000/- Rs.7000/ With Ac",Holiday bungalow,2,1,
24,Holiday Bunglow Anuradhapura Stage Rest,13 Jun  7:19 pm,"Anuradhapura, Anuradhapura","2,000",Comfortable Family  RoomsAnuradhapura City Area2Km to Sacred cityAC/Non AC Comfortable roomsLarge Parking AreaKitchen,"D.S.Senanayake MW, Stage iii, Anuradhapura",Holiday bungalow,8,4
25,Rent Apartment for Short Time in Anuradhapura,16 Jul  9:32 pm,"Anuradhapura, Anuradhapura","8,500","අනුරාධපුර නවනගරයෙ 02 පියවරහි පිහිටි දෙමහල් නිවසෙහි බිම් මහල කෙටිකාලීනව නිවාඩු ගත කිරීම සඳහා කුලියට දෙනු ලැබේ. නිදන කාමර 03, නාන කාමර 2, මුළුතැන් ගෙය සහ සාලය. එක් කාමරයක් වායු සමනය කර ඇත. නවීන සුව පහසු ඉඩකඩ . වන්දනා නඩ සඳහා විශේෂයි...නිස්කලංක පරිසරය. සියලුම ගෘහ උපකරණ සහිතව... ඔබේ නිවාඩුව සිතැඟි පරිදි ගත කරන්න. ..  තනි කාමර වූව ද වෙන් කර ගැනීමට හැක..A/C Bed Room 01Non A/C Bed Room 02Living roomKitchen  Parking space available.Individual rooms or whole apartment can be boooed.",Apartment,4,2,
26,Blooming Resort with Swimming Pool - Anuradhapura,12 Jun  9:54 pm,"Anuradhapura, Anuradhapura","2,000","Blooming Resort is the right place for your holiday. Newly built elegant hotel with specious bedrooms come with en-suite bathrooms. All bedrooms with comfy mattresses and siting area. Restaurant facility, meals, wi-fi, cable tv and more facilities.  Walking distance to Nuwara wewa. 200 meters from Mihintale road and 2 km to sacred city. * Free swimming pool facility for all guests.Non Ac Rooms Rs.2000/- Rs.3500/Ac Rooms        Rs.3000/- Rs.5000/",Holiday bungalow,5,5,
27,Comfortable Family Rooms - Anuradhapura,10 Jun  8:34 am,"Anuradhapura, Anuradhapura","2,000","* 4 Bed room with Very Good and clean attached bathrooms.* Kitchen* Very close to the Abhayagiriya, Mirisvetiya, Sri Mahabodhiya, Ruwanweliseya and other    religious places. * 2Km to Thisawewa and Sacred city 2 minutes from Railway station and New Town.","New Abhayagiri road,Anula Mawatha,Anuradhapura",Seasonal room,8,4
28,Selagala Hotel - Anuradhapura, 4 Jun  9:30 am,"Anuradhapura, Anuradhapura","1,500","Selagala Hotel is a comfortable place to stay. Walking distance to new town and very close to old town bus stand. Can reach to the city and sacred city  in a few minutes. The hotel has comfortable double bedrooms and family bedrooms. Some rooms have air conditioned facility. Restaurant, living room and lobby area available. Large garden area comes with parking space. Room basis and the entire premises can be taken for groups.Budget room Rs.1500/ - Rs.3000/Standard Room  Rs.2500/-  Rs.3500/We have small budget house with an attached bathroom and outdoor bathroom. Television is available.Rs.2500/ for 5 guestsRs.4000/ for 10 guestsRs.5000/ for guests",Holiday bungalow,5,5,
29,Clean And Comfortable Accommodation In Anuradhapura, 4 Jul  3:59 am,"Anuradhapura, Anuradhapura","7,000","Anuradhapura Accommodation (A home away from home) for families up to 10A rare opportunity to stay in a cozy, nice and clean place, keeping mind away from bustling cluttered environmentWe including me, tend to pay more for holiday accommodation because we want to ensure that quality and cleanliness should be there. We provide both at an affordable price. That’s our motto.  We will ensure that you feel like “a home away from home”A fully furnished cottage with 3BR (AC/non AC), complete pantry with all cooking equipment and utensils, 2-baths with hot water, automatic washer, open dining room, living room with cable TV and Wifi, toiletries and many more extra at no additional cost, is available to relax and to prepare religious offerings.Your privacy and comfortability are our top priorities. An assistant is available to help in case you need extra support. Cost varies from Rs. 5000 to 7500 depending on number of guests.We guarantee you the best customer care.P.S. Added few more resources recently because of your encouragement and all positive feedback provided by you (refer online reviews) about our service.Call me today orFollow us onhttps://www.instagram.com/p/BtdTalzgpnO/?utm_source=ig_share_sheet&igshid=z3dq8t4lnaa2 (copy and paste the link)Booking can be done through Airbnb, Facebook, Agoda and TripAdvisor also.",Holiday bungalow,10,2,
30,වන්දනා කරුවන් සදහා නවාතැන් පහසුකම් අනුරාධපුර, 8 Jun  5:00 pm,"Anuradhapura, Anuradhapura","2,500",අනුරාධපුර වන්දනවේ පැමිනෙන ඔබටනිදන කාමර 3ක් යාබද නාන කාමර සහිතව 16 දෙනෙකුට නවාතැන් ගතහැකි  සියලුම උපකරණ සහිත මුලුතැන්ගෙය හා ටිවි පහසුකම් සහිත නිවස රාත්‍රියක් සදහා රු 5000/=7 දෙනෙකුට නවාතැන් පහසුකම් ඇති යාබද  නානකාමර සහිත ඇනෙක්සිය රාත්‍රියක් සදහා රු 2500/=දුම්‍ රියෙන් පැමිනෙන  බැතිමතුන් සදහා අටමස්ථාන වන්දනා කිරිමට වැන්‍ රථ පහසු මිලට සපයාදිය හැකආරක්ශිත ගේමිදුලේ වාහන නවතා තැබිමේ පහසුකම් ඇත,525/46 2 වන පියවර  අනුරාධපුර,Holiday bungalow,3,3
31,Nimnara Niwasa - Anuradhapura, 8 Jun  4:51 pm,"Anuradhapura, Anuradhapura",600,අනුරාධපුර නව නගරයේ පිහිටි නිම්නාර නිවස තුලින් ආරක්ශිත සුව පහසු නවාතැන් ඔබට ලබාගත හැකියසුව පහසුව 20 දෙනෙකු සදහා නවාතැන් පහසුකම් ගතහැකඉහල මාලයේ කාමර 2කින් හා විසිත්ත කාමාර මුලිතැන්ගෙයකින් සමන්විත ඇති අතර එහි 12-15 අතර නවාතැන් ගතහැකිය එක් අයෙකු සදහා අයකිරිම 600/=ෆැමිලි බෙඩ්  ඩබල් බෙඩ් 2ක් සින්ගල් බෙඩ් 3 සම්න්විතය විදුලි පංකා හා මදුරු දැල් සහිතයිආහාර පිලියල කරගැනිමේ පහසුකම් මුලුතැන්ගෙය තුලින් ඔබට අවශ්‍ය පරිදි ආහාර පියලියල කර ගැනිමට හෝ ප්‍රනිත ආහාර  පිලියල කර දියහැකකිරි ආහාර නොමිලේ පිලියල කර දෙනු ලැබේජය ශ්‍රී මහා බෝධියට රුවන්වැලිසෑය කි.මි 3නව බස්නැවතුපලට කි.මි 1/2 දුරකි,Holiday bungalow,3,3,
