,0,1,2,3,4,5,6,7
109,Agriculture Project Land for Sale - Hambanthota,21 Jun  7:18 am,"Hambantota, Hambantota","1,000,000",🛑හම්බන්තොට  මත්තල -පාර සිට  3 km  දුරින්  කෘෂිකර්මාන්තයට  ඉතා සුදුසු කෙසෙල්  අඔ අැතුලු ඔනෑම වගාවන් වගා කිරිම  සදහා අක්කර 45  ක  පමන ඉඩම වගාව සමග  කෘෂිකර්මාන්ත කටුයුතු සදහා    විකිණීමට ඇත....🛑✔️ අැලට මුහුණත පළල අඩි-500 .✔️පර්චස්- 7200 ✔️හයිවේ පිවිසුමට -7 KM.✔️ ගුවන්තොටුපලට 2  KM✔️හතරැස් ඉඩමකි✔️සම්පූර්ණයෙන් ඉඩම ආවරණය වන සේ වැට  ආවරණය කර ඇත.✔️ජල පහසුකම්  .✔️ ව්‍යප්‍රතියේ කාලය  3 වසර ✔️ ඕනෑම වාහනයක් ඇතුලු කල හැකිය .✔️.ව්‍යප්‍රතිය් ස්භාවය  වගාව  🔴🔴ව්‍යප්‍රතිය  සදහා  අපේක්ශිත මුලු වියදම -රැ -45 මිලියන /= හෝ ආසන්නව .🔴🔴🔴🔴 ව්‍යප්‍රතියේන්  වසර 3ට පසු අාදායම  -රැ-60 මිලියන /=හෝ ආසන්නව බලාපොරොත්තු වේ.🔴🔴🔴🔴අකකර 1ක්    සදහා රජයේ තක්සේරුව-රැ-1500000/=🔴🔴🔥පිරිසිදු ඔප්පු හා බැoකු ණය සදහා අවශ්‍ය සියලු ලිපි ලේඛණ ඇත.🔥ව්‍යප්‍රතියේන්  වසර 3ට පසු සුද්ද ලාභය  රැ -15 මලියන,Hambanthota,"Agricultural, Commercial",45.0 acres
110,Land for Sale - Tissamaharama,23 Jul  9:29 am,"Tissamaharama, Hambantota","65,000",Land For Sale In Tissamaharama==========================,Residential,143.0 perches,
111,වීරකැටිය වටිනා ඉඩම වහාම විකිණීමට,22 Jul 10:44 am,"Tangalla, Hambantota","110,000",වීරකැටිය නගරයට  මීටර් 600 දුරින් රන්න ප්රධාන මාර්ගයට මීටර් 50ක් ඇතුලතින් ඇති ඉඩම ඉක්මනින්ම විකිණීමට තිබේ. නල ජලය තෙකලා විදුලිය හා මාර්ග පහසුකම් ඇත.,Residential,14.0 perches,
112,Land for Sale - Tangalla, 8 Jun 10:28 am,"Tangalla, Hambantota","55,000",නිවාඩු නිකේතනයක් ඉදි කිරීම සදහා විශේෂයී....,"Agricultural, Commercial, Residential",458.0 perches,
113,Land for sale in Tissamaharama,28 Jun 11:54 am,"Tissamaharama, Hambantota","4,500,000","40 perches land for sale in Tissamaharama Yala RoadLand is facing main road ranakeliya town (with 6 coconut trees)Very beautiful ancient historical areaOnly 8 km from Yala and Tissamaharama There is a lake in the  side corner of the landwhere herd of elephants comes to drink water in the dry seasonsuitable for hotel,guest house,villa,Residential or businessprice can be negotiablePls call for more Details",Tissamaharama Yala road,Commercial,40.0 perches
114,හේන් ඉඩමක් වගාව සමග විකිනිමට හම්බන්තොට, 6 Jun 10:30 pm,"Hambantota, Hambantota","1,200,000",🛑හම්බන්තොට -  ගොන්නොරැව -  පාර සිට  4   දුරින්  පිහිටි   මහ වැවැට  මුහුනලා  ලා  අක්කර  44  ක හතරැස් ඉඩම  වගාව සමග   විකිණීමට ඇත....🛑 දැනට  කෙසෙල්  පත්තකා  රටකජු  වැනි බෝග  වගා කර නව බෝග සිටුවිමට  අැත  ✔️මුහුණත  වැවට පළල අඩි-300.✔️පර්චස්- 7100✔️හම්බන්තොට ට -15 KM.✔️හයිවේ පිවිසුමට -15 KM✔️මුලු ඉඩම  බට නල  යොදා අැත✔️සම්පූර්ණයෙන් ඉඩම ආවරණය වන සේ වැටගසා  ආවරණය කර ඇත.✔️අඩි 25 පලලින්  .මාර්ග පද්දතිය ✔️කන්ටේනර් ඇතුලු ඕනෑම වාහනයක් ඇතුලු කල හැකිය .✔️ඕනෑම ව්‍යාපාරයක් හෝ වගාවකට   සුදුසුයි.🔴🔴මාසිකව අපේක්ශිත අාදායම්  මුදල-රැ -290000/= හෝ ආසන්නව .🔴🔴 🔴🔴වාර්ශිකව   අාදායම් -රැ-7500000/=හෝ ආසන්නව බලාපොරොත්තු වේ.🔴🔴🔴🔴අක්කර 1ක්  සදහා රජයේ තක්සේරුව-රැ-1500000/=🔴🔴,Hambanthota,"Agricultural, Commercial",44.0 acres
115,Residential Land for Sale in Ambalantota, 5 Jun  9:48 pm,"Hambantota, Hambantota","125,000",🛑 තිස්ස - මාතර -  ප්‍රදාන මාර්ගයේ   සිට   500  දුරින්  නිවස සමග  පිහිටි  පර්චස් 39  ක හතරැස් ඉඩම  පදිංචිය ට හෝ  ගබඩාවක් සදහා ඉතා සුදුසුය  පුලුල් මාර්ග සමග විකිණීමට ඇත....🛑✔️මුහුණත පළල අඩි-100✔️පර්චස්-39.✔️අම්බලන්තොට නගරයට - 500 M.✔️තේරපුත්ත ජාතික පාසලට -500 M✔️හම්බන්තොට වරායට  4 ✔️සම්පූර්ණයෙන් ඉඩම ආවරණය වන සේ තාප්ප යොදා ආවරණය කර ඇත.✔️ගේට්ටුව අඩි 20 පලලින් යුතුය .✔️කන්ටේනර් ඇතුලු ඕනෑම වාහනයක් ඇතුලු කල හැකිය .✔️ඕනෑම ව්‍යාපාරයක් සදහා සුදුසුයි.,Ambalantota,Residential,39.0 perches
116,Land for Sale Tangalle, 4 Jun 11:36 am,"Tangalla, Hambantota","800,000",✅නිරවුල් සින්නක්කර ඔප්පු ✅රන්න නගරයේ සිට 2km දුරින් ✅නල ජලය සහ විදුලිය ලබා ගැනීමේ හැකියාව ✅පර්චස් 20කතා කරන්න ප්‍රදීප්..,"පන්සල් හන්දිය,රන්න","Commercial, Residential",20.0 perches
117,Commercial Land for Sale – 31.47 Prc Sitinamaluwa / Beliatta Main Road, 4 Jun 11:25 am,"Beliatta, Hambantota","400,000","Valuable Commercial land for immediate sale. Located in front of Beliatta – Tangalle main Road in Sitinamaluwa .The land consist with 3 Bed room house (Not considered to value) .-	Clear Title & Deed (Re-survey by BIM SAVIYA program in 2016)-	Electricity-	Water(Suitable for Showroom , Office Complex , Supermarket)400,000 LKR per Perch (Not Negotiable)Contact  - 0775 226 900","No.34/9 , Sitinamaluwa , Beliatta","Commercial, Residential, Other",31.47 perches
118,Land ( Eco ) for Sale in Tissamaharama., 1 Jun  8:08 pm,"Tissamaharama, Hambantota","10,000,000","යාල ජතික වනොද්යානයට ඉතාමත් අසළින් පිහිටි අක්කර 09 ක විශාල ඉඩමකි.යාල සහ සිතුල්පව්ව විහාරයට ඉතාමත් සමිපව පිහිටා ඇතකතරගම නගරයට  19km , රන්මිණිතැන්න ටෙලි සිනෙමා ගම්මානයට 2kmතිස්සමහාරාම නගරයට 10kmතෙකලා විදුලිය සහ ජලය සහිතයිසම්පූර්ණයෙන් ඉඩම ආවරණය වන සේ වැට ආවරණය කර ඇත.මෙම ඉඩමේ පිහිටීම යාල, තඹරව ජපන් පාරට ඉතා ආසන්නයේ පිහිට ඇත.දැනට බෝග සිටුවා ඇත.:-•	ඇවුරුදු 04ක් වයසැති පොල් ගස් 520•	අඹ ගස් 275ක්•	වැල් දොඩම් වැල් 80ක්•	කෙසෙල් වගාව අක්කර 03 ක ලෙස සාර්ථකව වගා කර ඇත.","Ranminithanna  to Sithulpawuwwa Rd,",Commercial,9.0 acres
119,Land for Sale in Tissamaharama, 2 Jun  4:16 pm,"Tissamaharama, Hambantota","220,000","සංචාරක කර්මන්තය සදහා හොදම අයොජනයක්.පන්නගමුව වැවට මාඉම්ව පිහිටා අැත.පාරට පෙනේන දුරින්.සින්නාක්කර ඔප්පු.මත්තලට.කතරගමට.යාලට.හම්බන්තෝටටසමිපව පිහිටා අැත.බැංකු ණය ලබාගත හැකිය.sancharaka wayaparayakata sudusu idamak pannagamuwa wawata maimwa.pradana parata penena durin.sinnakkara oppu.banku naya laba gatha haka.maththalata,yalata,katharagamata kittuwen.niskalanka parisarayaka pihita etha.bottu sewawak uwada aramba kara hakiya.wadima ellumata ikmanin wikinimata.",Commercial,80.0 perches,
120,පදිංචියට ඉඩමක් විකිනිමට අම්බලන්තොටින්,30 Jun  8:49 am,"Ambalantota, Hambantota","200,000",පර්චස් 20 සහ 40  ඉතා අගනා ඉඩම  කැබැලි 2 ක් විකිනිමට  අැත  අමිබලන්තොට  තේරපුත්ත ජාතික පාසලට ඉතා  අාසන්නව  බෙලිගාලගොට පරට නුදුරින්  පිහිටි මෙම ඉඩම හමිබන්තොට වරායට 4 kmඅමිබලන්තොට නගරයට 1 km හයිවේ පිවිසුමට  7 kmවිදුලි සහ නල ජලය හෝ වාරි ජලය සහිත හමිබන්තොට කොළඔ  පුලුල් මාර්ගයට (මන්තීරැ 2/) සිට  මිටර් 700  පමන දුරින්   පිහිටි මෙම ඉඩම පදිංචිය සදහා  සුදුසුය  . පර්චස් 20 .40  කැබිලි කිහිපයක් අැතපිරිසිදු ඔප්පු සහිතයි (නිරවුල්).  බැංකු ණය අනුමතයි .,Ambalantota,"Commercial, Residential",20.0 perches
121,1 Acre Bare Land for Sale Tissamaharama Katharagama Main Road, 8 Jul 12:43 pm,"Tissamaharama, Hambantota","20,000,000",1 ACRE BARE LAND FOR SALE TISSAMAHARAMA KATHARAGAMA MAIN ROAD ROAD CLOSE TO TELE GAMANAYA WITH ALL FACILITIES GOOD LOCATION FOR TOURISTS INDUSTRY. ,TISSAMAHARAMA KATHARAGAMA MAIN ROAD,"Commercial, Residential, Other",1.0 acres
122,අගනා බිම් කොටසක් විකිණීමට - බෙලිඅත්ත,31 May 11:16 am,"Beliatta, Hambantota","130,000",හක්මණ බෙලිඅත්ත ප්‍රධාන පාරට මුහුණලා පර්චස් 45 ක කොස් ගස් 8 ක් හා පොල් ගස් ඇති ඉඩමක් විකිණීමට ඇත.බෙලිඅත්ත නගරයට කි.මී 5 යි,"පොත්තෙවෙල,බෙලිඅත්ත",Commercial,45.0 perches
123,Land for Sale Hambantota,17 Jun  1:14 pm,"Hambantota, Hambantota","2,800,000",pol waga kara etha polgas 50 etha wari idameki,mayurapura sooriyawewa,Agricultural,2.0 acres
124,01 ACRE LAND SALE MATTALA HAMBANTOTA,30 May  8:50 am,"Hambantota, Hambantota","6,000,000",Rs 6000000.00 LAKHS PER ACRE ,01 KM TO MATTALA AIRPORT MATTALA HAMBANTOTA,"Commercial, Residential, Other",1.0 acres
125,කෙසෙල් වගාව සමග ඉඩම විකිනිමට - හම්බන්තොට, 2 Jun  3:34 pm,"Hambantota, Hambantota","1,500,000",🛑මත්තල -  කතරගම  පාරට මුහුණ ලා අක්කර 10  ක කෙසෙල් වගාව සමග  ඉඩම  දැනට පිදීමට අාසන්න   ගස් කිහිපයක්  සමග  විකිණීමට ඇත.... දැනට  අක්කර 4 පමන වගාකර අැත🛑✔️ මාර්ගයට  මුහුණත පළල අඩි150✔️පර්චස්- 1600✔️මත්තල නගරයට -5 KM.✔️හයිවේ පිවිසුමට -7 KM✔️හතරැස් ඉඩමකි✔️සම්පූර්ණයෙන් ඉඩම ආවරණය වන සේ  වැටකින්  ආවරණය කර ඇත.✔️වැවට මුහුනත පළල  අඩි 150 .✔️කන්ටේනර් ඇතුලු ඕනෑම වාහනයක් ඇතුලු කල හැකි පුලුල් මාර්ග  .✔️ඕනෑම ව්‍යාපාරයක් හෝ වගාවන්  සදහා සුදුසුයි.🔴🔴ත්‍රයි මාශිකව අපේක්ශිත මුදල-රැ -1000000/= හෝ ආසන්නව .🔴🔴🔴🔴වාර්ශික   මුලු  අාදායම්     මුදලට -රැ-5000000/=හෝ ආසන්නව බලාපොරොත්තු වේ.🔴🔴🔴🔴අක්කරයක්  සදහා රජයේ තක්සේරුව-රැ-2500000/=🔴🔴🔥පිරිසිදු ඔප්පු හා  අවශ්‍ය සියලු ලිපි ලේඛණ ඇත.,Hambanthota,Agricultural,10.0 acres
126,Agriculture Land for Sale - Hambanthota, 2 Jun  3:39 pm,"Hambantota, Hambantota","1,400,000",🛑මත්තල  හයවේ පිවිසුමට  අාසන්නව -ප්‍රදාන  පාර සිට 2 km  නුදුරින්   පිහිටි අක්කර  14 ක හතරැස් ඉඩම වගා කටයුතු සදහා සුදුසු යි  අැල මාර්ගයට ඉතා ලගින් පිහිටි මෙම ඉඩම   විකිණීමට ඇත....🛑✔️ මාර්ගයට  මුහුණත පළල අඩි-150.✔️පර්චස්-1920.✔️හයිවේ පිවිසුමට-3  KM.✔️මත්තල ගුවන්තොටුපලලට -2 KM✔️හතරැස් ඉඩමකි✔️සම්පූර්ණයෙන් ඉඩම ආවරණය වන සේ වැට ගසා  ආවරණය කර ඇත.✔️ඒ අවට ඉඩම් වගා කර අැත  .✔️ වාහන   ඇතුලු කල හැකිය .✔️ඕනෑම වගා හෝ  ව්‍යාපාරයක් සදහා සුදුසුයි.🔴🔴අක්කරයක්  සදහා රජයේ තක්සේරුව-රැ-3500000/=🔴🔴🔥පිරිසිදු ඔප්පු හා බැoකු ණය සදහා අවශ්‍ය සියලු ලිපි ලේඛණ ඇත.,Hambanthota,"Agricultural, Commercial",14.0 acres
127,පොල් වගා ඉඩම විකිනිමට - මත්තල, 2 Jun  3:40 pm,"Hambantota, Hambantota","7,000,000",🛑හම්බන්තො  මත්තල   පාර  සිට  500 m දුරින්  වැවට  මුහුණ ලා පර්චස් 320  ක හතරැස්  පොල් ඉඩම   විකිණීමට ඇත....🛑✔️ වැව මුහුණත පළල අඩි-100.✔️පර්චස්-320.✔️හම්බන්තොට ට සහ  වාරායට -10 KM.✔️මත්තල  ගුවන්තොටුපලලට -15 KM✔️හයිවේ පිවිසුමට   12 km✔️සම්පූර්ණයෙන් ඉඩම ආවරණය වන සේ වැට  යොදා ආවරණය කර ඇත.✔️ප්‍රදාන පාරට 200 .✔️ වාහනයක් ඇතුලු කල හැකිය .✔️ඕනෑම ව්‍යාපාරයක් සදහා සුදුසුයි.🔴🔴පොල් ගෙඩි 1500  -1800  පමන මුරයකට  අාදායම.   අපේක්ශිත  මුදල-රැ -50000/= හෝ ආසන්නව 🔴🔴වර්ශයකට  පොල් වල අාදායම්   මුදල  රැ-250000/=හෝ ආසන්නව බලාපොරොත්තු වේ.🔴🔴🔴🔴අක්කර 1 ක්  සදහා රජයේ තක්සේරුව-රැ-3500000/=🔴🔴🔥පිරිසිදු ඔප්පු හා අවශ්‍ය සියලු ලිපි ලේඛණ ඇත.,Hambanthota,"Agricultural, Commercial",2.0 acres
128,Land for Sale - Walasmulla,30 May  7:46 am,"Beliatta, Hambantota","35,000","වලස්මුල්ල, කිරම නගරය තුල වරාපිටිය පාරට යාබදව පිහිටි, ජල/විදුලිය/දුරකථන පහසුකම් සහිතව උත්සව ශාලාවකට/ කර්මාන්ත ශාලාවකට/ පදිංචියට හෝ වෙනත් ව්‍යාපාරයකට ඉතා සුදුසු අක්කර 2ක් වූ, නිවසක් හා පොල් ඇතුළු මිශ්‍ර වගාවෙන් යුක්ත දැනට සංවර්ධනය කර ඇති නිරවුල් ඉඩමක් විකිණීමට ඇත. වැඩි විස්තර සදහා පහත දුරකථන අංකයන්ට අමතන්න.","Commercial, Residential, Other",2.0 acres,
129,Land for Sale - Suriyawewa,29 May  3:26 pm,"Hambantota, Hambantota","3,500,000",Akkara 1.5ka pol waga kara etha..Wari idamaki.Nala jalayaWiduliyaSaha wari jalaya sahithai..Geyak sada wari jalayen waga kirimata kemathi kenekta agana idamaki..,"unudiyapokunna, mahapelessa, suriyawewa",Agricultural,240.0 perches
130,Mango & Coconut Land for Sale in Hambantota,30 May  6:50 am,"Hambantota, Hambantota","1,500,000",🛑හම්බන්තොට - මත්තල      පාර සිට  500 m දුරින් ඒම පාරට  මුහුණ ලා  අක්කර  7 ක හතරැස් ඉඩම  හොදට වැඩුනු අඔ ගස්  150 සහ  පොල් ගස්  කිහිපයක්  සමග   විකිණීමට ඇත....🛑✔️මුහුණත පළල අඩි-125.✔️පර්චස්-1120.✔️ හම්බන්තොට ට වරායට  -10 KM.✔️මත්තල සහ හයිවේ පිවිසුමට  -15 KM✔️හතරැස් ඉඩමකි✔️සම්පූර්ණයෙන් ඉඩම ආවරණය වන සේ වැට   ගසා  ආවරණය කර ඇත.✔️ අතුරැබෝග වගා කර හැක .✔️කන්ටේනර් ඇතුලු ඕනෑම වාහනයක් ඇතුලු කල හැකිය .✔️ඕනෑම ව්‍යාපාරයක් සදහා සුදුසුයි.🔴🔴වරක ට අපේක්ශිත  අාදායම්  මුදල-රැ -290000/= හෝ ආසන්නව .🔴🔴( අඔ )🔴🔴වාර්ෂිකව  අාදායම්   මුදලට -රැ-675000/=හෝ ආසන්නව බලාපොරොත්තු වේ.🔴🔴🔴🔴 අක්කර 1 ට  රජයේ තක්සේරුව-රැ-2000000/=🔴🔴🔥පිරිසිදු ඔප්පු හා බැoකු ණය සදහා අවශ්‍ය සියලු ලිපි ලේඛණ ඇත.,Hambanthota,"Agricultural, Commercial",7.0 acres
131,Land for Sale in Beliatta,28 May 10:59 pm,"Beliatta, Hambantota","2,200,000",මෙම නිවස ඉක්මනින් විකිනීමට අවශ්‍යයය්. වලස්මුල්ල නගරයේ සිට 2km පමනි.ප්‍රදාන පාරට 50m.පදින්චියට සුදුසු.,"D/2,paburawa,walasmulla",Other,13.0 perches
132,Land for Sale in - Tissamaharama,28 May 12:38 pm,"Tissamaharama, Hambantota","3,000,000","බලපත්ත්‍ර ඇත. ජලය , විදුලිය  ඇත.  නගරයට ඉතා ආසන්නයි. ප්‍රධාන මාර්ගයට ආසන්නයි.හොටෙල් සදහා සුදුසුයි","No666/A, kawantissapura, Tissamaharama",Residential,80.0 perches
133,Residential & Business Land for Sale - Hambanthota,28 May  8:06 am,"Hambantota, Hambantota","1,500,000",🛑හම්බන්තොට - මත්තල -ගොන්නොරැව   පාරට මුහුණ ලා අක්කර 7 ක හතරැස් ඉඩම ආයතනයක් හෝ සමාගමක් පවත්වාගෙන යෑමට සුදුසු ස්ථානයක් විය  ....🛑✔️මුහුණත පළල අඩි-150✔️අක්කර -7.✔️මත්තලට -12 KM.✔️හම්බන්තොට  වරායට -15 KM✔️ ව්‍යාපාරයකට  ඉතාසුදුසුය  ✔️සම්පූර්ණයෙන් ඉඩම ආවරණය වන සේ වැට ගසා ආවරණය කර ඇත.✔️ජලය  තෙකලා වදුලිය  පහසුකම්  .✔️කන්ටේනර් ඇතුලු ඕනෑම වාහනයක් ඇතුලු කල හැකිය .✔️ඕනෑම ව්‍යාපාරයක් සදහා සුදුසුයි.🔴🔴අක්කරයක්  සදහා රජයේ තක්සේරුව-රැ-2500000/=🔴🔴🔥පිරිසිදු ඔප්පු හා  අවශ්‍ය සියලු ලිපි ලේඛණ ඇත.,Hambanthota,Commercial,7.0 acres
134,Commercial Land for Sale - Hambantota,28 May  7:47 am,"Hambantota, Hambantota","1,500,000","Commercial Value Land in Maththla Hambanthota  Southern SL 50 acres bare land  facing Highway  . 400 feet  Road  frontage. 1 km to Highway enter &    Maththala  town, 25 km to PORT, 4 km to Mattala airport and   . Land suitable for commercial operation including HOTEL ,RESIDENT, Yard & farm  etc. Price expected 1500000 per acres  but negotiable. Call for images and plan.",Hambanthota,"Agricultural, Commercial",49.0 acres
135,Commercial land for sale - Ambalantota,26 May  9:42 pm,"Ambalantota, Hambantota","6,500,000",පර්චස්  240  ක වැව  මායිව  අැති   අගනා ඉඩම  විකිනිමට   නිවාඩු නිකේතනයක්  සදහා ඉතා සුදුසුය ඒක  පැසකින්  වැවකට මුහුන ලා අැත හමිබන්තොට වරායට   10 km හමිබන්තොට  නගරයට 8 kmමත්තල  නගරයට  සහ හයිවේ පිවිසුමට 15 kmවිදුලි සහ නල ජලය හෝ වාරි ජලය සහිත හමිබන්තොට  මත්තල  පුලුල් මාර්ගයට  සිට   500  m  දුරින්   පිහිටි මෙම ඉඩම ව්‍යාපාරකට හෝ වගා කටියුතු සදහා කර්මාන්ත ශාලාවකට අනගියි.පිරිසිදු ඔප්පු සහිතයි (නිරවුල්). දැනට බෝග සිටවා අැත. පොල් සහ ගස් සහිත සාරවත් පස please   call    viber   w p   imo,Hambanthota,Agricultural,250.0 perches
136,Eco Land for Sale - Ambalanthota,26 May  9:09 pm,"Ambalantota, Hambantota","150,000",අක්කකර 25 ක  ඉතා අගනා ඉඩම හමිබන්තොට වරායට 4 kmඅමිබලන්තොට නගරයට 1 kmහයිවේ පිවිසුමට   10 kmවිදුලි සහ නල ජලය හෝ වාරි ජලය සහිත හමිබන්තොට  කොළඔ  පුලුල් මාර්ගයට (මන්තීරැ 2/) සිට  1 පමන දුරින්  පිහිටි මෙම ඉඩම සංචාරක  ව්‍යාපාරකට හෝ වගා කටියුතු සදහා කර්මාන්ත ශාලාවකට අනගියි.පිරිසිදු ඔප්පු සහිතයි (නිරවුල්). දැනට බෝග සිටවා අැත. පොල් සහ කොස් ගස් සහිත වලව ගග සහ මුහුද ඒකවිට මුනගැසෙන සංදිඉස්තානයක පිහිටි  මෙම ඉඩම  මනරම් දර්සනයක් දිස්වෙන සංචාරක  ව්‍යාපාරකට ඉතා සුදුසුය,Ambalantota,"Agricultural, Commercial",25.0 acres
