,0,1,2,3,4,5,6,7
74,Land for Sale in Tangalle,26 Jun 10:50 am,"Tangalla, Hambantota","3,375,000","තංගල්ල - බෙලිඅත්ත ප්‍රධාන මාර්ගයේ සිට 500 M ක් දුරින් පිහිටා ඇත.තංගල්ල නගරයට විනාඩි 05 න් ළගා විය හැකජල විදුලි පහසුකම් සහිත ප්‍රදේශයනිරවුල් ඔප්පු සහිතයපර්චස් 01 ක් රු 135,000","Tangalle, Polommaruwa, Uthura","Agricultural, Residential",25.0 perches
75,Commercial Land for Sales Hambanthota,26 Jun  8:28 am,"Hambantota, Hambantota","2,500,000","Commercial Value Land in  Hambanthota  Southern SL 20 acres bare land with  facing main road  . 400 feet  frontage. 10  km to hambanthota town, 14 km to PORT, 8 km to Mattala airport and highway enter   . Land suitable for commercial operation including HOTEL ,business  yard etc. Price expected 2.5 m per acres  but negotiable. Call for  more images and plan",Hambanthota,Commercial,20.0 acres
76,Land for Sale in - Katharagama,25 Jun  1:25 pm,"Tissamaharama, Hambantota","6,000,000",* Land Beside Of a Lake.* With More Than 75 Coconut Trees.* 1/2 Km For Katharagama Kiri Vehera.* Water & Electricity Is Available.* Suitable For Foreign Industry.,Commercial,120.0 perches,
77,"Land for Sale in Tangalle , Marakolliya",25 Jun 11:44 am,"Tangalla, Hambantota","765,000",*තංගල්ල නගරයට දුර  03 Km* තිස්ස කතරගම ප්‍රධාන මාර්ගයේ සිට 100 m* පර්චස් එකක් රු 45000 ක්* ජල විදුලි පහසුකම් සහිත වටපිටාවක්*නිරවුල් ඔප්පු සහිතය,"No,22 Marakolliya, Tangalle","Agricultural, Residential",17.2 perches
78,Land for sale - Ambalantota,27 Jun  6:18 pm,"Ambalantota, Hambantota","7,000,000",සහනදායි මිලකට අනගි අවස්ථාවක් මෙන්න!!!!! ,"Agricultural, Commercial, Residential, Other",38.0 perches,
79,Lake View Land for Sale Hambanthota,26 Jun  9:29 am,"Hambantota, Hambantota","4,500,000",🛑හම්බන්තොට -මත්තල   ප්‍රදාන මාර්ගයේ  සිට  2 km  පමන  දුරින් ඒම මාර්ගයට   මුහුණ ලා පර්චස් 173 ක හතරැස් ඉඩම  විකිණීමට ඇත....🛑 වැවට මායාම  පිහිටි  මෙම ඉඩම පදිංචියට  ඉතා සුදුසුය ඉඩම පිටුපසින් අැලක්ද පිහිටා අැත ✔️මුහුණත පළල අඩි-150. ✔️පර්චස්-173.✔️හම්බන්තොට ට -7 KM.✔️ගුවන්තොටුපලට -15 KM✔️වැවට   මුහුනත පලල 150✔️සම්පූර්ණයෙන් ඉඩම ආවරණය වන සේ වැට  යොදා ආවරණය කර ඇත.✔️පාර  අඩි 25 පලලින් යුතුය .✔️කන්ටේනර් ඇතුලු ඕනෑම වාහනයක් ඇතුලු කල හැකිය .✔️ඕනෑම ව්‍යාපාරයක් සදහා සුදුසුයි.,Hambanthota,"Agricultural, Residential",173.0 perches
80,Agriculture Farm Land for Sale -Hambanthota,26 Jun  9:29 am,"Ambalantota, Hambantota","1,500,000",අක්කර 20 පමන ඉඩම  දැනට පවතින පත්තක්කා  වගාව සමග  වකිනිමට  ඉතා අගනා මෙම  ඉඩම වෙනත් ඔනෑම වගාවක් සදහා සුදුසුය  දින  60 න්  පසු  රැ 7500000 පමන අදායමක් ලබා ගත හැකිය හමිබන්තොට වරායට 10 kmමත්තල  නගරයට 8 kmහයිවේ පිවිසුමට  12 kmවිදුලි සහ නල ජලය හෝ වාරි ජලය සහිත හමිබන්තොට - මත්තල   පුලුල් මාර්ගය (මන්තීරැ 4/ පාර) සිට මිටර් 500 දුරින්  ඒම පාරට  මුහුනලා පිහිටි මෙම ඉඩම ව්‍යාපාරකට හෝ වගා කටියුතු සදහා කර්මාන්ත ශාලාවකට අනගියි.පිරිසිදු ඔප්පු සහිතයි (නිරවුල්). දැනට බෝග සිටවා අැත.,Hambanthota,Agricultural,20.0 acres
81,Eco Land for Sale - Ambalanthota,23 Jun  8:52 am,"Ambalantota, Hambantota","75,000",🛑අම්බලන්තොට - බැරගම පාරට මුහුණ ලා පර්චස් 160 ක හතරැස් ඉඩම  විකිණීමට ඇත....🛑 මෙම ඉඩම අවට සුන්දර වෙල්යායකින් වට වි ඇත  නිසල පරිසරයක පිහිටි මෙම ඉඩම හොටෙල් ව්‍යාපාරයකට ඉතා සුදුසුය  වැවක අසරිය සමග  eco  කබාන  සදහාද සුදුසුය ✔️මුහුණත පළල අඩි-75.✔️පර්චස්-160.✔️අම්බලන්‍තොටට  4 KM.✔️වරායට -5 KM✔️හයිවේ පිවිසුමට 7 KM✔️සම්පූර්ණයෙන් ඉඩම ආවරණය වන සේ වැට යොදා ආවරණය කර ඇත.✔️අවට කුඔුරැ වගාකර ඇත .✔️කන්ටේනර් ඇතුලු ඕනෑම වාහනයක් ඇතුලු කල හැකිය .✔️ඕනෑම ව්‍යාපාරයක් සදහා සුදුසුයි.බැංකු ණය අනුමතය ,Ambalantota,"Commercial, Residential",160.0 perches
82,Residential Land for Sale in Hambanthota,23 Jun  8:40 am,"Ambalantota, Hambantota","4,500,000",🛑හම්බන්තොට - මත්තල     පාරට මුහුණ ලා පර්චස් 160 ක හතරැස් ඉඩම වගාවට හෝ පදිංචියට විකිනිමට   විකිණීමට ඇත....ඉඩම ආසන්නව  වැවක් සහ  ඉඩම පිටුපසින් ඇලක් බසින ලදි 🛑මුහුණත පළල අඩි-50.✔️පර්චස්-160.✔️හම්බන්තොටට -10KM.✔️මත්තල ගුවන්තොටුපලට -15 KM✔️හයිවේ පිවිසුමට  10  KM✔️සම්පූර්ණයෙන් ඉඩම ආවරණය වන සේ වැට යොදා ආවරණය කර ඇත.✔️ජල විදුලි පහසුකම්  ඇත  .✔️කන්ටේනර් ඇතුලු ඕනෑම වාහනයක් ඇතුලු කල හැකිය .✔️ඕනෑම ව්‍යාපාරයක් සදහා සුදුසුයි.  මුලු මුදලටම බැංකු ණය ලබා ගත හැක,Hambanthota,"Agricultural, Commercial, Residential",160.0 perches
83,Land For Sale In Beliatta,12 Jul  1:58 pm,"Beliatta, Hambantota","5,900,000","බෙලි අත්තේ සිටින මලුවේ සිට 1Km පමන දුරින් පිහිටා ඇති අක්කර 2කින් යුත් මෙම ඉඩම වැවට යාබදව පදිංචියටද ඉතාම සුදුසු,කුරුදු සිටවා ඇති මෙම ඉඩම ජලය,මාර්ගයද ඉඩමට ඇත.පොල් ගස් 100කට වැඩි ප්‍රමාණයක් ඇති අතර පොල් වලින් දැනට ආදායම් ලබයි.නිරවුල් ඔප්පු.වැඩි විස්තර සදහා විමසන්න.(මිල ගණන් සාකච්චා කල ගත හැක.)",Other,2.0 acres,
84,1 Acer Bare Land for Sale Tissamaharama, 8 Jul 12:43 pm,"Tissamaharama, Hambantota","20,000,000","1 ACER BARE LAND FOR SALE TISSAMAHARAMA KATHARAGAMA MAIN ROAD ROAD. 200 METERS TO TELE GAMANAYA WITH ALL FACILITIES, BUS ROUTE, 6 KM FOR KATHARAGAMA .",TISSAMAHARAMA KATHARAGAMA MAIN ROAD,"Commercial, Residential, Other",1.0 acres
85,Commercial land for sales Tangalle,22 Jun 12:06 am,"Tangalla, Hambantota","750,000","Commercial Value Land in Tangalle  Southern SL 250 perch  bare land with  facing  tangalle   Beach  . 200 feet  beach   frontage. 2 km to Tangoole town, 14 km to  highway enter  . Land suitable for commercial operation including HOTEL ,RESIDENT ,CABANAS  etc. Price expected 750000 per perch  but negotiable. Call for images and",tangall,Commercial,250.0 perches
86,On the Beach Land for Sales Ambalanthota,29 Jun  8:17 am,"Ambalantota, Hambantota","135,000","උසන්ගොඩ  සංචාරක ප්‍රදේශයේ ,මුහුදු වෙරළට  මුහුනත ඇති , හෝටලය ආසන්නයේ ,සංචාරක ව්‍යාපාරයට ඉතාමත් වටිනා පර්චස් 135ක ඉඩම ,පර්චසය 135000/= ගනනේ විකිනීමට බලාපොරොත්තු වේ .ඉඩම  පිහිටිම අලංකාරයි නිරවුල් ඔප්පු ,  .usangooda  tourist zone ,walipatanwila   beach . Facing the land. 135p valuable land for sale ,1 laks per perches .Clear deeds .....loans facilities can be arranged ..",Ambalantota,Commercial,112.0 perches
87,3.5 Acres Land Sale Tangalla,21 Jun  2:19 pm,"Tangalla, Hambantota","300,000","Rs 168,000,000",REKAWA RANNA TANGALLA,"Commercial, Residential",3.5 acres
88,Eco land for sale Hambanthota,21 Jun  7:16 am,"Hambantota, Hambantota","25,000",පර්චස් 250 පමන විශාල  මෙම ඉඩම  නිව ඉතා අගනා ඉඩම  නිවාඩු නිකේතනයක්  සදහා ඉතාසුදුසුු  පරිසරයක පිහිටා අැත  අවට වටපිටාව සුන්දර වැවු යායක ට වටවුන මෙම ඉඩම හමිබන්තොට වරායට 12 kmහම්බන්තොට  නගරයට 10 kmමත්තල සහ හයිවේ පිවිසුම්  මාර්ගයට   12 kmවිදුලි සහ නල ජලය හෝ වාරි ජලය සහිත හමිබන්තොට සුරියවැව පුලුල් මාර්ගයට (මන්තීරැ 4/ පාර)  500 m දුරින්   පිහිටි මෙම ඉඩම ව්‍යාපාරකට හෝ වගා කටියුතු සදහා  පදිංචියට  අනගියි.  පිරිසිදු ඔප්පු සහිතයි (නිරවුල්). දැනට බෝග සිටවා අැත. පොල් සහ කොස් ගස් සහිත සාරවත් පස viber  imo  w/app,Hambanthota,Commercial,250.0 perches
89,Agriculture Land for Sale - Hambanthota,21 Jun  6:52 am,"Ambalantota, Hambantota","1,500,000",අක්කර 10 වගාවට  ඉතා අගනා ඉඩම  වගාව සමග වකිනිමට   හමිබන්තොට වරායට 14 kmහම්බන්තොට  නගරයට 12 kmහයිෙවේ පිවිසුම්  මාර්ගයට  මත්තල ගුවන්තොටු පලට  12 kmවිදුලි සහ නල ජලය හෝ වාරි ජලය සහිත හමිබන්තොට  මත්තල    පුලුල් මාර්ගයට (මන්තීරැ 4/පාර) සිට 2 km පමන දුරින්  පිහිට්  මෙම ඉඩම   වගා කටියුතු සදහා  අනගියි.පිරිසිදු ඔප්පු සහිතයි (නිරවුල්). දැනට බෝග සිටවා අැත. පොල්  අඔ  දොඩම්  සහ  කොස් ගස් සහිත සාරවත් පස  වැඩි විස්තර දැනගැනීමට අමතන්න,Hambanthota,"Commercial, Residential",10.0 acres
90,Land for Sale in Tissamaharama,30 Jun  9:41 am,"Tissamaharama, Hambantota","850,000",Land for Sale in Tissamaharama===================,"Tissamaharama, Hambantota","Commercial, Residential",12.5 perches
91,"ත0ගල්ල,නෙටොල්පිටියෙන් අගනා සින්නක්කර ඉඩමක්",19 Jul 10:20 am,"Tangalla, Hambantota","23,000","ත0ගල්ල ,  නෙටොල්පිටියේ සිට කි.මී 1ක් දුරින් මෙම අගනා සින්නක්කර ඉඩම පිහිටා ඇත.නල ජලය ,විදුලිය ඇත.ඉතා ඉක්මනින් විකුණනු ලැබේ.කතා කරන්න.","Agricultural, Commercial, Other",11.0 acres,
92,Land for Sale in Hambantota,20 Jun  8:41 am,"Hambantota, Hambantota","235,000","180 perches land with a House Electricity,Water, land phone  1. km to Hambantota Huber main Gate 2 Km  A2 (colombo to Kataragama ) Main Road 2 Km BOI Zone 2.5 Km Shangri-La's Hambantota Golf Resort & Spa  hotelgood place for the container yard,import vehicle parking place","Rotalawewa, 2nd road, mirijjawila, Hambantota.","Commercial, Residential, Other",180.0 perches
93,Land for Sale at Bata- Atha ( Hambanthota),19 Jun  3:08 pm,"Hambantota, Hambantota","14,000","Scenic land for sale at Bata -Atha, Hambanthota,  Ideal for Agricilture and tuorism.  Two and half hour drive from Colombo via Highway. 7km away from Agunakolapelessa Exit. 40 perch or Two acre lots available.","Bata-Atha, Hambanthota",Agricultural,40.0 perches
94,නේවාසික ඉඩමක් විකිනීමට තිබේ - තංගල්ල,18 Jun  9:40 pm,"Tangalla, Hambantota","2,800,000",තංගල්ල හේනකඩුව පන්සල හා ගෞතම විහාරය ආසන්නයේ තිස්ස පාරට මීටර් 100 දුරින් නල ජලය විදුලියතංගල්ල නගර සීමාව තුල පිහිටා තිබේ,"හේනකඩුව, තිස්ස පාර, තංගල්ල",Residential,10.0 perches
95,බෙලිඅත්ත නගර සිමාවෙන් ඔබට ලැබෙන වටිනා අවස්ථාවක්..,18 Jun  7:41 pm,"Beliatta, Hambantota","275,000","බෙලිඅත්ත නගරයට මීටර් 800 ක දුරින්, ප්‍රධාන පාරට මුහුණලා පිහිටි මෙම බිම් කොටස ව්‍යාපාරික ස්ථානයක් සදහා වඩා සුදුසු වේ.බෙලිඅත්ත දුම්රිය නැවතුමට 1 km.අධිවේගී පිවිසුමට 1.5 km.","කම්බුස්සාවල, ගැටමාන්න පාර, බෙලිඅත්ත.","Commercial, Residential",63.0 perches
96,Land for Sale Weeraketiya,17 Jun  2:40 pm,"Beliatta, Hambantota","1,100,000","Thangalla-weeraketiya, pradana maargaye sita 500m pamana durin, bedigama-nugewela, maargayata muhunalapihiti, idama ikmanin wikineemata.","bedigama--nugeewela, maargaye.",Residential,20.0 perches
97,Land for Sale - Beliatta,17 Jun  1:42 pm,"Beliatta, Hambantota","3,500,000",බෙලිඅත්ත වට රවුම ඉදිරිපිට හක්මණ පාරට මුහුණලා පර්ච් 10ක ඉඩමක් විකිණීමට ඇත.පර්ච් 1ක් ලක්ෂ 35යි.,Beliatta,Commercial,10.0 perches
98,"Land for Sale in Tangalle, Nalagama",27 Jun 11:48 am,"Tangalla, Hambantota","3,000,000","*බෙලිඅත්ත, තංගල්ල ප්‍රධාන මාර්ගයට දුර  මීටර් 500 * නලගම පාරට මුහුණලා පිහිටා ඇත* නිරවුල් ඔප්පු සහිතයි.* ජල, විදුලි පහසුකම් සහිතය*ඉඩම පිටුපස තාප්පය පමණක් බැද ඇත.","Godauda kanda, Nalagama, Tangalle","Commercial, Residential",20.0 perches
99,1 Acer Bare Land for Sale Tissamaharama, 8 Jul 12:43 pm,"Tissamaharama, Hambantota","20,000,000","1 ACER BARE LAND FOR SALE TISSAMAHARAMA KATHARAGAMA MAIN ROAD ROAD. 200 METERS TO TELE GAMANAYA WITH ALL FACILITIES, BUS ROUTE, 6 KM FOR KATHARAGAMA .",TISSAMAHARAMA KATHARAGAMA MAIN ROAD,"Commercial, Residential, Other",1.0 acres
100,Agriculture farm for sales - Gonnoruwa,15 Jun  1:12 am,"Ambalantota, Hambantota","1,250,000",🛑හම්බන්තොට මත්තල -පාර සිට 3km දුරින් කෘෂිකර්මාන්තයට ඉතා සුදුසු කෙසෙල් අඔ අැතුලු ඔනෑම වගාවන් සදහා අක්කර 10 ක ඉඩම වගාව සමග කෘෂිකර්මාන්ත කටුයුතු සදහා විකිණීමට ඇත....🛑✔️ අැලට මුහුණත පළල අඩි-200 .✔️පර්චස්- 1600 ✔️හයිවේ පිවිසුමට -7 KM.✔️ ගුවන්තොටුපලට 10 KM✔️වගාවට සුදුසු  ඉඩමකි✔️සම්පූර්ණයෙන් ඉඩම ආවරණය වන සේ වැට ආවරණය කර ඇත.✔️ජල පහසුකම් .✔️ ව්‍යප්‍රතියේ කාලය 3 වසර ✔️ ඕනෑම වාහනයක් ඇතුලු කල හැකිය .✔️.ව්‍යප්‍රතිය් ස්භාවය වගාව 🔴🔴ව්‍යප්‍රතිය සදහා අපේක්ශිත මුලු වියදම -රැ -15 මිලියන /= හෝ ආසන්නව .🔴🔴🔴🔴 ව්‍යප්‍රතියේන් වසර 3ට පසු අාදායම -රැ-50 මිලියන /=හෝ ආසන්නව බලාපොරොත්තු වේ.🔴🔴🔴🔴අකකර 1ක් සදහා රජයේ තක්සේරුව-රැ-2000000/=🔴🔴🔥පිරිසිදු ඔප්පු හා බැoකු ණය සදහා අවශ්‍ය සියලු ලිපි ලේඛණ ඇත.🔥ව්‍යප්‍රතියේන් වසර 3ට පසු සුද්ද ලාභය රැ - මිලියන 35,Hambanthota,Agricultural,10.0 acres
101,Land for Sales - Hambanthota,15 Jun 12:59 am,"Hambantota, Hambantota","1,500,000",අක්කර 15 ක වැවට මායිම්  ඉතා අගනා ඉඩම  වගාකටයුතු  හෝ හොටෙල් ව්‍යාප්‍රතියකට   ඉතා සුදුසුය හමිබන්තොට වරායට 10 kmහම්බන්තොට  නගරයට 9 kmමත්තල නගරනට හා  ගුවක්තොටුපලට   12 kmවිදුලි සහ නල ජලය හෝ වාරි ජලය සහිත හමිබන්තොට සුරියවැව පුලුල් මාර්ගයට (මන්තීරැ 4/ පාර) සිට 2 km දුරින්  පිහිටි මෙම ඉඩම ව්‍යාපාරකට හෝ වගා කටියුතු සදහා කර්මාන්ත ශාලාවකට අනගියි.පිරිසිදු ඔප්පු සහිතයි (නිරවුල්). දැනට බෝග නැත නැත.  සාරවත් පස,Hambanthota,Agricultural,15.0 acres
102,Eco Land for Sale - Hambanthota,14 Jun  7:53 am,"Hambantota, Hambantota","25,000",🛑හම්බන්තොට මත්තල -පාර සිට 500 m දුරින් කෘෂිකර්මාන්තයට ඉතා සුදුසු  නිසල පරිසරයක පිහිටි  ඔනෑම වගාක්  සහ සංචාරක  ව්‍යාපාරයට  ඉතා සුදුසු    අගනා  පර්චස්  225  ක ඉඩම    කෘෂිකර්මාන්ත කටුයුතු හෝ  පදිංචියට  විකිණීමට ඇත....🛑 ✔️ වැවට මුහුණත පළල අඩි-100 .✔️පර්චස්- 225✔️හයිවේ පිවිසුමට -7 KM.✔️ ගුවන්තොටුපලට 10 KM✔️හතරැස් ඉඩමකි✔️සම්පූර්ණයෙන් ඉඩම ආවරණය වන සේ වැට ආවරණය කර ඇත.✔️ජල  විදුලි පහසුකම් .✔️  නිවාඩු නිකේතනයට ඉතා සුදුසුය  ✔️ ඕනෑම වාහනයක් ඇතුලු කල හැකිය .,Hambanthota,Agricultural,225.0 perches
103,Land For Sale In Walasmulla Town,13 Jun  4:19 pm,"Beliatta, Hambantota","200,000",වලස්මුල්ල මහ විදුහල ඉදිරිපිට සුන්දර වටපිටාවක පිහිටි අගනා බිම් කොටසක් ඉක්මනින් විකිණේ.වලස්මුල්ල නගරයට =200 mමිල ගණන් සාකච්චා කර ගත හැක.,"Beliaththa rd,Walasmulla",Residential,30.0 perches
104,Land For Sale In Beliatta,12 Jul  1:58 pm,"Beliatta, Hambantota","5,900,000","බෙලි අත්තේ සිටින මලුවේ සිට 1Km පමන දුරින් පිහිටා ඇති අක්කර 2කින් යුත් මෙම ඉඩම වැවට යාබදව පදිංචියටද ඉතාම සුදුසු,කුරුදු සිටවා ඇති මෙම ඉඩම ජලය,මාර්ගයද ඉඩමට ඇත.පොල් ගස් 100කට වැඩි ප්‍රමාණයක් ඇති අතර පොල් වලින් දැනට ආදායම් ලබයි.නිරවුල් ඔප්පු.වැඩි විස්තර සදහා විමසන්න.(මිල ගණන් සාකච්චා කල ගත හැක.)",Other,2.0 acres,
105,Land for Sale in Hambantota,30 Jun  9:41 am,"Hambantota, Hambantota","65,000",හම්බන්තොට ප්‍රදේශයේ ඉඩමක් විකිණීමට ===============================,"Commercial, Residential",222.0 perches,
106,හම්බන්තොට කුබුරු ඉඩම විකිණීමට,11 Jun  7:08 pm,"Hambantota, Hambantota","3,000,000",මට රැ 07.30න් පසු අමතන්න. ඉඩම කිසිම අවුලක් නැ වතුර ඇල මාර්ග හරහා. ඉඩම ලගින් විදුලිය ද යනවා  . කුබුරු අක්කර 2 හමාරක් ඉක්මනින් විකුනමි.,හම්බන්තොට...තිස්ස පුර,Agricultural,2.5 acres
107,Land for Sale Tissamaharama,11 Jun  1:56 pm,"Tissamaharama, Hambantota","5,000,000",Milaganan සාකච්ඡා karagatha haki,"611/4koonwelana,goonagamuwa ,tissamaharama.",Other,21.0 perches
108,හම්බන්තොට වටිනා කුඹුරු ඉඩමක් සහ ගොඩ විකිණීමට, 9 Jul  3:32 pm,"Hambantota, Hambantota","3,300,000","හම්බන්තොට දිස්ත්‍රික්කයේ මත්තල ගුවන් තොටුපලට,ඉදිවෙමින් පවතින අධිවේගී මාර්ගයට හා නව ආයෝජන කලාපයට ආසන්න ව පහළ අන්දරවැවට මුහුණලා බුරුත/ පොල්/තේක්ක සහ පළතුරු ගස් වගා කල අක්කරයක ගොඩ ඉඩමක්(මෙය නිවාඩු නිකේතනයක් සඳහා ද සුදුසුය) සහ  මත්තලට ආසන්න  ව යල මහ නොකඩවා වගා කරන අක්කර  2 කුඹුරු ඉඩමක් ඉක්මනින් විකිණීමට ඇත.ජය භූමි සහ ස්වර්ණ භූමි ඔප්පු ඇත.මිළ ගණන් සාකච්ඡා කරගත හැකිය.","Agricultural, Commercial, Residential",3.0 acres,
