,0,1,2,3,4,5,6,7
38,Land For Sale In Tangalle,16 Jul  9:39 am,"Tangalla, Hambantota","7,500","තංගල්ල නගරයට ඉතා නුදුරින් සුන්දර පරිසරයක පිහිටි ඉතා වටිනා , පිරිසිදු ඔප්පු සහිත අක්කර් 5.5 ක ( 880 පර්චස්) බිම් කොටස , වහාම විකිනීමට ඇත. පර්චසය රු . 7500 සිට . වැඩි ඉල්ලුමට වහාම විකුනනු ලැබේ. වැඩි ",Tangalle,"Agricultural, Commercial, Residential, Other",880.0 perches
39,Land for sale in Beliatta,10 Jul  3:31 pm,"Beliatta, Hambantota","1,900,000","Walasmulla Galahitiya pasala asala,julampitiya parata adi 35 muhunatha.ikmanin vikineemata.1900000/=","Commercial, Residential",13.5 perches,
40,Land For Sale - Thangalla,10 Jul 12:59 pm,"Tangalla, Hambantota","6,000,000","ප්‍රධාන පාරේ සිට මීටර් 250 පමණ දුරින් පිහිටි පහත මහලේ 90% ක් පමණ වැඩ අවසන් කර ඇති, කාමර 03 ක් බාත් රූම්  01 සහ වර්ග අඩි 2300 පමන ස්ලැබ් එක දම ඇති , තංගල්ලට විනාඩි 10 පමණ දුරින් වූ  නිවස විකිනීමට ඇත .","කදුරුපොකුණ පාර , ගොඩැල්ලවෙල , තංගල්ල .",Residential,20.0 perches
41,Land for Sale in Tissamaharama,10 Jul 10:49 am,"Tissamaharama, Hambantota","220,000",තිස්සමහාරාම-කිරින්ද ප්‍රධාන පරට මුහුනලා යොධ වැව ආසන්නයේ පසුපස කුබුරු යායක්.සංචාරකවයාපාරයට ඉතා සුදුසු පර්චස් 140 තෙකලා විදුලිය හා ජල පහසුකම් සහිත ඉඩම සම්පුර්ණ හෝ කොටසක් විකිනිමට ඇත. පිරිසුදු ඔප්පු.බැංකු ණය පහසුකම් ලබා ගත හැක.,Commercial,140.0 perches,
42,Land For Sale - Ambalanthota,18 Jul  5:00 pm,"Ambalantota, Hambantota","125,000",තිස්ස මාතර ප්‍රධාන මාර්ගයට යාබදවඅම්බලන්තොට ලුණම ප්‍රදේශයේ වෙල් යායට මායිම්ව ඇති ගොඩ ඉඩමසින්නක්කර ඔප්පුපර්චස් 70 ක ඉඩම විකිණීමට ඇතMr.Nishantha,"Ambalanthota,Lunugama, Thissamaharama",Residential,70.0 perches
43,Commercial Land for Sales Gonnoruwa, 9 Jul  4:38 am,"Hambantota, Hambantota","3,000,000",🛑හම්බන්තොට මත්තල -පාරට මුහුනලා පිහිටි  මෙම ඉඩම  අක්කර 25 ක්  ය ව්‍යාපාර කටයුතු  සදහා  ඉතා සුදුසුය කන්ටෙනර් යාඩ් ඒකක් සදහා ඉතා සුදුසුය     විකිණීමට ඇත....🛑✔️ පාරට  මුහුණත පළල අඩි-500 .✔️පර්චස්- 4000 ✔️හයිවේ පිවිසුමට -7 KM.✔️ ගුවන්තොටුපලට 10 KM✔️හම්බන්තොටට සහ වරායට 15  KM ✔️සම්පූර්ණයෙන් ඉඩම ආවරණය වන සේ වැට ආවරණය කර ඇත.✔️ජල  තෙකලා විදුලිලි  පහසුකම් .✔️ ව්‍යප්‍රතියේ කාලය 3 වසර ✔️ ඕනෑම වාහනයක් ඇතුලු කල හැකිය .✔️.ව්‍යප්‍රතිය් ස්භාවය  ව්‍යාපාර  කර්මාන්ත    ,Hambanthota,Commercial,25.0 acres
44,Commercial land for sales Hambanthota, 9 Jul  4:15 am,"Hambantota, Hambantota","10,000",🛑හම්බන්තොට  මත්තල   පාරේ ගොන්නොරැව  සිට   මිටර් 500   දුරින්   අඩි 20  පාරට මුහුණ ලා පර්චස් 480 ක හතරැස් ඉඩම  කෘෂිකර්මාන්තයට ඉතා සුදුසු ඉඩම   විකිණීමට ඇත....🛑✔️මුහුණත පළල අඩි-150.✔️පර්චස්-480.✔️-හම්බන්තොට  වරායට 15 KM.✔️ගුවන්තොටුපලට -12 KM✔️ගුවන්තොටුපලට  15 KM✔️සම්පූර්ණයෙන් ඉඩම ආවරණය වන සේ වැට  යොදා ආවරණය කර ඇත.✔️ජල විදුලි පහසුකම් .✔️ ඕනෑම වාහනයක් ඇතුලු කල හැකිය .✔️ඕනෑම ව්‍යාපාරයක් සදහා සුදුසුයි.,Hambanthota,Agricultural,480.0 perches
45,Land for Sale in - Ambalantota,22 Jul  2:40 pm,"Ambalantota, Hambantota","2,000,000","පිරිසිදු ඔප්පු සහිතය,නළ ජල පහසුකම්,තෙකලා විදුලි පහසුකම්,රන්න ප්‍රධාන පාරට 300m,නිවසක් සාදා ගැනීමට අවශ්‍ය දැව පහසුකම්ද සහිතය.","සමනල මාවත,රන්න නැගෙනහිර","Agricultural, Commercial, Residential, Other",280.0 perches
46,Land for Sale in Ambalanatota, 8 Jul  3:15 pm,"Ambalantota, Hambantota","70,000",මෙම ඉඩම සින්නක්කර ඉඩමකි ඉතමත් සුන්දර වලව ගගට මුහූනදෘ පිහිටා ඇත නිවාඩු නිකෙතනයක් සදහා වඩත් සදුසුය මෙම ඉඩමෙ සිට අමිබලන්තොට නගරයටkm 1 අමිබලන්තොට රොහලට500m හම්බන්තොට වරායට km 22 කොලඹ කතරගම මාර්ගයට m800ද දක්ෂින අදිවෙගි මාර්ගයට 25kmද මත්තල ගූවන්තොටුපලkm42 රිදියගම සෆාරි පාක්km18 ද නුදුරින්ද   පිහිටා ඇත ඉතාමත් කෙටිකාලයකිනන් පහසුවෙන් ගමන් කල හැක ගැනූමි කරැවන් විතරක් අමතන්න,ambalanatota,"Agricultural, Commercial, Residential, Other",41.0 perches
47,සින්නක්කර ඔප්පු සහිත ඉඩමක් තිස්සමහාරාම, 9 Jul 12:41 pm,"Tissamaharama, Hambantota","1,700,000",දෙබරවැව ජතික පසල අසල ඉඩම් කිහිපයක් සහ විරවිල බන්ධනාගාරය අසල සින්නක්කර  ඔප්පු සහිත  ඉඩමක් තිබේ.විස්තර  සදහා කොල් කරන්න.,Other,63.0 perches,
48,තංගල්ල - මැදකැටිය ඉඩම් කැබලි 02 ක් විකිණිමට ඇත, 8 Jul 11:14 am,"Tangalla, Hambantota","5,000,000","තංගල්ල නගර සීමාවේ තංගල්ල නගරයට දුර 1 kmජල, විදුලි පහසුකම් සහිත ප්‍රදේශයක්නිරවුල් ඔප්ප සහිතය","Dipankara road, Madakatiya, Tangalle","Residential, Other",15.0 perches
49,ඉඩම් තංගල්ල කදුරුපොකුණ, 7 Jul 11:22 am,"Tangalla, Hambantota","2,000,000",විදුලිය/නල ජලය ඇතඉක්මනින් විකිණීම සඳහා පිරිසිදු ඔප්පු,"කදුරුපොකුණ ,තංගල්ල","Commercial, Other",25.0 perches
50,Land with House Sooriyawewa,20 Jul 11:18 am,"Hambantota, Hambantota","25,000",15 min for Highway entarss 5 min for sooriyawewa town 5 min for hospital,"No15,perani Beddewewa,sooriyawewa",Other,140.0 perches
51,Land in Angunakolapelessa, 6 Jul  4:42 am,"Tangalla, Hambantota","165,000",Land in angunukolapellessa.angunukolapellessa nagaraye Wewata muhunala manaram parisarayaAngunukolapellessa nagaraye sita 400 m. Jalaya saha widuliya sahitai .Price is negotiable.Ikmanin wikineemata.,Mahanaga School Road,"Agricultural, Commercial, Residential, Other",36.0 perches
52,Agriculture Land for Sale - Gonnoruwa, 5 Jul  9:41 pm,"Hambantota, Hambantota","12,500",🛑හම්බන්තොට - මත්තල  ප්‍රදාන   පාර සිට  මිටර් 500 පමන දුරින් ඒම පාරට  මුහුණ ලා පර්චස් 800  ක හතරැස් ඉඩම  වගාවට සැකසු වගා  බිම සමග විකිණීමට ඇත....🛑✔️මුහුණත පළල අඩි-100  පාරට ✔️පර්චස්-800.✔️හම්බන්තොට වරායට -10 KM.✔️මත්තල ගුවන්තොටු පලට -15 KM✔️හයිවේ පිවිසුමට 12 ✔️සම්පූර්ණයෙන් ඉඩම ආවරණය වන සේ වැට යොදා ආවරණය කර ඇත.✔️ඉඩමට ජල නල ඒලා අැත  .✔️කන්ටේනර් ඇතුලු ඕනෑම වාහනයක් ඇතුලු කල හැකි අඩි 20 පාර .✔️ඕනෑම ව්‍යාපාරයක්   හෝ වගාවකට සුදුසුය  .🔴🔴මාසිකව 2ට  අපේක්ශිත වගා  අාදායම  -රැ -2000000/= හෝ ආසන්නව .🔴🔴🔴🔴වර්ශයකට අාදායම්  මුදල -රැ-6750000/=හෝ ආසන්නව බලාපොරොත්තු වේ.🔴🔴🔴🔴පර්චසයක් සදහා රජයේ තක්සේරුව-රැ-20000/=🔴🔴🔥පිරිසිදු ඔප්පු හා  අවශ්‍ය සියලු ලිපි ලේඛණ ඇත.වැඩි විස්තර සදහා අමතන්න,Hambanthota,Agricultural,800.0 perches
53,Land for Sale - Tissamaharamaya, 5 Jul  4:45 pm,"Tissamaharama, Hambantota","4,000,000","විදුලිය,ජලය,ඇත.වගාව සදහා ඇළ මාර්ගයට මෝටරය යොදා බට එලා ඇත.එක දිශාවකින් වනජීවී අලි වැට ඇත.අනෙක් පැති තුනට පරිපථයක් මගින් විදුලි වැට යොදා ඇත.කෙසෙල්,ගස්ලබු,තක්කාලි දැනට වගා කර ඇත.ඉතා සරු භූමියකි.වගාවන් සදහා මෙන්ම සංචාරක ව්යාපාරයේ කබාන (Cabana) ,ට්රි හවුස් (Tree House) ,පරිසර හිතකාමී ලැගුම්හල් ( Eco-Friendly Hotel) , කෑම්පින් ( Camping) සදහාද ඉතා යොග්ය වේ.ඉහත වගාවන් සහිත මෙම බලපත්ර ඉඩම සම්පූර්ණයෙන්ම හො හරි අඩක් විකිණීමට ඇත.මුදල් හදිසියක් නිසා විකුණනු ලැබේ.","Saliyapura,Gonagamuwa,Tissamaharamaya.","Agricultural, Other",5.0 acres
54,Land For Sale In Ambalantota, 4 Jul 12:20 pm,"Ambalantota, Hambantota","225,000",නෙරනාගම උස්සන්ගොඩ පාරේ මුහුදු වෙළදට ආසන්නව පර් 83කබිම් කොටසක් විකිණීමට ඇත පර්චස් 1ක් 225000/- ඉතා ඉක්මණින් විකිණීමට,ambalantota,Residential,83.0 perches
55,Land for Sale in Tangalla, 4 Jul  8:48 am,"Tangalla, Hambantota","3,700,000","මිද්දෙනියේ සිට ජුලම්පිටිය හරහා වලස්මුල්ල මාර්ගයට මුහුනලා පර්චස් 100ක ඉඩමක් විකිනීමට ඇත. පර්චස් 1ක් 37,000/= මිල ගනන් සාකච්චා කර ගත හැක. Middeniya walasmulla margayata muhunala 100p vikinimata etha. 1p=37,000/=",මිද්දෙනියේ සිට ජුලම්පිටිය හරහා වලස්මුල්ල මාර්ගයේ.,"Agricultural, Commercial, Residential",100.0 perches
56,1 Acer Bare Land for Sale Tissamaharama, 8 Jul 12:43 pm,"Tissamaharama, Hambantota","20,000,000","1 ACER BARE LAND FOR SALE TISSAMAHARAMA KATHARAGAMA MAIN ROAD ROAD. 200 METERS TO TELE GAMANAYA WITH ALL FACILITIES, BUS ROUTE, 6 KM FOR KATHARAGAMA .",TISSAMAHARAMA KATHARAGAMA MAIN ROAD,"Commercial, Residential, Other",1.0 acres
57,Land for Sale - Tissamaharama,23 Jul  9:29 am,"Tissamaharama, Hambantota","65,000",Land For Sale In Tissamaharama==========================,Residential,143.0 perches,
58,මත්තල ගුවන් තොටුපොල ආසන්නයේ වටිනා ඉඩමක්, 3 Jul  4:11 pm,"Tangalla, Hambantota","8,000,000",හම්බන්තොට දිස්ත්‍රික්කයේ ගොන්නොරුව පාරේ මත්තල ගුවන් තොටුපොල හා  මත්තල මහින්ද රාජපක්ෂ ක්‍රීඩාංගණයට ඉතාමත් ආසන්නයේ අන්දරවැව යන ගමේ පිහිටි උළු සෙවිලි කළ නිවසක්ද සහිත අන්දරවැව වත්ත යන ජලය විදුලිය පහසුකම් සහිත වටිනා නිරවුල් සින්නක්කර ඉඩම ඉතා ඉක්මනින් විකිණීමට..,අන්දරවැව,"Agricultural, Commercial, Residential, Other",15.0 acres
59,හදිසි විකිණීමේ ඉඩම් අම්බලන්තොට, 3 Jul 12:55 pm,"Ambalantota, Hambantota","15,000","අම්බලන්තොට නගරයට ,හම්බන්තොට රෝහලට,වරායට,ආසන්නව පර්චස් 80ක ඉඩමක් මුදල් හදිසියකට  විකුණනු ලැබේ.පර්චස් එකක් රු:15000 දහසක් වේ ය.බලපත්‍ර ඇත.","මැඩිල්ල මැද පාර,මානජ්ජාව, අම්බලන්තොට","Agricultural, Commercial, Residential, Other",80.0 perches
60,තංගල්ල නගරයට ආසන්න වට්නා පොල් ගස් සහිත ඉඩමක් විකිනීමට, 2 Jul  6:27 pm,"Tangalla, Hambantota","50,000","තංගල්ල නගරයට 5කි.මි දුරින්, බෙලිඅත්ත නගරයට 1.5 කි.මි දුරින් සාරවත් පොල් ඉඩමක් විකිනීමට.වැඩි විස්තර සන්ඳහා අමතන්න.","Agricultural, Commercial, Residential, Other",4.0 acres,
61,Residential Land for Sale in - Gonnoruwa,14 Jul  7:29 am,"Hambantota, Hambantota","17,500",Residential Land for Sale in Hambanthota අක්කර 5 ක  ඉතා අගනා ඉඩම  වැවට මුහුන ලා පිහිටා අැත  පදිංචියට හා වගාවට  ඉතා සුදුසු ය හමිබන්තොට වරායට 14 kmහම්බන්තොට  නගරයට 12 km මත්තල ට හා හයිවේ පිවිසුම්  නගරයට 12 kmවිදුලි සහ නල ජලය හෝ වාරි ජලය සහිත හමිබන්තොට මත්තල  පුලුල් මාර්ගයට (මන්තීරැ 4/  පාර) සිට මිටර් 500  දුරින් මුහුනලා පිහිටි මෙම ඉඩම ව්‍යාපාරකට හෝ වගා කටියුතු සදහා කර්මාන්ත ශාලාවකට අනගියි.පිරිසිදු ඔප්පු සහිතයි (නිරවුල්). දැනට බෝග සිටවා අැත.,Hambanthota,Agricultural,2.0 acres
62,Residential Land for Sale in Gonnoruwa,30 Jun  9:49 am,"Hambantota, Hambantota","25,000",Residential Land for Sale in Gonnoruwa,Hambanthota,Agricultural,2.0 acres
63,Land For Sale In Tangalle,30 Jun  2:35 pm,"Tangalla, Hambantota","395,000",තංගල්ල  මුහුදු වෙරළට ආසන්නව සංචාරක හෝටලයකට වඩාත් සුදුසු මෙම වටිනා ඉඩමෙ ඔබගේ ව්‍යාපාරය / නිවස ගොඩනගා ගන්න  *පර්චස් 10සින්නක්කර ඔප්පු  *තංගල්ල පරාක්‍රම මාවතේ මුහුදට ආසන්නව*තංගල්ල නගරයට ඇවිදින දුර 400mසියලුම නාගරික පහසුකම් සහිතව.- ආරක්ශිත වටපිටාවක්,"Tangalle Parakrama Road,Beach Side Land","Commercial, Residential",10.0 perches
64,Land Sale Tangalla,29 Jun  4:24 pm,"Tangalla, Hambantota","7,500,000",Tangala Town to Land 6 KM 03 Rooms in House01 Hall 01 Kitchen 01 Bathroom in houseLook Nice Area Comfortable Rooms Biliyatha Station to House 6 Km,"Embilamandiya, Nalagama vitharandeniya",Agricultural,160.0 perches
65,Land for Sale in Thissamaharama,29 Jun  1:52 pm,"Tissamaharama, Hambantota","600,000",තිස්සමහාරාම නගරයට ආසන්නව තිස්සමහාරාම වැවට ඉතා නුදුරින් සංචාරක පුරවරයට මැදිව පිහිටි ඉතා වටිනා පිරිසිදු ඔප්පු   සහිත අක්කරයක ඉඩමක් විකිණීමට කුඩා මුර නිවසක්ද සහිතව අලංකාර පරිසරයක පිහිටා ඇත සංචාරක නිකේතනයක් ඉදිකිරීමට වඩාත් සුදුසු ස්ථානයකි.බ්‍රෝකර්වරු අනවශ්‍යයි පර්චසයක් 600000/=,Thissamaharamaya Town,"Commercial, Other",1.0 acres
66,වගාවට සුදුසු ඉඩමක් විකිනිමට හම්බන්තොට,29 Jun  8:38 am,"Hambantota, Hambantota","10,000","හම්බන්තොට මත්තල  මාර්ගයේ සිට   මීටර් 450	පමන දුරින්  වගාවට සුදුසු මෙම ඉඩම විකිනිමට අැත * පර්චස් 1 ක් 10000 පමනි * පිරිසිදු ඔප්පු* ජලය , විදුලිය , දුරකථන  පහසුකම් * ඉඩමට අදාල රාජ්‍ය ආයතනවල අනුමැතිය* අනුමත පිඹුර* බැංකු ණය * ඉඩමේ සිට  හයිවේ පිවිසුමට   6km * වෙල් යායක අසිරිය විඳිමින් පදිංචියට  සහ වගාවට ... වරායට සහ ගුවන්තොටුපලට  විනාඩි 15 ලගාවිය හැක",Hambanthota,"Agricultural, Commercial",5.0 acres
67,වටිනා ඉඩමක් විකිනිමට මත්තල,28 Jun  8:16 pm,"Hambantota, Hambantota","1,200,000","මත්තල අලුත්ගම් ආර ප්‍රදාන පාරට මුහුනලා අක්කර භාගයක වටිනා ඉඩමක් විකිනිමට..නලය ජලය ,විදුලිය ඇත පොල්ගස් අබ ගස් කොස් දෙහි දෙලුම් වගාකර ඇති ඉඩම වගා ලිදක්ද ඇත මත්තල ගුවන් තොටුපොලට කි.මි 5සූරියවැව ක්‍රිකට් ක්‍රිඩාංගනයට  කි.මි 3යි","අබ වත්ත ,අලුත්ගම් ආර , මත්තල",Commercial,80.0 perches
68,Lake View Land for Sales Hambantota,27 Jun  7:02 pm,"Hambantota, Hambantota","20,000",පර්චස් 332  වැව අසල පිහිටි වැවකට සුන්දර දසුන් මවනා මෙම ඉඩම  පදිංචියට හෝ  නිවාඩු නිකේතනයකට  ඉතා සුදුසුය   හමිබන්තොට වරායට 14 kmමත්තල  ගුවන්තොටුපලට  නගරයට 12 kmහයිෙව් පිවිසුමට 10 kmවිදුලි සහ නල ජලය හෝ වාරි ජලය සහිත හමිබන්තොට - මත්තල   පුලුල් මාර්ගයට (මන්තීරැ 4/) මාර්ගයේ ගොන්නොරැව     සිට මිටර් 750 පමන දුරින්   පිහිටි මෙම ඉඩම ව්‍යාපාරකට හෝ වගා කටියුතු සදහා කර්මාන්ත ශාලාවකට අනගියි.පිරිසිදු ඔප්පු සහිතයි (නිරවුල්). දැනට බෝග සිටවා අැත. පොල්  කොස් .තේක්ක දෙලුම් අාදි  ගස්  සහිත සාරවත් පස  වගාවට වැඩි විස්තර දැනගැනීමට අමතන්න     viber  imo  w/app,Hambanthota,"Commercial, Residential",332.0 perches
69,Land In Tissamaharama,13 Jul  3:58 pm,"Tissamaharama, Hambantota","120,000","මහසෙන්පුර පාසල අසල,තිස්ස-කතරගම ප්‍රධාන මාර්ගයට 60m ක් පමණ දුරකින්(Hotel 4U පිටුපස) Hotel White House අසල පර්චස් 20ක ඉතාම වටිනා සින්නක්කර ඔප්පු සහිත ඉඩමක් කඩිනමින් විකිණිමට ඇත.(නිවාඩු නිකේතනයකට,වගා කටයුතු සඳහා,පදිංචියට ඉතා සුදුසු ය.)","Mahasenpura,Tissamaharama","Agricultural, Commercial, Residential, Other",20.0 perches
70,Eco Land for Sale - Hambanthota,27 Jun  7:47 am,"Hambantota, Hambantota","6,000,000",🛑හම්බන්තොට -මත්තල  පාර සිට  මිටර් 800 පමන දුරින්  පිහිටි  මෙම ඉඩම   පර්චස් 200  ක හතරැස් ඉඩමකි වැවට මායිව  ඇත පොල් ගස් 40 පමන තිබේ  නිවාඩු නිකේතනයක් සදහා සුදුසු මෙම ඉඩම  විකිණීමට ඇත....🛑✔️ වැව මුහුණත පළල අඩි-200 .✔️පර්චස්-200✔️හම්බන්තොට ට -4 KM.✔️වරායට -.5 KM✔️හතරැස් ඉඩමකි✔️සම්පූර්ණයෙන් ඉඩම ආවරණය වන සේ වැට  යොදා ආවරණය කර ඇත.✔️විදුලිය .සහ නල ජල පහසුකම් ✔️ ඕනෑම වාහනයක් ඇතුලු කල හැකිය .✔️ඕනෑම ව්‍යාපාරයක් සදහා සුදුසුයි.🔴🔴 පොල් වලින්  මාසිකව අපේක්ශිත මුදල-රැ -15000/= හෝ ආසන්නව .🔴🔴,Hambanthota,"Agricultural, Residential",200.0 perches
71,Commercial Land for Sales Hambanthota,27 Jun  7:37 am,"Hambantota, Hambantota","2,500,000",🛑 හම්බන්තොට -මත්තල   පාරට මුහුණ ලා අක්කර 18  ක හතරැස් ඉඩම වැවට මායිම ඇත අලංකාර දර්සනයකින් සමන් මෙම ඉඩම  විකිණීමට ඇත....🛑✔️මුහුණත පළල අඩි-400.✔️පර්චස්-2880.✔️හම්බන්තොට වරායට -15 KM.✔️මත්තල ගුවන්තොටුපලට -6 KM✔️හතරැස් ඉඩමකි තෙකලා විදුලි පහසු කම් ✔️සම්පූර්ණයෙන් ඉඩම ආවරණය වන සේ වැට යොදා ආවරණය කර ඇත.✔️පොල් වගා කර ඇත  . ✔️කන්ටේනර් ඇතුලු ඕනෑම වාහනයක් ඇතුලු කල හැකිය .✔️ඕනෑම ව්‍යාපාරයක් සදහා සුදුසුයි.,Hambanthota,Commercial,18.0 acres
72,Land for Sale Angunakolaplessa,26 Jun  3:24 pm,"Ambalantota, Hambantota","1,500,000",Eight meters away from Angunukolapelessa town on mulana Goda road facing 10 perches land for sale.Perches 10Free deedWater is electricClear documentCall me,"Commercial, Residential",10.0 perches,
73,Land for sale - wekandawala,26 Jun 12:31 pm,"Hambantota, Hambantota","3,500,000",weeraketiya,kishara redigedara.gonadeniya.wekandawala,Commercial,15.0 perches
