,0,1,2,3,4,5,6,7
0,title,posted date,location,price,description,Land type:,Land size:,
1,Land for Sale - Tissamaharama,23 Jul  9:29 am,"Tissamaharama, Hambantota","65,000",Land For Sale In Tissamaharama==========================,Residential,143.0 perches,
2,"['Land for Sale - Tissamaharama', '23 Jul  9:29 am', 'Tissamaharama, Hambantota', '65,000', 'Land For Sale In Tissamaharama==========================', 'Residential', '143.0 perches']","['title', 'posted date', 'location', 'price', 'description', 'Land type:', 'Land size:']",,,,,,
3,වීරකැටිය වටිනා ඉඩම වහාම විකිණීමට,22 Jul 10:44 am,"Tangalla, Hambantota","110,000",වීරකැටිය නගරයට  මීටර් 600 දුරින් රන්න ප්රධාන මාර්ගයට මීටර් 50ක් ඇතුලතින් ඇති ඉඩම ඉක්මනින්ම විකිණීමට තිබේ. නල ජලය තෙකලා විදුලිය හා මාර්ග පහසුකම් ඇත.,Residential,14.0 perches,
4,වලස්මුල්ල නගරයේම අගනා ඉඩමක් විකිනීමට, 2 Jul  3:00 pm,"Beliatta, Hambantota","680,000",වලස්මුල්ල නගරයේම බෙදා වෙන් කරන ලද ඉඩම විකිනීමට..සියලු පහසුකම් සහිතයි..ව්‍යාපාරික ගොඩනැගිල්ලක් ඉදිකිරීමට අගනා බිම් කොටසකි..17 perch 1 perch=680000,"මිද්දෙනිය පාර,වලස්මුල්ල",Commercial,17.0 perches
5,Commercial land for sales Maththala,23 Jul 10:22 pm,"Hambantota, Hambantota","1,500,000","Commercial Value Land in Maththla  Southern SL 50 acres bare land facing paddy aria  . 700 feet paddy  frontage. 2 km to airport , 4 km to Highway enter  , 23 km to port and highway enter  Hambanthota   . Land suitable for commercial operation including HOTEL ,RESIDENT solar project etc. Price expected 1.5 M per acres  but negotiable. Call for images and plan.Contact: viber  imo w/app",Hambanthota,Commercial,50.0 acres
6,Commercial Land for Sale - Hambanthota,23 Jul 10:04 pm,"Hambantota, Hambantota","950,000",🛑හම්බන්තොට -මත්තල -පාර  හයිවේ පිව්සුම්  මාර්ගයේ  සිට 2 KM. පමන   දුරින් කෘෂිකර්මාන්තයට  හෝ සෝලා ව්‍යාප්‍රතියකට ඉතා  සුදුසු කෙසෙල් අඔ අැතුලු ඔනෑම වගාවන් වගා කර හැකි   අක්කර 45 ක ඉඩම  විකිණීමට ඇත....🛑✔️  මුහුණත පළල අඩි-500 .✔️පර්චස්- 8000  ✔️හයිවේ පිවිසුමට -2 KM.✔️ ගුවන්තොටුපලට 4 KM✔️කොළඔ ට ලගා වීම පැ 2.30✔️සම්පූර්ණයෙන් ඉඩම ආවරණය වන සේ වැට ආවරණය කර ඇත.✔️ජල පහසුකම් .✔️ අක්කර 1 ක මිල 950000✔️ ඕනෑම වාහනයක් ඇතුලු කල හැකිය .✔️.ව්‍යප්‍රතිය් ස්භාවය වගාව  Commercial land 🔴🔴🔴🔴අකකර 1ක් සදහා රජයේ තක්සේරුව-රැ-1500000/=🔴🔴🔥පිරිසිදු ඔප්පු හා බැoකු ණය සදහා අවශ්‍ය සියලු ලිපි ලේඛණ ඇත.🔥,Hambanthota,Commercial,50.0 acres
7,Commercial land for sales Hambanthota,23 Jul  9:50 pm,"Hambantota, Hambantota","900,000","Commercial Value Land in Hambanthota  Southern SL 50 acres bare land  facing Road  . 200 feet Road  frontage. 12  km to Hambanthoata town, 14 km to PORT, 12 km to Mattala airport and highway enter   . Land suitable for commercial operation including HOTEL ,solar project  etc. Price expected 900000 per acres   but negotiable. Call for images and plan.Contact: Viber   IMO W/PP",Hambanthota,Commercial,50.0 acres
8,Land for Sale Beliatta,23 Jul 10:06 am,"Beliatta, Hambantota","20,000,000","Land for Sale Beliatta,(Sitinamaluwa)..............................................................................................................................................හම්බන්තොට දිස්ත්‍රිකයේ බෙලිඅත්ත නගරයට,අධිවේගි මාර්ගයට,බෙලිඅත්ත දුම්රිය ස්ථානයට,රුහුණු විජයබා ජාතික පාසලට ආසන්නයේ බෙලිඅත්ත,තංගල්ල ප්‍රධාන පාරට මුහුණලා ඉතා සුන්දර පරිසරයක පිහිටි ව්‍යාපාරික ස්ථානයකට සහ පදිංචියට සුදුසු පර්චස් 40 ක ඉදිවෙමින් පවතින දෙමහල් ගොඩනෑගිල්ල සහිත ඉඩමක් වහාම විකිණිමට ඈත...................................................................................................................................................CALL MORE DETAILS","Sitinamaluwa,Beliatta","Commercial, Residential, Other",40.0 perches
9,Land for Sale - Tissamaharama,23 Jul  9:29 am,"Tissamaharama, Hambantota","65,000",Land For Sale In Tissamaharama==========================,Residential,143.0 perches,
10,Land for Sale in Ambalangoda,22 Jul  4:37 pm,"Beliatta, Hambantota","1,020,000",බෙලිඅත්ත නගරයට 1/2 km කිරින්ද බෙලිඅත්ත ප්‍රධාන පාරට මීටර් 50ක් පමණ දුරින් පර්චස් 12ක ඉඩමක් විකිණීමට තිබේ. ජල විදුලි පහසුකම් ඇත. පර් :1ක් 85000ක්,Residential,12.0 perches,
11,Land for Sale Beliatta,22 Jul  4:19 pm,"Beliatta, Hambantota","80,000",බෙලිඅත්ත නගරයට ආසන්නව අධ්වේගී මාර්ගයට පහසුවෙන් පිවිසීම සහ දුම්රිය පොලට 0.5 km දුරින් පර්චස් 35ක් විකිණීමට.,"Nihiluwa, Beliatta.",Commercial,35.0 perches
12,Land for Sale in Barawakumbuka,22 Jul  3:56 pm,"Ambalantota, Hambantota","120,000",ඇඹිලිපිටිය නෝනගම ප්‍රධාන මාර්ගයට මීටර් 50ක් දුරින් අධිවේගී මාර්ග පිවිසුමට නුදුරින් සියලු යටිතල පහසුකම් සහිත පර්චස් 270ක අගනා බිම් කොටසක් කඩිනමින් විකිණීමට ඇත.,Residential,270.0 perches,
13,Land For Sale in Tangalle,22 Jul  2:00 pm,"Tangalla, Hambantota","975,000",Land For Sale in Tangalle,Tangalle,"Commercial, Residential",1.0 acres
14,පර්චස් 15 ක් සමඟ ව්‍යාපාරික ස්ථානය විකිණ්මට - තංගල්ල,22 Jul  1:08 pm,"Tangalla, Hambantota","12,000,000","ගොයම්බොක්ක වෙරළට විනාඩියක දුර.තංගල්ල මාතර ප්‍රධාන පාරට මීටර් 100විදුලිය,නල ජලය,දුරකථන පහසුකම් සහිතයි.පිරිසිදු ලියකියවිලි,අනන්තරා හෝටලය සහ ෆාම් පැරඩයිස් හෝටලයට මායිම් වූ  සංචාරකයින් සඳහා නේවාසික පහසුකම් ලබාදෙනු ලබන කබානා 3 කින් සමන්විතඅඩි 12 ක් පළල වෙරළ පිවිසුම් මාර්ගයට මුහුනලා ඇතිපර්චස් 15 ක පමණ ඉඩම.","Goyambokka,Tangalle",Commercial,15.0 perches
15,Land for Sale - Ambalantota,22 Jul 12:45 pm,"Ambalantota, Hambantota","75,000",+ For Immediate sale+ Good Residential Property in Lunama+ Peaceful neighborhood+ Easy Access to Main Road+ Genuine buyers are welcomeWith in 15 minutes to AmbalantotaPlease call for more information,"50m to Main road, Lunama, Ambalantota",Residential,60.0 perches
16,Beach view land for sales Ambalanthota,21 Jul 10:48 pm,"Ambalantota, Hambantota","275,000",මාතර තිස්ස  පාර සිට -2 KM  දුරින්  පිහිටා  තිබෙන  පර්චස් 85 ක හතරැස් ඉඩම  වෙරළට මායිව පිහිටා අැත සුන්දර පරිසරයක  පිහිටි මෙම ඉඩම  විකිණීමට ඇත....🛑✔️ වෙරළත මුහුණත පළල අඩි-80.✔️පර්චස්-85✔️අම්බලන්තොට ට -4 KM.✔️වරායට 5 KM✔️හතරැස් ඉඩමකි✔️සම්පූර්ණයෙන් ඉඩම ආවරණය වන සේ වැට ගසා  ආවරණය කර ඇත.✔️ අඩි 25 පලලින් යුතුය  මාර්ග පහසුකම් .✔️ ඕනෑම වාහනයක් ඇතුලු කල හැකිය .✔️ඕනෑම ව්‍යාපාරයක් සදහා සුදුසුයි.,Ambalantota,Commercial,85.0 perches
17,Eco Land for Sale - Ambalanthota,21 Jul 12:11 pm,"Ambalantota, Hambantota","120,000",මාතර ;තිස්ස - පාරට ම්ටර්  50   පමන  දුරින්  පර්චස් 110 ක හතරැස් ඉඩම  සංචාරක හෝ හොටෙල් ව්‍යාපාරයකට විකිණීමට ඇත....🛑✔️මුහුණත පළල අඩි-89.✔️පර්චස්-120.✔️අම්බලන්තොට -1.5 KM.✔️වරායට -4 KM✔️හයිවේ පිවිසුමට 5 KM✔️සම්පූර්ණයෙන් ඉඩම ආවරණය වන සේ වැට ගසා ආවරණය කර ඇත.✔️අවට දර්සනීය කුඔුරැ යායකි.✔️මුහුදු වෙරලට 2 KM,Ambalantota,Agricultural,120.0 perches
18,Lake View Land for Sales Gonnoruwa,21 Jul 11:44 am,"Hambantota, Hambantota","9,000",අක්කර  10 ක   වැව  මායිව     අගනා ඉඩම  විකිනිමට හමිබන්තොට වරායට   12 km හමිබන්තොට  නගරයට 8 kmමත්තල  නගරයට 15 kmහයිවේ පිවිසුමට  10 kmවිදුලි සහ නල ජලය හෝ වාරි ජලය සහිත හමිබන්තොට  මත්තල  පුලුල් මාර්ගයට  සිට   800  m  දුරින්   පිහිටි මෙම ඉඩම ව්‍යාපාරකට හෝ වගා කටියුතු සදහා කර්මාන්ත ශාලාවකට අනගියි. පර්චස් 1600පිරිසිදු ඔප්පු සහිතයි (නිරවුල්). .       viber   w p   imo,Hambanthota,Agricultural,10.0 perches
19,Land for Sale - Beliatta,20 Jul  5:34 pm,"Beliatta, Hambantota","75,000","බෙලිඅත්ත ගැටමාන්න  කිරින්ද ප්‍රධාන පාරේ මීටර් 350ක් නුදුරින් පිහිටි පර් 11ක සින්නක්කර ඉඩමක් වික්ණීමට ඇත.ගොරකා, පොල්, දවට, කොස් නල ඡලය විදුලිය සහිතයි",Gatamanna,"Agricultural, Commercial, Residential",111.0 perches
20,හම්බන්තෝටා පදිංචියට සහ ව්‍යාපාරයට ඉඩමක් විකිනිමට,20 Jul  5:07 pm,"Hambantota, Hambantota","50,000",හම්බන්තොට -මත්තල -පාරට මුහුනලා  පිහිටි පදිංචියට සහ ව්‍යාපාරයට  ඉතා සුදුසු කෙසෙල් අඔ අැතුලු ඔනෑම වගාවන්  සුදුසු පර්චස් 110  ක  පමන ඉඩම  විකිණීමට ඇත....🛑✔️ ප්‍රදාන පාරට  මුහුණත පළල අඩි-70 .✔️පර්චස්- 110 ✔️හයිවේ පිවිසුමට -7 KM.✔️ ගුවන්තොටුපලට 20 KM✔️ හම්බන්තොට වරායට 8 ✔️සම්පූර්ණයෙන් ඉඩම ආවරණය වන සේ වැට ආවරණය කර ඇත.✔️ජල  විදුලි පහසුකම් .✔️ පදිංචියට නිවසක් අැත ✔️ ඕනෑම වාහනයක් ඇතුලු කල හැකිය .✔️.හම්බන්තොට  නගරයට  විනාඩි 10 න් 🔴🔴පර්චස්  1ක් සදහා රජයේ තක්සේරුව-රැ-750000/=🔴🔴🔥පිරිසිදු ඔප්පු හා බැoකු ණය සදහා අවශ්‍ය සියලු ලිපි ලේඛණ ඇත.,Hambanthota,Commercial,110.0 perches
21,වීරකැටිය වටිනා ඉඩම වහාම විකිණීමට,22 Jul 10:44 am,"Tangalla, Hambantota","110,000",වීරකැටිය නගරයට  මීටර් 600 දුරින් රන්න ප්රධාන මාර්ගයට මීටර් 50ක් ඇතුලතින් ඇති ඉඩම ඉක්මනින්ම විකිණීමට තිබේ. නල ජලය තෙකලා විදුලිය හා මාර්ග පහසුකම් ඇත.,Residential,14.0 perches,
22,Lagoon View Land for Sales - Tangalla,20 Jul  9:22 am,"Tangalla, Hambantota","4,000,000","Commercial Value Land in kahadamoder  Southern SL 1 acres bare land with  facing lagoon    . 200 feet lagoon   frontage. 10 km to Ranna town, 4 km to beach , 15 km to  tangool  highway enter   . Land suitable for commercial operation including HOTEL ,RESIDENT ,CABANAS  etc. Price expected 4.M  but negotiable. Call for images and plan.",Kahadamoder,Commercial,160.0 perches
23,Land For Sale - Tissamaharama,19 Jul  4:33 pm,"Tissamaharama, Hambantota","79,000",Land For Sale In Tissamaharama==========================,Tissamaharama,"Commercial, Residential",80.0 perches
24,Land For Sale in Tangalla,18 Jul  4:41 pm,"Tangalla, Hambantota","3,500,000",Land For Sale In Tangalla(Sitina Maluwa)170m away from Tangalla - Beliaththa main roadNear Tangalla Ruhunu Wijeyabha School2.5km to Tangalla Junction,Residential,14.0 perches,
25,Land for Sale at Kahandamodara ( Hambanthota),18 Jul  3:48 pm,"Tangalla, Hambantota","2,500,000","Two and Half acres land for sale. Scenic,calm and quite.facing Kahanadamodara lagoon. Two hour drive from colombo.  2.5 Million per acres. Ideal for tourism or Agriculture. urgent sale.",Agricultural,2.5 acres,
26,Land Thissamaharaya,17 Jul  6:02 pm,"Tissamaharama, Hambantota","1,600,000","තිස්සමහාරාම- කතරගම ප්‍රධාන පාරට මුහුනලා ඇති මෙම  පර්චස් 20  ඉඩම ඉතා ඉක්මනින් විකිණීමට ඇත. (නිරවුල්  සින්නක්කර ඔප්පු සහිතයි.) පර්චස් එකක් රුපියල් 80,000 කි. විදුලිය, ජලය, හා දුරකථන  ලබාගත  හැක. කතරගමට 5km දුරින්ද, තිස්සමහාරාමයට 8km  ක් ද දුරින් පිහිට ඇත. බැංකු ණය පහසුකම් ලබාගත හැක.",Thissamaharamaya,Commercial,20.0 perches
27,Land Foe Sale in - Beliatha,18 Jul 10:10 am,"Beliatta, Hambantota","70,000",Very Valuable PropertyUrgent Requirement Call for More Deails,Godakumbura Beliatha,Residential,30.4 perches
28,Land in Ranna,15 Jul 12:42 pm,"Tangalla, Hambantota","300,000","පර්චසය රුපියල් 300,000/- සිට පහසුකම්_-ජලය - - විදුලිය - - පුළුල් පිවිසුම් මාර්ග - - පදිංචියට වඩාත් සුදුසු නිස්කලංක පරිසරය - - පිරිසිදු ඔප්පු -වැඩි විස්තර සඳහා අමතන්න. Can take 10 perches as well රන්න පන්සල් හන්දිය අසල","Commercial, Residential",70.0 perches,
29,1 Acer Bare Land for Sale Tissamaharama, 8 Jul 12:43 pm,"Tissamaharama, Hambantota","20,000,000","1 ACER BARE LAND FOR SALE TISSAMAHARAMA KATHARAGAMA MAIN ROAD ROAD. 200 METERS TO TELE GAMANAYA WITH ALL FACILITIES, BUS ROUTE, 6 KM FOR KATHARAGAMA .",TISSAMAHARAMA KATHARAGAMA MAIN ROAD,"Commercial, Residential, Other",1.0 acres
30,Mango Coconut Land for Sale in Gonnoruwa,16 Jul  4:54 pm,"Ambalantota, Hambantota","1,500,000",🛑හම්බන්තොට මත්තල -පාර සිට 500 m  දුරින් කෘෂිකර්මාන්තයට ඉතා සුදුසු කෙසෙල්' අඔ සහ පොල්  අැතුලු අඔ  වගාව  සමග  අක්කර 5 ක ඉඩම  කෘෂිකර්මාන්ත කටුයුතු සදහා විකිණීමට ඇත....🛑✔️ පාරට  මුහුණත පළල අඩි-300 .✔️පර්චස්- 800 ✔️හයිවේ පිවිසුමට -7 KM.✔️ ගුවන්තොටුපලට 15 KM✔️ ඉඩම වවා අැත✔️සම්පූර්ණයෙන් ඉඩම ආවරණය වන සේ වැට ආවරණය කර ඇත.✔️ජල  සහ විදුලිය පහසුකම් .✔️ අඔ ගස් සදහා  කාලය 3 වසර ✔️ ඕනෑම වාහනයක් ඇතුලු කල හැකිය .✔️අන්පොල්සු වරගයේ අඔ ගස් 150 පමන අැත 🔴🔴 අඔ ව්‍යප්‍රතිය සදහා අපේක්ශිත  මුලු වියදම -රැ -7.5 මිලියන /= හෝ ආසන්නව .🔴🔴🔴🔴 අඔ ව්‍යප්‍රතියේන් වසර 3ට පසු අාදායම -රැ-6 මිලියන /=හෝ ආසන්නව බලාපොරොත්තු වේ.🔴🔴,Hambanthota,"Agricultural, Commercial",5.0 acres
31,ඉඩමක් විකිණීමට - තිස්සමහාරාමය,15 Jul 12:39 pm,"Tissamaharama, Hambantota","75,000",පන්නගමුව වැවට මායිම්ව සුන්දර වටපිටාවක පවතින පර්චස් 116ක ඉඩමක් විකිනීමට ඇත. මෙය පන්නගමුව වැවට මුහුණලා පිහිට තිබේ. මත්තල ගුවන්තොටුපලට 15KM පමණ ඇත. තිස්සමහාරාම නගරයටද ඉක්මනින් ලගාවිය හැක. වැඩිම ඉල්ලුමට විකුණනු ලැබේ.බලපත්‍ර සහිත වේ.,"No.297/8 , Gatamanna Gedara , 17 , Pannegamuwa, Weerawila.",Commercial,116.0 perches
32,Mango Coconut Land for Sale in Gonnoruwa,16 Jul  4:54 pm,"Ambalantota, Hambantota","1,500,000",🛑හම්බන්තොට මත්තල -පාර සිට 500 m  දුරින් කෘෂිකර්මාන්තයට ඉතා සුදුසු කෙසෙල්' අඔ සහ පොල්  අැතුලු අඔ  වගාව  සමග  අක්කර 5 ක ඉඩම  කෘෂිකර්මාන්ත කටුයුතු සදහා විකිණීමට ඇත....🛑✔️ පාරට  මුහුණත පළල අඩි-300 .✔️පර්චස්- 800 ✔️හයිවේ පිවිසුමට -7 KM.✔️ ගුවන්තොටුපලට 15 KM✔️ ඉඩම වවා අැත✔️සම්පූර්ණයෙන් ඉඩම ආවරණය වන සේ වැට ආවරණය කර ඇත.✔️ජල  සහ විදුලිය පහසුකම් .✔️ අඔ ගස් සදහා  කාලය 3 වසර ✔️ ඕනෑම වාහනයක් ඇතුලු කල හැකිය .✔️අන්පොල්සු වරගයේ අඔ ගස් 150 පමන අැත 🔴🔴 අඔ ව්‍යප්‍රතිය සදහා අපේක්ශිත  මුලු වියදම -රැ -7.5 මිලියන /= හෝ ආසන්නව .🔴🔴🔴🔴 අඔ ව්‍යප්‍රතියේන් වසර 3ට පසු අාදායම -රැ-6 මිලියන /=හෝ ආසන්නව බලාපොරොත්තු වේ.🔴🔴,Hambanthota,"Agricultural, Commercial",5.0 acres
33,Eco Land for Sale - Ambalanthota,14 Jul  9:47 pm,"Ambalantota, Hambantota","75,000",🛑අම්බලන්තොට  - බැරගම  -පාරට  මුහුනලා  තිබෙන මෙම කෘෂිකර්මාන්තයට ඉතා සුදුසු  නිසල පරිසරයක  පිහිටි  පදිංචියට සුදුසු ඔනෑම හොටෙල් ව්‍යාප්‍රතියකට ඉතා සුදුසු  මෙම  ඉඩම විකිණීමට ඇත....🛑✔️ කුඔුරට  මුහුණත පළල අඩි1500 .✔️පර්චස්- 160 ✔️හයිවේ පිවිසුමට -7 KM.✔️ ගුවන්තොටුපලට 23 KM✔️වැවකට සහ  කුඔුරට මුහුන ලා ✔️සම්පූර්ණයෙන් ඉඩම ආවරණය වන සේ වැට ගසා  ආවරණය කර ඇත.✔️ජල  විදුලි  පහසුකම් .✔️ ඕනෑම වාහනයක් ඇතුලු කල හැකිය .✔️.ව්‍යප්‍රතිය් ස්භාවය   commercial  ,Ambalantota,"Agricultural, Commercial, Residential",160.0 perches
34,සුරියවැව ඉඩමක් විකිනීමට,14 Jul  8:20 pm,"Hambantota, Hambantota","6,000,000",සුරියවැව ඉඩමක් විකිනීමට,muwanpalassa sooriyawewa,Residential,30.0 perches
35,Land for sale in Ambalantota,15 Jul 11:25 am,"Ambalantota, Hambantota","16,000","පිරිසිදු ඔප්පු.ජල විදුලි පහසුකම්.ඉඩම පිටුපසින් ඇළ මාර්ගය.කොළඹ,කතරගම ප්‍රදාන මර්ගයට 900 m.","පින්ගම,අම්බලන්තොට","Agricultural, Commercial, Residential, Other",410.0 perches
36,Coconut Land For Sale In Weeraketiya,14 Jul 12:43 pm,"Tangalla, Hambantota","7,500,000",Coconut Land For Sale in Weeraketiya.,Agricultural,1.0 acres,
37,Agriculture Farm for Sale - Gonnoruwa,14 Jul  8:49 am,"Hambantota, Hambantota","4,500,000",🛑හම්බන්තොට මත්තල -පාර සිට 1 km  දුරින් කෘෂිකර්මාන්තයට ඉතා සුදුසු කෙසෙල් අඔ අැතුලු ඔනෑම වගාවන් සදහා අක්කර 3 ක ඉඩම වගාව සමග කෘෂිකර්මාන්ත කටුයුතු සදහා විකිණීමට ඇත....🛑✔️ අැලට මුහුණත පළල අඩි-400 .✔️පර්චස්- 480 ✔️හයිවේ පිවිසුමට -7 KM.✔️ ගුවන්තොටුපලට 2 KM✔️හතරැස් ඉඩමකි✔️සම්පූර්ණයෙන් ඉඩම ආවරණය වන සේ වැට ආවරණය කර ඇත.✔️ජල පහසුකම් .✔️  වගා ව්‍යප්‍රතියේ කාලය 3 වසර ✔️ ඕනෑම වාහනයක් ඇතුලු කල හැකිය .✔️.අඩි 20 පුර්න මාර්ග පහසුකම් 🔴🔴ව්‍යප්‍රතිය සදහා අපේක්ශිත මුලු වියදම -රැ - 4500000  /= හෝ ආසන්නව .🔴🔴🔴🔴 ව්‍යප්‍රතියේන් වසර 3ට පසු අාදායම -රැ-60 මිලියන /=හෝ ආසන්නව බලාපොරොත්තු වේ.🔴🔴🔴🔴අකකර 1ක් සදහා රජයේ තක්සේරුව-රැ-2000000/=🔴🔴🔥පිරිසිදු ඔප්පු හා අවශ්‍ය සියලු ලිපි ලේඛණ ඇත.🔥ව්‍යප්‍රතියේන් වසර 3ට පසු සුද්ද ලාභය රැ -2500000,Hambanthota,Agricultural,3.0 acres
