,0,1,2,3,4,5,6,7,8,9
0,title,posted date,location,price,description,Address:,Beds:,Baths:,House size:,Land size:
1,"House for Rent in Galle - Kalegana , Mampitiya",10 Jul  9:46 pm,"Galle, Galle","22,500",Newly Built two bed rooms house. pantry and one bath room. Parking Facility available.3 Km to Richmond and Rippon College. 3.5 Km Mahinda Collage.  5km To Galle Town. 5Km to Karapitiya Base Hospital,Wataraka Road. Mampitiya,2,1,"1,200.0 sqft",8.0 perches
2,"['House for Rent in Galle - Kalegana , Mampitiya', '10 Jul  9:46 pm', 'Galle, Galle', '22,500', 'Newly Built two bed rooms house. pantry and one bath room. Parking Facility available.3 Km to Richmond and Rippon College. 3.5 Km Mahinda Collage.  5km To Galle Town. 5Km to Karapitiya Base Hospital', 'Wataraka Road. Mampitiya', '2', '1', '1,200.0 sqft', '8.0 perches']","['title', 'posted date', 'location', 'price', 'description', 'Address:', 'Beds:', 'Baths:', 'House size:', 'Land size:']",,,,,,,,
3,House for Rent Galle Kalahe Wanchawala,17 Jul  1:34 pm,"Galle, Galle","30,000","2 story house is for rent Galle kalahe Wanchawala2 Bed rooms with attached bathrooms in upstairs with A/C , Hot water T.V setting area with big balcony Beautiful Paddy field view Surrounded by a wall and gates Security system available in Down floor 1 big bed room with fansseparate 1 small room with bathroom dining room with kitchen Fully tiled parking available for 2 vehicles All the facilities are available with furniture or without furniture 2 and half kilometer to Unawatuna beach 35 for without furniture 50 for with furniture Call for more information වෙල්යායට මුහුණලා පිහිටි අගනා දෙමහල් නිවස බදු දීමට ඇතගෘහ උපකරණ සමග හෝ නොමැතිවඉහල මාලයේ නිදන කාමර 2යි ඇටෑච් බාත් රූම් 2යිවිශාල සාලය සහ බැල්කනියපහල මාලයේ විශාල කාමර 1යි කුඩා කාමර එකයි බාත් රූම් 1යිකෑම කාමරයයිමුළුතැන්ගෙයයිසම්පූර්ණයෙන් ටයිල් අල්ලා ඇතගෘහ උපකරන රහිතව 35කිගෘහ උපකරන සහිතව 50කිවාහන 2ක් නැවත්විය හැකආරක්ෂක කැමරා පද්ධති ක්‍රියාත්මකව ඇතවටේට තාප්ප සහ ගේට්ටු දමා ඇතවැඩි විස්තර සඳහා විමසන්න","Kalahe, Wanchawala, Galle",3,3,"2,000.0 sqft",12.0 perches
4,House for Rent in Galle,20 Jul  3:10 pm,"Karapitiya, Galle","35,000","Newly constructed house for rentLooking for genuine familyLocated in karapitiya area and very close to general hospital (600m)there are two houses Ground and 1st floor.Ground - 40,000 LKR per month1st floor - 35,000 LKR per monthConstruction completed in last month including pantry, curtain, garden, fence wall and gate",Karapitiya,2,1,"1,400.0 sqft",10.0 perches
5,Jungle View House With Pool for Rent Galle,19 Jul 10:03 pm,"Galle, Galle","130,000","Cozy house for long term rent with swimming pool, designed by foreigners according to eu living standards, 3 bedrooms 2 bathrooms, furnished, fully equipped kitchen, ready to move in. Newly built roofed pavilion. Very nice trees, garden and jungle view. Very closed to Galle International College and Thomas Gall school ( 5-10 min. ) Price includes night watcher! WE ARE GOING TO SELL THE PROPERTY TOO.","Galle, Milliduwa",3,2,"2,500.0 sqft",27.0 perches
6,House For Rent - Galle,18 Jul 11:38 am,"Galle, Galle","75,000",Six Bed Rooms (Three are Air conditioned )Two Bathrooms + Servant BathroomFurnishedFully Equipped KitchenFully TiledHot WaterParking AvailableFor Long Term Rent,"4/31, Hirimbura Cross Road, Galle.",6,3,"3,000.0 sqft",12.0 perches
7,Up Stair of a House Suitable for Commercial Purposes Galle,18 Jul  9:44 am,"Galle, Galle","50,000","Fully tilled floor, equipped washroom. 4 bed rooms with one kitchen. Parking space available. separate water and electricity supply. ground floor entrance area also included. 2.8km from Galle town. Walking distance to Richmond, Sangamitta and Rippon college, beside wackwella road.",4,1,"1,650.0 sqft",16.0 perches,
8,House For Rent In Hikkaduwa,15 Jul 10:02 pm,"Hikkaduwa, Galle","60,000",Located in hikkaduwa tourism area.750m away from the hikkaduwa bus station & the railway station.Please Call for more details.,"John de silva mawatha,hikkaduwa",3,2,"1,064.0 sqft",11.0 perches
9,House For Rent In Karapitiya,12 Jul  5:46 pm,"Galle, Galle","30,000","Down stair of a newly constructed house with 3bed room,1 bath room,kitchen with pantry ,large living room,and 1 servants bath room ,parking space for two vehiclesclose to all leading school in galle town.walking distance to karapitiya hospital and to the constructing maternity hospital in Karapitiya and labuduwa HNDE","Karapitiya,Galle",3,1,"1,350.0 sqft",10.0 perches
10,House for Rent - Ambalangoda,12 Jul  5:08 pm,"Ambalangoda, Galle","30,000",1km for darmashoka college 600 m for dewananda college  1.5 km for Amblngoda town Cctv Wifi / internet Water Telephone Electricity Call for more information Thanks,No 7 R E DE SILVA ROAD AMBLNGODA,3,2,700.0 sqft,15.0 perches
11,Upstairs of A House Available for Rent. Karapitiya,12 Jul 11:07 am,"Karapitiya, Galle","20,000","•In Karapitiya, Godakanda•1.5 km to Karapitiya junction.•very decent and calm area.•Ideal for doctors,hospital staff and families.   ✓03 bed rooms.   ✓02 bath rooms.[01 attached]   ✓Living room.   ✓Balcony and roof top.[nice view]   ✓Seperate water and electricity bills.   ✓Two vehicles can be parked.   ✓Seperate entrance.•No brokers.",3,2,"1,100.0 sqft",12.0 perches,
12,House For Rent In Galle,12 Jul  5:23 am,"Galle, Galle","20,000",02 Bedrooms01 Attached BathroomKitchen with PantryClosed to Leading Schools (Mahinda/Richmond/Sangamitta)2 KM to Galle TownClam Environment,"No.24/A, Mahinda Mawatha, Bataganvila, Galle",2,1,"3,811.5 sqft",14.0 perches
13,House for Rent in Galle,11 Jul  8:14 pm,"Galle, Galle","43,000","2 storey housewalking distance to galle townpeaceful, safe neighborhood",saranankara rd Galle,3,2,"3,000.0 sqft",12.0 perches
14,දෙවන මහල බදු දිමට ඇත - අම්බලන්ගොඩ,11 Jul 10:25 am,"Ambalangoda, Galle","15,000",ප්‍රජාපතිය විද්‍යලය අසල තෙමහල් නිවසක වර්ග අඩි 850ක දෙවන මහල බදු දිමට ඇත.විමසන්න 🏚️🏚️🏚️🏚️🏚️🏚️,"wilegoda,ambalangoda",1,1,850.0 sqft,7.0 perches
15,Upstair House Rent - Dodanduwa,11 Jul  8:47 am,"Hikkaduwa, Galle","15,000","Furnished 2 bed room upstair house in a decent residential  area with bathroom,pantry along with dining area,living area and balcony","sri saranajothi mawatha,modara patuwatha,dodanduwa",2,1,"1,600.0 sqft",33.0 perches
16,House For Rent In Dangedara,11 Jul  1:56 am,"Galle, Galle","40,000",Special for Commercial purpose Suitable for Show room / Store / Tuition Classes / Residential ,4,1,"2,000.0 sqft",20.0 perches,
17,House for Rent Galle Minuwangoda,10 Jul  6:51 pm,"Galle, Galle","100,000","ගාලු නගරයෙන් දෙමහල් නිවස හා ඉඩම බදු දීමටප්‍රදාන නගර යෙන් 14 පර්ච් ගොඩනැගිල්ල හා ඉඩම.වියාපාර සදහාද සුදුසුයි.සාල 3 , නිදන කාමර 6 , කුස්සි 3, නාන කාමර 3.රථගාලප්‍රදාන පාසල් වලට මැදිව (මහින්ද,සංගමිත්ත,ඇලොසියස්,කොන්වන්ට්,විද්‍යාලෝක).ගාලු නගරයේ ඇති ප්‍රදාන අමතර පන්ති වලට ආසන්නව.නිවාස 3 ලෙස වෙන් වෙන්ව උවද බාවිතා කල හැකි ලෙස සකසා ඇත.ලමුන් සදහා බොඩිමක් ලෙසද බාවිතා කර හැකිය.(සංගමිත්ත)ජල විදුලි පහසුකම් ඇත.සියලු පහසුකම් සහිතයිවැඩි විස්තර සඳහා විමසන්නConvenient location is for rent out near Minuwangoda Junction GalleGood location for Office space, Quarters, ware house or a hostel All the facilities are available 6 Rooms 3 Kitchens 3 Bath rooms Parking available Garden available Separate access walking distance to Galle town andSituated face to Wackwella main Road Call for more information","Wackwella Road, Minuwangoda, Galle",6,3,"3,500.0 sqft",14.0 perches
18,For Rent a House in Galle,10 Jul  4:04 pm,"Galle, Galle","30,000","වරායට සහ අධිවේගී මාර්ගයට ඉතා ආසන්න මාගාල්ලේ නිවසක් බදු දීමට ඇත. ඉස්තෝප්පුවක් , නිදන කාමර 5ක්, කෑම කාමරයක්, නානකාමරයක් සහ සේවක වැසිකිළියක්,කුස්සියක් සහිතයි. මාසික කුළිය රු.30 000/- ක මුදලක් බලාපොරොත්තු වේ‍. බැලීම සදහා ඉරිදා දින උදෑසන 9.00- ප.ව 5.00 දක්වා පමණි. වැඩිදුර විස්තර සදහා අමතන්න","14/3,Sudharmarama Road,Magalle,Galle.",5,2,"1,500.0 sqft",80.0 perches
19,House for Rent Bataganwila,19 Jul  1:16 pm,"Galle, Galle","20,000",Single bedroom newly constructed home  for rent with spacious garden near Richmond and Mahinda colleges,"No.24, Thalagahahena lane, Bataganwila",1,1,"1,000.0 sqft",11.7 perches
20,House for Rent in Galle, 3 Jul  7:32 pm,"Galle, Galle","25,000","The house is 6km from Galle. The house is 1km away from Gintota Junction. Some furniture can be provided if needed. There are 2 bedrooms, living room, 1 bathroom, kitchen. Lovely surroundings.For more info =",505/22/G Thuparama mawawatha welipotimodara gintota,2,1,"1,500.0 sqft",9.0 perches
21,House for Rent - Karapitiya, 2 Jul 11:06 pm,"Karapitiya, Galle","25,000",කරාපිටිය මහ රෝහලට ඉතාමත් නුදුරිනි. අංග සම්පූර්ණ නිවසකි. වාහන දැමීමේ පහසුකම් ඇත.,2,1,"2,471.0 sqft",8.5 perches,
22,House for Rent at Thilakapura in Ambalangoda, 2 Jul  4:08 pm,"Ambalangoda, Galle","10,000",02 bed rooms01 bath room and servant toilet also06 km from Ambalangoda Walking distance ( 300 m )  Ambalangoda - Batapola bus route via Thilakapura 06 month key money,2,1,"1,200.0 sqft",15.0 perches,
23,Villa for Rent - Hikkaduwa,13 Jul  5:43 pm,"Hikkaduwa, Galle","125,000",For long term rent (2yr - 5yr),"No 22/3, John De Silva Mawatha, Baddegama Road, Wadugoda, Hikkaduwa",4,2,"2,000.0 sqft",20.0 perches
24,House for rent Galle, 1 Jul  4:43 pm,"Galle, Galle","18,000",House for rent Gall==============,3,1,"1,000.0 sqft",20.0 perches,
25,"House for Rent / Lease - Ahangama, Galle district",29 Jun  2:29 pm,"Ahangama, Galle","50,000","4 Bedrooms [ 2 A/C ]2 Bathrooms [ Attached & with Hot-water / Outdoor ]Large Living and Dining area [ Tiled floor & Fully furnished ]Modern pantry with Kitchen40 Perches land with parapet wall aroundAmple parking space with gardenPipe / Well water facilitySLT Facility3 Minute drive to Town, Beach, Food City,  Schools, BanksClose to HighwayRs. 50,000 per month [ Negotiable ]Recommended for Foreigners / Companies / Guest House / Holiday homeContact Viewing only by an appointment","168/A, Munidas Mw. Digaradda, Ahangama",4,2,"3,000.0 sqft",40.0 perches
26,Villa for Rent Unawatuna, 9 Jul  2:39 pm,"Galle, Galle","135,000",Pls contact more details Long term lease 5yrsSituated in Maharamba Road Unawatuna Unawatuna city center 1.7km Unawatuna beach 2.5kmUnawatuna railway station 1.9kmDalawella beach 1.9kmHighway entrance 5kmGalle town 6.5km,3,3,"2,500.0 sqft",45.0 perches,
27,House for Rent in Nakiyadeniya Galle,10 Jul 12:47 pm,"Galle, Galle","80,000","A house situated on a hill in the village with 4 bed rooms (2 rooms AC) ,  kitchen and pantry ,  bath room ,  living room and dining room , An open varendah , 24km to Galle city , 27km to Unawatuna beach / Jungle beach , 10km to Kanneliya rain forest , 5km to Kottawa rain forest .",4,1,"2,000.0 sqft",160.0 perches,
28,House for Long Term Rent in Ahangama,25 Jun  2:27 pm,"Ahangama, Galle","20,000",House for long time rent (10 years) in Ahangama - only for tourism,"Pelessa, Ahangama",4,4,"1,500.0 sqft",25.0 perches
29,House for Rent Galle Kalahe Wanchawala,17 Jul  1:34 pm,"Galle, Galle","30,000","2 story house is for rent Galle kalahe Wanchawala2 Bed rooms with attached bathrooms in upstairs with A/C , Hot water T.V setting area with big balcony Beautiful Paddy field view Surrounded by a wall and gates Security system available in Down floor 1 big bed room with fansseparate 1 small room with bathroom dining room with kitchen Fully tiled parking available for 2 vehicles All the facilities are available with furniture or without furniture 2 and half kilometer to Unawatuna beach 35 for without furniture 50 for with furniture Call for more information වෙල්යායට මුහුණලා පිහිටි අගනා දෙමහල් නිවස බදු දීමට ඇතගෘහ උපකරණ සමග හෝ නොමැතිවඉහල මාලයේ නිදන කාමර 2යි ඇටෑච් බාත් රූම් 2යිවිශාල සාලය සහ බැල්කනියපහල මාලයේ විශාල කාමර 1යි කුඩා කාමර එකයි බාත් රූම් 1යිකෑම කාමරයයිමුළුතැන්ගෙයයිසම්පූර්ණයෙන් ටයිල් අල්ලා ඇතගෘහ උපකරන රහිතව 35කිගෘහ උපකරන සහිතව 50කිවාහන 2ක් නැවත්විය හැකආරක්ෂක කැමරා පද්ධති ක්‍රියාත්මකව ඇතවටේට තාප්ප සහ ගේට්ටු දමා ඇතවැඩි විස්තර සඳහා විමසන්න","Kalahe, Wanchawala, Galle",3,3,"2,000.0 sqft",12.0 perches
30,"House for Rent in Galle - Kalegana , Mampitiya",10 Jul  9:46 pm,"Galle, Galle","22,500",Newly Built two bed rooms house. pantry and one bath room. Parking Facility available.3 Km to Richmond and Rippon College. 3.5 Km Mahinda Collage.  5km To Galle Town. 5Km to Karapitiya Base Hospital,Wataraka Road. Mampitiya,2,1,"1,200.0 sqft",8.0 perches
31,House For Rent In Galle,23 Jun  5:58 pm,"Galle, Galle","45,000","A house near to Landawa Junction, Kalegana. 1.5 KM to Richmond College and all other main national colleges with in 2.5 KM. 05 bed rooms including 01 bed room with AC. Living area, Dining area, Pantry kitchen and 02 wash rooms. 01 outside wash room and parking facility for 02 vehicles.",5,2,"2,200.0 sqft",11.0 perches,
32,House for Rent Galle,30 Jun  8:14 am,"Galle, Galle","65,000",Fully furnished house for rent.*  4Bed rooms (2rooms A/C)/living area/dining area/kitchen/open verandah/bathroom with hot water and a washing machine.*  Spacious front garden / parking area.*  Spacious back garden surrounded by trees and a well (well water also available.)*  Calm &amp; quite area/good neighborhood.*  10 minutes to Galle town *  15 minutes to Galle International College/ 5 minutes to southern express way exit (Pinnaduwa)/5 minutes to beach.*  5 minutes to Arpico Super Center &amp; liquor shop.*  Price is negotiable.can talk with us.*  Parapet wall.*  Place can be found at Airbnb as White House in Galle*  Foreigners are especially welcome.*  Very convenient location.  *  Call for more information.,4,2,"2,800.0 sqft",22.0 perches,
33,Upstairs House for Rent - Galle,21 Jun  7:56 pm,"Galle, Galle","25,000",Two room with air condition One bathroom PantryLiving areaBalcony Peo TVWifiWith furniture or without furniture Fully tiledSeparate entrance Facing for galle colombo main roadParking25000 for without furniture 35000 for with furniture Call for more information,2,1,"1,200.0 sqft",20.0 perches,
34,House for Rent in Karapitiya,29 Jun  9:04 am,"Karapitiya, Galle","35,000",Near the Karapitiya Hospital (800m) & pinnaduwa expressway entrance,"3rd lane, maitipe,karapitya",2,1,"1,200.0 sqft",30.0 perches
35,House for Rent in Bentota,19 Jun  1:28 pm,"Bentota, Galle","24,000","House for rent bentotaLiving room2 bedrooms bathroom and a pantry. Calm and quiet place with a garden. Very close to the Aluthgama town 3KmNearby hotels, beach Dedduwa river, and market.",Gomate Bentota,2,1,"1,800.0 sqft",55.0 perches
36,House for Rent in Galle, 5 Jul  2:24 pm,"Galle, Galle","20,000",FIRST FLOOR FOR RENT WITH1)3 Bedroom 2)1 Bathroom 3)A kitchen and a living room with a balcony. 4)Separate entrance to the house5)Six months advanced payment  is required,"NO 136A, edirisinghe mawatha, kithulampitiya",3,1,"1,500.0 sqft",20.0 perches
37,House for Rent Galle Kalahe Wanchawala,17 Jul  1:34 pm,"Galle, Galle","30,000","2 story house is for rent Galle kalahe Wanchawala2 Bed rooms with attached bathrooms in upstairs with A/C , Hot water T.V setting area with big balcony Beautiful Paddy field view Surrounded by a wall and gates Security system available in Down floor 1 big bed room with fansseparate 1 small room with bathroom dining room with kitchen Fully tiled parking available for 2 vehicles All the facilities are available with furniture or without furniture 2 and half kilometer to Unawatuna beach 35 for without furniture 50 for with furniture Call for more information වෙල්යායට මුහුණලා පිහිටි අගනා දෙමහල් නිවස බදු දීමට ඇතගෘහ උපකරණ සමග හෝ නොමැතිවඉහල මාලයේ නිදන කාමර 2යි ඇටෑච් බාත් රූම් 2යිවිශාල සාලය සහ බැල්කනියපහල මාලයේ විශාල කාමර 1යි කුඩා කාමර එකයි බාත් රූම් 1යිකෑම කාමරයයිමුළුතැන්ගෙයයිසම්පූර්ණයෙන් ටයිල් අල්ලා ඇතගෘහ උපකරන රහිතව 35කිගෘහ උපකරන සහිතව 50කිවාහන 2ක් නැවත්විය හැකආරක්ෂක කැමරා පද්ධති ක්‍රියාත්මකව ඇතවටේට තාප්ප සහ ගේට්ටු දමා ඇතවැඩි විස්තර සඳහා විමසන්න","Kalahe, Wanchawala, Galle",3,3,"2,000.0 sqft",12.0 perches
38,House for Rent in Galle,17 Jun 12:10 pm,"Galle, Galle","30,000","කරාපිටිය රෝහල සමීපයේ ගොඩකන්ද - උළුවිටිකේ මාර්ගයේ පැල්පොල වත්ත මංසන්ධියේ ඇනෙක්සියක් බදුදීමට  ඇත. ඉස්තෝප්පුවක්, සාලයක්, නිදන කාමර 02ක්, කෑම කාමරයක්, නානකාමරයක්, කුස්සියක් සහ සේවක වැසිකිලියක් සහිතයි. මාසික කුලිය රු.30,000 කි.","Godakanda Road, Karapitiya, Galle.",2,1,"2,500.0 sqft",34.0 perches
39,House for Rent in Galle, 4 Jul  9:21 am,"Galle, Galle","27,000","Newly build house for Rent.3 bed rooms bathroom with hot water and servant bathroom separate.Modern kitchen,Remote door vehicle parking 13ft around the wall.Upstair till not completed and empty aria can used, 15 min to Galle town and 5 min to Galle road.",No.147/B Ukwattha Gintota,3,2,"1,032.0 sqft",11.0 perches
40,House for Rent in Karapitiya (Near hospital),15 Jun 12:22 pm,"Karapitiya, Galle","25,000","House for rent near karapitiya hospitalInclude garage, veranda, veranda room","'Mahilal', Godakanda",3,1,"2,000.0 sqft",15.0 perches
41,House for Rent Heenatigala Road Unawatuna,13 Jun  7:24 am,"Galle, Galle","50,000","House for Rent in Unawatuna for Foreigners. Rs. 50,000/ month. 4 Bedroom house with beautiful garden. Located in Tourist attraction area.3 km to Galle town.1 km to Unawatuna Beach1.5 km to Jungle Beach.",Unawatuna,4,1,950.0 sqft,20.0 perches
42,House for Rent in Galle,12 Jun  6:17 pm,"Galle, Galle","60,000","Vehical Garage, Garden, Located in Kalhe TownNear Peoples Bank, Post Office5 minutes to Highyway Entrance15 Minutes to Unawatuna Beach5 Munites to Galle Matara Road","Malagoda, Kalahe, Wanchawala",3,4,"7,500.0 sqft",25.0 perches
43,"House For Rent Near Richmond, Galle",11 Jun 11:46 am,"Galle, Galle","50,000",5 bedroom house for rent near richmond hill stationBetween the station And richmond college5 bedroom ( 4 bedrooms with attached bathrooms)Garage and storage availableLarge hall and kitchen2 km from galle city and dutch fortFurnished or unfurnished,Richmond Hill Station,5,4,800.0 sqft,35.0 perches
44,House for Rent - Galle,11 Jun  8:30 am,"Galle, Galle","16,500","The house is located at milidduwa, galle consist of 03 bed rooms including a visitor room, veranda, living area, dining area and a kitchen with pantry.2.0 km from Karapitiya Hospital 2.5 km from Galle towncalm environment to live.",3,2,"1,400.0 sqft",17.0 perches,
45,House for Rent with Garage and Garden in Ambalangoda,15 Jun  3:55 pm,"Ambalangoda, Galle","150,000","This beautiful House FOR SALE was built in 1996 and is located in  Ambalangoda only 3 minutes by walking to Ambalangoda Railway and bus stand. The beach is 10 minutes walk away. The well maintained house is located on a quiet street without traffic and is very suitable for families. Ambalangoda is famous for its College ""Dharmasoka"", it is 10 minutes away from the house.Facilities: 2 kitchen: 1 kitchen is traditionally Sinhalese, the other kitchen is European style and was only renovated 3 years ago.There is a spacious living & dining room.The unique doors are handmade in traditional Sinhala style from carpenter. Spacious veranda with little garden on the sides. There is a garden behind the kitchen with an outside shower and a garden at the front of the house with a mango tree. There is also a washing machine in the house.Each room has a ceiling fan.",Ambalangoda,3,1,"1,500.0 sqft",15.5 perches
46,House for Rent in Galle,10 Jun  5:31 pm,"Galle, Galle","60,000","Akurassa Rd,Kaduruduwa,Galle Opposite in the Kaduruduwa temple Home - 3 bed rooms, Kitchen, varendah, 2 Bath rooms(with hot water), Small garden","Kaduruduwa, Galle",3,2,800.0 sqft,16.0 perches
47,House for Rent in Galle,10 Jun  3:01 pm,"Galle, Galle","25,000","Upper floor with Living,2 Bed rooms, Pantry, Bathroom & Large Balcony. Calm surroundings. Better for a family. Car Parking space available. 150m to Galle-Colombo road at Mahamodara.","Mahamodara, Galle.",2,1,"1,100.0 sqft",12.0 perches
48,House For Rent In Galle,10 Jun  9:30 am,"Galle, Galle","21,000",ගාල්ල සංඝමිත්තා / මහින්ද ප්‍රධාන පාසල් වලට යාබදව රිච්මන්ඩ් විදුහල ආසන්නයේ අනෙක්සියක් බදු දීමට,"Richmond Hill rd,Galle",2,1,600.0 sqft,10.0 perches
49,House For Rent In Galle,20 Jul 11:22 am,"Galle, Galle","21,500","Semi furnished Fully tiled House in upstair with bedrooms bathroom, pantry and extra toilet available for rent in Galle.For a decent family or couple.Suitable even for an office.Covered Parking available in ground floor.Only 1 km to heart of the city. Facing a main bus route.Walking distance to Richmond, Sangamitta and Aloysius colleges.Please call for more details.",3,1,950.0 sqft,16.0 perches,
50,House for Rent Galle Dangedara,24 Jun  2:56 pm,"Galle, Galle","50,000",Newly built / fully tiled / fully furnished house for rent. 2 Bed rooms (one room A/C)/living area/dining area/kitchen/open verandah/attachedbathroom with hot water/roof terrace. Spacious front garden for play/ parking more than 4 vehicles. Spacious back garden surrounded by trees and a well (well water also available.) Calm &amp; quite area/good neighborhood. 1.5km to Galle town ( 5min ride by a bike or tuk tuk) 2.5km to karapitiya teaching hospital/2.5km to ancient Galle fort/5km to unawatuna beach. 500m to UGK mahagedara food city &amp; liquor shop. Need 3 month key money. Parapet wall.,Dangedara Galle,2,1,"1,500.0 sqft",20.0 perches
51,Upstairs House for Rent in Galle, 6 Jun  4:07 pm,"Galle, Galle","35,000",4 Bedrooms 2 Bathroomsbalcony car parkNeed six months advanced,117/2 ananda mawatha galle,4,2,"1,434.0 sqft",15.0 perches
52,Up stair House for Rent in Galle, 6 Jun  8:23 am,"Galle, Galle","18,000","Fully tiled house, Kitchen with pantry, Bathroom with Hot water shower, Separate entrance, Parking Available",2,1,"1,500.0 sqft",10.0 perches,
53,House for Rent at Galle, 4 Jun 10:27 am,"Galle, Galle","50,000","A house with a Kitchen, 2 tiled wash rooms, living area, dining area, store room and 4 bed rooms are available for rent at Galle town, with 450m to the Galle bus stand. House located at the galle prison road, adjacent to st aloysius college (100m), and Convent college (200m) and at walking distance to Southlands college (950m).",4,2,"2,050.0 sqft",4.5 perches,
