,0,1,2,3,4,5,6,7
44,05 Acres Lana in Badulla, 3 Jul  9:14 am,"Badulla, Badulla","9,000,000","බදුල්ල මහනුවර ප්‍රධාන පාරට මුහුණලා අක්කර 2ක හා 3ක ඉඩම් කැබලි දෙකක් හදිසියේ විකිණිමට ඇත. ඉඩම් පිටුපසින් බදුලු ඔය ගලා බසී. හොටලයක් සදහා විශේෂයි. ඉඩම තුල ගම්මිරිස්, අඹ, සියබලා, කොස් ගස් වලින්ද, පෑල් 1 1/2ක කුඹුරක් ද, දිය උල්පතක්ද සහිතයි. ඉඩමේ ඉදිරි පසින් ප්‍රධාන මාර්ගය","Agricultural, Commercial",3.0 acres,
45,Land for Sale - Bandarawela, 3 Jul  7:47 am,"Bandarawela, Badulla","550,000","@ බණ්ඩාරවෙල නගරයට මිටර් 500යි. @ බස් නැවතුමිපොල, දුමිරිය ස්ථානය ආසන්නයි. @ බණ්ඩාරවෙල නාගරික සීමාවෙ ඉඩම පිහිටා අැත. @ සිංනක්කර ඔප්පු, අනුමත ප්ලෑන්. ,NBRO අනුමැතිය. @ ඉඩමට අඩි 12 පලල පාර, විදුලිය, දුරකථන පහසුකමි. @ පර්චසය රු. 550000යි.",අඔතැන්නවත්ත බණ්ඩාරවෙල,"Commercial, Residential",7.2 perches
46,10P Lands for Sale in Welimada, 2 Jul  4:41 pm,"Welimada, Badulla","90,000",Property details★ වැලිමඩ නගර ආසන්නයෙන් ★ ඉඹුල්ගස්සින්න ප්‍රධාන බස් මාර්ගයේ★ පර් : 10 සුපිරි බිම් කොටස්,"SENHAS Property Sales(Pvt)Ltd, Imbulgassinna Rd,Welimada.","Agricultural, Commercial, Residential, Other",10.0 perches
47,Land for Sale - Ella,10 Jul  8:30 am,"Ella, Badulla","450,000","@ ඇල්ල හංදියේ සිට වැල්ලවාය පාරේ කිලෝමිටර් 2යි. @ දර්ශණීය නිස්කලංක පරිසරය. @ සිංනක්කර ඔප්පු, ප්ලෑන් ඇත. @ ඉඩමටම අඩි 12 පලල පාර, නල ජලය, විදුලිය, දුරකථන පහසුකමි.  @ සංචාරක හෝටලයක් ඉදිකිරීමට කදිමයි. @ පර්චසය රු. 450000 @ නියම ගැණුමිකරුවන් පමණක් අමතන්න.",රාවණාඇල්ල අැල්ල,Commercial,104.0 perches
48,Land for Sale - Ella, 2 Jul  8:28 am,"Ella, Badulla","350,000","@ ඇල්ල නගරයේ සිට කිතල්ඇල්ල පාරේ කිලෝමිටර් 2යි. @ දර්ශණීය නිස්කලංක පරිසරය. @ ඉඩමටම අඩි 12 පලල පාර, විදුලිය, නල ජලය, දුරකථන පහසුකමි. @ සංචාරක හෝටලයක් ඉදිකිරීමට කදිමයි.  @ ජය භුමි ඔප්පු, ප්ලෑන් අැත. @ පර්චසය රු. 350000යි. @ නියම ගැණුමිකරුවන් පමණක් අමතන්න.",කිතල්ඇල්ල ඇල්ල,Commercial,10.0 perches
49,Land for Sale - Bandarawela,21 Jul  2:24 pm,"Bandarawela, Badulla","62,000","To bandarawela town 3km, flat land, water / Electricity,  very silence place, clear deed (Reg- 2015), suitable for holiday home, cash only (Many Urchant ) please contact.","Emputuwelpathana,Opadella,Bandarawela.",Residential,17.5 perches
50,Ideal Residential Land for Sale in - Bandarawela, 1 Jul  8:52 am,"Bandarawela, Badulla","3,500,000",2km from Bandarawela City (Muncipal Limit - 5 blocks availlable),Ellathota,Residential,10.0 perches
51,Land for sale - Haputale,29 Jun  7:36 pm,"Haputale, Badulla","250,000","@ හපුතලේ නගරයේ සිට මිටර් කැප්පෙටිපොල, බොරලන්ද පාරේ 150යි. @ සුන්දර දර්ශණීය පරිසරය. @ කාපටි පාරට මුහුණලා ඉඩම පිිහිටා අැත. @ සිංනක්කර ඔප්පු, ප්ලෑන් අැත. @ විදුලිය, නල ජලය, දුරකථන පහසුකමි අැත.  @ පදිංචියට, සංචාරක හෝටලටයකට කදිමයි. @ පර්චසය රු. 250000යි. @ නියම ගැණුමිකරුවන් පමනක් අමතන්න.","කැප්පේටිපොල, බොරලන්ද පාර හපුතලේ","Commercial, Residential",21.0 perches
52,Land for Sale in - Ella,12 Jul  2:57 pm,"Ella, Badulla","375,000",A Piece of Land with A View of The Scenic Beauty. Hospitality Climate. Ideal Land for Tourist Hotel the Word Deed of The Land 12 Feet Road Clean Well Water Tap Water Electricity and Slt Landline Facilities Mbro Certificate Available. Near the One Kilo Metres Ella Town.,"Ella, Halpe Road.","Agricultural, Commercial",57.0 perches
53,Ella City Area View Land for Sale in,12 Jul  2:40 pm,"Ella, Badulla","120,000","One of greatest view in Ella. Only 900 meters. (waking distance) to Ella city. Pnaromic view "" punch rawana water fall"".""little adams peck""  and can see railway as well.And other side mountains view. Can buy as","Commercial, Residential",12.0 perches,
54,Land for Sale Badulla, 8 Jul  9:40 pm,"Badulla, Badulla","600,000","* Badulla- municipal council * Badulla- Hanwella Road * 8 1/2 perches land - clear deeds * Incomplete house- covered by parapet wall * Flat land - middle class * Water, electricity, carpet road * Near to the Race Course Ground * Schools, banks, hospitals- close ",Badulla- Hanwella Road,Residential,8.5 perches
55,Land for Sale - Passara,27 Jun 12:48 pm,"Passara, Badulla","2,500,000","Cultivation - mixed cultivation such as pepper,coconut,ariconut,jack,plantain,coffee...ect.House details..Roof - corrugated iron sheeton swan timber frame workwalls - rubble & sundried masonry walls plastered & color washedfloor - cementeddoors - paneledwindows - timber frame paneledconveniences - electricity,well water service,asbestos ceiling,attached bath & toiletscondition  - fairaccommodations - sitting areas,dining,six bed rooms,kitchen,attached bath & latrines,store room,verandah floor area - 1929 square feetoccupier - owner","Disa niwasa,metigahathenna,passara","Agricultural, Commercial, Residential",2.0 acres
56,Land for Sale in Bandarawela,22 Jul  9:58 am,"Bandarawela, Badulla","120,000",Approximately 6.5 Km from Bandarawela TownNear to Malwaththa Aramaya and Aislabe Tea FactoryPerfect for residential Perfect place for cottage/bungalow/Holiday InnPeaceful area,Malwaththa,Residential,37.0 perches
57,Best Land for Sale Badulla, 8 Jul  9:40 pm,"Badulla, Badulla","600,000","* Badulla municipal council * 9 perches land - clear deeds * Flat land* Close to Race course ground* Land covered by parapet wall* Middle class * Water, electricity, carpet road ",Badulla- Race Course Ground Road,Residential,9.0 perches
58,Commercial Land for Sale in - Badulla,12 Jul  2:51 pm,"Badulla, Badulla","125,000","Waga kirimata,weladamata, padinchiya sadaha sudusu agana bim kotasaki. Jala pahasukam widuliya ha durakathana pahasukam sahithai. Pradhana parata muhuna la pihita atha.","""sumanasiri"",badulu oya,kandakatiya,badulla.",Commercial,160.0 perches
59,Best Land for Sale Badulla, 8 Jul  9:40 pm,"Badulla, Badulla","600,000","* Badulla municipal council * 9 perches land - clear deeds * Flat land* Close to Race course ground* Land covered by parapet wall* Middle class * Water, electricity, carpet road ",Badulla- Race Course Ground Road,Residential,9.0 perches
60,270 Perches bare land for sale in Haputale,25 Jun 10:22 pm,"Haputale, Badulla","115,000","270 Perches bare land for sale in Rathkarauwa, Haputale.","Agricultural, Commercial, Residential",270.0 perches,
61,Land for Sale - Bandarawela,25 Jun  6:16 pm,"Welimada, Badulla","4,000,000",වැලිමඩ බණ්ඩාරවෙල ප්‍රධාන පාරේ 50 m ක් පමණ දුරින් ඉඩම පිහිටා ඇත.(නාවෙල හංදියෙන් දකුණට ඇති කොන්ක්‍රීට් පාරෙන් 50 m පමණ දුරිනි )ඉඩමේ තේ වගා කර ඇති අතර නිවසක් සෑදීම සඳහා කොටසක් ඉතිර කර ඇත.පර්චස් එකක් රු.55000.ඉඩමේ මුලු වටිනාකම ලක්ෂ 40 වේ.,"Agathawaththa,Nawela,Mirahawaththa,Bandaraqela","Agricultural, Residential",67.0 perches
62,Valuable Land with House in Badulla,25 Jun  3:52 pm,"Badulla, Badulla","27,500,000","Valuable land of 10.97P for sale near Badulla Central College very suitable for commercial purpose. Quick access for Badulla Central college,Badulla Hospital, Badulla Town. Located in the main road. Price negotiate.","Commercial, Residential",10.97 perches,
63,40 Perches Land for Sale Badulla - Budugekanda Main Road,23 Jul  9:20 am,"Badulla, Badulla","1,650,000","විදුලි,ජල,වාහන පහසුකම් ඇත.ව්‍යාපාරික කටයුතු සදහා හා කෘෂි කර්ම කටයුතු සදහා  සුදුසු තැනිතලා පර්චස් 40 බිම් කොටසකි.සින්නක්කර ඹප්පු ඇත.බදුල්ල බුදුගේ කන්ද  ප්‍රධාන මාර්ගයට මුහුණලා පිහිටා තිබේ.බදුල්ල නගරෙය් සිට කි.මි.12 කි.(බදුල්ල සිට මහියංගන පාරේ මැඩි තලේ හංදියෙන් හැරෙන මාර්ගයයි.බසයෙන් විනාඩි 35 - 40 පමණ ගතවන අතර බයිසිකලයෙන් විනාඩි 15 - 20 න් බදුල්ල නගරයට ගමන් කල හැකිය)",Badulla - Budugekanda,"Agricultural, Commercial, Residential",40.0 perches
64,Land for Sale in Welimada,30 Jun  9:41 am,"Welimada, Badulla","220,000",Land for sale in welimada====================,Residential,12.5 perches,
65,අගනා තේ ඉඩමක් වැලිමඩ,23 Jun  1:32 pm,"Welimada, Badulla","4,900,000","ජලය ,විදුලිය  ,ඉඩමටම පාර සහිත අක්කර 2ක් වන තේ  ඉඩමට වැලිමඩ නගරයේ සිට දුර 2km.","Mahathanna,madagama,welimada",Commercial,2.0 acres
66,Valuable Land Plots for Sale in Badulla,16 Jul  8:22 am,"Badulla, Badulla","6,500,000","* Badulla- Mahiyanganaya main road* 3 1/2 km away from Badulla city * 1 acre land- clear deeds* 3/4 km to Dunhinda water fall* Best place for hotels* Water, electricity, road facilities * Valuable trees are available * Schools, banks, hospitals- close",Badulla- Mahiyanganaya Road,"Commercial, Residential",1.0 acres
67,Land for sale - welemada,21 Jun 11:09 pm,"Welimada, Badulla","5,500,000","@ වැලිමඩට කිලෝමිටර් 5යි. @ බණ්ඩාරවෙලට කිලෝමිටර් 17යි. @ වැලිමඩ බණ්ඩාරවෙල ප්‍රධාන පාරට මිටර් 800යි. @ දර්ශණීය නිස්කලංක පරිසරය. @ සිංනක්කර ඔප්පු, ප්ලෑන් අැත. @ ඉඩමේ පැරණි නිවසක් ඇත. @ ඉඩමටම අඩි 10 පලල පාර, විදුලිය, උල්පත් ජලය, දුරකථන පහසුකමි. @ ඉඩමෙි වටිනාකම රු ලක්ෂ 55යි. @ ඉඩම පරීක්ෂාකර මිල සාකචිජා කලහැක. නියම ගැණුම්කරුවන් පමණක් අමතන්න",කැටකෑල්ල යල්පත්වෙල වැලිමඩ,"Agricultural, Residential",336.0 perches
68,Land for Sale - Ella,21 Jun  8:13 pm,"Ella, Badulla","90,000","@ ඇල්ල හංදියේ සිට කිලෝමිටර් 3.8යි. @ සුන්දර නිස්ලංක පරිසරය. @ පදිංචියට, කුඩා නිවාඩු නිකේතනයකට කදිමයි. @ ඉඩමටම අඩි 10 පලල පාර, නල ජලය, විදුලිය, දුරකථන පහසුකමි ඇත. @ සිංනක්කර ඔප්පු, ප්ලෑන් ඇත. @ පර්චසය රු. 90000යි. @නියම ගැණුමිකරුවන් පමනක් අමතන්න.",10 කණුව හල්පේ ඇල්ල,"Commercial, Residential",13.8 perches
69,"අගනා බිම්කොටසක්,විකිනීිම සඳහා - මහියන්ගනය",21 Jun  1:48 pm,"Mahiyanganaya, Badulla","75,000","මහියංගන,සොරබොර මීගහපිටිය,අගනා බිම් කොටසක් විකිණීමට තිබේ.නේවාසික සඳහා ඉතා යෝග්‍යයයි.පිරිසිදු ඔප්පු.මහියංගන, නගරයට කිලෝමීටරයයි.නළ ජලය සහ විදුලිය සහිතයි.පර්චස් 20 ක ට වඩා ඉල්ලුම් කළ හැක.","සොරබොර,වැවපාර,මීගහපිටිය,මහියන්ගනය.",Residential,60.0 perches
70,Lamd for Sale - Bandarawela,19 Jun  9:54 pm,"Bandarawela, Badulla","130,000","@ බණ්ඩාරවෙල නගරයේ සිට කිලෝමිටර් 2.5යි. @ සුන්දර නිස්කලංක පරිසරය. @ ඉඩම මායිමෙන් ඔයක්, අමුණක්, දුමිරිය පාලමක් ඇත. @ ඉඩමට අඩි 12 පලල පාර, විදුලිය, ලිං ජලය, දුරකථන පහසුකමි අැත.  සිංනක්කර ඔප්පු, ප්ලෑන් ඇත. @ නිස්කලංකබව අගයන පරිසර හිතකාමියේකුට පදිංචියට කදිමයි. @ නියම ගැණුමිකරුවන් පමනක් අමතන්න.",ඔබඩඇල්ල බණ්ඩාරවෙල,Residential,13.38 perches
71,Land with House in Bandarawela,19 Jun  6:08 pm,"Bandarawela, Badulla","7,800,000",Clear sinnakkara deedsSelling due to money urgentcall for more details,Kahagolla,Residential,21.0 perches
72,බණ්ඩාරවෙල අගනා ඉඩමක් විකිණීමට,27 Jun  2:40 pm,"Bandarawela, Badulla","375,000",බණ්ඩාරවෙල නගරයට ඉතා ආසන්නව ප්‍රධාන පාරට 250mපර්චස් 116 ක තේ වගා කළ අගනා ඉඩම සම්පූර්ණයෙන්ම හෝ කොටස් වශයෙන් විකිණීමට ඇත.නිවසක් හෝ සංචාරක හෝටලයක් ඉදිකිරීමට ඉතාම සුදුසු මනරම් සුන්දර පරිසරයක පිහිටා ඇත.ස්වභාවික ජල මාර්ග සහිත.වැඩි විස්තර සදහා අමතන්න.,"වරකාරොදවත්ත, බණ්ඩාරවෙල",Agricultural,116.0 perches
73,Land in Welimada Sappukade,16 Jul  2:21 pm,"Welimada, Badulla","285,000",Land in dimuthugama road sappukade100m to nuwaraeliya welimada main roadValuble land for saleවැලිමඩ සාප්පුකඩේ හන්දියේ දිමුතුගම පාරේ නුවරඑළිය වැලිමඩ ප්‍රධාන පාරට මීටර් 100ක් දුරින් පිහිටි පර්චස් 25ක තැනිතලා වටිනා ඉඩමක් විකිණීමට නළජලය තෙකලා විදුලිය සහිතයි,nuwaraeliya road Welimada,"Commercial, Residential",25.0 perches
74,Land for Sale in Badulla,15 Jun  2:32 pm,"Badulla, Badulla","6,500,000",Flat Land with newly built wall and Elcardo roller gate with 10year warranty. Has done the foundation for a house also. 200m for badulla town. And less than 100m for swimming pool . Facing main road. With resrvation 9 perches. Clean deed . URGENT SALE.,Green Lane Drive Badulupitiya Badulla,Residential,7.7 perches
75,Land for Sale in Karadagolla,18 Jul 10:15 am,"Ella, Badulla","45,000",💐විශාරි ඇල්ල හා රවණා ඇල්ල සහ මනහර කදු ☀️යායකින් වටවු නිස්කලංක පරිසරය 👌සංචාරක නිකේතනයක් ඉදිකිරිමට සුදුසු ස්ථායකි📍📍📍👉රාවණා ඇල්ලට කීලොමිටර් 12දුර🔖දැනට දෙස් විදෙස් සංචාරකයින් බහුලව  ගැවසන ස්ථායකි 👌 පිරිසිදු ඔප්පු ⛳ සීතල සෞම්‍ය පරිසරය 👉 ඉතා පිරිසිදු ජලය 👉ත්‍රී පෙස් විදුලිය 👌 කාපට් මර්ග පහසුකම් 👉 පර්චස් 1ක් රු. 45000/=කී☎️මිල ගනන් සකච්චාකල හැක 👊,"Hunukatiya Karadagolla,Ella","Commercial, Residential",80.0 perches
76,Land for Sale in Beragala,13 Jun 10:42 am,"Haputale, Badulla","25,000","LAND FOR SALE IN BERAGALA*The land is located beragala.*200 perches.*01 Km from beragala junction and colombo badulla main road.*Good environment and peaceful area.*Best for tourist hotels and farm.*Best for agriculture ( tea,pepper,cinnamon.)*Price per perch Rs 25000.00.*Negotiable.*You can save in multi millions.",Beragala,"Agricultural, Commercial, Residential",200.0 perches
77,"Land for Sale in Nawela, Welimada",16 Jul 12:57 pm,"Welimada, Badulla","4,500,000",හැකි ඉක්මනින් විකිනීමට ,Residential,212.0 perches,
78,බදුල්ල ප්‍රධාන පාරට මායිම් වූ සින්නක්කර ඉඩම,12 Jun  4:56 pm,"Bandarawela, Badulla","450,000","කුම්බල්වෙල බදුල්ල පාරට මායිම් වූ ඉඩම#ජලය, විදුලිය #ප්‍රධාන පාරට මායිම්ව#ව්‍යාපාර කටයුතු සඳහා ඉතා සුදුසු",Kumbalwela,"Commercial, Residential",10.0 perches
79,Valuable Land in Welimada Town,12 Jun 12:26 pm,"Welimada, Badulla","250,000,000","☆Commercial land for sale in the heart of Welimada town☆3.15 perches offered for highest demand☆Front & back view of the whole town☆Crowded business area☆Clear deeds☆Ideal for a bank, supermarket ,showrooms etc250 millions",Commercial,3.15 perches,
80,Sinnakkara Land for Sale - Aththalapitiya,12 Jun  8:34 am,"Bandarawela, Badulla","125,000",Aththalapitiya  pansala asannaye idama pihita atha.per 32 thenithala idamaki.niraul sinnakkara oppu.padinchiyata wadath sudusui. per 01 =125000.00 price can negotiable,Residential,32.0 perches,
81,Land for Sale - Ella,11 Jun  2:40 pm,"Ella, Badulla","5,500,000",Infront of Colombo badulla highway. Three km to Ella tourism area. Tow km to demodara railway station nine arch bridge. Three km to view point walasbedda.,"Agricultural, Commercial, Residential, Other",80.0 perches,
82,Land in Bandarwela Town, 8 Jun  6:48 pm,"Bandarawela, Badulla","300,000","බණ්ඩාරවෙල විශාකා බාලිකා විද්‍යාලයට ආසන්න,  බණ්ඩාරවෙල ප්‍රධාන නගරයට 1km, 300m පමණත්, බණ්ඩාරවෙල ප්‍රධාන පාසල් වන කුඩා කුසුමි බාලිකා විද්‍යාලයටත්, ධර්මපාල මහා විද්‍යාලයටත් සහ ප්‍රධාන මුලික රෝහලටත් ඉතාමත් නුදුරින් පිහිටි ( ඇවිදගෙන යන දුරින්) සුන්දර සොබහ සෞන්දර්යෙන් යුත් නිස්කලන්ක , සින්නක්කර ඔප්පු  සහිත පර්වර්ස් 20 ඉඩම් කොටස් දෙකක් විකිනිමට ඇත . පර්චරය Rs : 300000 .",Residential,40.0 perches,
83,Valuable Land Plots for Sale in Badulla,16 Jul  8:22 am,"Badulla, Badulla","6,500,000","* Badulla- Mahiyanganaya main road* 3 1/2 km away from Badulla city * 1 acre land- clear deeds* 3/4 km to Dunhinda water fall* Best place for hotels* Water, electricity, road facilities * Valuable trees are available * Schools, banks, hospitals- close",Badulla- Mahiyanganaya Road,"Commercial, Residential",1.0 acres
84,Land for Sale in Badulla,17 Jul  8:03 pm,"Hali Ela, Badulla","2,000,000","* Badulla- HaliEla * 18 perches land - clear deeds * 2 minutes to HaliEla city* 100m away from Badulla- Colombo main road* Close to HaliEla AG office * Middle class - high residential area* Water, electricity * Schools, banks- close",Badulla- HaliEla,Residential,18.0 perches
85,Land for Sale 30 or 35 and perches, 7 Jul  2:36 pm,"Ella, Badulla","50,000",One of the most beautiful view in Ella. Very close to '' villa varde '' hotel. Another 2 hotels around this land. Can buy whole land or portions as follows 30 perches 35 perches 30 perches,"Agricultural, Commercial",100.0 perches,
86,Land for Sale in - Hali Ela, 6 Jun  4:56 pm,"Hali Ela, Badulla","265,000",Clear DeedNBRO Report Plan (Pradesiyasaba Anumathai)WaterElectricity & All Documents clear,"Commercial, Residential",10.0 perches,
87,Land for Sale in Bandarawela, 8 Jul  9:40 pm,"Bandarawela, Badulla","150,000","* Bandarawela - Atampitiya road* 36 perches land - clear deeds * 1 1/2 km away from Bandarawela city* Water, electricity, road facilities * Normal old house is available * Valuable trees * 15 perches land prepared for * Attractive area- calm environment ",Bandarawela - Atampitiya Road,Residential,36.0 perches
88,"Valuable Land for sale in Bandarawela, Ampitiya", 3 Jul  4:05 pm,"Bandarawela, Badulla","210,000","බණ්ඩාරවෙල , අම්පිටිය ....කිතල්ඇල්ල ප්‍රධාන බස් මාර්ගයට ආසන්නයේ....",Bandarawela,Residential,10.5 perches
89,Land for Sale Welimada, 4 Jun  4:09 pm,"Welimada, Badulla","325,000","land for sale, near welimada central collage, one kilometer from welimada town , 500m distence to welimada bandrawela main road","divititawela, welimada",Residential,15.0 perches
90,Land For Sale In Welimada, 4 Jun 11:56 am,"Welimada, Badulla","625,000",(නුවරඑළියට 24 km කාපට් මාර්ගයේ රමනීය පරිසරයක පිහිටා ඇත) නුවරඑළිය මැද⁣ෙවල  හරහා වැලිමඩ කාපට් මාර්ගයේ වලහමුල්ල ලංකා බැංකුවට 200 මීටර් නුදුරින් පිහිටා ඇත.,"wlahamulla juntion,welimada","Residential, Other",15.0 perches
91,Land for Sale in Badulla, 3 Jun 12:58 pm,"Badulla, Badulla","500,000",කාර්මික විදුහල අසල බදුලුපිටිය.පර්චස් 15 ක ඉඩම පර්චස් 7 බැගින් වෙන් කර දිය හැක.අඩි 10 පාර.,"green lane drive,කයිලගොඩ",Residential,7.0 perches
92,රිදීපාන 14P ඉඩම, 2 Jun 12:38 pm,"Badulla, Badulla","125,000",රිදීපාන කෝවිළ අසලසින්නක්කර ඔප්පුතවත් 10P කුඹුරු ඉඩමක් විකිණීමට ඇත.කයිලගොඩ පන්සල අසල,රිදීපාන කෝවිළ අසල,Residential,14.0 perches
93,Tea Estate for Sale - Ella, 8 Jul  9:40 pm,"Ella, Badulla","6,000,000","* Ella - Ambadandegama* 21 km away from Bandarawela city, 5 km away from Ella city* 20- 25 VP tea - 5 years* Spring water, road facilities * Land prepared for build bungalow * Attractive area- best place for tourist hotel",Ella-Ambadandegama,Commercial,3.0 acres
94,Land for Sale in Bandarawela,31 May  5:27 pm,"Bandarawela, Badulla","140,000",Land For Sale In Bandarawela,Bandarawela,"Commercial, Residential",47.0 perches
