,0,1,2,3,4,5,6,7
95,Land for Sale in Delgoda/ Gampaha District,29 May  8:21 pm,"Ella, Badulla","190,000","දෙල්ගොඩ, කඩවත, කිරිබත්ගොඩ, ගම්පහ නගර වලට ඉතා ආසන්නව මනරම් වෙල්යායකට මුහුණලා පිහිටා ඇති හතරැස් පර්චස් දහයට මදක් වැඩි ඉඩම ඉක්මනින් විකිනීමට. දෙල්ගොඩ නගරයේ සිට උඩුපිල පන්සල හන්දියෙන් වැබඩ් දෙසට 3km පමණ ගිය පසු කෙහෙල් හේන ඉසිකිලිකන්ද පාරේ පිහිටා ඇත. ඉඩමට ඇති මාර්ගය පුළුල්ය. පිරිසිදු ඔප්පු සහිතය. කිරිබත්ගොඩට 13km, කඩුවෙලට 14km ගම්පහට 14 km කඩවතට 9km. අයිතිකරු විදෙස් ගත වීම නිසා ඉක්මනින් විකිනීමට තීරණය කර ඇත. පර්චසය රුපියල්",Residential,10.0 perches,
96,Land for Sale in Bandarawela,29 May  1:28 pm,"Bandarawela, Badulla","15,000,000",☀️බණ්ඩාරවෙල නගරයට නොදුරින් පූනාගල ☀️☀️මර්ගයෙ  ඉඩම සහ නිවස පිහිටා ඇත 👌👉ඉඩමෙ ප්‍රමාණය පර්චස් 46කී👉ජලය විදුලි සහිතයි 👉පිරිසිදු ඔප්පු 👉 මධ්‍යම පංතියේ නිවාස 👉 නිස්කලංක මනහර පරිසරය 👉 බැංකු ණය පහසුකම් ලබාගත හැක 🔖ඉක්මනින් විකිණීමට                                          👉මිල ගනන් සකච්චාකල හැක ⛳,"Punagala Road ,Bandarawela",Residential,46.0 perches
97,Valuable Land for Sale in - Haputale,27 Jun 12:54 pm,"Haputale, Badulla","32,000","A valuable land for sale in Idalgashinna close to haputale town (6km), Diyatalawa town ( 5km ), Boralanda town (7km). land is situated with a beautiful view, ideal for cabanas and other hotels. and also for houses. 800m from haputale- nuwaraeliya main road. Calm and quite neighborhood.Currently tea is cultivated in the land. More than 80 perches available.","Maligatenna Estate 'Anusri"" Idalgashinna","Agricultural, Other",80.0 perches
98,Land for Sale in - Keppitipola,13 Jun  7:17 pm,"Welimada, Badulla","2,600,000","This Place Is Good for Build Hotel,home Sinnakkara  Oppu",Nuwara Eliya Welimada Road Keppitipola,"Agricultural, Commercial, Residential, Other",26.0 perches
99,Land for Sale Badulla- Kalugalpitiya, 8 Jul  9:40 pm,"Badulla, Badulla","225,000","* Badulla municipal council * 10m away from Kalugalpitiya- Hingurugamuwa road* 37 perches land- clear deeds* 1km away from Badulla city * Calm environment, middle class* Water, electricity, road facilities * Schools, banks, hospitals- close",Badulla- Kalugalpitiya,Residential,37.0 perches
100,Land for Sale in Kithal Ella,23 Jul  9:25 am,"Ella, Badulla","200,000","Very beautiful, peaceful, calm and quiet surrounding",Kithal Ella,"Agricultural, Commercial, Residential, Other",800.0 perches
101,Valuable Land with A Cottage for Sale in City of Ella,27 May  1:55 pm,"Ella, Badulla","1,200,000","Panoramic view ,attracted by many tourists ,best for a tourist hotel,Rs.1200000per perch,",Commercial,10.0 perches,
