,0,1,2,3,4,5,6,7
0,title,posted date,location,price,description,Address:,Land type:,Land size:
1,Land for Sale in Badulla,17 Jul  8:03 pm,"Hali Ela, Badulla","2,000,000","* Badulla- HaliEla * 18 perches land - clear deeds * 2 minutes to HaliEla city* 100m away from Badulla- Colombo main road* Close to HaliEla AG office * Middle class - high residential area* Water, electricity * Schools, banks- close",Badulla- HaliEla,Residential,18.0 perches
2,"['Land for Sale in Badulla', '17 Jul  8:03 pm', 'Hali Ela, Badulla', '2,000,000', '* Badulla- HaliEla * 18 perches land - clear deeds * 2 minutes to HaliEla city* 100m away from Badulla- Colombo main road* Close to HaliEla AG office * Middle class - high residential area* Water, electricity * Schools, banks- close', 'Badulla- HaliEla', 'Residential', '18.0 perches']","['title', 'posted date', 'location', 'price', 'description', 'Address:', 'Land type:', 'Land size:']",,,,,,
3,Tea Estate for Sale - Guruthalawa,17 Jul  7:41 pm,"Welimada, Badulla","14,000,000","* Welimada- Guruthalawa* Facing to Haputale road* 7 acres tea estate - clear deeds * 1 1/2 km away from Welimada city* 4 km away from Diyatalawa city* 4 acres - VP tea, 3 acres- Lanka tea* 3000 kg tea leaves/ month* Valuable terpentine trees are available * House with 3 bedrooms for laborers - with water & electricity * Road facilities ",Welimada- Guruthalawa,"Agricultural, Commercial",7.0 acres
4,Land for Sale in Bandarawela,24 Jul  8:21 am,"Bandarawela, Badulla","550,000","Located at Ambetennawatta, Bandarawela. Just 950 meters to Bandarawela Bus Station. 3 minutes drive to town. Have clear deeds. Can access by two roads, one from upside of the land and another one from the bottom of the land. Both are concrete roads. Call for more details. Price can be negotiable.","Commercial, Residential",10.0 perches,
5,Land in For Sale Badulla,22 Jul  2:24 pm,"Badulla, Badulla","36,000",Nagara seemawe athi meme idama wahama wikine,"katupelella gama, badulla","Agricultural, Commercial, Residential, Other",68.0 perches
6,Land for Sale in Bandarwela,22 Jul  1:16 pm,"Bandarawela, Badulla","200,000","A piece of land with a view of the scenic beauty. Hospitality climate and an ideal land for tourist destinations and Any other tourist activitiesForm this place its 117km to Kandy and it takes 3 hr 30 min , to Nuwaraeliya 36km 1hr and 45 min to Ella. All 5As as Accomodation accessibility, amenities, attractions and activities are included in the tourist destination","warakagoda, Ettampitiya Bandarwela road.",Residential,93.0 perches
7,නිවසක් සහ ඉඩම විකිණීමට - බදුල්ල,22 Jul 11:06 am,"Badulla, Badulla","1,200,000",මනරම් නිස්කලංක පරිසරයක පිහිටා ඇති.සින්නක්කර ඔප්පු ජල විදුලි මාර්ග පහසුකම් ඇති නිවාස සහ ඉඩම විකිණීමට.සම්පූර්ණ පර්චස් 24 කි. බදුල්ල නගරයට මිනිත්තු 15 දුර.මිල ගණන් සාකච්ඡා කරගත හැක.,බදුල්ල රිල්පොල  මැදගම,Other,24.7 perches
8,Land for Sale in Bandarawela,22 Jul  9:58 am,"Bandarawela, Badulla","120,000",Approximately 6.5 Km from Bandarawela TownNear to Malwaththa Aramaya and Aislabe Tea FactoryPerfect for residential Perfect place for cottage/bungalow/Holiday InnPeaceful area,Malwaththa,Residential,37.0 perches
9,Land for sale - Ella,21 Jul 11:49 pm,"Ella, Badulla","375,000","@ ඇල්ල හංදියේ සිට කිලෝමිටර් 3.2යි. @ දර්ශණීය සුන්දර නිස්කලංක පරිසරය. @ ජය භුමි ඔප්පු, ප්ලෑන් ඇත.  @ ඉඩමටම  කොන්ක්‍රිටි පාර ,නල ජලය, විදුලිය, දුරකථන පහසුකමි ඇත. @ අවශ්‍ය නමි පර්චස් 12ක් ලබාගත හැක. @ පර්චසය රු. 375000යි. @ සංචාරක හෝටලයක් ඉදිකිරීමට කදිමයි. @ නියම ගැණුමිකරුවන් පමණක් අමතන්න.",3 කණුව පස්සර  ඇල්ල,Commercial,10.0 perches
10,Land for Sale - Diyathalawa,22 Jul 10:41 am,"Diyatalawa, Badulla","150,000","@ දියතලාව නගරයට කිලෝමිටර් 2.5යි. @ සුන්දර නිස්කලංක පරිසරය. @ සිංනක්කර ඔප්පු ,අනුමත ප්ලෑන් @ NBRO අනුමැතිය. @ දෝඩමිවත්ත කාපටි පාරට මුහුණලා ඉඩම පිහිටා ඇත. @ පර්චසය රු. 150000 සිට ඉහලට තෝරාගැණීමට බිමි කොටස් කීපයක්ම ඇත.  @ නියම ගැණුමිකරුවන් පමණක් අමතන්න.",ඩබල්පීල්ල අසල දෝඩමිවත්ත පාර දියතලාව,"Commercial, Residential",10.0 perches
11,Land for Sale in Badulla Town,20 Jul 10:04 pm,"Badulla, Badulla","200,000",ස්ප්‍රිංවැලි මාර්ගයට මුහුණලා ඉඔුල්ගොඩNBRO අනුමතිය ලබාගෙන ඇතබදුල්ල නගරයට විනාඩි 10,Imbulgoda,"Commercial, Residential",8.5 perches
12,Land for Sale in Badulla Town,23 Jul  1:35 pm,"Badulla, Badulla","100,000",ස්ප්‍රිංවැලි මාර්ගයේ රොක්හිල්NBRO අනුමතිය ලබාගෙන ඇතබදුල්ල නගරයට විනාඩි 10,"Commercial, Residential",14.0 perches,
13,Land for Sale in - Bandarawela,20 Jul  5:16 pm,"Bandarawela, Badulla","700,000",ElectricityWater Call for More Details,"Bindunuwewa, Bandarawela",Residential,8.0 perches
14,Land for Sale Mahiyanganaya,19 Jul  5:47 pm,"Mahiyanganaya, Badulla","35,000","මහියංගණය බදුල්ල ප්‍රධාන මාර්ගයට මීටර් 20 ක් දුරින් කුරැවිතැන්න මහා විද්‍යාලය ආසන්නයේ නිවාස බිම් කොටස් විකිණීමට තිබේ.(විදුලිය, සින්නක්කර ඔප්පු, ජලය, බැංකු ණය පහසුකම්)",Residential,20.0 perches,
15,Land for sale - Haputale,19 Jul  2:32 pm,"Haputale, Badulla","80,000","@ හපුතලේ සිට යහලබැද්ද ඉඩමට කිලෝමිටර් 4.5යි. @ දියතලාවට කිලෝමිටර් 5යි. @ සිංනක්කර ඔප්පු, ප්ලෑන් ඇත. @ දර්ශණීය සුන්දර නිස්කලංක පරිසරය. @ පදිංචියට, සංචාරක නිවාඩු නිකේතනයකට කදිමයි.  @ අවශ්‍ය නමි පර්චස් 10ක් ලබාගත හැක. @ පර්චසය 80000යි. @ නියම ගැණුමිකරුවන් පමණක් අමතන්න.",යහලබැද්ද හපුතලේ,Residential,22.0 perches
16,Land for Sale in Welimada,18 Jul  6:43 pm,"Welimada, Badulla","80,000","වැලිමඩ නගරයේ සිට 1km දුරින්, පර්චස් 14.4 ක බිම් කොටස, වැලිමඩ විජය විද්‍යාලයට යාබදව බිම් කොටස, බදුල්ල සහ බණ්ඩාරවෙල මාර්ග දෙකෙන්ම ලගා විය හැක. සින්නක්කර ඔප්පු සහ 100% පිරිසිදු ඔප්පු,සියලුම නාගරික පහසුකම්, නල ජලය සහ තෙකලා විදුලිය, ඉක්මනින්ම විකිණීමට",Badulla or Bandarawela road Welimada,Residential,14.4 perches
17,Land for Sale in Badulla,17 Jul  8:03 pm,"Hali Ela, Badulla","2,000,000","* Badulla- HaliEla * 18 perches land - clear deeds * 2 minutes to HaliEla city* 100m away from Badulla- Colombo main road* Close to HaliEla AG office * Middle class - high residential area* Water, electricity * Schools, banks- close",Badulla- HaliEla,Residential,18.0 perches
18,Tea Estate for Sale - Guruthalawa,17 Jul  7:41 pm,"Welimada, Badulla","14,000,000","* Welimada- Guruthalawa* Facing to Haputale road* 7 acres tea estate - clear deeds * 1 1/2 km away from Welimada city* 4 km away from Diyatalawa city* 4 acres - VP tea, 3 acres- Lanka tea* 3000 kg tea leaves/ month* Valuable terpentine trees are available * House with 3 bedrooms for laborers - with water & electricity * Road facilities ",Welimada- Guruthalawa,"Agricultural, Commercial",7.0 acres
19,Land with House for sale in Badulla - Redeepana,17 Jul  1:35 pm,"Badulla, Badulla","6,500,000","Badulla -  Redeepana55.35p3.3Km to Badulla town.150m to Pitapola Junction (Baulla – Mahiyangana Road)Single storied house 1790sqft, open verandah, sitting cum dining hall, six rooms, pantry & Kitchen, Two bathrooms ( One half completed)Electricity & WaterContact : Niroshan / Jeevana",Badulla -  Redeepana,Residential,55.35 perches
20,Land for Residence - Welimada,16 Jul  3:56 pm,"Welimada, Badulla","150,000",A land consist of 57 Purchase 1.5 KMs from Walimada town and 1 Km from Walimada Nuwara Eliya Main Road. For  higherst offer.Price could be negotiate.No brockers.Cont Prasad Akuranthilake,Residential,57.0 perches,
21,Tea Estate for Sale - Badulla,16 Jul 12:17 am,"Welimada, Badulla","10,500,000","* Badulla- Atampitiya* 8 acres tea estate- clear deeds* 1/2 km away from Atampitiya * Welimada - Atampitiya road* Attractive area- calm environment * Water, electricity * Normal house for labourers ",Badulla - Atampitiya,"Agricultural, Commercial",8.0 acres
22,Land For Sale - Bandarawela,14 Jul  4:47 pm,"Bandarawela, Badulla","1,800,000",@ බණ්ඩාරවෙල බදුල්ල ප්‍රධාන පාරට මුහුණලා බිදුණුවැව හිල්සයිඩි බාර් එක අසල ඉඩම පිහිටා ඇත.  @ ඔිනෑම ව්‍යාපාරයකට කදිමයි. @ මාර්ග රක්ෂිතය ඉවත්කර ඇත. @ සිංනක්කර ඔප්පු ප්ලෑන් ඇත.  @ තැනිතලා ඉඩමකි. @ පර්චසය රු. ලක්ෂ 18යි. @ ඉඩම පරික්ෂාකර මිල සාකචිජා කලහැක. @ නියම ගැණුමිකරුවන් පමණක් අමතන්න.,බිදුණුවැව බණ්ඩාරවෙල,Commercial,3.5 perches
23,Land For Sale In Bandarawela,14 Jul  7:42 pm,"Bandarawela, Badulla","350,000","@ බිදුණුවැව ලැවෙන්ඩා ( පැරණි ක්වින්ස්)  හෝටලය අසලින් ඇති හිල්ඔය පාරට යන පාරේ මිටර් 150කි.  @ සුන්දර නිස්කලංක වැදගත් නේවාසික පරිසරය. @ සිංනක්කර ඔප්පු, ප්ලෑන් ඇත. @ ඉඩමට අඩි 12 පලල පාර, විදුලිය, නල ජලය, දුරකථන පහසුකමි. @පර්චසය රු. 350000යි. @ අවශ්‍ය නමි පර්චස් 12ක් ලබාගත හැක. @ ඉඩම පරීක්ෂා කිරීමෙන් පසු මිල සාකචිජා කලහැක. @ නියම ගැණුමිකරුවන් පමණක් අමතන්න.",ලැවෙන්රා හෝටලය අසල බිදුණුවැව බණ්ඩාරවෙල,Residential,10.0 perches
24,Land for Sale - Ella,14 Jul  7:38 pm,"Ella, Badulla","2,000,000","@ ඇල්ල නගරයේ සිට කිලෝමිටර් 8කි. @ නිදහස් නිස්කලංක සුන්දර දර්ශණීය පරිසරය. @ විදුලිය , අඩි 12 පලල පාර, උල්පත් ජලය, දුරකථන පහසුකමි. @ සිංනක්කර ඔප්පු, ප්ලෑන් ඇත. @ අක්කරය ලක්ෂ 20යි. @ කොටස් දේන්නේ නැත, මුලු ඉඩම පමණයි. @ සංචාරක හෝටලයක් ඉදිකිරීමට කදිමයි. @ ඉඩම පරීක්ෂාකර මිල සාකචිජා කලහැක. @ නියම ගැණුමිකරුවන් පමණක් අමතන්න.",වලස්බැද්ද ඇල්ල,Commercial,6.0 acres
25,Land for Sale - Ella,13 Jul  8:51 pm,"Ella, Badulla","100,000","@ ඇල්ල හංදියේ සිට කිලෝමිටර් 4යි. @ දර්ශණීය නිස්කලංක පරිසරය.  @ ඉඩමට කුඹල්වෙල මහමෙවුනා අසපුව දිස්වෙි.  @ ස්වරණ භුමි ඔප්පු, ප්ලෑන් ඇත. @ ඉඩමටම අඩි 12 පලල පාර ,විදුලිය ,නල ජලය, දුරකථන පහසුකමි. @ සංචාරක හෝටලයක් ඉදිකිරීමට කදිමයි.  @ ඉඩම පරික්ෂාකිරීමෙන් පසු මිල සාකචිජා කලහැක.  @ නියම ගැණුමිකරුවන් පමණක් අමතන්න",කිතල්ඇල්ල අැල්ල,"Commercial, Residential",120.0 perches
26,Land for sale - Bandarawela,13 Jul  2:21 pm,"Bandarawela, Badulla","70,000","@ බණ්ඩාරවෙල නගරයේ සිට කිලෝමිටර් 5කි. @ පුනාගල මාර්ගයේන් හා ඔබඩඇල්ල මාර්ගයේන් ඉඩමට ලගාවිය හැක. @ නිස්කලංක නිදහස් තැනිතලා ඉඩමකි. @ සිංනක්කර ඔප්පු, ප්ලෑන් ඇත. @ ඉඩමටම අඩි 12 කොන්ක්‍රිටි පාර, විදුලිය, නල ජලය, දුරකථන පහසුකමි.  @ එකවර ඉඩම මිලදි ගන්නේ නමි කොටස් කර දෙනු ලැබෙි.  @ නියම ගැණුමිකරුවන් පමණක් අමතන්න.",බැද්දේකුඹුර ඔබඩඇල්ල බණ්ඩාරවෙල,Residential,27.0 perches
27,Land For Sale Badulla,18 Jul  3:56 am,"Badulla, Badulla","8,500,000","* 130 m away from Badulla- Mahiyanganaya road * Badulla municipal council * Puwakgodamulla- clear deeds * 20 perches land - flat land* 1 1/2 km away from Badulla city * Calm environment * Coconut, mango, avocado, banana trees available * Old house with water and electricity* Schools, banks, hospitals- close ",Badulla- Mahiyanganaya road,Residential,20.0 perches
28,Land for Sale Badulla,12 Jul 11:13 pm,"Badulla, Badulla","250,000","* Badulla- Hingurugamuwa main road* 27 perches land- clear deeds * Badulla municipal council * 1 km away from Badulla city * Calm environment, best view * Water, electricity* Schools, banks, hospitals- close",Badulla- Hingurugamuwa,Residential,27.0 perches
29,Land for Sale in Bandarawela,22 Jul  9:58 am,"Bandarawela, Badulla","120,000",Approximately 6.5 Km from Bandarawela TownNear to Malwaththa Aramaya and Aislabe Tea FactoryPerfect for residential Perfect place for cottage/bungalow/Holiday InnPeaceful area,Malwaththa,Residential,37.0 perches
30,Tea Estate for Sale - Badulla,16 Jul 12:17 am,"Welimada, Badulla","10,500,000","* Badulla- Atampitiya* 8 acres tea estate- clear deeds* 1/2 km away from Atampitiya * Welimada - Atampitiya road* Attractive area- calm environment * Water, electricity * Normal house for labourers ",Badulla - Atampitiya,"Agricultural, Commercial",8.0 acres
31,Land For Sale Mahiyanganaya,12 Jul  6:19 pm,"Mahiyanganaya, Badulla","6,000,000",විකිණීමට ඇත....මහියංගනය > අම්පාර ප්‍රදාන පාර උල් හිටිය ඔයට මුහුණලා.... ආදිවාසී මහගෙදරට (දඹාන) 4km..මිල ගණන් කතා කරගත හැක....Tel-,"Agricultural, Commercial, Residential",3.5 acres,
32,Land for sale - kahagolla,12 Jul  3:03 pm,"Bandarawela, Badulla","1,350,000","@ බණ්ඩාරවෙලට කිලෝමිටර් 4යි. දියතලාවට කිලෝමිටර් 3යි. @ දියතලාව බණ්ඩාරවෙල ප්‍රධාන පාරට මිටර් 100යි. @ දර්ශණ නිස්කලංක වැදගත් පරිසරය. @ ජයභුමි ඔප්පු, ප්ලෑන් ඇත.  @ අඩි 12 පලල පාර , නල ජලය, විදුලිය, දුරකථන පහසුකමි ඇත. @ වටිනාකම රු. 1350000යි. @ නියම ගැණුමිකරුවන් පමණක් අමතන්න.",ග්පටිඅරාවපාර කහගොල්ල දියතලාව,Residential,9.2 perches
33,Land for Sale - Haputale,12 Jul  2:49 pm,"Haputale, Badulla","8,000,000","@ හපුතලේ නගරයේ සිට බොරලන්ද කැප්පෙටිපොල පාර කිලෝමිටර් 2ක් දුරින් ඉඩම පිහිටා ඇත. @ සුන්දර දර්ශණීය පරිසරය. @ ඔප්පු,ප්ලෑන් අැත.  @ ඉඩමේ නිවසක්ද ඇත.  @ සංචාරක හෝටලයක් ඉදිකිරීමට හෝ පදිංචියට කදිමයි. @ ඉඩමටම අඩි 12 පලල පාර, නල ජලය, විදුලිය, දුරකථන පහසුකමි. @ වටිනාකම රු. ලක්ෂ 80යි. @ දේපල පරික්ෂා කිරීමෙන් පසු මිල සාකචිජා කලහැක.  @ නියම ගැණුමිකරුවන් පමණක් අමතන්න.",බොරලන්ද කැප්පෙටිපොල පාර හපුතලේ,"Commercial, Residential",17.8 perches
34,Land for sale - Bandarawela,11 Jul  6:57 pm,"Bandarawela, Badulla","175,000","@ බණ්ඩාරවෙල නගරයේ සිට වැලිමඩ පාරේ කිලෝමිටර්1ක් දුරින් ඉඩම පිහිටා ඇත.  @ කහත්තේවෙල හංදියේ සිට මිටර් 600යි. @ සිංනක්කර ඔප්පු,ප්ලෑන් ඇත. @ ඉඩමටම අඩි 12 පලල පාර, විදුලිය, අවුරුද්ද පුරාවටම නොසිදෙන ලිං ජලය, දුරකථන පහසුකමි. @ සුන්දර නිස්කලංක පරිසරයක් ඇති තැනිතලා ඉඩමකි.  @ පර්චසය රු 175000යි. @ නියම ගැණුමිකරුවන් පමණක් අමතන්න.",ඇක්ටන්වත්ත කහත්තේවෙල හංදිය බණ්ඩාරවෙල,Residential,25.0 perches
35,Land Sale in Welimada,10 Jul  2:18 pm,"Welimada, Badulla","1,980,000",වැලි මඩ නගරය කිලෝමීටර් 4.5ක් නුදුරින් උෘව පරණගම උමා ඇල පෙදෙසේ,උමා ඇල,Agricultural,22.0 perches
36,Land For Sale In Bandarawela, 9 Jul  2:32 pm,"Bandarawela, Badulla","16,000,000",20 purch land for sale. Good for residential. Miunsipality aproved for six floor bilding. Price slightly negotiable for seirious buyer. Clear deed. Good for tuarist hotel or restaurent also. Call for more deatails.,Residential,20.0 perches,
37,Land for sale - Kahagolla, 9 Jul  3:53 am,"Diyatalawa, Badulla","120,000","@ දියතලාව නගරයට කිලෝමිටර් 2.5යි. @ බණ්ඩාරවෙල නගරයට 4.5යි.  @ දියතලාව බණ්ඩාරවෙල කාපටි පාරේ සිට මිටර් 300යි. @ දර්ශණීය නිස්කලංක පරිසරය. @ තේවතු මැදින් දුමිරිය ගමන් කිරීම මනාව දිස්වෙි.  @ පදිංචියට ,නිවාඩු නිකේතනයකට කදිමයි. @ පිරිසිදු සිංනක්කර ඔප්පු, අනුමත ප්ලෑන්, විථි රේඛා ඇත. @ ජාතික ගොඩනැගිලි පර්යේෂන සංවිධානයේ (NBRO) අනුමැතිය. @ ඉඩමටම අඩි 10 පලල පාර, විදුලිය, නල ජලය, දුරකථන පහසුකමි. @ අවශ්‍ය නමි බැංකු ණය පහසුකමි සලසා දියහැක. @ පර්චසය රු 120000යි.",ගල්පටිටිඅරාව කහගොල්ල දයතලාව,Residential,24.3 perches
38,Land for sale in haldummulla, 7 Jul  4:37 pm,"Haputale, Badulla","10,000,000",කොළඹ  බදුල්ල  ප්‍රධාන  පාරේ හල්දුම්මුල්ල ප්‍රාථමික  විදුහලට හා පොලිස් ස්ථානයට යාබදව පිහිටා ඇති පැරණි නිවසක් සහිත ඉඩම (පර්චස් 20ක තේ දලු ආදායම ලබයි ),Haldummulla,"Agricultural, Commercial, Residential",110.0 perches
39,Land for Sale - Merahawaththa, 6 Jul  1:59 pm,"Bandarawela, Badulla","350,000","@ බණ්ඩාරවෙල වැලිමඩ ප්‍රධාන ලාරට මුහුණලා මිරහවත්ත මාර්ග සංවර්ධන අධිකාරියේ වැඩපල ඉදිරිපිට ඉඩම පිහිටා ඇත. @ බණ්ඩාරවෙල සිට කිලෝමිටර් 11.5යි. @ සිංනක්කර ඔප්පු, ප්ලෑන් ඇත. @ ඔනෑම ව්‍යාපාරයකට, පදිංචියට කදිම තැනිතලා කදිම ඉඩමකි.  @ පර්චසය රු. 350000යි. @ ඉඩම පරීක්ෂා කිරීමෙන් පසු මිල සාකචිජා කලහැක. @ නියම ගැණුමිකරුවන් පමනක් අමතන්න.",7 කණුව මිරහවත්ත,"Commercial, Residential",10.0 perches
40,Land for sale - Diyathalawa, 5 Jul  4:34 pm,"Diyatalawa, Badulla","70,000","@ දියතලාව නගරයේ සිට කිලෝමිටර් 2.5යි. @ සිංනක්කර ඔප්පු, ප්ලෑන් ඇත. @ නිදහස් නිස්කලංක පරිසරය. @ ඉඩමටම අඩි 10 පලල පාර ,නල ජලය, ලිංජලය, විදුලිය, දුරකථන පහසුකමි. @ පර්චසය රු. 70000යි. @ නියම ගැණුමිකරුවන් පමණක් අමතන්න.",අලුත්වෙලඋතුර දියතලාව,Residential,14.0 perches
41,Land for Sale - Bandarawela,11 Jul  7:34 pm,"Bandarawela, Badulla","70,000","@ බණ්ඩාරවෙල නගරයට කිලෝමිටර් 1.1යි. @ කහ⁣ත්තේවෙල හංදියට මිටර් 600යි.  @ නිස්කලංක සුන්දර පරිසරය. @ සිංනක්කර ඔප්පු, ප්ලෑන් ඇත. @ ඉඩමට අඩි 10 පලල පාර, විදුලිය, දුරකථන පහසුකමි, අවුරුද්ද පුරාම නොසිදේන ලිං ජලය.  @ තෝරා ගැණීමට රු.70000 සිට ඉහලට පර්චස් 7.2, 7, 10 බිමි කොටස් 3ක් ඇත. @ නියම ගැණුමිකරුවන් පමණක් අමතන්න.",ඇක්ටන්වත්ත කහත්තේවෙල හංදිය බණ්ඩාරවෙල,Residential,7.2 perches
42,Land for Sale in Badulla Town,23 Jul  9:04 am,"Badulla, Badulla","1,000,000",17 perch land is avilable for immediate sale. Half land can also be sold.Location is in the heart of Badulla town in a Highly Residential area. The Neighbourhood is a very peacful and has high property value.Price is negotiable & land can also be sold in 2 units.,"Agricultural, Commercial, Residential",17.5 perches,
43,Land for Sale in Badulla, 8 Jul  9:40 pm,"Badulla, Badulla","160,000","* Badulla- Pitapola* 10m away from Badulla- Mahiyanganaya road * 22 perches land - clear deeds * Water,  electricity, road facilities                                                  * 3km away from Badulla city (5 minutes )",Badulla- Pitapola,"Commercial, Residential",22.0 perches
