,0,1,2,3,4,5,6,7,8,9
0,title,posted date,location,price,description,Beds:,Baths:,House size:,Land size:,
1,House for Sale in Katugastota,19 Jul  3:53 pm,"Katugastota, Kandy","13,000,000",6 bed room2 bath room2 entrance for each floorTwo vehicle parking spaceFully completed house10 perches7 kelemeter to Kandy4 kelemeter to KatugastotaAll facilities available Clear deeds200 meter to 4 th mile post (via  katugastota - kurnegala main road)Contact person Mr.Sudathබාත් රෑම් 2නිදන කාමර 6තට්ටු දෙක සදහා වෙන වෙනම ප්‍රවේශ මාර්ගවාහන දෙකක් නැවැත්වීමේ පහසුකම් සම්පූර්ණයෙන් නිමාකල නිවසපර්චස් 10නුවරට කිලෝමීටර් 7කටුගස්තොටට කිලෝමීටර් 4සියලූම පහසුකම් සහිතවනිරවුල් ඔප්පුකටුගස්තොට කුරුණෑගල ප්‍රධාන පාරේ හතරේ කණුවේ සිට මීටර් 200 දුරින්සුදත් මහතා.,6,2,"1,500.0 sqft",15.0 perches,
2,"['House for Sale in Katugastota', '19 Jul  3:53 pm', 'Katugastota, Kandy', '13,000,000', '6 bed room2 bath room2 entrance for each floorTwo vehicle parking spaceFully completed house10 perches7 kelemeter to Kandy4 kelemeter to KatugastotaAll facilities available Clear deeds200 meter to 4 th mile post (via  katugastota - kurnegala main road)Contact person Mr.Sudathබාත් රෑම් 2නිදන කාමර 6තට්ටු දෙක සදහා වෙන වෙනම ප්\u200dරවේශ මාර්ගවාහන දෙකක් නැවැත්වීමේ පහසුකම් සම්පූර්ණයෙන් නිමාකල නිවසපර්චස් 10නුවරට කිලෝමීටර් 7කටුගස්තොටට කිලෝමීටර් 4සියලූම පහසුකම් සහිතවනිරවුල් ඔප්පුකටුගස්තොට කුරුණෑගල ප්\u200dරධාන පාරේ හතරේ කණුවේ සිට මීටර් 200 දුරින්සුදත් මහතා.', '6', '2', '1,500.0 sqft', '15.0 perches']","['title', 'posted date', 'location', 'price', 'description', 'Beds:', 'Baths:', 'House size:', 'Land size:']",,,,,,,,
3,House for sale in Katugasthota,19 Jul  2:28 pm,"Katugastota, Kandy","16,000,000",කොළඹ - නුවර අධිවේගී මාර්ගයේ ප්‍රධාන පිවිසුම් සන්දිස්ථානය වන  කටුගස්තොට නගරයට ඇවිද යන දුරින් පිහිටි පර්චස් 22.9 ක් සහිත නිවසක් විකිණීමට ...         කටුගස්තොට - රණවන පාරට මීටර් 150 යි...        කටුගස්තොට - නගරයට විනාඩි 03 යි.            නිවසට මිලක් නියම නොකරන අතර පර්චස් වටිනාකමට පමණක් මිල කෙරේ...             පර්චසය රු. ලක්ෂ 7 යි.       ගැණුම්කරුවන් පමණක් විමසන්න .... රෝහල් / සුපිරි වෙළඳසැල් / බස් පහසුකම් / ආදී සියලුම පහසුකම් සහිතය ...         විමසන්න RSK Property - Kandy ~~~~~~~~~~~~~~~~~~~~~~~~~~~~~~~~~~~~~~~~~~~~ ,"ranawana road, katugasthota",3,1,"1,500.0 sqft",22.0 perches
4,දෙමහල් නිවස කටුගස්තොට,18 Jul 12:24 pm,"Katugastota, Kandy","18,000,000",මහනුවර නගරයට කිලෝමීටර් 3කටුගස්තොට නගරයට කිලෝමීටර් 1පර්චස් 20කින් සමන්විත නිසන්සල පරිසරයදෙමහල් නිවස.ඉතා ඉක්මනින් විකිනේ.ගනන් කතා කරගත හැක.,NO 22 Vidyala Mavatha Mavilmada,4,1,"1,500.0 sqft",20.0 perches
5,House for Sale in - Madawala,17 Jul 10:26 am,"Katugastota, Kandy","6,000,000",Down Stairs Completed. Upstairs Partly Completed.,"Madawala, Harispattuwa",3,2,"1,500.0 sqft",29.0 perches
6,House for Sale Kandy,15 Jul  2:14 pm,"Katugastota, Kandy","68,500,000",Basement*drivers quarters(extra room and bathroom)/ store room and garden,"Katugasthota road,mahaiyawa,kandy",4,3,"3,400.0 sqft",14.0 perches
7,House in Katugastota for Sale,15 Jul 10:52 am,"Katugastota, Kandy","15,000,000",House in Katugastota for Sale======================,"no 247/1/1, kalugala watta, ranawana rd, katugastota.",3,2,"2,500.0 sqft",21.0 perches
8,House for Sale - Kandy,13 Jul  3:57 pm,"Katugastota, Kandy","7,900,000",වාහන නවතා තැබීමට පහසු කම්  නිස්කලංක පරිසරය ප්‍රධාන පාරට මිටර් 250 පමණ ඇත.  පොල් සහ කොස් ගස් සහිත ඉඩම,"yatiwawala, katugastota , kandy",3,1,"1,500.0 sqft",27.0 perches
9,House for Sale in Katugastota - Kulugammana,13 Jul  3:51 pm,"Katugastota, Kandy","9,000,000",Ref. 129,4,1,"2,000.0 sqft",8.0 perches,
10,House for Sale in - Katugastota,21 Jul 12:08 pm,"Katugastota, Kandy","31,000,000","17.2 Perches Land with A Beautiful Bungalow.4 Miles Away from Kandy Town,located in A Very Calm & Silent Environment.DescriptionLocation - Ambathanne Matale Road(katugastota Kandy City Limit)Property Type - Land with A Modern BunglowLand Extent  - 17.2 PerchesProperty Value -Rs.38 MnExtra DetailsNumber of Rooms - 4Number of Bathrooms -01 & a Servant's BathroomNumber of Floors - Single Story HouseAmple Car Parking SpaceProperty Features-Excellent Environment with A Greenery View in Front of Piga Oya.All Kandy Main Schools,supermarkets,hospitals Are Closeby.Contact for More Info",4,1,"3,000.0 sqft",17.2 perches,
11,House for Sale Edarutenna,12 Jul 10:38 pm,"Katugastota, Kandy","9,800,000",House for sale edarutenna. ..Jumma masjid 150 meetar ..school 100 meeter ..4 km katgastota. .7 km kandy,3,1,"2,100.0 sqft",22.0 perches,
12,House for Sale in Katugastota Polgolla,12 Jul  3:22 pm,"Katugastota, Kandy","13,500,000","House for Sale in Polgolla 4KM to Kandy 50m to main road 20 perch land with two story house two large living Halls , balcony , Veranda 2 Vehicles can park in one time Grage Parapet wall 24Hours line water & Well Electricity & all facilities 1KM for Polgolla Open University 2KM for Katugasthota Twn Collages ( St. Anthonys Boys & girls / CIS Colombo International )100% Clear Deeds ","Katugasthota , Polgolla",10,6,"4,900.0 sqft",20.0 perches
13,House For Sale In Kandy Aladeniya,12 Jul 10:41 am,"Katugastota, Kandy","6,500,000",* In Kandy Aladeniya* 5Km to Katugastota town * In Katugastota Kurunegala Main Road* All Facilities Available * 2 Story * Ground floor Completed* Ground floor- 1 Bed Room / Living room/ Kitchen/ Bathroom * Upper - 3 Bed room / Living room/ Bathroom/ Balcony/ Pantry,"Sewana Land, Sri Piyarathne Mawatha, Aladeniya Werellagama",4,2,"2,000.0 sqft",12.5 perches
14,House for Sale in තලවින්න,10 Jul  8:22 pm,"Katugastota, Kandy","9,500,000",කටුගස්තොට ජම්බුගහපිටිය මාර්ගයේ තලවින්න දුම්රියපොළට ආසන්න පර්චස් 36  ඉඩමක් සමග අංගසම්පූර්ණ නිවස කුත් විකිණීමට තිබේ මහනුවර නගරයට 7kmපිරිසිදු ඔප්පුවිදුලියනල ජලයවැඩි විස්තර දැන ගැනීමට අමතන්න,කටුගස්තොට ජම්බුගහපිටිය මාර්ගයේ තලවින්න,3,2,"5,000.0 sqft",36.0 perches
15,Ancestral House for Sale in Kandy,10 Jul  5:33 pm,"Katugastota, Kandy","125,000,000",Beautifully restored heritage house first built in 1901 situated on 103 perches of land located approximately 5 km from kandy city area. ,"Katugasthota, Kandy",5,5,"5,000.0 sqft",103.0 perches
16,House for Sale in - Bokkawala,10 Jul  3:44 pm,"Katugastota, Kandy","5,000,000","Ideal 10 perch House Near Katugasthota town just 10 km, Kandy to Bokkawala bus route, near Marathugoda National School,Good environment,Clear Deeds & Plan, 90% completed  House, 02 bed rooms, 01 barth rooms,Kitchen,Big living & dinning area,Electricity & other facilities",Bokkawala,2,1,945.0 sqft,10.0 perches
17,New House in For Sale - Katugasthota,12 Jul  3:12 pm,"Katugastota, Kandy","39,000,000",New Luxury House Sale in Katugasthota - Kandy ],"Katugasthota , Kandy",10,6,"4,500.0 sqft",19.1 perches
18,House for Sale in Katugasthota,12 Jul  9:48 pm,"Katugastota, Kandy","47,500,000",Land with commercial building and a house,"nugawela, kandy",9,5,"5,000.0 sqft",58.0 perches
19,House for Sale in - Kandy, 8 Jul  2:14 am,"Katugastota, Kandy","11,200,000","මහනුවර නගරයට 8km නුදූරින් පිහිටා ඇතනිදන කාමරය.    -    2නානකාමර          -     3 සම්පූර්ණ ටයිල් සහ සිවිලිම් ගසා ඇතසියලුම පහසුකම් වලින් යුක්තයනිවාස සාදා වසර 7 යි(Foodcity - around 100 feet , bus stand around 500feet , water , electricity, )",3,2,"2,600.0 sqft",40.0 perches,
20,House for Sale Katugastota, 4 Jul 11:27 am,"Katugastota, Kandy","14,200,000","A newly constructed two storied house with 2200 Sq.ft. Slab for constructing 3rd story, situated in a well facilitated calm & quiet environment  2 km off Katugastota, on Kurunegala road (6 km from Kandy city)","Senarathgama, Katugastota",4,3,"3,700.0 sqft",20.5 perches
21,House for sale in Katugasthota,29 Jun  7:43 pm,"Katugastota, Kandy","30,000,000",The house is in a very calm and serene environment 6 km away from Kandy town. It is an upstair house with 8 AC bedrooms. The pantry is fully finished Got two spacious livings and a spacious dining room plus an office room. The garden has a capacity of parking 5 vehicles. Got imported light fittings. The house is overlooking the River Mahaweli.,8,5,"6,000.0 sqft",16.5 perches,
22,New House for Sale Halloluwa,10 Jul 11:21 am,"Katugastota, Kandy","7,500,000",10 Minutes to Kandy.3 KMs away from Katugasthota town.4 KMs away from Peradeniya town.Two floor house and ground floor has completed.Tilled.Dining and living area.,"Pallemulla, Halloluwa",2,1,"1,200.0 sqft",10.0 perches
23,House for Sale Katugastota Rajaphilla,28 Jun  2:20 pm,"Katugastota, Kandy","11,000,000",කටුගස්තොට නගරයට කි.මි. 4 යි මහනුවර නගරයට කි.මි 8යි.රජපිහිල්ල නිදන කාමර 05නාන කාමර 02සියලු පහසුකම් සහිත නව නිවස සහ පර්. 7 ඉඩම විකිණීමට,"Ranavana Road, Katugastota",5,2,"1,800.0 sqft",7.0 perches
24,නිවසක් විකිනීමට නුවර කටුගස්තොට,28 Jun  1:42 pm,"Katugastota, Kandy","14,000,000",මහනුවර කටුගස්තොට නගර සීමාවේනිස්කලංක පරිසරය සුවපහසු නිදන කාමර #6නාන කාමර #2මුලුතැන්ගේ #2 ඇතසියලු පහසුකම් නිවාසය ආසන්නයේ නිරවුල් ඔප්පුවඉඩමේ ප්‍රමාණය පර්චස් 17.8නිවසේ ප්‍රමාණය දිග52 පලල35,U.D.G.T.  CHAMINDANO- 297/2/B UDAWATHTHA KONDADENIYA KATUGASTHOTA,6,3,"1,820.0 sqft",17.8 perches
25,House for Sale in Katugastota,21 Jul  8:52 am,"Katugastota, Kandy","13,000,000","13.5 Perches land with Single story House in Katugasthota.3 bedrooms, 1 bathroom, 1 servant toilet.Situated just 500m from the Katugasthota town. Carpet Road.Paddy field view with a wonderful garden.Friendly & well-reputed neighbors. ","Katugastota, Riwikirana Mawatha",3,1,"1,250.0 sqft",13.5 perches
26,House for sale near Katugastota,27 Jun  9:19 am,"Katugastota, Kandy","13,500,000",Bed rooms-3BathroomLiving roomDining roomFace to the main roadClear deedWater+Electricity8 Km to Kandy town,3,1,"2,000.0 sqft",33.0 perches,
27,Newly constructed two stories house for sale,25 Jun  2:09 pm,"Katugastota, Kandy","13,000,000",The Construction has been completed by 90%,"Yakgahapitiya,Amunugama",3,2,"1,300.0 sqft",10.0 perches
28,House for Sale in Katugastota - Kandy,22 Jun  1:05 pm,"Katugastota, Kandy","10,200,000",Ref. 113,2,1,"1,275.0 sqft",9.7 perches,
29,Two Story House for Sale -Katugastota,28 Jun  6:32 pm,"Katugastota, Kandy","38,000,000",spacious luxury 2 storied   three uni  house in kandy katugastota kurunagala road..  centrally located yatiwawala..  300m walking distance to  kandy kurunegala main road....  2.5 km to katugastota town..  it's situated in highly residential area..,yatiwawela katugastota..,9,4,"4,850.0 sqft",19.1 perches
30,Fully Tiled Single Stair House Katugastota,20 Jun  3:31 am,"Katugastota, Kandy","6,200,000",කටුගස්තොට සිට කිලෝමීටර 5 යි. රජපිහිල්ල හංදියේ සිට මීටර 50ක්. බස් නැවතුම් පල පේන දුරින්. බෙඩ් රූම් 3යි. බාත් රූම් 1යි. සම්පූර්ණ වැඩ නිමවා ඇත්. මුළු ගේම ටයිල් කර සිවිලිම් ගසා ඇත. පැන්ට්‍රි කබඩ් ගසා ඇත. පදිංචි වීමට නිස්කලංක පරිසරය. මුස්ලිම් අයට දෙනු නොලැබේ. ඵල දරන පලතුරු ගස් 15ක් පමණ ඇත. මිදුල අලංකාරව සකසා ඇත්. ඉතා ඉක්මනින් විකිණීමට. වැඩිම ඉල්ලුමට. නිවස පරීක්ෂාකර බලා මිල ගණන් සාකච්චාකරගත හැක. නළ ජලය විදුලිය 24 පැය පුරා.,3,1,"1,260.0 sqft",14.0 perches,
31,House for Sale Watapuluwa,19 Jul 10:25 pm,"Katugastota, Kandy","40,000,000",Near cis susex college polgolla dam.and many more routes.center of kandy.calm quiet peaceful.Land with a house.40 perches.quick sale.parking garage.2km to kandy town.1km to katugastota town.  කෝටි 4,watapuluwa kandy,4,2,"10,808.33 sqft",39.7 perches
32,House for sale in Katugastota,18 Jun 11:24 am,"Katugastota, Kandy","23,500,000","Complete house for sale in Katugastota, Ranawana road.  Built in 2007. 3 minutes drive to Katugastota and 15 minutes  to Kandy. The house consist with a basement garage and dometory for 10 bed spaces. (can be use for a separate anex ). Ground floor complete with,...4 beds3 bathroomsLiving room Dining room TV  room Varenda Parking for 5 cars comfortablyOutside toilet and water tank Store roomPaved garden with Interlocks",5,4,"2,400.0 sqft",20.0 perches,
33,House for Sale in Katugasthota,30 Jun  9:41 am,"Katugastota, Kandy","6,500,000",House for Sale in Katugasthota========================,"No.78/3, Siri Damma Mawatha, Senarathgama, Katugastota",3,2,"2,200.0 sqft",13.0 perches
34,2 houses with 49 perches land for sale,12 Jun  1:59 pm,"Katugastota, Kandy","29,000,000",located In between Galaha Road and Mahakanda road2.5km to Peradeniya University4km to Peradeniya teaching hospitalOne house is two storied7 bedrooms and 3 bathroomsPipe water and electricity availableOther house is under construction,"6th mile post, Galaha road,Hindagala",7,3,"2,600.0 sqft",49.0 perches
35,House for sale - Katugastota,11 Jun  5:08 pm,"Katugastota, Kandy","11,800,000","New hours for sale in kandy - katugastota .water & electricity available , just 7km to kandy city and 3km to katugastota, 4km to paradheniya. Contact Mr Nalin . .",Hamangoda Katugastota,3,1,"2,500.0 sqft",12.0 perches
36,House for Sale Katugastota, 4 Jul  2:18 pm,"Katugastota, Kandy","21,500,000",කටුගස්තොට නගරයට සිට මි. 750යි කාමර 4නාන කාමර 2කෑම කාමර සාලය මුළුතැන්ගෙය ගරාජ්ය සහිත සියළු පහසුකම් සපිරි නිවස විකිණීමට උඩුමහලේ කොන්ක්‍රීට් දමා ඇත. තව නිවසක් ඉදි කිරීමට හැක.,"Katugastota, Kandy",4,2,"1,500.0 sqft",8.0 perches
37,House for Sale - Katugastota, 6 Jun  4:11 pm,"Katugastota, Kandy","6,000,000",ඉඩමක් සමග ගෙයක් විකිණීමට තිබේනුවර කුරුණෑගල ප්‍රධාන පාරේමැදවල හෑදෙණිය ටවුමේ සිට කිලෝමීටර් 3km  දුරින්පර්චස් 30 ක ඉඩම් කෑල්ලක් සමග ගෙයක්  විකිණිමට තිබේකාමර 5Attach bathroomservant roomපිරිසුදු වතුර විදුලියපිරිසිදු ඔප්පු සමගවැඩි විස්තර දැනගැනීම සඳහා අමතන්න,මැදවල හැදෙනිය,7,1,"7,500.0 sqft",30.0 perches
38,අඩක් නිම කල නිවස කටුගස්තොට, 6 Jun  4:03 pm,"Katugastota, Kandy","5,200,000",අඩක් නිම කල නිවස මහනුවර නගරයට 3.km ජල නල විදුලිය පහසුකම් ඇත බ්‍රොකර්වරු අනවශයයි,කටුගස්තොට ගොහාගොඩ පාර,1,1,"1,600.0 sqft",16.6 perches
39,House for Sale in Kandy - Katugastota, 1 Jun  2:16 pm,"Katugastota, Kandy","7,500,000","Kandy, katugastota, Nugawela900 meter to Kandy - Kurunegala main road18 perchesAll facilities available Clear deeds10 sqft road to the land3 bedrooms1 bed room",3,1,"1,800.0 sqft",18.0 perches,
40,House for Sale in Katugasthota - Alawathugoda,29 May  5:00 pm,"Katugastota, Kandy","4,000,000","Owner :  JayathilakaClear Deeds  with all facilities Vehicle parking available 1 km to Alawathugoda Town 22 1/2 perch1500 sq ft3 bedroomsLiving room1 bathroom1 kitchenAddress: 47/1,konakalagala,alawathugoda (near the school)","Address: 47/1,konakalagala,alawathugoda (near the school)",3,1,"1,500.0 sqft",22.5 perches
41,House with Land for Sale in - Katugastota,25 May 10:50 am,"Katugastota, Kandy","9,000,000","Katugastota nagarayata ithama asannaye idikirimata yojitha adiwegi margayata nudurinsiyalu pahasukam sahitha prasidda pasal,bank,hospital ,super market sahitha anga sampoorna niwasa ikmanin wikinimata atha,wedima ILLUMATA,Broker waru anawashyayai","Ranawana Road,Katugastota",4,1,750.0 sqft,9.0 perches
42,House for Sale Katugastota,23 May  3:52 pm,"Katugastota, Kandy","25,000,000","Katugastota close to Town 5 Bedroom, 3 Bathroom,2 Storied House with all facilities in best residential areaParking Available for 7/8 Vehicles","Katugastota, Kandy",5,3,"2,900.0 sqft",23.5 perches
