,0,1,2,3,4,5,6,7,8,9
0,title,posted date,location,price,description,Address:,Beds:,Baths:,House size:,Land size:
1,"House for Sale in Thalakotuwa Gardens, Colombo 05",17 Jul 10:49 am,"Colombo 5, Colombo","52,500,000",House for Sale in Colombo 05=======================,"Thalakotuwa Gardens, Colombo 05",2,1,"1,400.0 sqft",5.9 perches
2,"['House for Sale in Thalakotuwa Gardens, Colombo 05', '17 Jul 10:49 am', 'Colombo 5, Colombo', '52,500,000', 'House for Sale in Colombo 05=======================', 'Thalakotuwa Gardens, Colombo 05', '2', '1', '1,400.0 sqft', '5.9 perches']","['title', 'posted date', 'location', 'price', 'description', 'Address:', 'Beds:', 'Baths:', 'House size:', 'Land size:']",,,,,,,,
3,House for Sale in Colombo 05,17 Jul 11:08 am,"Colombo 5, Colombo","85,000,000","House for sale in Colombo 05 facing main roadbedrooms 5 , bath rooms 5Two vehicle can be park High residential area.Close to leading school & close to 5 hospital Asiri segical ,Asiri medical,Nine wells,Lanka Hospital  & Kings hospital.Commercial or residential purpose.",Colombo 05,5,5,"2,500.0 sqft",7.0 perches
4,7.5 Perches Land with House in Kirulapona.,20 Jul  7:17 am,"Colombo 5, Colombo","80,000,000",STRICTLY NO AGENTS OR BROKERS!,"EDMINTON ROAD,COLOMBO 5.",5,3,"2,847.0 sqft",7.5 perches
5,House for Sale in Colombo 5 - H0680,20 Jul  7:38 am,"Colombo 5, Colombo","280,000,000",#.3 STORIED HOUSE AT Thimbirigasyaya,3,5,"6,000.0 sqft",20.0 perches,
6,House for Sale in Colombo 5 - H0694,17 Jul  1:57 pm,"Colombo 5, Colombo","80,000,000","HOUSE FOR SALE AT POLHENGODA, COLOMBO 5.",3,2,"4,000.0 sqft",12.0 perches,
7,Old House for Sale - Colombo 5,16 Jul  2:09 pm,"Colombo 5, Colombo","220,000,000",residence area with car parking,Kirulapone Avenue,2,1,"1,200.0 sqft",4.0 perches
8,House for Sale Colombo 5 - HH632,12 Jul  5:26 pm,"Colombo 5, Colombo","176,000,000","#. BEAUTIFUL HOUSE AT LAKE DRIVE, COLOMBO 5",4,4,"5,000.0 sqft",22.0 perches,
9,"House for Sale in Thalakotuwa Gardens, Colombo 05",17 Jul 10:49 am,"Colombo 5, Colombo","52,500,000",House for Sale in Colombo 05=======================,"Thalakotuwa Gardens, Colombo 05",2,1,"1,400.0 sqft",5.9 perches
10,Thimbirigasyaya Road,11 Jul 12:23 pm,"Colombo 5, Colombo","175,000,000",14+p land with approx 75 feet of road frontage on Thimbirigasyaya Rd. The solidly built 2 story house is an added benefit to the new owner as with some renovations can be used for almost any commercial venture. Ample parking options or a large garden space can be created as there is a large part of the property without a structure.,Thimbirigasya,4,3,"3,500.0 sqft",24.0 perches
11,75 Feet Facing Thimbirigasyaya Road,11 Jul 12:23 pm,"Colombo 5, Colombo","175,000,000",14+p land with approx 75 feet of road frontage on Thimbirigasyaya Rd. The solidly built 2 story house is an added benefit to the new owner as with some renovations can be used for almost any commercial venture. Ample parking options or a large garden space can be created as there is a large part of the property without a structure.,Thimbirigasyaya Road,4,3,"3,500.0 sqft",14.0 perches
12,House for Sale - Kirulapone, 9 Jul 10:35 pm,"Colombo 5, Colombo","40,000,000","Balapokuna Road, Kirulapone 2 floors house Garage Servant bedroom and bathroom Parking facility for vehicles Facing to the Balapokuna Road 50 m distance to the 120 bus route 40 million",4,3,"3,500.0 sqft",10.5 perches,
13,Houses For sale Colombo 5, 8 Jul  7:20 pm,"Colombo 5, Colombo","90,000,000",Colombo 5 Kirula Road off Jayakontha Lane 10perches Land wiht 3 storey large House For sale 9 Bed Room/5Bath Room 5000sq.fd.very close Asiri medical Hospital,Colombo 5 Jayakontha Lane,9,5,"5,000.0 sqft",10.0 perches
14,Two Unit Luxury House for Immediate Sale in Kirulapona,10 Jul  3:16 pm,"Colombo 5, Colombo","50,000,000","Two Unit Luxury House for Immediate Sale!Two unit fully tiled upstair house with separate entrance in Kirulapone, Colombo 05Each unit consists of 3 bedrooms, Hall/Dining, Pantry/2 Toilets (one attached), Solar powered hot water, overhead water tank, separate servants room and toilet, garage with roller shutter gates for 2 vehicles, Terrace and roof top cum indoor / outdoor garden.On 9.95 perches, top floor consists of 1518sqft and bottom floor 1521sqft (total 3,039sqft)","Nandimitra Place, Kirulapona",6,4,"3,039.0 sqft",10.0 perches
15,5B/R 3 Storey House for Sale at Colombo 5., 5 Jul  1:06 pm,"Colombo 5, Colombo","6,900,000",Three Storey HouseWith 5 Bed Rooms. ,"Colombo 5, Narahenpita, Dabare Road.",5,3,"1,400.0 sqft",1.8 perches
16,House And Land 11 Perches Colombo-05,13 Jul  8:50 am,"Colombo 5, Colombo","7,500,000","11 Perch 2 Houses With Land For Sale1 Perch - 7,500,000Colombo 5 Good Place Temples , Keels , Asiri Surgical / Medical , Police Hospital , Lanka Hospital , Railway Station , All Other & Government Places , Important Places Nearby , Popular Schools Nearby , Walking Distant To Main Bus Routes & Main Roads , Lane Capable Of Driving Large Vehicles , Small Vehicle Can Be Parked Inside Home & Infront Of HomeNegotiableOne Perch Price Displayed / Given Below(Sq. Feet Size Not Properly Calculated)","Timbirigasyaya Road, Narahenpita",3,1,500.0 sqft,11.0 perches
17,Architect Designed 5B/R 3 Storey House for Sale in Colombo 5., 5 Jul 11:51 am,"Colombo 5, Colombo","106,000,000",ARCHITECT DESIGNED HOUSEAT COLOMBO 5.,"Colombo 5, Thimbirigasyaya Junction, Isipathana Mawatha.",5,5,"4,000.0 sqft",7.8 perches
18,House for Sale Colombo 5 - HH595, 4 Jul 11:55 pm,"Colombo 5, Colombo","170,000,000","BEAUTIFUL UNIQUE HOUSE AT NARAHENPITA, COLOMBO 5",4,3,"4,500.0 sqft",21.0 perches,
19,House For Sale - Col 05, 3 Jul  9:20 pm,"Colombo 5, Colombo","5,000,000",National Housing Scheme Dhabare MawathaNarahenpitaColombo 05,1,1,800.0 sqft,3.0 perches,
20,House for Sale in - Colombo 5, 2 Jul  2:36 pm,"Colombo 5, Colombo","95,000,000",Location : Colombo 05 (Off Wijay Kumaratunghe Mawatha),Kirulapone,4,3,"3,000.0 sqft",19.0 perches
21,02 Story House & 6.9 p Col 05, 2 Jul  1:06 pm,"Colombo 5, Colombo","65,000,000",Rs 65000000.00 LAKHSNegotiable,MEGAHA PLACE THIBIRIGASYAYA ROAD COLOMBO 05,7,5,"2,800.0 sqft",6.9 perches
22,Luxury House for Sale in Seeduwa,30 Jun  2:59 pm,"Colombo 5, Colombo","50,000,000",This property is situated just 500 meters away from Seeduwa town.,4,5,"5,300.0 sqft",13.0 perches,
23,House for Sale in Colombo 05, 8 Jul  1:02 pm,"Colombo 5, Colombo","55,000,000","- 2 units up-stair house, 2 flat houses with separate entrance, each unit consists of 3 bedrooms, Living area, dining, pantry, 2 bathrooms, solar powered hot water, A/C, overhead water tank, Servant rooms with bathrooms, garage with roller shutter for 2 vehicles, Terrace and rooftop cum indoor and outdoor garden space, 9.92 perches land, each floor over 1500 sqft area, House Build in 2006 Close to Lanka hospital, supermarket , International schools and 2 mints to the High level road.- Asking Price is Rs.55m",6,4,"1,500.0 sqft",9.92 perches,
24,Beautiful 4 Bedroom House with Swimming Pool for Sale Colombo 5,22 Jun 12:30 pm,"Colombo 5, Colombo","310,000,000",4 Bedroom with 6 bathsMaids room with toiletDrivers room Swimming pool with GymFully a/c roomsSeperate TV roomSolar Wiring doneSeperate Kitchen and seperate pantry4 vehicle parkingSeperate service entry availableThe house is sold with the high end furnitures available,Skeleton Road,4,6,"6,700.0 sqft",15.0 perches
25,5 BR House | Colombo - Greenland Lane for Sale, 8 Jul  1:02 pm,"Colombo 5, Colombo","125,000,000",5 bedrooms House For sale In Colombo 5 ,Greenland Lane,5,4,"4,200.0 sqft",12.0 perches
26,House for sale in Thalangama,20 Jun 11:32 am,"Colombo 5, Colombo","32,500,000",New House2 Stories8.5 perches3000 square feet3 Bedrooms 3 bathrooms One balcony2 en suite rooms2 living areasGarage parking for 2 vehicles15 feet access roadCourtyardRoof top terraceFront gardenBackyardTiled floorMaid's quartersA/C roomsHot waterCCTV camera system ,"Bataketiya Road, Udumulla South, Thalangama",3,3,"3,000.0 sqft",8.5 perches
27,House for Sale in Colombo 5 (1076 B),19 Jun  4:01 pm,"Colombo 5, Colombo","55,000,000",Two story house with nine rooms and four bathrooms 4000 square feet,OFF WIJAYAKUMARATHUNGA MW,9,4,"4,000.0 sqft",11.0 perches
28,"House for Sale in Thalakotuwa Gardens, Colombo 05",17 Jul 10:49 am,"Colombo 5, Colombo","52,500,000",House for Sale in Colombo 05=======================,"Thalakotuwa Gardens, Colombo 05",2,1,"1,400.0 sqft",5.9 perches
29,House for Sale in Colombo 5, 8 Jul  1:02 pm,"Colombo 5, Colombo","55,000,000","Details Of The Property.2 units up-stair house, 2 flat houses with separate entrance, each unit consists of 3 bedrooms, Living area, dinning, pantry, 2 bathrooms, solar powered hot water, A/C, overhead water tank, Servant rooms with bathrooms, garage with roller shutter for 2 vehicles, Terrace and rooftop cum indoor and out door garden space, 9.92 perches land, each floor over 1500 sqft area, House Build in 2006 Close to Lanka hospital, super market , International schools and 2 mints to the High level road.Asking Price is Rs.55m","Robbert Drive, Robbertgunawardena mawatha, Col 5",6,4,"4,500.0 sqft",9.92 perches
30,Land with 2 Houses for Sale in Colombo 05,28 Jun  2:18 pm,"Colombo 5, Colombo","75,000,000",15.45 Perch Land with 2 Houses for Sale in Colombo 05,4,4,"2,500.0 sqft",15.45 perches,
31,House for Sale with Land in Colombo 05,28 Jun  2:52 pm,"Colombo 5, Colombo","90,000,000",Best descent place.house also in good condition,balapokuna road,6,4,"5,000.0 sqft",15.0 perches
32,House for Sale in Colombo 05,30 Jun  9:41 am,"Colombo 5, Colombo","7,800,000",House for Sale in Colombo 05===================,"Chithra Lane Flats, Colombo 05",3,1,"1,150.0 sqft",3.7 perches
33,House Two Storey for Sale in - Thimbirigasyaya,26 Jun  8:50 am,"Colombo 5, Colombo","120,000,000",5900sqft house. Well maintained house on a private residential road.Can be used as two different units. ,9,5,"5,900.0 sqft",17.5 perches,
34,House for Sale Kirulapone,28 Jun  2:52 pm,"Colombo 5, Colombo","23,000,000",Kirulapobe 6.5 perches 4 bedrooms house 23 million,Kirulapobe,4,3,"2,500.0 sqft",6.5 perches
35,House for sale in Colombo 05,14 Jun 11:12 pm,"Colombo 5, Colombo","39,000,000","Balapokuna Road, Colombo 05 2 floors house Servant bedroom and bathroomFacing to the Balapokuna Road Garage 39 Million",4,3,"4,200.0 sqft",10.5 perches,
36,2 Story House for Sale in Colombo 5,14 Jun 10:55 pm,"Colombo 5, Colombo","45,000,000","2 Storey House For immediate sale in Colombo5Sieble Avenue ,Colombo5","Sieble Avenue ,Colombo5",3,2,"2,000.0 sqft",5.6 perches
37,House for Sale in Colombo - 05,14 Jun  3:34 pm,"Colombo 5, Colombo","80,000,000",Highly Residential Property in Kirulapana (Sri Siddhartha Road),"Sri Siddhartha Passage ,Colombo 5",3,2,"3,000.0 sqft",20.0 perches
38,House for Sale in Colombo - 05,14 Jun  3:28 pm,"Colombo 5, Colombo","150,000,000",Good Residential Property in Colombo - 05 (Isipathana Road),"Isipathana Road, Colombo - 05",4,2,"2,500.0 sqft",10.0 perches
39,23 Perch Old Single Storey House Sale in Colombo 5,13 Jun 12:45 am,"Colombo 5, Colombo","130,000,000",Property Sale in Land Value Only Price 57Lakes Per Perch Negotiabl,"50 meters to nugegoda - kirulapone main Road,Colombo 5",4,2,"1,850.0 sqft",23.0 perches
40,03 Story House & 15 P Sale At Col 05,12 Jun  3:30 pm,"Colombo 5, Colombo","250,000,000",03 Story House & 15 P Sale At Colombo 05 ,Park Road Colombo 05,6,7,"3,800.0 sqft",15.0 perches
41,5BR House | Colombo 5 - For Sale, 8 Jul  1:02 pm,"Colombo 5, Colombo","125,000,000",5 bedrooms House For sale In Colombo 5 ,Greenland Lane,5,4,"4,200.0 sqft",12.0 perches
42,House With Land for Sale in - Colombo 5,12 Jun  4:17 pm,"Colombo 5, Colombo","55,000,000",යට මහල නිදන කාමර - 03නාන කාමර - 01සාලයගරාජ් - 01,"237 / 14 , Polhena Road , Kirulupana , Colombo 5.",6,2,"4,000.0 sqft",9.0 perches
43,House for Sale Kirulapone,28 Jun  2:52 pm,"Colombo 5, Colombo","36,000,000",Kirukapone 6.5 Perches 4 bedrooms house 36 million,Kirukapone,4,2,"2,500.0 sqft",6.5 perches
44,House for Sale - Colombo 5,28 Jun  2:52 pm,"Colombo 5, Colombo","25,000,000",Kirukapone Mahinda place 7 Perches 4 bedrooms house 25 million,Kirukapone Mahinda place,4,2,"2,500.0 sqft",7.0 perches
45,Stunning home for sale in Thalangama,12 Jun 10:14 am,"Colombo 5, Colombo","70,000,000","6 bedrooms6 bathrooms 22 perches land 3,050 square feet Office room with separate entrance3 story house3 ensuite rooms4 balconies  2 living areasRoof terraceBackyard1 master bedroom with ACHot waterSolar panels Well lit interiorTiled floorsMaid's quartersDriver's quarters12 feet Access roadGarage parking for 2+2 vehicles inside the premises","2nd Lane, Kotte -Bope Road, Thalangama",6,6,"3,050.0 sqft",22.0 perches
46,House for Sale in Kirulponae,28 Jun  2:52 pm,"Colombo 5, Colombo","40,000,000",Kirulapone 6.5 Perches 4 bedrooms house fully tiles 40 Million 100 Meters to High level road,Kirulapone,4,3,"3,000.0 sqft",6.5 perches
47,Two Storey House for Sale Colombo 5,28 Jun 10:43 am,"Colombo 5, Colombo","45,000,000",sibal avenue Colombo 5 two storey house for sale 3 bedrooms 2 bedrooms  5.6 perches immediately sale 450 lakhs  please no brokers,sibal avinue colombo 5,3,2,"2,000.0 sqft",5.6 perches
48,House for Sale in Kirilapona, 9 Jun  7:20 pm,"Colombo 5, Colombo","6,000,000","House for Sale Land Value inKirilapona Mawatha, (Baseline Road)","Kirilapona Mawatha, Kirilapona, Colombo-05",3,2,"1,415.7 sqft",5.2 perches
49,House For Sale @ Colombo 5,28 Jun  2:52 pm,"Colombo 5, Colombo","55,000,000",Kirulapone Colombo 5 Close to Kirulapone Mosh 10 perches with 4 bedrooms house only land value 55 Million,Kirulapone Colombo 5,4,3,"3,000.0 sqft",10.0 perches
50,4BR House For Sale - Colombo 5, 8 Jul  1:02 pm,"Colombo 5, Colombo","115,000,000",4 bedrooms house for sale in Park Road.,Park Road,4,3,"3,500.0 sqft",9.0 perches
51,House for Sale - Colombo 05, 8 Jul  1:02 pm,"Colombo 5, Colombo","150,000,000","Col 5 - Off Jawatta road, Facing to Sulaiman terrace, Highly residential area, 11.84 perch land with a over 25 years old house, Solid structure, 3000 sqft, two storied, 4 bedrooms + Office room, 3 bathrooms, Pantry area, Large living area & Sitting area, servant room and toilet, Storeroom, 2 Covered parking space, Front garden Selling for land value, Asking price is Rs.150m",4,3,"3,000.0 sqft",12.0 perches,
52,House for sale - Colombo 05, 6 Jun  3:41 pm,"Colombo 5, Colombo","37,000,000","A beautifully designed 3-storey house located approx. 5 minutes from the Nugegoda Junction, within close proximity to all modern-day conveniences. The property resides in a quite residential neighborhood in Kirulapona, Colombo-05.The property offers extensive living space.The property details,* Fully tiled* Four Rooms (one room with A/C)* Four toilets (Including maids toilet)* 2 Living areas* Hot Water* Roller shutter gate* Kitchen with Modern pantry cupboards* Inside parking for 2 vehicles* Roof top terrace","Kirulapona, Colombo-05",4,4,"2,650.0 sqft",6.0 perches
53,Old House for sale in Colombo 5, 8 Jul  1:02 pm,"Colombo 5, Colombo","150,000,000","Property Details.Col 5 - Off Jawatta road, Facing to Sulaiman terrace, Highly residential area, 11.84 perch land with a over 25 years old house, Solid structure,  3000 sqft, two storied, 4 bedrooms + Office room, 3 bathrooms, servant room and toilet, Pantry area, Large living area & Sitting area, 2 Covered parking space, Front garden  Selling for land value, asking price is Rs.150m",Sulaiman terrace Off Jawatta road,4,3,"3,000.0 sqft",11.0 perches
54,"House for Sale in Thalakotuwa Gardens, Colombo 05",17 Jul 10:49 am,"Colombo 5, Colombo","52,500,000",House for Sale in Colombo 05=======================,"Thalakotuwa Gardens, Colombo 05",2,1,"1,400.0 sqft",5.9 perches
55,House for Sale Col 5,28 Jun  2:51 pm,"Colombo 5, Colombo","300,000,000","5 car park servant room and driver room separate with toilet.swimming pool.large luxary rooms,living hall,dining room.",Amarasekara mawatha,5,5,"7,000.0 sqft",12.0 perches
56,House For Sale Colombo 5,28 Jun  2:52 pm,"Colombo 5, Colombo","70,000,000",Kirulapone Porrwarama road 20 perches with colonial house old house 3.5 million per  perch 5 bedrooms only land value,Kirulapone Porrwarama road,5,4,"4,000.0 sqft",20.0 perches
57,"Bambalapitiya, Milagiriya House for Sale", 8 Jun  3:00 pm,"Colombo 5, Colombo","200,000,000","Amazing deal for a Prime Property !this is located in the heart of colombo, literally !Just a walk away to the beach and the center of the city!Location : Milagiriya Avenue Purpose : residential / commercial use Extent - 18.95 PHouse - 3500 sqftBed - 5 Bath - 4Price : 200 million  ",BAMBALAPITIYA,5,4,"3,500.0 sqft",18.95 perches
58,TWO STORY HOUSE & 19 P SALE COL 05, 1 Jun  8:10 am,"Colombo 5, Colombo","95,000,000","50 LAKHS ( 5 MILLION ) PER PERCHLAND VALUE ONLY  TOTAL VALUE RS 95,000,000Negotiable",100 METERS TO MAIN ROAD / ANDARAWATHA ROAD POLHENGODA COLIMBI 05,4,3,"3,000.0 sqft",19.0 perches
59,House for Sale in Kirulapone,28 Jun  2:51 pm,"Colombo 5, Colombo","200,000,000",5 bedroom fully tiled.ground floor 2 bed room living room 1 toilet bathroom 1st floor 3 bedroom 3 toilet 20 million,Robert gunawardana Mawatha kirulapone,5,3,"3,000.0 sqft",4.0 perches
60,(hs185) House for Sale in Kirulapone,23 May  2:50 pm,"Colombo 5, Colombo","45,000,000",2 story house 5.6 perches En suite roomsGarage parking  Rooftop terrace Kitchen and Pantry Small front gardenBalconies 15 ft. access roadGreat ventilationHigh residential areaQuiet neighborhoodGreat access pointsAccess to all amenities,"Rajawatta Terrace, Kirulapone",3,2,"2,500.0 sqft",5.6 perches
