,0,1,2,3,4,5,6,7
41,Valuable Land for Sale Divulapitiya, 8 Jul 12:36 pm,"Divulapitiya, Gampaha","100,000","This Valuable land for sale immediately.ideal for Residential , agriculture or industrial purpose.Buyers can buy partly like as 30,40,80 perches etc. 2km for  Divulapitiya city center,4km for naiwala. 30 min for Katunayake international airport. 30 min for Katunayake- Colombo express way. 30 min for Gampaha city center.very close to minuwangoda & udugampola. The land situated just 250m from Divulapitiya-Naiwala main Road.Very Valuable land for bargain price.20 ft road around the land. ",Divulapitiya,"Agricultural, Commercial, Residential",100.0 perches
42,Land for Sale in Divulapitiya (Lot 4),24 Jun  3:00 pm,"Divulapitiya, Gampaha","88,000",දිවුලපිටිය වරාදලින් අගනා නේවාසික බිම් කොටස්⏩ විදුලිය⏩ තාර යෙදු පුලුල් මාර්ග⏩ DAMRO / CIC / LANKA TILE කර්මාන්තශාලා වලට ආසන්නව⏩ 251 බස් මාර්ගයට මීටර් 100යි.⏩ කුරුණැගල කොළබ 5 පාරට 1.2km,waradala,Residential,12.5 perches
43,Land for Sale in - Divulapitiya,16 Jun  7:36 am,"Divulapitiya, Gampaha","55,000",පර්ච් 31.5හ එකවර මිලදී ගන්නෙනම්පර්ච් 31.5   = 55 000,Dunagaha,"Agricultural, Residential",31.5 perches
44,Land with House - Kongodamulla,22 Jun  4:09 pm,"Divulapitiya, Gampaha","28,000,000","Newly built home.. 150.0 perches of land Close to all amenities; schools, local shops, pharmacy, doctors, churches, new developments2 bedrooms2 bathrooms (1 external)1 dining room / sitting room 1 kitchen (unfitted)1 porchAll fitted with windows and secured with grillsAdditional separate buildings1 annex with 2 rooms (181 sq ft)1 hen coop1 pigsty1 concrete fish farming pond",Kongodamulla,Residential,150.0 perches
45,අක්කර 4 පොල් ඉඩම නිවාස 2ක් සමග දිවුලපිටිය,24 Jul 10:26 am,"Divulapitiya, Gampaha","16,500,000","දිවුලපිටිය බාදුරාගොඩ , වල්පිට හරස්  මාර්ගයේ , පිහිටි වටිනා පොල් අක්කර 4ක, ඉඩම . සියලුම පළතුරු හා වෙනත් වටිනා දැව හා බෝග සහිතයි .Tiles කර , සිවිලිම් ගසා අංගසම්පූර්ණව නිමකර ඇති, wosh Room සහිත වටිනා නිවසක් හා තවත් අඩක් නිමකළ නිවසක්  සහිතයි . බැංකු ණය ලබා ගත හැකි නිරවුල් ඔප්පු හා ප්ලෑන් . විදුලිය හා පිරිසිදු ලිං ජලය සහිත ලිං 2ක් සහිතයි ..ඉඩම තැනිතලා ඉඩමක් නොවේ , පසුපසින් උස් පිහිටීමක් සහිත පර්, 624. මෙම ඉඩම මුදල් හදිසියක් නිසා , සති දෙකක් ඇතුලත එන වැඩිම ඉල්ලුමට විකුනනු ලැබේ.. හොඳම හා වටිනා ආයෝජනයක් සදහා  ඉක්මනින් විමසන්න .","මඩිතියවල පාර , වල්පිට .","Agricultural, Commercial, Residential",4.0 acres
46,1 Acer Land for Sale in - Divulapitiya,11 Jun  4:49 pm,"Divulapitiya, Gampaha","45,000","1 Acer Land for Sale in Divulapitiya , Delwagura Road.Price Negotiable",Residential,1.0 acres,
47,2.5 Acre Valuable Property for Sale in Divulapitiya,23 Jul 10:05 am,"Divulapitiya, Gampaha","10,000,000",2.5 Acre Commercial/ Agriculture Land for sale in Divulapitiya . The land currently with Coconut cultivation. Exchange of Vehicle would be considered.,"Agricultural, Commercial, Residential",2.5 acres,
48,Land For Sale Divulapitiya ( Walihinda ),11 Jun 10:55 am,"Divulapitiya, Gampaha","120,000","වැලිහිද (  දිවුලපිටිය ) කොටදෙනියාව  මීගමුව පාරට 50 යාබදව සහ කොලඹ කුරුනෑගල පාරට 100 දුරින් පිහිටි     (වැලිහිද හන්දියට 50 m / කොටදෙනියාව නගරයට 500 m )*  35 පර් අගනා බිම් කොටස ඉතා ඉක්මනින් විකිනීමට -*  සින්නක්කර ඔප්පු  *පොල් ගස් 4 ,කොස් ගස් 1 ,තේක්ක ගස් 2** ඉඩමට අඩි 12 පාර  *****අදම අමතන්න","Welihinda ,Kotadeniyawa",Residential,35.0 perches
49,Land for Sale in Divulapitiya Town,10 Jun 10:07 am,"Divulapitiya, Gampaha","65,000",දිවුලපිටිය නගරයට මී.800 ක් දුරින්,Divulapitiya Town,Residential,12.5 perches
50,Valuable Coconut Land - Divulapitiya,24 Jul 10:26 am,"Divulapitiya, Gampaha","3,950,000","කර්මාන්ත ශාලාවකට, ගොවිපළකට, විශාල නිවාස යෝජනා ක්‍රමයකට හෝ හෝ වෙනත් ඕනෑම දෙයකට යොදාගත හැකි , විදුලිය , ජලය , හා මාර්ග පහසුකම් සහිත අක්කර 16, ඉඩම ඉක්මනින් විකිනීමට . නිරවුල් ඔප්පු හා ප්ලෑන් . බැංකු ණය පහසුකම් ලබා ගත හැක ... එක වර විකිනීමට පමණි ..","Gampaha , Divulapitiya .","Agricultural, Commercial, Residential",16.0 acres
51,Land For Sale in Divulapitiya / Waradala,24 Jun  3:00 pm,"Divulapitiya, Gampaha","88,000",දිවුලපිටිය වරාදලින් අගනා නේවාසික බිම් කොටස් මේ උත්සව සමයේ ඉඩමක් මිල දී ගෙන 20% ක වට්ටමක් හිමිකර ගන්න.⏩ විදුලිය⏩ තාර යෙදු පුලුල් මාර්ග⏩ DAMRO / CIC / LANKA TILE කර්මාන්තශාලා වලට ආසන්නව⏩ 251 බස් මාර්ගයට මීටර් 100යි.⏩ කුරුණැගල කොළබ 5 පාරට 1.2km,waradala,Residential,12.5 perches
52,Land For Sale In Maradagahamula, 1 Jun 10:37 am,"Divulapitiya, Gampaha","1,500,000",මරඳගහමුලින් බඩල්ගම පාරේ හුණුමුල්ල කුරුඳුවත්ත මහමෙව්නා අසපුවට මායිම්ව පර්චස් 24ක බිම් කොටසක් විකිණීමට ඇත.,"Badalgama Rd, Maradagahamula","Agricultural, Commercial, Residential, Other",24.0 perches
53,දිවුලපිටිය නගරයෙන් ඉඩමක් .,24 Jul 10:26 am,"Divulapitiya, Gampaha","250,000","දිවුලපිටිය නගරයෙන් මීගමුව දෙසට , අයෝවා හෝටලය ඉදිරිපිට , පළමු පටුමගෙහි 100m දුරින් පිහිටි අගනා ඉඩම .. සීග්‍රයෙන් දියුනුවට පත්වන සියලුම පහසුකම් සහිත පෙදෙසකින් , පදිංචියට ඉඩමක් සොයන්නෙකුට වටිනා ඉඩම , බැංකු ණය ලබාගත හැකි නිරවුල් ඔප්පු හා අනුමත ප්ලෑන් .. එකවර හෝ කොටස් වශයෙන් .","1,st Lane, Negombo Road , Divulapitiya .","Commercial, Residential, Other",79.0 perches
54,Land For Sale Divulapitiya, 3 Jul  2:42 pm,"Divulapitiya, Gampaha","65,000","දිවුලපිටිය ,ගම්පහ බස් පාරට 150mමහගෙදර වත්ත වෙන්දේසි වත්ත අසල පොල් ,පුවක් සහිතයි , පුළුල් මාර්ග . (මුදල් හදිසි නිසා ප්‍රදේශයේ පවතින මිලට ඉතා අඩුවෙන් )","දිවුලපිටිය ,ගම්පහ පාර විතානමුල්ල","Agricultural, Residential",44.0 perches
