,0,1,2,3,4,5,6,7
0,title,posted date,location,price,description,Address:,Land type:,Land size:
1,Land For Sale Divulapitiya, 6 Jul  2:19 pm,"Divulapitiya, Gampaha","600,000","දිවුලපිටිය ,ගම්පහ බස් පාරේ විතානමුල්ල පාසලට ආසන්නයේ කුඹුරු යායක් මායිමේ පිහිටි දර්ශනීය ඉඩම ,ජලය ,විදුලිය සහිත තැනිතලා බිම්කඩකි .මුළු ඉඩමම ලක්ෂ 6","දිවුලපිටිය ,ගම්පහ බස් පාරට 300m විතානමුල්ල","Agricultural, Residential",10.0 perches
2,"['Land For Sale Divulapitiya', ' 6 Jul  2:19 pm', 'Divulapitiya, Gampaha', '600,000', 'දිවුලපිටිය ,ගම්පහ බස් පාරේ විතානමුල්ල පාසලට ආසන්නයේ කුඹුරු යායක් මායිමේ පිහිටි දර්ශනීය ඉඩම ,ජලය ,විදුලිය සහිත තැනිතලා බිම්කඩකි .මුළු ඉඩමම ලක්ෂ 6', 'දිවුලපිටිය ,ගම්පහ බස් පාරට 300m විතානමුල්ල', 'Agricultural, Residential', '10.0 perches']","['title', 'posted date', 'location', 'price', 'description', 'Address:', 'Land type:', 'Land size:']",,,,,,
3,Land for Sale Gampaha - Maradagahamula,27 Jul  3:51 pm,"Divulapitiya, Gampaha","2,700,000",සීඝ්‍රයෙන් සංවර්ධනය වන උසස් නේවාසික පරිසරකසුපිරි බිම්කොටස් ව්‍යාපෘතියක් ඔබ දන්නම තැනකින්....,මරදගහමුල,"Agricultural, Commercial, Residential",80.0 perches
4,Land for Sale Gampaha - Maradagahamula,27 Jul  3:51 pm,"Divulapitiya, Gampaha","2,700,000",සීඝ්‍රයෙන් සංවර්ධනය වන උසස් නේවාසික පරිසරකසුපිරි බිම්කොටස් ව්‍යාපෘතියක් ඔබ දන්නම තැනකින්....,මරදගහමුල,"Agricultural, Commercial, Residential",80.0 perches
5,Land for sale in Divulapitiya,27 Jul  9:55 am,"Divulapitiya, Gampaha","460,000","Land located in the middle of Divulapitiya town. Very peasefull environment and closed to Colombo - Kurunegala main bus route, walking disterance to all convenience facilities.  Very clear land title and easy payment systems can be arrange.Call for more details.",Residential,14.0 perches,
6,Land for sale in Divulapitiya,27 Jul  9:31 am,"Divulapitiya, Gampaha","475,000",Land located in Divulapitiya town  facing to Colombo - Kurunegala main bus route. it's very closed to Divulapitiya Hospital and famous Horagasmulla primary School.Property suitable for eny business porpose. Call for more details.,Commercial,22.0 perches,
7,Land for Sale in Divulapitiya,26 Jul  2:02 pm,"Divulapitiya, Gampaha","1,275,000","අංක 5 කොළඹ-කුරුණෑගල පාරට මීටර් 300 යි.පර්චස් 16පොල් පැල,එළවළු,බුලත්,වගා කර ඇත.ළිද බැද  ඇත.කම්බි ගසා වට කර ඇත.නිස්කලංක ගැමි පරිසරය පිහිටි මෙම ඉඩම නිවසක් සැදීමට ඉතා සුදුසුයි.මිල ගණන් සාකච්චා කර ගත හැක.බැංකු ණය පහසුකම් ලබා ගත හැක.ඉතා ඉක්මනින් විකිණේ.","Kotadeniyawa,Divulapitiya","Agricultural, Residential, Other",16.0 perches
8,දිවුලපිටිය නගරයෙන් අගනා ඉඩමක්,25 Jul  8:26 am,"Divulapitiya, Gampaha","275,000","දිවුලපිටිය මීගමුව මාර්ගයේ , දිවුලපිටිය ""අයෝවා හෝටලය ඉදිරිපිටම, පළමු පටුමගෙහි පිහිටි පර්,80 අගනා ඉඩම . එකවර හෝ පර්, 16 බැගින් කොටස් 5කට ලබා ගත හැක ...බැංකු ණය ලබා ගත හැකි නිරවුල් ඔප්පු හා අනුමත ප්ලෑන් .. පදිංචියට ඉතාම සුදුසු , සියලුම පහසුකම් සහිත අගනා ඉඩම .. එකවර මිලදී ගන්නෙකුට, විශේෂ අඩුකල මිලකට ..ඉක්මනින් විමසන්න ...","මීගමුව පාර , පළමු පටුමග , දිවුලපිටිය , ""අයෝවා හෝටලය ඉදිරිපිට .","Commercial, Residential, Other",80.0 perches
9,Valuable Land Divulapitiya,25 Jul  8:12 am,"Divulapitiya, Gampaha","325,000","දිවුලපිටිය මන්දාකිණි හෝටලය අසල, පදිංචියට හා ව්‍යාපාරයකට ඉතාම සුදුසු වටිනා ඉඩම . දිවුලපිටිය නගරයට ආසන්න යෙන්ම ඉඩමක් සොයන්නෙකුට ඉතාම අගනා ඉඩම ..සියලුම පහසුකම් සහිතයි, බැංකු ණය ලබා ගත හැක ..","Sarasi Land, Divulapitiya .","Commercial, Residential, Other",14.0 perches
10,"Land for Sale in Mallawagedara, Divulapitiya.",24 Jul  5:44 pm,"Divulapitiya, Gampaha","78,500","20 Perches Land Blocks for Sale in Mallawagedara, Divulapitiya, situated very peaceful residential area. Less than 250 meters to Negombo – Giriulla road and very close to Anagarika Dharmapala Maha Vidyalaya.  7 Km to Divulapitiya Town. Suitable for residential purpose and factory or warehouse.",Mallawagedara,"Commercial, Residential",20.0 perches
11,Valuable Land Divulapitiya,24 Jul  4:21 pm,"Divulapitiya, Gampaha","195,000","මීගමුව දිවුලපිටිය මාර්ගයේ , දිවුලපිටිය නගරය ආසන්නයේම , I PC,  අයෝවා සංචාරක හෝටලය  ඉදිරිපිට , පළමු පටුමගෙහි පිහිටි අගනා වටිනා ඉඩම ...විදුලිය ,ජලය , දුරකථන  ඇතුළු සියලුම පහසුකම් සහිතයි ...අනුමත ප්ලෑන් සහ නිරවුල් ඔප්පු ...බැංකු ණය ලබා ගත හැක ...එකවර හෝ කොටස් වශයෙන් ලබා දිය හැක ..","Negombo Road , 1st Lane,  Divulapitiya ,","Commercial, Residential",80.0 perches
12,Land for Sale - Divulapitiya,24 Jul  4:10 pm,"Divulapitiya, Gampaha","32,500","කොළඹ කුරුණෑගල අංක 5 බස් මාර්ගයේ , දිවුලපිටිය , වල්පිට , ඉන්දන පිරවුම් හල අසල සිට මීටර් 550, දුරින් පිහිටි වටිනා ඉඩම ..         අඩි, 20 පලලින් යුතු මාර්ගයට මුහුණලා පිහිටා ඇත..            තෙකලා විදුලිය , ජලය , සහිතයි ..අනුමත ඔප්පු හා නිරවුල් ප්ලෑන් ...පදිංචියට , කර්මාන්තයකට, හෝ කොටස් කර විකිණීමකට ඉතාම සුදුසුයි ...ඉක්මනින් විකිණීමට ...බැංකු ණය ලබා ගත හැක ..සම්පූර්ණයෙන්ම එකවර මිලදී ගන්නෙකුට පමණක් මෙම විශේෂ  මිලට ...","වල්පිට , දිවුලපිටිය ..","Agricultural, Commercial, Residential",140.0 perches
13,"Land for Sale in Divlapitiya,kudagammana",24 Jul  3:40 pm,"Divulapitiya, Gampaha","1,800,000","ගම්පහ දිස්ත්‍රික්කයේ දිවුලපිටිය ආසනයේ දිවුලපිටිය නගරයට කි.3, දිවුලපිටිය කුඩගම්මන, තැඔිලිගස් හන්දියේ සුදසිංහ වතුයායට මායිම්ව සාරවත් බුලත්, මයියොක්කා සහ තෙක්ක වගාවෙන් යුත් පොල් ඉඩම පර්චස් 36.75, ලක්ෂ 18 යි.  31 වන දිනට ප්‍රථම ගන්නා අයට 5% ක විශේෂ වට්ටමක්. මිඩ්ලන්ඩ් ආයතනයට අවුරුදු 33 ක් පිරීම නිමිත්තෙන් රුපියල් ලක්ෂයක වාසියක්.","දිවුලපිටිය, කුඩගම්මන",Commercial,36.75 perches
14,Land for Sale at Maradagahamula,19 Jul 11:52 am,"Divulapitiya, Gampaha","160,000",maradagamula nagaraye indana piraum hala asal ATHI PARE SITA 100M DURINDIULAPITIYA 2 KMNEGAMBO 24 km,shanthi printers maradaghamula,"Commercial, Residential",45.0 perches
15,කඩිනමි ණය පහසුකම් සහිත ඉඩමක් - මිරිගම,18 Jul  2:21 pm,"Divulapitiya, Gampaha","60,000","මිරිගම මිගමුව 251 කටාන මාර්ගයට 100m දුරින්  වාරාදල හංදියේ   තැනිතලා පොල් ගස් සහිත ඉඩමක් . කොළඹ කුරුණෑගල මාර්ග අංක05 ප්‍රධාන මාර්ගයට 1km, කොටදෙණියාව නගරයට 2km , පන්නල නගරයට  බඩල්ගම නගරයට 5km, 90% කඩිනමින් ණය පහසුකම් .",වාරාදල  හංදිය .( 251 මාර්ගය ),Residential,12.0 perches
16,Land for sale in Maradagahamula,13 Jul  1:08 pm,"Divulapitiya, Gampaha","100,000","මරදගහමුල, නගරයට යාබදව අගනා බිම් කොටසක් වීකිණීමට ඇත","කැළෑපිටිමුල්ල, මරදගහමුල,","Agricultural, Commercial, Residential, Other",40.0 perches
17,Land for sale in Diulapitiya,13 Jul 11:51 am,"Divulapitiya, Gampaha","120,000","Freedom Park- DiulapitiyaLocated just 2km away from Diulapitiya town and only 200m away from Colombo-Kurunegala (no 05) main bus route. Land is full of coconut trees and lush greenery surrounding the land. Green fields- Diulapitiya gives you the convenient access to Horagasmulla primary school which is just steps away.The project comes equipped with the following facilities. • 3 phase electricity • Ample water • Tarred wide road network  • Concrete drains  • Bank loans • Easy payment schemes   Blocks available from 12.5 perches and upwards   Price per perch: 120,000/= and upwards",Freedom Park- Diulapitiya,Residential,12.5 perches
18,"Land for Sale in Mallawagedara, Divulapitiya.",23 Jul 10:06 am,"Divulapitiya, Gampaha","68,500","Good solid 85.5 Perches Land Property for Sale in Mallawagedara, Divulapitiya, situated very peaceful residential area. Less than 400 m to Negombo road and Mallawagedara School.  7 Km to Divulapitiya Town. Suitable for residential purpose and garment factory or warehouse.",Mallawagedara,"Agricultural, Commercial, Other",85.5 perches
19,Land for sale in Dunagaha,12 Jul  1:42 pm,"Divulapitiya, Gampaha","850,000","මීගමුව දිවුලපිටිය 242 බස් පාරේ දුනගහ කඩවල පන්සල පාරේ ජයබිම gardens. පෙර්චෙස් 12 1/2 බිම්කොටස් 2. පෙර්චෙස් 12 1/2 ම ලක්ෂ 8 1/2.මිඩ්ලන්ඩ් දේපල වෙළද සමාගමට වසර 33ක් පිරීම නිමිත්තෙන් මේ ජුලි මාසයේ 27වන දිනට ප්‍රථම එකවර මුදල් ගෙවන අයට 5% විශේෂ වට්ටම්. රු. 75,000ක වාසිදායක ඉතිරියක්. බැංකුණය සහිති.","Dunagaha, Kadawala","Agricultural, Commercial, Residential, Other",25.0 perches
20,"Land for sale in Diwulapitiya, Kudagammana",12 Jul  1:18 pm,"Divulapitiya, Gampaha","3,500,000",දිවුලපිටිය කුරුණෑගල නො . 05 බස් පාරට කි.මී. 1 1/2 ක් නුදුරින් කුඩගම්මන පන්සල අසල සුදසිංහ වතුයාය පාරට මායිම්ව පෙර්චස් 78ක ඉඩමක්.සම්පුර්ණ වශයෙන් හෝ කොටස් දෙක බැගින් ලබා ගත හැක. පෙර්චස් 78ම ලක්ෂ 35. පෙර්චස් 40 කොටස් වශයෙන් ලබාගන්නේ නම් ලක්ෂ 18 1/2.සාරවත් පොල් හා අතුරු බෝග සහිත ඉඩමකි. ,"Near Kudagammana temple, Sudasingha Wathuyaya, Diwulapitiya","Agricultural, Commercial, Residential, Other",78.0 perches
21,Land for Sale - Divulapitiya,11 Jul  4:55 pm,"Divulapitiya, Gampaha","50,000",Poll idamak. Kurudu  wagakara atha.,Agricultural,1.0 acres,
22,Land for sale Mirigama,10 Jul  7:50 am,"Divulapitiya, Gampaha","5,500,000",Mirigama diwlapitiya pradhana paren rassapaana paarata muhunala athi Mema aganaa idama itha ikmanin wikinimata atha. Wedi wisthara sandaha adama amathanna 077-6632542 (Mr.Sheltan),"Agricultural, Commercial, Residential, Other",80.0 perches,
23,Land for Sale in Divulapitiya,20 Jul 11:25 am,"Divulapitiya, Gampaha","230,000",Superb residential lands5 Minutes away from Divulapitiya town7 Minutes away from Minuwangoda townClose proximity to schools and super markets.Calm and relaxing environmentFast developing areaWater/Electricity and all other convenient facilities,Land for sale in Diulapitiya,Residential,15.0 perches
24,Land For Sale Divulapitiya, 6 Jul  9:19 pm,"Divulapitiya, Gampaha","600,000","දිවුලපිටිය ,ගම්පහ බස් පාරට 300m විතානමුල්ල පාසලට ආසන්නයේ ,තැනිතලා parches 7 ඉඩම ලක්ෂ 6 පමණයි .( අත්පිට මුදලට පමණයි ).","දිවුලපිටිය ,ගම්පහ බස් පාරට විතානමුල්ල","Agricultural, Residential",7.0 perches
25,Land For Sale Divulapitiya, 6 Jul  2:19 pm,"Divulapitiya, Gampaha","600,000","දිවුලපිටිය ,ගම්පහ බස් පාරේ විතානමුල්ල පාසලට ආසන්නයේ කුඹුරු යායක් මායිමේ පිහිටි දර්ශනීය ඉඩම ,ජලය ,විදුලිය සහිත තැනිතලා බිම්කඩකි .මුළු ඉඩමම ලක්ෂ 6","දිවුලපිටිය ,ගම්පහ බස් පාරට 300m විතානමුල්ල","Agricultural, Residential",10.0 perches
26,Land For Sale Divulapitiya, 6 Jul  2:15 pm,"Divulapitiya, Gampaha","1,800,000","කොළඹ ,කුරුණෑගල (5)පාරට 1km දිවුලපිටිය ,උළු කඩේ හන්දිය මාබොදල පාරට මායිමේ ඉතා වටිනා  ඉඩම මුදල් හදිසි නිසා අඩුම මිලකට .කුඩා නිවසක් ද සහිතයි .පොල්, කොස් ,පුවක් ආදායම් ඇති අනර්ඝ ඉඩම","කොළඹ ,කුරුණෑගල (5) පාරේ දිවුලපිටිය උළු කඩේ හන්දිය","Agricultural, Commercial, Residential",33.0 perches
27,ඉඩම විකිණීම විතානමුල්ල, 4 Jul  2:51 pm,"Divulapitiya, Gampaha","600,000","දිවුලපිටිය ගම්පහ බස් පාරට 300mදර්ශනීය කුඹුරු යායක් මායිමේ පිහිටි තැනිතලා බිම්කඩකි ,මුළු ඉඩමම ලක්ෂ 6 පමණයි .","දිවුලපිටිය ,ගම්පහ පාර විතානමුල්ල","Agricultural, Residential",10.0 perches
28,Land for Sale in Divulapitiya, 4 Jul 10:55 am,"Divulapitiya, Gampaha","80,000","දිවුලපිටිය වරාදල පාරට මුහුනලා රුපියල් 25,000 බැගින් මාස 12ක් ගෙවා පදිoචිවන්න..... *කොන්දෙසි සහිතයි*.... දැන්ම අමතන්න. පදිචියට ආයෝජනයට අනාගතයට....!!!",Divulapitiya,Residential,12.0 perches
29,Land for sale in Diulapitiya,13 Jul 11:51 am,"Divulapitiya, Gampaha","120,000","Freedom Park- DiulapitiyaLocated just 2km away from Diulapitiya town and only 200m away from Colombo-Kurunegala (no 05) main bus route. Land is full of coconut trees and lush greenery surrounding the land. Green fields- Diulapitiya gives you the convenient access to Horagasmulla primary school which is just steps away.The project comes equipped with the following facilities. • 3 phase electricity • Ample water • Tarred wide road network  • Concrete drains  • Bank loans • Easy payment schemes   Blocks available from 12.5 perches and upwards   Price per perch: 120,000/= and upwards",Freedom Park- Diulapitiya,Residential,12.5 perches
30,Land For Sale Divulapitiya, 3 Jul  2:42 pm,"Divulapitiya, Gampaha","65,000","දිවුලපිටිය ,ගම්පහ බස් පාරට 150mමහගෙදර වත්ත වෙන්දේසි වත්ත අසල පොල් ,පුවක් සහිතයි , පුළුල් මාර්ග . (මුදල් හදිසි නිසා ප්‍රදේශයේ පවතින මිලට ඉතා අඩුවෙන් )","දිවුලපිටිය ,ගම්පහ පාර විතානමුල්ල","Agricultural, Residential",44.0 perches
31,Land for Sale Minuwangoda,11 Jul  2:37 pm,"Divulapitiya, Gampaha","5,000,000",environmental friendly 20mins to katunayake10mins to Colombo Kurunegala bus route,Aluthapola Minuwangoda,Agricultural,80.0 perches
32,Coconut Land With House - Divulupitiya,24 Jul 10:26 am,"Divulapitiya, Gampaha","18,000,000","ගම්පහ දිස්ත්‍රික්කයේ , දිවුලපිටිය , වල්පිට ප්‍රදේශයේ පිහිටි අක්කර 4, වටිනා පොල් ඉඩම . පිරිසිදු ලිං ජලය හා විදුලිය වෙන් වෙන්ව ඇති අංගසම්පූර්ණ වටිනා නිවාස 2ක් සහිතයි . පළතුරු හා අනෙකුත් වටිනා දැව සහිතයි . බැංකු ණය ලබා ගත හැක. එකවර මිලදී ගන්නා අයෙකුට විශේෂ මිල අඩුකිරීමක්, අක්කරයක් ,ලක්ෂ 45/= බැගින් ..","Walpita , Divulapitiya .","Agricultural, Commercial, Residential, Other",4.0 acres
33,Land for Sale in Divulapitiya, 1 Jul  5:19 pm,"Divulapitiya, Gampaha","45,000","ගම්පහ - දිව්ලපිටිය පාරේ ඉගුරු කඩේ හන්දියෙන් 1km පමණ ඇතුලට ඉහලගම , මාබොදල පිහිටි ඉඩම පොල් වගාව සහිතයි ","ඉහලගම , මාබොදල","Agricultural, Residential, Other",70.0 perches
34,Valuable Land for Sale Walpita .,24 Jul 10:26 am,"Divulapitiya, Gampaha","35,000","කොළඹ කුරුණෑගල අංක 5, බස් මාර්ගයේ , දිවුලපිටිය  වල්පිට ඉන්දන පිරවුම්හල අසළ මාර්ගයේ 500 m, දුරින් පිහිටි ව්‍යාපාරයකට හෝ පදිංචියට ඉතාම සුදුසු වටිනා ඉඩම . පළල් මාර්ගය, ජලය  හා තෙකලා විදුලිය සහිතයි . කොටස් කර විකුනන ව්‍යාපාරයකට ඉතාමත් සුදුසු අනුමත ප්ලෑන් සහ බැංකු ණය ලබා ගත හැකි නිරවුල් ඔප්පු . ඉක්මනින් විකිනීමට . එකවර ඉක්මනින් මිලදී ගන්නා අයෙකුට , පර්, 1ක්, 35,000/= බැගින් .","කොළඹ 5 පාර , වල්පිට .","Agricultural, Commercial, Residential",141.0 perches
35,Valuable Land with House - Divulapitiya,24 Jul 10:26 am,"Divulapitiya, Gampaha","155,000","කොළඹ කුරුණෑගල අංක 5 බස් මාර්ගයටම මුහුණලා පිහිටි වටිනා ඉඩම . ගෙයක් සහ ව්‍යාපාරික ස්ථානයක් සහිත කැබලි කර විකිනීමට සුදුසු අගනා ඉඩම . වැඩිම ඉල්ලුමට ,ඉක්මනින් විකිනීමට .  බැංකු  ණය ලබාගත හැකි නිරවුල් ඔප්පු හා අනුමත ප්ලෑන් .","කොළඹ 5, පාර , දොඹවින්න .","Commercial, Residential",90.0 perches
36,Perches 20 Land for Sale In - MARADAGAHAMULA,29 Jun  3:08 pm,"Divulapitiya, Gampaha","1,400,000",මරදගහමුල-දුනගහ අතර නෙල්ලිහහමුල හන්දියෙ-නගෙනහිරපල්ලියපිටිය පාරෙ වඩුපාසලෙ සිට 500m දුරින් පර්:20 ඉඩම විකිනිමට.පර්:70000,Commercial,20.0 perches,
37,දිවුලපිටිය නගරයෙන් පදිංචියට ඉඩමක්,29 Jun  8:47 pm,"Divulapitiya, Gampaha","260,000","කොළබ -කුරුණෑගල 05 ප්‍රදාන බස් පාරේ,දිවුලපිටිය නගර සිමාව තුළ,ආරක්‍ෂිත තාප්පයකින් වටවූ,සුන්දර වෙල්යායකට මුහුණලා පිහිටි,සුපිරි බිම් කොටස් 4ක් (පර්චස් 12.5).පර්චසය රු. 260000/= සිට විකිනීමට ඇත.එකවර ගෙවීමේදී විශේෂ වට්ටම් !,බැංකු ණය පහසුකම් !!,විදුලිය, ජලය ඇතුළු සියලු නේවාසික පහසුකම් සහිතයි,ගම්පහ නගරයට, වේයන්ගොඩට විනාඩි 30යි,කටුනායකට, මීගමුවට විනාඩි 25යි,බැංකු, ජනප්‍රිය පාසල්, රෝහල්, සුපිරි වෙළදසැල් ඇතුළුසියලු නාගරික පහසුකම් සහිතයි.අමතන්න-ජයසිංහ","කොලබ පාර, දිවුලපිටිය.",Residential,12.5 perches
38,දිවුලපිටිය නගරයට 2 Km දුරින් පදිංචියට ඉඩමක්,29 Jun 11:52 am,"Divulapitiya, Gampaha","52,500","ගම්පහ - දිවුලපිටිය 211 ප්‍රදාන බස් මාර්ගය ආසන්නයේ දිවුලපිටිය නගරයට 2Km දුරින්, මාබොදල, නිස්කලංක පරිසරයක පිහිටි පර්චස් 15 අගනා නේවාසික බිම් කොටස් දැන් විකිණේ.පර්චසය රු. 52500/= සිට,එකවර ගෙවීමේදී විශේෂ වට්ටම් !,පොළිය රහිතව පහසු ගෙවීමේ ක්‍රමයට !!,විදුලිය, ජලය ඇතුළු සියලු නේවාසික පහසුකම් සහිතයි,ගම්පහ නගරයට, වේයන්ගොඩට විනාඩි 15යි,කටුනායකට, මීගමුවට විනාඩි 20යි,බැංකු, ජනප්‍රිය පාසල්, රෝහල්, සුපිරි වෙළදසැල් ඇතුළුසියලු නාගරික පහසුකම් සහිතයි.අමතන්න-ජයසිංහ ","මාබොදල, දිවුලපිටිය.",Residential,15.0 perches
39,Coconut Estate for sale in Divulapitiya,23 Jul  9:25 am,"Divulapitiya, Gampaha","8,000,000","Coconut Estate for sale in Godigomuwa, Divulapitiya","Godigamuwa,Badalgama,Divulapitiya","Agricultural, Commercial, Residential, Other",15.0 acres
40,144 P Land SALE Kotadeniyawa GAMPHA,21 Jun  5:03 pm,"Divulapitiya, Gampaha","60,000",144 Perches of Coconut Cultivated Land - Kotadeniyawa (Gampaha Dist.),Nawana-Diyagampala Road. 500m from the main Negombo-Giriulla Road (B322) in Kotadeniyawa.,"Agricultural, Commercial, Residential, Other",144.0 perches
