,0,1,2,3,4,5,6,7
84,Beach Land for Sale - Ja ela,17 Jul 12:24 pm,"Ja-Ela, Gampaha","500,000",- Beautiful rectangular beach front land for Sale in Pamunugama- Wide main road access - Wide beach front to property- Electricity & Water connection - Old Portugese styled house at property - Ideal location for a beach resort,Pamunugama Road,"Commercial, Residential",90.0 perches
85,Land For Sale - Ja-Ela,17 Jun 12:16 pm,"Ja-Ela, Gampaha","675,000","8 perches land with all facilities. Very good nature environment in Ja-ela. Road access 30ft . 200 meters to Colombo - Negombo main Rd, 5 minutes drive to Colombo - Katunayaka  Highway.5 minutes walking distance to Railway Station Ja-Ela and main Bus Stand.Close to Leading Schools/ Banks/ Shopping complex and Food courts.","Royal Park, Weligampitiya, Ja-Ela.",Residential,8.0 perches
86,Land for Sale | North Kudahakapala-Ja Ela,15 Jun  6:49 pm,"Ja-Ela, Gampaha","350,000","ඍජුකෝණාස්‍රාකාර  ඉඩමකි.ජාඇල නගරයට විනාඩි 5න් ලගා විය හැකියපිරිසිදු ජලය, විදුලිය සියළු නාගරික පහසුකම්වලින් යුක්තයි.ජල පීඩා නොමැතපුළුල් මාර්ගපදිංචියට සුදුසු පරිසරයක පිහිටා ඇත.තාප්පය සහිතයිමිලගණන් සාකච්ඡා කරගත හැකිය",North Kudahakapala-Ja ela,Residential,25.0 perches
87,4 Acres Land for Sale Ja-Ela,28 Jun  2:52 pm,"Ja-Ela, Gampaha","600,000,000",land for sale Ja ela 4 acres land for sale Price 600 million,Ja-ela,"Agricultural, Commercial, Residential",4.0 acres
88,Land for Sale in Ja-Ela,16 Jun 11:27 am,"Ja-Ela, Gampaha","325,000","Land For Sale In Ja-Ela Along The St, Mary's Road  Towards Ganemulla Passing the St Mary's School About 100m Turn to your Right on KandeWatte Road Leading Towards the The Finance Watta , Only 1 Block Left from the Scheme Water , Electricity Facilities , 15Feet Wide Road Ideal For Newly Married  Couple to Build a House.No Brokers , Genuine Buyers Only","Ganemulla Road , Ja-Ela",Residential,13.0 perches
89,Land for Sale in Ja Ela,12 Jun  8:18 pm,"Ja-Ela, Gampaha","195,000",Land for sale in Jaela,Jaela,"Commercial, Residential",58.0 perches
90,ඉඩමක් විකිණීමට ජාඇල, 5 Jul  2:50 pm,"Ja-Ela, Gampaha","2,200,000",මුදල් හදිස්සිය සඳහා දෙනූ ලැබේ .අධිවේගීමාර්ගයට 100m.ජාඇල නගරයට 3 මිනිත්තු .ඉඩමට 10ft පාර ඇත.,"සෙබස්තියන් පෙරේරා මාවත ,තුඩැල්ල ජාඇල",Other,10.0 perches
91,Land for Sale in Ja Ela,11 Jun  2:54 pm,"Ja-Ela, Gampaha","650,000",Land For Sale in Jaela | Weligampitiya,Jaela | Weligampitiya,"Commercial, Residential",10.0 perches
92,Land For sale ( Valuable Land) - Ja-Ela,11 Jun 10:35 am,"Ja-Ela, Gampaha","225,000","ඒකල නගරයේ සිට 300m දුරින් කන්‍යාරාම මාවතෙන් වටිනා ඉඩමක් පර්චස් 23.5ක් ඇති ඉඩම සම්පුර්ණයෙන් හෝ කොටස් වසයෙන් විකිණීමට පදිංචියට හෝ ව්‍යාපාරික( බොඩින් හවුස් ) කටයුතු සඳහා සුදුසුය නගරය පෙනෙන දුරින් සියලු නාගරික පහසුකම් සහිතය පුළුල් මාර්ග , ජලය , විදුලිය පහසුකම් ඉඩම වටා තාප්ප දමා ඇත මිල ගණන් කතා කර ගත හැක වැඩි විස්තර සඳහා අමතන්න","Ekala , Jaela","Commercial, Residential",23.5 perches
93,Land for Sale in - Ja Ela,10 Jun  4:25 pm,"Ja-Ela, Gampaha","550,000","Land for Sale in Walikuruduwatta, Kapuwatta, Ja-Ela.",Residential,14.5 perches,
94,ඉඩමක් විකිනීමට - මීගමු පාර,10 Jun  1:52 pm,"Ja-Ela, Gampaha","185,000","ඉඩමක් විකිනීමට... මීගමු පාරට 1km දුරින් ජා ඇල සහ සීදුව නගරයන් වලට මැදිව පිහිට් ඉඩම නිස්කලංක පරිසරයක ඇත.ඉඩම දෙපසින්ම මාර්ග දෙකක් ඇත.ජා ඇල නගරයට විනාඩි 10/කටුනායක ගුවන්තොටුපොළට විනාඩි 10/සීදුව නගරයට විනාඩි 5.ඉඩමේ ප්‍රමාණය පර්චස් 103කි.පදිංචියට වඩාත් හොදයි.අලවතුපිටිය දුම්රිය පොලට විනාඩි 2ක දුරින් පිහිටි ඉඩම පර්චස් එකක් 185, 000කි.ගණන් කතා කල හැක.සම්පුර්ණ ඉඩම පමණක් විකිනෙ.",Residential,103.0 perches,
95,Land for Sale - Jaela,10 Jul  1:03 pm,"Ja-Ela, Gampaha","125,000","200 m to Shanta Reeta mw200 m to Batagama Awariwathta mw 800 m to 266,278 Ganemulla bus rd1 km to jaela town","Shanta Reeta mw,Tumpaaliya,Jaela","Commercial, Residential",10.0 perches
96,Land for Sale in Ja-Ela, 7 Jun  8:35 pm,"Ja-Ela, Gampaha","900,000",Good Residential Land in Ja ElaFacing a Kisthuraja Mawatha,"Agricultural, Commercial, Residential, Other",84.0 perches,
97,Land with Two Rooms House and Separate 8 for Sale in Ekala, 6 Jun 12:03 pm,"Ja-Ela, Gampaha","8,000,000",Two Rooms House And Separate 8 RoomsNext to industrial zoneIdeal place for room/house rent service or boaring roomsLand size nearly 20 perches4laks per perch(slightly negotiable after inspection)No brokers pls,"Ekala, Ja Ela",Residential,20.0 perches
98,10 Perches Land for Sale Ja Ela, 7 Jun  2:54 pm,"Ja-Ela, Gampaha","350,000",10 perches land (2 slots)2 KM distance from Colombo Negombo roadSituated in Prime land schemeHighly residential area,Residential,10.0 perches,
99,Land With House For Sale In Ja Ela, 5 Jun  4:00 pm,"Ja-Ela, Gampaha","7,500,000",Land With House For Sale In Ja Ela,JaEla,"Commercial, Residential",15.0 perches
100,Land for Sale in Ja Ela, 2 Jul  9:13 am,"Ja-Ela, Gampaha","64,000,000","Land for Sale inJa Ela - St Anthony's Mawatha02 AcresSuitable for Business, Factory, Warehouse, Hotel or Housing Project","Commercial, Residential",2.0 acres,
101,Land for Sale in Seeduwa / Negombo-Gampaha Bus Route, 3 Jun 12:55 pm,"Ja-Ela, Gampaha","175,000",Land for sale in Seeduwa with modern house plan (Negombo-gampaha Main Road),"Negombo-gampaha Main Road, Near Raddalugama Junction",Residential,14.5 perches
102,Land for Sale Ja-Ela, 2 Jun 10:54 pm,"Ja-Ela, Gampaha","200,000","Ekala CTB junction Wimalajoyhi Thera road 10 perches for sale.Siyal Pen Company road.The price per perch is 200,000.Very good title.High residence.Get your appointment before you visit the house.Good land to build houses.Genuine buyers only no brokers.",Ja-Ela,Residential,10.0 perches
103,Land for Sale - Ja Ela, 2 Jun 10:44 pm,"Ja-Ela, Gampaha","245,000","Ja-Ela Ekala Kanyarama Mawatha very valuable 23 perches for sale.Price per perch is 245,000.Near By Ekala City.Wide roads.The land can even be divided to 8 perches.Price is negotiable.Get your appointment before your visit.Genuine buyers only no brokers.",Ekala,Residential,23.0 perches
104,Land for Sale in Minuwangoda,10 Jul  1:03 pm,"Ja-Ela, Gampaha","6,200,000",This land located on polwaththa road minuwangoda.2km to airport2km to negambo Colombo mean road15 perches,Residential,15.0 perches,
105,Land with House for Sale in - Ja Ela,28 May  8:59 pm,"Ja-Ela, Gampaha","2,800,000","ජාඇල,කනුවන,කුරුදුවත්ත,ධර්මපාල මාවතේ පර්චස් 7ක ජලය,විදුලිය සහිත අගනා බිම්කොටස සහ නිවස විකිනීමට ඇත.",Residential,7.0 perches,
106,Land for Sale in Ja Ela Bopitiya,17 Jun 11:21 am,"Ja-Ela, Gampaha","475,000",ජා-ඇල බෝපිටිය පල්ලිය පාරේ පර්චස් 20ක අගනා ඉඩමක් විකිණීමට ඇත. ජා-ඇල අධිවේගී පිවිසුමට විනාඩි 5යි.,Residential,20.0 perches,
107,3.4 Acres Bare Land for Sale in Muthurajawela,12 Jul  1:56 pm,"Ja-Ela, Gampaha","544,000,000",•Our Reference No. SL 9209(Please quote this reference number when inquiring.)	,Muthurajawela,"Commercial, Other",544.0 perches
108,Land for Sale in Ja Ela,25 May  7:03 pm,"Ja-Ela, Gampaha","180,000",# Land for Sale in Ja Ela / Waligampitiya .....# කොළඹ - මීගමුව ප්‍රධාන පාරට කි.මී. 3 යි....# ගුරුගේ පාක් එකේ සිට කි.මී. 1 යි...# පිරිසිදු ඔප්පු / ලියකියවිලි # ඉඩමට අඩි 15 පාර# තවත් ඉඩම් කැබලි ඇත,Ja Ela / Waligampitiya,Residential,14.5 perches
109,Land For Sale In Kapuwatta Ja Ela,25 May 12:35 pm,"Ja-Ela, Gampaha","15,000,000",Land For Sale In Kapuwatta Ja Ela.5 Minutes Distance To Ja Ela High Way Entrance800 M To K-Zone Ja Ela.Walking Distance To Negambo  / Colombo Road.Calm Residential AreaClear Title.750000/- Per Perch,"Fatima Road, Valikuruduwatta, Kapuwatta, Ja Ela.",Residential,20.0 perches
110,Beach Land for Sale - Ja ela,17 Jul 12:24 pm,"Ja-Ela, Gampaha","500,000",- Beautiful rectangular beach front land for Sale in Pamunugama- Wide main road access - Wide beach front to property- Electricity & Water connection - Old Portugese styled house at property - Ideal location for a beach resort,Pamunugama Road,"Commercial, Residential",90.0 perches
111,Commercial Land for Sale at Ekala,18 Jul  8:45 pm,"Ja-Ela, Gampaha","440,000",8 ACERS COMMERCIAL PROPERTY LAND FOR SALE AT JA-ELA  EKALA. 30 FEET ROAD ACCESS. 20 FEET CONTAINER ACCESS WITH AMPLE PARKINGSURROUNDED BY  BOUNDARY WALL MORE SUITABLE FOR WAREHOUSE AND FACTORY HOUSING PROJECTS.5 MINS TO NEGOMBO MAIN ROAD ALL THE SUPERMARKET ACCESS,"Ekala , Ja-Ela","Commercial, Residential",8.0 acres
112,19 Perch Land for Sale in Seeduwa Ja-Ela,23 May  2:01 pm,"Ja-Ela, Gampaha","500,000","19 Perch Land available for sale in Seeduwa Ambalammulla, Ja-Ela,  * 100 Mtrs away from Colombo Negombo main road.* 15 Feet Road available to Land. * Clear Deeds can apply for bank loan ","Ambalammulla, Seeduwa Ja-Ela","Agricultural, Commercial, Residential, Other",19.0 perches
113,Land for Sale in Wewala,10 Jul  1:03 pm,"Ja-Ela, Gampaha","320,000",This land located on wewala jaelaNear by wewala church12 perches1km to jaela town,Residential,12.0 perches,
