,0,1,2,3,4,5,6,7
0,title,posted date,location,price,description,Address:,Land type:,Land size:
1,Commercial Land for Sale at Ekala,18 Jul  8:45 pm,"Ja-Ela, Gampaha","440,000",8 ACERS COMMERCIAL PROPERTY LAND FOR SALE AT JA-ELA  EKALA. 30 FEET ROAD ACCESS. 20 FEET CONTAINER ACCESS WITH AMPLE PARKINGSURROUNDED BY  BOUNDARY WALL MORE SUITABLE FOR WAREHOUSE AND FACTORY HOUSING PROJECTS.5 MINS TO NEGOMBO MAIN ROAD ALL THE SUPERMARKET ACCESS,"Ekala , Ja-Ela","Commercial, Residential",8.0 acres
2,"['Commercial Land for Sale at Ekala', '18 Jul  8:45 pm', 'Ja-Ela, Gampaha', '440,000', '8 ACERS COMMERCIAL PROPERTY LAND FOR SALE AT JA-ELA  EKALA. 30 FEET ROAD ACCESS. 20 FEET CONTAINER ACCESS WITH AMPLE PARKINGSURROUNDED BY  BOUNDARY WALL MORE SUITABLE FOR WAREHOUSE AND FACTORY HOUSING PROJECTS.5 MINS TO NEGOMBO MAIN ROAD ALL THE SUPERMARKET ACCESS', 'Ekala , Ja-Ela', 'Commercial, Residential', '8.0 acres']","['title', 'posted date', 'location', 'price', 'description', 'Address:', 'Land type:', 'Land size:']",,,,,,
3,Land for Sale - Batuwattha,18 Jul  5:49 pm,"Ja-Ela, Gampaha","310,000",රාගමට කිලෝමිටර 3ස්ටේෂමට විනාඩි 5 දුර979 ප්‍රධාන පාරට නුදුරින්.පර්. 34.8 යිපර්. එකක් 3.10 යිමුදල සාකච්චා කර ගත හැකිය.,"111D, Batuwattha, Ragama.",Residential,34.8 perches
4,Land for sale Jaela,21 Jul 11:31 pm,"Ja-Ela, Gampaha","3,250,000",Suitable for a business or residentialPerches 10 Near to avariyawatta RoadCalm and quiet placeAn opportunity not to be missed3.25million,"Avariyawatta Road, Batagama, Jaela","Commercial, Residential",10.0 perches
5,Land for sale Jaela,21 Jul 11:30 pm,"Ja-Ela, Gampaha","4,400,000",200m for Jaela Town200m for Colombo - Negombo road200m for highway entrance200m for Railway stationClear deeds with Bank loan facilitiesAn opportunity not to be missed4.4 million per perch,"St. Mary's Road, Jaela","Commercial, Residential",8.0 perches
6,Land for Sale - Ja Ela,21 Jul  9:28 pm,"Ja-Ela, Gampaha","3,000,000",Calm and quiet area12.5 perch3 million per perch,"St. Rita Road, Maeliya, Jaela","Commercial, Residential",12.5 perches
7,Land for Sale - Ja Ela,20 Jul 12:16 pm,"Ja-Ela, Gampaha","2,175,000",Nice land for residential purpose immediately sale the products as urgent money requirement,Residential,18.78 perches,
8,20 Perch Land With Two Houses - Ja-Ela Ekala,19 Jul 11:32 am,"Ja-Ela, Gampaha","6,000,000",එකල කතොලික පල්ලිය අසන්නව පිහිටි පර්ච් 20 ක ඉඩමක් සහ අඩක් නිමකල නිවාස 2ක් විකිණීමට ඇත ,"Ja Ela,  Ekala, Kotugoda Road, Near Catholic Church Ekala","Agricultural, Commercial, Residential, Other",20.0 perches
9,"Beach Front Property for Sale in Pamunugama, Ja-Ela",19 Jul  1:18 pm,"Ja-Ela, Gampaha","650,000","Good Residential/Commercial Property in Pamunugama, Ja-ElaPeaceful surrounding, Good Neighborhood","Pamunugama, Ja-Ela","Commercial, Residential, Other",27.0 perches
10,Commercial Land for Sale at Ekala,18 Jul  8:45 pm,"Ja-Ela, Gampaha","440,000",8 ACERS COMMERCIAL PROPERTY LAND FOR SALE AT JA-ELA  EKALA. 30 FEET ROAD ACCESS. 20 FEET CONTAINER ACCESS WITH AMPLE PARKINGSURROUNDED BY  BOUNDARY WALL MORE SUITABLE FOR WAREHOUSE AND FACTORY HOUSING PROJECTS.5 MINS TO NEGOMBO MAIN ROAD ALL THE SUPERMARKET ACCESS,"Ekala , Ja-Ela","Commercial, Residential",8.0 acres
11,Land for Sale - Batuwattha,18 Jul  5:49 pm,"Ja-Ela, Gampaha","310,000",රාගමට කිලෝමිටර 3ස්ටේෂමට විනාඩි 5 දුර979 ප්‍රධාන පාරට නුදුරින්.පර්. 34.8 යිපර්. එකක් 3.10 යිමුදල සාකච්චා කර ගත හැකිය.,"111D, Batuwattha, Ragama.",Residential,34.8 perches
12,"Land for Sale in Niwandama, Ja-Ela.",18 Jul 10:17 am,"Ja-Ela, Gampaha","225,000","Residential Land Blocks with all necessary facilities for Sale in Niwandama, Ja-Ela. Close to Ja Ela, Kandana, Ganemulla cities. Close proximity to 278 Ja-Ela Bus Route.",Niwandama,"Commercial, Residential, Other",13.0 perches
13,Land for Sale in Dandugama,18 Jul  8:36 am,"Ja-Ela, Gampaha","575,000",Very good land and near the dandugama bridge this land,"no 451 dandugama,ja ela","Commercial, Residential",22.0 perches
14,Beach Land for Sale - Ja ela,17 Jul 12:24 pm,"Ja-Ela, Gampaha","500,000",- Beautiful rectangular beach front land for Sale in Pamunugama- Wide main road access - Wide beach front to property- Electricity & Water connection - Old Portugese styled house at property - Ideal location for a beach resort,Pamunugama Road,"Commercial, Residential",90.0 perches
15,Land for Sale Ja Ela,16 Jul 10:00 pm,"Ja-Ela, Gampaha","1,100,000",21 perches land with house ideal for waya House and housing project factory and transport services other immediately for sale.,chndara place ja ela. towan,"Commercial, Residential, Other",21.0 perches
16,"Land for Sale in Ekala, Ja-Ela",16 Jul  2:16 pm,"Ja-Ela, Gampaha","350,000","This is a good flat land situated Ekala, Ja-ela. 1.5Km from the Ekala mota Junction. Good for industrial, warehouse usage or residential usage. you can buy whole 45 perches or 7.5 Perches blocks.","Commercial, Residential",45.0 perches,
17,"Bopitiya Road, Jaela Land for Sale - MCP242",15 Jul  8:45 pm,"Ja-Ela, Gampaha","500,000",7.5 Acre landThis Land is located in Bopitiya road and Good for the hotel project.,Commercial,7.5 acres,
18,Ja-Ela Commercial Land For sale - CC684,15 Jul  8:52 pm,"Ja-Ela, Gampaha","250,000,000","#. 505 perch large flat land with few buildings. #. Located in Agaradaguru Mawatha, Ja-Ela.",Commercial,505.0 perches,
19,Ja-Ela Land for Sale - LL663,15 Jul  7:55 pm,"Ja-Ela, Gampaha","1,150,000","#. 28 perch land located in Pantalin Mawatha, Ja-Ela#. 200 Meters away from negambo Road and Very close to Rilaulla Junction.",Residential,28.0 perches,
20,Land for Sale in Ja Ela,18 Jul 11:04 am,"Ja-Ela, Gampaha","300,000","20 and 25 feet wide road access .Land extent - 10.8 perches Price Rs 300,000/- per perch (negotiable)",Residential,10.8 perches,
21,90+ Perches Commercial Land for Sale in Ja Ela,15 Jul  4:26 pm,"Ja-Ela, Gampaha","700,000","90+ Perches highly valuable Commercial Land for Sale in Ja Ela, situated in between Ja-Ela city and Katunayake – Colombo Highway Interchange. This property currently occupied for Container Yard of  Freight Forwarding Company. Suitable for  Apartments Complex, Hotel/ Reception Hall, Ware House or any other commercial purpose.",Delathura Road,"Commercial, Residential",90.0 perches
22,Land for Sale - Ja-Ela,13 Jul 10:28 pm,"Ja-Ela, Gampaha","150,000","Ja-ELa Niwandama Annasi Watta 17.5 perches for sale.Price per perch is 150,000.30 feet road.Best land to build your place.High residential area.Get your appointment before your visit.Genuine buyers only no brokers.",Ja-Ela,Residential,17.5 perches
23,Land blocks for sale in thudella Kristhuraja mw,15 Jul  9:43 am,"Ja-Ela, Gampaha","650,000",Land blocks for Sale in Thudella Kristhuraja mw ,"thudella Kristhuraja mw,ja ela",Residential,8.0 perches
24,Land in Pamunugama,12 Jul  6:01 pm,"Ja-Ela, Gampaha","260,000","Cool & Calm Residential land is to be sold at Weliketiya, Pamunugama, Ja Ela.","Bopitiya,Weliketiya, Pamunugama","Commercial, Residential",30.0 perches
25,Land for Sale in Bopitiya,12 Jul  2:23 pm,"Ja-Ela, Gampaha","275,000",5 minutes to colombo katunayake Hoighway100 m to Bopitiya ChurchCall for more informationQuick Sale,"Bopitiya,Pamunugama","Residential, Other",20.0 perches
26,335 p land sale uswetakeiyyawa,10 Jul  3:47 pm,"Ja-Ela, Gampaha","325,000",The Land is near Palm Village Uswetakeiyyawa Pamunugama jaela ,The Land is near Palm Village Uswetakeiyyawa Pamunugama jaela,"Agricultural, Commercial, Residential",335.0 perches
27,Land for Sale in Ja - Ela,17 Jul 10:03 am,"Ja-Ela, Gampaha","370,000",Land for Sale in Ja-ela=================,"Commercial, Residential",34.6 perches,
28,Land for Sale - Ekala,10 Jul 12:40 pm,"Ja-Ela, Gampaha","450,000","The land is on Ekala-Minuwangoda main roadSecond block from the main road (80M walking distance to the land from the main road)2.2Km from Ekala junction, 1KM from Kotugoda JunctionHighly residential area Following properties are within 1.5 KM radius from the land(Milleninnium  City, Filling station, Cargills food city, Machan restaurant, Post office, Seylan ATM etc)",Parisara Mawatha,Residential,10.5 perches
29,Land for Sale in Ja Ela - Weligampitiya,13 Jul  1:25 pm,"Ja-Ela, Gampaha","575,000",ජා ඇල වැලිගම්පිටිය උසාවිය පාර - 1වන පටුමගේ වටිනා පර්වස් 12ක ඉඩම් කැබැල්ලක් විකිණීමට. පර්චසයක මිල රැ 575000 වන අතර මිල සාකච්ඡා කර කුඩා ප්‍රමානයකින් අඩු කරගත හැක.,"1st Lane - Courts Road, Weligampitiya, Ja Ela",Residential,12.0 perches
30,Commercial Land for Sale at Ekala,18 Jul  8:45 pm,"Ja-Ela, Gampaha","440,000",8 ACERS COMMERCIAL PROPERTY LAND FOR SALE AT JA-ELA  EKALA. 30 FEET ROAD ACCESS. 20 FEET CONTAINER ACCESS WITH AMPLE PARKINGSURROUNDED BY  BOUNDARY WALL MORE SUITABLE FOR WAREHOUSE AND FACTORY HOUSING PROJECTS.5 MINS TO NEGOMBO MAIN ROAD ALL THE SUPERMARKET ACCESS,"Ekala , Ja-Ela","Commercial, Residential",8.0 acres
31,Land for Sale in - Uswetakeiyawa Ja-ela,10 Jul  4:40 pm,"Ja-Ela, Gampaha","650,000","Land for sale in Uswetakeiyawa ===================================* Location - Uswetakeiyawa * Land Type – Bare Land  * Land Size – 24.5 Perch * Price - Rs 650,000 /=","Commercial, Residential",24.5 perches,
32,අගනා ඉඩමක් විකිණීමට ජා- ඇල,15 Jul  5:31 pm,"Ja-Ela, Gampaha","300,000","ජා-ඇල ,පල්ලිය පිටුපස පර්චස් 10 බ්ම්කොටසක් ඉක්මනින් විකිනිමට  ( ජා- ඇල දුම්රියපොළේ ආසන්නයේ ) පර්චසයක් ලක්ශ  300,000/= (සවස 3 පසුව අමතන්න )",Residential,10.0 perches,
33,Land for Sale - Ja Ela, 8 Jul  1:22 pm,"Ja-Ela, Gampaha","350,000",ඉතා වටිනා ඉඩම ජා-ඇල නගරයට ඉතා ආසන්නයෙන් ජා-ඇල දඬුගම ලංසි පල්ලිය පිටුපස පොල් ගස් 09අඹ ගස් 01ලිං ජලය වැඩි විස්තර සඳහා අමතන්න,"Dandugama , Jaela","Commercial, Residential",37.5 perches
34,"Land for Sale in Ekala, Jaela", 8 Jul 11:47 am,"Ja-Ela, Gampaha","375,000","12 perches bare land for sale in Ekala Jaela.land located very calm area ,700m to gampaha ekala main road,1.5 km to jaela town,20ft wide roadElectricity, water, telephone, available1perches per Rs 375000/=NegotiableMore information pls cl","Commercial, Residential",12.0 perches,
35,Land for Sale in Jaela,10 Jul  1:03 pm,"Ja-Ela, Gampaha","70,000",This land located in Paris perera mawatha Jaela 35 perchers 1.5km  to Colombo Negombo main road Calm and quit area,Paris perera mawatha Jaela,Residential,35.0 perches
36,Land for Sale in Ja Ela,10 Jul  1:03 pm,"Ja-Ela, Gampaha","550,000","This land for sale in Paris perera mawatha, Jaela 200m to Jaela town Calm and quit area",Jaela,Residential,12.0 perches
37,Land for Sale - Ja ela,12 Jul  7:41 pm,"Ja-Ela, Gampaha","1,400,000",This land located in DehiyaganaIt face to Negambo Colombo main rd,Dehiyagana Jaela,"Agricultural, Residential",17.0 perches
38,Land for Sale - Jaela,10 Jul  1:03 pm,"Ja-Ela, Gampaha","200,000",This land located in Maeliya Jaela50 m to 278 Ganemulla bus rd,Maeliya jaela,Residential,11.0 perches
39,Land for Sale - Jaela,10 Jul  1:03 pm,"Ja-Ela, Gampaha","250,000",This land located in Maeliya50 m to 278 Ganemulla bus rd1km to Jaela town,"maeliya,Jaela","Commercial, Residential",14.0 perches
40,Land for Sale in Kandana,10 Jul  1:03 pm,"Ja-Ela, Gampaha","170,000","This land located in Ranasinghe Housing Scheme, Polpithimukalana, Kandana10 perches land200 m 276 Gampaha bus route2.5 km Colombo, Negombo main road",Kandana,Residential,10.0 perches
41,Land in Ja-ela, 5 Jul  4:06 pm,"Ja-Ela, Gampaha","225,000",1) 2km to Negambo-Colombo main road2) 2km to Minuwamgoda-Colombo main road3) 100m to Ja-ela Raddoluwa bus route4) Within 5min can reach ja-ela  highway entrance 5) 500m to Alawathupitiya railway  station6) Very close to famous  school7) Clam area8) Bank loans can be arrange 9)all facilities  are available,Ekala Ja-ela,Residential,11.0 perches
42,Land for Sale in Ekala,10 Jul  1:03 pm,"Ja-Ela, Gampaha","350,000","This land located on Temple road, Ekala14 perches land.500 m to Minuwangoda, Colombo main roadCalm area with good neighborhood","Ekala, Jaela",Residential,14.0 perches
43,Land for Sale Jaela,10 Jul  1:03 pm,"Ja-Ela, Gampaha","200,000",This land located in batagama bandigoda.clear land quiet  and calm area.,batagama jaela,Residential,7.0 perches
44,Land for Sale Thudella Ja Ela, 5 Jul 12:02 pm,"Ja-Ela, Gampaha","1,200,000",මිගමුව කොලඹ ප්‍ර‍ධාන පාරේ (කටුනායක කොලඹ ප්‍ර‍ධාන පාරේ) ඡා ඇල තුඩැල්ල ප්‍රාදේශිය සභා ගොඩනැගිල්ලට යාබදව පිහිටි පර් 22.45 විශාල ඉඩම පර්චසය ලක්ෂ 12 බැගින් විකිනිමට තිබේ,Thudella Jaela,Commercial,22.45 perches
45,Land for Sale - Ja-Ela, 5 Jul  9:48 am,"Ja-Ela, Gampaha","3,500,000",ජා ඇල නගරයට 2 kmවැලිගම්පිටිය හන්දියට 2km Guruge nature paek 1.5 km,ඇවරිය වත්ත පාර බටගම ජා ඇල,"Commercial, Residential",10.3 perches
46,Land For Sale In Ja-Ela, 5 Jul  1:51 am,"Ja-Ela, Gampaha","310,000",640 perches land ideal for waya House and housing project factory and transport services other immediately for sale,maeliya villages,"Agricultural, Commercial, Residential, Other",4.0 acres
47,Land for Sale - Ja Ela, 5 Jul  3:05 pm,"Ja-Ela, Gampaha","873,000",- good land for sale in ja-ela (lake city ),ja-ela (lake city ),"Residential, Other",6.3 perches
48,Land for Sale Ja Ela, 4 Jul  2:02 pm,"Ja-Ela, Gampaha","170,000",ජාඇළ  කදාන ගනේමුල්ල නගර වලට කෙටි දුරින් සියලු පහසුකම් සහිත බිම් කොටස් කීපයක් මුලින් 40% ගෙවා ඉතිරි මුදල් බැංකු ණය මගින් මාසිකව ගෙවීමට සලසා දිය හැකිය,ජාඇළ  බංඩිගොඩ,Residential,10.0 perches
49,Land for Sale in Ja-Ela,15 Jul  6:41 am,"Ja-Ela, Gampaha","675,000","12 perches of land for sale in JA-ELA, 500m from Colombo-Negombo main road. High residential area with all facilities.(Rs. 675,000 per perch) and a 18 perches of land for sale in KANDANA (Rs. 900,000 per perch). For more details please contact 0760946575.",Ja-ela,"Commercial, Residential",12.0 perches
50,Land For Sale In Ja-Ela, 4 Jul  5:33 am,"Ja-Ela, Gampaha","550,000",160 perches land ideal for waya House and housing project factory and transport services other immediately for sale,Ja ela kapala kanda road,"Commercial, Residential, Other",160.0 perches
51,Land For Sale In Ja-Ela- Thudella, 3 Jul 11:38 pm,"Ja-Ela, Gampaha","575,000",* Land Size -08 Perches,"Agaradaguru Mawatha , Thudella, Ja-Ela","Commercial, Residential",8.1 perches
52,Land For Sale Ja-Ela, 3 Jul 10:12 pm,"Ja-Ela, Gampaha","575,000","Ja-ELa (Thudella) Gated Community & 100 % Privacy06 to 12 perch Lots575,000/- Onwards Per Perch200 Meters from Negombo RoadBank Loan facilities available",Ja-ELa (Thudella),Residential,6.0 perches
53,Land for Sale in Kandana,10 Jul  1:03 pm,"Ja-Ela, Gampaha","170,000","This land located in Ranasinghe Hoysing Scheme Polpithimukalana, Kandana15 perchers in land200m to 276 Gampaha bus route2.5 km Colombo Negombo main road","Polpithimukalana, Kandana",Residential,15.0 perches
54,Land for Sale in Kandana,10 Jul  1:03 pm,"Ja-Ela, Gampaha","225,000","This land located in Ranasinghe  Housing  Scheme Polpithimukalana, Kandana 25 perchers 200m to 276 Gampaha bus route 2.5 km  Colombo Negombo main road","Polpithimukalana , Kandana",Residential,25.0 perches
55,Land for Sale in Yakkaduwa,10 Jul  1:03 pm,"Ja-Ela, Gampaha","200,000","This land located in Yakkaduwa near Yakkaduwa church10 perches  in land50m Ja ela,Ganemulla bus rout","Yakkaduwa, Ja ela",Residential,12.5 perches
56,Land for Sale in Ja Ela - Weligampitiya,13 Jul  1:25 pm,"Ja-Ela, Gampaha","575,000",ජා ඇල වැලිගම්පිටිය උසාවිය පාර - 1වන පටුමගේ වටිනා පර්වස් 12ක ඉඩම් කැබැල්ලක් විකිණීමට. පර්චසයක මිල රැ 575000 වන අතර මිල සාකච්ඡා කර කුඩා ප්‍රමානයකින් අඩු කරගත හැක.,"1st Lane - Courts Road, Weligampitiya, Ja Ela",Residential,12.0 perches
57,Commercial Land for Sale at Ekala,18 Jul  8:45 pm,"Ja-Ela, Gampaha","440,000",8 ACERS COMMERCIAL PROPERTY LAND FOR SALE AT JA-ELA  EKALA. 30 FEET ROAD ACCESS. 20 FEET CONTAINER ACCESS WITH AMPLE PARKINGSURROUNDED BY  BOUNDARY WALL MORE SUITABLE FOR WAREHOUSE AND FACTORY HOUSING PROJECTS.5 MINS TO NEGOMBO MAIN ROAD ALL THE SUPERMARKET ACCESS,"Ekala , Ja-Ela","Commercial, Residential",8.0 acres
58,Land for Sale in Ja Ela,10 Jul  1:03 pm,"Ja-Ela, Gampaha","220,000","This land is located in Jaela, Maeliya facing to St. Rita road10 perches landSurrounded by a wallCan be used for a business purpose also100 m to Jaela, Ganemulla road1 km to Colombo, Negombo main road","Maeliya, Jaela","Commercial, Residential, Other",10.0 perches
59,Land for Sale In - JA-ELA, 3 Jul  8:33 am,"Ja-Ela, Gampaha","240,000","* Location - 02 Km to Ja-ela main city, 50m to Ja-ela- Ganemulla main Road.*Land Type- Commercial & Residential* Land Size -08 Perches*Price- Per Perch 300,000/-(Price Can Be Negotiable)* Water & Electricity facility available* Rectangular shape bare land with 01 side covered by a concrete wall.*15ft road frontage*Suitable for Commercial & Residential purpose","Commercial, Residential, Other",8.0 perches,
60,Land for Sale in Waligampitiya,10 Jul  1:03 pm,"Ja-Ela, Gampaha","400,000",This land located on ranasinghe home ekala jaela10 perches,Residential,10.0 perches,
61,Land for Sale in Ja Ela,10 Jul  1:03 pm,"Ja-Ela, Gampaha","350,000",This land located on jaelaNear by express way10 perches,Residential,10.0 perches,
62,Land for Sale in Ja Ela,10 Jul  1:03 pm,"Ja-Ela, Gampaha","360,000",This land located on ranasinghe construction Ekala10 perches,Residential,10.0 perches,
63,Land for Sale in Kotugoda,10 Jul  1:03 pm,"Ja-Ela, Gampaha","140,000",This land located on opatha dewala road kotugoda..800m to minuwangoda Colombo mein road,Kotugoda,Residential,7.0 perches
64,Land for Sale in Yakkaduwa,10 Jul  1:03 pm,"Ja-Ela, Gampaha","170,000","This land located in Yakkaduwa near Yakkaduwa church10 perches in land50 m to Jaela,Ganemulla bus routeCalm and quite area","Yakkaduwa, Jaela",Residential,10.0 perches
65,Land for Sale in Ekala,10 Jul  1:03 pm,"Ja-Ela, Gampaha","350,000",This land located in Temple road in Ekala7 perches land600m to Colombo bus routeDecent neighbourhood,Ekala,Residential,7.0 perches
66,Land for Sale - Ja Ela,10 Jul  1:03 pm,"Ja-Ela, Gampaha","9,900,000",this land located in Paris Perera Mw Jaelathe property around the wall200 m to jaela town250 m to highway,"Paris perere MW,Jaela","Commercial, Residential",18.0 perches
67,Land in Ja ela,29 Jun  1:46 pm,"Ja-Ela, Gampaha","265,000","ජා ඇල - මීගමුව 273 ප්‍රධාන බස් පාරට මුහුණලා නල ජලය විදුලිය සහිතව මුලින් රු 300,000 ගෙවා ඉතිරිය මාසිකව ගෙවන්න ඉඩමක් ගන්න","Pamunuwa road , ja ela",Residential,10.0 perches
68,"Land For Sale Ja-Ela, Kandana",19 Jul  2:22 pm,"Ja-Ela, Gampaha","250,000","ජා-ඇල, කදාන ගනේමුල්ල පාරෙන් සියලුම පහසුකම් සහිත නිස්කලංක පරිසරයකින් යුත් අගනා නේවාසික බිම් කොටස් විකිණීමට...","Ja-Ela, Kandana",Residential,10.0 perches
69,Land for Sale in Ekala,28 Jun  8:46 am,"Ja-Ela, Gampaha","3,250,000",Land for sale in Ekala Cinnamon Garden,Residential,10.0 perches,
70,Land for Sale near Ja-ela,27 Jun 12:55 pm,"Ja-Ela, Gampaha","450,000","Located in Ja Ela, Pamunugama.4km from Ja Ela exit of Colombo - Katunayake expressway.14 km from Negombo.Adjoining to Hamilton Canal.Suitable for warehouse, housing scheme, factory or hotel.Clear deedsWater supply, 3 phase electricity and SLT broadband with fiber connection available.80 to 100 perch blocks or the whole land is available for sale.","Commercial, Residential, Other",340.0 perches,
71,High Demanding Area for Residencies,26 Jun  6:47 am,"Ja-Ela, Gampaha","800,000","60 perches land sale at kapuwatta, Jaela.Highly residential area, peaceful surrounding, good neighborhood.Easy access to Colombo Negombo main road less than 100 meters, opposite K-Zone.","Kapuwatta, Ja-ela.",Residential,60.0 perches
72,Land for Sale -Wewala,10 Jul  1:03 pm,"Ja-Ela, Gampaha","325,000",This land located near the Wewala churchsuitable for residencequote and calm area,"Wewala,Jaela",Residential,12.0 perches
73,Land for Sale - Kandana,10 Jul  1:03 pm,"Ja-Ela, Gampaha","1,100,000","Rilaula, Pantaliyan laneSeventhday school Road200m for Colombo - Negombo Road","Rilaula, Kandana","Commercial, Residential",27.0 perches
74,Land for Sale in Ja Ela - Weligampitiya,13 Jul  1:25 pm,"Ja-Ela, Gampaha","575,000",ජා ඇල වැලිගම්පිටිය උසාවිය පාර - 1වන පටුමගේ වටිනා පර්වස් 12ක ඉඩම් කැබැල්ලක් විකිණීමට. පර්චසයක මිල රැ 575000 වන අතර මිල සාකච්ඡා කර කුඩා ප්‍රමානයකින් අඩු කරගත හැක.,"1st Lane - Courts Road, Weligampitiya, Ja Ela",Residential,12.0 perches
75,Ja-Ela Land for Sale, 3 Jul 12:22 pm,"Ja-Ela, Gampaha","1,000,000","Bare land of 17 perches situated right at the mouth of Ja Ela exist of Colombo - Katunayake Expressway direction towards Ja Ela Town to which is 5 minutes walk, 15 minutes to Colombo on Expressway and also a road accessible (20 feet) to the land with any type of vehicle","Guruge watta road, Ja ela","Commercial, Residential, Other",17.0 perches
76,Commercial Land for Sale at Ja-Ela,21 Jun 12:29 pm,"Ja-Ela, Gampaha","365,000",JAELA ( MAELIYA ) 4 ACERS COMMERCIAL LAND  AVAILABL FOR SALE / 2 KM. JAELA TOWN AND HIGHWAY ENTRANCE / SQURE FLAT LAND / NATURAL FLAT LAND / IDEAL FOR ANY COMMERCIAL PURPOSE / WAREHOUSE / FACTORY / INTERNATIONAL SCHOOL / PRIVATE HOSPITAL / 40 FEET CONTAINER EXCESS AVAILABLE / NO FLOOD THREATS AND VISITS CAN BE ARRANGED ON APPOINMENTS ONLY FOR APPOINMENT PLEASE CALL -  ( PRICE PER PERCH 365000/=  NEGOTIABLE ),"Maeliya , Ja-Ela",Commercial,4.0 acres
77,Land for sale in Ja-ela,30 Jun  9:41 am,"Ja-Ela, Gampaha","275,000",Land for sale ja ela============,Residential,13.5 perches,
78,Land for Sale in Jaela Thudella,20 Jun  2:11 pm,"Ja-Ela, Gampaha","395,000","නිරවුල් ඔප්පු ,පර්චස් 31විදුලි මිටර 2 කිපර්චසයක් රු.3 95000/-නේවාසික කාමර 6 කි,මුළු ඉඩමම තාප්පයකින් වටවී ඇත.ජා ඇල තුඩැල්ල පිහිටි වැදගත් පරිසරයක් ඇති අගනා බිම් කොටසකි.","Agricultural, Commercial, Residential",31.0 perches,
79,Land for Sale Ja Ela (Ekala Town),20 Jun  8:43 am,"Ja-Ela, Gampaha","250,000",~~~~ එදා මෙන් නොව...දෙගුණ වී අද ~~~~~...................තෙගුණ වෙයි හෙට.....................,Ekala Town,Residential,10.0 perches
80,Landscaped Land for Immediate Sale - Thudella,19 Jun 12:47 pm,"Ja-Ela, Gampaha","480,000",Ekala land 505 perch600m to ja ela ekala main road1.5km to ja ela town.20feet wide road3phase electricity Pipe born water,"Commercial, Residential",505.0 perches,
81,Land for Sale in Ja-Ela,20 Jun  9:08 am,"Ja-Ela, Gampaha","350,000",2km from Ja-ela Town,Awariwatta Road,Residential,10.0 perches
82,2 slots of 10 perch lands near jaela tudellla railway station,17 Jun  2:02 pm,"Ja-Ela, Gampaha","325,000",This lands are near jaela - tudella railway station650 meters to Colombo - Negombo Main roadnearly 1.5 km (3min ride) to Colombo- katunayake highwayKatunayake airport ( 8min)All the banks and supermarkets available  Highly residential area 2 slots of 10 perch blocks,"Tudella, ja ela","Commercial, Residential",10.0 perches
83,Land for Sale in Ja Ela - Weligampitiya,13 Jul  1:25 pm,"Ja-Ela, Gampaha","575,000",ජා ඇල වැලිගම්පිටිය උසාවිය පාර - 1වන පටුමගේ වටිනා පර්වස් 12ක ඉඩම් කැබැල්ලක් විකිණීමට. පර්චසයක මිල රැ 575000 වන අතර මිල සාකච්ඡා කර කුඩා ප්‍රමානයකින් අඩු කරගත හැක.,"1st Lane - Courts Road, Weligampitiya, Ja Ela",Residential,12.0 perches
