,0,1,2,3,4,5,6,7
0,title,posted date,location,price,description,Address:,Land type:,Land size:
1,Land for Sale - Papiliyana,17 Jul 12:22 pm,"Boralesgamuwa, Colombo","2,150,000","පැපිලියාන මංසන්දියට ආසන්නව හික්ගහවත්ත පාරේ,සියලු පහසුකම් සහිත 7.3 perch අගනා බිම් කොටස විකිනීමට ","Hikgahawatta Road,Papiliyana.",Residential,7.3 perches
2,"['Land for Sale - Papiliyana', '17 Jul 12:22 pm', 'Boralesgamuwa, Colombo', '2,150,000', 'පැපිලියාන මංසන්දියට ආසන්නව හික්ගහවත්ත පාරේ,සියලු පහසුකම් සහිත 7.3 perch අගනා බිම් කොටස විකිනීමට ', 'Hikgahawatta Road,Papiliyana.', 'Residential', '7.3 perches']","['title', 'posted date', 'location', 'price', 'description', 'Address:', 'Land type:', 'Land size:']",,,,,,
3,Land for Sale in Boralesgamuwa,14 Jul  7:26 am,"Boralesgamuwa, Colombo","1,400,000",LAND with Private Access to BORALESGAMUWA - LAKE & WALKING TRACK ,"Commercial, Residential",25.0 perches,
4,Land with House for Sale - Boralesgamuwa,13 Jul  4:05 pm,"Boralesgamuwa, Colombo","13,500,000","තනි තට්ටුවක නිවසක් සහිත පර්චස් 8.6ක හරි හතරැස් ඉඩමක් විකිනීමට ඇත.ශ්‍රී ජයවර්ධනපුර විශ්වවිද්‍යාලය නුදුරින් හා 138 ප්‍රධාන බස් මාර්ගයට 1 km හා 119 බස් මාර්ගයට 800 m දුරින් පවතින නිසා පහසුවෙන් ලගාව්මට හැකියාව ඇත. බොරලැස්ගමුව, මහරගම, නුගේගොඩ යන ප්‍රදාන නගර 3නටම පහසුවෙන් යාමට හැකිය පවතින නිසා එදිනෙදා කටයුතු පහසුවෙන් ඔබට කරගැනීමට හැකියාව ඇත.සියලුම බැංකු විජේරාම මංසන්දියේ හා ඊට ආසන්නව ඇති නිසා බැංකු පහසුකම් හා අනිකුත් දෑ  ඔබට පහසුවෙන් කරගැනීමට හැකියාව ඇත.ජලය හා ව්දුලිය ද සහිත හරි හතරැස් ඉඩමක්. ( ශිෂ්‍ය නේවාසිකාගාරයක් තැනීම සදහා වඩාත් යෝග්‍ය වේ )","162/ 4B, 3 වන පටුමග, එගොඩවත්ත, බොරලැස්ගමුව",Residential,8.6 perches
5,07P LAND FOR SALE IN BORALESGAMUWA,22 Jul  2:21 am,"Boralesgamuwa, Colombo","7,700,000",BORARESGAMUWA 7P LAND  FOR SALE.(ABERATHNA MAWTHA),"Aberathna Mawatha,Boralesgamuwa",Residential,7.0 perches
6,Residential 10P land Sale Boraresgamuwa,21 Jul  9:29 am,"Boralesgamuwa, Colombo","15,000,000",Residential 10P land Sale in Boraresgamuwa ---------------------------------*1 Km To Boraresgamuwa Town *300merts to 119 bus Route Dehiwala-Maharagama,300merts to 119 bus Route Dehiwala-Maharagama Boraresgamuwa,Residential,10.0 perches
7,Land for Sale in - Boralesgamuwa,20 Jul  4:48 pm,"Boralesgamuwa, Colombo","7,437,500","1.2 km to Werahera junction and 2 km to Boralasgamuwa 1 perch Rs 875000. Peaceful residential area. 74, Peris Mawatha, Gangarama Rd, BoralesgamuwaClear deeds and can arrange document for bank loan","74, Peris Mawatha, Gangarama Rd, Boralesgamuwa",Residential,8.5 perches
8,Land for sale in Boralesgamuwa,20 Jul  1:11 pm,"Boralesgamuwa, Colombo","12,200,000",A 7 perches land for sale in Boralesgamuwa. just 150m to 119 main bus route.The land facing to 20ft wide carpeted road.Highly residential and peaceful area.,Residential,7.0 perches,
9,Land for Sale - Boralesgamuwa,20 Jul 11:27 am,"Boralesgamuwa, Colombo","1,000,000",1 perch 10 Lakhs (negotiable)Clear deeds Peaceful environmentRespectable and safe residential area1.2 Km from Werahera junction,"Werahera, Boralesgamuwa",Residential,9.0 perches
10,Land for Sale in Boralesgamuwa,20 Jul  7:35 am,"Boralesgamuwa, Colombo","875,000","පිලියන්දල, කොට්ටාව, මහරගම, පන්නිපිටිය බොරලැස්ගමුව නගරවලට ආසන්නයෙන් තරු පන්තියේ බිම් කොටස් 341/2  ප්‍රධාන බස් පාරට මුහුණලා ආරක්ශිත ගේට්ටු සහ වට තාප්ප වලින් සමන්විත නේවාසික කලාපය",bokundara. boralesgamuwa,"Commercial, Residential",9.8 perches
11,Land in 10th Mile Post Boralesgamuwa,20 Jul  5:15 am,"Boralesgamuwa, Colombo","6,500,000","Land in 10th Mile Post Rd Boralesgamuwa, Situated in a calm and Quiet residential area* Land extent 7.5 p * Only 500 m to the 10th Mile Post Junction ( 120 Bus route PILIYANDALA - PETA )* Easy access to COLOMBO, PILIYANDALA, MORATUWA, KESBAWA, KAHATHUDUWA    HIGHWAY ENTRANCE etc* 10th mile post rd is a carpeted 20 feet rd to a by lane with 15 feet wide. ( only 200 m from   10th mile post rd to the land ) * Closes city is Katuwawela with Groceries, Bakeries, Pharmacies, Dispensaries,   Communications, Stationary shops etc * Only 800 m to Bokundara with Cargills food city, Economic center, Petrol station, etc* Land is with approved documents and foundation laid for two story house with two units   separate ( Proposed Building plan attached as a photograph )* Asking for the land value * Asking price total 6.5 m ( Negotiable )",10th Mile Post Boralesgamuwa,Residential,7.5 perches
12,Land for Sale - Papiliyana,17 Jul 12:22 pm,"Boralesgamuwa, Colombo","2,150,000","පැපිලියාන මංසන්දියට ආසන්නව හික්ගහවත්ත පාරේ,සියලු පහසුකම් සහිත 7.3 perch අගනා බිම් කොටස විකිනීමට ","Hikgahawatta Road,Papiliyana.",Residential,7.3 perches
13,Beautiful Peace Of Land In Boralesgamuwa,21 Jul  7:25 pm,"Boralesgamuwa, Colombo","3,500,000",A 3.5 perch land is available with clear deeds and survey plan for immediate sale. Peaceful environment and friendly neighbourhoodIf interested you can contact us.,Jayanthi Road Boralesgamuwa,Residential,3.5 perches
14,Land for Sale (with Half built house) Boralasgamuwa,14 Jul  2:20 pm,"Boralesgamuwa, Colombo","1,300,000",ඉඩම වටා සම්පූර්ණයෙන් තාප්පය ඉදිකොට  ඇත ගේට්ටුව සඳහා රෝල ශටර් දමා ඇත නිවසේ අත්තිවාරම් දමා 25% වැඩ  නිමකොට ඇත,"574/4, Gangarama Road, Werahara, Boralasgamuwa",Residential,10.0 perches
15,Land for Sale in - Boralesgamuwa,13 Jul  8:25 pm,"Boralesgamuwa, Colombo","1,050,000","Werahera,jayanthi Place.12ft Road for Land.Clear Deed.",Residential,6.29 perches,
16,Land for Sale at Boralesgamuwa,13 Jul  2:41 pm,"Boralesgamuwa, Colombo","2,200,000",Land For Sale at BORALESGAMUWA,L-BORALESGAMUWA-02,Residential,19.0 perches
17,Land for Sale at Boralesgamuwa,13 Jul  2:35 pm,"Boralesgamuwa, Colombo","1,250,000",Land For Sale at BORALESGAMUWA20 FEET ROAD,L-BORALESGAMUWA-01,Residential,16.0 perches
18,Land for Sale - Rattanapitiya,13 Jul 11:23 am,"Boralesgamuwa, Colombo","1,750,000","50 perch land and this land located in Rattanapitiya, Boralesgamuwa with refurbished house.",Residential,50.0 perches,
19,Residential 15.5 P Land for Sale.In Boralesgamuwa - Dehiwala Road,13 Jul 12:51 am,"Boralesgamuwa, Colombo","23,300,000","LAND FOR SALE.IN BORALESGAMUWA -DEHIWALA ROADRs 23,300,000/Negotiable600 meters to 119 maharagama -dehiwala Bus Route",Dewalamulla -Dehiwala Road - Boralesgamuwa,Residential,15.5 perches
20,Boralesgamuwa Land | for Sale - LL686,12 Jul 10:53 pm,"Boralesgamuwa, Colombo","1,800,000","#.24 perch Squre block of land in a very residential location down Ruban Piris Mawatha, Boralesgamuwa.",Commercial,24.0 perches,
21,Land For Sale in Boralesgamuwa,12 Jul  5:49 pm,"Boralesgamuwa, Colombo","20,000,000","7.74 Perches at Boralesgamuwa, Egodawatte Road800m to Ja'pura Campus150m to Pirivena Junction 119 Bus RoutClose to Maharagama, NugegodaPartly Builded HouseTwo Separate Electricity & Water Supplies2 House NumbersHouse Plan ApprovedNo BrokersPrice: 20 Millions Negotiable","Egodawatte Road, Boralesgamuwa","Commercial, Residential",7.74 perches
22,6 Perches Highly Valuable Land for Sale in Boralesgamuwa,22 Jul 11:45 am,"Boralesgamuwa, Colombo","2,000,000","6 Perches Highly Valuable Land Available for Sale in Boralesgamuwa, one of the fast developing, popular, commercial and residential excellent area. It is very rare to find that kind of land extent in this area. Just 400m to Boralesgamuwa Junction.",Metishuddagara Road,"Residential, Other",6.0 perches
23,96 Perches Highly Valuable Land Available for Sale in Boralesgamuwa,12 Jul  2:09 pm,"Boralesgamuwa, Colombo","3,000,000","96 Perches Highly Valuable Land Available for Sale in Boralesgamuwa, one of the fast developing, popular, commercial and residential excellent area. It is very rare to find that kind of land extent in this area with 25 coconut trees. Just 400m to Boralesgamuwa Junction.Residential area and very close proximity to Banks, Super Markets, Private & Government  Institution, Hospitals, Government & International Schools etc.",Metishuddagara Road,"Commercial, Residential, Other",96.0 perches
24,Land For Sale In Boralesgamuwa,13 Jul  4:25 pm,"Boralesgamuwa, Colombo","1,250,000",Land with single storied house For Sale in Boralesgamuwa,Boralesgamuwa,"Commercial, Residential",17.21 perches
25,12 P Bare Land Sale at Boralesgamuwa,12 Jul 11:47 am,"Boralesgamuwa, Colombo","1,625,000","Rs 1,625,000.00 Lakhs per perchNegotiable",1st Lane Newton Senevitathne Mawatha Boralesgamuwa Or Pirivena Road,"Commercial, Residential",12.0 perches
26,Land for sale in Boralesgamuwa,12 Jul  9:08 am,"Boralesgamuwa, Colombo","1,850,000",Good land for sale in highly residential area in Boralesgmauwa 100m to Dehiwela - Maharagama main road600m to Boralesgamuwa Town / Colombo - Horana main road  2.4km to Maharagama Towan ,"O.P. Perera Mawatha, Lake Road , Boralesgamuwa",Residential,12.0 perches
27,Land in Bokundara,11 Jul  3:57 pm,"Boralesgamuwa, Colombo","7,500,000","Land in Bokundara, Solamon Mw, (In front of Sri Mahendraramaya temple, Arawwala Bokundara rd) 10p land extent, 20 feet carpeted rd to 15 feet by lane access, 3 parts of the land is covered by parapet walls, approved plan and with a bank loan ( valuation in 2017 for 6.5m) for quick sale. 1 km and 400 m to Bokundara junction, 800m to Arawwala- Bokundara bus route, calm and quiet residential area, 100m to grocery, and from Bokundara junction easy access to Piliyandala, Kottawa, Colombo, Moratuwa etc. Asking price 7.5m negotiable",Bokundara Piliyandala,Residential,10.0 perches
28,Bare Land Sale Boralesgamuwa,11 Jul  9:46 am,"Boralesgamuwa, Colombo","790,000",Rs 790000.00 LAKHS per perchNegotiable,FACING 10 TH MILE POST ROAD 10TH MILE POST KATUWAWALA,"Commercial, Residential",20.0 perches
29,Land for Sale in Boralesgamuwa,14 Jul  7:26 am,"Boralesgamuwa, Colombo","1,400,000",LAND with Private Access to BORALESGAMUWA - LAKE & WALKING TRACK ,"Commercial, Residential",25.0 perches,
30,Land For Sale in Boralesgamuwa,12 Jul  5:49 pm,"Boralesgamuwa, Colombo","20,000,000","7.74 Perches at Boralesgamuwa, Egodawatte Road800m to Ja'pura Campus150m to Pirivena Junction 119 Bus RoutClose to Maharagama, NugegodaPartly Builded HouseTwo Separate Electricity & Water Supplies2 House NumbersHouse Plan ApprovedNo BrokersPrice: 20 Millions Negotiable","Egodawatte Road, Boralesgamuwa","Commercial, Residential",7.74 perches
31,Sale a Land with House Borelasgamuwa,11 Jul  9:15 am,"Boralesgamuwa, Colombo","125,000,000",have a 2 bedrooms residence area,bokundara road Borelasgamuwa,Other,12.0 perches
32,Land for Sale in Boralesgamuwa,10 Jul  9:57 pm,"Boralesgamuwa, Colombo","15,750,000",Super land for sale in bellantota boralesgamuwa,Bellantota Boralesgamuwa,Residential,10.0 perches
33,Lands for Sale - Boralesgamuwa,18 Jul  1:11 pm,"Boralesgamuwa, Colombo","1,550,000","Land for sale in borelasgamuwa aberathne mawathaPre sales reservation available on site development period for special pricesfor main road 120 bus route 300mfor town 450,6 blocks abailableper perch 1550000 per perch starting price.Tharanga landsales prasants boralagamuwa avendra terrace project as a housing project as wellwe built ur own house according to your tast on same land1910 squre feetstwo sory with terace 3bed roomservant room 2 toilet bathrooms1 servant toilet bathroomliving TV launchdining small gardencar portdining 3 balconies one terraceceelingbrick wallsback yard and suronded with tall parapot wallhous and land both 28.75milion onlyබොරලැස්ගමුව අබේරත්න මාවත අගන බිම්කොටස් 6ක් විකිණීමටසංවර්දනය වන ඉඩම වෙන්කරව ගැනීමෙන් විශේෂ වාසි අත්විඳින්න 120 බස් පාරේ සිට ඉඩමට මීටර් 300ඉඩමේ සිට බොරලැස්ගමුව නගරයට මීටර් 450පෙර්චසය 1550000 සිට ඉහලට",bralasgamuwa abeyrathne mawatha,"Commercial, Residential",6.0 perches
34,Land for sale in Boaralesgamuwa,10 Jul 12:25 pm,"Boralesgamuwa, Colombo","1,450,000",Land for sale in Boaralesgamuwa,"Commercial, Residential",14.5 perches,
35,90 P Bare Land Sale at Boralesgamuwa,10 Jul 11:06 am,"Boralesgamuwa, Colombo","3,000,000",Rs 3000000.00 LAKHSPER PERCHNegotiable,Facing Matisudagara road Boralesgamuwa,"Commercial, Residential",90.0 perches
36,බොරලැස්ගමුව මාලිගා පෙදෙසේ පර්චස් 8.5 ඉඩම විකිණීමට ඇත,10 Jul  3:39 pm,"Boralesgamuwa, Colombo","1,300,000",බොරලැස්ගමුව මාලිගා පෙදෙසේ  පර්චස් 8.5 ඉඩම විකිණීමට ඇත .බොරලැස්ගමුව හන්දියට මීටර් 70 යි .පිහිටා  තිබෙන්නේ laugh සුපර්මක්ර්ට් අසල පිහිටි පාරේ මීටර් 50 යනවිට වම්පැත්තට වෙන්න ඉඩම පිහිටා ඇත ..පිරිසිදු ඔප්පු.  බැංකු නය ගැනීමටද හැක ...මිල ගණන් අඩු කරනු ලැබේ ...බ්‍රෝකර්වරු අනවශ්‍යයි .....,බොරලැස්ගමුව මාලිගා පෙදෙස,Residential,8.5 perches
37,Land For Sale In Boralesgamuwa, 9 Jul 12:35 pm,"Boralesgamuwa, Colombo","10,000,000","Distance From Werahera(Gangarama Road) to 120 Colombo-Horana main road-5 minutesFacilities- water,Electricity,Telephone",Residential,10.0 perches,
38,45.8 P and Property Sale Boralesgamuwa, 8 Jul  5:22 pm,"Boralesgamuwa, Colombo","700,000",Rs 700000.00 LAKHSPER PERCHNegotiable,GALWALA ROAD ( QUREY ROAD ) EHLAPE JUNCTION KATUWAWALA BORALESGAMUWA,"Commercial, Residential",45.8 perches
39,Super Land with Single Story House for Sale, 7 Jul  5:14 pm,"Boralesgamuwa, Colombo","1,050,000",19.40 perches land 500m to 120 Rd 20ft carpet Rd facing high land including single story house with 3bed 2bath living dining highly residential area price 1050000 per perch no brokers genuine buyers well come after appointments,Boralasgamuwa Bokundara,Residential,19.4 perches
40,26.80P Property Sale at Boralesgamuwa, 6 Jul  1:47 pm,"Boralesgamuwa, Colombo","1,375,000",Rs 1375000.00 LAKHS PER PERCHNegotiable,FACING ABBILAWATHA ROAD ( 400 METERS TO MAIN ROAD ) BORALESGAMUWA,"Commercial, Residential",26.8 perches
41,Super Land for Sale - Borelesgamuwa, 5 Jul 11:41 am,"Boralesgamuwa, Colombo","4,200,000",600m to 120 rd 15ft Rd facing superb land square block highly residential area very close to Boralasgamuwa Maharagama towns price 700000 per perch no brokers genuine buyers well. Come after appointments,Boralasgamuwa Bokundara pasal Mawatha,Residential,6.0 perches
42,Super Land for Sale Boralasgamuwa, 4 Jul 11:05 am,"Boralesgamuwa, Colombo","13,000,000",500m to 119 Rd 500 m to 120rd 10perches Square block facing 20ft carpet Rd high land highly residential area 1km to maharagama and 1km to Boralasgamuwa Town price 1300000per perch genuine buyers well come after appointments,Boralasgamuwa Embillawatta Rd,Residential,10.0 perches
43,Land for sale - Boralesgamuwa, 4 Jul  7:12 am,"Boralesgamuwa, Colombo","8,800,000",8perches square land with an old single storey house facing Embillawatta Rd 20 ft Rd facing superb land highly residential area very close boralasgamuwa maharagama Nugegoda 600 m to 119 Rd 600m to 120 rd price 1100000.per perch genuine buyers well come after appointments,Boralasgamuwa Embillawatta Rd,Residential,8.0 perches
44,Bare Land up For Sale in - Boralasgamuwa, 2 Jul  2:01 pm,"Boralesgamuwa, Colombo","1,600,000","15 Perch bare land,2.0 km for Boralasgamuwa Junction200 Meters for Horana - Colombo Main road","112A, Ahalape Road, Werahara","Commercial, Residential",15.0 perches
45,Land for sale in Boralesgamuwa, 2 Jul  1:31 pm,"Boralesgamuwa, Colombo","1,800,000",බොරලැස්ගමුව 120 ( හොරණ කොළඹ ප්‍රධාන පාර ) පාරේ 10m ක් ඇතුලත නිසංසල පරිසරයක ඉතාමත් වටිනා නේවාසික හෝ ව්‍යාපාරික පර්චස් 9.6 බිම් කොටසක් විකිණීමට ඇත. RMV සහ හමුදා රෝහලට ඉතාමත් නුදුරුව හා බොරලැස්ගමුව ව්‍යායාම මංතීරුවට  700mයි  මිල ගණන් සාකච්චා කරගත හැක.,"Commercial, Residential",9.6 perches,
46,Boralesgamuwa Commercial Property | For Sale - CC600-A, 1 Jul  8:17 pm,"Boralesgamuwa, Colombo","91,000,000",#. Commercial Land is available for sale with ware house and office space with 125 kW transformer.,Commercial,55.0 perches,
47,22p Land for Sale Boralesgomuwa, 1 Jul  3:32 pm,"Boralesgamuwa, Colombo","1,500,000","22 perches land with little old 4 bedroom 2 bathroom house.Facing the abandoned paddy field. (Reservation)Quiet environment.Servant room and toiletWide access roads1 km to Boralesgamuwa town10 minutes to Maharagama townDehiwala - Maharagama main road, 500 metersනිදන කාමර 4 ක් සහ නාන කාමර 2 අත්හැර දමන ලද කුඹුරු යායකට  මුහුණලා ඇත. නිස්කලංක පරිසරය.අතින් වතුර ගත හැකි ලිඳ සේවක කාමරය සහ වැසිකිලිය පුළුල් ප්‍රවේශ මාර්ග බොරලැස්ගමුව නගරයට කි මි 1මහරගම නගරයට මිනිත්තු 10දෙහිවල මහරගම ප්‍රධාන මාර්ගයට මීටර් 500සියලු පහසුකම් අතේ දුරින්","5th Lane, Egodawaththa Road, Boralesgomuwa.1,500,000.",Residential,22.0 perches
48,24 P & Property Sale At Boralesgamuwa,30 Jun 11:06 am,"Boralesgamuwa, Colombo","1,700,000",Rs 1700000.00 LAKHSPER PERCHNegotiable,Facing Robert De Alwis Mawatha Boralesgamuwa,"Commercial, Residential",24.0 perches
49,Land with house Boralesgamuwa,30 Jun  4:42 pm,"Boralesgamuwa, Colombo","4,500,000",Ideal place for residencial area  and near to The university of Sri Jayawardanapura .the location is placed in middle of cities and easy to access to towns within few minutes.,Residential,4.5 perches,
50,Land for Sale - Boralasgamuwa,28 Jun  6:45 am,"Boralesgamuwa, Colombo","1,250,000",Dehiwala Maharagama bus road 350 mBoralasgamuwa junction 1.8kmMaharagama town 1.5 km Super land 1250000 per parch,Maharagama road Katuwawala Mawatha,Residential,10.0 perches
51,Land for Sale in Werahera,29 Jun 12:11 pm,"Boralesgamuwa, Colombo","1,600,000",බොරලැස්ගමුව 120  පාරේ ඉතාමත් වටීනා බිම් කොටසක් පර්ච් 8ක් වතුර වීදුලිය සමගම 120 පාරට 200M   වීකිනීමට ඇත පර්චස් එකක මිල 1600000 පමනයි.. විමසීම් ..,"Kaolin Refinery Rd, Boralesgamuwa 10290",Residential,8.0 perches
52,Land for Sale in Boralesgamuwa,27 Jun  5:16 pm,"Boralesgamuwa, Colombo","1,200,000","බෝකුන්දර, පාසැල් මාවත‍පර්චස් 7හරිහතරැස් ඉඩමබෝකුන්දර හන්දියට 1km120 බස් පාරට 700m (කොළඹ පාර)රජයේ අනුමත නිවාස සැලසුම්ද නොමිලේ ලබාදේ(ගෘහ නිර්මාණ ශිල්ප අනුව නොමිලේ සැකසූ සැලසුම)පර්චසයක් ලක්ෂ 12 (Negotiable)","Bokundara, Boralesgamuwa","Commercial, Residential",7.0 perches
53,Land for sale Boralasgamuwa,26 Jun  5:46 am,"Boralesgamuwa, Colombo","1,375,000",120 horana Colombo bus road 500 m119 dehiwala Maharagama bus road 450 mBoralasgamuwa Town Good residents area 20 feet road facing 9 and 9.5 perch 1375000 per parch,Piriwena road Boralasgamuwa,Residential,9.0 perches
54,Land For Sale In Boralesgamuwa,25 Jun  9:25 am,"Boralesgamuwa, Colombo","6,500,000",Good Residential Land in BoralesgamuwaPeaceful Environment & Good Neighbourhood,"3rd Lane, Rathnarama Road, Abeyrathna Mawatha, Boralesgamuwa",Residential,9.0 perches
55,Land For Sale in Boralesgamuwa,22 Jun  1:27 pm,"Boralesgamuwa, Colombo","1,100,000","බොරලැස්ගමුව, කටුවාවල, නීලම්මහර පාරේප්‍රධාන පාරට මුහුණලා පර්චස් 15 ක නිරවුල් ඉඩම විකිණීමටපහසුකම් සහිතයි.120 ප්‍රධාන පාරට 400mපර්චසයක් ලක්ෂ 11","Neelammahara Road, Katuwawala, Boralesgamuwa","Commercial, Residential",15.0 perches
56,Land for Sale - Papiliyana,17 Jul 12:22 pm,"Boralesgamuwa, Colombo","2,150,000","පැපිලියාන මංසන්දියට ආසන්නව හික්ගහවත්ත පාරේ,සියලු පහසුකම් සහිත 7.3 perch අගනා බිම් කොටස විකිනීමට ","Hikgahawatta Road,Papiliyana.",Residential,7.3 perches
57,Land for Sale in Boralesgamuwa,14 Jul  7:26 am,"Boralesgamuwa, Colombo","1,400,000",LAND with Private Access to BORALESGAMUWA - LAKE & WALKING TRACK ,"Commercial, Residential",25.0 perches,
58,Land for Sale Papiliyana, 5 Jul 10:24 am,"Boralesgamuwa, Colombo","1,200,000",300 meter to 120 bus root 20 feet wide road,hikgahawaththa road papiliyana,Residential,15.0 perches
59,Super Land for Sale in Boralesgamuwa,18 Jun  3:02 pm,"Boralesgamuwa, Colombo","8,000,000",500m to main Gangarama rd 15ft private rd facing superb land square land highly residential area very close to 120bus rd 3km to Galle rd 750m to KDU and KDH price 800000per perch no brokers genuine buyers well come appointments,Boralasgamuwa Gangarama rd,Residential,10.0 perches
60,Super Land for Sale - Borelesgamuwa,17 Jun  9:06 pm,"Boralesgamuwa, Colombo","15,400,000",14perches square land 15ft rd facing superb land 1Km to 120rd highly residential area high land natural soil price 1100000.per perch no brokers genuine buyers well come after.appointments,Boralasgamuwa Neelammahara rd,Residential,14.0 perches
61,පර් 15.41 ඉඩම විකිණීමට බොරලැස්ගමුව,29 Jun  8:08 am,"Boralesgamuwa, Colombo","980,000","බොරලැස්ගමුව හන්දියට කිලෝමීටර් 1යි,කොට්ටාව අධිවේගී මාර්ගයට විනාඩි 20යි .ඉතා නිසංසල පරිසරයකි සම්පූර්ණ ඉඩම පර් 15.41කි.පර් 7.69 /7.72 බෙදා වෙන් කර ඔප්පු සකස් කර ඇත. තනි කැබැල්ලක් වුවත් ගත හැකි ය .","1වන පටුමග,අබේරත්න මාවත ,බොරලැස්ගමුව ,",Residential,15.41 perches
62,15 Perches Land for Sale - Boralesgamuwa,14 Jul  7:21 am,"Boralesgamuwa, Colombo","1,750,000","BORALESGAMUWA – 15 Perches of hard ground in a pleasantly ELEVATED, highly residential & peaceful neighbourhood ! ",Residential,15.0 perches,
63,8.0P Land In Boralesgamuwa For Sale,15 Jun  1:12 pm,"Boralesgamuwa, Colombo","1,850,000","8.0P valuable land in a very quiet residential area with 15 feet private access road 50m away from Colombo-Boralesgamuwa main road for sale.Easy access to Boralesgamuwa junction(400m), walking path(200m), Delkanda, Nugegoda and Dehiwala. Clear deeds, genuine buyers only.Inspection by prior appointment.",Raththanapitiya,Residential,8.0 perches
64,Land for Sale in Boralesgamuwa,10 Jul  3:59 pm,"Boralesgamuwa, Colombo","550,000","In BLOCKS of 10, 6 & 4, Perches.ONLY 450 m to the 120 Root.15 ft wide carpeted Access Road. Keells Supermarket/Food city/Bank & other Conveniences in walking distance.A ‘rare opportunity’ in terms of such availability!PRICE: Ranges from Rs 550,000/- per perch.Genuine Buyer Only. No Brokers","Werahara ,Boralasgamuwa.","Commercial, Residential",6.0 perches
