,0,1,2,3,4,5,6,7
59,10P Residential Land - Kosgama,12 Jul  9:04 am,"Padukka, Colombo","180,000",---- නැණවත් ඔබට හිතන්නට තැනක් -----,"Awissawella rd, Kosgama",Residential,10.0 perches
60,Land for Sale in Watareka Padukka,10 Jul  3:05 pm,"Padukka, Colombo","280,000","1km to high level road. Total land size is 12 perches, but if interested also available as two lots of 6 perches.",Residential,12.0 perches,
61,Land for Sale in Padukka, 9 Jul  2:16 pm,"Padukka, Colombo","1,104,000",land in padukka - maputugala.clear deed.aproved plan.bank loan.easy payment.,padukka,Residential,12.0 perches
62,පාදුක්ක අරකාවිල ඉඩම, 9 Jul 12:06 pm,"Padukka, Colombo","132,000",කොළඹ ඉංගිරිය බස් මාර්ගයට ආසන්නව පොල් ගස් සහිත පදිංචියට සුදුසු නේවාසික බිම් කොටස් විකිණීමට...විස්තර සඳහා අමතන්න,Arakavila,Residential,10.0 perches
63,රබර් ගස් සහිත ඉඩමක් | Maputugala, 9 Jul 11:25 am,"Padukka, Colombo","920,000",300m to Hadapangoda Bus RdElectricity SupplyClear Deed and PlanLakdinu Easy PaymentBank Loan Facility,Maputugala,Residential,12.0 perches
64,පාදුක්ක - අරකාවිල ඉඩම්, 9 Jul 10:52 am,"Padukka, Colombo","129,000",පාදුක්ක - අරකාවිල ඉඩම්කොළඹ - ඉංගිරිය 125 බස් මාර්ගයේනල ජලය විදුලිය මනා ලෙස සංවර්ධිත ඉඩමක්,padukka,Residential,12.0 perches
65,Land for Sale in Padukka, 9 Jul  9:23 am,"Padukka, Colombo","95,000","කොළඹ ඉංගිරිය මාර්ගයට කිලෝමීටර එක හමාරක් පමණ දුරින් පාදුක්ක, අංගමුව ප්‍රදේශයේ පිහිටි රබර් වගා කර ඇති තැනිතලා බිමින් පර්චස් 25 ක් විකුණනු ලැබේ.","Agricultural, Commercial, Residential",25.0 perches,
66,රබර් ගස් සහිත මාපුටුගලින් ඉඩමක්, 8 Jul 10:03 am,"Padukka, Colombo","92,000",පාදුක්ක හඳපාන්ගොඩ බස් මාර්ගයට මීටර 300ක් නුදුරින් රබර් වගාව සහිත පර්චස් 10 බිම් කොටස් විකිණීමට...විස්තර සඳහා අමතන්න,Maputugala,Residential,10.0 perches
67,පාදුක්ක මාපුටුගලින් නේවාසික ඉඩම්, 8 Jul  9:48 am,"Padukka, Colombo","1,104,000",300m to Hadapangoda Bus RdClear Deed and PlanElectricity SupplyLakdinu Easy PaymentBank Loan facility,Maputugala,Residential,12.0 perches
68,10P | Land in Padukka, 8 Jul  9:01 am,"Padukka, Colombo","1,320,000",# 600m to Colombo Ingiriya Bus Rd# With Electricity & Pipe Water# Clear Deed and Plan# Lakdinu Easy Payment# Bank Loan Facility,Arakavila,Residential,10.0 perches
69,Land in Hadapangoda Maputugala, 6 Jul  1:48 pm,"Padukka, Colombo","92,000",attractive locationelectricity supplyclear deed300m to horana - handapangoda main bus roadbank loan facilities,padukka,Residential,12.0 perches
70,Land in Padukka - Handapangoda, 6 Jul  1:44 pm,"Padukka, Colombo","50,000",හඳපාන්ගොඩ පිහිටි වටිනා රබර් ගස් සහිත ඉඩමක්ඔප්පු නිරවුල්කොටස් ලෙස ද මිල දී ගත හැකියිදර්ශනීය වෙල් යායකට මායිම් ව පිහිටා ඇත,padukka,Residential,160.0 perches
71,Land in Padukka - Bope, 6 Jul  1:00 pm,"Padukka, Colombo","129,000",LAND IN BOPE300M TO INGIRIYA - COLOMBO ROADPIPE BORN WATER3 PHASE ELECTRICITY,padukka,Residential,12.0 perches
72,Land in Padukka For Sale, 6 Jul 10:27 am,"Padukka, Colombo","132,000",කොළඹ ඉංගිරිය බස් මාර්ගයට මීටර 600ක් නුදුරින් පොල් වගාව සහිත පදිංචියට සුදුසු නේවාසික බිම් කොටස් විකිණීමට...සියලු නේවාසික පහසුකම්බැංකු ණය පහසු ගෙවිමේ ක්‍රමවිස්තර සඳහා අමතන්න,Arakavila,Residential,10.0 perches
73,Padukka / Maputugala Land, 6 Jul 10:15 am,"Padukka, Colombo","1,104,000",300m to handaangoda bus rd.with electricity supply.clear deed and planeasy paymentbank loan ,Maputugala,Residential,12.0 perches
74,Land in Meepe, 5 Jul  1:12 pm,"Padukka, Colombo","1,320,000",land in meepe arakawila.pipe born water & 3 phase electricity.valuable land.,padukka,Residential,10.0 perches
75,Land in Horana | 12p, 5 Jul 12:28 pm,"Padukka, Colombo","92,000",පාදුක්ක මාපුටුගල පදිංචියට ඉතා සුදුසු දර්ශණීය පරිසරයක පිහිටා ඇති නේවාසික බිම් කොටස් විකිණීමට...හොරණ හඳපාන්ගොඩ බස් මාර්ගයට මීටර 300යි.විදුලිය සහිතයි.බැංකු ණය පහසුකම්වසර 03ක ගෙවිමේ කාල සීමාවවිස්තර සඳහා අමතන්න,Maputugala,Residential,12.0 perches
76,10p | Land in Padukka, 5 Jul 12:01 pm,"Padukka, Colombo","132,000",කොළඹ ඉංගිරිය බස් මාර්ගයට මීටර 600ක් නුදුරින් සියලු නේවාසික පහසුකම් සහිත පදිංචියට සුදුසු බිම් කොටස් විකිණීමට...විස්තර සඳහා අමතන්න,Arakavila,Residential,10.0 perches
77,Land for Sale - Padukka, 5 Jul 11:47 am,"Padukka, Colombo","650,000",👉🏿 පාදුක්ක හොරණ 315 ප්‍රධාන මාර්ගයට මුහුණලා පර්චස් 22 ක වටිනා බිමි කොටස විකිණීමට ඇත.👉🏿 නල ජලය උල්පත් ජලය විදුලිය සහ සියලුම පහසුකම් සහිතයි.👉🏿 සියලු නාගරික පහසුකම් සහ රජයේ සහ පුද්ගලික ප්‍රදාන ආයතන බැංකු සහිත පාදුක්ක නගරයට විනාඩි 5 ක දුරින් ප්‍රධාන මාර්ගයට මුහුණලා පිහිටි මෙවැනි වටිනා ඉඩමක හිමිකරු වීමේ මහගු අවස්ථාවකි.👉🏿 පිරිසිදු ඔප්පු 👉🏿 පැමිණ මිල ගණන් සාකච්චා කර ගත හැක.,"Horana road, Padukka","Commercial, Residential, Other",22.0 perches
78,Land in Padukka - Maputugala, 4 Jul  4:51 pm,"Padukka, Colombo","89,000",attractive landclear deedelectricity supplybank loan & easy payment,padukka,Residential,12.0 perches
79,Land in Padukka, 4 Jul 12:16 pm,"Padukka, Colombo","95,000",land in padukka - arakawilaface to carpet road.clear deed.,padukka,"Agricultural, Residential",57.9 perches
80,Near Horana - Handapangoda Bus Rd Land, 4 Jul 12:12 pm,"Padukka, Colombo","1,044,000","300m to horana - handapangoda bus road.electricity supply.bank loan facilities.easy payment.per perch : Rs : 87,000/=",padukka,Residential,12.0 perches
81,Land for Sale in Arakavila, 4 Jul 11:15 am,"Padukka, Colombo","132,000",සියලු නේවාසික පහසුකම් සහිත පදිංචියට සුදුසු බිම් කොටස් කිහිපයක් විකිණීමට...පිරිසිදු ඔප්පු / පුළුල් මාර්ග සහිතයිබැංකු ණය පහසුකම් සහ වසර 03ක ගෙවිමේ කාල සීමාවවිස්තර සඳහා අමතන්න,Arakavila,Residential,10.0 perches
82,Land for Sale in Padukka, 4 Jul 11:06 am,"Padukka, Colombo","920,000",පාදුක්ක හඳපාන්ගොඩ බස් මාර්ගයේ රබර් වගාව සහිත පර්චස් 10ක ඉඩමක් විකිණීමට...මිළගණන් කතා කර ගත හැකියවිස්තර සඳහා අමතන්න,Maputugala,Residential,10.0 perches
83,Land in Padukka For Sale,12 Jul  1:07 pm,"Padukka, Colombo","95,000",පාදුක්ක අරකාවිල කාෆට් පාරකට මායිම්ව මධ්‍යම ප්‍රමාණයේ කර්මාන්ත ශාලාවකට ඉතා සුදුසු පර්චස් 57ක ඉඩමක් විකිණීමට...විස්තර සඳහා අමතන්න,Arakavila | Koswathta Land,Residential,57.9 perches
84,Land in Padukka For Sale,20 Jul 10:05 am,"Padukka, Colombo","1,320,000",600m to Hadapangoda Bus RdWith Electricity & Pipe Water lineClear Deeds & Tittels.Bank loan or 3 years Easy payment methods.Super Land Plots and good Residential area,Arakavila,Residential,10.0 perches
85,Land in Padukka, 3 Jul 12:43 pm,"Padukka, Colombo","87,000",land in padukka - maputugala. electyricity. clear deed & aproved plan. bank loan. easy payment. ,padukka,Residential,12.0 perches
86,Padukka Land for Sale | 57.9, 3 Jul 11:39 am,"Padukka, Colombo","95,000",පාදුක්ක අරකාවිල කාපට් පාරකට මායිම් වූ රබර් වගාව සහිත පර්චස් 57.9ක ඉඩමක් විකිණීමට...විස්තර සඳහා අමතන්න,Arakavila,Residential,57.9 perches
87,Padukka / Arakavila Land, 3 Jul 10:19 am,"Padukka, Colombo","132,000",කොළඹ ඉංගිරිය බස් මාර්ගයට ආසන්නව පදිංචියට සුදුසු බිම් කොටස් විකිණීමට...නල ජලය තෙකලා විදුලිය සහිතයි.බැංකු ණය පහසුකම් සහ වසර 03ක ගෙවිමේ කාල සීමාවවිස්තර සඳහා අමතන්න,Arakavila,Residential,10.0 perches
88,Padukka / Maputugala Land, 3 Jul  9:54 am,"Padukka, Colombo","92,000",හොරණ හඳපාන්ගොඩ බස් මාර්ගයට මීටර 300ක් නුදුරින් දර්ශණීය පරිසරයක පිහිටා ඇති පදිංචියට සුදුසු නේවාසික බිම් කොටස් විකිණීමට...විස්තර සඳහා අමතන්නමූලික ගෙවිම 30% සිට.විස්තර සඳහා අමතන්න,Maputugala,Residential,12.0 perches
89,10P in Padukka, 2 Jul  5:58 pm,"Padukka, Colombo","1,320,000",land in padukka - arakawila.pipe born water.3 phase electricity.clear deed.aproved plan.,padukka,Residential,10.0 perches
90,Land in Padukka for Sale, 2 Jul  1:02 pm,"Padukka, Colombo","132,000",10 Perches Land.Land in Arakavila.With Electricity & Pipe Water line.Clear Deeds & tittels.600m to Colombo Ingiriya Bus RdBank loan or 3 years Easy payment methods.,Arakavila,Residential,10.0 perches
91,Land in Horana | 10p, 2 Jul  9:35 am,"Padukka, Colombo","115,000",සියලු නේවාසික පහසුකම් සහිත පදිංචියට සුදුසු තැනිතලා බිම් කොටස් විකිණීමට....හොරණ නගරයට කි.මි 5යිතල්ගහවිල බස් මාර්ගයට මීටර 400යි.පදිංචියට සුදුසු නිස්කලංක පරිසරය.බැංකු ණය පහසුකම් ලබා ගත හැකියවසර 03ක ගෙවිමේ කාල සීමාව.විස්තර සඳහා අමතන්න,Maragahahena,Residential,10.0 perches
92,Land in Padukka, 1 Jul  7:01 pm,"Padukka, Colombo","1,320,000",land in padukka - arakawila. pipe born water. 3 phase electricity.clear deed.aproved plan.,padukka,Residential,10.0 perches
93,Land for Sale Padukka Miriyagalla, 1 Jul  3:40 pm,"Padukka, Colombo","48,000",Approved plan Beautiful paddy field viewClear DeedCalm and quiet areaIdeal for holiday bungalow,"Miriyagalla ,padukka",Residential,127.0 perches
94,Land in Padukka for Sale, 1 Jul  3:23 pm,"Padukka, Colombo","92,000",පාදුක්ක හඳපාන්ගොඩ බස් මාර්ගයට මීටර 300ක් නුදුරින් විදුලිය සහිත පදිංචියට සුදුසු බිම් කොටස් විකිණීමට...බැංකු ණය පහසුකම් සහ වසර 03ක ගෙවිමේ කාල සීමාවවිස්තර සඳහා අමතන්න,Maputugala,Residential,12.0 perches
95,Land in Padukka For Sale, 1 Jul  3:03 pm,"Padukka, Colombo","132,000",කොළඹ ඉංගිරිය බස් මාර්ගයට ආසන්නව පොල් වගාව සහිත පදිංචියට සුදුසු නේවාසික බිම් කොටස් විකිණීමට...බැංකු ණය පහසුකම් සහ වසර 03ක ගෙවිමේ කාල සීමාවවිස්තර සඳහා අමතන්න,Arakavila,Residential,10.0 perches
96,Land for Sale - Padukka, 1 Jul  2:18 pm,"Padukka, Colombo","135,000","බෝපේ හන්දියට කි .මි.2ක් දුරින්,උඩගම අවිස්සාවේල්ල ප්‍රධාන මාර්ගයේ සුන්දර වෙල් යායකට මයිම්ව අගනා නේවසික බිම් කොටස් කිහිපයක්,පහසු ගෙවිම් ක්‍රම  සමගින්,එකවර ගෙවිමෙදි සුවිශේෂි වට්ටම්",bope udagama,"Commercial, Residential",10.0 perches
97,Land for sale - Padukka Pinnawala,29 Jun  3:30 pm,"Padukka, Colombo","1,500,000","Land for sale - Padukka - Pinnawala=================හයිලෙවල් පාර මීපේ හන්දියේ සිට කි.මි. 7 ක් පමණ දුරින් සහ 239 වග පාදුක්ක පාරට කි.මි. 1.5 පමණ දුරින්ද, ලබුගම කොළඹ පාරට මි. 900ක් දුරින්දපිහිටි පර්චස් 40 ක ඉඩම විකිණීමට ඇත.ස්වාභාවික නිදහස් නිස්කලංක පරිසරයමුදල් හදිස්සියක් සඳහා ඉක්මණින් විකිණේ.","Commercial, Residential, Other",40.0 perches,
98,125 බස් මාර්ගයට ආසන්න ඉඩම | Padukka,28 Jun 11:12 am,"Padukka, Colombo","128,000",කොළඹ ඉංගිරිය බස් මාර්ගයට මීටර 600ක් නුදුරින් පදිංචියට සුදුසු නේවාසික බිම් කොටස් විකිණීමට....විස්තර සඳහා දැන්ම අමතන්න.,Arakavila,Residential,10.0 perches
99,Padukka - Maputugala Land,28 Jun 10:51 am,"Padukka, Colombo","1,104,000",300m to Hadapangoda Bus RdBetter quiet residential environment ElectricityClear Deeds & Tittels.Lakdinu Easy Payment and Bank Loan available.,Maputugala,Residential,12.0 perches
100,Great Land for Sale in Padukka,30 Jun 10:55 am,"Padukka, Colombo","120,000","වග පාදුක්ක මාර්ගය අයිනේ කෙලිමඩල පිහිටි පර්චස් 49 ක පිරිසිදු ඔප්පු හා ඉතා වටිනා නැදුන් වැටියක් සහිත ඉඩම විකිනීමට, පර්චසයක් = 120,000, බංකු ණය ගැනීමට ඉතා පහසු වේ.නිස්කලංක පරිසරයක පිහිටා ඇත,අවිස්සාවේල්ල කොළඹ  මාර්ගයට 4 KM (High level road - meepe) කි. (1 hour and 30 mins to Colombo) Selling due to immigration.","505/1,mahayayalanda,kelimadala,thummodara","Agricultural, Commercial, Residential, Other",49.0 perches
101,Land For Sale Padukka,27 Jun  3:27 pm,"Padukka, Colombo","92,000",# 300m to Horana bus road# Electricity# Beautiful Paddy feild View# Bank loan facility,Hadapangoda,Residential,12.0 perches
102,පොල් ගස් සහිත අරකාවිල ඉඩම,27 Jun 12:33 pm,"Padukka, Colombo","132,000",කොළඹ ඉංගිරිය බස් මාර්ගයට මීටර 600ක් නුදුරින් පොල් ගස් සහිත පදිංචියට සුදුසු බිම් කොටස් විකිණීමට...සියලු නේවාසික පහසුකම්පිරිසිදු ඔප්පුපදිංචියට සුදුසු නිස්කලංක පරිසරයවිස්තර සඳහා අමතන්න,Arakavila,Residential,10.0 perches
103,Land in Padukka For Sale,27 Jun 12:24 pm,"Padukka, Colombo","1,104,000","දර්ශණීය පරිසරයක් සහිත පදිංචියට සුදුසු , සියලු පහසුකම් සපිරි බිම් කොටස් කිහිපයක් විකිණීමට...හඳපාන්ගොඩ බස් මාර්ගයට මීටර 300බැංකු ණය පහසුකම් ලබා ගත හැකිය.වසර 03ක් දක්වා ගෙවිමේ පහසුකම්",Maputugala,Residential,12.0 perches
104,Land in Padukka 12p,27 Jun 11:06 am,"Padukka, Colombo","92,000",හඳපාන්ගොඩ බස් මාර්ගයට මීටර 300යි.පිරිසිදු ඔප්පු / පුළුල් මර්ග / විදුලිය සහිතයි.පදිංචියට සුදුසු නිස්කලංක පරිසරයබැංකු ණය පහසුකම් සහ වසර 03ක ගෙවිමේ කාල සීමාවවිස්තර සඳහා අමතන්න,Maputugala,Residential,12.0 perches
105,Land in Padukka |10p,27 Jun 10:35 am,"Padukka, Colombo","132,000",කොළඹ ඉංගිරිය බස් මාර්ගයට මීටර 600ක් නුදුරින් නල ජලය තෙකලා විදුලිය සහිත පදිංචියට සුදුසු නේවාසික බිම් කොටස් විකිණීමට...බැංකු ණය පහසුකම් සහ වසර 03ක ගෙවිමේ කාල සීමාව.විස්තර සඳහා අමතන්න,Arakavila,Residential,10.0 perches
106,Land in Padukka For Sale,26 Jun  1:50 pm,"Padukka, Colombo","92,000","Land in Padukka - Maputugala.advance payment : Rs: 30,000/=300m to horana - handapangoda bus road.Electricity SupplyClear Deed.",Maputugala,Residential,12.0 perches
107,පාදුක්කට ආසන්න ඉඩමක්,26 Jun 12:45 pm,"Padukka, Colombo","1,320,000","125 කොළඹ ඉංගිරිය බස් මාර්ගයට මීටර 600ක් නුදුරින් නල ජලය තෙකලා විදුලිය සහිත බිම් කොටස් විකිණීමට...ඉඩමේහි පොල් වගාව සහිතයි.    පර්චසයක් 132,000/= වැඩි විස්තර සදහා අමතන්න",Arakavila,Residential,10.0 perches
108,හඳපාන්ගොඩ බස් මාර්ගයෙන් ඉඩමක්,26 Jun 12:17 pm,"Padukka, Colombo","1,104,000","දර්ශණීය පරිසරයක් සහිත පදිංචියට සුදුසු , සියලු පහසුකම් සපිරි බිම් කොටස් කිහිපයක් විකිණීමට...හඳපාන්ගොඩ බස් මාර්ගයට මීටර 300බැංකු ණය පහසුකම් ලබා ගත හැකිය.වසර 03ක් දක්වා ගෙවිමේ පහසුකම්",Maputugala,Residential,12.0 perches
109,Land for Sale in Padukka - Arakavila,26 Jun 12:10 pm,"Padukka, Colombo","1,320,000",# With Electricity & Pipe Water line.# Clear deeds & tittels.# Calm & Quite area.# 600m to Colombo Ingiriya Bus Rd# Bank loan or 3 years Easy payment methods.,Arakavila,Residential,10.0 perches
110,Land in Padukka For Sale,12 Jul  1:07 pm,"Padukka, Colombo","95,000",පාදුක්ක අරකාවිල කාෆට් පාරකට මායිම්ව මධ්‍යම ප්‍රමාණයේ කර්මාන්ත ශාලාවකට ඉතා සුදුසු පර්චස් 57ක ඉඩමක් විකිණීමට...විස්තර සඳහා අමතන්න,Arakavila | Koswathta Land,Residential,57.9 perches
111,Land in Padukka For Sale,20 Jul 10:05 am,"Padukka, Colombo","1,320,000",600m to Hadapangoda Bus RdWith Electricity & Pipe Water lineClear Deeds & Tittels.Bank loan or 3 years Easy payment methods.Super Land Plots and good Residential area,Arakavila,Residential,10.0 perches
112,පාදුක්ක අරකාවිල පර්චස් 57ක ඉඩමක්,26 Jun 11:42 am,"Padukka, Colombo","95,000",පාදුක්ක අරකාවිල කාපට් පාරකට මායිම් වූ මධ්‍යම ප්‍රමාණයේ කර්මාන්ත ශාලාවකට ඉතා සුදුසු පර්චස් 57.9ක ඉඩමක් විකිණීමට...විස්තර සඳහා අමතන්න,Arakavila,Residential,57.9 perches
113,Land for Sale in Watareka,26 Jun 11:24 am,"Padukka, Colombo","200,000",වටරැක පාසල ආසන්නයේ වෙන්දේසි ඉඩමකින් ගන්නා ලද පර්චස් 10 ඉඩම ඉතා ඉක්මනින් විකිනීමට ගැනුම්කරුවන් පමනක් අමතන්න පර්චසයක මිල 200000/- නිරවුල් ඔප්පු,Residential,10.0 perches,
114,පොල්ගස් සහිත 12p ඉඩම,25 Jun  2:35 pm,"Padukka, Colombo","129,000",# 300m to 125 Colombo bus road# Water / Electricity# Coconut cultivation# 20ft Tar road# Bank loan facility# Clear Titels,Bope / Arakawila,Residential,12.0 perches
115,පාදුක්ක මාපුටුගල ඉඩම,25 Jun 11:45 am,"Padukka, Colombo","1,104,000",නිස්කලංක පරිසරයක පිහිටා ඇති අගනා බිම් කොටස් විකිණීමට..හඳපාන්ගොඩ බස් මාර්ගයට මීටර 300යි.විදුලිය /  පිරිසිදු ඔප්පු / පුළුල් මාර්ග සහිතයි.බැංකු ණය පහසුකම් සහ වසර 03ක ගෙවිමේ කාල සීමාවවිස්තර සඳහා අමතන්න,Maputugala,Residential,12.0 perches
116,රබර් ගස් සහිත මාපුටුගලින් ඉඩමක්,25 Jun 11:20 am,"Padukka, Colombo","92,000",හඳපාන්ඟොඩ බස් මාර්ගයට මීටර 300යි.විදුලිය සහිතයි.පුළුල් මාර්ග / පිරිසිදු ඔප්පුබැංකු ණය පහසුකම් සහ වසර 03ක ගෙවිමේ කාල සීමාවවිස්තර සඳහා අමතන්න,Maputugala,Residential,10.0 perches
117,Padukka - Arakavila Land for Sale,25 Jun 11:08 am,"Padukka, Colombo","132,000",කොළඹ ඉංගිරිය බස් මාර්ගයට ආසන්නව සියලු නේවාසික පහසුකම් සහ නිස්කලංක පරිසරයක පිහිටා ඇති පදිංචියට සුදුසු බිම් කොටස් විකිණීමට....විස්තර සඳහා අමතන්න,Arakavila,Residential,10.0 perches
118,300m Land for sale Colombo - Ingiriya Bus Road,24 Jun  4:53 pm,"Padukka, Colombo","1,320,000",pipe born water & 3 phase electricity.clear deed.good place & valuable land.good residential land.,padukka,Residential,10.0 perches
119,ඉඩමක් විකිණීමට - පාදුක්ක,24 Jun  3:14 pm,"Padukka, Colombo","65,000",හයිලෙවල් පාර මීපේ හංදිය  හංදියට කි.මි. 2 ක් ද පාදුක්ක නගරයට කි.මි. 4 ක් ද දුරින් පිටුම්පේ අන්නාසිගලහේන වත්තේ ස්වාභාවික නිස්කලංක පරිසරයක පිහිටා ඇති පර්චස් 50 ක ඉඩම විකිණීමට ඇත.සින්නකර පිරිසිදු ඔප්පු සහිතයි.මිල ගණන් සාකච්චා කර ගත හැක.වැඩි විස්තර සඳහා අමතන්න.,"Annasigalhena Watta, Pitumpe, Padukka","Commercial, Residential, Other",50.0 perches
120,Land in Poruwadanda,24 Jun  2:49 pm,"Padukka, Colombo","104,000",land in poruwadanda - boralugoda.electricity.near - boi zone - horana - boralugoda.clear deed.apropved plan.,poruwadanda,Residential,12.2 perches
