,0,1,2,3,4,5,6,7
0,title,posted date,location,price,description,Address:,Land type:,Land size:
1,Land in Padukka For Sale,12 Jul  1:07 pm,"Padukka, Colombo","95,000",පාදුක්ක අරකාවිල කාෆට් පාරකට මායිම්ව මධ්‍යම ප්‍රමාණයේ කර්මාන්ත ශාලාවකට ඉතා සුදුසු පර්චස් 57ක ඉඩමක් විකිණීමට...විස්තර සඳහා අමතන්න,Arakavila | Koswathta Land,Residential,57.9 perches
2,"['Land in Padukka For Sale', '12 Jul  1:07 pm', 'Padukka, Colombo', '95,000', 'පාදුක්ක අරකාවිල කාෆට් පාරකට මායිම්ව මධ්\u200dයම ප්\u200dරමාණයේ කර්මාන්ත ශාලාවකට ඉතා සුදුසු පර්චස් 57ක ඉඩමක් විකිණීමට...විස්තර සඳහා අමතන්න', 'Arakavila | Koswathta Land', 'Residential', '57.9 perches']","['title', 'posted date', 'location', 'price', 'description', 'Address:', 'Land type:', 'Land size:']",,,,,,
3,Land in Padukka For Sale,20 Jul 10:05 am,"Padukka, Colombo","1,320,000",600m to Hadapangoda Bus RdWith Electricity & Pipe Water lineClear Deeds & Tittels.Bank loan or 3 years Easy payment methods.Super Land Plots and good Residential area,Arakavila,Residential,10.0 perches
4,Land in Padukka - Maputugala,22 Jul  3:17 pm,"Padukka, Colombo","91,000",land in padukka - maputugalaelectricity availablebank loan & easy payment facilitiesclear deed & aproved plan,padukka,Residential,12.0 perches
5,Land for Sale in Horana,22 Jul  1:11 pm,"Padukka, Colombo","1,104,000","දර්ශණීය පරිසරයක් සහිත පදිංචියට සුදුසු , සියලු පහසුකම් සපිරි බිම් කොටස් කිහිපයක් විකිණීමට...හඳපාන්ගොඩ බස් මාර්ගයට මීටර 300බැංකු ණය පහසුකම් ලබා ගත හැකිය.වසර 03ක් දක්වා ගෙවිමේ පහසුකම්",Maputugala,Residential,12.0 perches
6,කොළඹ ඉංගිරිය බස් මාර්ගයෙන් ඉඩමක්,22 Jul 12:53 pm,"Padukka, Colombo","1,320,000",# With Electricity & Pipe Water line.# Clear deeds & tittels.# Calm & Quite area.# 600m to Colombo Ingiriya Bus Rd# Bank loan or 3 years Easy payment methods.,Arakavila,Residential,10.0 perches
7,Land with House for Sale - Padukka,22 Jul 12:08 pm,"Padukka, Colombo","6,500,000","පාදුක්ක ගලගෙදර හයිලෙවල් පාරට ඉතා ආසන්නව වටේට තාප්ප දැමූ පර්චස් 15.5 ඉඩම සහ නිවස විකුනමි.  කාමර 3 සහ නාන කාමර 1 ඇත. ජලය , විදුලිය, සාරවත් පොල් ගස් තුනක් ඇත. පිරිසිදු ඔප්පු.ප්රසිද්ද පාසල්, කැම්පස්, සුපිරි වෙළෙඳ සැල්, දුම්රියපොල, P&S, මීගොඩ ආර්ථික මද්යස්ථානයආදී පහසුකම් ආසන්නයේ ඇත. වැඩි විස්තර සඳහා අමතන්න.Land with House for Sale at High Level Road  Galagedara – PadukkaJust 2 minute walk from High Level roadFeatures15.5 perch landRecently renovated house with Bedrooms -03, Bathroom -1(New), Large Living room, Kitchen, House about 2000 ft2, Packing space, Boundary wall and steel Gate, Access road, Calm & peaceful neighborhood. Railway station and all urban facilities are nearby. 15 to 20 minute drive from Kottawa – Highway exitPrice- Rs. 6,500,000 (negotiable)",High Level Road  Galagedara – Padukka,Residential,15.5 perches
8,Land for Sale in Padukka,22 Jul 11:30 am,"Padukka, Colombo","1,320,000",land in padukka - arakawilapipe born water3 phaseelectricitynear colombo bus road,padukka,Residential,10.0 perches
9,Land in For Sale - Watareka,20 Jul 11:24 pm,"Padukka, Colombo","135,000","Residential land for sale in Watareka-Madulawa, Diamond City3 phase electricityPipe borne water20-30ft roads300m to the bus-stop3Km to Watareka rail station6Km to Godagama - Highlevel road4Km to Mahinda Rajapakshe National School4Km to NSBM Green University",Watareka - Madulawa (Diamond City),Residential,10.0 perches
10,Land for Sale in Padukka,20 Jul  1:59 pm,"Padukka, Colombo","1,320,000",300m to colombo - ingiriya bus rdpipe born water3 phase electricityclear deed,padukka,Residential,10.0 perches
11,පාදුක්ක මාපුටුගල ඉඩම,20 Jul 10:12 am,"Padukka, Colombo","92,000",හොරණ හඳපාන්ගොඩ බස් මාර්ගයට මීටර 300ක් නුදුරින් පදිංචියට සුදුසු විදුලිය ඇතුළුව සියලු පහසුකම් සපිරි නේවාසික බිම් කොටස් විකිණීමට....බැංකු ණය පහසුකම්වසර 3ක ගෙවිමේ කාල සීමාවවිස්තර සඳහා අමතන්න,Maputugala,Residential,12.0 perches
12,Land in Padukka For Sale,20 Jul 10:05 am,"Padukka, Colombo","1,320,000",600m to Hadapangoda Bus RdWith Electricity & Pipe Water lineClear Deeds & Tittels.Bank loan or 3 years Easy payment methods.Super Land Plots and good Residential area,Arakavila,Residential,10.0 perches
13,Land for Sale - Padukka,19 Jul 11:53 am,"Padukka, Colombo","91,000",good viewattractive landnear horana - handapngoda bus roadelectricitycalm & quite area,padukka,Residential,12.0 perches
14,Land in Padukka - Bope for Sale,19 Jul 11:27 am,"Padukka, Colombo","1,320,000","ඉතා වටිනා කොළඹ - ඉංගිරිය 125 මාර්ගයේ 300m දුරින් තාර යෙදූ මාර්ගයකට මායිම් ව ඇති මෙම ඉඩම ආයෝජනයට හෝ පදිංචියට හොදින් ගැලපේ. සීඝ්‍රයෙන් මිල ඉහල යන මෙම ප්‍රදේශයේ ඉඩමක් මෙතරම් අඩු මිලට මිලදී ගැනීමට ලැබෙන දුර්ලභ අවස්ථාවක්.සමතලා හතරැස් ඉඩම පර්චස් 10ක් පර්චසය රු 132,000ක මිලකට.නිස්කලංක පරිසරය , නල ජලය , විදුලිය",padukka,Residential,10.0 perches
15,Beautiful Land in Handapangoda,18 Jul  3:03 pm,"Padukka, Colombo","91,000",ATTRACTIVE LAND IN HANDAPANGODA. NEAR HORANA BUS ROAD ( 300M)ELECTRICITY SUPPLYCLEAR DEEDAPROVED PLAN,padukka,Residential,12.0 perches
16,Land in Padukka 10p,18 Jul 12:57 pm,"Padukka, Colombo","1,320,000","125 කොළඹ ඉංගිරිය බස් මාර්ගයට මීටර 600ක් නුදුරින් නල ජලය තෙකලා විදුලිය සහිත බිම් කොටස් විකිණීමට...ඉඩමේහි පොල් වගාව සහිතයි.   පර්චසයක් 132,000/= වැඩි විස්තර සදහා අමතන්න",Arakavila,Residential,10.0 perches
17,Land in Padukka For Sale,18 Jul 12:39 pm,"Padukka, Colombo","1,104,000","300m to Padukka Hadapangoda RdElectricity Supply.Better quiet residential environment Clear Deeds & Tittels.Lakdinu easy payment and bank loan available1 Perch = Rs : 92,000/=Contact for more info",Maputugala,Residential,12.0 perches
18,Land in Padukka For Sale,18 Jul  9:43 am,"Padukka, Colombo","1,320,000",600m to Colombo Ingiriya Bus RdElectricity & Pipe WaterClear Deed & PlanWide RoadLakdinu Easy PaymentBank Loan Facility,Arakavila,Residential,10.0 perches
19,Land for Sale Padukka,17 Jul  2:23 pm,"Padukka, Colombo","155,000",තෙකලා විදුලිය සහිත තදබදයෙන් මිදුන නිස්කලංක පරිසරයක පිහිටි කොළඹට මෙන්ම අවශ්‍ය සෑම තැනකටම ඇසුරු සැනින් ලඟා විය හැකි පදිංචියට සුදුසුම තැනක්... සියලු පහසුකම් සහිත අගනා නේවාසික බිම් කොටසක්. පාදුක්ක නගරයට 1.5 Kmගලගෙදර - ‍හොරණ ප්‍රධාන මාර්ගයට 800 mසුපිරි පාසල් වලට ඇවිදින දුරින් ගංවතුර තර්ජන නැත.,Padukka Jayanthi mawatha,Residential,10.0 perches
20,කොළඹ ඉංගිරිය බස් මාර්ගයෙන් ඉඩමක්,17 Jul 12:29 pm,"Padukka, Colombo","132,000",කොළඹ ඉංගිරිය බස් මාර්ගයට මීටර 600යි.නල ජලය තෙකලා විදුලියපිරිසිදු ඔප්පුපදිංචියට සුදුසු නිස්කලංක පරිසරයපුළුල් මාර්ගබැංකු ණය පහසුකම් සහ වසර 03ක ගෙවිමේ කාල සීමාවවිස්තර සඳහා අමතන්න,Arakavila,Residential,10.0 perches
21,Land in Padukka |12p,17 Jul 11:45 am,"Padukka, Colombo","92,000",දර්ශණීය පරිසරයක් සහිත පදිංචියට සුදුසු බිම් කොටස්...විදුලිය ඇතුළුව සියලු නේවාසික පහසුකම්හඳපාන්ගොඩ බස් මාර්ගයට මීටර 300යි.පිරිසිදු ඔප්පු / පුළුල් මාර්ගපදිංචියට සුදුසු නිස්කලංක පරිසරය,Maputugala,Residential,12.0 perches
22,Land for Sale - Padukka,17 Jul 11:01 am,"Padukka, Colombo","1,320,000",land in padukka - arakawilapipe born water3 phase electricityclear deedaproved plan,padukka,Residential,10.0 perches
23,Land for Sale - Padukka,17 Jul 10:44 am,"Padukka, Colombo","89,000",land near horana - handapangoda bus rd.clear deedaproved planbank loaneasy payment ,padukka,Residential,12.0 perches
24,Land For Sale - Padukka Bope,17 Jul  8:20 pm,"Padukka, Colombo","125,000",Land for sale - Padukka Bope======================124 බෝපේ - මීපේ ප්‍රධාන මාර්ගයට මී 300 ක් පමණ දුරින්දහයිලෙවල් පාර මීපේ හන්දියට කි.මි. 5 ක් පමණ දුරින්දපිහිටා ඇති පර්චස් 12 ක ඉඩම විකිණීමට ඇත.පිරිසිදු ඔප්පුපැමිණ මිල ගණන් සාකච්චා කර ගත හැකවැඩි විස්තර සඳහා විමසන්න,"Bope, Padukka.","Commercial, Residential, Other",12.0 perches
25,Land in Padukka - Maputugala,15 Jul  5:10 pm,"Padukka, Colombo","89,000",3000m to horana - handapangoda bus roadelectricity supplyclear deedaproved planbank loaneasy payment facilities,padukka,Residential,12.0 perches
26,Land for Sale in Padukka,19 Jul 10:11 am,"Padukka, Colombo","155,000",නාගරික පරිසරයක සියළු පහසුකම් සමඟින්සීඝ්‍රයෙන් දියුණු වෙමින්දිනෙන් දින වටිනාකම් රැස්වනසියල් සපිරි සුපිරි නේවාසික පරිසරයෙන්අනඟි බිම්කොටස් ව්‍යාපෘතියක්ඔබ වෙනුවෙන්ම....,"Padukka, Jayanthi mawatha","Agricultural, Residential",10.0 perches
27,Land for Sale in - Padukka,15 Jul  1:23 pm,"Padukka, Colombo","3,500,000","1.5 Km to Moragaha Hena Junction, 600 M to 315 Bus Road, in Front of Miriswatta Farm.","Moragaha Hena, Miriswatta, Padukka","Agricultural, Commercial, Residential",14.0 perches
28,පාදුක්ක - මනරම් පරිසරය සහිත ඉඩම,15 Jul 12:50 pm,"Padukka, Colombo","89,000",මනරම් පරිසරයවිදුලිය සහිතදර්ශනීය බිම් කොටසක්නිරවුල් ඔප්පු සහිතයි,padukka,Residential,12.0 perches
29,Land in Padukka For Sale,12 Jul  1:07 pm,"Padukka, Colombo","95,000",පාදුක්ක අරකාවිල කාෆට් පාරකට මායිම්ව මධ්‍යම ප්‍රමාණයේ කර්මාන්ත ශාලාවකට ඉතා සුදුසු පර්චස් 57ක ඉඩමක් විකිණීමට...විස්තර සඳහා අමතන්න,Arakavila | Koswathta Land,Residential,57.9 perches
30,Land in Padukka For Sale,20 Jul 10:05 am,"Padukka, Colombo","1,320,000",600m to Hadapangoda Bus RdWith Electricity & Pipe Water lineClear Deeds & Tittels.Bank loan or 3 years Easy payment methods.Super Land Plots and good Residential area,Arakavila,Residential,10.0 perches
31,Land in Arakavila,15 Jul 12:45 pm,"Padukka, Colombo","132,000",කොළඹ ඉංගිරිය බස් මාර්ගයට ආසන්නව පදිංචියට සුදුසු  නේවාසික බිම් කොටස් විකිණීමට...සියලු නේවාසික පහසුකම්පිරිසිදු ඔප්පුපුළුල් මාර්ග සහිතයි.විස්තර සඳහා අමතන්න,Arakavila,Residential,10.0 perches
32,Land in Padukka / Arakawila,15 Jul 12:12 pm,"Padukka, Colombo","129,000","land in padukka - arakawilapipe born water3 phase electricityclear deedaproved planbank loaneasy paymenttotal price : Rs: 1,548,000/=",padukka,Residential,12.0 perches
33,Land in Padukka for Sale,15 Jul 12:01 pm,"Padukka, Colombo","1,104,000",300m to Handapangoda Bus RdElectricity SupplyWide RoadClear DeedBank Loan FacilityEasy Payment,Maputugala,Residential,12.0 perches
34,Land for Sale - Padukka Angamuwa,15 Jul 11:44 am,"Padukka, Colombo","80,000",Land for sale - Padukka Angamuwa==========================පාදුක්ක මිරියගල්ල බස් මාර්ගයට මී.30 ක් පමණ දුරින්පාදුක්කට කි.මි. 3 පමණ දුරින් පර්චස් 128 ඉඩම විකිණීමට ඇත.පිරිසිදු ඔප්පු සහිත තැනිතල හතරැස් බිම් කොටසසියළු පහසුකම් වලින් ද රජයේ සහ පුද්ගලික ප්‍රසිද්ධ වැදගත් ආයතන සහ බැංකු ආදියෙන් පරිපූර්ණ පාදුක්ක නගරයට ආසන්නව පිහිටි නිදහස් නිස්කලංක ස්වාභාවික පරිසරය.මිල ගණන් සාකච්චා කර ගත හැකි අතර වැඩි විස්තර සඳහා අමතන්න.,"Angamuwa, Padukka","Agricultural, Commercial, Residential, Other",128.0 perches
35,Land for sale - Padukka,15 Jul 10:05 am,"Padukka, Colombo","135,000","බෝපේ හන්දියට ක්රි.මි.2ක් දුරින්,උඩගම අවිස්සාවේල්ල ප්‍රධාන මාර්ගයේ සුන්දර වෙල් යායකට මයිම්ව අගනා නේවසික බිම් කොටස් කිහිපයක්,පහසු ගෙවිම් ක්‍රම සමගින්.මුලික ගෙවිම 10%",bope udagama,"Commercial, Residential",10.0 perches
36,Land for sale Padukka town,14 Jul 10:19 pm,"Padukka, Colombo","750,000","Clear DeedApproved survey planWith 20ft Road access150m to Padukka townNear by Cargills food city1min to Railway station,Bus standGovernment , private Hospitals Government , private banks",Residential,17.0 perches,
37,Land for Sale in Padukka,14 Jul  3:25 pm,"Padukka, Colombo","32,500,000",හොරණ පාදුක්ක ප්‍රධාන මාර්ගයට මුහුණලා පිහිටි ඉඩම පිටුපස වෙල්යායකින් අවසන් වි ඇත. කර්මාන්ත ශාලාවකට හෝ හෝටලයක් සඳහා වඩාත් සුදුසුයි.,හොරණ පාදුක්ක පාර අසල,Commercial,345.0 perches
38,Land for sale in padukka,14 Jul  2:43 pm,"Padukka, Colombo","60,000,000","කොළඹ දිස්ත්‍රික්කයේ පාදුක්ක ප්‍රාදේශීය ලේකම් කොට්ටාශයේ පාදුක්ක නගරයේ සිට හොරණ මලගල පාරේ කිලෝමීටර 6ක් දුරින් තේ, පොල්, රබර්, වගාකර ඇති, අක්කර 18 1/2, සරුසාර වගාකළ ඉඩම විකිනීමට ඇත.ට්‍රාන්ස්ෆෝමර් සහිත තෙකලා විදුලිය, ළිඳ සහිත නල ජලය, සහිතයි. වර්ග ආදී 11000ක ගොඩනගිල්ල සහිත ක්‍රේප් රබර් නිෂ්පාදනය කරන අංග සම්පුර්ණ කර්මාන්තශාලාව. රබර් වේලීම සදහා අවශ්‍ය දුම් කාමර, වතු නිවාස ඇත.හොරණ නගරයට කිලෝමීටර 09කි.ගැලනිගම අධිවේගී පිවිසුමට කිලෝමීටර 13කි. මාකුඹුර බහුවිධ ප්‍රවාහන මධ්‍යස්ථානයට කිලෝමීටර 14කි.ඉඩමේ එක පැත්තක් රජයේ මිරියගල්ල රක්ෂිතයට මායිම් වන අතර, තව මායිමක ඉඩමටම අයිති අක්කර 1/2ක දෙකන්න වැඩ කරන කුඹුරු යායකි.මිරියගල්ල රක්ෂිතයේ සිට ඉඩම හරහා ගලා යන සුන්දර දොළ පාරකි. මනස්කාන්ත පරිසරය තුල හාවුන්, මිමිනන්, වල්  ඌරං, ඉත්තෑවන් ආදී වසතුන්ද, මොණරු, ගිරව්, රාජාලි ආදී,පක්ෂින්ද නිතර දැකිය හැකිය.කොස්, බටදොඹ, දෙල්, ගිණිකුරු, නැදුන් මහෝගනී, තේක්ක, ආදී වටිනා දැවමය ශාක ඉඩම පුරාම ඇත.","Malagala Road, Padukka.",Agricultural,18.5 acres
39,80P Land for Sale in Poruwadanda,13 Jul  2:01 pm,"Padukka, Colombo","88,000",valuable landnear poruwadanda junctiongood viewclear deedeasy payment fcilities,poruwadanda,"Agricultural, Residential",80.0 perches
40,Land in Padukka - Arakawila,13 Jul  1:46 pm,"Padukka, Colombo","1,320,000",land in padukka - arakawilapipe born water3 phaseelectricityclear deedaproved plan,padukka,Residential,10.0 perches
41,Land in Padukka - Maputugala,13 Jul  1:15 pm,"Padukka, Colombo","91,000",land in padukka - maputugala.flat landelectricity supplyclear deedaprove plan,padukka,Residential,12.0 perches
42,Land for Sale - Meepe,12 Jul  2:43 pm,"Padukka, Colombo","1,320,000",land in meepe - arakawilapipe born water3 phase electricityclear deedaproved plan,padukka,Residential,10.0 perches
43,Land in Padukka For Sale,12 Jul  1:07 pm,"Padukka, Colombo","95,000",පාදුක්ක අරකාවිල කාෆට් පාරකට මායිම්ව මධ්‍යම ප්‍රමාණයේ කර්මාන්ත ශාලාවකට ඉතා සුදුසු පර්චස් 57ක ඉඩමක් විකිණීමට...විස්තර සඳහා අමතන්න,Arakavila | Koswathta Land,Residential,57.9 perches
44,Land for Sale Handapangoda - Maputugala,12 Jul 12:39 pm,"Padukka, Colombo","89,000",near horana - handapangoda bus road electricity supplybank loan facilitieseasy payment facilities,padukka,Residential,12.0 perches
45,Land in Padukka For Sale,12 Jul 11:48 am,"Padukka, Colombo","1,104,000","දර්ශණීය පරිසරයක් සහිත පදිංචියට සුදුසු , සියලු පහසුකම් සපිරි බිම් කොටස් කිහිපයක් විකිණීමට...හඳපාන්ගොඩ බස් මාර්ගයට මීටර 300බැංකු ණය පහසුකම් ලබා ගත හැකිය.වසර 03ක් දක්වා ගෙවිමේ පහසුකම්පර්චසයක් 92,000/= වැඩි විස්තර සදහා අමතන්න",Maputugala,Residential,12.0 perches
46,පාදුක්ක අරකාවිල ඉඩම,12 Jul  9:52 am,"Padukka, Colombo","132,000","කොළඹ ඉංගිරිය බස් මාර්ගයට ආසන්නව පදිංචියට සුදුසු , පොල් ගස් සහිත බිම් කොටස් විකිණීමට....සියලු නේවාසික පහසුකම් සහිතයි.බැංකු ණය පහසුකම් සහ වසර 03ක ගෙවිමේ කාල සීමාවවිස්තර සඳහා අමතන්න",Arakavila,Residential,10.0 perches
47,Land for Sale - Meepe,11 Jul  6:39 pm,"Padukka, Colombo","150,000","1km to Padukka junction ( Time taken on foot is 10 minutes )Railway station, banks, hospital, supermarkets( cargils,arpico)5 min to meepe junction  highlevel road ( 24h bus facility )Water, electricity facilities ",Residential,23.8 perches,
48,Land for Sale - Padukka,11 Jul  3:08 pm,"Padukka, Colombo","195,000",මීපේ ඉංගිරිය ප්‍රධාන මාර්ගයේ මායිමේ  පිහිටි අනගි බිම් කොටස් ☛කාපට් ඇතිරූ පුළුල් මාර්ග ☛හයිලෙවල් ප්‍රධාන මාර්ගයට 4km☛SLTC විශ්ව විද්‍යාලයට කිලෝමීටර් 3සුන්දරත්වය ප්‍රිය කරන ඔබ සඳහාමයි,Residential,10.0 perches,
49,Land in Handapangoda for Sale,11 Jul 12:20 pm,"Padukka, Colombo","89,000",300m / horana - handapangoda bus road. attractive bus road. electricity supply.clear deed & aproved plan.,padukka,Residential,12.0 perches
50,Rubber Land in handapangoda,11 Jul 12:19 pm,"Padukka, Colombo","50,000","Young planted rubber estate for sale in Horana – Handapangoda Rd. 500m to main bus road, Price per perch is Rs:50,000/= and can be negotiated. Clear title deeds.",handapangoda,"Agricultural, Residential",160.0 perches
51,Land in Padukka - BOPE,11 Jul 12:12 pm,"Padukka, Colombo","128,000",LAND IN PADUKKA - BOPEPIPE BORN WATER3 PHASE ELECTRICITYNEAR COLOMBO BUS ROUTECLEAR DEED,padukka,Residential,13.4 perches
52,Land in Padukka | 10p,11 Jul 11:15 am,"Padukka, Colombo","132,000",කොළඹ ඉංගිරිය බස් මාර්ගයට ආසන්නව පොල් ගස් සහිත පදිංචියට සුදුසු බිම් කොටස්....සියලු නේවාසික පහසුකම් පිරිසිදු ඔප්පුපුළුල් මාර්ගපදිංචියට සුදුසු නිස්කලංක පරිසරය,Arakavila,Residential,10.0 perches
53,පාදුක්ක මාපුටුගලින් ඉඩමක්,11 Jul 10:49 am,"Padukka, Colombo","1,104,000","පාදුක්ක හඳපාන්ගොඩ බස් මාර්ගයට මීටර 300යි.විදුලිය සහිතයි.පිරිසිදු ඔප්පුපුළුල් මාර්ගබැංකු ණය පහසුකම් සහ වසර 03ක ගෙවිමේ කාල සීමාවපර්චසයක් 92,000/-විස්තර සඳහා අමතන්න",Maputugala,Residential,12.0 perches
54,10 P Land for Sale in Padukka,11 Jul 10:37 am,"Padukka, Colombo","1,320,000",600m to Colombo Ingiriya Bus Rd.Electricity & Water SupplyClear Deed and PlanLakdinu Easy Payment and Bank Loan Facility,Arakavila,Residential,10.0 perches
55,Land in Meepe - Arakawila,10 Jul 12:44 pm,"Padukka, Colombo","129,000",land in arakawila.300m colombo - ingiriya bus road.pipe born water3 phase electricity.,padukka,Residential,12.0 perches
56,Land in Padukka For Sale,12 Jul  1:07 pm,"Padukka, Colombo","95,000",පාදුක්ක අරකාවිල කාෆට් පාරකට මායිම්ව මධ්‍යම ප්‍රමාණයේ කර්මාන්ත ශාලාවකට ඉතා සුදුසු පර්චස් 57ක ඉඩමක් විකිණීමට...විස්තර සඳහා අමතන්න,Arakavila | Koswathta Land,Residential,57.9 perches
57,Land in Padukka For Sale,20 Jul 10:05 am,"Padukka, Colombo","1,320,000",600m to Hadapangoda Bus RdWith Electricity & Pipe Water lineClear Deeds & Tittels.Bank loan or 3 years Easy payment methods.Super Land Plots and good Residential area,Arakavila,Residential,10.0 perches
58,Land in Padukka For Sale,10 Jul 12:17 pm,"Padukka, Colombo","1,104,000",300m to Hadapangoda Bus RdElectricity SupplyClear Deed and PlanBank Loan facilityEasy Payment,Maputugala,Residential,12.0 perches
