,0,1,2,3,4,5,6,7
0,title,posted date,location,price,description,Property type:,Address:,Size:
1,"5 Storied Commercial Building for Sale in Pathiragoda Road, Maharagama",10 Jul  9:08 am,"Maharagama, Colombo","55,000,000","5 Storied Commercial Building for Sale in Pathiragoda Road, Maharagama16 PerchesEach Floor is 2000 Sq.Ft. Apartment4 Apartments3 Bedrooms & 2 Bathrooms on Each ApartmentFully TiledA/C, Hot Water, Car Park, CCTV & All Facilities ThereRoof Top on 5th FloorRoof Tops are Tiled & Have Separate Bathroom8 Perch Car Park20Ft. Access RoadClose to Sri Jayawardenapura Hospital2km to Highlevel RoadIdeal for Commercial or Residential UseIdeal for School, Private Hospital or Care HomeUrgent SaleNo BrokersSelling Price: Rs.55 MillionCall for More Details",Building,Pathiragoda Road,"8,000 sqft"
2,"['5 Storied Commercial Building for Sale in Pathiragoda Road, Maharagama', '10 Jul  9:08 am', 'Maharagama, Colombo', '55,000,000', '5 Storied Commercial Building for Sale in Pathiragoda Road, Maharagama16 PerchesEach Floor is 2000 Sq.Ft. Apartment4 Apartments3 Bedrooms & 2 Bathrooms on Each ApartmentFully TiledA/C, Hot Water, Car Park, CCTV & All Facilities ThereRoof Top on 5th FloorRoof Tops are Tiled & Have Separate Bathroom8 Perch Car Park20Ft. Access RoadClose to Sri Jayawardenapura Hospital2km to Highlevel RoadIdeal for Commercial or Residential UseIdeal for School, Private Hospital or Care HomeUrgent SaleNo BrokersSelling Price: Rs.55 MillionCall for More Details', 'Building', 'Pathiragoda Road', '8,000 sqft']","['title', 'posted date', 'location', 'price', 'description', 'Property type:', 'Address:', 'Size:']",,,,,,
3,Hotel for sale Maharagama,30 Jun  8:25 am,"Maharagama, Colombo","100,000,000",14 RoomsAttached bathroom and graniteFull furnishedTile and granited1 side 2 storey second side 3 storey,Hotel,109/6 Railway Avenue,"10,000 sqft"
4,03 Story Building Sale At Maharagama,25 Jul 10:20 am,"Maharagama, Colombo","29,500,000",3 STORY BUILDING & 02 P SALE AT  FACING HIGH-LEVEL ROAD WATHEGEDRA MAHARAGAMA  ,Building,FACING HIGH LEVEL ROAD WATHEGEDARA MAHARAGAMA,"2,200 sqft"
5,Commercial Building For Sale in Maharagama,23 Jul  5:20 pm,"Maharagama, Colombo","47,500,000",Commercial Building For Sale in Maharagama,Building,Maharagama,800 sqft
6,3 Story Commercial Property for Sale in Maharagama.,23 Jul 11:15 am,"Maharagama, Colombo","19,800,000",Three Storey Building SaleAt Maharagama Pamunuwa Junction.,Building,"Maharagama near Pamunuwa,Mihindu Mawatha.","4,600 sqft"
7,SINGLE STORY BUILDING MAHARAGAMA,22 Jul  8:40 am,"Maharagama, Colombo","52,500,000",Rs 52500000.00,Building,MAHARAGAMA,"2,500 sqft"
8,40 Apartments Building for Sale Nawinna,21 Jul 10:29 pm,"Maharagama, Colombo","400,000,000",Total apartments 421bedroom apartment 8 Floors Lift available Parking available A/C Non A/C apartments available,Building,141 old kottawa Road Nawina Maharagama,"25,000 sqft"
9,Building for Sale in Kotte,21 Jul 10:20 pm,"Maharagama, Colombo","190,000,000",Main road facing 5 story building Parking available Suitable for office store and any kind of commercial purposes,Building,815 EAP perera Mawatha Ethul kotte,"10,000 sqft"
10,Factory for Sale Piliyandala - C0686-F,19 Jul  7:52 am,"Maharagama, Colombo","25,000,000","10 perch and with Garment factory for sale in Maharagama Road, Piliyandala.",Factory / Workshop,"5,000 sqft",
11,COMMERCIAL PROPERTY & 43 P MAHARAGAMA,18 Jul  6:28 pm,"Maharagama, Colombo","50,000,000",Rs 50000000.00 LAKHSPER PERCH ( 1162790.00 LAKHS PER PERCH )Negotiable,Shop,FACING PAMUNUWA ROAD MAHARAGAMA,"2,000 sqft"
12,Gym for Sale - Maharagama,11 Jul 11:59 am,"Maharagama, Colombo","5,500,000",Sale for gym and supplement shop.call for more details .,Other,"89/1,old road,nawinna, maharagama","4,000 sqft"
13,"Commercial Property for Sale in Pamunuwa Junction, Maharagama",10 Jul  1:03 pm,"Maharagama, Colombo","40,000,000","7.3 Perches or 10 Perches Commercial Land for Sale in Pamunuwa Junction, MaharagamaFacing to Pamunuwa Road (Maharagama-Ja'Pura Hospital Bus Route)Suitable to Build a 4 Storied Commercial PropertyHighly Commercial EnvironmentLack of For Sale Commercial Lands in Pamunuwa Junction, MaharagamaTherefore, This will be Massive Future Investment for a BusinessmanVery Urgent SaleSerious Buyers Welcome; No BrokersSelling Price: Rs.55 Lakhs Per Perch (If 7.3P-Rs.40 Million or 10P-Rs.55 Million)Call for More Details:",Building,Pamunuwa Junction,"4,000 sqft"
14,03 Story Building 7.3 P Sale at Maharagama, 4 Jul  9:28 am,"Maharagama, Colombo","80,000,000",03 STORY BIULDING & 7.3 P SALE AT  FACING HIGH LEVEL ROAD WATHEGEDRA JUNCTION MAHARAGAMA,Building,FACING HIGH LEVEL ROAD WATHEGEDRA JUNCTION MAHARAGAMA,"6,000 sqft"
15,Commercial Building for Sale in Maharagama, 3 Jul  5:53 pm,"Maharagama, Colombo","75,000,000",Commercial Building for Sale in Maharagama===================================,Building,"6,500 sqft",
16,02 Story Building & 15 P Sale Nawina Maharagama, 1 Jul 12:29 am,"Maharagama, Colombo","90,000,000",Rs 6000000.00 LAKHSPER PERCHNegotiable,Building,FACING HIGH LEVEL ROAD NAWINA MAHARAGAMA,"2,800 sqft"
17,Commercial Building for Sale Maharagama,28 Jun  1:29 pm,"Maharagama, Colombo","250,000,000","Commercial Building for sale.Six storied new building for sale facing to Pamunuwa Road, Maharagama.Passenger lift to all levels. Updated fire extinguisher system is installed. 3 floors tiled and other 3 is cemented. Just 300 meters from Maharagama junction. Execellant location for a showroom.Basement car parking and front parking available. International level front appearance. Office area is well designed for Board room, Director room and wide area for workstations. Large overhead water tanks for 50,000 lts. capacity. Pls. Call for more information.",Building,"Pamunuwa Road, Maharagama.","12,000 sqft"
18,42 Apartment Building for Sale in Maharagama,26 Jun  6:16 pm,"Maharagama, Colombo","250,000,000",Fully furnished modern studio apartmentsElectricity and water facilities providedkitchen and pantry facilitiesParking available24 hour security with surveillanceIdeal for hotel/ hospital or office space,Building,109/6 Railway Avenue,"20,000 sqft"
19,Bakery with A House for Sale Maharagama,30 Jun  3:01 pm,"Maharagama, Colombo","15,000,000","දිනකට පිටි මිටි 6 ක්.,  ගැණුම්කරුවන්ගේ කඩ 40, චූන් පාන් ත්‍රීවීලර් 5 සහ අළුත්ම තත්වයේ  කේක් සහ පාන් මික්ශර් මැශින් 2ක් සමඟ පාන් පෙති කපන මැශිමක්. නිවසද විසිත්ත කාමරයක් , කාමර 3ක්, නාන කාමරයක් සහ මුලුතැන්ගෙයකින් සමන්විතයි.",Factory / Workshop,"1,300 sqft",
20,Maharagama near Pamunuwa Building for Sale,25 Jun 10:44 pm,"Maharagama, Colombo","19,800,000",Three Storey Building SaleAt Maharagama Pamunuwa Junction.,Building,Maharagama,"4,600 sqft"
21,03 Story Building & 02 P Sale Maharagama,14 Jun 10:03 am,"Maharagama, Colombo","29,500,000",3 STORY BUILDING & 02 P SALE AT  FACING HIGH-LEVEL ROAD WATHEGEDRA MAHARAGAMA  ,Building,FACING HIGH-LEVEL ROAD WATHEGEDRA MAHARAGAMA,"3,200 sqft"
22,17 P & Single Story Building Maharagama,11 Jun  9:52 am,"Maharagama, Colombo","51,000,000",Rs 51000000,Building,APEKSHA HOSPITAL JUNCTION MAHARAGAMA,"2,000 sqft"
23,Commercial Property for Sale in Maharagama Town,10 Jun  3:42 pm,"Maharagama, Colombo","50,000,000","A commercial property for sale in Maharagama Town facing to Maharagama - Pilayandala Main Road. It is a land with a 13*16 sqft running shop. A house with 2 bedrooms,  bathrooms, kitchen with pantry cupboard and a living area. An Annex with a living area, pantry, a bedroom, 1 bathroom and a small office room. 7.7 perches. Price : 50 Million (Negotiable)",Building,"Pilayandala Road, Maharagama Town","1,900 sqft"
24,Building with 24 P Sale Maharagama, 8 Jun  6:34 pm,"Maharagama, Colombo","55,500,000",24 P LAND & SINGLE STORY BUILDING  SALE AT FACING MAHARAGAMA OLD KOTTAWA ROAD/ 100 METERS TO HIGH LEVEL ROAD MAHARAGAMA ,Building,FACING MAHARAGAMA OLD KOTTAWA ROAD/ 100 METERS TO HIGH LEVEL ROAD MAHARAGAMA,"4,000 sqft"
25,Commercial Land with Building for Sale in Maharagama, 9 Jul  9:39 am,"Maharagama, Colombo","80,000,000","Commercial Land with 3 Storied Building & 2 Storied House for Sale in Maharagama Town7.3 Perch with 3 Storied Building - 3000 Sq.Ft., 3.3 Perch LandRemaining 4 Perches - Land with Foundation for a BuildingAlso There are 8 Perches Land with 3 Storied House & 22 Perches Bare Land Behind This LandFacing High Level RoadSelling Price: Rs.80 MillionUrgent SaleNo BrokersCall for More Details",Building,Maharagama Town,"3,000 sqft"
26,"5 Storied Commercial Building for Sale in Pathiragoda Road, Maharagama",10 Jul  9:08 am,"Maharagama, Colombo","55,000,000","5 Storied Commercial Building for Sale in Pathiragoda Road, Maharagama16 PerchesEach Floor is 2000 Sq.Ft. Apartment4 Apartments3 Bedrooms & 2 Bathrooms on Each ApartmentFully TiledA/C, Hot Water, Car Park, CCTV & All Facilities ThereRoof Top on 5th FloorRoof Tops are Tiled & Have Separate Bathroom8 Perch Car Park20Ft. Access RoadClose to Sri Jayawardenapura Hospital2km to Highlevel RoadIdeal for Commercial or Residential UseIdeal for School, Private Hospital or Care HomeUrgent SaleNo BrokersSelling Price: Rs.55 MillionCall for More Details",Building,Pathiragoda Road,"8,000 sqft"
27,02 Story Building & 11.5 P Sale Maharagama,31 May 11:45 am,"Maharagama, Colombo","60,000,000",Rs 60000000.00 LAKHESTOTAL PRICE  Negotiable,Building,FACING MAHARAGAMA -PILIYANDALA MAIN ROAD MAHARAGAMA,"3,500 sqft"
28,"5 Storied Commercial Building for Sale in Pathiragoda Road, Maharagama",10 Jul  9:08 am,"Maharagama, Colombo","55,000,000","5 Storied Commercial Building for Sale in Pathiragoda Road, Maharagama16 PerchesEach Floor is 2000 Sq.Ft. Apartment4 Apartments3 Bedrooms & 2 Bathrooms on Each ApartmentFully TiledA/C, Hot Water, Car Park, CCTV & All Facilities ThereRoof Top on 5th FloorRoof Tops are Tiled & Have Separate Bathroom8 Perch Car Park20Ft. Access RoadClose to Sri Jayawardenapura Hospital2km to Highlevel RoadIdeal for Commercial or Residential UseIdeal for School, Private Hospital or Care HomeUrgent SaleNo BrokersSelling Price: Rs.55 MillionCall for More Details",Building,Pathiragoda Road,"8,000 sqft"
29,Hotel for Sale in Maharagama,25 Jun 10:48 am,"Maharagama, Colombo","55,000,000",5 Rooms with Bathroom and FurnishedFully Tiled Two Storey15 1/2 PerchPrice Can Be Negotiated,Hotel,109/6 Railway Avenue,"6,000 sqft"
30,Shop for Sale in Pamunuwa Road Maharagama,20 Jun  1:55 pm,"Maharagama, Colombo","6,000,000",The shop is in a good condition with a safe Door & lockers.This is the shop located in ground floor of two stories building which has 4 shops in each floor.Both water and electricity are available.There is a common toilet as well.,Shop,"217/B, Pamunuwa road, Maharagama",120 sqft
