,0,1,2,3,4,5,6,7,8,9
0,title,posted date,location,price,description,Beds:,Baths:,House size:,Land size:,
1,Modern Luxury 2 Story House for Sale in Pamunuwa road - Maharagama,16 Jul  4:01 pm,"Maharagama, Colombo","32,000,000","Modern luxury 2 story house on 13.5 perches and is 2875 sqftHighly residential area, which is surrounded by very good neighbourhood",4,3,"2,875.0 sqft",13.5 perches,
2,"['Modern Luxury 2 Story House for Sale in Pamunuwa road - Maharagama', '16 Jul  4:01 pm', 'Maharagama, Colombo', '32,000,000', 'Modern luxury 2 story house on 13.5 perches and is 2875 sqftHighly residential area, which is surrounded by very good neighbourhood', '4', '3', '2,875.0 sqft', '13.5 perches']","['title', 'posted date', 'location', 'price', 'description', 'Beds:', 'Baths:', 'House size:', 'Land size:']",,,,,,,,
3,Upstair Modern House Maharagama,19 Jul 11:16 pm,"Maharagama, Colombo","14,000,000",Real Solutions for your Real Estate Needs,MAHARAGAMA  PILIYANADALA ROAD ARRAWWALA EGODAWATTA,2,1,"2,700.0 sqft",7.0 perches
4,15Perch land with brand new two storey house - Maharagama,13 Jul  3:58 pm,"Maharagama, Colombo","19,500,000","15 Perch Land  with Brand New Two Storey House for Sale in Maharagama Gammana Road. 3 Bedrooms 2 Bathrooms Servant Room, Pantry and Large Vehicle Parking Space. Fully Tiled.300m to High Level Road. 1km to Maharagama Town",3,2,"1,300.0 sqft",15.0 perches,
5,House For Sale In Maharagama, 4 Jul  1:04 pm,"Maharagama, Colombo","22,500,000",පදිංචියට මෙන්ම ආයෝජනයකට වඩා සුදුසුයි.,"Daham Mawatha  ,  Maharagama",10+,2,"1,700.0 sqft",10.0 perches
6,House for Sale Pansala Para Maharagama,16 Jul 11:22 am,"Maharagama, Colombo","17,000,000",Located in a highly residential Area in  Maharagama,Pansala para maharagama,4,2,"3,000.0 sqft",12.0 perches
7,Three Story House for Sale - Maharagama,21 Jul  7:57 am,"Maharagama, Colombo","35,000,000",Under Construction Modern House for Sale in Maharagama500 meters to Maharagama150 meters to CIB Shopping Mall1 Km to Jayawardenapura Hospital  05 Bed rooms02 Main Bathrooms and 02 Servant's BathroomsDining RoomLiving AreaPantryRoof top areaGarage (for two vehicles),5,2,"3,334.0 sqft",10.0 perches,
8,Modern Luxury 2 Story House for Sale in Pamunuwa road - Maharagama,16 Jul  4:01 pm,"Maharagama, Colombo","32,000,000","Modern luxury 2 story house on 13.5 perches and is 2875 sqftHighly residential area, which is surrounded by very good neighbourhood",4,3,"2,875.0 sqft",13.5 perches,
9,2 Storey Brand New 8 P House for Sale in Maharagama Twon,21 Jul  7:44 am,"Maharagama, Colombo","22,500,000",2 storey Brand New 8P House For Sale in maharagama twon,Maharagama twon,4,3,"2,550.0 sqft",8.0 perches
10,"House for Sale in - Maharagama,Pannipitiya (old road)",14 Jul  7:21 pm,"Maharagama, Colombo","29,000,000",Two Story House with Separate Water Meters and Power Supplies for Each Floor.Tile & Terrazzo .Roller Door.3 Vehicle Parking Facilities.200m to High Level Road.,8,6,"3,000.0 sqft",18.5 perches,
11,House for Sale - Maharagama,21 Jul 11:51 am,"Maharagama, Colombo","17,500,000","Kamara 4,thanimahal niwasa,adi20 para,Maharagamata 2km,Bokundarata 2km,arawwala pasala asala.Mila kathakaragatha haka,call for  more details.","arawwala,pannipitiya",4,2,"1,650.0 sqft",12.5 perches
12,House for Sale in Maharagama,20 Jul  2:47 pm,"Maharagama, Colombo","19,500,000",HOUSE FOR SALE IN MAHARAGAMA8 PERCHESHighly residential area and very calm surrounding.       For Quickly Sell,L-MAHARAGAMA-05,3,4,"1,300.0 sqft",8.0 perches
13,Newly Built House for Sale in Navinna,20 Jul  2:03 pm,"Maharagama, Colombo","55,000,000","5 BedRooms. 4 bathrooms (2 attached). servent bathroom and servent bedroom# Tv lobby, dining hall,Beautiful modern kitchen, Pantry cupboards. Solar hot water,cctv, roller gate,# 3 Veranda, Landscaped Garden. Open concept. # vehicles parking space is 1 or 2, tow roller shutter. # 1500 sqft roof top, aluminum sliding windows # doors Genuine wood teak # 1. 3 km to maharagama # 500 meters to Navinna. # 20 meters to Polwaththa rd# Face to 20 feet carpet road",navinna,5,4,"4,100.0 sqft",11.0 perches
14,House Sale in Maharagama,20 Jul 11:56 am,"Maharagama, Colombo","27,500,000",HOUSE SALE IN MAHARAGAMANILAMMAHARA ROAD2 STORIED HOUSE275 LAKSHighly residential area and very calm surrounding.       For Quickly Sell,H-MAHARAGAMA-03,4,2,"1,800.0 sqft",12.9 perches
15,Upstair Modern House Maharagama,19 Jul 11:16 pm,"Maharagama, Colombo","14,000,000",Real Solutions for your Real Estate Needs,MAHARAGAMA  PILIYANADALA ROAD ARRAWWALA EGODAWATTA,2,1,"2,700.0 sqft",7.0 perches
16,Brand New Super Luxury House Sale in Maharagama,19 Jul  8:01 am,"Maharagama, Colombo","42,000,000",2Storey Brand new Super Luxury House for Sale in maharagama,maharagama pathiragoda road,4,4,"4,000.0 sqft",10.0 perches
17,House For Sale - Maharagama,18 Jul 11:03 am,"Maharagama, Colombo","17,200,000",Good new house for sale in mahayaya waththa road maharagama1.km piliyanadala maharagama road700.mt 296 kottawa piliyandala road4.km maharagama town4.7 km piliyandala town,Mahayaya Waththa Road Maharagama,4,2,"1,700.0 sqft",13.0 perches
18,House in Wijerama Maharagama,18 Jul  9:53 am,"Maharagama, Colombo","28,000,000","Two story house with * 5 bedrooms and 3 bathrooms* 2 to 3 vehicles parking* cctv camera/water/electricity/phone etc* Located in Wijerama junction - 300m to High Level Rd. * 200m to Jayawardanapura campus, * 3800 Sqft, * 20 feet carpeted rd access from both  sides* Walking distance to 138 bus route* Convenient, residential location.* Bank valuation 31 m ( under a bank loan) * Clear deeds titles Asking price 28 m ( Negotiable)",5,3,"3,800.0 sqft",8.0 perches,
19,Beautiful House For Sale In Maharagama,17 Jul  3:24 pm,"Maharagama, Colombo","46,000,000","Super luxury Two story House for Sale in Maharagama Waththegedara 400 meters to Maharagama Main Road. And selling with a modern furniture,4 Bedrooms with a AC   03 Bathrooms And a Hot Water system   Fully tiled, Living /DiningBalcony and small Playing Area  Pantry / KitchenParking Space for 2 VehiclesEntire house made by 9 inch brick walls, we can arrange the bank loans also. Please call us for make an appointment to see the house.……….SISAARA PROPERTY MANAGEMENT………",Maharagama - Waththegedara,4,3,"3,000.0 sqft",10.0 perches
20,Brand New Luxury Model 3 Story House for Sale in Maharagama,16 Jul  7:45 am,"Maharagama, Colombo","45,500,000","Brand New 3Storey House For Sale in Maharagama Navinna, pathiragoda, polwaththa rd. ","Maharagama, Navinna, pathiragoda",4,4,"4,600.0 sqft",10.0 perches
21,Half Done Upstair House Maharagama Arrawwala,17 Jul  4:32 pm,"Maharagama, Colombo","13,500,000",Real Solutions for your Real Estate Needs,MAHARAGAMA  PILIYANADALA ROAD ARRAWWALA,2,1,"1,200.0 sqft",12.75 perches
22,2 Story House For Sale - Maharagama,14 Jul  2:46 pm,"Maharagama, Colombo","17,500,000",2Storey House For Sale in Egodawattha Junction 01 Located just 1km Form The Main and is in a Highly Residential area in 341 bus Round Maharagama Piliyandala- Arawwala02 200 meters to 296 kottawa piliyandala bus round ...........................................................................................................................It's 2units House on 10 Perch and is 2580 sqft5Bedroom 2 Bathroom BalconyLiving RoomsPantryRoller Gate Garage with Parking Space for 2 VehiclesMaids / Toilet and RoomClear Titles,200 meters to 296 kottawa piliyandala bus round,5,2,"2,580.0 sqft",10.0 perches
23,Brand New Modern House for Sale Egodawattha Junction,14 Jul 12:39 am,"Maharagama, Colombo","24,000,000",Brand New Modern House For Sale in Egodawattha Junction ,"700 Meters to Maharagama -Piliyandala Road,Egodawattha Junction",4,3,"2,850.0 sqft",8.5 perches
24,House for Sale in Maharagama,12 Jul 11:50 pm,"Maharagama, Colombo","18,000,000",• Our Reference No SH 10459( Please quote this reference number when inquiring),Maharagama,5,2,"2,908.0 sqft",13.25 perches
25,Brand New Super Luxury House,12 Jul  5:20 pm,"Maharagama, Colombo","55,000,000","5 BedRooms. 4 bathrooms (2 attached). servent bathroom and servent bedroom# Tv lobby, dining hall,Beautiful modern kitchen, Pantry cupboards. Solar hot water,cctv, roller gate,# 3 Veranda, Landscaped Garden. Open concept. # vehicles parking space is 1 or 2, tow roller shutter. # 1500 sqft roof top, aluminum sliding windows # doors Genuine wood teak # 1. 3 km to maharagama # 500 meters to Navinna. # 20 meters to Polwaththa rd# Face to 20 feet carpet road","Pathiragoda Road,Navinna,Maharagama",5,4,"4,100.0 sqft",11.5 perches
26,Old House for Sale - Maharagama,12 Jul  9:28 am,"Maharagama, Colombo","1,500,000",only land value,Maharagama pamunuwa road,4,2,"3,500.0 sqft",20.0 perches
27,House For Sale in Maharagama,11 Jul  8:23 pm,"Maharagama, Colombo","16,000,000",මහරගම නිවසක් විකිණීමටමහරගම අඹගහපුර හන්දියේ සිට 200mපහසුකම් සහිත දෙමහල් නිවසක් සහ තනි නිවසක් විකිණීමටපර්චස් 16කාමර 3බාත්රූම් 2මිල ලක්ෂ 160,Maharagama,3,2,"2,000.0 sqft",16.0 perches
28,House for Sale in - Maharagama,11 Jul 12:56 pm,"Maharagama, Colombo","18,000,000",Nations Trust Bank PLC - Sale of acquired Property,"No.72/B, Pamunuwa Road, Maharagama.",5,2,"2,908.0 sqft",13.25 perches
29,House for Sale Close to Maharagama Town, 7 Jul 11:03 am,"Maharagama, Colombo","27,500,000",2 storey House for sale close to Maharagama town in Alhena Road (150 m to highlevel road).4 bedrooms2 bathrooms / 1 servant toiletparking for 2 vehiclesroller gate,"Maharagama, Elhena Rd",4,2,"2,500.0 sqft",8.3 perches
30,4 BR Modern House for Sale Maharagama Piliyanadala Road,17 Jul  4:31 pm,"Maharagama, Colombo","21,000,000",Real Solutions for your Real Estate Needs,MAHARAGAMA ROAD aberathna mw bokundara,4,3,"2,450.0 sqft",8.1 perches
31,(HS176) House for sale in Pamunuwa,10 Jul 12:00 pm,"Maharagama, Colombo","130,000,000",51 perchesLarge gardenPeaceful locationIndoor gardenArchitecture designedParking for 4+ vehiclesMaid's quartersSri Jayewardenepura hospital only few meters awaySuper market right next doorGreat ventilationHigh residential areaGreat access pointsAccess to all amenitiesLarge garage space which can be converted into an office space,"Pamunuwa Road, New Hospital Road, Maharagama",3,2,"2,000.0 sqft",51.0 perches
32,Facing Main Road 11 Perch with House - Maharagama,10 Jul 11:59 am,"Maharagama, Colombo","15,000,000",Real Solutions for your Real Estate Needs,2,1,"1,400.0 sqft",11.0 perches,
33,Brand New 4 Br Modern Rooftop House Pannipitiya,10 Jul 11:36 am,"Maharagama, Colombo","29,000,000",Real Solutions for your Real Estate NeedsDear Sir / Madam,MAHARAGAMA  PANNIPITIYA,4,3,"2,700.0 sqft",11.0 perches
34,4 Br Modern House with Roof Top for Sale Maharagama Pannipitiya,10 Jul 11:30 am,"Maharagama, Colombo","32,000,000",Real Solutions for your Real Estate NeedsDear Sir / Madam,MAHARAGAMA  PANNIPITIYA,5,3,"3,200.0 sqft",11.0 perches
35,Separate Entrance 2 Storey House for Sale - Maharagama Twon, 9 Jul 11:48 pm,"Maharagama, Colombo","30,000,000",Separate Entrance 2Storey House for Sale Maharagama,1km to Maharagama Twon.,4,2,"2,580.0 sqft",8.0 perches
36,Two Storied House For Sale in Maharagama,16 Jul  5:36 pm,"Maharagama, Colombo","92,500,000","★ Good House & Land / අනර්ග නිවසක් සහ ඉඩමක්  ★ Calm Place / නිස්කලංක පරිසරය★ Water, Electricity & Telephone /  ජලය , විදුලිය සහ දුරකථන★ 20 feet Carpet Road / අඩි 20 කාපට් පාර★ Suitable for build a Apartment , Factory or Stores / කර්මාන්ත ශාලාවකට , මහල් නිවාසයකට හෝ ගබඩා සංකීර්ණයක් ගොඩනැගීම සදහා වඩාත් සුදුසුය.★ Near to the Royal Institute / රෝයල් අධ්‍යාපන ආයතනය අසල★ Very Closed to the Divisional Secretariat Office & to the Keels Super Market / ප්‍රාදේශීය ලේකම් කාර්යාලයට සහ කීල්ස් සුපිරි වෙළඳ සලට ඉතා ආසන්නව★ Price Can Be Negotiable / මිල ගණන් සාකච්චා කරගත හැකCall the above contact for more information.වැඩි විස්තර සදහා අමතන්න.","Dehiwala Road, Daham Mawatha",6,3,900.0 sqft,40.0 perches
37,3Storey House For Sale in Maharagama- Pamunuwa, 9 Jul  4:15 am,"Maharagama, Colombo","19,000,000",3Storey House For Sale in Maharagama- Pamunuwa ,New Hospital Road Pamunuwa -Maharagama,8,3,"3,500.0 sqft",8.0 perches
38,2 Story Separate Entrance House for Sale - Maharagama, 8 Jul 11:28 pm,"Maharagama, Colombo","28,000,000","This House is located Maharagama Dabahena Road, 2Story Separate entrance House For Sale in Maharagama --------------------------------------------6Bed rooms 2 bath rooms and Servant toiletDining and leavingPantry & KitchenParking for 4vehiclesseparate entrance  first floor.","Dabahena Road,Maharagama",6,2,"2,850.0 sqft",12.35 perches
39,House || in Maharagama, 8 Jul  9:25 am,"Maharagama, Colombo","12,500,000",Single story house3 bedrooms2 bathroomLiving areaKitchen areaVehicle parking spacewater & electricity20 feet road400m to high level roadResidential areaClear deed,Maharagama,3,2,"1,300.0 sqft",10.0 perches
40,House for sale in Maharagama, 7 Jul  1:32 pm,"Maharagama, Colombo","46,000,000","3500sq fully furnished Beautiful Home for sale in a peaceful and a calm environmental with all the luxuries yet very close to main road and Arpico super centre Navina. Secured and friendly neighbourhood, With 20feet wide roads.",4,2,"3,500.0 sqft",10.5 perches,
41,House for Sale Close to Maharagama Town, 7 Jul 11:03 am,"Maharagama, Colombo","27,500,000",2 storey House for sale close to Maharagama town in Alhena Road (150 m to highlevel road).4 bedrooms2 bathrooms / 1 servant toiletparking for 2 vehiclesroller gate,"Maharagama, Elhena Rd",4,2,"2,500.0 sqft",8.3 perches
42,House for Sale - Pannipitiya Maharagama, 7 Jul  8:15 am,"Maharagama, Colombo","16,000,000","08 perch LAND with House3 Bedroom 2 Bathroom living room and kitchen20 ft wide Road Enters600 meter From Main road Kottawa Borella1.500 Kms from Darmapala College PannipitiyaBed Rooms & Living with Complete Furniture - Double Bed, Almairah for each Bed Room- A/C for Main Room- Living area with Sofa Set and TV, Dining Table - Complete Pantry with Cupboards Spacious Parking for 2 Vehicles Furnished Celling with Open Reef16/- Million with Complete FurnitureClear DeedsTo inspect the Land - Please inform 2 hours before",Pannipitiya Maharagama,3,2,"1,370.0 sqft",8.0 perches
43,Brand New Modern 3BR House for Sale in Maharagama, 7 Jul  7:47 am,"Maharagama, Colombo","17,900,000",Brand New Modern House for Sale Near Maharagama,2.5Km to Bokunadara Junction,3,3,"2,580.0 sqft",8.0 perches
44,House for sale in Maharagama, 6 Jul  6:23 pm,"Maharagama, Colombo","46,000,000",Three story house situated at Pamunuwa - MaharagamaGood Neighborhood & Calm & quiet area,"Pamunuwa, Maharagama",6,2,"3,000.0 sqft",12.08 perches
45,8 Br 15 P 2 Unit Newly Renovated Modern House Maharagama,10 Jul  3:04 pm,"Maharagama, Colombo","31,000,000",Real Solutions for your Real Estate Needs,MAHARAGAMA  PANNIPITIYA,8,4,"4,500.0 sqft",15.0 perches
46,3Storey House For Sale in Maharagama, 6 Jul 12:09 am,"Maharagama, Colombo","29,000,000",3Storey House For Sale in Maharagama- Mahamegawattha Road,"Mahamegawattha Road, Maharagama",6,3,"2,650.0 sqft",10.0 perches
47,Maharagama Arawwala House, 5 Jul  4:33 pm,"Maharagama, Colombo","26,500,000","Newly built house for sale , high residential area in arawwala 500 meters from arawwala junction",Maharagama Arawwala,3,2,"2,000.0 sqft",18.0 perches
48,House For Sale Maharagama - HH579, 5 Jul  1:44 am,"Maharagama, Colombo","27,500,000",Brand New Luxury two storied HouseFull Tilled3 Bed rooms (Master bed room with A/C)3 Bath rooms Solar power hot waterServant room/Servant Kitchen/Servant bathroomHouse in 0 perches landRoller gate500 meters to Jayawardenapura HospitalSurrounded by well built walls,3,3,"2,500.0 sqft",9.0 perches,
49,Two Story House For Sale In Maharagama,20 Jul 11:20 am,"Maharagama, Colombo","30,500,000",✓Two Story House For Sale In Maharagama 🏠✓Land Size 16.1perches ✓House Size 3400sqft ,"Boralasgamuwa, Maharagama",6,3,"3,400.0 sqft",16.1 perches
50,Luxury House for Sale in Maharagama,11 Jul  4:00 pm,"Maharagama, Colombo","35,000,000","ARCHITECTURALLY WELL DESIGNED, 3 STORY HOUSE WITH ROOFTOP, SUPER LUXURY HOUSE BUILT IN A 10 PERCH LAND WITH 4000 SQFT FOR SALE IN MAHARAGAMA. WELL DESIGNED 6 BEDROOMS, WITH 4 BATHROOMS PLUS A SERVANT BATH ON ROOF TOP. 3 BEDROOMS WITH ATTACHED BATH IS LOCATED IN THE GROUND FLOOR AND A FULLY EQUIPPED PANTRY AND OPEN KITCHEN IS ALSO LOCATED IN THE GROUND FLOOR. HOUSE IS WIRED FOR SOLAR AND PIPE LINES DONE FOR ALL THE TOILETS SUITABLE FOR HOT SOLAR HOT WATER GEEZER OR NORMAL GEEZER. NICELY DESIGNED GARDEN AND A BELLY TREE IN FRONT. TWO VEHICLES CAN BE PARKED. UPSTAIRS CAN BE RENTED OUT. HOUSE IS SPECIALLY DESIGNED WITH DOUBLE HEIGHT CONCEPT, FLOOR TO FLOOR 12 FEET, WITH AMPLE VENTILATION AND DAYLIGHT. CCTV CAMERA AND APPLICABLE FOR NET METERING AND OUR IF INTERESTED IN RENTING OUT PROVISION IS GIVEN FOR THREE METERS FOR THREE FLOORS. HOUSE IS FACING TO NAGAHAWATTA ROAD, 20 FEET CARPETED ROAD WITH DRAINS AND WELL MAINTAINED BY THE MAHARAGAMA UC. ASKING PRICE IS 36.5M NEGOTIABLE","Nagahawatte road, Maharagama",6,4,"4,000.0 sqft",10.0 perches
51,Brand New Super Luxury Model House for Sale in Maharagama,15 Jul  9:36 am,"Maharagama, Colombo","55,000,000","Brand New 3Storey architecture design House For Sale in Maharagama Navinna, pathiragoda, polwaththa rd. ","Maharagama, navinna rd, pathiragoda.",5,4,"4,100.0 sqft",11.5 perches
52,Brand New Luxury Model House for Sale in Maharagama,15 Jul  9:36 am,"Maharagama, Colombo","45,500,000","Brand New 3Storey House For Sale in Maharagama Navinna, pathiragoda, polwaththa rd. ","Maharagama, pathiragoda",5,4,"4,600.0 sqft",10.0 perches
53,House for sale at Maharagama, 1 Jul  5:23 pm,"Maharagama, Colombo","65,000,000",3 Story  Super Luxury House for Sale in Maharagama Area,polwatha road,5,5,"5,000.0 sqft",14.0 perches
54,House for Sale in - Maharagama, 1 Jul 12:42 pm,"Maharagama, Colombo","22,700,000","Maharagama, Piliyandala Road, Yahampath Mawatha1km to Maharagama Town500m to Maharagama, Piliyandala Main RoadBrand New Two Storied House (Used Only Two Months)4 Bedroom with AC4 BathroomCCTV Camera SystemParking Space for Two Vehicles7 PerchesFully TiledUpstair 3 Bedroom with BalconyUpstair TV LobbyLobby Living, DiningPantry with Modern Pantry CupboardHot WaterOver Head Tank with Pressure PumpRoller DoorPrice: 227 Lakhs","Yahampath Mawatha, Piliyandala Road, Maharagama",4,4,"2,150.0 sqft",7.0 perches
55,"Spacious House Close to High Level Rd, Maharagama",30 Jun  9:39 pm,"Maharagama, Colombo","31,000,000",Architecturally designed well maintained spacious house at Maharagama800 meters to High Level RoadLiving and dinning area5 bed rooms with 3 bath roomsPantryTV lobbyL shaped gardenFacing 20 ft wide access roadHigh residential area,"Wattegedara Road, Maharagama",5,3,"3,000.0 sqft",15.0 perches
56,House and Land for Sale - Maharagama,20 Jul 10:48 am,"Maharagama, Colombo","12,000,000",House For Sale In Maharagama================================,"Henegedara Road, Neelamara, Maharagama.",2,1,"1,500.0 sqft",10.7 perches
57,4 BR Modern House for Sale Maharagama Piliyanadala Road,17 Jul  4:31 pm,"Maharagama, Colombo","21,000,000",Real Solutions for your Real Estate Needs,MAHARAGAMA ROAD aberathna mw bokundara,4,3,"2,450.0 sqft",8.1 perches
58,House for Sale with Valuable Land Maharagama, 2 Jul  9:21 am,"Maharagama, Colombo","28,000,000","Located in a highly residential Area in pannipitiya, Maharagama",pannipitiya maharagama,3,2,"3,000.0 sqft",17.0 perches
59,House for Sale in - Dambahena,30 Jun 11:24 am,"Maharagama, Colombo","24,000,000",මහරගම නගරයේ සිට 800m දුර. දෙමහල් නිවසක් සහා තනි නිවසක් ඉකමනින් විකිනීමට ඇත.වැඩ් දුර විස්තර සදහා අමතන්න.,4,4,"3,000.0 sqft",15.0 perches,
60,House for Sale in - Maharagama,29 Jun  8:06 pm,"Maharagama, Colombo","16,200,000","Half built house for sale in Godigamuwa,Maharagama. (Maharagama - Piliyandala road).700 meters to Maharagama city. ( less than 5 minutes)Down floor fully completed. Down floor consist of 2 beds, 1 bath, living, dinning area, Kitchen with pantry and garage. Made of brick walls.Garden is done and present around the house. Highly residential area with a private road. (Private road is for 6 houses from the main road)Genuine buyers only.",2,1,"1,500.0 sqft",10.5 perches,
61,House for Sale in Piliyandala, 5 Jul  3:28 pm,"Maharagama, Colombo","10,700,000","මහරගම - පිළියන්දල බස් මාර්ගයට 200 m , කොට්ටාව - පිළියන්දල බස් මාර්ගයට 50m  කොට්ටාවට  4km, මහරගමට 5Km ,පිළියන්දලට 3km.නිදන කාමර 2 (යාබද නාන කාමර) , සාලය, කෑම කාමරය, සහිතයි.අංග සම්පුර්ණ කුස්සිය සේවක වැසිකිලිය මනාව සකස් කරන ලද ගෙමිදුල, වාහන 2 ගාල් කිරීමේ ඉඩකඩ සහිතයි.නල ජලය, දුරකථන, විදුලිය සහිතයි.පිරිසිදු, නිරවුල් ඔප්පු, සහ අනුකුලතා සහතිකය සහිතයි.අඩි 20 පළල මාර්ගය.පරික්ෂා කිරීමෙන් පසු මිලගණන් සාකච්චා කල හැක.ගැනුම් කරුවන් පමණක් විමසන්න, බ්‍රෝකර්වරු අනවශ්‍යයි.",2,2,"1,100.0 sqft",7.25 perches,
62,House For Sale,28 Jun 11:43 am,"Maharagama, Colombo","19,500,000",Super 2 Storey House For Sale Erawwala Maharagama,Erawwala Maharagama,6,5,"2,700.0 sqft",10.0 perches
63,House for Sale - Maharagama,27 Jun 11:20 pm,"Maharagama, Colombo","30,000,000","15 perches, 800 m to Maharagama Junction, Ground floor- Open veranda,living,dining,4 bed rooms,kitchen,2 toilets , car porch, balcony & garage. Basement 420 sq ft.in a good condition.Main house fully tiled.Rear building 620 sq ft, Total 3500 sq ft. Rs.30 million.",4,2,"3,500.0 sqft",15.0 perches,
64,House || in Maharagama, 8 Jul  9:25 am,"Maharagama, Colombo","30,000,000",Single story houseSquare landResidential area4 Beds room 3 Bath roomsLiving /diningPantry with kitchen areaGarageGarden areaPipe born water & electricityParapet wall with gateClear deeds,Near Maharagama,4,3,"2,500.0 sqft",20.0 perches
65,House For Sale In Nawinna, 1 Jul 10:48 am,"Maharagama, Colombo","35,000,000","* Two story house (newly refurbished)* Living and dinning area* 5 bedrooms and 3 bathrooms* 15 perches land* Located at Nawinna, * 400 meters to Highlevel road and Boralesgamuwa","Isipathanarama Road, Nawinna",5,3,"2,500.0 sqft",15.0 perches
66,Brand New 5BR Modern Rooftop House - Maharagama,29 Jun 10:57 am,"Maharagama, Colombo","33,000,000",Real Solutions for your Real Estate Needsමෙම   දේපළට  පැමිනිමට පළමුව කරුණාකර පැහැදිලිවම කලින්  දින වේලාවක් වේන්කර ගෙන පැමිනෙන්න එසේ නොමැතිව අපහසු තාවයට පත් නොවන්න කරුණාකර දැන්විම  සමිපුර්නයෙන් කියවීමෙන් පසුව අප අමතන්න.,Maharagama yahampath mawatha,5,3,"3,800.0 sqft",12.5 perches
67,2 Storey New House For Sale near Maharagama,22 Jun  8:58 pm,"Maharagama, Colombo","19,800,000",2 Storey New House For Sale near Maharagama Piliyandala Bus Routes -------------------------Located just 200 meters to 296 Kottawa piliyandala Bus routes,Located just 200 meters to 296 Kottawa piliyandala Bus routes,4,3,"2,750.0 sqft",8.0 perches
68,31 P & Single Story House Maharagama,21 Jun  6:06 pm,"Maharagama, Colombo","60,000,000",Rs 60000000.00Negotiable,PATHIRAGODA ROAD NAWINA MAHARAGAMA,4,3,"3,000.0 sqft",31.0 perches
69,House For Sale in Maharagama,20 Jun  6:22 pm,"Maharagama, Colombo","15,300,000","මහරගම, පමුණුව පාරේ CIB අසල ජයවර්ධනපුර රෝහලට ආසන්නයේ පර්චස් 7 හරි හතරැස් ඉඩම සහිතසම්පූර්ණ ටයිල් දෙමහල් නිවස විකිණීමට.වෙනම ඇනෙක්සියක්ද ඇත.ත්‍රීෆේස් විදුලිය, අඩි 20 පාරකාමර 2, සාලයබාත්රූම් 1, කුස්සියවාහන 3කට පාකිං ඇත.බිම ගල් අල්ලා ඇත.මිල ලක්ෂ 153 (Negotiable)","Pamunuwa Road, Maharagama",2,1,"1,000.0 sqft",7.0 perches
70,Single House For Sale in Maharagama.,20 Jun  8:08 am,"Maharagama, Colombo","5,500,000",Residential 6P Land & House For Sale in Maharagama  for land value  ------------With  20 feet Road,30 Meters to bokunadara Road,2,1,850.0 sqft,6.0 perches
71,New Modern 2 story House For Sale in Maharagama Temple Rd,19 Jun  1:32 pm,"Maharagama, Colombo","37,000,000",New Modern House For Sale in maharagama ,"Maharagama, Temple Rd",4,4,"3,000.0 sqft",15.0 perches
