,0,1,2,3,4,5,6,7
63,Building for Sale - Kelaniya, 4 Jul 12:37 pm,"Gampaha, Gampaha","30,000,000","6.42 Phr. 3642 Sq ft. 3 stories Building with 2nd floor Ac, 16 Security Cameras fixed,Telephones,Lift to Transport Goods to 3rd Floor, 60 KVA Electricity,12 Feet wide Road, 10-15 meters to Kandy Road, 200 meters before passing Kelaniya University, from Colombo left side,just behind Pussellawa meat Shop Dalugama, ideal for Hostel, Garment Factory, or any other business.",Building,"43/3-2,Kandy Road, Dalugama Kelaniya","3,642 sqft"
64,Building for Sale in Minuwangoda,25 Jul 10:43 am,"Minuwangoda, Gampaha","17,000,000","fully completed   02 story building located katunayake-Minuwangoda main road. 15 perch 3km to Minuwangoda city.4 km to katunayake airport and to the express way.separate entrance for each compartment. .toilets facilities water,clear Documents and Plan. currently  TVS service is available monthly rental 40000+20000.in this area price of 01 perch is 675000/highly commercially developing  area .building is separated to two compartments  1560 sqft and 840 sqft",Building,Yatiyana Minuwangoda,"2,400 sqft"
65,Property for Sale in Mirigama, 4 Jul  9:12 am,"Mirigama, Gampaha","8,500,000","කොළඹ කුරුණෑගල ප්‍රධාන මාර්ගයට මුහුණලා ගිරිඋල්ල නගරයට 1km දුරින් පිහිටා ඇති මෙම නිවස  හා ව්‍යාපාරික  ගොඩනැගිල්ල අංගසම්පූර්ණ කඩ කාමර 2ක්, නාන කාමර 2ක්, නිදන කාමර 2ක් මුලුතැන්ගෙය, ටයිල් කල පොළොව , සිවිලිම , නල ජලය , ලිං ජලය , වට තාප්ප , සේවක වැසිකිලි , ගරාජය, නිරවුල් ඔප්පු සහිතයි .",Building,කොළඹ කුරුණෑගල මාර්ග අංක05  නාල්ල .,"1,700 sqft"
66,Commercial Property for Sale Kiribathgoda, 2 Jul  3:54 pm,"Kiribathgoda, Gampaha","35,000,000",සපුගස්කන්ද  ගෝනවල  පාරට මුහුණලා  ඕනෑම ව්‍යාපාරයකට  සුදුසුයි . වටේම තාප්පය,Other,"1,000 sqft",
67,Restaurant for Sale in Negombo, 9 Jul  3:13 pm,"Negombo, Gampaha","60,000,000","Restaurant & Bar For Sale In Hotel Road, Negombo.• -  8.5 Perches • -  1700 Sq Ft Slab Area ",Restaurant,"Hotel Road, Negombo","1,700 sqft"
68,New Villa for Sale in Negombo, 2 Jul  3:40 pm,"Negombo, Gampaha","40,000,000",New Villa for Sale in Negombo=======================,Hotel,Negombo,"2,500 sqft"
69,Hotel for Sale Negombo,30 Jun 10:48 pm,"Negombo, Gampaha","35,000,000",Call For More DetailsSerious Buyers Welcome,Hotel,Negombo,"5,000 sqft"
70,Hotel for Sale Negombo,30 Jun 10:52 pm,"Negombo, Gampaha","35,000,000",Call For More DetailsSerious Buyers Welcome,Hotel,Negombo,"5,000 sqft"
71,Hotel for Sale in Negombo,30 Jun  9:03 pm,"Negombo, Gampaha","35,000,000",Call For More DetailsSerious Buyers Welcome,Hotel,Negombo,"5,000 sqft"
72,Commercial Property For Sale In Jaela Orex City,30 Jun  4:44 pm,"Ja-Ela, Gampaha","2,000,000","Near to the elevator, 1.5 km to the high way entrance, car parking, also suitable for a shop",Office,Orex city ekala,192 sqft
73,Commercial Property for Sale in Wattala,30 Jun 11:56 am,"Wattala, Gampaha","750,000","මහල් නිවාස සංකීර්ණ(Apartments) සෑදීමට ඉතා සුදුසු ඉඩමක්,පල්ලියවත්ත,හැඳල,වත්තල ප්‍රදේශයෙන් පැරණි නිවසක් ද සමග විකිණීමට තිබේ .( නිවසට තක්සේරුවක් කරනු නොලැබේ)",Other,"පල්ලියවත්ත , හැඳල , වත්තල","2,000 sqft"
74,Building for Sale in Negombo City,29 Jun 10:58 pm,"Negombo, Gampaha","16,000,000","# මීගමුව - හලාවත පරණ පාරට ආසන්නව ( මීටර 50 ) , ආවේ මරියා පෞද්ගලික රෝහලට මුහුණලා , මීගමුව නගර මධ්‍යයෙන් , වර්ග අඩි 2500 ක ව්‍යාපාර ගොඩනැගිල්ලක් සමග පලමු මහලේ ඇති නිවස වහාම විකිණීමට තිබේ ....# කොළඹ - හලාවත ප්‍රධාන බස් මාර්ගයට , මීටර  300 ක් පමණ තිබේ ...# සියලු පහසුමක් සමගින් , විශේෂයෙන් පාසල් / පල්ලි / සුපර් මාකට්  යනාදියට...# වැඩි විස්තර සඳහා පහත දුරකථන අoකයෙන් විමසන්න .....",Building,Negombo City,"2,500 sqft"
75,Boarding Houses For Sale In Awariwaththa Katunayaka,29 Jun 10:41 pm,"Katunayake, Gampaha","10,000,000",අමන්දොලුව අවරිවත්ත සිදුව කටුනායක ප්‍රදේශයේ පිහිටි පර්ච් 10 ක ඉඩමක්  තුළ පිහිටි බොඩින් කමර සහිත ගොඩනැගිල්ලක් විකිණීම. ,Other,Amandoluwa Awariwaththa Katunayaka Seeduwa,"2,000 sqft"
76,10 Boarding Rooms for Sale Katunayaka Awariwaththa,29 Jun 10:29 pm,"Katunayake, Gampaha","6,000,000",අමන්දොලුව කටුනායක සිදුව ප්‍රදේශයේ පිහිටි පර්ච් 10 ක ඉඩම සහ බොඩින් කමර 8 විකිණීමට ඇත ,Other,Amandoluwa Awariwaththa Katunayaka Seeduwa,"1,000 sqft"
77,3 Shutter Shop for Sale - Ja ela,29 Jun  1:58 pm,"Ja-Ela, Gampaha","7,900,000",3 shutter shop with 10 perches land space for salelocated in Nivandama road3 km to Negombo Main road,Shop,"142E North Batagama, Jaela","1,000 sqft"
78,3 Storied Commercial Building Available for Sale in Gampaha,23 Jul 10:06 am,"Gampaha, Gampaha","35,000,000","3 Storied Commercial Building available for Sale in Gampaha.  The Building belong  11.5 perches, Facing to Colombo – Gampaha Main road, Nearly Holly Cross collage. Less than 1.5km to Gampaha city and 3.5km to Kandy road (Miriswaththa Junction) . Currently ongoing well established studio.",Building,Gampaha,"3,500 sqft"
79,Commercial Property for Sale in Katunayake,28 Jun 12:24 pm,"Katunayake, Gampaha","39,000,000",Best place for business. Face to Baseline Road Amandoluwa. Thre are two stories buildin. Full glass frontside. Three pace electricity. Please visit and dicide. Verrey urgently sale. Cos to be abroad.,Building,"5,900 sqft",
80,Warehouse for Sale - Negambo,28 Jun  2:20 pm,"Negombo, Gampaha","21,000,000",Floor Space Ground Floor 3800 Square Feet,Warehouse / Storage,"5,000 sqft",
81,Hotel for Sale Negombo,27 Jun 12:53 pm,"Negombo, Gampaha","35,000,000",Call For More DetailsSerious Buyers Welcome,Hotel,Negombo,"5,000 sqft"
82,Hotel for Sale Negombo,27 Jun 12:51 pm,"Negombo, Gampaha","35,000,000",Call For More DetailsSerious Buyers Welcome,Hotel,Negombo,"5,000 sqft"
83,අංගසම්පූර්ණ ව්‍යාපාරික ස්ථානයක් - නාල්ල,10 Jul  2:39 pm,"Mirigama, Gampaha","4,000,000","විදුලිය, නල ජලය, ටයිල් කල පොළොව , සිවිලිම , නාන කාමරය  නිදන කාමර 1ක් පර් 06යි මුලුතැන්ගෙය. සහිත අංගසම්පූර්ණ ව්‍යාපාරික ස්ථානයක් .",Building,කොළඹ කුරුණෑගල මාර්ග අංක05  නාල්ල .,850 sqft
84,Negombo Beach Hotel for Sale / 8 Br,24 Jul  9:26 am,"Negombo, Gampaha","45,000,000",# FACING NEGOMBO BEACH ROAD# SEA VIEW HOTEL# 8 BED ROOMS AND ATTACHED BATH ROOMS# RESTAURANT # SWIMMING POOL# GOOD INCOME BUSINESS# SERIOUS BUYERS ONLY - NO MIDDLE MAN****# AFFILIATED TO FERNANDO HOMES # INSPECTION ON PRIOR APPROVALS,Hotel,Negombo Beach Road,"4,250 sqft"
85,Boutique Hotel for Sale in Negombo,26 Jun  5:41 pm,"Negombo, Gampaha","35,000,000",Call For More DetailsSerious Buyers Welcome,Hotel,Negombo,"5,000 sqft"
86,Newly Built 2 Story building for Sale in Biyagama.,23 Jul 10:06 am,"Delgoda, Gampaha","16,000,000","Annex type 2 Story building available for sale in Biyagama. Built on 11.8 perches land. Consists 12 Rooms, attached Bathrooms, Separate pantries, Tiled floor, Parapet walls. Just 700m away from BOI zone. Already fixed monthly income. Selling due to migrating.",Building,"5,400 sqft",
87,Building for Sale in Pugoda,24 Jun 11:21 am,"Gampaha, Gampaha","17,500,000",හංවැල්ල කිරිදිවැල මාර්ගයට මායිමව හෙට්ටිකඩේ හන්දියේ  පර් 10ක ඉඩම සහ තට්ටු තුනේ ගොඩනැගිල්ල සහ ව්‍යාපාර ස්ථාන 2ක් ඇත.සැලෝන් එකක්COMMUNICATION එකක් පාසල් උපකරණ ෆොටෝ COPY මැෂිමක් ඇතුළු සියලු දේ විකුණනු ලැබේ මිල ගණන් කතා කර ගත හැක,Shop,"1,482 sqft",
88,Shop for Sale in Ganemulla,22 Jun  4:51 pm,"Ganemulla, Gampaha","2,900,000",ගණේමුල්ල නගරයේ පිහිටි වර්ග අඩි 14x14 ඹෞෂධ වෙළද සැලක් විකිණීමට ඇත.,Shop,196 sqft,
89,Small Guest House for Sale in Katunayaka Seeduwa Liyanagemulla,19 Jul  1:13 pm,"Katunayake, Gampaha","16,500,000",සිදුව ලියනගේමුල්ල කටුනායක ප්‍රදේශයේ පිහිටි කුඩා Guest House එකක් විකිණීමට ඇත.,Hotel,"Liyanagemulla,  Katunayaka, Seeduwa","2,000 sqft"
90,Business and Property for Sale in Negombo,28 Jun  9:41 am,"Negombo, Gampaha","40,000,000","Currently an accredited water testing laboratory and office. Selling with the CEA certificates, accreditation certificates ISO 17025 ISO 9001, staff and equipment. 6 years old building.- selling with the 3 bedroom 2 bathroom apartment with furniture.-Selling as the directors are migrating.",Office,St joseph street,"5,000 sqft"
91,Two Story Commercial Building for Sale - Aththanagalla,21 Jun  3:09 pm,"Gampaha, Gampaha","17,500,000","අත්තනගල්ල රජමහා විහාරයට කි.මි 1.5 දුරින් ,පාරවල් දෙකකට මුහුණලා ඇති ,  40ft container පිවිසීමට හැකියාව තිබෙන පර්චස් 78 ක තෙකලා විදුලිය ,නළ ජලය සහ හතරවට තාප්ප සහිත ඉඩම සහ දෙමහල් ගොඩනැගිල්ල විකිණීමට තිබේ.කර්මාන්තශාලාවක් සදහා වඩාත් යෝග්‍යවේ .දැනට මාසිකව 65,000.00 බැගින් කුලියට දී තිබේ .බැoකු ණය පහසුකම් සපයාදිය හැක .",Building,"5,500 sqft",
92,Commercial Property for Sale at Negombo,21 Jun 12:37 pm,"Negombo, Gampaha","280,000,000",NEGOMBO  ( DUNGALPITIYA ) COMERICAL PROPERTY AVAILABLE FOR SALE / 800 PERCHES  ( 5 ACERS )  / 6 BEDROOM  HOUSE / ROAD FRONTAGE OF COLOMBO NEGOMBO MAIN ROAD  / ( 70 METERS ROAD FRONTAGE / SQUARE BLOC / PARAPET WALL / 8 KM. NEGOMBO AND 25 KM. TO COLOMBO / IDEAL FOR ANY COMMERCIAL PURPOSE / NATURAL LAND / IDEAL FOR  HOSPITAL / INTERNATIONAL SCHOOL / LUXURY ELDERS HOME / NO FLOOD THREATS AND VISITS CAN BE RRANGED ON APPOINMENTS ONLY FOR APPOINMENT PLEASE CALL - ( PRICE PER PERCH  350000/= LKS.  ( NEGOTIABLE ),Other,"Dungalpitiya , Negombo","5,000 sqft"
93,Building for Sale in Negombo.,27 Jun  3:11 pm,"Negombo, Gampaha","9,500,000","මුහුදු වෙරල ආසන්නයෙ ක්‍රිඩා පිට්ටනිය සහ උසාවියේ සිට මිගමු නගරයට එන පාර මහවිදිය පල්ලිය අසල පල්ලිය නැරබිමට දහස් ගනන් විදෙශියන්  පැමිනෙන. ඒ අසල රත ගලයක් තිබේ. විදේශිකයන් සදහා බඩු අලෙවි කරන ස්තානයකට සුදුසුය.. රීට අමතරව විදෙශ මුදල් මාරුකරන ස්තානයකටද, රත්තරන් බඩු අලෙවි කරන ස්තානයකටද, ගුවන් ටිකට් පත් අලෙවි කරන ස්තානයකටද ඕනෑම ව්‍යාපාරයක් සදහා සුදුසුය. රීට අමතරව බදාද සහ ඉරිදා විශාල වශයෙන් පවත්වන පොලක් (fair) ද ඇත. එම ස්තානයේ අවන් හලක් පවත්වා ගෙන යයි. පචර් එකකට අඩු තට්ටු 3 ක ගොඩනැගිල්ලක් (තට්ටු තුනේම වර්ග අඩි 507 ක් තිබේ )ව්‍යාපාරයක සමග හො නැතුව විකිණීමට. මිල රු 9500000.නුවර අවට ආදායම් ලබන ව්‍යාපාරයක් හො වටිනා දේපලකව  මරුවකට සදහ  සලකා බැලේ , ඉතුරු මුදල් අතින්. නුවර අවට වටිනා ඉඩම් මිලදී  ගැනිමට ද අවශ්‍යයි.විමසන්න ",Building,155 sqft,
94,Commercial Property with Land in Kadawatha,19 Jun  3:15 pm,"Kadawatha, Gampaha","145,800,000",The land in most developing city in Sri Lanka under the Mega police plan for sale. This  land in Kadawatha Eldeniya facing Colombo Kandy main road 24.3 P land with 12.6m road front  only 100m to Eldeniya high way entrance. The back of the land facing to a beautiful paddy field and  the highway this will be brilliant investment with huge appreciation with current developments. Expecting 6 million per perch (negotiable) only serious buyers no brokers please,Other,"6,221 sqft",
95,Commercial Building for Sale in Kadawatha,25 Jun  3:19 pm,"Kadawatha, Gampaha","45,000,000","කිරිල්ලවල  කන්නදකපපු  හන්දියේ  නුවර පාරට  මුහුණලා පර්  10 ඉඩම  සමග  තෙමහල්  බිස්නස්  ගොඩනැගිල්ල සහ  ස්ටෝ  රූම් අලවියට. [නුවර  පාරට  අඩි  55 මුහුණත ] සියලුම  පහසුකම් ඇත  . බැංකු ,කාර්යාල,සාප්පු  ප්‍රදර්ශනගාර , ගබඩාවකට ,නිෂ්පාදන  ප්‍රදර්ශනගරා  අදි යට  වඩා  සුදුසුය දැනට මෙහි  ලි  බඩු  ප්‍රදර්ශන ගාරයක් පවත්වාගෙන  යනු  ලැබේ .[ඉඩමට  අමතර  අඩි 12 පිවිසුම් මාර්ගයක් ඇත  කොටස්  වශයෙන්ද  ලබා  ගත  හැක ] කඩවතට  නගරයට  විනාඩි 10 අදිවේගී  මාර්ග පිවිසුමට  විනාඩි  5  වාහන 10 නැවතීමේ  පහසුකම් සහ කන්ටේනර් ඇතුල් කර  ගැනීමේ පහසුකම්  මුළු ගොඩ නගිල්ලම  ටෙම්පඩ්  විදුරු  දම  ඇත.",Building,"4,000 sqft",
96,Commercial Building with Land for Sale in Gamapaha,30 Jun  9:41 am,"Gampaha, Gampaha","35,000,000",Commercial Building with Land for Sale in Gamapaha===================================,Factory / Workshop,"4,400 sqft",
97,Commercial Property For Sale Katunayake, 3 Jul  6:47 am,"Katunayake, Gampaha","28,000,000","Commercial Property For Sale A 3200 Square Feet half build three story building ( approved by civil aviation authority ) is for immediate sale.there is a separate two rooms and a servant wash room to wards the end of the property.The property is located in W.A DE Silva Road,Katunayake (18th mile post) The location is situated just 05 mins to the airport  and 02 min to katunayake - colombo expressway.             * IDEAL FOR BANK,RESTAURANT,HOTEL OR SHOPPING MAILL.             * THREE PHASE CURRENT,WATER SUPPLY AVAILABLE.              *  VEHICLE PARKING AVAILABLE.              * PRICE NEGOTIABLE.",Building,"W.A DE Silva Road,Katunayake","1,800 sqft"
98,Shop For Sale - Ja Ela,18 Jun  5:08 pm,"Ja-Ela, Gampaha","6,600,000",Well Finished Roof and Floor.Consist of an Attached Bathroom.Ground Floor Shop.,Shop,"Ground Floor, Orex City, Ekala, Ja-ela.",292 sqft
99,Shop for sale in Minuwangoda,17 Jun  9:34 pm,"Minuwangoda, Gampaha","10,000,000",Shop for sale in MinuwangodaIkmanin wikine,Shop,minuwangoda,800 sqft
100,Commercial Building for Sale Kotugoda,25 Jun 11:50 am,"Ja-Ela, Gampaha","9,800,000","The House with a Commercial Building consists of a total of 15.5 perches of land for sale in Kotugoda. (Near to Colombo - Kurunagala No.05 main road). 15 min to Katunayaka international airport.Two story House consists of 4 bedrooms, bathroom, living room, and Kitchen.All facilities are available with electricity, Water tanks in both properties & Telephone (SLT connection) in the main house & the Building. Clear Deeds.",Building,Kotugoda,"4,220 sqft"
101,Building with House for Sale in Kalagedihena Juntion,19 Jun  3:11 pm,"Nittambuwa, Gampaha","45,000,000","3 Storey Commercial Property & House for Sale Kalagedihena Juntion,",Building,"Kalagedihena, Nittambuwa","8,000 sqft"
102,Newly Built Garment Factory for Sale - Ja Ela,15 Jun  9:26 am,"Ja-Ela, Gampaha","55,000,000","- 30 perches land - Each floor 3655 square feet and total 3 floors( including ground floor)- 2600 square feet land for parking facilitites- Designed for complete departments of garment factory- Including a hoist to carry good for top floor - Facing to colombo- kurunagela main road- 8 km to katunayake airport- 5 km to Ja ela highway entrance- Even suitable for tuition classes, medical center, stores facilities and can be developed for residencies - Can be negotiated even for long term lease agreement too",Factory / Workshop,"11,000 sqft",
103,Commercial Property for Sale in Kelaniya,14 Jun  5:35 pm,"Kelaniya, Gampaha","55,000,000","This property consists of three sections which we can use for Business cum Residence. It’s facing Biyagama road and 500m from the Kelaniya Raja Maha Viharaya. Commercial Building Two storied building facing Biyagama road Total floor area is 2,200 sq.ft. (Ground & First floor – 1,800 sq.ft. & Roof top 400 sq.ft.) ",Building,"Biyagama Road, Kelaniya","4,700 sqft"
104,Shop for Sale in Ja Ela,30 Jun  9:41 am,"Ja-Ela, Gampaha","1,550,000",Shop for Sale in Ja Ela==================,Shop,"Orex City, Ja Ela",185 sqft
105,Commercial Building in Kadawatha,23 Jul  9:25 am,"Kadawatha, Gampaha","75,000,000","Commercial building situated at kirillawala , Kadawatha",Building,"Kandy Road, Kirillawala , Kadawatha","3,243 sqft"
106,Shops for Sale in Negombo-Rukaththana Junction,10 Jun  5:07 pm,"Negombo, Gampaha","57,500,000",30 Perches Land with shops for saleNear the minuwangoda main bus roadUrgent salecall for more information,Shop,"Rukaththana junction,Negombo","3,000 sqft"
107,Shop with House in Ragama,28 Jul 10:06 pm,"Ragama, Gampaha","11,000,000","❇️රාගම තේවත්ත ප්‍රධාන බස් මාර්ගයට මුහුනලා පොලිසියට ආසන්නව ඇති පර්චස් 4ක පමණ නවීන උඩුමහල් නිවස සහ පහත මාලයේ නවීන කඩකාමර 2 විකිණීමට  ඇත. (කඩකාමර සදහා වෙනම වැසිකිලි පහසුකම්)ලීසන්ස් රෝහලත්, කුරුස හංදියත් අතර ඇත.සියලු පහසුකම් සහිතය. පිරිසිදු ඔප්පු ඇත.දුම්රියපොළට 1Km යි. රාගම කොලඹ බස් නැවතුම්පොළට, රෝහලට කි.මී 1.3යි. (1.3Km)",Building,"1,600 sqft",
108,Commercial Building Sale in Ja-Ela,23 Jul  9:25 am,"Ja-Ela, Gampaha","30,000,000",Part of a Commercial building situated at Ja ela –Ekala	Suitable for any commercial purposes with almost 1600 sq ft ,Building,Ja ela - Ekala Junction,"1,500 sqft"
109,ණය පහසුකම් සහිත ව්‍යාපාරික ස්ථාන මරදගහමුල, 7 Jul  9:38 am,"Divulapitiya, Gampaha","1,400,000",මරදගහමුල නගරයේ සණස වෙළඳ සංකිර්ණය අංගසම්පූර්ණ ව්‍යාපාරික ස්ථානයක් ටයිල් කල පොළොව විදුලිය නල ජලය කඩිනමින් ණය පහසුකම් .,Building,සණස වෙළඳ සංකිර්ණය මරදගහමුල .,200 sqft
110,අංගසම්පූර්ණ ව්‍යාපාරික ස්ථානයක් - නාල්ල,10 Jul  2:39 pm,"Mirigama, Gampaha","4,000,000","විදුලිය, නල ජලය, ටයිල් කල පොළොව , සිවිලිම , නාන කාමරය  නිදන කාමර 1ක් පර් 06යි මුලුතැන්ගෙය. සහිත අංගසම්පූර්ණ ව්‍යාපාරික ස්ථානයක් .",Building,කොළඹ කුරුණෑගල මාර්ග අංක05  නාල්ල .,850 sqft
111,ණය පහසුකම් සහිත ව්‍යාපාරික ස්ථාන මරදගහමුල, 7 Jul  9:38 am,"Divulapitiya, Gampaha","1,400,000",මරදගහමුල නගරයේ සණස වෙළඳ සංකිර්ණය අංගසම්පූර්ණ ව්‍යාපාරික ස්ථානයක් ටයිල් කල පොළොව විදුලිය නල ජලය කඩිනමින් ණය පහසුකම් .,Building,සණස වෙළඳ සංකිර්ණය මරදගහමුල .,200 sqft
112,Sanasa Building - Badalgama, 6 Jun 11:34 am,"Gampaha, Gampaha","42,500,000",වරලත් ඉංජිනේරු වරුන්ගේ අධීක්ෂණය යටතේ ඉදිවු බඩල්ගම නගරයේ පිහිටි තෙමහල් ව්‍යාපාරික ගොඩනැගිල්ල වහාම විකිණිමටබිම්මහල කඩකාමර    04පළමු මහල     04දෙවන මහල වර්ල අඩි 800 පමණ විශාල ශාලාවattached wash room and water supplyවිකුණුම් මිල - හාරකෝටි විසිපන් ලක්ෂයි,Building,negombo road badalgama,"2,000 sqft"
113,Warehouse for Sale - Wattala, 5 Jun 11:13 am,"Wattala, Gampaha","675,000",*to migamu main road 4km*to colombo port 7km*ඔබට අවශ්‍ය warehouse කුලියට ඇත.වර්ග අඩි 30000/45000/50000 ඇත*වර්ග අඩියක මිල - 45 (මසකට  675000)*we don't need brokes,Warehouse / Storage,"Uswatakeyiava,wattala","25,000 sqft"
