,0,1,2,3,4,5,6,7
0,title,posted date,location,price,description,Property type:,Address:,Size:
1,අංගසම්පූර්ණ ව්‍යාපාරික ස්ථානයක් - නාල්ල,10 Jul  2:39 pm,"Mirigama, Gampaha","4,000,000","විදුලිය, නල ජලය, ටයිල් කල පොළොව , සිවිලිම , නාන කාමරය  නිදන කාමර 1ක් පර් 06යි මුලුතැන්ගෙය. සහිත අංගසම්පූර්ණ ව්‍යාපාරික ස්ථානයක් .",Building,කොළඹ කුරුණෑගල මාර්ග අංක05  නාල්ල .,850 sqft
2,"['අංගසම්පූර්ණ ව්\u200dයාපාරික ස්ථානයක් - නාල්ල', '10 Jul  2:39 pm', 'Mirigama, Gampaha', '4,000,000', 'විදුලිය, නල ජලය, ටයිල් කල පොළොව , සිවිලිම , නාන කාමරය  නිදන කාමර 1ක් පර් 06යි මුලුතැන්ගෙය. සහිත අංගසම්පූර්ණ ව්\u200dයාපාරික ස්ථානයක් .', 'Building', 'කොළඹ කුරුණෑගල මාර්ග අංක05  නාල්ල .', '850 sqft']","['title', 'posted date', 'location', 'price', 'description', 'Property type:', 'Address:', 'Size:']",,,,,,
3,Negombo Beach Hotel for Sale / 8 Br,24 Jul  9:26 am,"Negombo, Gampaha","45,000,000",# FACING NEGOMBO BEACH ROAD# SEA VIEW HOTEL# 8 BED ROOMS AND ATTACHED BATH ROOMS# RESTAURANT # SWIMMING POOL# GOOD INCOME BUSINESS# SERIOUS BUYERS ONLY - NO MIDDLE MAN****# AFFILIATED TO FERNANDO HOMES # INSPECTION ON PRIOR APPROVALS,Hotel,Negombo Beach Road,"4,250 sqft"
4,Hotel for Sale in Mirigama,29 Jul  4:13 pm,"Mirigama, Gampaha","21,000,000",10 Rooms with attached Bathroomsමීරිගම නගර සීමාවේඅධිවේගි මාර්ග පිවිසුමට ඉතාමත් ආසන්නයිපර්. 30,Hotel,"3,000 sqft",
5,Hotel for Sale / Negombo Beach,29 Jul  3:34 pm,"Negombo, Gampaha","220,000,000",# 40 Perches Land (Extended Possible More 20 Perches)# 20 Rooms & Attached Bath Rooms# Swimming Pool# Restaurant# Well Running Hotel# Serious Buyers Welcome (No Middle Man***)# Clear Documents# Inspection Only On Prior Approvals,Hotel,NEGOMBO BEACH ROAD,"25,000 sqft"
6,Vehicle Service Station for Sale in Negombo,21 Jul  4:45 pm,"Negombo, Gampaha","32,000,000",Well-equipped Vehicle Service Centre for Sale situated in a prime location (Colombo Negombo Main Road)  within Negombo city limits.,Building,Negombo,"8,000 sqft"
7,Factory Building for Sale in Delgoda,21 Jul  8:08 pm,"Delgoda, Gampaha","35,000,000","Good for any Factories, Stores,Reception Hall,International School,Hotel etc.location: nice view, facing  to Paddy field, Close to Biyagama EPZ.",Factory / Workshop,"9,000 sqft",
8,Hotel for Sale - Negombo,27 Jul  5:05 pm,"Negombo, Gampaha","26,500,000","05 rooms, ac/tv/hot water /attach bathroom, 90 perch land, full cover by lage wall, so many coconut and large trees, guest house license, very carm and quite area, good neabourhood and good in come, running business, 7km to airport, can exchange with vehicle, owner going to maigret.",Hotel,"katana road, negombo","5,500 sqft"
9,Shop For Sale In Yakkala Town,27 Jul 11:43 am,"Gampaha, Gampaha","2,500,000",☑️ යක්කල හංදිය ☑️ සණස සාප්පු සංකීර්ණයේ අංග සම්පුර්ණ කඩ කාමරය ඉක්මනින් විකිණීමට☑️ වර්ග අඩි 200☑️ විදුලිය ☑️ නල ජලය ☑️Roller Door☑️Glass Door & Front,Shop,"Kandy Rolad, Yakkala",200 sqft
10,Commercial Building for Sale - Kandana,26 Jul  2:27 pm,"Ja-Ela, Gampaha","7,500,000",This building is located in Rilaulla 400 m to Kadhana main rd6.1 perchTwo story commercial building,Building,"Kandana,Rilaulla","1,500 sqft"
11,Commercial Property for Sale at Wattala,25 Jul  5:30 pm,"Wattala, Gampaha","200,000,000",WATHTALA  ( MABOLA / COLOMBO NEGOMBO MAIN ROAD FRONT  COMMERCIAL PROPERTY AVAILABL  FOR SALE / 87 PERCHES LAND  / 8 BEDROOM  FULLY TILLED LUXURY HOUSE / 45 PERCHES BARE LAND / 40 FEET CONTAINER EXES AVAILABLE / IDEAL FOR ANY COMMERCIAL PURPOSE / EXPECTING ONLY LAND VALUE / NO FLOOD THREATS AND VISITS CAN BE RRANGED ON APPOINMENTS ONLY FOR APPOINMENT PLEASE CALL - ( PRICE PER PERCH  2.3 MILLION  ( 23 LKS.),Warehouse / Storage,"Colombo Negombo main Road , Mabola , Wattala","5,000 sqft"
12,Broiler Farm for Sale - Badalgama,25 Jul  4:27 pm,"Divulapitiya, Gampaha","100,000,000","* Land	- 10 acres * Capacity - 55,000 Birds. On going farm Profit over 6-7 million each one batch* Two new closed House are completed with European equipment. Third house is under construction.* EPL with All Government Approvals are there* At  Badalgama.  20 Km  to  Airport  and Negombo.* Container access Road.* 3500 sqft Two story new House.",Building,"Badalgama, Katana","45,000 sqft"
13,Warehouse for Sale at Kotugoda Ja-Ela,25 Jul  4:07 pm,"Ja-Ela, Gampaha","60,000,000",Warehouse for sale at kotugoda Ja-ela40 feet container accessAmple Parking and office space530k monthly incomeWashroom available,Warehouse / Storage,"kotugoda, Ja-Ela","16,000 sqft"
14,Shop for Sale in Yakkala,24 Jul  2:46 pm,"Gampaha, Gampaha","3,450,000",යක්කල සණස සාප්පු සංකිර්ණයේ දෙවනි මහලේ 100 කඩය,Shop,200 sqft,
15,Building for Sale in Kiribathgoda area,24 Jul  3:40 pm,"Kiribathgoda, Gampaha","55,000,000",කිරිබත්ගොඩ නගරයට ආසන්නව පිහිටි මහල් හතරකින් යුත් ව්‍යාපාරික ගොඩනැගිල්ලක් විකිණීමට ඇත.වර්ග අඩි 2000 බැගින් මහල් හතරයි.පර්. 7.9 යි.,Building,"130, Kandy road, Mahara, Kiribathgoda.","8,000 sqft"
16,Shop for Sale - Ibulgoda,24 Jul 12:08 pm,"Kadawatha, Gampaha","3,800,000",කොලබ නුවර ප්‍රධාන පාරේ.ට්‍රක්මෝ හන්දියෙන් හැරී. මීටර් 800 දුරින් ඇති.හතරමන් හන්දියේ පිහිට.ට්‍රක්මෝ පාරට (333 ගම්පහ ගනේමුල්ල බස් පාර) මුහුනලා ඇති කඩ කාම්මර දෙක විකිනිමට.,Shop,"ihala yagoda, ibulgoda",380 sqft
17,Commercial Building for Sale - Nittabuwa,24 Jul 10:23 am,"Nittambuwa, Gampaha","40,000,000","Brand new commercial building for sale in nittabuwa town6.3 perchers, 4800 sqft4 stories commercial buildingFrom kandy, colambo main roadWater,electricity, parking availableImmediately salePrice can be negotiable",Building,NITTABUWA,"4,800 sqft"
18,Negombo Beach Restaurant and Hotel for Sale / 8 Br,22 Jul  7:26 pm,"Negombo, Gampaha","45,000,000",# FACING NEGOMBO BEACH ROAD# SEA VIEW HOTEL# 8 BED ROOMS AND ATTACHED BATH ROOMS# RESTAURANT# SWIMMING POOL# GOOD INCOME BUSINESS# SERIOUS BUYERS ONLY - NO MIDDLE MAN****# AFFILIATED TO FERNANDO HOMES# INSPECTION ON PRIOR APPROVALS,Hotel,NEGOMBO BEACH TOURISTS AREA,"4,250 sqft"
19,Negombo Beach Restaurant and Hotel for Sale / 8 BR,22 Jul  7:26 pm,"Negombo, Gampaha","45,000,000",# FACING NEGOMBO BEACH ROAD# SEA VIEW HOTEL# 8 BED ROOMS AND ATTACHED BATH ROOMS# RESTAURANT# SWIMMING POOL# GOOD INCOME BUSINESS# SERIOUS BUYERS ONLY - NO MIDDLE MAN****# AFFILIATED TO FERNANDO HOMES# INSPECTION ON PRIOR APPROVALS,Hotel,NEGOMBO BEACH TOURISTS AREA,"4,250 sqft"
20,Boutique Hotel for Sale - Negombo,21 Jul 10:14 pm,"Negombo, Gampaha","35,000,000",Call For More DetailsSerious Buyers Welcome,Hotel,Negombo,"5,000 sqft"
21,Factory /Storage In Gampaha,21 Jul  5:32 pm,"Gampaha, Gampaha","6,500,000","Land and building/ large Tent fully covered by wall facing to Ja-Ela - Gampaha Road.(15 Purchase).1700 Square Feet Building for factory Storage.Open space suitable for vehicle parking or open storage.600 Square feet house with 2 rooms ,Living room,Kitchen and toilet.Ideal for Factory, Work shop, Yard, Storage Space, Garage, Service Station,Hard Ware, Distribution Agency or any commercial work.3 Phase Industrial  Electricity. (I1) available.Well Water.",Factory / Workshop,Makavita,"1,700 sqft"
22,Commercial Property for Sale in Gampaha,23 Jul 10:06 am,"Gampaha, Gampaha","12,000,000","Warehouse for Sale in Oruthota road, Gampaha. Built on 12.5 Perches Land area and 3,290 Sq.Ft floor area. A fairly new light industrial/warehouse unit available with on site parking, wide loading bay. The property comprises of detached storage facility, office accommodation, separate washrooms etc.",Building,Oruthota road,"3,290 sqft"
23,3 Storey Commercial Property for Sale in Kadawatha.,19 Jul 11:43 pm,"Kadawatha, Gampaha","95,000,000","3 Storey Commercial  Building For Sale in Kadawatha.Heart of Kadawatha. 10,000 Sq.ft.",Building,Kadawatha,"10,000 sqft"
24,Warehouse for Sale at Wattala,25 Jul  5:03 pm,"Wattala, Gampaha","120,000,000",WATTALA EDERAMULLA 12000 SQUARE FEET WAREHOUSE FOR IMMEDIATELY SALE. 85 PERCH LAND3KM TO COLOMBO NEGOMBO MAIN ROAD40 FEET CONTAINER ACCESS WITH AMPLE PARKINGSMALL OFFICE SPACE WITH TOILET FACILITIES AVAILABLE CLEAR PAPERS,Warehouse / Storage,"Enderamulla, wattala","12,000 sqft"
25,Commercial Property | for Sale Uswetakeiyawa - C0573-D,19 Jul  7:48 pm,"Wattala, Gampaha","120,000,000",Commercial Property for Sale in Uswetakeiyawa.,Hotel,"6,000 sqft",
26,Hotel for Sale - Divulapitiya,19 Jul 10:26 pm,"Divulapitiya, Gampaha","19,000,000",ව්‍යාපාරික  ස්ථානයකි දිවුලපිටිය නගරයට ආසන්න බල්ලපාන හන්දිය ප්‍රධාන පාරට මුහුණලා පිහිටා  ඇත. නාන කාමර සමග කාමර 5කුස්සී  - 1වට තාප්ප  හා වාහන පාර්ක්  සහිතසියලුම ගෘහ උපකරණ සහිතව මසකට රුපියල් 100000 වඩා ආදායමක් උපයාගත හැකි දැනට පවත්වාගෙන යන වසර 15කට වඩා පැරණි ව්‍යාපාරික  ස්ථානයකි.සියල්ල නරවුල්ව මෙන්ම ව්‍යාපාරික  ස්ථානය  ලියාපදිංචි කර ඇත.,Hotel,"Geeen Place, KURUNEGALA RD ,BALLAPANA ,DIVLAPITIYA","1,950 sqft"
27,Negombo Beach Hotel for Sale / 8 Br,24 Jul  9:26 am,"Negombo, Gampaha","45,000,000",# FACING NEGOMBO BEACH ROAD# SEA VIEW HOTEL# 8 BED ROOMS AND ATTACHED BATH ROOMS# RESTAURANT # SWIMMING POOL# GOOD INCOME BUSINESS# SERIOUS BUYERS ONLY - NO MIDDLE MAN****# AFFILIATED TO FERNANDO HOMES # INSPECTION ON PRIOR APPROVALS,Hotel,Negombo Beach Road,"4,250 sqft"
28,ව්‍යාපාරික ස්ථානයක් - කොටදෙණියාව,18 Jul  2:08 pm,"Divulapitiya, Gampaha","7,500,000",කොළඹ කුරුණෑගල මාර්ග අංක05 ප්‍රධාන මාර්ගයට මුහුණලා ප්‍රසිද්ධ ඇගලුම් කර්මාන්ත ශාලාවක් (smart shart ) පර්චස් 30 සහිත නිරවුල් ඔප්පු සහිත  භාවිතයට ගත හැකි නිවසක් ද විදුලිය ජලය සහිතයි . පර්චසයකට ඉහළ තක්සේරු වටිනාකමක් සහිතයි .,Other,මාර්ග අංක05 කොටදෙණියාව.,"1,500 sqft"
29,Negombo Beach Hotel for Sale / 8 Br,24 Jul  9:26 am,"Negombo, Gampaha","45,000,000",# FACING NEGOMBO BEACH ROAD# SEA VIEW HOTEL# 8 BED ROOMS AND ATTACHED BATH ROOMS# RESTAURANT # SWIMMING POOL# GOOD INCOME BUSINESS# SERIOUS BUYERS ONLY - NO MIDDLE MAN****# AFFILIATED TO FERNANDO HOMES # INSPECTION ON PRIOR APPROVALS,Hotel,Negombo Beach Road,"4,250 sqft"
30,ණය පහසුකම් සහිත ව්‍යාපාරික ස්ථාන මරදගහමුල, 7 Jul  9:38 am,"Divulapitiya, Gampaha","1,400,000",මරදගහමුල නගරයේ සණස වෙළඳ සංකිර්ණය අංගසම්පූර්ණ ව්‍යාපාරික ස්ථානයක් ටයිල් කල පොළොව විදුලිය නල ජලය කඩිනමින් ණය පහසුකම් .,Building,සණස වෙළඳ සංකිර්ණය මරදගහමුල .,200 sqft
31,Commercial Property for Sale - Ragama,18 Jul  2:00 pm,"Ragama, Gampaha","75,000,000","Kadawatha Ragama main road facing50m meters to ragama junction and 20m to commercial, sampath BankIdeal business place for Restaurant, super market,show room or any others.",Restaurant,Kadawatha Road Ragama,"8,000 sqft"
32,Commercial building for sale in Kelaniya,17 Jul  4:36 pm,"Kelaniya, Gampaha","65,000,000","- 12,000 sqft- 20 perches- Price Rs. 65 million",Office,"12,000 sqft",
33,Building( Apartment.) for sale In Kiribathgoda viharamahadevi main road,27 Jul  9:36 am,"Kiribathgoda, Gampaha","31,000,000",4story building for Sale in Kiribathgoda. ,Building,kiribathgoda (01) housing scheme Road,"3,200 sqft"
34,Building with Land for Sale in Mirigama,16 Jul  2:03 pm,"Mirigama, Gampaha","7,000,000",කොළඹ කුරුණෑගල (අංක 5 බස් පාර) ප්‍රධාන මාර්ගට මුහුණලා ඇති ව්‍යාපාරික ගොඩනැගිල්ල.,Shop,"Nalla,Diuldeniya. (colombo - kurunegala rd)","1,580 sqft"
35,අගනා ව්‍යාපාරික ස්ථානයක් ( 1/4) කල්එලිය,16 Jul  9:07 am,"Mirigama, Gampaha","3,000,000","මිරිගම කල්එලිය පල්ලේවෙල මාර්ගයට මුහුණලා අංගසම්පූර්ණ ව්‍යාපාරික ගොඩනැගිල්ලේ තනි කඩ කාමරයක්, විදුලිය,  නල ජලය . ටයිල් කල පොළොව , පල්ලේවෙල දුම්රියපොළට 2km , 221 මාර්ගයට 1KM, මිරිගම නගරයට  අධිවේගී පිවිසීමට 6KM,  ඉහළ  මහල් 2ක් දක්වා ඉදිකිරීමට හැකිය",Building,"මැදගම්පිටිය පාර, කල්එලිය .",425 sqft
36,Commercial Property for Sale in Kochchikade,23 Jul 10:06 am,"Negombo, Gampaha","39,500,000","Commercial Building With 55 Perches Land For Sale in Kochchikade. Ideal for Hotel, Reception Hall, Apartment/ Housing Complex, Warehouse, Factory, Yard or any other commercial purpose.",Building,Negombo,"8,000 sqft"
37,Hostel Building For Sale - Kelaniya University,15 Jul  2:23 pm,"Kelaniya, Gampaha","70,000,000",Building for Sale in Kiribathgoda======================,Building,"123/1 Mahawatta Road,Wewalduwa Kelaniya.","1,000 sqft"
38,Commercial Building for sale Kelaniya,15 Jul  1:46 pm,"Kelaniya, Gampaha","9,800,000","3story commercial property for sale 300km to 4 kanuwa juntion 2km to kelaniya temple500m to highway entrance close to peliyagoda ,kelaniya,biyagama,dalugama300m to kandy road400m to kelaniya station",Building,"NO 146.Biyagama Road,Pattiya ,Kelaniya",600 sqft
39,Warehouse for Sale at Biyagama,15 Jul  1:32 pm,"Delgoda, Gampaha","85,000,000",Easy Access to Colombo new Kandy Main Road.01km to Delgoda and Biyagama Zone.Three Phase Electricity Commercial water supply Facility with telephone lines15 feet Road aside of the building03 No of Air conditioned partitioned office blocks in the warehouse,Warehouse / Storage,"835/10 Siyambalape waththa, Delgoda.","6,500 sqft"
40,Office Building for Sale at Biyagama,15 Jul  1:24 pm,"Delgoda, Gampaha","120,000,000",Easy Access to Colombo New Kandy Main Road around 01km to Delgoda and Biyagama Zone.Three Phase electricity  Commercial water supply facility with land telephone lines.Parking Facility  available for 15 No of VehiclesAir conditioned wood partitioned office blocks.,Office,"687/1 Yatihena, New Kandy Rd, Waduwegama 11700","3,500 sqft"
41,Commercial Property for Sale in Radawana Junction,23 Jul 10:06 am,"Gampaha, Gampaha","18,500,000","Commercial Cum Residential Property for Sale in  Radawana Town, Kirindiwela, facing to Kirindiwela – Weliveriya main road. Close to Kirindiwela, Weliveriya cities. Parking facilities available in front of the premises. Aproximately 1,800 Sq.ft total area. Floor area consist 1 Master Bedroom with an Attached Bathroom, Dining Area, Study Area, Kitchen, 3 spaces suits for commercial purposes. Able to reach this property from 225, 202, 231 Bus routes",Building,Radawana Junction,"1,750 sqft"
42,Two Storied Building for Sale in Welisara,14 Jul 10:07 pm,"Kandana, Gampaha","16,000,000",Two storied Building for Sale in Welisara,Building,Welisara,"2,800 sqft"
43,Commercial building for sale Negombo,13 Jul  4:13 pm,"Negombo, Gampaha","276,000,000",Air conditioning65 Kv GeneratorComplete Ground Floor office with the Furniture18 CCTV unitsElectric Auto sensor gatesLighting protecting system and Air craft lighting systemSolar Hot water systemsSingle face & Three face Electricity supply24/7 Council water supplyMini barParking for 25 vehicles42 perches12000 square feet20 ft access roadResidential area5km from the airport ,Building,Negombo Road,"12,000 sqft"
44,Brand new Hotel for sale in Seeduwa Katunayake,23 Jul 10:06 am,"Katunayake, Gampaha","83,500,000","Brand new Hotel for sale in Seeduwa, Katunayake. The property is located at Dharshana Mawatha, Liyanagemulla, just 150 meters from Colombo – Negombo Road.  Only 800 meters to Colombo-Katunayake expressway interchange and 3 Km distance to Bandaranaike International Airport.  There are many tourist hotels around the property and also the area is highly recognized for commercial purposes as well. Built on 13.5 Perches Land, approx. 11,200 Sq.Ft. including spacious 5 storied building with 15 air conditioned Deluxe type  bedrooms (9 family rooms & 6 double rooms) with en-suite modern fitted bathrooms (all bathrooms with hot water & 4 bathrooms with bathtubs), Stores, Staff room, Office room, Rooftop restaurant, Buffet area, Kitchen,  Solar hot water, CCTV, TV Cable, Telephone Cable, Electric door locks, Vehicle park ( 6 cars ), 7 Lobby toilets.",Hotel,Seeduwa,"11,200 sqft"
45,Commercial Building in Gampaha Town,18 Jul  2:17 pm,"Gampaha, Gampaha","35,000,000",For sale three story building in Gampaha town (Baudhaloka Mawatha)1500sqft each floor Three phase elecityClear deeds and available all documents Tempted galas and cladin finishing Fully tile floor with two washroomSeparate entrance for top floorHighly commercial area in Gampha townPrice only negotiate after inspection. Highest offer accepted,Building,"1,500 sqft",
46,Beauty Salon For Sale In Kelaniya,17 Jul  4:27 pm,"Kelaniya, Gampaha","700,000",Well equipped beautifully laid out Unisex Salon situated in a good locality in Kelaniya is available for immediate  sale.  Owner going overseas. Contact ....,Other,"784, new candy road, wedamulla, kelaniya.",900 sqft
47,Villa | for Sale Mirigama - C0686-C,11 Jul  9:22 pm,"Mirigama, Gampaha","22,000,000",70 perch land with Villa (facing Maoya) for sale in Mirigama,Hotel,"5,000 sqft",
48,මීරිගම නගර මධයේ තෙමහල් ගොඩනැගිල්ල විකිනීමට,23 Jul  1:16 pm,"Mirigama, Gampaha","18,000,000",Call For More Details....,Building,"නො. 74, කෙලින් වීදිය, මීරිගම.","2,250 sqft"
49,Hostel for Sale - Muthuwadiya,11 Jul  7:56 pm,"Katunayake, Gampaha","21,000,000",This property is located in Muthuwadiya50 m to Kotugoda rdproperty around wallsecurity roomrest roomTV room 4 separate bath roomcommon kitchen parking area,Other,"Kotugoda,Muthuwadiya","8,000 sqft"
50,"Commercial Building for Sale in Bogamuwa, Yakkala.",23 Jul 10:06 am,"Gampaha, Gampaha","22,000,000","3 Storied Commercial Building with 26 Perches Land for Sale in Bogamuwa, Yakkala.This building is situated in a highly commercialized area facing to Kandy Road.",Building,"Kandy Road, Bogamuwa, Yakkala","5,850 sqft"
51,අංගසම්පූර්ණ ව්‍යාපාරික ස්ථානයක් - නාල්ල,10 Jul  2:39 pm,"Mirigama, Gampaha","4,000,000","විදුලිය, නල ජලය, ටයිල් කල පොළොව , සිවිලිම , නාන කාමරය  නිදන කාමර 1ක් පර් 06යි මුලුතැන්ගෙය. සහිත අංගසම්පූර්ණ ව්‍යාපාරික ස්ථානයක් .",Building,කොළඹ කුරුණෑගල මාර්ග අංක05  නාල්ල .,850 sqft
52,Poulltry farm for Sale in Divulapitiya,10 Jul  3:30 pm,"Divulapitiya, Gampaha","29,500,000",සියලුම ලියකියවිලි බලපත්‍ර අන්ග සම්පුර්න කුකුලු ගොවිපල වර්ග අඩ් 2400 කින් යුත් කුකුල් කොටු 6 ක්සහ වර්ග අඩ් 3250 කින් යුත් කොටු 3 ක් සහිත නල ලින් අඩි 220 2මාඔය මායිම්ව් ආහාර බාජන වතුර ඉටාලි ඔටො බාජන පර්චස් 640 කින් සමන්විත ගොවිපල විකිනීමට (බ්ත්තර කිකිලියන් සදහාද සුදසුයි),Other,"24,000 sqft",
53,"Restaurant for Sale in Kandy main rd, kelaniya,",27 Jul  9:35 am,"Kelaniya, Gampaha","100,000,000","5655 sqft Restaurant for sale in face Colombo, kandy Rd. kelaniya, 4 kanuwa. ",Restaurant,"Colombo, Kandy main rd, kelaniya, 4 kanuwa.","5,655 sqft"
54,Property for Sale in Ekala, 9 Jul  2:34 pm,"Ja-Ela, Gampaha","1,350,000","Situated in 4th floorFully titled and  attached bathroom24hrs security and CCTVClose to Jaela highway entrance, katunayake Airport/FTZClose to the Lift and open waiting areaParking facilitiesIdeal for an office or a class room",Office,Ekala,210 sqft
55,Commercial Property for Sale - Kadawatha,15 Jul  2:09 pm,"Kadawatha, Gampaha","2,000,000",Commercial Property for sale,Building,816 sqft,
56,Negombo Beach Hotel for Sale / 8 Br,24 Jul  9:26 am,"Negombo, Gampaha","45,000,000",# FACING NEGOMBO BEACH ROAD# SEA VIEW HOTEL# 8 BED ROOMS AND ATTACHED BATH ROOMS# RESTAURANT # SWIMMING POOL# GOOD INCOME BUSINESS# SERIOUS BUYERS ONLY - NO MIDDLE MAN****# AFFILIATED TO FERNANDO HOMES # INSPECTION ON PRIOR APPROVALS,Hotel,Negombo Beach Road,"4,250 sqft"
57,අංගසම්පූර්ණ ව්‍යාපාරික ස්ථානයක් - නාල්ල,10 Jul  2:39 pm,"Mirigama, Gampaha","4,000,000","විදුලිය, නල ජලය, ටයිල් කල පොළොව , සිවිලිම , නාන කාමරය  නිදන කාමර 1ක් පර් 06යි මුලුතැන්ගෙය. සහිත අංගසම්පූර්ණ ව්‍යාපාරික ස්ථානයක් .",Building,කොළඹ කුරුණෑගල මාර්ග අංක05  නාල්ල .,850 sqft
58,Kadawatha Resort with 3 Villas | For Sale - CC535-A, 8 Jul 11:36 am,"Kadawatha, Gampaha","90,000,000",SMALL RESORT WITH 3 VILLAS,Hotel,"8,000 sqft",
59,Sale for shop in Yakkala, 9 Jul  8:04 pm,"Gampaha, Gampaha","1,625,000",සණස ගොඩනැගිල්ලෙහි තෙවන  මහාලේ කඩ කමරයනුවර පාරට මුහුනලා ඉක්මනින් විකිනිමට,Shop,200 sqft,
60,Hostel for Sale in Katunayake, 7 Jul 10:30 am,"Katunayake, Gampaha","20,000,000","Hostel for sale in Katunayake.Built Before 2 years,05 meters to  Katunayake - Raddoluwa main road,5 minutes to Katunayake International Airport & Free trading zone.5 minutes to Katunayake Highway Entrance.>> 10 Bedrooms & 4Bathrooms,>> Security room,>> TV Room & Rest room,>> Large Gate & 7 Feets Parapet wall,>> Large parking area,Monthly income 70,000/- per month & Increase every YearsNow Property rent - BOI Company Contact basisCall for details.",Building,"No.212, Muthuwadiya,Raddolugama","4,000 sqft"
61,Commercial Property for Sale in Minuwangoda,13 Jul  3:43 pm,"Minuwangoda, Gampaha","18,000,000",■ අළුතින් ම නිමකල ගොඩනැගිල්ල හදිසියේම විදේශගත වීමේ තීරණයක් නිසා විකිනේ. ,Building,"5,093 sqft",
62,Shop for Sale in Kirindiwela,10 Jul 11:27 am,"Gampaha, Gampaha","6,000,000","කිරිඳිවැල නගරයේ රජවීදිය පාරට මුහුනලා අලුතෙන් සාදන ලද කඩ කාමරයක් විකිනීමට ඇත. පර්චස් දෙකක ඉඩමෙහි තනි තට්ටුවට සාදා ඇති අතර ඉහල මහල් දෙකක් සෑදීමට ඉඩ ඇත.ආපන ශාලාවක්,පොත් හලක් හෝ වෙනත් ඕනෑම ව්‍යාපාරයකට සුදුසු වේ.රු. 60,00000/=අවසාන වටිනාකම සඳහා සාකච්ඡා කළ හැක.Shop premises  for sale in Kirindiwela. Facing to  Rajaveediya in Kirinidiwela city center.  Highly business area. Ideal for a small hotel, communication center, book shop or  other business. The ground floor completed and another two floors can build.  2 perches land.Rs.6 million",Building,"Rajaveediya, Kirindiwela",500 sqft
