,0,1,2,3,4,5,6,7,8,9
0,title,posted date,location,price,description,Address:,Beds:,Baths:,House size:,Land size:
1,House For Rent In Nawala,17 Jul 12:46 pm,"Nawala, Colombo","260,000",6 rooms with attached bathroomsDouble garage with remote controlled doorGardenHot water Almost brand new houseWalking distance to Gateway CollegeSuitable for both residence and office,"15/38,3rd Lane,koswatta,Nawala.",6,7,"3,200.0 sqft",14.0 perches
2,"['House For Rent In Nawala', '17 Jul 12:46 pm', 'Nawala, Colombo', '260,000', '6 rooms with attached bathroomsDouble garage with remote controlled doorGardenHot water Almost brand new houseWalking distance to Gateway CollegeSuitable for both residence and office', '15/38,3rd Lane,koswatta,Nawala.', '6', '7', '3,200.0 sqft', '14.0 perches']","['title', 'posted date', 'location', 'price', 'description', 'Address:', 'Beds:', 'Baths:', 'House size:', 'Land size:']",,,,,,,,
3,House For Rent In Rajagiriya,13 Jul 10:46 am,"Nawala, Colombo","380,000","11Rooms (6 AC rooms).5 bathrooms.1 servant bathroom.4 Floors (with roof top).Seperate entrance for each floors).25 feet road.2 garage (5 vehicle parking).75m to Nawala Koswatta town.1/2 km to Rajagiriya,1km to Nawala.176 bus root.Walking distance to Gateway collage.Better for office or company.","No:33,De Melwatha Rd,Nawala,Rajagiriya.",10+,5,"14,000.0 sqft",20.0 perches
4,Up Unit House In Nawala,19 Jul  2:19 pm,"Nawala, Colombo","50,000",🔴REF NO-- JL694,Nawala   Gateway rd,3,2,"1,600.0 sqft",15.0 perches
5,Fully Luxury House for Rent - Nawala,18 Jul  4:19 pm,"Nawala, Colombo","275,000",Brand new house with garden and double garage fully luxury house ( 275000) 6month advance,Nawala koswatta,6,6,"4,500.0 sqft",12.0 perches
6,Luxury House For Rent In Nawala,17 Jul 11:04 pm,"Nawala, Colombo","230,000","3800sqft three story house is for rent in school Avenue ,Nawala for immediate occupancy.House is facing the beautiful green belt in Nawala. Rare opportunity! built in one and half year ago.almost brand new- 4 A/C bedrooms- 3 bathrooms- spacious living room- modern pantry - solar hot water - jacuzzi - CCTV- parking for two with remote gate - Maids room/toilet- spacious roof top with a breathtaking view of greenery - residential area -unfurnished",4,3,"3,800.0 sqft",9.0 perches,
7,Upstair unit for Rent Nawala,17 Jul  8:24 pm,"Nawala, Colombo","55,000","Upstair unit for Rent @ Nawala______________________________________Vacant Position / Red cement flooring / 950 sq, ft   2 Beds with common Bath (with hot water)Living / Dining / Pantry with store spaceSeparate Entrance / Electricity & Water supplyAll rooms having ceiling fansParking space for 1 vehicles300m to Nawala Main road (koswatta junk)_______________________________________55000 - Per Month (Negotiable)6 months Rental advance________________________________________________________________________Registered Lease with Stamp & Lawyer's fees shared equallyfurther broker fee which includes 1Month rent wll be shared equally for both parties _____________________________________________________________More photos - www.kpproperty.lk",Near Koswattha city limit,2,1,950.0 sqft,9.0 perches
8,House For Rent In Nawala,17 Jul 12:46 pm,"Nawala, Colombo","260,000",6 rooms with attached bathroomsDouble garage with remote controlled doorGardenHot water Almost brand new houseWalking distance to Gateway CollegeSuitable for both residence and office,"15/38,3rd Lane,koswatta,Nawala.",6,7,"3,200.0 sqft",14.0 perches
9,House For Rent In Nawala,15 Jul  3:13 pm,"Nawala, Colombo","90,000","25 Meters to Nawala – Rajagiriya main Road (Private Lane - 20 feet wide road)150 Meters to Nawala JunctionFully Furnished and equipped house ( 2500 Sqft) walls all round3 Bed Rooms (2 A/C Rooms) 2 Wash Rooms with Hot waterLarge Setting and Dining rooms and large Kitchen 1 Servants room separate Toilet Under ground covered parking for one vehicle with 2 more parking facilitiesCrossroads, Chops sticks, Steam Boat restaurants and Cargils Food City walking distance.  Maga Office  complex, Keels Super, Health Guard Pharmacy, Dispensary,  Hospitals, Post Office, Wet Land Park & Jogging track within 5 minutes drive.",3,2,"2,000.0 sqft",11.0 perches,
10,"House For rent at Nawala, Koswatta",15 Jul  9:43 am,"Nawala, Colombo","40,000","Nawala Koswatta 2 Rooms 1 Bathroom Pantry, Lobby, Parking 40000/= with Furniture 55000/=CCTV Security 1st Floor. 3 Rooms, 2 Bathrooms, Lobby, Pantry, Bar 2000sqft.3rd Floor, Parking CCTV 65000/= ( With furniture 80000/=)06 months Advance.",2,1,"2,000.0 sqft",12.0 perches,
11,House For Rent at Nawala,15 Jul  7:17 am,"Nawala, Colombo","125,000",Nawala Goswatta 11 perchs 5 bedrooms house 125000.00,Nawala Goswatta,5,4,"3,000.0 sqft",10.0 perches
12,2 Storied House in (with/without Semi Furnitur) - Nawala,13 Jul 12:06 pm,"Nawala, Colombo","75,000",🔴REF NO--JL697,3,2,"1,700.0 sqft",8.0 perches,
13,House For Rent - Nawala,12 Jul  1:13 pm,"Nawala, Colombo","200,000",Nawala 5 bedrooms fully luxury house granite floor 2 parking office or residence 200000.00,Nawala,5,3,"2,500.0 sqft",10.0 perches
14,House for rent in Nawala,12 Jul 12:36 pm,"Nawala, Colombo","70,000","House for rent in Nawala, spacious upstairs unit. Avoid the hassle of traffic, 5 min to Colombo.Includes 3 bedrooms, Sitting & Dining areas, Panty with modern amenities, 2 Bathrooms, Balcony and Servant Room & bathroom. Parking for 2 Vehicle. Expecting Rs.70,000/= Negotiable Contact:","2nd Lane, Senanayake Mawatha",3,2,"1,500.0 sqft",15.0 perches
15,House For Rent - Nawala,12 Jul 10:32 am,"Nawala, Colombo","150,000",House For Rent @ Nawala Monthly Rental 150000.00 Parking available,Nugegoda,3,2,"2,500.0 sqft",8.0 perches
16,House For Rent In Rajagiriya,13 Jul 10:46 am,"Nawala, Colombo","380,000","11Rooms (6 AC rooms).5 bathrooms.1 servant bathroom.4 Floors (with roof top).Seperate entrance for each floors).25 feet road.2 garage (5 vehicle parking).75m to Nawala Koswatta town.1/2 km to Rajagiriya,1km to Nawala.176 bus root.Walking distance to Gateway collage.Better for office or company.","No:33,De Melwatha Rd,Nawala,Rajagiriya.",10+,5,"14,000.0 sqft",20.0 perches
17,Nawala Upstair House For Rent,12 Jul  6:28 am,"Nawala, Colombo","50,000","Nawala close to Gateway college upstair unite for rent3 bedroom Fully tiledGarageSeparate electricity n water metersRent  Rs 50,000/- pmDeductabal Rs 10,000/-pmPay Rs 40,000/-pmKey money Rs 300,000/-",3,2,"1,200.0 sqft",10.0 perches,
18,Single Storied House In Nawala,12 Jul  1:35 am,"Nawala, Colombo","65,000",🔴REF NO --JL696,Nawala  Old rd,4,3,"2,500.0 sqft",20.0 perches
19,Up Unit House In Nawala,12 Jul 12:48 am,"Nawala, Colombo","50,000",🔴REF NO-- JI693,Nawala    Gamunu Mw,3,1,"1,600.0 sqft",15.0 perches
20,5BR House for Rent in Nawala,11 Jul  3:02 pm,"Nawala, Colombo","250,000",• Our Reference No LH 1884( Please quote this reference number when inquiring),Nawala,5,6,"4,000.0 sqft",15.0 perches
21,House for rent Nawala,13 Jul  1:55 pm,"Nawala, Colombo","85,000","Nawala beautiful seluded property 1.5 km from borella 3.5 km from colombo 7 and 5 km from col petty situated minutes from British shchool gateway royal institute wycherlies and bidura international this secluded property is rate find in a highly residential neighbourhood in nawala it is lacated minuts from 4 private hospitals  keells, and numberous restaurants suitable for expatriates doctors working at asiri lnka nin wells or kings hospitals or business professional available semi furnished or unfurnished ",Nawala,3,2,"1,850.0 sqft",10.0 perches
22,Rent a House for Working Girls koswatta,11 Jul  9:16 am,"Nawala, Colombo","10,000",boarding house only for girls safe area 2month advance,Nawala koswatta,1,1,600.0 sqft,6.0 perches
23,House For Rent In Nawala,12 Jul  3:54 pm,"Nawala, Colombo","50,000","Separate house in Nawala for rent, with all basic amenities. Parking for two vehicles.3 bedrooms,2 baths",3,2,"1,400.0 sqft",10.0 perches,
24,New 2 Units House For Rent in Nawala,20 Jul 11:26 am,"Nawala, Colombo","130,000",》》Foreigners are well Come》》NAWALA OLD RD 5Room 5Baths 2 Vpark Roller Door see the Pictures Link. https://photos.app.goo.gl/SdkKykzzGcAqTWuq6,Nawala,5,5,"3,250.0 sqft",12.0 perches
25,House For Rent In Nawala, 8 Jul  8:37 pm,"Nawala, Colombo","65,000",Upstair house for rent in nawala..  2 bedrooms with 2 toilets1 pantry1 dinning room1 large living room with one car park.,2,2,"1,800.0 sqft",10.0 perches,
26,Single Storey House for Rent in - Nawala, 7 Jul  8:12 am,"Nawala, Colombo","55,000","6 Month Advance4,5 Car Parking",Nawala Koswatta Road (cooray mawatta),3,1,"1,300.0 sqft",8.0 perches
27,Ground Floor Unit in Nawala, 7 Jul 12:28 pm,"Nawala, Colombo","50,000",🔴REF NO-- JL691,Nawala,3,1,"1,300.0 sqft",10.0 perches
28,"3B/R 2 Storey House for Rent in Nawala, Liyanage Rd.", 5 Jul 12:06 pm,"Nawala, Colombo","105,000","3 Bed Rooms House for Rent in Nawala, Liyanage Road.","Nawala, Liyanage Road.",3,2,"1,600.0 sqft",8.0 perches
29,House For Rent In Rajagiriya,13 Jul 10:46 am,"Nawala, Colombo","380,000","11Rooms (6 AC rooms).5 bathrooms.1 servant bathroom.4 Floors (with roof top).Seperate entrance for each floors).25 feet road.2 garage (5 vehicle parking).75m to Nawala Koswatta town.1/2 km to Rajagiriya,1km to Nawala.176 bus root.Walking distance to Gateway collage.Better for office or company.","No:33,De Melwatha Rd,Nawala,Rajagiriya.",10+,5,"14,000.0 sqft",20.0 perches
30,House For Rent In Nawala,17 Jul 12:46 pm,"Nawala, Colombo","260,000",6 rooms with attached bathroomsDouble garage with remote controlled doorGardenHot water Almost brand new houseWalking distance to Gateway CollegeSuitable for both residence and office,"15/38,3rd Lane,koswatta,Nawala.",6,7,"3,200.0 sqft",14.0 perches
31,House for Rent in Nawala (1271 B), 5 Jul 11:17 am,"Nawala, Colombo","150,000",Two story house available with five bed rooms with four bathrooms ( two attached and two common)3500 sqft11.7 perch,KOSWATTE,5,4,"3,500.0 sqft",11.7 perches
32,House for Rent - Nawala, 4 Jul  7:13 pm,"Nawala, Colombo","55,000",6month advance residence area,nawala kurey mawata,3,2,500.0 sqft,10.0 perches
33,House for Rent - Nawala, 4 Jul 11:23 am,"Nawala, Colombo","50,000",residence area,nawala (koswaththa road),3,2,"1,500.0 sqft",6.0 perches
34,House for Rent in - Nawala (junction), 2 Jul  2:38 pm,"Nawala, Colombo","75,000","6 Month Advance..., 100mt to Main Roadfor Office.. Groun Floor (2 Vehicle Parking)",Nawala (junction),3,2,"1,000.0 sqft",8.0 perches
35,House for Rent at Nawala, 1 Jul  4:08 pm,"Nawala, Colombo","125,000",Nawala 4 Bedrooms Fully Tiles House 125000.00,Nawala,4,2,"1,500.0 sqft",8.0 perches
36,House for Rent in Nawala, 1 Jul  1:36 pm,"Nawala, Colombo","70,000",House for rent,2,1,800.0 sqft,3.5 perches,
37,Beautiful House For Rent Near Koswatta Junction,29 Jun  2:07 am,"Nawala, Colombo","110,000","This is a well-maintained, renovated, large house. Ample parking for 2 (or more) cars. Master bedroom is air-conditioned. ",Nawala,3,3,"3,000.0 sqft",20.0 perches
38,Up Unit in Nawala,28 Jun 11:22 pm,"Nawala, Colombo","60,000",🔴REF NO --JU686,Nawala    Kolambage mw,2,2,"1,500.0 sqft",12.0 perches
39,02 Bed Room First Floor House Rent in Nawala,28 Jun  3:08 pm,"Nawala, Colombo","40,000","02 bed room, 01 bath room, big hall, another lounge open area. the house is in first floor and have automatic roller car parking.100m distance from 176 bus rout.  the second tp no-","19, gunasekara garden, nawala, rajagiriya",2,1,"1,250.0 sqft",4.0 perches
40,House for Rent in Nawala,28 Jun 11:43 am,"Nawala, Colombo","160,000","Spacious fully tiled up stair house with brand new furniture, 04 Bed Rooms A/C with attached toilet, Hot water and 02 sitting, dining, fitted pantry, kitchen servants room with a toilet, double garage with garage with roller door.",School Avenue,4,4,"5,980.0 sqft",22.0 perches
41,House For Rent In Nawala,27 Jun  1:40 pm,"Nawala, Colombo","80,000","Small upstair house ,suitable for a couple or a bachelor with quiet ways . Peaceful surrounding and neighbors . Double parking .A/C and hot water to upstair room . Separate house and has a spacious garden .","No,73,swarnadisi place,koswatte,nawala",4,2,"1,500.0 sqft",12.0 perches
42,House For Rent In Nawala,24 Jun 11:52 am,"Nawala, Colombo","125,000",Almost brand new house Near Open UniversityParking 1,Wijayaba Mw Nawala,5,3,"2,000.0 sqft",7.5 perches
43,2 Storied House in Nawala,24 Jun 10:41 am,"Nawala, Colombo","75,000",🔴REF NO JU682,"Nawala,  Koswatta , Galptta rd",2,1,850.0 sqft,3.0 perches
44,House for Rent in Koswatte (223 B),23 Jun  4:58 pm,"Nawala, Colombo","280,000",Two story luxury house with six bedrooms and three attached bathrooms plus one toilet3200 square feet,NAWALA,6,4,"3,200.0 sqft",35.0 perches
45,1st floor unit in Nawala,22 Jun 12:37 am,"Nawala, Colombo","55,000",🔴REF NO --JU681,Nawala,3,2,"1,400.0 sqft",12.0 perches
46,New House for Rent Nawala,21 Jun  6:23 am,"Nawala, Colombo","160,000",LUXURY HOUSE NAWALA,"NawalaRd,koswathta",5,4,"3,000.0 sqft",20.0 perches
47,House for Rent in Nawala,23 Jun  9:31 pm,"Nawala, Colombo","60,000",Rent for residence or office use. Parking spce for 4 vehices. Seperte entrence. Color wash and clean the space when hand over. ,"5th Lane, Nawla",2,1,"1,130.0 sqft",10.0 perches
48,House for Rent in Nawala (42B),20 Jun  1:10 pm,"Nawala, Colombo","70,000",Two Story House available Two Bedrooms and One Common Bathroom850 square3 perches,GALPOTTA ROAD,2,1,850.0 sqft,3.0 perches
49,5BR Fully Furnished House for Rent in Nawala,20 Jun 12:28 am,"Nawala, Colombo","350,000",• Our Reference No LH 1977( Please quote this reference number when inquiring),Nawala,5,6,"4,500.0 sqft",27.0 perches
50,2 Storied House for Rent in Nawala,20 Jun  4:42 pm,"Nawala, Colombo","100,000",🔴REF NO JU679,Nawala,3,2,"1,600.0 sqft",10.0 perches
51,Up Unit for Rent in Nawala,19 Jun  2:07 am,"Nawala, Colombo","30,000",🔴REF NO-- JU678,Nawala,1,1,500.0 sqft,15.0 perches
52,House for Rent - Nawala,19 Jun 12:43 am,"Nawala, Colombo","40,000",🔴REF NO-- JU677,Nawala   Old rd,2,1,650.0 sqft,6.0 perches
53,House for Rent in Nawala,28 Jun  2:52 pm,"Nawala, Colombo","350,000","All bathrooms attached with rooms.7 car park suitable for restaurant, residence, office, warehouse, guesthouse ets",nawala koswatha,10+,10+,"4,500.0 sqft",14.0 perches
54,Commercial Property & Residential House for Rent in Nawala,17 Jun 11:48 pm,"Nawala, Colombo","225,000",Commercial property & Residential House For Rent  NawalaOld Nawala Road.200 Meters to Nawala junction With 30Feet Road ,Old Nawala Road.,4,4,"4,000.0 sqft",10.0 perches
55,"Luxury House for Rent in Nawala, Koswatte.",17 Jun  4:55 pm,"Nawala, Colombo","275,000","Luxury House for Rent in Nawala, Koswatte, Wasana Road.with 15 Perches.","Nawala, Koswatte, Wasana Road.",5,3,"3,500.0 sqft",15.0 perches
56,House For Rent In Nawala,17 Jul 12:46 pm,"Nawala, Colombo","260,000",6 rooms with attached bathroomsDouble garage with remote controlled doorGardenHot water Almost brand new houseWalking distance to Gateway CollegeSuitable for both residence and office,"15/38,3rd Lane,koswatta,Nawala.",6,7,"3,200.0 sqft",14.0 perches
57,House For Rent In Rajagiriya,13 Jul 10:46 am,"Nawala, Colombo","380,000","11Rooms (6 AC rooms).5 bathrooms.1 servant bathroom.4 Floors (with roof top).Seperate entrance for each floors).25 feet road.2 garage (5 vehicle parking).75m to Nawala Koswatta town.1/2 km to Rajagiriya,1km to Nawala.176 bus root.Walking distance to Gateway collage.Better for office or company.","No:33,De Melwatha Rd,Nawala,Rajagiriya.",10+,5,"14,000.0 sqft",20.0 perches
58,House for Rent in Nawala,17 Jun 12:52 pm,"Nawala, Colombo","80,000",House / Apartment for RentClose to Nawala Open UniversityFully tiled3 bed rooms with 2 attached bathroomsHot waterPantry2 balconiesGarage Servant bathroom,"16/25, Wijeyaba Avenue, Nawala Rd, Nugegoda",3,2,"1,300.0 sqft",5.0 perches
59,Two Story House for Rent Nawala,28 Jun 10:18 am,"Nawala, Colombo","270,000",Two storey house for rent 4 bedrooms 3 bedrooms servant room and bathroom driver room a/c hot water rooftop garden monthly rent 270000 rent in advance 1 year half month broker fees please no brokers,senanayaka road nawala,4,3,"3,750.0 sqft",10.0 perches
60,House for Rent Nawala,28 Jun  2:52 pm,"Nawala, Colombo","130,000",Nawala School Lane 4 bedrooms fully tiles 4 parking 130000.00 monthly rental 6 months advance Residence or office,Nawala,4,3,"3,000.0 sqft",10.0 perches
61,House for Rent in Nawala,15 Jun  7:43 am,"Nawala, Colombo","90,000","Living + Dining 4 Bedrooms2 WashroomsA/ C + Hot water3 Phase ElectricityKitchen and pantryParking for 3 vehiclesAmple parking space outsideGood residential areaModern FurnitureSmall garden spaceLocated in Nawala, Koswatta, a highly residential area with close proximity to major international and government schools, supermarkets, hospitals and many other amenities!Foreigners are well Come!!!Rental is just 90,000 LKR per month!No Brokers, please.",4,2,"2,000.0 sqft",7.0 perches,
62,3BR House for Rent in Nawala,15 Jun  5:41 am,"Nawala, Colombo","225,000",• Our Reference No LH 2969( Please quote this reference number when inquiring),Nawala,3,2,"2,500.0 sqft",11.0 perches
63,4BR House for Rent in Nawala,15 Jun  5:41 am,"Nawala, Colombo","250,000",• Our Reference No LH 1016( Please quote this reference number when inquiring),Nawala,4,4,"4,000.0 sqft",10.0 perches
64,Studio Type House for Rent Nawala,20 Jun  3:47 am,"Nawala, Colombo","42,000","Fully furnished studio type annex including # Double bed# Wardrobe# TV# Fridge, # Microwave# Dining table# Hot water geezer# Fully complete pantry cupboards# Iron & ironing table.# Walking distance to koswatte junction.# Close to Gatway college.# Separate water & electricity supply.***Preferably a Single person or a couple..",1,1,600.0 sqft,5.0 perches,
65,Newly Renovated Single Storied House in Nawala,13 Jun 11:54 pm,"Nawala, Colombo","85,000",🔴REF NO --JU676,Nawala,4,2,"2,400.0 sqft",15.0 perches
66,Up Stairs House Closer to Gateway College Rajagiriya,13 Jun  4:09 am,"Nawala, Colombo","75,000","Upstairs house very close to Gateway College Koswatta Rd.3 Bedrooms. (2 A/C rooms one normal)2 bathrooms, kitchenServant's room with a toiletParking for a one vehicleRooftop (Ample space ideal for parties)","Koswatta Rd, Rajagiriya",3,2,"1,500.0 sqft",15.0 perches
67,2 Storied House in Nawala,13 Jun  1:01 am,"Nawala, Colombo","90,000",🔴REF NO--JU674,Nawala     Diyawanna Gardens,4,2,"2,000.0 sqft",8.0 perches
68,Nawala Brand New 4 Bedroom 3 Bathroom House For Rent,12 Jun  6:57 pm,"Nawala, Colombo","120,000","Nawala – Koswatta 2nd lane brand-new 2 storied 2200sqft house 4 bedrooms 2 with AC, 3 bathrooms sitting dinning with fitted pantry, Family/TV area, 4 balconies, large roof terrace and parking for two cars in a quiet residential area.","37/10 Koswatta 2nd Lane, Nawala",4,3,"2,200.0 sqft",6.0 perches
69,Nawala Temple Road - Super Luxury House For Rent,12 Jun  6:52 pm,"Nawala, Colombo","225,000","Nawala Temple road (border of Colombo 5) brand new 3 bed room single story super luxury house for rent. Situated in very good residential area with 2 car garage, ample visitor parking, fully luxury tiled and timber flooring, fully fitted kitchen and 2nd extra kitchen, beautiful alfresco court yard, rooms & living area fully air conditioned, one attached one common large modern bath rooms, luxury interior, maid's room with toilet, high security with CCTV and much more available either fully furnished with all luxury furniture, brand new electrical equipment or unfurnished.",Temple Road,3,2,"2,500.0 sqft",11.0 perches
70,"3BR House for Rent in Nawala, Liyanage Road",11 Jun  2:46 pm,"Nawala, Colombo","105,000","3 Bed Rooms House for Rent in Nawala, Liyanage Road.","Nawala, Liyanage Road",3,2,"1,600.0 sqft",8.0 perches
71,Rent a House - Nawala,10 Jun  4:46 pm,"Nawala, Colombo","120,000",LUXURY HOUSE NAWALA,Nawala,4,3,"2,400.0 sqft",15.0 perches
72,House For Rent Nawala,28 Jun  2:52 pm,"Nawala, Colombo","150,000",Nawala 4 bedrooms 2 rooms attached 4 bathrooms servant rooms & bathroom Luxury house 2 parking Residential area New model house 150000.00,Nawala,4,4,"3,000.0 sqft",10.0 perches
73,House for Rent in - Nawala,17 Jul  9:51 am,"Nawala, Colombo","250,000","River Facing Luxury House for Rent in Nawala Galpotta 1st Lane Ground floor 1250sqft (4 Bedroom 4 Bathroom)Upstairs 1350 Sqft  ( 3 Bedroom  2 Bathroom)Upstairs 400 Sqft  ( Balcony 1 Bathroom)Upstairs Separate Entrance Separate Electricity & water Parking Spaces Around 15 Cars 6 Month Deposit 2 Month Security Deposit Suitable For Residents "" Office "" Restaurant ""Hotel""",7,8,"3,000.0 sqft",25.0 perches,
74,5 Bed Rooms House for Rent in Nawala., 5 Jun 12:18 pm,"Nawala, Colombo","155,000",Nawala House for Rent.,"Nawala, Sri Ghanendra Mawatha near 1st Lane.",5,3,"2,500.0 sqft",8.0 perches
75,House for Rent at Malabe, 4 Jun  2:19 pm,"Nawala, Colombo","40,000","Living RoomDining RoomKitchen2 Bed rooms (1 room with A/C) with attached bathrooms.Full TileClose to Cinec Marine Campus, Horizon College & SLIIT600 meters to 177 RootParking space for 1 vehicle.","Sudarshana mw,Malabe",2,2,"1,100.0 sqft",9.0 perches
76,House for Rent - Nawala, 3 Jun 11:37 am,"Nawala, Colombo","125,000",Three bedroom upstairs house for rent with attached bathrooms situated in Kandewatta Lane. With utility room and maids room. Parking for one vehicle. Garage with remote controlled roller gate.,Kandewatta Lane,3,3,"3,000.0 sqft",10.0 perches
77,Housing Complex for Rent in Nawala (1146B), 1 Jun  4:07 pm,"Nawala, Colombo","160,000",Two story house with three bedrooms and three bathrooms3000 square feet,NAWALA,3,3,"3,000.0 sqft",15.0 perches
78,"House for Rent at Galpotta Road, Nawala", 9 Jul  9:39 am,"Nawala, Colombo","50,000","House for Rent at Galpotta Road, NawalaRent: Rs.50,000 Per Month2 Bedrooms Upstair UnitAll Rooms with Ceiling FansCommon Bathroom with Hot WaterLiving AreaDining AreaPantryBalconyStore SpaceSeparate Entrance950 Sq.Ft.12 Perches of LandElectricity, Water Supply & Storage TankWIFI, SLT Phone ConnectionParking Space for One VehicleSuitable for Small Family6 Months Advance NeededInspection Only on Saturdays & SundaysCall for More Details",Galpotta Road,2,1,950.0 sqft,12.0 perches
79,Office /Residence Space for Rent - Nawala,28 Jun  2:51 pm,"Nawala, Colombo","85,000",Near nawala campus suitable for office and residence,wiyayapa road nawala,5,4,"2,500.0 sqft",4.0 perches
80,House For Rent - Nawala,28 Jun  2:51 pm,"Nawala, Colombo","55,000",Small unit 6month advance car park separate unit,nawala koswatha cooray mawatha,3,2,"1,500.0 sqft",3.0 perches
81,2 Storied House in Nawala,31 May  3:01 pm,"Nawala, Colombo","115,000",🔴REF NO --MY669,Nawala    School lane,4,3,"2,000.0 sqft",10.0 perches
82,House for rent in Nawala,14 Jun  9:08 am,"Nawala, Colombo","125,000",3 Bed 2 bath house with spacious living dining kitchen and garden area available. Residential area. Partially furnished. Call .,3,2,"3,000.0 sqft",20.0 perches,
83,House For Rent In Nawala,17 Jul 12:46 pm,"Nawala, Colombo","260,000",6 rooms with attached bathroomsDouble garage with remote controlled doorGardenHot water Almost brand new houseWalking distance to Gateway CollegeSuitable for both residence and office,"15/38,3rd Lane,koswatta,Nawala.",6,7,"3,200.0 sqft",14.0 perches
84,House For Rent In Rajagiriya,13 Jul 10:46 am,"Nawala, Colombo","380,000","11Rooms (6 AC rooms).5 bathrooms.1 servant bathroom.4 Floors (with roof top).Seperate entrance for each floors).25 feet road.2 garage (5 vehicle parking).75m to Nawala Koswatta town.1/2 km to Rajagiriya,1km to Nawala.176 bus root.Walking distance to Gateway collage.Better for office or company.","No:33,De Melwatha Rd,Nawala,Rajagiriya.",10+,5,"14,000.0 sqft",20.0 perches
85,House for Rent in Nawala,28 Jun  2:52 pm,"Nawala, Colombo","150,000",Nawala Goswatta 4000 sqft house or store or office 150000.00,Nawala Goswatta,3,2,"2,500.0 sqft",10.0 perches
86,House for Rent in Nawala, 8 Jun 12:09 pm,"Nawala, Colombo","45,000",3rd floor house with a car park near to gateway collage,"160/3/1/2, koswatta rd,nawala,rajagiriya",2,2,"1,100.0 sqft",7.0 perches
87,Brand New up Unit in Nawala,30 May 12:45 am,"Nawala, Colombo","45,000",🔴REF NO --MY662,Nawala,2,1,850.0 sqft,20.0 perches
88,House for Rent at Nawala,28 Jun  2:52 pm,"Nawala, Colombo","150,000",Nawala Senanageka Avenue 5 bedrooms with fully ac 6 parking office & Residents 150000.00,Nawala Senanageka Aveneu,5,4,"3,000.0 sqft",10.0 perches
89,House for Rent - Nawala,28 Jun  2:51 pm,"Nawala, Colombo","120,000",Fully luxury house 3 car park separate servant room and toilet. With A/C,nawala,5,4,"3,000.0 sqft",6.0 perches
90,2 Storied House in Nawala,27 May  3:37 pm,"Nawala, Colombo","58,000",🔴REF NO-- MY661,Nawala     School Av,2,2,"1,500.0 sqft",12.0 perches
91,Four Bedroom House for Rent in Nawala [HR06],27 May  2:51 pm,"Nawala, Colombo","325,000","Fully furnished two-story house available for long term rent, conveniently located off Kirimandala Mawatha, Nawala. The property is only 300 meters away from Nawala Road and 1.5 km away from Elvitigala Mawatha. The house is equipped with brand new furniture and offers extensive living space along with a total of four bedrooms and three bathrooms. ","Kirimandala Mawatha, Nawala",4,3,"3,000.0 sqft",16.0 perches
92,Houses for Rent in Nawala, 3 Jul 12:55 pm,"Nawala, Colombo","75,000",HOUSE UPSTAIR UNIT FOR RENT ,Walawwatta Nawala,3,2,"1,500.0 sqft",20.0 perches
93,House for rent Nawala,28 Jun  2:52 pm,"Nawala, Colombo","40,000",Nawala Junction 2 bedrooms 2 Bathrooms Stores And Office with Car Parking 6 Months advance 40000.00,Nawala,2,2,"2,000.0 sqft",10.0 perches
