,0,1,2,3,4,5,6,7,8,9
94,Downstair of Two Storey House for Rent in Nawala,23 Jun  2:48 pm,"Nawala, Colombo","80,000","3 Bedrooms,3 Bathrooms,Pantry,Dining roomSpacious living room,Garage, Space for another vehicle,with Furniture,Calm friendly environment,Separate Water tank ,Separate Electricity,","Near 4th lane Nawala,200m to main road.",3,3,"1,100.0 sqft",15.0 perches
95,Up Unit in Nawala,26 May  9:32 am,"Nawala, Colombo","45,000",🔴REF NO-- MY660,Nawala    Narahenpita rd,2,1,850.0 sqft,12.0 perches
96,Nawala Office Space for Rent sqft1200,25 May  1:26 pm,"Nawala, Colombo","85,000","Office Space for Rent sqft1200 Nawala ---------------2 rooms 2bathrooms ,Living pantry andServents bathroom.",Rajagiriya Road Nawala,2,2,"1,200.0 sqft",8.0 perches
97,House for Rent in Nawala,28 Jun  8:27 pm,"Nawala, Colombo","200,000","Two- storey house available for rent in Nawala :* Ground floor - Dining room, living room, pantry, 2 bedrooms with attached bathroooms, servant room with bathroom and small kitchen accessible from outside. * First floor - 3 bedrooms with attached bathrooms, 1 store room and 1 living room* All bedrooms are air conditioned * Granite floor* Rooftop with rooftop bar and bathroom* Small back garden and front garden* Parking space for 3 vehicles ",5,5,"3,000.0 sqft",15.0 perches,
98,Small House for Lease at Nawala Nugegoda,28 May  2:45 pm,"Nawala, Colombo","30,000","*Unit is on lease for professionals*Max occupants 2Walking distance to OUSL (Open University) & Urban Wetland parkSafe and calm environment with 24*7 CCTV operationSeparate electricity and water supplySeparate entrance & parkingA basement unit accessible via steps (hence unit is not suitable for elderly)1 Bedroom (99 Sqft) & Attached bathroom (35 Sqft)Living room (140 Sqft)Kitchen (99 Sqft)200,000/= security depositNote: Premises is non-smoking area",1,1,400.0 sqft,1.0 perches,
99,House for Rent in Koswatta, 4 Jun 10:39 pm,"Nawala, Colombo","200,000",LUXURY HOUSE NAWALA,Nawala Koswatta,5,4,"3,000.0 sqft",16.0 perches
100,5BR House fore Rent in Nawala,12 Jul  1:58 pm,"Nawala, Colombo","200,000",• Our Reference No LH 2912( Please quote this reference number when inquiring),Nawala,5,4,"4,000.0 sqft",12.0 perches
101,Three Story Full Furniture House for Rent - Nawala,22 May  2:04 am,"Nawala, Colombo","175,000",Three story full furniture house Bedroom 5Bathroom 5Ac 4Pantry and kitchen Tv lounchRoof top Servants bathroom and room Sitting and dinning 2 vehicles parking Roller doorBalcony 20 feet road placingRecidence areaNawala Rajagiriya Road 500 metresHospital and bank and super market Narahenpita road 500 metresRs.1750002 year advance Contact agent laksiri No broker,Nawala walawwatta road,5,5,"3,200.0 sqft",10.0 perches
