,0,1,2,3,4,5,6,7,8,9
0,title,posted date,location,price,description,Address:,Beds:,Baths:,House size:,Land size:
1,A House for Sale Angoda,18 Jul  1:29 pm,"Angoda, Colombo","8,000,000","A house in Delgahawatta, Angoda for immediate sale. 	1 Km to Gothatuwa Junction.	Only 5 minutes to 175 bus routes and 15 minutes drive to Rajagiriya.	Calm area to live	Fully tiled.","Delgahawatta, Angoda",1,1,800.0 sqft,7.5 perches
2,"['A House for Sale Angoda', '18 Jul  1:29 pm', 'Angoda, Colombo', '8,000,000', 'A house in Delgahawatta, Angoda for immediate sale. \t1 Km to Gothatuwa Junction.\tOnly 5 minutes to 175 bus routes and 15 minutes drive to Rajagiriya.\tCalm area to live\tFully tiled.', 'Delgahawatta, Angoda', '1', '1', '800.0 sqft', '7.5 perches']","['title', 'posted date', 'location', 'price', 'description', 'Address:', 'Beds:', 'Baths:', 'House size:', 'Land size:']",,,,,,,,
3,මුල්ලෙරියාවෙන් අනගි ඉඩමක් සහ නිවසක්,17 Jul  2:57 pm,"Angoda, Colombo","7,900,000",143 අවිස්සාවේල්ල පාරේ මුල්ලේරියාව නීලමල්ලිකාරම මාවතේ  සිට 200m පමණ දුරකින් මෙම ඉඩම සහ නිවස  පිහිට ඇත.,"622 ,නීලමල්ලිකාරාමය පාර , මුල්ලේරියාව",2,1,"1,400.0 sqft",15.0 perches
4,අනර්ඝ ඉඩමක් සමග නිවසක් කොටිකාවත්තෙන්,16 Jul  8:55 pm,"Angoda, Colombo","16,000,000",175 බස් මාර්ගයට මුහුණලා ඇත.,"Kohilawatta Road, Kotikawatta",3,1,"1,400.0 sqft",11.0 perches
5,3 Story House for Sale - Angoda,11 Jul  8:13 pm,"Angoda, Colombo","25,000,000","3 Story house for Sale in Angoda.fully tiled floor, Seven large bed rooms, two living room, dinning room, kitchen , two balconies, three bathroom, Roof top Terrace vehicle ample parking space and calm surrounding area.Contact for More Details",7,3,"3,500.0 sqft",9.0 perches,
6,House for Sale in - Kotikawatta, 9 Jul  4:40 pm,"Angoda, Colombo","11,000,000","New single Story House at weeramal mw, Kotikawatta,Landscaped garden area with 6 perches1100 Sw.FT20 Ft Road3 Bed rooms (1 Attached Bath Room & AC)Living, Dining, Pantry AreaOver water tank with pipe born water02 Vehicle can be park2 Bath roomsLiving, Dining, Pantry AreaOver water tank with pipe born water02 Vehicle can be parkRoller Gate (three singha) ","Weeramal Mw,3rd lane, Kotikawatta",3,2,"1,100.0 sqft",6.0 perches
7,(HS180) House for Sale in Angoda, 7 Jul  9:59 am,"Angoda, Colombo","28,000,000",Key Features22 perchesLarge garden2 living areasPantry and Kitchen2 stories tallOpen airy environmentGreat ventilationGreat access pointsHighly residential areaGood neighborhood,"Rahula Road, Hospital Road, Angoda",4,3,"3,050.0 sqft",22.0 perches
8,House for Sale in - Angoda, 6 Jul  2:16 pm,"Angoda, Colombo","15,000,000",House for Sale in Kelanimulla Angoda.Suitable for Commercial and Residential Cear Deed100m to Main Road( Sri Sumana Mw.)300m to Kelanimulla Junction 500m to Angoda Junction 5km to Highway Entrance Kaduwela,"Kelanimulla, Angoda",3,1,"1,550.0 sqft",17.0 perches
9,House for sale in mulleriyawa, 5 Jul  7:02 pm,"Angoda, Colombo","5,700,000",House for sale in mulleriyawa====================,3,1,"1,226.0 sqft",15.0 perches,
10,House for Sale - Angoda, 5 Jul  1:52 pm,"Angoda, Colombo","33,500,000",300m to Angoda Junction100m to Colombo - Avissawella Main RoadKaduwela Junction 5kmKaduwela Highway entrance 3 kmFully Tiled2 AC RoomsGardenParking for 2 vehiclesRoof top  Party Hall,"Awissawella Road, Mulleriyawa.",4,2,"3,200.0 sqft",10.0 perches
11,නිවසක් සහිත ඉඩම - අංගොඩ, 4 Jul  5:21 pm,"Angoda, Colombo","13,000,000",garej and pack tow gate stro room water and powerwalljanuary rata yana bavin wahama vikinimata,195/4 G Kalanimulla Angoda,3,2,"2,000.0 sqft",16.0 perches
12,House for sale in Mulleriyawa Angoda, 4 Jul  5:03 pm,"Angoda, Colombo","35,000,000",Three story house situated at Ranabima Mawatha - MulleriyawaGood Neighborhood & Calm & quiet area,"Ranabima Mawatha, Mulleriyawa",5,3,"3,500.0 sqft",34.0 perches
13,Luxury House for Sale - Kotikawatta, 4 Jul 11:40 am,"Angoda, Colombo","65,000,000",03 Rome AC02 GateFully Granite02 Entrees10 Vehicle ParkingFully Completed GardenSecurity RoomServer Room02 Kitchen20Ft Road,"126/a/A Koratuwa rd, Kotikawatta Angoda",7,3,"2,000.0 sqft",32.0 perches
14,මුල්ලේරියාව අගනා දෙමහල් නිවසක් විකිණීමට, 5 Jul  2:28 pm,"Angoda, Colombo","8,500,000","කඩුවෙල කොළඹ ප්‍රධාන පාරට මී.150 යි. සියලු පහසුකම් සහිත දෙමහල් නිවස කඩිනමින් විකිණීමට ඇත.පිරිසිදු ඔප්පු.නිවසට පැමිණෙන පාර ගල් අතුරා සකස් කර ඇත. විදුලිය, නල ජලයගැනුම් කරුවන් පමණක් කථා කරන්න ...","598/D/16 සිරි පැරකුම් මාවත දහම් පෙදෙස, මුල්ලේරියාව නව නගරය",4,3,"1,800.0 sqft",7.8 perches
15,House for Sale (3 Story) - Angoda, 1 Jul  7:54 pm,"Angoda, Colombo","39,000,000",only 500m to Angoda Townonly 10m to Colombo Avissawella (low level) Main Road House is visible to the main roadFully tiled just behind the Petrol Shed (Mallimarachchi)All the 3 floors designed as 3 separate housesSeparate Light & Water to each floorsParking Space availableකොළඹ අවස්සාවේල්ල ප්‍රධාන පාරට පේන දුරින්අංගොඩ හන්දියට මී500යිතට්ටු 3ම වෙනම ගෙවල් 3ක් ලෙස සාදා ඇතකුලියට දීමටද හැකිය.වෙනම විදුලිය සහ ජලය සැපයුම් ලබා දී ඇත.සම්පූර්ණයෙන් ටයිල් කර ඇත.,"Mulleriyawa North, Mulleriyawa",6,3,"4,000.0 sqft",7.1 perches
16,New House for Sale - Angoda,28 Jun  5:48 pm,"Angoda, Colombo","9,200,000",Angoda hibutana patumaga 164.166.150..bus parata m.600 duren.ganwatura tarjena nomati nawa niwasa.,Hibutana patumaga,3,2,"1,200.0 sqft",7.1 perches
17,Two Story Luxury House for Sale in Kotikawatta,28 Jun  3:04 pm,"Angoda, Colombo","28,500,000","Two Storied Luxury  House available for Sale in Kotikawatta with separate entrance. Just 400 meters away from Kotikawatta junction. built on 12.5 Perches Land area with Right round Boundary wall. Very convenient location close to Angoda Town. This house consists with 4 bedrooms (2 bedrooms A/C), 2 attached bathrooms, 01 common bathroom, terrazzo floor, kitchen and pantry cupboards, 02 gates. jack wood window and doors. easy access to Rajagiriya and Angoda Towns.",Kotikawatta,4,3,"2,800.0 sqft",12.5 perches
18,House for Sale at Kotikawatta,27 Jun  2:52 pm,"Angoda, Colombo","6,000,000","කොටිකාවත්ත මහවත්ත පාරේ නිවසක් විකිනීමට තිබේ.කොටිකාවත්ත හන්දියට (ලෝ ලෙවල් පාරට) 1KM. 175 බස් පාරට 300M. පර්චස් 6.කාමර 2. බාත්රූම් 1 (උණු ජලය සහිත). තාප්ප සහිතය. වහනයක් නැවැත්විය හැක.කුඩා ගෙවත්තක් පලතුරු ගස් සහිතයි.නිසංසල පරිසරය.ගං වතුර තර්ජන නොමැත.පිරිසිදු ඔප්පු.ලක්ෂ 60 (මිල ගණන් සාකච්චා කල හැක)දුරකථන ඇමතුමක් දී බැලීමට පැමිණෙන්න.House for sale at Kotikawatta Mahawattha Road1KM to Kotikawatta Junction (Low Level Road). 300M to 175 but route6 perches2 Rooms, 1 bathroom with hot waterParapet WallParking AreaSmall Garden in front and back with fruit treesCalm environmentFree from floodClear deeds60 Lahks (negotiable)Can see after making an appointment",Kotikawatta,2,1,"1,900.0 sqft",6.0 perches
19,4 Bedroom House for Sale in - Kotikawatta,27 Jun 12:40 pm,"Angoda, Colombo","17,500,000",For More Details Please Contact Us on,Kotikawatta,4,2,"1,795.0 sqft",15.37 perches
20,2 Story House Available for Sale in Kotikawatta,25 Jun 12:34 pm,"Angoda, Colombo","8,500,000","2 Story House available for Sale in Veeramal mawatha, Kotikawatta. Built on 3.1 Perches Square Shape Land area with Right round Boundary wall. Very convenient location close to Town, Just 1 Km to kotikawatta junction. This fully tiled house consists with 2 bed rooms with a large master bed room, 1 bathroom, servant toilet, Ceiling, kitchen and pantry cupboards.- Telephone, Electricity, Waterline facilities are available. Clear deeds.","Veeramal mawatha, Kotikawatta",2,2,"1,500.0 sqft",3.1 perches
21,House for Sale - Angoda,11 Jul  2:40 pm,"Angoda, Colombo","9,000,000",Two story houses Car parking available Quite place All the facilities near by 900 m100 m far for 175 busGround floor not complete,122 / 8 kotikawatta angoda,4,2,"1,100.0 sqft",7.0 perches
22,Large House with 17 P Land for Sale in Idh Angoda,19 Jun 10:57 pm,"Angoda, Colombo","37,500,000","රාජගිරියට කිලෝමීටර් 3 ක් ද ,දෙමටගොඩට කිලෝමීටර් 4ක් ද  වන  IDH  KEELS SUPER ඉදිරියේ ප්‍රධාන පාරේ සිට මීටර් 20ක් පමණ දුරින් අඩි 30ක පාරට මුහුනත ඇති පර්චස් 17ක ඉඩමේ කාමර 5 නාන කාමර 3ක ද වාහන 5කට පමණ නැවතීමේ ඉඩකඩද සහිත අංගසම්පූර්ණ විශාල නිවස ලක්ෂ 375 කට විකිනීමට ඇත .කරුණාකර තැරව්කරුවන් කථා කරන්න එපා .සත්‍ය ගැනුම්කරුවන් සදහා පමණයි .නිවස පරීක්ෂා කිරීමෙන් පසුව මිල සාකච්ඡා කල හැක .නිවස පරීක්ෂා කිරීම සදහා සාකච්ඡා කර කලින් වෙලාවක් වෙන්කර ගන්න .ස්තූතියි ...",KAJUGAHAWATHTHA  1ST LANE  IDH .,5,3,"1,800.0 sqft",17.0 perches
23,House with land for sale in kotikawatha,19 Jun  3:35 pm,"Angoda, Colombo","9,500,000",10 purchase land with home,3,1,"1,500.0 sqft",10.0 perches,
24,House For Sale in Gothatuwa,11 Jun  6:03 pm,"Angoda, Colombo","22,000,000",2 Bedrooms 1 Bathroom1GarageRoller gatePantry (big)CourtyardDouble light systemGarden,2,1,"1,350.0 sqft",10.0 perches,
25,House with Land for Sale Gothatuwa (IDH) New Town,10 Jun  9:03 am,"Angoda, Colombo","12,500,000","Fully furnished house with land. Very quite neihborhood.Land is completely walled from 3 sides and perfectly rectangular Suitable for residence or business purposes.Facing IDH mainroad.Walking distance to IDH supermarket, Kells and Cargills Supermarkets,IDH hospital ,Banks.Clear deed.","166/B,Dodangahena,IDH,Angoda.",1,1,600.0 sqft,5.0 perches
26,House for Sale in Angoda,10 Jul  2:06 pm,"Angoda, Colombo","5,200,000","A house situate in Kelani Nadee mawatha for Sale . Very clear title over 30 years, Approved building plan and  COC are  available . Very close to Galwana junction and 4 km to  Kaduwela  High entrance and 2km Kelani Temple . Genuine Buyers only.",2,1,"1,180.0 sqft",6.0 perches,
27,2 Story Modern Type House in Angoda, 8 Jun  9:10 pm,"Angoda, Colombo","22,000,000","2 story Modern type house situated in Delgahawatta Rd kotikawatta,800 m to angoda town","Delgahawatta Road,angoda",4,2,"2,600.0 sqft",9.5 perches
28,House for sale - Angoda,12 Jun  1:03 pm,"Angoda, Colombo","6,800,000",Clear DeedAwissawella Main Road 100mElectricity and Water Fully TileLower deck Completed Agent SaleGate,"No 277/1D Hospital Rd, Angoda",2,1,"1,200.0 sqft",5.0 perches
29,Immediate House for Sale - Himbutana, 8 Jun 10:42 am,"Angoda, Colombo","3,600,000","2nd floor house for sale with parking space for one vehical .Suitable for small family . 3 km to Koswaththa juction, 5Km to Rajagiriya juction.For Immediate sale","7B/2/3 Himbutu Uyana Housing Scheme, Himbutana",2,1,"1,125.0 sqft",2.5 perches
30,2 Storied House for Sale in Kotikawatta Road IDH, 7 Jul 11:37 am,"Angoda, Colombo","16,500,000","IDH හන්දියේ සිට මීටර් 500ක් පමණ වන අඩි 15  හා අඩි 20 පාර සහිත පර්චස් 6  ඉඩමේ කාමර 4 නාන කාමර 2ක් ද ඇති  වටිනා අලංකාර  නවීන පන්නයට ඉදිකරන ලද අංගසම්පූර්ණ දෙමහල් නිවස ලක්ෂ 165 කට විකිනීමට ඇත .ROOLER GATE , HOT WATER  හා A/C ඇතුලු පහසුකම් ද සහිතයි .නිවස පරීක්ෂා කිරීමෙන් පසුව මිල සාකච්ඡා කල හැක .තැරව්කරුවන් අනවශ්‍යයි .සත්‍ය ගැනුම්කරුවන් සදහා පමණයි .නිවස පරීක්ෂා කිරීම සදහා සාකච්ඡා කර කලින් වෙලාවක් වෙන්කර ගන්න .ස්තූතියි ....",KOTIKAWATTA ROAD  BATALANDA HENA  IDH .,4,2,"2,250.0 sqft",6.0 perches
31,House for Sale - Angoda, 5 Jun  4:25 pm,"Angoda, Colombo","4,000,000",1.5km to Angoda town1km to Galwana4km to KaduwelaParking Space for more than 2 vehiclesවාහන නැවැත්වීමට ඉඩකඩ ඇතපර්චස් 12කි,"Kelani Nadi Road, Angoda",2,1,900.0 sqft,12.0 perches
32,14 Perch Land with a House for Sale - Kotikawatte,17 Jun 11:39 am,"Angoda, Colombo","19,000,000",14 Perch Land with Ground Floor Completed House for Sale or Lease at 175 Bus Route in Kotikawatte. 200m to Kotikawatte JunctionAll the Facilities Are Nearby Distance. Peace and Calm Environment.Clear Deeds and Looking for Sale or Lease,2,1,"3,000.0 sqft",14.0 perches,
33,House for Sale in - Kotikawatta, 4 Jun  6:26 pm,"Angoda, Colombo","11,000,000","New Single story house at Weeramal Mawatha, Kotikawatta.6 Perches with Landscaped garden area.•  1100 Sq. Ft. •  20 Ft Roads• 3 Bed rooms ( 1 Attach Bath room & AC )• 2 bathrooms• Living, dining, pantry area • Pipe born water with over head water tank• 02 Vehicles can be Park • Roller Gate (Three singha)",3,2,"1,100.0 sqft",6.0 perches,
34,දෙමහල් නිවස - අංගොඩ,30 Jun  6:12 pm,"Angoda, Colombo","6,500,000","නිස්කලංක පරිසරය , වාහන නවතා තැබීමට පහසුකම් , ජලය , විදුලියකොළඹට කිලෝ.මී  7මාළෙඹි  බත්තරමුල්ල කඩුවෙළ ආසන්නව","172/2B Maligagodalla Road , Mulleriyawa New Town Secant Lane",4,2,"1,200.0 sqft",5.5 perches
35,House for Sale in Angoda,10 Jul  2:42 pm,"Angoda, Colombo","12,500,000","FOR URGENT SALE10 Perches Land size5 Perches House areaBrand new house for sale... Approved plan for a two story house & 1st floor fully completed.Roller Shutters with Remote, Rocell tiles, all Branded items installed to the Bathroom.Large Veranda & Good looking garden area in Front & Backyard too . Septic tank,3rings + 1 extra set 3rings for overflowed water from the septic tank. Water + ElectricityWater TankMore than 12feet Road, newly paving blocks has installed.5' thick Slab. 100 meters to Avissawella Low level road5 min to Kaduwela Highway 15 min to ColomboMore access roads to Battaramulla, Rajagiriya, Kelani Temple......Water proofing blind wall",Mulleriywa new town,1,1,"1,360.0 sqft",10.0 perches
36,2 Storied Units House for Sale in Angoda Thalahena., 8 Jul 11:09 am,"Angoda, Colombo","15,000,000","2 storied 2 units house for immediate sale in Angoda. - (2.4km to Thalahena Junction, Battaramulla) ",4,2,"2,500.0 sqft",6.5 perches,
37,"02 Story Luxury House Available for Sale in Angoda, Kotikawatta",25 Jun  9:51 am,"Angoda, Colombo","28,500,000","02 Storied Luxury  House available for Sale in Kotikawatta with separate entrance. Just 400 meters away from Kotikawatta junction. built on 12.5 Perches Land area with Right round Boundary wall. Very convenient location close to Angoda Town. This house consists with 4 bedrooms (2 bedrooms A/C), 2 attached bathrooms, 01 common bathroom, terrazzo floor, kitchen and pantry cupboards, 02 gates. jack wood window and doors. easy access to Rajagiriya and Angoda Towns.",Kotikawatta,4,3,"2,800.0 sqft",12.5 perches
38,House with Land for Sale Kellanimulla,28 May  9:58 am,"Angoda, Colombo","9,500,000",Serious Buyers Only!,"401/1/2A, Kellanimulla Muleriyawa New Town",3,1,"2,000.0 sqft",7.7 perches
39,Two Story House for Sale in Ambathale,28 May  9:12 am,"Angoda, Colombo","23,000,000","Ambathale Old road. 300 m to Low level (Colombo To Avissawella) Rd. Separate entrance, electricity & water. Ideal investment. 3KM to Southern Express way. 20minutes to Rajagiriya, Battaramulla & Malabe. 2KM to Kelaniya. Close to Schools & hospitals. High residential area.",4,2,"2,300.0 sqft",7.75 perches,
40,House For Sale Mulleriyawa,27 May  4:58 pm,"Angoda, Colombo","19,300,000","දෙමහල් නිවස,ටයිල් කර ඇත,Finishing වහල ,Remote Gate,කුබුක් ලෑලි අල්ලා ඇත.","68/11 A , Malgama Road , Mulleriyawa",5,2,"2,678.0 sqft",8.5 perches
41,House for Sale in Kotikawatta,26 May  5:39 pm,"Angoda, Colombo","11,000,000",කොටිකාවත්ත මහබුත්ගමුව ප්‍රදේශයේ තනි තට්ටුවේ නිවස විකිණීමට ! කොළඹට ඉතා පහසුවෙන් ප්‍රවේශ වීමේ හැකියාව.පර්චස් 12 ඉඩම.ඉදිරිපස සහ පසුපස ඉඩකඩ සහිත ගෙවත්ත.පුළුල් ආලින්දය.නිදන කාමර දෙකයි.ඇතුලත නාන කාමරයට අමතරව පිටතද නාන කාමයක් පිහිටා ඇත.කෑම කාමරය (Dinning room) පුළුල් මුළුතැන්ගෙය (Spacious kitchen),2,1,"1,270.0 sqft",12.0 perches,
42,House For Sale at Kotikawatta,25 May  1:38 pm,"Angoda, Colombo","4,000,000",Land with house for sale at Kotikawatta==============================,"No : 88/1 c, Kotikawatta, Kudabuthgamuwa",2,1,850.0 sqft,6.5 perches
43,"House for Sale At,hibutana Road Galwana,angoda",24 May  3:08 pm,"Angoda, Colombo","21,000,000","house for sale at,hibutana road galwana,angoda    *land extent: 8.6p.                                                           *Distance to main rood: 100m.(Avissawella colombo road) #Ground floor: *parking spaces: 2 vehicles *living,dining 1 bed room and 1 attached bath room, kitchen *floor area sq feet- 2000. #1st floor: *3 bed room,1 attached bathroom and master bed room with attached bathroom *TV room and open erea *floor erea sq feet- 2000  #2nd floor: *1bed room and sarven room,big open area •totel bed room:06 bath room:03 •walking distance to main road. Food city,super market,fish market,resturent,banks,oki international school and higway.",6,3,"2,000.0 sqft",8.6 perches,
44,House for Sale in Angoda,23 May 12:45 pm,"Angoda, Colombo","31,000,000","50 m to main road  (colombo Awissawella Road) walking distance to Angoda junction.  7.5 perches , Two storey house and single storey separated house. Two storey house. ....* Two Large bed rooms *one bathroom *TV Area *Upstair Garden *Large balcony *Living room *Large kitchen *Dining room * one car porch *completely TiledSingle storey house - Two bed rooms -one bathroom -Living Room-one kitchen Flooring Tile with I panel sivilima.We sell with All furnituresOne bathroom in outside with water tank.CCTV camera system. Clear Deeds and Bank Loan already available.",4,3,"2,400.0 sqft",7.5 perches,
