,0,1,2,3,4,5,6,7,8,9
0,title,posted date,location,price,description,Address:,Beds:,Baths:,House size:,Land size:
1,House for Rent in Mount Lavinia,18 Jul  7:10 pm,"Mount Lavinia, Colombo","45,000","03 Story Fully Renovated House 400m to Galle Road, as 01 Units (02 Electricity & 02 Water Meters)","No. 54/13A, Charls Collonne Place, Templers Road, Mount Lavinia",5,2,"3,000.0 sqft",6.0 perches
2,"['House for Rent in Mount Lavinia', '18 Jul  7:10 pm', 'Mount Lavinia, Colombo', '45,000', '03 Story Fully Renovated House 400m to Galle Road, as 01 Units (02 Electricity & 02 Water Meters)', 'No. 54/13A, Charls Collonne Place, Templers Road, Mount Lavinia', '5', '2', '3,000.0 sqft', '6.0 perches']","['title', 'posted date', 'location', 'price', 'description', 'Address:', 'Beds:', 'Baths:', 'House size:', 'Land size:']",,,,,,,,
3,Private House For Rent In Mt Lavinia,19 Jul 12:03 pm,"Mount Lavinia, Colombo","45,000",02 Story House for rent for Executive Boy's | Couple | Ladies. Can use as a Company Accommodations Too.,"Samudrasanna Road, Mount Lavinia",2,2,850.0 sqft,3.0 perches
4,House for Rent in Mount Lavinia,18 Jul  7:10 pm,"Mount Lavinia, Colombo","45,000","03 Story Fully Renovated House 400m to Galle Road, as 01 Units (02 Electricity & 02 Water Meters)","No. 54/13A, Charls Collonne Place, Templers Road, Mount Lavinia",5,2,"3,000.0 sqft",6.0 perches
5,Ground Floor House for Rent - Mount Lavinia.,20 Jul 12:43 pm,"Mount Lavinia, Colombo","45,000",⛔ Please note that this ad is posted by an agent ( broker ) and half-month rent will be charged as service charges:,Mount Lavinia,3,2,"1,200.0 sqft",15.0 perches
6,House for Rent in Mount Lavinia,17 Jul  8:59 am,"Mount Lavinia, Colombo","80,000","*** NO BROKERS*** Luxury Unfurnished House*** 3 Bedroom with 2 air condition *** 3 Bathroom ( 2 attach and 1 common bathroom )*** Walking distance from Galle road*** Nearby Masjid, Supermarkets, Schools, Resturants, etc...*** Suitable for Maldivians' *** 4-month refundable deposit*** Half Month Agent Fee",Mount Lavinia - Watrapola road,3,3,"2,400.0 sqft",6.5 perches
7,Fully Furnished 2 Storey modern House Rent - Mt Lavinia,20 Jul  8:28 am,"Mount Lavinia, Colombo","115,000","4 bedroom 4 bathroom one attach two common 1 servant, hall large kitchen full tiled 2 story  fully furnished very close to galle road garden area parking for 3 vehicles, 6 month advance agent free half month",Taksinarama road Mt Lavinia,4,4,"2,500.0 sqft",8.0 perches
8,New House For Rent In Mt Lavinia,20 Jul  8:12 am,"Mount Lavinia, Colombo","52,000",3 bedroom 2 bathroom and attached one common hall kitchen fully tiled Pantry no car park close to Galle road six month advance agent fee half month,Peiris road Mt Lavinia,3,2,"1,250.0 sqft",7.0 perches
9,House for Rent - Mount Lavinia,19 Jul  9:15 pm,"Mount Lavinia, Colombo","300,000",House for rent 7 bedrooms 5 bathrooms 6000 sqft 20 vehicles car parking galle road facing monthly rent 300000 advance 6 month half month broker fees please no brokers,galle road mount lavinia,7,5,"6,000.0 sqft",38.0 perches
10,Upstair Unit For Rent in Mount Lavinia,19 Jul  8:41 pm,"Mount Lavinia, Colombo","55,000",♤First Floor Unit.☆3 Bed Rooms ☆2 Bath Rooms.🚘No Parking.,Peeris Road Mt Lavinia,3,2,950.0 sqft,9.0 perches
11,02 Floor New House for Rent - Mount Lavinia,19 Jul  5:23 pm,"Mount Lavinia, Colombo","80,000",Fully tile 04 month advance new house 150 meter to galle road 02 attach bathroom 02 commen barthroom half month broker fee neded,watarappala road mountlavinia,3,3,"1,000.0 sqft",15.0 perches
12,House for Rent - Mt Lavinia,19 Jul  1:08 pm,"Mount Lavinia, Colombo","55,000","Two bedrooms fully tilled single storey house with attached bathroom at No 60/8A Templers Road Mt Lavinia .Monthly Rent of Rs.55,000/=  & 6 months advance.",2,2,"1,300.0 sqft",6.0 perches,
13,House for Rent in Mount Lavinia,19 Jul  2:13 pm,"Mount Lavinia, Colombo","70,000","First floor for rent in Mount Lavinia. 10 mitres to Galle road. Fully tiled. 5 bedrooms, 3 bathrooms, pantry. Close proximity to St.thomas college, Cargills, keels, arpico, burgerking, mc donalds, kfc, subway ect.",Mount Lavinia,5,7,"1,200.0 sqft",7.0 perches
14,House for Rent in Mt Lavinia,18 Jul 12:57 pm,"Mount Lavinia, Colombo","72,500",MODERN NEW HOUSE FOR RENTSumanarama Road Mt Lavinia ,37A Sumanarama Road Mt Lavinia,3,2,"1,800.0 sqft",3.0 perches
15,House for Rent in Mount Lavinia,17 Jul  8:34 am,"Mount Lavinia, Colombo","68,000","This newly renovated house is up for rent! with Spacious balcony/sitting area , 3 beds, 1 bath, living, kitchen & dining. It is situated in Mount Lavinia within close proximity to the Mount Lavinia railway station (10min. Walk) , Mount Lavinia junction (10 min walk), Nearest bus stop (5min walk). ",Mount Lavinia,3,1,"1,500.0 sqft",11.8 perches
16,Three Separate Unit Houses for Rent in Mount Lavania,18 Jul  3:29 pm,"Mount Lavinia, Colombo","220,000","3 seperate unit Houses for rent in Mount Lavania, 200m from the Galle Road. Suitable for Residence and Commercial purpose.",10,5,"3,300.0 sqft",7.0 perches,
17,House for Rent - Mount Lavinia,15 Jul  9:27 pm,"Mount Lavinia, Colombo","40,000",1Room with fully air-conditioned Ground floorSeperate entranceParking facilitiesSmall gardenKitchen with pantry cupboards 5months deposit ,mount lavinia,2,2,"1,100.0 sqft",6.0 perches
18,Two Storied Luxury House for Rent at Station Road Mount Lavinia,15 Jul  5:48 pm,"Mount Lavinia, Colombo","100,000","Two Storied luxury house at Station  road  Mount Lavinia with 4 bed rooms including Master bed room with a/c and Hot water facilities, Servant toilet included Easy access to Mount lavinia station, 255 bus route and 100 meter walk to super Markets and calm and quiet neighborhood!!!","30/2, Station road, Mount Lavinia.",4,3,"2,000.0 sqft",6.0 perches
19,Single Storeyed House with 4 Bed Rooms Is for Rent in - Mt Lavinia,15 Jul 10:03 am,"Mount Lavinia, Colombo","48,000","Single Storeyed, Fully Tiled House with Four Bed Rooms, Two Bath Rooms (one Attached Bathroom and One Servant Bathroom), and A Pantry Is for Rent. 150m to Galle Road.",4,2,"1,000.0 sqft",8.0 perches,
20,House for Rent in Mt Lavinia,15 Jul  5:55 am,"Mount Lavinia, Colombo","45,000",4 bedroom 2 bathroom large hall kitchen pantry fully tiled first floor facing huludagoda Road close to watrapola Masjid and galle 6 month advance agent fee half month,Huludagoda road Mt Lavinia,4,2,"2,200.0 sqft",8.0 perches
21,House For Rent In Mount Lavinia,14 Jul 11:41 am,"Mount Lavinia, Colombo","27,000","Hall , Two bedrooms , kitchen with bathroom.","No.19 Sri Dharmapala Road,Mount Lavinia",2,1,900.0 sqft,6.0 perches
22,House for Rent - Mount Lavinia,14 Jul  9:00 am,"Mount Lavinia, Colombo","45,000",Three bedroom two bathroom. Separate house with large garden. Parking space available. Close to the main road. Six months advance.,mount lavinia,3,2,"1,600.0 sqft",10.0 perches
23,2 Bedroom House Huludagoda Gardens,13 Jul  3:19 pm,"Mount Lavinia, Colombo","40,000","separate house with two rooms and 3 bathrooms in a calm area, fully tiled,inspections on prior Appointments only.NO Brokers, please",2,3,"2,000.0 sqft",6.0 perches,
24,House for Rent in Mount Lavinia,13 Jul  3:17 pm,"Mount Lavinia, Colombo","55,000","*** NO BROKERS*** Unfurnished House*** 3 Bedroom 2 Bathroom*** 1st floor *** Walking distance from Galle road*** Nearby Supermarkets, Schools, Resturants, etc...*** 4-month deposit*** Half Month Agent Fee",Mount lavinia,3,2,"1,600.0 sqft",6.0 perches
25,Ground Floor for Rent - mount Lavinia,13 Jul 10:22 am,"Mount Lavinia, Colombo","40,000",Fully tile parking 06 month advance half month broker fee neded,peres road mountlavinia,2,2,700.0 sqft,15.0 perches
26,Separate Brand New House for Rent - Mount Lavinia,13 Jul  8:39 am,"Mount Lavinia, Colombo","60,000",Fully tiled brand new 100 meter to galle road half month broker fee neded,galle road mount lavinia,4,4,800.0 sqft,18.0 perches
27,House For Rent in Mount Lavinia,12 Jul  2:30 pm,"Mount Lavinia, Colombo","38,000",Ground Floor House For Rent in Mount Lavinia,Mount Lavinia,2,1,800.0 sqft,10.0 perches
28,House for Rent Mount Lavinia,12 Jul  8:41 am,"Mount Lavinia, Colombo","75,000",Four bedroom three bathroom. Two storey house. Parking space available. Close to the main road. Six months advance.,Mount Lavinia,4,3,"2,600.0 sqft",8.0 perches
29,Luxury House for Rent - Mount Lavinia, 7 Jul 12:56 pm,"Mount Lavinia, Colombo","70,000",House for rent in Mount Lavinia 4 Bedrooms 3 Bathrooms Parking Good H Close to Galle rd Single upstair downstair houseResidential good area6 months advance Half months broker fees,Close to St Thomas College,4,3,"2,500.0 sqft",10.0 perches
30,Private House For Rent In Mt Lavinia,19 Jul 12:03 pm,"Mount Lavinia, Colombo","45,000",02 Story House for rent for Executive Boy's | Couple | Ladies. Can use as a Company Accommodations Too.,"Samudrasanna Road, Mount Lavinia",2,2,850.0 sqft,3.0 perches
31,House for rent in Mount Lavinia,11 Jul  3:18 pm,"Mount Lavinia, Colombo","50,000","*** NO BROKERS*** Unfurnished Brand new 1st floor House*** 2 Bedroom *** 2 Bathroom (1 attach 1 common )*** 500m from Galle road*** Nearby Supermarkets, Schools, Resturants, etc...*** prefer for Maldivians and locals*** Half Month Agent Fee",Mountclavinia - Peris road,2,2,"1,800.0 sqft",6.0 perches
32,Furnished House For Rent in Mt Lavinia,11 Jul  3:01 pm,"Mount Lavinia, Colombo","95,000",♤Furnished Modern House For Rent in    Mount Lavinia Near US Car Sale.☆2 Bed Rooms.☆2 Bath Rooms.☆A/C For Master Bed Room.☆Garden. 🚘Parking Available.,Galle Road Mount Lavinia,2,2,"1,500.0 sqft",10.0 perches
33,House for Rent in Mount Lavinia,11 Jul  9:44 am,"Mount Lavinia, Colombo","28,000",One large bedroom. One bathroom. Separate entrance house. Parking space available. Includes electricity and water 28000.three months advance. Close to the jayawardanapura faculty rathmalana.,mount lavinia,1,1,"1,000.0 sqft",6.0 perches
34,Mount Lavinia - House for Rent,11 Jul  9:43 am,"Mount Lavinia, Colombo","75,000",Four bedroom three bathroom. Two storey house. Parking space available. Servants rooms and bathroom. Small garden in back side. Close to the main road and st thomas school. Six months advance.,Hotel road,4,3,"3,400.0 sqft",8.0 perches
35,5 Bed Roomed New House for Rent- Mount Lavinia,10 Jul 12:13 pm,"Mount Lavinia, Colombo","150,000",5 Bed roomed new house for RENT- Mount Lavinia ,Dehiwala,5,5,"3,200.0 sqft",8.0 perches
36,Separate House for Rent Mount lavinia,10 Jul 10:05 am,"Mount Lavinia, Colombo","35,000",Tile parapot wall half month broker fee neded 06 month advance,dakshinarama road mountlavinia,3,2,700.0 sqft,15.0 perches
37,Property for rent Mount Lavinia, 9 Jul  6:06 pm,"Mount Lavinia, Colombo","45,000",Next to Templers road. Less than 200m to Aththidiya junction. 1st floor with large hall. One bathroom inside and one outside. Parking available. Currently there's a zumba class. More suitable for an office or similar.,1,1,"1,000.0 sqft",6.0 perches,
38,First Floor for Rent in - Mount Lavinia,12 Jul 10:01 am,"Mount Lavinia, Colombo","30,000",⛔ Please note that this ad is posted by an agent ( broker ) and half-month rent will be charged as service charges:,Mount Lavinia,2,1,900.0 sqft,10.0 perches
39,Private House For Rent In Mt Lavinia,19 Jul 12:03 pm,"Mount Lavinia, Colombo","45,000",02 Story House for rent for Executive Boy's | Couple | Ladies. Can use as a Company Accommodations Too.,"Samudrasanna Road, Mount Lavinia",2,2,850.0 sqft,3.0 perches
40,"HOUSE FOR RENT – Sirimal Uyana, Ratmalana", 9 Jul  1:52 pm,"Mount Lavinia, Colombo","75,000",•	Fully tiled 2800 square feet house for rent in a highly residential area off Templers Road,"Sirimal Uyana, Off Templers Road",4,2,"2,800.0 sqft",29.0 perches
41,House for Rent in Mount Lavinia, 9 Jul 10:48 am,"Mount Lavinia, Colombo","45,000",♤Brand New Second Floor Unit ☆2 Bed Rooms With Attach Bath    Rooms.☆Kitchen With Small Pantry.,Vihara Mawatha Mount Lavinia,2,2,850.0 sqft,6.0 perches
42,House for Rent in - Mount Lavinia, 9 Jul 12:17 pm,"Mount Lavinia, Colombo","20,000",House for Rent in Mount Lavinia==========================,"6/7A, Watarappola Road, Mount Lavinia",1,1,450.0 sqft,2.0 perches
43,Upstair Unit for Rent in Mt Lavinia, 9 Jul 10:00 am,"Mount Lavinia, Colombo","60,000",♤Brand New First Floor Unit. ☆3 Bed Rooms With Attach Bath    Rooms.☆Kitchen With Pantry.☆1 Small Parking.,Vihara Mawatha Mount Lavinia,3,3,"1,300.0 sqft",6.0 perches
44,"House for Rent- Vihara Road, Mount Lavinia", 8 Jul  2:35 pm,"Mount Lavinia, Colombo","40,000","2 Bed roomed 2nd floor house for RENT- Vihara Road, Mount Lavinia ",Mount Lavinia,2,2,900.0 sqft,7.0 perches
45,House for Rent - Mont Lavinia, 8 Jul  2:34 pm,"Mount Lavinia, Colombo","50,000",Mont Lavinia alwis rd3 room2 bathroom1 st floor,3,2,"1,100.0 sqft",6.0 perches,
46,"4 Bed Roomed 1st Floor House for Rent- Vihara Roada, Mount Lavinia", 8 Jul  2:32 pm,"Mount Lavinia, Colombo","60,000","4 Bed roomed 1st floor house for RENT- Vihara Roada, Mount Lavinia ",Mount Lavinia,4,3,"1,800.0 sqft",7.0 perches
47,"3 bed Roomed Ground Floor House for Rent- Vihara Road, Mount Lavinia", 8 Jul  2:28 pm,"Mount Lavinia, Colombo","60,000","3 Bed roomed Ground floor house for RENT- Vihara Road, Mount Lavinia ",Mount Lavinia,3,3,"1,600.0 sqft",7.0 perches
48,Two Story House for Rent in Mt Lavinia, 8 Jul 12:54 pm,"Mount Lavinia, Colombo","55,000",fully tiled two story house. available parking.  6 months advance and half of month broker fee is applicable.,"Alwis rd, mt.lavinia",3,2,"1,500.0 sqft",10.0 perches
49,Brand New Super Luxury House for Rent in Mt Lavinia, 8 Jul  6:49 am,"Mount Lavinia, Colombo","114,000",4 bedroom with attached bathroom large hall modern kitchen fully tiled car park remote Gate 3 storey architect design house brand new 25 feet Wide Road facing 800 metres from galle Road high residential area two bedroom with air condition 6 month advanced agent fee half month,Alvis Place Mt Lavinia,4,4,"2,500.0 sqft",6.0 perches
50,House for rent - Rathmalana, 7 Jul 11:39 pm,"Mount Lavinia, Colombo","48,000",One storied luxury house for rent with the below mentioned facilities.- 3 bedrooms - 1 master bedroom with attached bathroom - 2 bathrooms- Front garden and a backyard- Garage available- 20ft road- 500m to the Galle road,"Thelawela road, 2nd lane, Rathmalana",3,2,"2,178.0 sqft",8.0 perches
51,House for Rent Attidiya, 7 Jul  5:15 pm,"Mount Lavinia, Colombo","38,000",Near 100m Aththidiya Main RoadUpstair New House Vehicle Parking Fully Tiled,"No. 25/2, 3rd Lane, Parakum Mawatha, Aththidiya",4,2,"1,760.0 sqft",10.0 perches
52,Separate House for Rent - Boralasgamuwa, 7 Jul  2:39 pm,"Mount Lavinia, Colombo","50,000",Hall tile 06 month advance parking half month broker fee neded 300 meter to 120 bus root,katuwawala road boralasgamuwa,3,2,900.0 sqft,20.0 perches
53,Upstair Unit for Rent in Mt Lavinia, 7 Jul  2:14 pm,"Mount Lavinia, Colombo","50,000","Upstair unit with all separate facilities and entrance. 200m from Galle Road, with walking distance to STC/ KFC / Cargills / Keells / Family Super and Mount junction. 1 master bedroom, 2 bedrooms, 1 bathroom, 1 Pantry, 1 living area, 1 large front balcony overlooking a large front lawn, 1 rear balcony overlooking back yard and 1 servants toilet. Water with overhead tank, all KDK ceiling fans and SLT fixed line.","Siri Gunarathna Mawatha, Mt Lavinia",3,1,"2,500.0 sqft",25.0 perches
54,House for Rent in - Mount Lavinia, 6 Jul  3:54 pm,"Mount Lavinia, Colombo","55,000","Semi Furnished House for rent at Beach Road, Mount Lavinia3 bathrooms with 3 attached bathroomsfully tiled and equipped with ceiling fansseparate water and electricity.","29A, Beach Road, Mount Lavinia",3,3,"1,090.0 sqft",4.5 perches
55,05 Room House for Rent Mountlavinia, 6 Jul  3:05 pm,"Mount Lavinia, Colombo","100,000",Fully tile parking 06 month advance half month  broker fee neded,kalapura temlers road mountlavinia,5,3,"1,000.0 sqft",20.0 perches
56,Private House For Rent In Mt Lavinia,19 Jul 12:03 pm,"Mount Lavinia, Colombo","45,000",02 Story House for rent for Executive Boy's | Couple | Ladies. Can use as a Company Accommodations Too.,"Samudrasanna Road, Mount Lavinia",2,2,850.0 sqft,3.0 perches
57,5 BR/ Furnished House For Rent Near Galle Rd Mt Lavinia, 2 Jul  8:23 pm,"Mount Lavinia, Colombo","65,000",Furnished 1st floor House near  galle rd5 bedrooms 3athrooms  Halle kitchen balcony Walking distance to St Thomas College6 months advance Half months broker fees,100m to Arpico . Near Galle Rd .,5,3,"1,345.0 sqft",9.0 perches
58,House for Rent in - Mount Lavinia,13 Jul  2:18 pm,"Mount Lavinia, Colombo","40,000",5 Months AdvanceGround FloorSeparate Water and Electricity,Watarappala Road Mount Lavinia,2,1,670.0 sqft,6.0 perches
59,House for Rent Mount Lavinia, 6 Jul 10:13 am,"Mount Lavinia, Colombo","45,000",Three bedroom. Two bathrooms. Close to the main road. Parking space available. Four months advance.,mount lavinia,3,2,"1,300.0 sqft",20.0 perches
60,New House for Rent (1st Floor) in Mount Lavinia,10 Jul 12:37 pm,"Mount Lavinia, Colombo","68,000","Newly constructed residential building first floor for Rent, fully tiled all rooms, Living Hall, 4-bedrooms with air condition and One Master bedroom with a hot water system, Kitchen with pantry, and 3 bathrooms. You just need to come with your things. No household items Private entrance and parking space are available.   The building is situated in a peaceful and good neighborhood area. ","1st templer mawatha, Mount Lavinia",4,3,"1,000.0 sqft",9.0 perches
61,House For Rent (Upstair - Unfurnished) In Mount Lavinia,14 Jul  1:48 pm,"Mount Lavinia, Colombo","45,000",MOUNT LAVINIA UPSTAIR  HOUSE FOR RENT,"No. 11 Terrance Avenue, Mount Lavinia",2,1,"2,000.0 sqft",8.0 perches
62,House with garden & parking for Rent Mount Lavinia, 4 Jul  6:43 pm,"Mount Lavinia, Colombo","25,000",House for RentGarden - Pet friendlyParking availableSmall sitting areaSemi furnishedKitchenetteAttached bathroom,"Vijaya Road, Mount Lavinia",1,1,500.0 sqft,7.0 perches
63,Upstairs House for Rent Mt.Lavinia, 4 Jul  3:38 pm,"Mount Lavinia, Colombo","75,000",fully tiled upstairs house with full  furniture. A/C bedrooms. 6 months advance and half of month broker fee is applicable.,"galwala rd, mt.lavinia",3,3,"1,500.0 sqft",10.0 perches
64,Brand New House for Rent in Mount Lavinia, 4 Jul  3:43 pm,"Mount Lavinia, Colombo","65,000",Brand New  House for rent in Mount Lavinia=================================,No 8 Vihara Road Mount Lavinia,3,3,"1,800.0 sqft",6.5 perches
65,Downfloor House for Rent - Mt.Lavinia, 4 Jul  3:22 pm,"Mount Lavinia, Colombo","70,000",fully tiled downfloor house  with full furniture. one A/C room. available parking.,mt.lavinia,2,3,"1,500.0 sqft",10.0 perches
66,House for Rent - Mt.Lavinia, 4 Jul  2:48 pm,"Mount Lavinia, Colombo","50,000",fully tiled downfloor house. available parking. 6 months advance and half of month broker fee is applicable.,"gunarathena rd, mt.lavinia",3,2,"1,500.0 sqft",10.0 perches
67,House for Rent in Mount Lavinia, 3 Jul 10:51 am,"Mount Lavinia, Colombo","60,000","*** NO BROKERS*** Unfurnished House*** 3 Bedroom 2 Bathroom*** 1st floor *** Walking distance from Galle road*** Nearby Supermarkets, Schools, Resturants, etc...*** 4-month deposit*** Half Month Agent Fee",Mount lavinia,3,2,"1,950.0 sqft",6.0 perches
68,5 BR/ Furnished House For Rent Near Galle Rd Mt Lavinia, 2 Jul  8:23 pm,"Mount Lavinia, Colombo","65,000",Furnished 1st floor House near  galle rd5 bedrooms 3athrooms  Halle kitchen balcony Walking distance to St Thomas College6 months advance Half months broker fees,100m to Arpico . Near Galle Rd .,5,3,"1,345.0 sqft",9.0 perches
69,Luxury House for Rent Mount Lavinia, 2 Jul 10:12 am,"Mount Lavinia, Colombo","45,000",3 Bedrooms.2 Bathrooms.Large Hall.Peaceful Surroundings.Upstair unit (1st floor).Newly built house with modern pattern.Located in Attidiya Bakery Junction.,mount lavinia,3,2,"1,350.0 sqft",10.0 perches
70,Two Story House for Rent Mt. Lavinia, 1 Jul  7:11 pm,"Mount Lavinia, Colombo","100,000","fully tiled brand new two story house. remote gate, available parking. 6 months advance and half of month broker fee is applicable.","mt.lavinia junction, mt. lavinia",5,4,"2,000.0 sqft",10.0 perches
71,Downfloor House for Rent - Mt.Lavinia, 1 Jul  5:08 pm,"Mount Lavinia, Colombo","30,000","fully tiled downfloor house, available parking 6 months advance and half of month broker fee is applicable.","Templers rd,Mount Lavinia",2,1,"1,000.0 sqft",8.0 perches
72,House For Rent - Mount Lavinia, 1 Jul  4:42 pm,"Mount Lavinia, Colombo","30,000","2 Bedroom, 2 Bathroom, 2 hall, kitchen. 1st floor house with separate entrance. 450 metre from galle road.","Hena Road, Mount Lavinia",2,2,"1,500.0 sqft",11.0 perches
73,House for Rent Mount Lavinia,16 Jul  9:56 am,"Mount Lavinia, Colombo","50,000",3 Bedrooms3 BathroomsTwo story houseThere are 2 separate entrances.Kitchen with pantry cupboards.6 Months Advance,mount lavinia,3,3,"2,700.0 sqft",12.0 perches
74,House for Rent in Mt Lavinia,15 Jul  2:16 pm,"Mount Lavinia, Colombo","110,000",Opposite Siddhalepa hospital =commercial valuable house,"Temples Road ,Mount Lavinia",5,4,"2,500.0 sqft",8.8 perches
75,Separate House for Rent at - Mount Lavinia,12 Jul 10:04 am,"Mount Lavinia, Colombo","80,000",⛔ Please note that this ad is posted by an agent ( broker ) and half-month rent will be charged as service charges:,Mount Lavinia,3,2,"1,200.0 sqft",10.0 perches
76,First-Floor for Rent at - Mount Lavinia,12 Jul 10:05 am,"Mount Lavinia, Colombo","40,000",⛔ Please note that this ad is posted by an agent ( broker ) and half-month rent will be charged as service charges:,Templers Rd,1,1,900.0 sqft,10.0 perches
77,Luxury House For Rent in Mount Lavinia,17 Jul  4:22 pm,"Mount Lavinia, Colombo","75,000",All rooms are fully A/C. Seperate entrance. Kitchen with pantry cupboards. 5months depositNewly Built house Luxury. ,"Templer's road, Mount Lavinia",4,3,"2,750.0 sqft",10.0 perches
78,House for Rent - Mount Lavinia,30 Jun  9:52 am,"Mount Lavinia, Colombo","40,000",Two bedroom two bathroom. Down floor. Parking space available. One room with a/c. Six months advance.,mount lavinia,2,2,"1,200.0 sqft",6.0 perches
79,House for rent - Mount Lavinia Hotel Road,16 Jul  4:21 pm,"Mount Lavinia, Colombo","90,000","Fully furnished 1st floor house with 3 bedrooms, Main room  with En-suite and AC. The other 2 rooms with 1 common toilet and fans installed. Fully furnished with 3 x Queen beds in all rooms and wardrobes. Fridge, washing machine, cooking facilities. It has a rooftop garden with Colombo city and beach views. Next to St Thomas college. Ideal for foreigners or expats. 5 minutes walk to railway station and famous mount hotel.",3,2,"2,000.0 sqft",7.0 perches,
80,House Upstairs for Rent in Mt Lavinia, 8 Jul  6:00 pm,"Mount Lavinia, Colombo","55,000","House upstairs Rent in Mt Lavinia 3b, 2 bath, Rent Rs 55,000/ per month make and earlier appointment",Mount Lavinia,3,2,"2,000.0 sqft",7.0 perches
81,Single /separate House Rent in Attidya Mt Lavinia, 2 Jul  9:39 am,"Mount Lavinia, Colombo","35,000",Single House for rent near  to attidiya rd n Templars rd2 Bedrooms 2 Bathroom N condition Hallkitchen parking Garden right round wall6 months advance Half months broker fee,Attidya near bakery junction,2,2,"1,000.0 sqft",7.0 perches
82,House for Rent - Mount Lavinia,29 Jun  8:28 am,"Mount Lavinia, Colombo","85,000",Four bedroom two living room. With A/C. and hot water. Close to galle road. Parking available. Advance six months,mount lavinia,4,3,"2,250.0 sqft",10.0 perches
83,Single /separate House Rent in Attidya Mt Lavinia, 2 Jul  9:39 am,"Mount Lavinia, Colombo","35,000",Single House for rent near  to attidiya rd n Templars rd2 Bedrooms 2 Bathroom N condition Hallkitchen parking Garden right round wall6 months advance Half months broker fee,Attidya near bakery junction,2,2,"1,000.0 sqft",7.0 perches
84,Luxury House for Rent - Mount Lavinia, 7 Jul 12:56 pm,"Mount Lavinia, Colombo","70,000",House for rent in Mount Lavinia 4 Bedrooms 3 Bathrooms Parking Good H Close to Galle rd Single upstair downstair houseResidential good area6 months advance Half months broker fees,Close to St Thomas College,4,3,"2,500.0 sqft",10.0 perches
85,2 Room Unfurnished for Rent - Mount Lavinia,28 Jun  7:57 pm,"Mount Lavinia, Colombo","55,000",Mount Lavinia down Peris road 2 room1 bathroomUnfurnished ground floor fully tiled,2,1,"1,000.0 sqft",5.0 perches,
86,5 Bed roomed new house for RENT- Mount Lavinia,28 Jun 11:53 am,"Mount Lavinia, Colombo","150,000",5 Bed roomed new house for RENT- Mount Lavinia ,Mount Lavinia,5,5,"3,200.0 sqft",8.0 perches
87,House for Rent in Mount Lavinia,30 Jun  9:44 am,"Mount Lavinia, Colombo","45,000",House for Rent in Mount Lavinia====================,"Pansala Road, Mount Lavinia",4,3,"2,500.0 sqft",10.5 perches
88,Single House for Rent in Mt Lavinia, 8 Jul  6:00 pm,"Mount Lavinia, Colombo","85,000","Single House Rent in Mount Lavinia 4 bedrooms 4 bathrooms, car parks, walking distance to Galle Rd,  suitable for office too,  Rent per month Rs 85,000/ make and earlier appointment",Mount Lavinia,4,4,"2,000.0 sqft",10.0 perches
89,House for Rent in Mount Lavinia,18 Jul 10:57 pm,"Mount Lavinia, Colombo","40,000","Small compact house with two bed rooms with one A/c room, two bathrooms, pantry, hall, kitchen with parkuing, walking distance to galle road, privena road, mt lavinia. Suitable for working executives, small family etc",2,2,"1,300.0 sqft",6.0 perches,
90,Annex for rent mount lavinia.,26 Jun 11:51 am,"Mount Lavinia, Colombo","25,000","#Alwis road,mount lavinia.25000 rent per month..6 months deposit...#Suitable for small family",1,1,500.0 sqft,15.0 perches,
