,0,1,2,3,4,5,6,7
0,title,posted date,location,price,description,Property type:,Address:,Size:
1,Office Space for Rent Rajagiriya,15 Jul 12:26 pm,"Rajagiriya, Colombo","280,000",Office Space for Rent in Rajagiriya 1500sqft or 3000sqftAvailable with or without partition,Office,Rajagiriya,"3,000 sqft"
2,"['Office Space for Rent Rajagiriya', '15 Jul 12:26 pm', 'Rajagiriya, Colombo', '280,000', 'Office Space for Rent in Rajagiriya 1500sqft or 3000sqftAvailable with or without partition', 'Office', 'Rajagiriya', '3,000 sqft']","['title', 'posted date', 'location', 'price', 'description', 'Property type:', 'Address:', 'Size:']",,,,,,
3,Commercial Office Space Available for Rent - Rajagiriya,15 Jul  2:04 pm,"Rajagiriya, Colombo","420,000","1. Ideal for IT Companies and Back Offices etc 2. Located in Rajagiriya luxury brand new Jana Jaya City Complex near the flyoverTotal 2019 Sq feet or customised according to the required smaller areas (Eg 400Sq Feet each).   3. Three months refundable deposit with only monthly pay as you go. 4. Willing to customize the partitions and furniture as per your requirements 5. Fully furnished Tables / Chairs/ Light fittings from UK 6. Serviced Pantry, Central AC, CCTV, Lease Line WIFI, Designated land number 7. Sign Board at the entrance, Unlimited underground car park 8.Elevator and Generator facilities available.",Office,"9th Floor, Jana Jaya Building, Rajagiriya","2,019 sqft"
4,Office space Rajagiriya,20 Jul 10:04 pm,"Rajagiriya, Colombo","75,000",Office space available in my town in Rajagiriya. Situated in road facing. Separate entrance.With tempered glass and segregates.,Office,750 sqft,
5,Space for A Shop or Office - Rajagiriya,15 Jul 10:06 pm,"Rajagiriya, Colombo","17,000","For a office or a shop in Rajagiriya RoadFront view - fully glass 100M to Hewawitharana collegeBoth residential and commercial areaSeperate electricity and waterAdjoining two story house also for rent.., ",Shop,"120, Rajagiriya Road, Rajagiriya",130 sqft
6,Commercial Office Space Available for Rent - Rajagiriya,15 Jul  2:04 pm,"Rajagiriya, Colombo","420,000","1. Ideal for IT Companies and Back Offices etc 2. Located in Rajagiriya luxury brand new Jana Jaya City Complex near the flyoverTotal 2019 Sq feet or customised according to the required smaller areas (Eg 400Sq Feet each).   3. Three months refundable deposit with only monthly pay as you go. 4. Willing to customize the partitions and furniture as per your requirements 5. Fully furnished Tables / Chairs/ Light fittings from UK 6. Serviced Pantry, Central AC, CCTV, Lease Line WIFI, Designated land number 7. Sign Board at the entrance, Unlimited underground car park 8.Elevator and Generator facilities available.",Office,"9th Floor, Jana Jaya Building, Rajagiriya","2,019 sqft"
7,Commercial Building for Lease at Rajagiriya – Available from June 2019,15 Jul  1:44 pm,"Rajagiriya, Colombo","750,000",Proposed Commercial Building for Lease at Rajagiriya – Available from June 2019,Building,"6,900 sqft",
8,Office Space for Rent Rajagiriya,15 Jul 12:26 pm,"Rajagiriya, Colombo","280,000",Office Space for Rent in Rajagiriya 1500sqft or 3000sqftAvailable with or without partition,Office,Rajagiriya,"3,000 sqft"
9,Office Space Rent Rajagiriya,13 Jul  6:58 pm,"Rajagiriya, Colombo","40,000",Office space rent jana jaya city 140 sqft,Office,rajagiriya,140 sqft
10,9BR 3 Storied Building with 15 Car Park Rajagiriya,17 Jul 11:00 am,"Rajagiriya, Colombo","380,000","* - This office permission has more than 15 Car Parks with 14,000 Square Feet.",Office,Nawala Rajagiriya Road,"12,000 sqft"
11,Warehouse | for Lease Rajagiriya - R0553,11 Jul  9:35 pm,"Rajagiriya, Colombo","1,400,000",Warehouse | For Lease | Rajagiriya,Warehouse / Storage,"23,000 sqft",
12,Shop for Rent in Ragagiriya,10 Jul  1:08 pm,"Rajagiriya, Colombo","35,000",Shop for rent in Ragagiriya sutable for saloon or office,Shop,rajagiriya,800 sqft
13,Commercial Property for Rent - Jana Jaya City Rajagiriya, 9 Jul  9:42 am,"Rajagiriya, Colombo","1,500,000","JANA JAYA CITY - RAJAGIRIYARajagiriya lies between the administrative capital of Kotte and the commercial capital of Colombo city. To the east is Borella (Colombo and to the west is the main administrative hub of Sethsiripaya) The main Parliament Road that connects the city to the government offices and Parliament area is the main route in and out of Rajagiriya. Local economy and infrastructureThe Parliament road which connects the administrative capital and the commercial capital is regarded as the VVIP roadway in Sri Lanka and enjoys a high level of maintenance throughout the year due to its frequent use by senior parliamentarians and foreign dignitaries. The connecting bridge on this stretch was recently up-graded and the area is a recreation hub of wet-land parks, jogging tracks and park benches. The Diyawannawa River is also a seaplane port that connects domestic aircrafts covering many parts of the island.In terms of schools, Kotte hosts the island’s leading International School – Overseas International School. This school is popular amongst the diplomats and senior foreign consultants and country directors who work in Sri Lanka. Whilst transport to and from this school can take up to one hour from Colombo during the school traffic peak times, this school is within easy reach of Rajagiriya. During our research, we have found several foreign consultants moving out of luxury apartments in Colombo and moving into Kotte in order to be close to the school. OutlookIn conclusion, we can note that Rajagiriya in particular and Kotte in general offer residents a much more ‘homely’ atmosphere as compared to Colombo where the market is saturated and there are issues of heavy traffic congestion. The apartments in this area are popular amongst families with children, and senior citizens, both expatriates and locals. It’s also an extremely green environment that has public walk-ways, water sports and markets.DESCRIPTION OF JANAJAYA CITY, 11th FLOOR– RECOMMENDED SITE TO ESTABLISH A RESTAURANTTotal floor area		:	6520 Sq.Ff. (Including both side terrace area)Restaurant area			4993 Sq.ft.Swimming pool		:	70ft x 20ftPool deck		:	56.4ft x 9.9ftParking for 8 vehicles in the reserved area for parking (in the night there are enough of parking space available along the road)Separate elevator has fixed only to go to rooftopInterior has not done but pipe fittings has done according to restaurant concept.Lease amount Rs.1.5 Million per month",Restaurant,"6,520 sqft",
14,5000 Sqf & 3 Storey House for Rent in Buthgamuwa Road Rajagiriya ., 9 Jul 12:54 am,"Rajagiriya, Colombo","425,000","රාජගිරියේ සිට කිලෝමීටර් 2ක් පමණ දුරින් බුත්ගමුව ප්‍රධාන පාරට මුහුනත අඩි 100ක් පමණ ඇති පර්චස් 20ක ඉඩමේ  කන්ටේනර් ඇතුලුවීමට හැකි ලෙස  ආවරණය  කර ඉදිකළ  වර්ගඅඩි 3750 ක පමණ  විශාල ප්‍රමාණයේ ශාලාවක් සමගින් ,වර්ගඅඩි 3000ක පමණ කාමර 3ක නාන කාමර 2ක් සහිත  තෙමහල් අංගසම්පූර්ණ නිවස ද ,කාමර 2ක්  නාන කාමර 2ක් සහිත ව්‍යාපාරික ස්ථානය ද ,කාමර 2ක්  නාන කාමරයක්  සහිතව  දෙමහල්  ව්‍යාපාරික ස්ථානය 2ක් ද  ඇතුලුව සියලුම  ව්‍යාපාරික ස්ථාන මාසික කුලිය 425000 ගනනේ කුලියට දීමට බලාපොරොත්තු වේ .මාසික කුලිය 250000 ගනනේ කොටස් 2ක් ලෙසින් ද  දීමට හැකියාව ඇත .විෂේශයෙන්  වාහන විකිණීමේ  ප්‍රදර්ශනාගාරයක් හා  අමතර කොටස්  අලෙවිකරණ ව්‍යාපාරයකට ඉතාමත් සුදුසුම  ස්ථානයකි .ඕනෑම ව්‍යාපාරයකට  හෝ කාර්යාලයකට වුවද සුදුසු ස්ථානයකි .කරුණාකර තැරව්කරුවන් අමතන්න එපා .ස්ථානය පරීක්ෂා කිරීමෙන් පසුව මිල සාකච්ඡා කල හැක .සත්‍ය ගැනුම්කරුවන් සදහා පමණයි .ස්ථානය පරීක්ෂා කිරීම සදහා සාකච්ඡා කර කලින් වෙලාවක් වෙන්කර ගන්න .************ස්තුතියි ************",Building,BUTHGAMUWA  ROAD RAJAGIRIYA .,"5,000 sqft"
15,Building For Rent Rajagiriya, 5 Jul 11:37 am,"Rajagiriya, Colombo","400,000",Colombo 8 Rajagiriya Building for rent Guest House 16 Rooms & Bathrooms Commercial Building 400000.00 Monthly rental 5 Parking,Building,Colombo 8 Rajagiriya,"4,000 sqft"
16,Shop / Office For Rent in Rajagiriya, 6 Jul  1:47 pm,"Rajagiriya, Colombo","55,000","රාජගිරිය, නාවල පාර නගර සභාවට ඉදිරියෙන්වර්ග අඩි 950 බැගින් යුතුඋඩුමහල් නිවාසය බදු දීමට ඇත.කාමර 2බාත්රූම් 2පැන්ට්‍රි කබඩ්සාලය සම්පූර්ණ ටයිල් කරඇත.මාසිකව 55,000/=මාස 4 අත්තිකාරම්",Shop,"Nawala Road, Rajagiriya",950 sqft
17,750 SQ Shop Rent - Rajagiriya,30 Jun  6:29 pm,"Rajagiriya, Colombo","65,000",* - This office permission is excellent place for Saloon or Office Place,Building,Nawala Rajagiriya- Facing 35 Feet Road,750 sqft
18,Office Space for Rent in Rajagiriya (1056 B),30 Jun 12:03 pm,"Rajagiriya, Colombo","125,000",Two story houseEghit rooms house with two open hall 3000,Office,CLOSE TO PARK LANE,"3,000 sqft"
19,Building Store for Rent Rajagiriya,28 Jun  2:57 pm,"Rajagiriya, Colombo","290,000","Building in Rajagiriya for Long term lease or rent : 5000 sq ft G+2 newer curtain glass fronted building 12 car parking with 7 covered parking slots available. Expected rent Rs 290,000. Central location and ideal for Office/Stores/Distribution centre or Garment Factory. (Container trucks accessible)",Building,Rajagiriya (Arunodaya Mawatha),"5,000 sqft"
20,Indian Restaurant - Rajagirya,28 Jun 10:45 am,"Rajagiriya, Colombo","575,000","Currently running Indian Restaurant for Sale with all kitchen equipment's,Furniture, Computer billing system, Plates, cutleries, deep fridge, Delivery bikes (2) , air conditioners (5), Kitchen Exhaust fans Etc.. Located in road facing area at Rajagiriya with 5 to 6 dedicated car parking and many shall be parked on road side.currently Indian franchise restaurant is running with the good customer database. Kindly serious buyers can approach us by email or call.Selling of the restaurant business due to the migration of the Owner.",Restaurant,"3,500 sqft",
21,Shop or Office - Rajagiriya,29 Jun  2:25 am,"Rajagiriya, Colombo","20,000",In Kalapaluwawa  rajagiriya 150/152 bus road.100m to kalapaluwawa keels super.,Shop,350 sqft,
22,"Shop/office spaces for rent in Jana Jaya City, Rajagiriya", 4 Jul  2:16 pm,"Rajagiriya, Colombo","35,000","Shop/office spaces for rent in Jana Jaya City, Rajagiriya.",Office,210 sqft,
23,Office Building & Store for Rent in Rajagiriya,19 Jun  3:39 pm,"Rajagiriya, Colombo","450,000","රාජගිරිය බුත්ගමුව පාරට මුහුණලා වර්ග අඩි 3000 ගොඩනැගිල්ල, වර්ග අඩි 4500කින් යුතු කන්ටේනර් ඇතුලු කළ හැකි ගබඩාව සහ එයට යාබදව ඇති වර්ග අඩි 2000කින් යුක්ත දෙමහල් ගොඩනැගිල්ල සම්පූර්ණව කුලියට හෝ දීර්ඝ කාලීන වශයෙන් බදු දීමට ඇත",Building,"9,500 sqft",
24,Shop and Annex for Rent In - I.D.H Junction,19 Jun  9:17 am,"Rajagiriya, Colombo","30,000",Facing I.D.H Rajagiriya Main road (Close to I.D.H Junction)Ground Floor for a Shop2nd Floor for AnnexNext to Commercial Bank ATMIn font of the Bus StopSuitable for any Business or OfficeCall for More Details,Building,500 sqft,
25,Workshop Venue Office Space in Colombo Rajagiriya,13 Jul  3:07 pm,"Rajagiriya, Colombo","10,000",VENUE FOR HIRE IN RAJAGIRIYA COLOMBO FOR CLASSES | WORKSHOPS | SEMINARS | MEETINGS | DISCUSSIONS...,Other,700 sqft,
26,Shop /office for Rent in Rajagiriya,11 Jun  2:08 pm,"Rajagiriya, Colombo","35,000","6 months Advance,please call for more details",Shop,Rajagiriya,250 sqft
27,Building for Rent in Rajagiriya,11 Jun  2:04 pm,"Rajagiriya, Colombo","125,000","2 story Building,6 months Advance,Please call for more details",Building,Rajagiriya,"2,000 sqft"
28,Warehouse/Car Rent In Rajagiriya,19 Jul  2:27 pm,"Rajagiriya, Colombo","800,000","Main road facing Most suitable to car sale,out door sale items,storage, shop30 ft road 1.5km Nawala junction 700m to rajagiriya 3 car parking",Warehouse / Storage,Rajagiriya,"15,000 sqft"
29,Commercial Office Space Available for Rent - Rajagiriya,15 Jul  2:04 pm,"Rajagiriya, Colombo","420,000","1. Ideal for IT Companies and Back Offices etc 2. Located in Rajagiriya luxury brand new Jana Jaya City Complex near the flyoverTotal 2019 Sq feet or customised according to the required smaller areas (Eg 400Sq Feet each).   3. Three months refundable deposit with only monthly pay as you go. 4. Willing to customize the partitions and furniture as per your requirements 5. Fully furnished Tables / Chairs/ Light fittings from UK 6. Serviced Pantry, Central AC, CCTV, Lease Line WIFI, Designated land number 7. Sign Board at the entrance, Unlimited underground car park 8.Elevator and Generator facilities available.",Office,"9th Floor, Jana Jaya Building, Rajagiriya","2,019 sqft"
30,Office Space for Rent Rajagiriya,15 Jul 12:26 pm,"Rajagiriya, Colombo","280,000",Office Space for Rent in Rajagiriya 1500sqft or 3000sqftAvailable with or without partition,Office,Rajagiriya,"3,000 sqft"
31,Shop for rent in rajagiriya main road facing,19 Jul  2:27 pm,"Rajagiriya, Colombo","50,000",30 ft road access 1km to rajagiriya junction 1.2 km to kolonnawa junction Roller shatter gate2 car parking,Shop,Obesekarapura road rajagiriya,800 sqft
32,Office Space for Rent in Rajagiriya,19 Jul  2:27 pm,"Rajagiriya, Colombo","35,000",40ft road access 2 car parking With A/C 100m to Rajagiriya junction,Office,Rajagiriya main road,750 sqft
33,Commercial Property for Rent at - Polgasowita, 8 Jun 11:49 am,"Rajagiriya, Colombo","75,000","An Approximately 2500 Sq. Foot Commercial Property at Wethara Junction, Facing the Southern Expressway Access Route (120 Bus Route), with Parking Facilities, Is Available for Long Term Lease at 75,000 Lkr per Month (negotiable).",Building,"132, Wethara, Polgasowita","2,500 sqft"
34,Office Space for Rent in - Rajagiriya, 5 Jun  4:55 pm,"Rajagiriya, Colombo","39,000",Office Space for Rent in Rajagiriya==========================,Office,"75, Medawelikada Road, Rajagiriya",500 sqft
35,Office Space for Rent in - Rajagiriya, 5 Jun  4:43 pm,"Rajagiriya, Colombo","62,000",Office Space for Rent in Rajagiriya==========================,Office,"997/41, Park Lane, Welikada, Rajagiriya","1,600 sqft"
36,Shop and Office Space for Rent / Lease at Rajagiriya, 8 Jun  2:36 pm,"Rajagiriya, Colombo","30,000","Shop & Office space available at Jana Jaya City, RajagiriyaShopping mall Brand new buildingWith all facilities* Escalators* Lifts* A/C* Smoke sensors* Security / CCTV* Spacious car park* Swimming pool* Cinema* Food court",Shop,Jana Jaya City Rajagiriya,130 sqft
37,Office For Rent in Nugegoda,30 Jun 12:19 pm,"Rajagiriya, Colombo","10,000",Office space. Suitable for a shop also (in the bus stand building nugegoda.),Office,Bus halt Building Rent in Nugegoda,80 sqft
38,Building for Rent Rajagiriya, 3 Jun  4:48 pm,"Rajagiriya, Colombo","18,000","Office, saloon, tailor shop, butiq",Building,"74, Obesekarapura Road, Rajagiriya",300 sqft
39,Commercial Property Available for Lease in Rajagiriya, 2 Jun  8:34 am,"Rajagiriya, Colombo","505,600","2 floors in a 3 story commercial property are available for lease/rent in Rajagiriya.This office space is consists of;Ground floor with floor area: 2,232 sqft2nd floor with floor area: 2,824 sqftTotal floor area is 5,056 sqft without the staircase areaConference room, management rooms, separated working spaces, dining space available where all the area is fully partitioned with glass/boards which can be used for any commercial purpose.2 set of bathrooms available in ground floor and another set of bathrooms available in 2nd floor.Total space is fully airconditioned with separate A/C units for separate partitioned areas.5 dedicated parking slots available with separate parking area for about 20 motor bikes.Separate rooftop area of open space is available which can be converted to filing/storing space on request.Situated within walking distance from Rajagiriya junction. Can be accessed from both Nawala Road (100m) and Parliament Road (80m). Close proximity to all the banks, restaurants, supermarkets and many more.Rent is Rs. 100/- per sqftDeposit - 6 months refundable security deposit is required.Advance - 3 months advance payment which will be deducted monthly in equal amounts from the 1st 12 months rental.Negotiable only after inspections. Call to arrange an inspection and for more details.",Office,Park Lane,"5,056 sqft"
40,Shop for Rent in Jana Jaya City Super Market Complex Rajagiriya,31 May  2:27 pm,"Rajagiriya, Colombo","38,000",117 sqftCentral AC Elevator and escalator service On the fourth floor Tempered glass showroom Shop for rent,Building,117 sqft,
41,Building for Rent in Rajagiriya,28 Jun  2:52 pm,"Rajagiriya, Colombo","150,000",Rajagiriya 4 story building for rent or Leese per Floor 150000.00,Building,Rajagiriya,"4,000 sqft"
42,Shop / Office for Rent in Rajagiriya,24 May  2:38 pm,"Rajagiriya, Colombo","23,000","With separate Business Electricity meter,With CCTV camera,6 months / 1 Year Advance",Shop,"No.787/ C/ 2,MDH Jayawardene mawatha,Rajagiriya",350 sqft
