,0,1,2,3,4,5,6,7,8,9
0,title,posted date,location,price,description,Beds:,Baths:,House size:,Land size:,
1,Luxurious House for Rent - Kandy,16 Jul 10:23 am,"Kandy, Kandy","120,000","Within Kandy Municipal Council. Hospitals, Supermarkets, Botanical Garden, Courts Complex, University and many more within 5mints Range. SLT Fiberoptic Line. CCTV Cameras around the land premises. Vehicle parking facility. Natural water stream inside the land with an attractive small garden. Suitable for a family (foreign or local) or office use.",5,3,"2,700.0 sqft",12.0 perches,
2,"['Luxurious House for Rent - Kandy', '16 Jul 10:23 am', 'Kandy, Kandy', '120,000', 'Within Kandy Municipal Council. Hospitals, Supermarkets, Botanical Garden, Courts Complex, University and many more within 5mints Range. SLT Fiberoptic Line. CCTV Cameras around the land premises. Vehicle parking facility. Natural water stream inside the land with an attractive small garden. Suitable for a family (foreign or local) or office use.', '5', '3', '2,700.0 sqft', '12.0 perches']","['title', 'posted date', 'location', 'price', 'description', 'Beds:', 'Baths:', 'House size:', 'Land size:']",,,,,,,,
3,House for Rent in Kandy,18 Jul  9:41 am,"Kandy, Kandy","43,000","House for rent in kandy. 2 bedroom, living, dining, complete pantry, attached washroom with hot water, servant toilet, separate  electricity and waterParking available. six months deposit.","T .k Ellepola, No 15A Robert Gunawardena mw,William Gopallawa road,Kandy",2,2,"1,200.0 sqft",15.0 perches
4,3 Bedroom House for Rent in - Kandy,20 Jul  4:01 pm,"Kandy, Kandy","35,000","Ideal for Families, Group of Boarders (school Girls or Working Women) or For Home StayLand Is Fully Secured with A Front GateClosed to Mahamaya and Dharmaraja CollagesParking Space Available for About 8 Vehicles Good Residential Neighborhood 3 Beds, Two Baths, Living, Dining, Pantry and KitchenSeparate Servants Toilet and Bathroom","Hewaheta Road, Talwatta, Kandy",3,2,"1,800.0 sqft",52.0 perches
5,House For Rent In Kandy,20 Jul 12:43 pm,"Kandy, Kandy","35,000",Suitable to Business  Water / electricity facility Near the sampath bankKandy town to 5 minPeradeniya to 5 min,"No.16/1/1, Heerassagala Road, Kandy.",2,1,"1,300.0 sqft",7.0 perches
6,House For Rent In Kandy Nugawela,20 Jul 10:23 am,"Katugastota, Kandy","50,000",* In Kandy Katugastota Nugawela* 2 Story House* In Front Of Harispaththuwa Divisional Secretariat office * 2.5Km To Katugastota town * 100m To Nugawela Katugastota Main Road * Vehicle Parking Available * Decent Silent place for live * All Facilities Available ,"Royal Garden, Nugawela , Katugastota",3,2,"2,000.0 sqft",10.0 perches
7,Luxury Air conditioned House for rent / Lease - Kandy,20 Jul  9:47 am,"Kandy, Kandy","58,000","Luxury Air conditioned Two bed room Two attached bath Apartment Apartment  for rent/LeaseNewly Built luxury apartment house in close proximity of Kandy town with very best neighborhood.Fully Furnished Fully tiledand with with Luxury curtains.Large spacious living room and dining, two air conditioned ( Also with fans)bed rooms with attached Barth rooms  with hot water. Modern pantry with four burner cooker and Oven Two door Refrigerator.   Roof top terrors  over looking landscaped garden\grass.  3=2=1 sofa 6 piece dining table living room cabinet two queen size beds two wardrobes two dressing tables writing table veranda chairs TV DVD (can be upgraded)Secured fence wall with automatic roller door and CCTV surveillance available. Secured parking for one car.easy comfortable access to house very connected to important places schools hospitals banks city center ect.","George E de Silva Mawatha, Aniwatta, Kandy",2,2,"1,100.0 sqft",12.0 perches
8,House For Rent In Kiribathkumbura,19 Jul  7:54 pm,"Peradeniya, Kandy","30,000","Highly secure area and green environment ""Hansa sewana"" Kiribathkumbura.1 km to colombo kandy road4 km to peradeniya city4 bed rooms and 2 bath rooms with parking facility",4,2,"2,500.0 sqft",20.0 perches,
9,"Upstairs House for Rent,Kandy",19 Jul  4:09 pm,"Katugastota, Kandy","40,000","මහනුවර කටුගස්තොට  රණවන  පාරේ ජනරජ මහා විද්‍යාලය යාබදව  ප්‍රධාන පාරට මුහුණලා  අංග සම්පුර්ණ  උඩුමහල්  නිවස බදු දීමට කාමර 4,සාලය මුළුතැන්ගෙය වාහන නැවතීමේ පහසුකම්",4,1,"2,000.0 sqft",15.0 perches,
10,House For Rent In Akurana,18 Jul  2:19 pm,"Akurana, Kandy","22,500",A9 මාර්ගයේ සිට මිටර් 75ක් ඇතුළත තෙමහල් නිවසේ පහළ මහල කුලියට දීමට.,"2/3 කුඩුගල,අඹතැන්න",3,1,"1,700.0 sqft",42.0 perches
11,House for Rent Kandy Heerassagala,18 Jul 10:07 am,"Kandy, Kandy","55,000","Newly build house in Heerassagala with in Kandy City Limits.Kandy & Peradeniya Hospitals, Asiri & Suwasewanna (Pvt) Hospital, Botanical Garden,Court Complex, Peradeniya University, Kingswood College, Keels & Arpico Super Markets and many more with in 15 minutes Range * 03 Bed Rooms* Modern Kitchen                                                                                                                                                             * Large Living Room* 03 Attached Bathrooms* Verandah* Car Poarch* Parking available for up to 5 vehicles","Heerassagala, Kandy",3,3,"2,500.0 sqft",21.0 perches
12,House For Rent In Kiribathkumbura,16 Jul 10:42 am,"Peradeniya, Kandy","120,000",House house rent at kiribathkumbura for locals and forgeingers.Fully furnished house.Parking for 8+ vehicles 20 meters away from Colombo- Kandy main road.Can be taken with or without furniture.,Kiribathkumbura,3,2,"2,000.0 sqft",33.0 perches
13,Luxurious House for Rent - Kandy,16 Jul 10:23 am,"Kandy, Kandy","120,000","Within Kandy Municipal Council. Hospitals, Supermarkets, Botanical Garden, Courts Complex, University and many more within 5mints Range. SLT Fiberoptic Line. CCTV Cameras around the land premises. Vehicle parking facility. Natural water stream inside the land with an attractive small garden. Suitable for a family (foreign or local) or office use.",5,3,"2,700.0 sqft",12.0 perches,
14,House for Rent Navayalatanne,15 Jul 11:20 am,"Katugastota, Kandy","40,000","Brand new house for rent in navayalatanne, 4 kanuwa, wasanakanda road. 2 BedroomsLarger living room, one guest toilet and shared bathroom for both the roomslarger kitchen, front and back side sitting area. Quite area. Maximum 2 car parking facility. 5.1 km to katugastota,7.3 to kandyPrice negotiable can be discussed",2,1,"3,000.0 sqft",8.0 perches,
15,House for Rent in - Kengalle,17 Jul  2:18 pm,"Kundasale, Kandy","36,000","Situated at Kengalla. Nearby Pallekale Stadium. 4 Bed Rooms and 3 Bathrooms. Dining Room, Pantry. 2 Vehicles Parking. All House Fully White Colour Tiles. Nice   Peaceful Surrounding Aria.",4,3,"2,000.0 sqft",10.0 perches,
16,House for Rent at - Ampitiya,14 Jul  2:53 pm,"Ampitiya, Kandy","100,000","Fully furnished ,4 bedrooms with attached toilets .All rooms AC,Hot water with Solar panels .Domestic quarters and toilet  .Parking for 2 cars ,2 KM from lake round is available for rent .As a house or a tourist business purpose .",8,4,"4,000.0 sqft",13.0 perches,
17,House for Rent - Peradeniya,14 Jul 11:21 am,"Peradeniya, Kandy","30,000",5 minutes drive to Peradeniya hospital and university.Parking available.,2,1,600.0 sqft,100.0 perches,
18,House for Rent in Heerassagala,14 Jul  7:23 am,"Kandy, Kandy","35,000","House in a peaceful environment and friendly neibourhood. Availability of one parking spot. Easy access to Keels supermarket, Arpico, Peradeniya and suwesewen hospital",75/4 3rd Lane Heerassagala Road Kandy,2,2,900.0 sqft,10.0 perches
19,Band New Luxury House For Rent In Kandy,14 Jul  8:58 pm,"Kandy, Kandy","200,000","This modern, brand new luxury property, located at Aniwatta Kandy (10 minutes drive from the centre of Kandy) is ideal for tourism, holiday resort, executive quarters, circuit bungalow or expats looking for long-term stay. This architecture designed, newly built property consists of a double height large living and dining area, modern pantry, 5 bed rooms, 4 bathrooms (3 attached), spacious lounge at basement, servant bathroom and double garage with remote controlling roller door. - Balconies for all bed rooms, living area, lounge and kitchen (8 balconies)- Solar hot water system, - Additional parking space for 2 more vehicles - Wooden floor tiles through out- Timber stair case and hand-railing- Rocell bath ware - Timber modern pantry- Teak doors and windows- Panoramic view from roof top garden (grass)- Court yard This property is surrounded by a quiet and decent neighborhood. Owner currently overseas. Please contact Mrs Thennakoon for further details","43A, Rosamund Place, Gorge E De Silva Mawatha, Aniwatta, Kandy",5,4,"5,000.0 sqft",20.0 perches
20,House for rent - Kandy,14 Jul  1:23 pm,"Kandy, Kandy","25,000","•200m to main road•1km to dharmaraja,mahamaya schools and dalada maligaw.•highly residential area.•calm,quite and friendly neighbourhood.•also there's another buildings near the main road which has 3 floors(for business)",2,1,800.0 sqft,10.0 perches,
21,"House For Rent In Kandy ""mahaweli Uyana "" Kundasale",13 Jul  3:33 pm,"Kandy, Kandy","45,000","Beautiful house in Kandy-Kundasale- Mahaweli ""Uyana"" for lease or rent down stairs only.","Kandy- ""Mahaweli Uyana "" Kundasale",4,2,"2,500.0 sqft",25.0 perches
22,House for Rent in Katugastota,13 Jul 12:37 pm,"Katugastota, Kandy","12,000","Annex for rent in Gohagoda road, KatugastotaRs 12,000/= per monthIdeal for Couples or Bachelor",1,1,400.0 sqft,7.0 perches,
23,House for Rent - Peradeniya,13 Jul 10:44 am,"Kandy, Kandy","20,000",Water / Electricity Privet entrancePeradeniya town 1 kmKandy town 4 km,"No 516, Kendakaduwa, Gannoruwa, Peradeniya.",2,1,"1,500.0 sqft",7.0 perches
24,House for Rent Mahaiyawa,12 Jul 10:44 pm,"Kandy, Kandy","15,000",House for rent mahiyawa main road upstairs  15000 upwards  broker al hadi pvt ltd,1,1,"1,050.0 sqft",5.0 perches,
25,House for Rent Kandy,12 Jul 10:40 pm,"Kandy, Kandy","35,000",House for rent ..aruppola ..dangolla..getambe close to asiri hospital..aniwatha...brokr (  al hadi international),3,2,"1,200.0 sqft",8.0 perches,
26,House for Rent in Katugastota Kandy,13 Jul 12:23 pm,"Katugastota, Kandy","28,000",House For Rent In Katugastota Kandy===============================,"Gohagoda,Katugastota, Kandy",3,2,"1,600.0 sqft",40.0 perches
27,"5 BR House for rent in 1st Lane, Aruppola, Kandy",12 Jul 12:36 pm,"Kandy, Kandy","55,000","(5 BR) 4 bedrooms + servants room - House for rent in 1st Lane, Aruppola, Kandy","1st Lane, Aruppola , Kandy",5,3,"3,000.0 sqft",20.0 perches
28,House for Rent in Kandy,12 Jul 11:10 am,"Kandy, Kandy","24,000",House for Rent in Kandy ,Kandy,2,1,700.0 sqft,10.0 perches
29,"House for rent in Pannwila, Kandy", 7 Jul 11:45 am,"Kandy, Kandy","19,900","3 Bed rooms,2 wash rooms with hot water in Kandy Panwila.Ground Floor with •	Parking available for upto 2 vehicles on 25 perch land. •	Electricity•	Tiled floor with pantry, kitchen.•	You can see the Unnasfalls mountant from the house.•	Without furniture•	Only the goundfloor of this house is for rent!",3,2,"2,000.0 sqft",25.0 perches,
30,House For Rent In Kundasale,18 Jul  5:21 am,"Kundasale, Kandy","24,000","House for rent within the Galmaduwawatta scheme in Kundasale20 mins drive to kandyLarge house which has been recently renovated20 perch landParking for 2 vehiclesPrice negotiable after inspectionLocated within close proximity to supermarkets, hospitals and convivent wide road accessLocated in a residential area with a friendly neighborhood","Galmaduwawatta, Kundasale",5,2,"2,800.0 sqft",20.0 perches
31,Two Storied House for Rent in Kundasale,12 Jul 10:30 am,"Kundasale, Kandy","30,000",Two Storied House for Rent in Kundasale================================,"Mahaweli Uyana Scheme, Kundasale, Kandy",4,2,"2,500.0 sqft",15.0 perches
32,House for Rent - Gelioya,17 Jul  5:07 pm,"Gelioya, Kandy","25,000",ගෙලිඔය - කරමඩ පිහිටි දෙමහල් නිවසේ උඩුමහල කුලියට දීමට තිබේ.,Gelioya,3,1,"2,500.0 sqft",15.0 perches
33,House for Rent Katugastota,10 Jul 10:55 am,"Katugastota, Kandy","25,000",කටුගස්තොට නගරයට මි. 100යි.නිදන කාමර  02නාන කාමර 02සියලු පහසුකම් සහිත නිවස කුලියට දීමට වාහන නතර කිරීමේ පහසුකම් සහිතයි   ආරක්‍ෂිත වැදගත් පරිසරයක්,"Katugastota, Kandy",3,2,"1,000.0 sqft",10.0 perches
34,House for Rent in Katugasthota Kandy,10 Jul 11:45 am,"Katugastota, Kandy","80,000","House for rent in Gohagoda, Katugasthota. ","401/C SINGHEGIRI, GOHAGODA, KATUGASTHOTA, KANDY",4,3,"3,000.0 sqft",14.0 perches
35,Spacious House For Rent In Kandy W/ Parking, 9 Jul  2:16 pm,"Katugastota, Kandy","35,000","Large House For Rent In Yatiwawala, Katugastota!3 Bedrooms Big Size Kitchen2 BathroomsLarge Living And Dining RoomServant Toilet2 Parkings Available 6Months Key Money Location:4.5KM to Kandy Town1KM to Katugastota Town",3,2,"3,000.0 sqft",13.0 perches,
36,House for Rent in Kandy - Mapanawathura, 9 Jul  2:12 pm,"Kandy, Kandy","25,000",Near to Gateway and Trinity College (Through Vihara Mawatha)Six month key money needed3 bedroomsOpen varendaLiving roomKitchen room(1 attached bathroom)Servant toiletGround Floor2 Kelemeter To kandy City,3,2,"2,000.0 sqft",15.0 perches,
37,"House for Rent in Primrose Garden, Anniewatta, Kandy", 9 Jul  1:36 pm,"Kandy, Kandy","400,000","Beautiful 6 bedroom, 5 bathroom house for RENT in Kandy on Primrose Garden, Anniewatta. With maids and drivers living quarters. Ideal for expats. Available on long term rent. Expecting US$2500 a month. Please contact for further details.",6,5,"7,000.0 sqft",50.0 perches,
38,Modern House for Rent in Kundasale, 8 Jul  1:44 pm,"Kundasale, Kandy","45,000",Newly Built modern House for rent in Koongahamula (621 route ) Three bedrooms with separate balconies One kitchen One Living Room with dining roomLobby areaTwo bathrooms with hot water facility Garage Electricity & Water Suitable for a  Family /company quarters /or for a company 20 minutes drive to  Kandy Town 10 minutes drive to lewella 05 minutes drive to kundasale300 Meters to manikhinna town3km to BOIWith OR without furniture ....(No Brokers Please),koongahamula,3,2,"3,400.0 sqft",8.0 perches
39,Brand New One Story House for Rent in Kandy, 7 Jul 11:55 am,"Digana, Kandy","22,000",Fully completed one story brand new house for sale in a rapidly increasing residential neighborhood at Kandy.- - - - - - - - - - - - - - - - - - - - - - - - - - - - - - - - - - - - - - - - - - - -- 10 Perches with landscaped front garden area- The house is completely tiled and ceiling roof- 2 Bedrooms- 1 Bathroom- Living area- Kitchen and Modern Pantry- Parking space (2+ vehicles can be parked)- House is fully secured by surrounding wall and a fence- Pipe born water and Electricity - 2 min to Victoria Range Bungalows- 25 min to Kandy town- 10 min to Pallekele International Ground and BOI,Digana | Kandy,2,1,"2,178.0 sqft",11.0 perches
40,House For Rent In Kandy, 7 Jul 10:34 am,"Peradeniya, Kandy","25,000",මහනුවර හල්ලොලුව නගරයේ ව්‍යාපාර/ ගබඩා හෝ පදිංචිය සදහා සුදුසු මෙම නිවස බදු දීමට ඇත. ජලය හා විදුලිය සපයා ඇත. රථවාහන ගාල් කිරීම සදහා ඉඩ පහසුකම් ඇත. වර්ග අඩි2000 ක සම්පූර්න ගොඩනැගිල්ල. වැඩි විස්තර සදහා අමතන්න.,"589,Barigama Rd, Halloluwa,kandy",2,1,"1,000.0 sqft",10.0 perches
41,House for Rent in Kandy (heerassagala), 7 Jul  9:49 am,"Kandy, Kandy","30,000","3 bedrooms, kitchen and living room with 1 attach bathroom and 1 outdoor toilet3 - 4 Kilometerers to the Kandy-Colombo main road, Keels super center, Kingswood college. 5KMs to the Kandy city. Buses available from Bowalawatta and Heerassagala both sides.",3,1,"2,000.0 sqft",8.0 perches,
42,House for Rent - Kandy, 6 Jul  5:23 pm,"Kandy, Kandy","60,000","Description - Can use the premises as business purpose,Office,  nursery and for House stay.*Bed rooms - 2 fully tiled *Bathroom - 1 master bathroom *Kitchen tiled with pantry cabinets.*Dinning room.","No. 37/5,Wiliam gopallawa mw, Kandy",2,1,"1,080.0 sqft",7.5 perches
43,House for Rent in - Kandy, 6 Jul  4:26 pm,"Kandy, Kandy","40,000",3 bed room. Kitchen. Large living and dining. 2 washrooms. Garage. Hot water. It is very close to kandy hospital and town (10 minutes) And also close to girls highschool and Kingswood college 50m to William go pallawala rd (kandy Colombo new road),3,2,"2,500.0 sqft",13.5 perches,
44,House for Rent in - AMPITIYA, 6 Jul  3:48 pm,"Ampitiya, Kandy","19,000","With Big open veranda, Three bedrooms, One bathroom, One kitchen, One living room.500m away from main road.",3,1,"1,500.0 sqft",15.0 perches,
45,House for Rent in - KANDY, 6 Jul 11:06 am,"Kandy, Kandy","60,000","මහනුවර, හීරැස්සගල පාර, විහාර මාවතෙහි අලුතින් සාදන ලද දෙමහල් නිවසෙහි උඩු මහල කාමර 04, සාලය, කුස්සිය, කෑම කාමරය සහ නාන කාමර 02 ක් සහිත නිවස කුලියට දීමට ඇත. මාසික කුලිය රැ.60,000 කි.වැඩි විස්තර සදහා අමතන්න නිමල් අබේකෝන්",Heerassagala Kandy,4,2,"1,800.0 sqft",6.5 perches
46,House for Rent in Kandy Digana, 5 Jul  3:31 pm,"Digana, Kandy","19,000",* In Kandy Digana* Near Digana Village * 200m To Digana Town* All Facilities Available * Vehicle Garage Available * Silent Decent place for live ,"50, Ambasewanagama Digana",4,2,"2,000.0 sqft",29.0 perches
47,Rent for house in Pilimatalawa, 3 Jul 10:48 am,"Pilimatalawa, Kandy","28,500",situated very closed to Kandy Colombo main road.all facilities are available.fully tiled,Urapola Pilimathalawa,4,2,"1,500.0 sqft",10.0 perches
48,"Home for Rent in digana, Kengalle", 3 Jul  5:29 am,"Digana, Kandy","15,000","An annex with furniture ,two bed rooms,a Living room ,Kitchen an a bathroom.Near to kengalle maha vidyalaya & it's only 700M for the kandy - digana main road.monthly rent per month-15000/=two bedsmirror tablechair set..","digana,kengalle",2,1,"1,900.0 sqft",15.0 perches
49,A Beautifull House for Rent in Kandy, 2 Jul  2:12 pm,"Kandy, Kandy","35,000",A very beautiful house for rent. This is a very good place to live for family and it is very closed to Kandy city.There is 2 bed rooms with large living area. Specially spacious kitchen with pantry cupboard by Mahogani wood. Wash room with cubicle.There is available space to park your car with safe.please call for more detail: ,"Lewalla, Kandy",2,1,"1,200.0 sqft",12.0 perches
50,"Bungalow For Rent In Kandy, Peradeniya", 2 Jul  1:22 pm,"Peradeniya, Kandy","70,000","Gannoruwa - Peradeniya New Kandy road5 bed rooms- attach bath rooms and kitchen Separate servant room with bath roomWalk distances Peradeniya botanical garden and university   City view and garden  Most suitable for circuit bungalow, office or guest house","No.3, Samagi Housing Project, Gannoruwa, Peradeniya",5,5,"2,000.0 sqft",20.0 perches
51,House for rent in Kundasale, 2 Jul 12:39 pm,"Kandy, Kandy","25,000",Call more details .. warapitiya kundasale ..,K.G nayana kumari . no 09 warapitiya kundasale .,2,1,"1,000.0 sqft",10.0 perches
52,House for Rent Anuradhapura, 2 Jul 11:21 am,"Kandy, Kandy","35,000","KADA 50For Rent Water Electricity facility ParkingNear the Hospital , and Kada 50 anuradhapura town to 5 min  CCTV tvOne room A/C","49,LS Road, Twin house, Anuradhapura.",3,1,"1,200.0 sqft",15.0 perches
53,House for Rent in - Gampola, 1 Jul  4:24 pm,"Gampola, Kandy","25,000",one hall 3 bedrooms1 attached bathroom and 1 normal bathroomdining hall and kitchen..infront of gampola zahira school near railway gate (beside saliyala temple),Kandy Road Gampola,3,2,"1,497.3 sqft",5.5 perches
54,House for Rent in Kandy,18 Jul  9:41 am,"Kandy, Kandy","43,000","House for rent in kandy. 2 bedroom, living, dining, complete pantry, attached washroom with hot water, servant toilet, separate  electricity and waterParking available. six months deposit.","T .k Ellepola, No 15A Robert Gunawardena mw,William Gopallawa road,Kandy",2,2,"1,200.0 sqft",15.0 perches
55,Luxury House for Rent in Katugastota, 9 Jul  9:40 am,"Katugastota, Kandy","60,000",All major schools & amenities close by 1 Km to Katugastota City,3,1,"2,000.0 sqft",21.0 perches,
56,Luxurious House for Rent - Kandy,16 Jul 10:23 am,"Kandy, Kandy","120,000","Within Kandy Municipal Council. Hospitals, Supermarkets, Botanical Garden, Courts Complex, University and many more within 5mints Range. SLT Fiberoptic Line. CCTV Cameras around the land premises. Vehicle parking facility. Natural water stream inside the land with an attractive small garden. Suitable for a family (foreign or local) or office use.",5,3,"2,700.0 sqft",12.0 perches,
57,Brand New One Story House for Rent in Kandy, 7 Jul 11:55 am,"Digana, Kandy","22,000",Fully completed one story brand new house for sale in a rapidly increasing residential neighborhood at Kandy.- - - - - - - - - - - - - - - - - - - - - - - - - - - - - - - - - - - - - - - - - - - -- 10 Perches with landscaped front garden area- The house is completely tiled and ceiling roof- 2 Bedrooms- 1 Bathroom- Living area- Kitchen and Modern Pantry- Parking space (2+ vehicles can be parked)- House is fully secured by surrounding wall and a fence- Pipe born water and Electricity - 2 min to Victoria Range Bungalows- 25 min to Kandy town- 10 min to Pallekele International Ground and BOI,Digana | Kandy,2,1,"2,178.0 sqft",11.0 perches
58,House For Rent Katugastota,30 Jun 11:57 am,"Katugastota, Kandy","27,000","4 KM to Katugastota Town8 KM to Kandy TownAmbathenna2 Bed Room,1 Bed Room 2 Storied HouseWith All Facililities & FurnitureClam & Residential Area-------------------කටුගස්තොට නගරයට කි.මි.4 යි.මහනුවර නගරයට  කි.මි.8 යි.අඹතැන්න  නිදන කාමර 2/නාන කාමර 1සියලු පහසුකම් සහිත දෙමහල් නිවස ,නිවසට අවශ්‍ය සියලු උපකරණ  සමග කුලියට දීමට නිදහස් පදිංචියට සුදුසු පරිසරය","Ambatenna,Katugastota",2,1,"1,600.0 sqft",15.0 perches
59,House for Rent in Malpana Digana,30 Jun 11:08 am,"Digana, Kandy","9,000",parking area available 2 vehicles can park . around wall a dragging grate  walking distances from the main road (Madawaleroad) 2km to Digana town and 2km to Menikhina town ,1,1,"1,500.0 sqft",11.0 perches,
60,House For Rent In Katugastota,29 Jun  4:46 am,"Katugastota, Kandy","23,000",House for rent walking distant to Katugastota town situated by the Gohagoda road in a peaceful environment.,"Gohagoda Road, Katugastota",3,2,"1,800.0 sqft",12.0 perches
61,Small House for rent in Aniwatta,28 Jun  3:24 pm,"Kandy, Kandy","25,000","Our first for floor is vacant from may 1st attached bath room,living area, cooking facility with furniture.Please contact for the more details Thank you","28/33, Riverdale Rood,Anniwatta,Kandy",1,1,"1,000.0 sqft",10.0 perches
62,Up - Stair House For Rent Pilimathalawa,28 Jun 12:18 pm,"Pilimatalawa, Kandy","30,000","Newly built up-stair house for RENT or LEASE in Pamunuwa - Pilimathalawa, 2 km from Kandy - Colombo Main Road.",pamunuwa,2,1,"1,500.0 sqft",20.0 perches
63,House For Rent in Kandy,20 Jul  4:00 pm,"Kandy, Kandy","55,000","6 bedrooms- 2nd and 3rd floor  - 55,000 rent Key money 1 year upfront.If you can pay 30 lacks key money- i can give you the entire 6bedroom for 10,000month",Aruppola kandy,6,3,"3,000.0 sqft",17.0 perches
64,Two Storey House For Rent Ampitiya, 1 Jul  7:22 am,"Ampitiya, Kandy","75,000",Brand-new two storey house for rent in Ampitiya.,"No 332, Ampitiya, Kandy",3,2,"2,000.0 sqft",20.0 perches
65,Fully furnished luxurious house for rent kandy,25 Jun  3:01 am,"Kandy, Kandy","120,000","fully  furnished luxurious house for rent in city limit , near health alliance faculty, university  of peradeniya.Four  bed rooms with  2 attached  bathroom  and AC. One natural type bed room with natural type bathroom( with glass roof)Beautiful landscaping with out door table, mini swiming pool, swinging chair and light system .Parking space for three vehicles.CCTV and fiber optic internet. Remort control gate and blind.Internal fabric walls with carpeted, vinyl and tiled floor.Rooftop.Calm surrounding, bordering university of peradeniya .Rented for 2years in 3 months .",4,3,"3,000.0 sqft",17.0 perches,
66,House for Rent in Balagolla,30 Jun  9:41 am,"Kundasale, Kandy","35,000",House for Rent in Balagolla=================,"Regent Village, Balagolla",4,2,"2,700.0 sqft",12.0 perches
67,House for Rent in Kandy,18 Jul  9:00 am,"Kandy, Kandy","28,000","02 B/R,attached bath,Kitchen,Living,Dinning,Garage,Tile Floor,Ground FloorWide road access","34/11B,Watagoga temple Rd Aruppola,Kandy",2,1,"1,400.0 sqft",15.0 perches
68,House for Rent in - Katugastota,23 Jun  3:04 pm,"Katugastota, Kandy","28,000",Near Katugastota Police Station .(0.5km)kandy town 5km.(A9 road),"kahalla,katugastota.(police station 0.5km)",3,1,"1,500.0 sqft",15.2 perches
