,0,1,2,3,4,5,6,7,8,9
132,Luxury House for Rent in Nittawela Kandy, 3 Jul  8:00 pm,"Katugastota, Kandy","210,000",Beautiful modern house opposite to Nittawela rugby stadium.,2,3,"2,600.0 sqft",25.0 perches,
133,House for rent - Kandy,28 May  3:41 pm,"Kandy, Kandy","20,000","Living room, 2bed rooms, Bath room with Hot water, Kitche","No, 53, second Lane,Mawilmada, Kandy",2,1,"1,000.0 sqft",8.0 perches
134,House for Rent in Kundasale,28 May  3:27 pm,"Kundasale, Kandy","40,000",Newly renovated house for rent in Kundasale.Separate entrances for both units.,4,1,"2,000.0 sqft",20.0 perches,
135,Luxury House for Rent - Kandy,28 May  3:03 pm,"Kandy, Kandy","75,000",LUXURY HOUSE FOR RENT OR SALE FULLY A/C2 BED ROOMS WITH ATTACH BATH ROOMS PANTRY AND DINING ROOM PARKING FOR 3 VEHICLESBASEMENT OF 900 SQ.FT. PLAN APPROVED FOR 5 STORIES 13.8 PERCHES WITH PARAPET WALL AND ROLLER SHUTTERS CLOSE TO TEMPLE SACRED10 MINUTES WALKING TO DHARMA RAAJA & MAHAMAYA COLLEGES RENT PRICE PER MONTH Rs.75000/= SALE PRICE Rs.35 MILLIONS,kandy,2,2,900.0 sqft,13.8 perches
136,House For Rent - peradeniya Rd,31 May  9:26 am,"Peradeniya, Kandy","195,000",Super luxury house for rent or sale Architect designed an built modern house Walking distance to arpico an suwasewanaIdeal for house or instituitionsCall for appointment,Primrose Road,5,5,"7,000.0 sqft",17.0 perches
137,House for Rent in Kandy,18 Jul  9:41 am,"Kandy, Kandy","43,000","House for rent in kandy. 2 bedroom, living, dining, complete pantry, attached washroom with hot water, servant toilet, separate  electricity and waterParking available. six months deposit.","T .k Ellepola, No 15A Robert Gunawardena mw,William Gopallawa road,Kandy",2,2,"1,200.0 sqft",15.0 perches
138,Luxurious House for Rent - Kandy,16 Jul 10:23 am,"Kandy, Kandy","120,000","Within Kandy Municipal Council. Hospitals, Supermarkets, Botanical Garden, Courts Complex, University and many more within 5mints Range. SLT Fiberoptic Line. CCTV Cameras around the land premises. Vehicle parking facility. Natural water stream inside the land with an attractive small garden. Suitable for a family (foreign or local) or office use.",5,3,"2,700.0 sqft",12.0 perches,
139,House for Rent in Gampola,27 May  1:28 pm,"Gampola, Kandy","22,000","3Bed Room, living, Dinning, kitchen, 1Bath room, Garage, tiled, peaceful environment, Beautiful view,","12th lane, Nawalapitiya Rd, Jayamalapura",3,1,"1,300.0 sqft",20.0 perches
140,House for Rent Kadugannawa,27 May  3:40 pm,"Kadugannawa, Kandy","17,000",2nd Floor for Rent 2 bed room / 2 bath room / living room / kitchen / dining room Kandy to Colombo Main roadPeradeniya to 15 minKandy to 25 minAll facility ( Water / Electricity ),"No. 416, Kandy Road, Kadugannawa.",2,1,"1,200.0 sqft",10.0 perches
141,House for Rent Kandy,27 May 12:01 pm,"Katugastota, Kandy","22,000",Separate house All Facility ( Water / Electricity) Katugastota to kandy 10 minNear The St. Anthony Girls and Boys school / vidyartha collage / Clombo International school,"No. 23/5, Prarthana Mw, 1st lane, Watapuluwa, Kandy",3,1,"1,600.0 sqft",10.0 perches
142,House for Rent Peradeniya,26 May  3:08 pm,"Peradeniya, Kandy","22,000","House down floor for rent PeradeniyaFully Tilled, 2 bed room, 1 wash roomKitchen, Living roomParking3 km to university of peradeniya hospital Near the station 800 mm","248/A/1, Edaduwava, Peradeniya.",2,1,"1,200.0 sqft",20.0 perches
143,House for Rent in Kandy,30 May 11:52 am,"Kandy, Kandy","28,000",කටුගස්තොට ගොහාගොඩ මාර්ගයේ දොඩම්වල පාලමට යාබදව හා කෝලාන මං සංදියේ (දුම් පරීක්ෂණ මධ්‍යස්තානය) අසල පිහිහා ඇති ,"Yatihalagala,Pallegama,Halloluwa",2,2,"1,800.0 sqft",7.0 perches
144,House for Rent - Ampitiya,26 May  8:10 am,"Ampitiya, Kandy","25,000","small house- 3rooms 2baths 1kitchen  with living room. 25 monthly n need 6 months advance. (negotiable)Hotel , 3 a.c rooms 2 non a.c. 5 baths with hot water. 1 fully equipped kitchen n one pantry. House is fully furnitured. Parking available  for 4 vehicles.  Nature surrounding. 4 km away from kandy town 15 minutes to kandy town.  This apartment can use for duel purpose coz there are separate entrance for both stages. 100 000 for month n 6 months advance required,  price is negotiable.( Looking for companies)near diurumbodiya temple. Thanks.",10,6,"1,500.0 sqft",30.0 perches,
145,House For Rent - Peradeniya,23 May  4:38 pm,"Peradeniya, Kandy","20,000",Contact :  Morning 8.00 am to Evening 4.00 pm,"42/15, Sooriyagoda Road, Udaeiriyagama, Peradeniya.",2,1,800.0 sqft,6.0 perches
146,House for Rent Bokkawala,23 May  1:41 pm,"Katugastota, Kandy","25,000","පුජාපිටිය නගරයට කි.මි. 4 යි.මහනුවර කුරුණෑගල ප්‍රධාන මාර්ගයට කි.මි. 8යි.බොක්කාවල නගරයේ නිදන කාමර 04 යි.විසිත්ත කාමර 01 යි කෑම කාමරමුළුතැන්ගේ  නාන කාමර 01 යි.ජලය, විදුලිය, දුරකථන හා  සියළු පහසුකම් සහිතයි  පළමු මහල / දෙවන මහල කුලියට දීමට ව්‍යාපාරයක් කිරීමට අපේක්‍ෂා කරන්නේ නම් වෙන වෙනම කඩ කාමර 02ක්  ඇත.","Bokkawala, Katugastota",4,1,"2,000.0 sqft",14.0 perches
147,House for Rent in Kandy - Kirbathkumbura,23 May  8:58 am,"Peradeniya, Kandy","25,000","Pantry KichenLiving roomCar park available (Upstair for rent)Separate entrance, separate electricity, separate water.",3,2,"2,000.0 sqft",25.0 perches,
148,House For Rent In Kundasale,18 Jul  5:21 am,"Kundasale, Kandy","24,000","House for rent within the Galmaduwawatta scheme in Kundasale20 mins drive to kandyLarge house which has been recently renovated20 perch landParking for 2 vehiclesPrice negotiable after inspectionLocated within close proximity to supermarkets, hospitals and convivent wide road accessLocated in a residential area with a friendly neighborhood","Galmaduwawatta, Kundasale",5,2,"2,800.0 sqft",20.0 perches
149,House for rent - Jayamalapura / Gampola,23 May  1:42 pm,"Gampola, Kandy","18,000","Gampola, Jayamalapura 4 Bed roome2 BathroomHouse with all facilities to lease.","Jayamalapura, Gampola",4,2,"1,200.0 sqft",20.0 perches
150,Rooms & Annexes - Rajawatta,22 May  1:50 pm,"Kandy, Kandy","55,000",Building for rent in rajawattaRooms 7Bath rooms 3Water / Electricity5 min Peradeniya General Hospital  5 min peradenya University,"176/B,Rajawatta,Peradeniya",7,3,"2,500.0 sqft",20.0 perches
151,House for Rent Kandy Lewella,22 May 11:08 am,"Kandy, Kandy","36,000","Fully tiled up stair house with  03 bed rooms, 02 bathrooms,Living room,Pantry,Open portico,Garage and Large Balcony for rent",lewella,3,2,"2,500.0 sqft",9.0 perches
152,House for Rent - Pilimathalawa, 1 Jun 11:24 am,"Pilimatalawa, Kandy","25,000","A house for rent in Pilimathalawa, close to Colombo - Kandy main road (2 mins) with all facilities. Parking available for two vehicles.",Pilimathalawa,2,1,"1,500.0 sqft",10.0 perches
