,0,1,2,3,4,5,6,7,8,9
50,House for Sale Embilipitiya( Padalangala), 7 Jun  3:58 pm,"Embilipitiya, Ratnapura","5,500,000","අැඔිලිපිටිය කාපට් හංදිය හරහා සූරියවැව,(පදලංගල හංදියේ) ඩී.ඒ්.රාජපක්ෂ ප්‍රාථමික විදුහලඅසලඉතා වටිනා නිවසක් විකිණිමට තිබේ.නිරවුල් බලපත්‍ර සහිත පර්චස් 35 කි.ජලය, විදුලිය, මාර්ග සියලු පහසුකම් සහිතයි.තෙකලා විදුලිය ද තිබේ.නිවස,නිදන කාමර 03,සාලය,මුලුතැන්ගෙය,ටොයිලට්,ව්‍යාපාරයකට හෝ පදිංචියට වඩාත් සුදුසු වේ,මිළ ගණන් සාකච්ජා කර ගත හැක,අමතන්න.","943/1,පාසල් පෙදෙස, පදලංගල.",3,1,"2,000.0 sqft",35.0 perches
51,Brand New 2 Story House for Sale in Balangoda.,15 Jul  9:36 am,"Balangoda, Ratnapura","11,500,000",Brand new 2 story house for Sale in balangoda,"Balangoda,",6,3,"2,200.0 sqft",14.0 perches
52,"2 BR Single House For Sale In Balangoda,Allepola",15 Jul  9:36 am,"Balangoda, Ratnapura","6,500,000",House for sale in balangoda allepola,"Balangoda,Allepola",2,1,900.0 sqft,1.0 acres
53,Single Story House for Sale in Balangoda,15 Jul  9:36 am,"Balangoda, Ratnapura","2,200,000",Single House For sale in balangoda Ibulpe.*Residential Area *750 metres to Badulla Colombo road.*10 feet road.*8 km to balangoda town.*perchers 59. *2 bed rooms. *dining room and kitchen.*Rs 2200000 negotiate.,"Balangoda, Ibulpe",2,1,750.0 sqft,59.0 perches
54,"Singal Story House for Sale in Balangoda, Kirimatithenna",15 Jul  9:36 am,"Balangoda, Ratnapura","2,700,000",Singal story House For sale in balangoda kirimatenna.,"Balangoda, kirimatithenna",3,1,800.0 sqft,10.0 perches
55,"New Singal House for Sale in Balangoda, Rassagala Rd",15 Jul  9:36 am,"Balangoda, Ratnapura","11,000,000",New house for sale in rassagala balangoda Rd.*beautiful place.*complite house.*38 perchers.*3 bed rooms.*1 atage bath room and servan toilet. *2 km to balangoda town.*Rs 11000000 negotiable. ,"Balangoda, Rassagala rd",3,2,"1,200.0 sqft",38.0 perches
56,House for Sale - Ratnapura, 4 Jun 10:23 am,"Ratnapura, Ratnapura","4,000,000","සාලයයි / කාමර 1යි/ ලොකු නිදන කාමර 3යි./ පොඩි නිදන කාමරයයි / පැන්ට්‍රි කාමරයයි / කුස්සිය / නාන කාමරය / ගබඩා කාමරය/ නළ ජල පහසුකම් විදුලිය ඇත. නිවස ටයිල් කර ඇත. අංග සම්පුර්ණ නිවස , කහවත්තේ සිට 2.5 km","අලුත් ගෙදර වත්ත, දකුණු පනාවැන්න, පෝරණුව පාර, කහවත්ත.",4,1,"1,500.0 sqft",66.0 perches
57,House for sale - Kahawatta Ratnapura, 3 Jun 10:16 am,"Ratnapura, Ratnapura","40,000,000","House in scenic location, for saleLocated facing We river - ideal for a family home, holiday home, guest house or even to run an Air BnbCalm and relaxing environment private water supply / 3 phase electricity supply / Lan line connection and cable tv connectionen-suite rooms two overhead water tankslarge garden area that can easily hold about five parking spotsCrops on land include coconut, king coconut, tea and bananas",5,3,"2,118.0 sqft",130.0 perches,
58,House for Sale - Balangoda, 1 Jun 10:16 am,"Balangoda, Ratnapura","7,800,000",1km far from  balangoda on rassagala road  .well water  tap water   electricity   near to schools .silent place ..  6 agarwood trees include,4,3,"1,500.0 sqft",22.0 perches,
59,House with Land for sale in Pelmudulla,31 May 10:46 am,"Pelmadulla, Ratnapura","3,800,000",කොළබ බදුල්ල ප්‍රදාන මාර්ගයට 100m නුදුරින්.සියලු පහසුකම් සහිත අගනා නිවස. 0,"vidyala mawata,opanayaka",3,1,"1,000.0 sqft",10.0 perches
60,"3BR House With Commercial 2 Retail Shop For Sale In Kahawatta,Weladura",15 Jul  9:36 am,"Pelmadulla, Ratnapura","10,000,000","Retail shop and House immediately sale weladura, kahawatta,","Colombo,Embilipitiya Main Rd,waladura,kahawatta",3,2,"2,000.0 sqft",20.0 perches
61,"Single Storey House for Sale in Balangoda, Kirimatithenna",15 Jul  9:36 am,"Balangoda, Ratnapura","4,500,000",Good condition 3 bedrooms 1 bathroom11 Perches 12 feet Rd 200 meters to main rd. Rs. 450000 lak Negotiable ,"Balangoda, kirimatithenna.",2,1,950.0 sqft,11.0 perches
62,House for Sale - Parakaduwa,27 May 10:16 am,"Ratnapura, Ratnapura","7,000,000","pussalla maha widuhala asala,colombo pradahana parata 100m pamana durakin ithi watina niwasak wikineemata atha.widuliaya, lin jalaya, adi 12 para,idama wata thappayak saka kambi watakin awaranaya kara atha.mema niwasa ikmanin wikineemata atha.mila ganan sakachcha kara gatha haka.amathanna.","192/1,pussalla,parakaduwa.",3,1,"1,269.0 sqft",15.0 perches
63,House for sale in Rathnapura (Newtown),27 May  1:20 pm,"Ratnapura, Ratnapura","52,000,000","සීවලී විදුහල,කුමර විදුහල,රජයේ ප්‍රධාන කාර්‍යාල සහ දෙපාර්තමේන්තු,සුපිරි වෙළඳසැල්,ඉන්ධන පිරවුම්හල්,කාර්මික විදුහල සහ යෝජිත වෛද්‍ය පීඨය,කොළඹ-රත්නපුර ප්‍රධාන මාර්ගය යන සියල්ලට විනාඩි 5 කි.ගංවතුර සහ ස්වභාවික විපත් වලින් තොරයි.බිම් මහල-නිදන කාමර 2,කාර්‍යාල කාමරය,පෑන්ට්‍රි 2,බාත් රූම් 1,සාලය,විශාල විවුර්ත ආලින්දය,ගරාජ 2 ,නිවසින් පිටත කුස්සියක් සහ සේවක වැසිකිළියකින් සමන්විතයි.ඉහළමාලය-සාලය,විශාල බැල්කනිය,නිදන කාමර 4(ඉන් 1ක් වායු සමනය කර ඇත.),බාත් රූම් 2මිල-මිලියන 58(සාකච්ඡා කළ හැක)","Newtown,Rathnapura",7,3,"5,500.0 sqft",51.0 perches
64,"Single House For Sale In Balangoda,Gurubavila",15 Jul  9:36 am,"Balangoda, Ratnapura","2,200,000",House for sale in balangoda gurubawila.,"Balangoda,Gurubavila",3,1,600.0 sqft,40.0 perches
65,House for Sale in - Ratnapura,23 May  5:17 pm,"Ratnapura, Ratnapura","4,500,000",මෙම නිවස නිදන කාමර 3ක් සමග කෑම කාමරයක් කුස්සියක් සහ සාලයක් සමග වේ.වහන නැවැත්වීමට පහසුකම් කම් සහ ජල විදුලිය . නාය යෑම් සහ ගන්වතුර නැත.ප්‍රධාන පාරට ම්ටර් 10 ‍යි.ප්‍රධාන නගරයට විනඩ් 15යි.,"Elapatha, Ratnapura",3,1,"1,520.0 sqft",16.0 perches
