,0,1,2,3,4,5,6,7,8
0,title,posted date,location,price,description,Address:,Property type:,Beds:,Baths:
1,2 Room Apartment for Short and Long Stay in Colombo 4,19 Jul  9:42 am,"Colombo 4, Colombo","5,500","AKARA Apartments - Lorenze Road, Colombo 4 (AS008)","Lorensz Road, Colombo 4.",Apartment,2,2
2,"['2 Room Apartment for Short and Long Stay in Colombo 4', '19 Jul  9:42 am', 'Colombo 4, Colombo', '5,500', 'AKARA Apartments - Lorenze Road, Colombo 4 (AS008)', 'Lorensz Road, Colombo 4.', 'Apartment', '2', '2']","['title', 'posted date', 'location', 'price', 'description', 'Address:', 'Property type:', 'Beds:', 'Baths:']",,,,,,,
3,2 Room Apartment for Short and Long Stay in Colombo 4,19 Jul  9:37 am,"Colombo 4, Colombo","5,500","AKARA Apartments - Lorenze Road, Colombo 4 (AS008)","Lorensz Road, Colombo 4.",Apartment,2,2
4,2 Room Apartment for Short and Long Stay in Colombo 4,19 Jul  9:37 am,"Colombo 4, Colombo","5,500","AKARA Apartments - Lorenze Road, Colombo 4 (AS008)","Lorensz Road, Colombo 4.",Apartment,2,2
5,2 Room Apartment for Short and Long Stay in Colombo 4,19 Jul  9:42 am,"Colombo 4, Colombo","5,500","AKARA Apartments - Lorenze Road, Colombo 4 (AS008)","Lorensz Road, Colombo 4.",Apartment,2,2
6,Studio Type Apartment For Rent (apt01287) - Colombo 4,20 Jul  7:25 pm,"Colombo 4, Colombo","4,000","STUDIO TYPE APARTMENT COLOMBO 4 Address: - 44 Lorenze Road, Colombo 4","44, Lorenze Rd, COlombo 4.",Apartment,1,1
7,1 Bed Room Apartment - Colombo 04 (APT00240,20 Jul  4:43 pm,"Colombo 4, Colombo","4,500","Address: - 44 Lorenze Road, Colombo 4","44, Lorenze Rd, COlombo 4.",Apartment,1,1
8,2 Bed Room Apartment for Rent in Colombo 04,20 Jul  4:23 pm,"Colombo 4, Colombo","5,500","e away from home. Let it be for business or holiday you will feel right at home. . All the Apartments are Fully Furnished including a Fully Equipped Kitchen.These apartment are located in Lorenz Rd in Colombo 4 (Bambalapitiya), with easy access to other parts of the city and all the amenities. Most of Colombo’s attractions are all within 15 mins drive from the Apartment. There are many fast food outlets within few minutes walking distance. Public transport is just few meters from the building.------------------------------------------------------------------------------------	■ 2 Bed Room with one attached and one common bathroom	■ Living and Dining Area. Fully Air conditioned.	■ Free Wi-Fi, Gas, Water and International TV Channels.	■ 24 Hours Security and Parking.	■ Electricity Rs. 50 per unit.	■ Rs.5500 + Electricity Per Day ------------------------------------------------------------------------------------Call/Whatsapp/Viber us for more info/to reserve.","44, Lorenze Rd, COlombo 4.",Apartment,2,2
9,1 Bed Room Apartment for Rent in Colombo 04 (apt01283),20 Jul  4:10 pm,"Colombo 4, Colombo","4,500","Address: - 44 Lorenze Road, Colombo 4","44, Lorenze Rd, COlombo 4.",Apartment,1,1
10,2 Bed Room Apartment for Rent in Colombo 4,20 Jul  3:52 pm,"Colombo 4, Colombo","5,500","Address :- 44 Lorenze Road, Colombo 6","44, Lorenze Rd, COlombo 4.",Apartment,2,2
11,Studio Type Apartment for Rent Col-4,20 Jul  2:25 pm,"Colombo 4, Colombo","4,500","eatures:Studio Room with in-built kitchenette, attached bathroom and private spacious balcony with a nice view. Suitable for single or double occupancy.",Lorenz road Colombo 4,Apartment,1,1
12,Colombo 4 Apartments 2 Br,20 Jul 10:34 am,"Colombo 4, Colombo","5,500",The apartments are tastefully furnished including fully equipped kitchen.,NO 37 SAGARA ROAD  COLOMBO-04,Apartment,2,1
13,2 Bed Room Apartment (apt01280) for Rent in Colombo 04,20 Jul 10:23 am,"Colombo 4, Colombo","5,500","Address :- 44 Lorenze Road, Colombo 6","44, Lorenze Rd, COlombo 4.",Apartment,2,2
14,2 Bed Room Apartment (1500) for Rent - Colombo 4,20 Jul  9:37 am,"Colombo 4, Colombo","5,500","TWO BEDROOM APARTMENT COLOMBO 4	Address :- 44 Lorenze Road, Colombo 6",44 lorenz road colombo 04,Apartment,2,2
15,2 Rooms Apartment For Rent Col-4,20 Jul  6:08 am,"Colombo 4, Colombo","6,500","■ 2 Rooms-1 Attached and 1 Common Bathroom.■ Living and Dining Area.■ Fully Furnished and Fully Air conditioned.■ Free WiFi, Gas, Water and International TV Channels.■ 24 Hours Security and Parking.■ Electricity Rs 50 per unit.All the apartments comes with the following amenities as standard: Air conditioning and Ceiling in Rooms and Living Area, Hot water, Free WiFi, International TV Channels, and Parking.",Lorenz Road Colombo 4,Apartment,2,2
16,2 Bed Room in Attach Bath Col 04,19 Jul 11:21 pm,"Colombo 4, Colombo","6,000",FULLY FURNISHED APARTMENT WITH A/C.  24 HOUR SECURITY WITH PARKING. KITCHEN FACILITIES.  FREE WATER GAS INTER NATIONAL TV CHANNELS. PER DAY 6000/-  ELE PER UNIT 50/-  NOW AVAILABLE WORRY TO NOW CALL.  PARTY AND WEDDING INVITE GOOD PLACE.,NO 37  SAGARA ROAD  COL 04,Apartment,2,2
17,Studio Type Apartment For Rent Colombo - 4,19 Jul  3:27 pm,"Colombo 4, Colombo","4,500","Fully Furnished including Fully Equipped Kitchen, Free WiFI, International TV Channels, Hot Water, Security. Towels, Toiletries, Option for daily cleaning and transport arrangement upon request.",Lorenz Colombo  4,Apartment,1,1
18,1 Room Apartment For Rent In Col - 4,19 Jul  3:26 pm,"Colombo 4, Colombo","5,000","Fully Furnished including Fully Equipped Kitchen, Free WiFI, International TV Channels, Hot Water, Security. Towels, Toiletries, Option for daily cleaning and transport arrangement upon request.",Lorenz Road Colombo 4,Apartment,1,1
19,Two Rooms Apartment For Rent - Colombo 4,19 Jul  3:22 pm,"Colombo 4, Colombo","6,500",Centrally located beautifully furnished these compact apartments are you home way from home. Let it be for business or holiday you will feel right at home. All the apartments are fully furnished including a fully equipped kitchen.,"Lorenze Rd, Colombo 4, Colombo 4 - Bambalapitiya",Apartment,2,2
20,2 B/room Apartment for Short and Long Stay Colombo 4 (01277),19 Jul 10:26 am,"Colombo 4, Colombo","5,500",2 B/Room Apartment for Short and Long Stay (00166),44 Lorenz Road Colombo 04,Apartment,2,2
21,2 B/room Apartment for Short and Long Stay Colombo 4 (01279),19 Jul 10:09 am,"Colombo 4, Colombo","5,500",2 B/Room Apartment for Short and Long Stay (00208),44 Lorenz Road Colombo 04,Apartment,2,2
22,Sea Brice 2 Bed Rooms Apartment in Colombo - 4,19 Jul 12:40 pm,"Colombo 4, Colombo","5,500","COLOMBO Apartments - Harmers Avenue Road, Colombo 6 .",37th lane colombo-4,Apartment,2,2
23,Luxury Apartment in Sahara 3BR Col - 4,19 Jul  2:42 pm,"Colombo 4, Colombo","7,000","COLOMBO Apartments - Harmers Avenue Road, Colombo 6 .",37; Sagara rd colombo-4,Apartment,3,2
24,3 Bed Room Apartment for Short and Long Rent - Colombo,19 Jul  9:22 am,"Colombo 4, Colombo","7,000","This 3 Room Apartment is located very close to Galle Rd in Colombo 3. It’s just few minutes walking distance to the beach and all the amenities including banks, restaurants and shopping. The Central Business District, Kollupitya Market, Liberty Plaza, Majestic City, Galle Face, Fort and Vihara Maha Devi Park all are 5 mins drive from the apartment. This Apartment is located in a very Prime Location.■ 3 Rooms, 1 Attached & 1 Common Bathroom.■ Living and Dining Area. ■ Fully Air conditioned & Fully Air Conditioned.■ 24 Hours Security and Parking. ■ Short and Long Stays.■ Daily - Rs 7,000+ Electrcity. ■ Long Term - Rs 185,000/month+Bills.",Colombo 3,Apartment,3,2
25,2 B/Room Apartment for Short and Long Stay Rent in Colombo 4 (01280),19 Jul 10:33 am,"Colombo 4, Colombo","5,500","AKARA Apartments - Lorenze Road, Colombo 4 (AS008)",44 Lorenz Road Colombo 04,Apartment,2,2
26,2 Rooms Apartment For Rent Col-4,17 Jul  8:56 pm,"Colombo 4, Colombo","6,500","These Spacious Modern Apartments consists 2 Rooms with one attached and one common bathroom, a large Living and Dining Area and a Fully Equipped Kitchen. The Apartments are Fully Furnished including TV, Washing Machine, Fridge, Ironing, Microwave etc. Kitchen is Fully Equipped including Cutleries and Crockeries. Linen also provided.","Lorenze Rd, Colombo 4, Colombo 4 - Bambalapitiya",Apartment,2,2
27,2 Rooms Apartment For Rent Col-4,17 Jul  8:56 pm,"Colombo 4, Colombo","6,500","These Spacious Modern Apartments consists 2 Rooms with one attached and one common bathroom, a large Living and Dining Area and a Fully Equipped Kitchen. The Apartments are Fully Furnished including TV, Washing Machine, Fridge, Ironing, Microwave etc. Kitchen is Fully Equipped including Cutleries and Crockeries. Linen also provided.",Lorenz Colombo  4,Apartment,2,2
28,1 Room Apartment Col - 4,17 Jul  8:56 pm,"Colombo 4, Colombo","4,500","All Apartments areFully Furnished including Fully Equipped Kitchen, Free WiFI, International TV Channels, Hot Water, Security. Towels, Toiletries, Option for daily cleaning and transport arrangement upon request.","Lorenze Rd, Colombo 4, Colombo 4 - Bambalapitiya",Apartment,1,1
29,2 Room Apartment for Short and Long Stay in Colombo 4,19 Jul  9:37 am,"Colombo 4, Colombo","5,500","AKARA Apartments - Lorenze Road, Colombo 4 (AS008)","Lorensz Road, Colombo 4.",Apartment,2,2
30,Fully Furnished Apartment - Colombo 3,17 Jul  9:14 pm,"Colombo 4, Colombo","5,000",We Have Around 100+ Apartments Short Term and Long Term Colombo 3.4.5.6.& Dehiwala SHORT STAYSVisiting Colombo for a Short Stay? We have a wide selection of Serviced and Self Catering Apartments in different locations.,HANAN Apartments Colombo 3,Apartment,3,2
31,Studio Type Apartment for Rent - Colombo 4,17 Jul  8:56 pm,"Colombo 4, Colombo","4,000","This Studio unit is located in Mayura Place in Colombo 6 (Wellawatte), with easy access to other parts of the city and all the amenities.","Lorenze Rd, Colombo 4,  Bambalapitiya",Apartment,1,1
32,New 3 Rooms Apartment For Rent Colombo,17 Jul  8:57 pm,"Colombo 4, Colombo","7,500","These Spacious Modern Apartments consists 3 Rooms with one attached and one common bathroom, a large Living and Dining Area and a Fully Equipped Kitchen. The Apartments are Fully Furnished including TV, Washing Machine, Fridge, Ironing, Microwave etc. Kitchen is Fully Equipped including Cutleries and Crockeries. Linen also provided.","Galle Rd, behind Lalson Tailors, Colombo 3 - Kollupitiya",Apartment,3,2
33,Grand New Apartment - Colombo 04,19 Jul  2:51 pm,"Colombo 4, Colombo","6,000",GRAND NEW APARTMENT. FULLY FURNISHED WITH AIR CONDITION. 24 HOUR SECURITY &  PARKING. SEA VIEW  &  KITCHEN FACILITIES. FREE WATER  &  GAS  &  INTER NATIONAL TV CHANNELS. PER DAY  6000/-  ELE PER UNIT 50/-  NOW AVAILABLE  WORRY TO NOW CALL.  WEDDING  &  PARTY  INVITE GOOD PLACE  CALL!!!!,NO  37  SAGARA ROAD COL 04,Apartment,2,2
34,Fully Furnished Apartment - Colombo 04,19 Jul  2:52 pm,"Colombo 4, Colombo","6,000",FULLY FURNISHED APARTMENT WITH AIR CONDITION.  24 HOUR SECURITY WITH PARKING. KITCHEN FACILITIES. SEA VIEW. FREE WATER AND GAS INTER NATIONAL TV CHANNELS.  PER DAY 6000/- ELE PER UNIT 50/-  NOW AVAILABLE  WORRY TO NOW CALL.  DAY AND WEEK AND MONTH CALL,NO 37 SAGARA ROAD COL 04,Apartment,2,2
35,2 Rooms Apartment for Rent Colombo 4,17 Jul  8:58 pm,"Colombo 4, Colombo","6,500","Fully Furnished including Fully Equipped Kitchen, Free WiFI, International TV Channels, Hot Water, Security. Towels, Toiletries, Option for daily cleaning and transport arrangement upon request",Lorenz Colombo  4,Apartment,2,2
36,Two Rooms Apartment For Rent Colombo 4,17 Jul  8:58 pm,"Colombo 4, Colombo","6,500","Fully Furnished including Fully Equipped Kitchen, Free WiFI, International TV Channels, Hot Water, Security. Towels, Toiletries, Option for daily cleaning and transport arrangement upon request","Lorenze Rd, Colombo 4, Colombo 4 - Bambalapitiya",Apartment,1,1
37,2 Rooms Apartment for Rent Col-4,17 Jul  8:58 pm,"Colombo 4, Colombo","5,500",Centrally Located Bought Furnished These Compact Apartments Are You Home Way from Home. Let It Be for Business or Holiday You Will Feel Right at Home. All the Apartments Are Fully Furnished Including a Fully Equipped Kitchen.,Sagra Road Colombo 4,Apartment,2,2
38,2BR Apartments in Col 4,19 Jul  2:56 pm,"Colombo 4, Colombo","6,000","COLOMBO Apartments - Harmers Avenue Road, Colombo 6 .",SAGARA ROAD COLOMBO-04,Apartment,2,2
39,Apartment in Colombo 4,19 Jul  2:57 pm,"Colombo 4, Colombo","6,500",FULLY FURNISHED APARTMENT  WITH A/C.  24 HOUR SECURITY  WITH PARKING. KITCHEN FACILITIES. FREE  WATER AND GAS  INTER NATIONAL  TV  CHANNELS.  PER DAY  6500/-  ELE PER UNIT 50/-  NOW AVAILABLE  WORRY TO NOW CALL,no 37 good hope resident colombo 4,Apartment,2,2
40,1 Bed Room Apartment in Col-4,19 Jul  2:57 pm,"Colombo 4, Colombo","4,000","COLOMBO APARTMENTS offers Fully Furnished 3Room Apartments for short and extended/long stay. Sea view apartment near sea site one car park lift have,All the Apartments are a Fully Furnished including a Fully Equipped Kitchen.1------------------------------------------------------------------------------------ ■ 1rooms 1 Bathroom. ■ Living and Dining Area. Fully Air conditioned.■  Wi-Fi, Gas, Water and International TV Channels.■ 24 Hours Security and Parking.■ Parties, wedding inculding.  PER DAY7500/- ELE PERUNIT 50/- NOW CALL",37 sagara rd colombo-4,Apartment,1,1
41,3BR Furnished at Colombo - 4,19 Jul  2:58 pm,"Colombo 4, Colombo","6,500","COLOMBO APARTMENTS offers Fully Furnished 3 Room Apartments for short and extended/long stay. Sea view apartment near sea site one car park lift have,All the Apartments are a Fully Furnished including a Fully Equipped Kitchen.1------------------------------------------------------------------------------------ ■ 3Rooms-1 Attached and 1 Common Bathroom. ■ Living and Dining Area. Fully Air conditioned.■  Wi-Fi, Gas, Water and International TV Channels.■ 24 Hours Security and Parking.■ Parties, wedding inculding.  PER DAY7500/- ELE PERUNIT 50/- NOW CALL",38 kinross ave col#4,Apartment,3,2
42,2BR Sea View Apartment in Col - 4,19 Jul  2:58 pm,"Colombo 4, Colombo","5,500","COLOMBO APARTMENTS offers Fully Furnished 2Room Apartments for short and extended/long stay. Sea view apartment near sea site one car park lift have,All the Apartments are a Fully Furnished including a Fully Equipped Kitchen.1------------------------------------------------------------------------------------ ■ 2Rooms-1 Attached and 1 Common Bathroom. ■ Living and Dining Area. Fully Air conditioned.■  Wi-Fi, Gas, Water and International TV Channels.■ 24 Hours Security and Parking.■ Parties, wedding inculding.  PER DAY7500/- ELE PERUNIT 50/- NOW CALL",37 sagara rd colombo-4,Apartment,2,2
43,2 Bedroom Apartment Col 04,19 Jul  2:59 pm,"Colombo 4, Colombo","6,500",FULLY FURNISHED APARTMENT  WITH A/C.  24 HOUR SECURITY  WITH PARKING. KITCHEN FACILITIES. FREE  WATER AND GAS  INTER NATIONAL  TV  CHANNELS.  PER DAY  6500/-  ELE PER UNIT 50/-  NOW AVAILABLE  WORRY TO NOW CALL,NO  37  SAGARA ROAD  COL  04,Apartment,2,2
44,3BR Apartment for Rent in Colombo-04,19 Jul  3:00 pm,"Colombo 4, Colombo","6,000",The apartments are tastefully furnished including fully equipped kitchen.,SAGARA ROAD NO37 COLOMBO-04,Apartment,2,2
45,1 Rooms Apartment For Rent Colombo 4,17 Jul  9:00 pm,"Colombo 4, Colombo","5,000","This Penthouse Apartment is located in Lorenz Rd in Colombo 4 (Bambalapitiya), with easy access to other parts of the city and all the amenities. Most of Colombo’s attractions including Majestic City, Liberty Plaza, ODEL and major Hotels, Hospitals and Restaurants are all within 15mins drive from the Apartment. There are many fast food outlets within few minutes waking distance. Public transport is just few meters from the building.",Lorenz Road Colombo 4,Apartment,1,1
46,3BR Furnished Apartment in Colombo 4,19 Jul  3:36 pm,"Colombo 4, Colombo","7,000","COLOMBO APARTMENTS offers Fully Furnished 3Room Apartments for short and extended/long stay. Sea view apartment near sea site one car park lift have,All the Apartments are a Fully Furnished including a Fully Equipped Kitchen.1------------------------------------------------------------------------------------ ■ 3Rooms-1 Attached and 1 Common Bathroom. ■ Living and Dining Area. Fully Air conditioned.■  Wi-Fi, Gas, Water and International TV Channels.■ 24 Hours Security and Parking.■ Parties, wedding inculding.  PER DAY7500/- ELE PERUNIT 50/- NOW CALL",37 Sagara rd colombo-4,Apartment,3,2
47,Two Rooms Apartment For Rent - Colombo 4,17 Jul  9:01 pm,"Colombo 4, Colombo","6,500","Fully Furnished including Fully Equipped Kitchen, Free WiFI, International TV Channels, Hot Water, Security. Towels, Toiletries, Option for daily cleaning and transport arrangement upon request.",Lorenz Road Colombo 4,Apartment,2,2
48,City View Apartment For Rent Colombo 4,17 Jul  9:01 pm,"Colombo 4, Colombo","5,500","Fully Furnished including Fully Equipped Kitchen, Free WiFI, International TV Channels, Hot Water, Security. Towels, Toiletries, Option for daily cleaning and transport arrangement upon request.","Lorenze Rd, Colombo 4, Colombo 4 - Bambalapitiya",Apartment,2,2
49,2 Bed Room Sea View Apartment Col 04,19 Jul  3:38 pm,"Colombo 4, Colombo","6,000",FULLY FURNISHED WITH A/C. 24 HOUR SECURITY  WITH PARKING.  KITCHEN FACILITIES. SEAVIEW  FREE WATER AND GAS INTER NATIONAL  TV  CHANNELS. PER DAY  6000/-  ELE PER UNIT 50/-  PARTY AND WEDDING INCLUDING  THIS APARTMENT. NOW AVAILABLE  WORRY TO NOW CALL,NO  37   SAGARA  ROAD COL 04,Apartment,2,2
50,3 Rooms Apartment For Rent Colombo - 4,17 Jul  9:01 pm,"Colombo 4, Colombo","6,500","■ 2 Rooms-1 Attached and 1 Common Bathroom.■ Living and Dining Area.■ Fully Furnished and Fully Air conditioned.■ Free WiFi, Gas, Water and International TV Channels.■ 24 Hours Security and Parking.■ Electricity Rs 50 per unit.","Lorenze Rd, Colombo 4, Colombo 4 - Bambalapitiya",Apartment,2,2
51,2 Rooms Apartment for Rent Colombo 4,17 Jul  9:01 pm,"Colombo 4, Colombo","6,000","■ 2 Rooms-1 Attached and 1 Common Bathroom.■ Living and Dining Area.■ Fully Furnished and Fully Air conditioned.■ Free WiFi, Gas, Water and International TV Channels.■ 24 Hours Security and Parking.■ Electricity Rs 50 per unit.",Lorenz Road Colombo 4,Apartment,2,2
52,2 Room Apartment for Short and Long Stay in Colombo 4,19 Jul  9:30 am,"Colombo 4, Colombo","5,500","KARA Apartments - Lorenze Road, Colombo 4 (AS008)",44 Lorenz Road Colombo 04,Apartment,2,2
53,1 Bed Apartment for Short and Long Stay Rent In(001277) - Colombo 04,19 Jul  9:24 am,"Colombo 4, Colombo","4,500","Studio Unit for Short & Long Stay Rent in Colombo ( 4)AKARA Apartments - Lorenze Rd, Colombo (AS006)This Studio unit come with an attaches bathroom with a kitchenette for basic cooking. It also has its private, nice and spacious balcony.The Unit is Fully Furnished including TV, Washing Machine, Fridge, Ironing, and Microwave. Kitchen is Fully Equipped including Cutleries and Crockeries. Linen also provided.------------------------------------------------------------------------------------ ■ Studio Unit with attached Bathroom and Spacious Private Balcony.■ Fully Air conditioned and Fully Air-Conditioned.■ 24 Hours Security and Parking. ■ Electricity Rs. 50 per unit.■Daily Rs 4,500+ Electricity.■Long Term Rs 135,000+Bills■ PARTIES AND GET-TO-GATHERS STRICTLY NOT ALLOWED.Call/Whatsapp/Viber us for more info/to reserve.AKARA APARTMENTS.-Serviced Apartments-Sales & Rental-Property Management.44, Lorenze Rd, Colombo 4.",44 Lorenz Road Colombo 04,Apartment,1,1
54,1 Room Apartment for Short and Long Stay Rent In(001241) - Colombo 04,19 Jul  9:30 am,"Colombo 4, Colombo","4,500",Room Apartment for Short & Long Stay - Colombo- 4,44 Lorenz Road Colombo 04,Apartment,1,1
55,1 Bed Apartment for Short and Long Stay Rent In(001240) - Colombo 04,19 Jul  9:30 am,"Colombo 4, Colombo","4,500","Studio Unit for Short & Long Stay Rent in Colombo ( 4)AKARA Apartments - Lorenze Rd, Colombo (AS006)This Studio unit come with an attaches bathroom with a kitchenette for basic cooking. It also has its private, nice and spacious balcony.The Unit is Fully Furnished including TV, Washing Machine, Fridge, Ironing, and Microwave. Kitchen is Fully Equipped including Cutleries and Crockeries. Linen also provided.------------------------------------------------------------------------------------ ■ Studio Unit with attached Bathroom and Spacious Private Balcony.■ Fully Air conditioned and Fully Air-Conditioned.■ 24 Hours Security and Parking. ■ Electricity Rs. 50 per unit.■Daily Rs 4,500+ Electricity.■Long Term Rs 135,000+Bills■ PARTIES AND GET-TO-GATHERS STRICTLY NOT ALLOWED.Call/Whatsapp/Viber us for more info/to reserve.AKARA APARTMENTS.-Serviced Apartments-Sales & Rental-Property Management.44, Lorenze Rd, Colombo 4.",44 Lorenz Road Colombo 04,Apartment,1,1
56,2 Room Apartment for Short and Long Stay in Colombo 4,19 Jul  9:42 am,"Colombo 4, Colombo","5,500","AKARA Apartments - Lorenze Road, Colombo 4 (AS008)","Lorensz Road, Colombo 4.",Apartment,2,2
57,2 Room Apartment for Short and Long Stay in Colombo 4,19 Jul  9:37 am,"Colombo 4, Colombo","5,500","AKARA Apartments - Lorenze Road, Colombo 4 (AS008)","Lorensz Road, Colombo 4.",Apartment,2,2
58,2 Room Apartment for Short & Long Stay in Colombo 4(APT001235),19 Jul  9:30 am,"Colombo 4, Colombo","5,500","KARA Apartments - Lorenze Road, Colombo 4 (AS008)",44 Lorenz Road Colombo 04,Apartment,2,2
59,1 Room Apartment for Short and Long Stay Rent In(001232) - Colombo 04,19 Jul  9:31 am,"Colombo 4, Colombo","4,500",Room Apartment for Short & Long Stay - Colombo- 4,44 Lorenz Road Colombo 04,Apartment,1,1
60,1 Bed Apartment for Short and Long Stay Rent In(001220) - Colombo 04,19 Jul  9:31 am,"Colombo 4, Colombo","4,500","Studio Unit for Short & Long Stay Rent in Colombo ( 4)AKARA Apartments - Lorenze Rd, Colombo (AS006)This Studio unit come with an attaches bathroom with a kitchenette for basic cooking. It also has its private, nice and spacious balcony.The Unit is Fully Furnished including TV, Washing Machine, Fridge, Ironing, and Microwave. Kitchen is Fully Equipped including Cutleries and Crockeries. Linen also provided.------------------------------------------------------------------------------------ ■ Studio Unit with attached Bathroom and Spacious Private Balcony.■ Fully Air conditioned and Fully Air-Conditioned.■ 24 Hours Security and Parking. ■ Electricity Rs. 50 per unit.■Daily Rs 4,500+ Electricity.■Long Term Rs 135,000+Bills■ PARTIES AND GET-TO-GATHERS STRICTLY NOT ALLOWED.Call/Whatsapp/Viber us for more info/to reserve.AKARA APARTMENTS.-Serviced Apartments-Sales & Rental-Property Management.44, Lorenze Rd, Colombo 4.",44 Lorenz Road Colombo 04,Apartment,1,1
61,1 Room Apartment for Short and Long Stay Rent In(001231) - Colombo 04,19 Jul  9:31 am,"Colombo 4, Colombo","4,500",Room Apartment for Short & Long Stay - Colombo- 4,44 Lorenz Road Colombo 04,Apartment,1,1
62,2 Rooms Apartment For Rent Colombo 04,17 Jul  9:05 pm,"Colombo 4, Colombo","5,500",Centrally located these compact apartments are you home way from home. Let it be for business or holiday you will feel right at home.,44  Lorenz Road Colombo 04,Apartment,2,2
63,2Room Apartment for Short & Long Stay (001203)Colombo 04,19 Jul  9:31 am,"Colombo 4, Colombo","5,500","KARA Apartments - Lorenze Road, Colombo 4 (AS008)",44 Lorenz Road Colombo 04,Apartment,2,2
64,1 Room Apartment for Short and Long Stay Rent In(001201) - Colombo 04,19 Jul  9:32 am,"Colombo 4, Colombo","4,500",Room Apartment for Short & Long Stay - Colombo- 4,44 Lorenz Road Colombo 04,Apartment,1,1
65,1 Bed Apartment for Short and Long Stay Rent In(001200) - Colombo 04,19 Jul  9:32 am,"Colombo 4, Colombo","4,500","Studio Unit for Short & Long Stay Rent in Colombo ( 4)AKARA Apartments - Lorenze Rd, Colombo (AS006)This Studio unit come with an attaches bathroom with a kitchenette for basic cooking. It also has its private, nice and spacious balcony.The Unit is Fully Furnished including TV, Washing Machine, Fridge, Ironing, and Microwave. Kitchen is Fully Equipped including Cutleries and Crockeries. Linen also provided.------------------------------------------------------------------------------------ ■ Studio Unit with attached Bathroom and Spacious Private Balcony.■ Fully Air conditioned and Fully Air-Conditioned.■ 24 Hours Security and Parking. ■ Electricity Rs. 50 per unit.■Daily Rs 4,500+ Electricity.■Long Term Rs 135,000+Bills■ PARTIES AND GET-TO-GATHERS STRICTLY NOT ALLOWED.Call/Whatsapp/Viber us for more info/to reserve.AKARA APARTMENTS.-Serviced Apartments-Sales & Rental-Property Management.44, Lorenze Rd, Colombo 4.",44 Lorenz Road Colombo 04,Apartment,1,1
66,2 Bedroom Apartment Col 04,19 Jul  3:53 pm,"Colombo 4, Colombo","6,000",Fully furnished apartmebt with A/C. 24 HOUR SECURITY WITH PARKING. KITCHEN FACILITIES. FREE WATER AND GAS INTER NATIONAL TV CHANNELS. PARTY AND WEDDING INCLUDING THIS APARTMENT. PERDAY 6000/- ELE PER UNIT 50/-  NOW AVAILABLE WORRY TO  NOW CALL,SAHARA ROAD COL 04,Apartment,2,2
67,Studio Type Apartment For Rent Bambalapitiya,17 Jul  9:07 pm,"Colombo 4, Colombo","4,500","This Studio unit is located in Lorenz Rd in Colombo 4 (Bambalapitiya), with easy access to other parts of the city and all the amenities. Most of Colombo’s attractions including Majestic City, Liberty Plaza, ODEL and major Hotels, Hospitals and Restaurants are all within 15mins drive from the Apartment. There are many fast food outlets within few minutes waking distance. Public transport is just few meters from the building.","Lorenze Rd, Colombo 4, Colombo 4 -",Apartment,1,1
68,2 Rooms Apartment For Rent Colombo 4,17 Jul  9:07 pm,"Colombo 4, Colombo","6,500",Centrally located these compact apartments are you home way from home. Let it be for business or holiday you will feel right at home.,"Lorenze Rd, Colombo 4, Colombo 4 - Bambalapitiya",Apartment,2,2
