,0,1,2,3,4,5,6,7
1189,Land for Sale in Katunayake, 8 Jun  8:28 am,"Katunayake, Gampaha","450,000","Land located in Katunayeka Andiambalama, facing to the Katunayeka-Gampaha main bus route. Only 5 minutes away to Katunayeke airport & Colombo Expressway. Very clear title and can arrange bank loan facilities easily. price 450000, per perch upwards. Call for more informations.",Residential,10.0 perches,
1190,Residential Land for Sale at Wattala Kerawalapitiya,18 Jul  9:01 pm,"Wattala, Gampaha","300,000",4 ACERS LAND FOR SALE  WATTALA KERAWALAPITIYA. 20 FEET ROAD ACCESS. 600 METERS TO THE HIGHWAY ENTRANCE.. MORE SUITABLE FOR AN APARTMENT COMPLEX AND A HOUSING PROJECTACCESS TO ALL THE SHOPS AND SUPERMARKETSCLEAR PAPERS AND PURE WATER FACILITIES,"WATTALA , KERAWALAPITIYA",Residential,4.0 acres
1191,Land for Sale in Udugampola,18 Jul  6:29 pm,"Gampaha, Gampaha","2,950,000","10.4p Square land with water supply, clean deeds 200m to Seeduwa road 500m to Udugampola town.","D.S. Senanayake Mawatha, Seeduwa Road, Udugampola",Residential,10.4 perches
1192,Land for Sale in Wattala, 7 Jun  9:57 pm,"Wattala, Gampaha","8,475,000",Land for sale in Wattala 7. 8 perch land square block250 metres to Colombo main road20 feet wide access RoadGood neighbourhoodPrice per perch 1125000/negotiable,Residential,7.8 perches,
1193,Land For Sale - Copra Junction, 7 Jun  9:53 pm,"Negombo, Gampaha","695,000",300m to Copra Junction Land For SaleSerious Buyers May Contact Only,"Copra Junction, Negombo",Residential,13.3 perches
1194,7 Perches Land For Sale - 500M to Bus Road, 7 Jun  9:50 pm,"Negombo, Gampaha","400,000",7 PERCHES500M TO BUS ROADQUICK SALELAST PRICESERIOUS BUYERS ONL,"Dalupotha, Negombo",Residential,7.0 perches
1195,Land for Sale in Ja-Ela, 7 Jun  8:35 pm,"Ja-Ela, Gampaha","900,000",Good Residential Land in Ja ElaFacing a Kisthuraja Mawatha,"Agricultural, Commercial, Residential, Other",84.0 perches,
1196,Land for Sale - Kadawatha, 7 Jun  8:34 pm,"Kadawatha, Gampaha","220,000",කඩවත  ගනේමුල්ල  පාරේ  දර්මදර්සි  විදුහල අසල සියලු  පහසුකම් සහිත  ඉඩම ,"Commercial, Residential",46.0 perches,
1197,Land for Sale - Minuwangoda, 7 Jun  4:17 pm,"Minuwangoda, Gampaha","79,000",මිනුවන්ගොඩ නගරයට වි.10 ළඟා  විය හැකි සියලු පහසුකම් සහිත බිම් කොටස් කීපයක් මුලින් 40% ගෙවා ඉතිරි මුදල් බැංකු ණය මගින් මාසිකව ගෙවීමට සලසා දිය හැකිය පධාන නගර වලට කෙටි දුරින් .යකහටුව brandex ආයතනයට කෙටි දුරින්,minuwangoda .horampalla,Residential,12.5 perches
1198,Land for Sale in Wattala,10 Jun  9:34 pm,"Wattala, Gampaha","2,000,000","Property for sale at Hendala, Wattala. 94 perches prime flat land located in a high residential area. 1km from Hendala Junction at Colombo Negombo Rd.  100 mtrs. from Hendala Elakanda main Road. 5 mts. to Kerawalapitiya main outer circular Highway.116 ft. main road frontage, 2 way road access. Front 30 ft. wide, side 17 ft. wide,Close proximity to leading Banks several International School Lyceum, Okai, Hemas Hospital, Supermarkets, Churches, Temple and to the Beaches.Excellent Title, and clear Deeds, An ancestral PropertyIdeal location for Condo developmentNo brokers",Residential,94.0 perches,
1199,64 P Bare Land Sale at Kelaniya, 7 Jun  2:48 pm,"Kelaniya, Gampaha","575,000",Rs 575000.00 per perch,UDANA MAWATHA 20 FEET ROAD / SADHATISSA ME  ( 15 FEET ROAD ) KELANIYA - BIYAGAMA ROAD KELANIYA,"Commercial, Residential",64.0 perches
1200,Bare Land for Sale - Kadirana, 7 Jun  2:41 pm,"Negombo, Gampaha","275,000",A bare flat land very suitable to build a residence. Calm and quit inhabited location. Proper entries are avialable. Just 15 miniutes away from negombo town and 05 Miniutes away from St Nikalas Internationa school and Maristella College. Call for more informations.,"Guruge Uyana, Kadirana",Residential,13.0 perches
1201,Land for Sale in Keenawala,12 Jun  3:44 pm,"Veyangoda, Gampaha","250,000","කිඉනවල දුම්රිය ස්ථානයට මීටර් 50යි,පොල් වගාකර තිබේ,","Veyangoda,Keenawala","Agricultural, Commercial, Residential",15.0 perches
1202,Land for Sale - Kelaniya, 7 Jun  1:22 pm,"Kelaniya, Gampaha","1,500,000","*face to main road *to colombo port 8km*to colombo nuwara road 300m*this land can use for your business place,build a house or praking sapce for vehicle and big trucks *කොටස් වශයෙන් විකිණීමට තිබේ*we give one perch 1500000*we don't need brokes","Waragoda,kelaniya",Other,480.0 perches
1203,"8.76P Land for Sale in Kiribathgoda,Gemunu Mawatha.", 7 Jun  1:11 pm,"Kiribathgoda, Gampaha","5,518,800","8.76p LAND FOR SALE IN  KIRIBATHGODA,GEMUNU MAWATHA.","Kiribathgoda, Gemunu Mawatha.","Commercial, Residential",8.76 perches
1204,30 Perches Land for Sale in Kandana., 7 Jun 12:53 pm,"Kandana, Gampaha","25,000,000",30 PERCHES LAND FOR SALE IN KANDANA.,"Kandana, St Jude Mawatha.","Commercial, Residential",30.0 perches
1205,Residential Land Plot Sale Waboda Kadawatha,27 Jun  5:14 am,"Gampaha, Gampaha","4,000,000","11.2 perches bare landWeboda, kadawatha2km to kandy road3 km to kawawatha highway entrance Property of Prime land Clear deedsHighly residential area,respectable neighborhood380000/-per perch , price negotiable Contact",Residential,11.2 perches,
1206,10.60P Land for sale in welisara,15 Jul  9:36 am,"Wattala, Gampaha","525,000","10P Land For Sale waththala, Walisara, near Macdonal, parakrama Road.","Wattala, walisara, Near Macdonal, parakrama Road",Residential,10.6 perches
1207,Land for sale in Negombo,19 Jun  2:09 pm,"Negombo, Gampaha","360,000","• 25% discount valid till June 23rd• Exclusive land plots• Highly residential neighborhood• Tranquil environment• Clear deeds• 1.km to Thelwaththa junction• 200m to Sussex International College• 100m to Negombo-Minuwangoda main bus route• Three phase electricity, water, 20ft access road • Rs.360,000/- pp (discounted price)• 10p-11p blocks available• Price negotiable","Commercial, Residential, Other",10.0 perches,
1208,"Squared, Developed 16.3 Perch Land 2.5km for Sale in Weliweriya Town",10 Jun  8:16 am,"Gampaha, Gampaha","100,000","Squared, developed (all utilities available, water, electricity etc) land in Kirikiththa Road, Weliweriya, Gampaha. 2.5KM to Weliweriya town. Single Owner Owned land, clear dead","Kirikiththa Road, Weliweriya, Gamapha",Residential,16.3 perches
1209,"Land for sale in Udugampola, Gampaha",10 Jul  1:03 pm,"Gampaha, Gampaha","120,000","This land is situated in 'Pathahawatta', Udugampola, Gampaha.22.5 perches landTap line is available.800 m to St. Peter's College, Udugampola.400 m to Gampaha, Minuwangoda main road1 km to Udugampola townAn opportunity not to be missed.","Udugampola , Gampaha",Residential,22.5 perches
1210,Land with House for sale - Delgoda, 6 Jun  6:41 pm,"Delgoda, Gampaha","8,000,000",දෙල්ගොඩ සිට 3 km දුරින් පිහිටි පර්චස් 33 සමග නිවසක් විකිණීමට... ඵම ඉඩමට යාබද පර්චස් 32 ඉඩමක් විකිණීමට... දෙකම ඵකක් වශයෙන් හෝ දෙකක් වශයෙන් දිය හැක... පර්චස් 33 නිවස සමග ඉඩම දෙකම 8000000......,"Agricultural, Residential",32.0 perches,
1211,"Land Near Kandy Colombo Rd, Weweldeniya", 6 Jun  5:08 pm,"Mirigama, Gampaha","200,000","100m from Kandy colombo main road, valuble land slot for sale for highest offer..!! * Well water* Electricity Good for residence or commercial purpose Call for more infomation","112 Ihalagama, Weweldeniya.","Commercial, Residential",40.0 perches
1212,Land for sale in Biyagama - Siyabalape, 6 Jun  4:39 pm,"Delgoda, Gampaha","330,000","A square 10 P land in Biyagama (around 1km from Siyambalape junction) with a peaceful environment, boundary wall, Water tap line and electricity  Include.  600 meter from Biyagama – Kiribathgoda main road,  No flooding. Clear deeds. Approved plan with clear documents.","Siyabamlape, Biyagama",Residential,10.0 perches
1213,Real Land | Nayakakanda Plot 02, 6 Jun  4:09 pm,"Wattala, Gampaha","725,000",Wattala Nayakakanda highly Residential land PlotMatagoda RoadHendala Road 1.3 km,Wattala - Nayakakanda,Residential,10.0 perches
1214,20 Perch Land with Half Constructing House in Yakkala,25 Jun  9:51 am,"Gampaha, Gampaha","5,100,000","20 Perches Land and Half Constructing House for Sale at Weediyawatta, Yakkala. Built on 1300 sq.ft floor area. The house consist of 2 Bedrooms, 1 bathroom. Clear deeds.","Weediyawatta, Yakkala.","Residential, Other",20.0 perches
1215,අධීවේගී පිවිසුමට සමීප ඉඩමක් විකිණීමට - වේයන්ගොඩ, 6 Jun  2:08 pm,"Veyangoda, Gampaha","125,000","වේයන්ගොඩ, මල්ලැහැව මාර්ගයේ පදිංචියට හෝ ව්‍යාපාරික ස්ථානයකට සුදුසු පර්චස් 26.5 ක ඉඩම.පර්චසයක මිල රු.125,000/-ක් පමණි. ඉදිවන මධ්‍යම අධිවේගී මාර්ගයේ පිවිසුමට සමීපව. වේයන්ගොඩ නගරයට 5km. නිට්ටඹුව නගරයට හා නුවර පාරට 7km. කටුනායකට පාරට, පස්යාල මංසන්ධියට, මීරිගමට හා ප්‍රධාන පාසල්වලට අසන්න දුරකින්.තැනිතලා ඉඩම. නිරවුල් ඔප්පු.මිල ගණන් කතා කර ගත හැකිය.","340, කුඹල්ඔළුව, වේයන්ගොඩ.","Commercial, Residential",26.5 perches
1216,Land for Sale Ganemulla, 8 Jun 11:05 am,"Ganemulla, Gampaha","375,000",ගනේමුල්ල නගරයට ආසන්නයේ පර්.10ක ඉඩම ඉක්මනින් විකිණීමට ඇත.දුම්රිය පලට මිටර් 600. කඩවත අදිවේගි මාර්ගයට සහ ඉදිවන නුවර අදිවේගි මාර්ගයේ ගම්පහ පිවිසුමට පහසුවෙන් ලගාවීම.නිදහස් පරිසරය ..පිරිසිදු ඔප්පු ..,Ganemulla,Residential,10.0 perches
1217,Land for Sale - Wattala 9.5 Perches,15 Jul 12:26 pm,"Wattala, Gampaha","1,500,000",WATTALA TOWNSeewali Lane - Station RoadLuxurious Residential area9.5 Perches ( 2 Plots )1.5 Million Per Perch200 Meters from Hendala JunctionBank Loan facility availableSquire Land Please Call For More Details,Seewali Lane - Station Road,Residential,9.5 perches
1218,Land for Sale in Negombo Daluwakotuwa,20 Jul  8:33 pm,"Negombo, Gampaha","850,000",# කොළඹ - හලාවත ප්‍රධාන බස් පාරට මුහුණලා ( දෙවෙනි ඉඩම ) මිගමුව / දළුවකොටුව නගරයෙන් අගනා / වටිනා පර්චස් 20 ක ඉඩමක් වහාම විකිණීමට තිබේ ....# ප්‍රධාන පාරේ සිට අඩි 12 පාර ඉඩමටම ..# සින්නක්කර / නිරවුල් ඔප්පු ..# මීගමුව නගරයට විනාඩි 5 න් ..# කොච්චිකඩේ නගරයට විනාඩි 2 න් ..# පර්චස් 15 ක් වුවද දිය හැක ...# අධික ඉල්ලුමක් පවතින බැවින් ඉක්මණින් විමසන්න ...# අයිතිකරුගේ දූරකථන අoකය පහතින් තිබේ,Daluwakotuwa / Negombo,"Commercial, Residential, Other",20.0 perches
1219,Land with Two Rooms House and Separate 8 for Sale in Ekala, 6 Jun 12:03 pm,"Ja-Ela, Gampaha","8,000,000",Two Rooms House And Separate 8 RoomsNext to industrial zoneIdeal place for room/house rent service or boaring roomsLand size nearly 20 perches4laks per perch(slightly negotiable after inspection)No brokers pls,"Ekala, Ja Ela",Residential,20.0 perches
1220,Land For Sale Weliveriya, 3 Jul 12:24 pm,"Gampaha, Gampaha","1,300,000",දකුණ ඇඹරලුව වැලිවේරිය පිහිටි සියලු පහසුකම් වලින් සමන්විත පර්චස් 10ක ඉඩම ඉක්මනින් විකිණේ. නිස්කලංක පරිසරයක පිහිටා ඇත.,"South Ambaraluwa, Amara Mawatha, Weliveriya",Residential,10.0 perches
1221,10 Perches Land for Sale Ja Ela, 7 Jun  2:54 pm,"Ja-Ela, Gampaha","350,000",10 perches land (2 slots)2 KM distance from Colombo Negombo roadSituated in Prime land schemeHighly residential area,Residential,10.0 perches,
1222,Nittambuwa Land Urgent Sale - නිට්ටඹුව ඉඩමක් හදිසි විකිණීමට, 8 Jul  2:22 am,"Nittambuwa, Gampaha","350,000","නුවර පාර නිට්ටඹුව පස්යාලෙහි පිහිටි පර්චස් 160 (අක්කරයක්) වටිනා ඉඩමකි.ඉඩම සමඟ පැරණි නිවසක් හා අලුතින් ඉදිකරන ලද නිවසක්ද ඇත.ජල,විදුලිය හා දුරකථන පහසුකම්  සහිතව පොල් හා කොස් වැනි වටිනා ගස් වර්ගද ඇත. මේ සමග ගණේෂ් පාර,ත්‍රිකුනාමලයෙහි පර්චස් 26ක ඉඩමක්ද ඇත.එහි කාමර 05ක් සහිත නිවසක් ජල,විදුලිය පහසුකම් සහිතව ඇත.ඉඩම් දෙකම සුවිශේෂී අඩු මිලකට ලබාදේ.","නුවර පාර, නිට්ටඹුව","Agricultural, Commercial, Residential, Other",160.0 perches
1223,Land for Sale - Kelaniya, 5 Jun  4:56 pm,"Kelaniya, Gampaha","8,000,000","Land with half way completed building for sale In Kelaniya, Nungamugoda  20p land with half way completed 2 storied building  No brokers Giving less than the market rate Contact Madura","Nungamugoda, Kelaniya",Residential,20.0 perches
1224,Land For Sale in Divulapitiya / Waradala,24 Jun  3:00 pm,"Divulapitiya, Gampaha","88,000",දිවුලපිටිය වරාදලින් අගනා නේවාසික බිම් කොටස් මේ උත්සව සමයේ ඉඩමක් මිල දී ගෙන 20% ක වට්ටමක් හිමිකර ගන්න.⏩ විදුලිය⏩ තාර යෙදු පුලුල් මාර්ග⏩ DAMRO / CIC / LANKA TILE කර්මාන්තශාලා වලට ආසන්නව⏩ 251 බස් මාර්ගයට මීටර් 100යි.⏩ කුරුණැගල කොළබ 5 පාරට 1.2km,waradala,Residential,12.5 perches
1225,Land With House For Sale In Ja Ela, 5 Jun  4:00 pm,"Ja-Ela, Gampaha","7,500,000",Land With House For Sale In Ja Ela,JaEla,"Commercial, Residential",15.0 perches
1226,Land with House for Sale in Wattala,19 Jul  7:43 am,"Wattala, Gampaha","9,025,000","70 perches land With house  for sale in Hendala, KalaWarapitiya.The money is hurry so prices can be negotiated","Agricultural, Commercial, Residential",70.0 perches,
1227,Land for sale - Minuwangoda, 5 Jun  3:03 pm,"Minuwangoda, Gampaha","795,000",ඉඩමට අඩි .15 කොන්ක්‍රීට්  දැමු මාර්ගය  ලක්ෂ  7.95/= ඉක්මනින්  විකිනීමට .,"මිනුවන්ගොඩ ,වටිනාපහ",Other,8.0 perches
1228,Residential Land (13.16 Perches) - Kiribathgoda, 5 Jun  2:37 pm,"Kiribathgoda, Gampaha","500,000","Perfect Land (13.16 Perches). Ideal for New Home Builders and Unique View Facing Highway. Excellent Residential Neighborhood Surrounded by Newly Built Houses. Clean Title, No Outstanding Loans (fully Owned). Walking Distance to Main Road (200 M). 10 Minutes to Kiribathgoda, 10 Minutes to Kadawatha and 10 Minutes to Highway Entrance.Directions to The Land: Drive Along Kiribathgoda/makola Road Towards Y Junction, Turn Left from Y Junction, Approximately After 1.5 - 2.0 Km Turn Right in To Youth Services Council Road (sabhaawa Road), Land Is on Your Left Hand Side, 200 M from Main Road","Youth Services Council Road, Spittel State, Makola, Kiribathgoda",Residential,13.16 perches
1229,Land with House for Sale in Minuwangoda,25 Jun  6:00 pm,"Gampaha, Gampaha","3,500,000",*  Located just 05 minutes away from Minuwangoda town and 06 km to Gampaha city.*  Only 10km to Katunayake International Air port.*  Clear Titles.*  40ft Carpet road*  03 phase Electricity*  Can arrange bank loan*  01 attach Bath room*  Under construction home * Please call more information,Between Gampaha Minuwangoda main road,"Commercial, Residential",15.0 perches
1230,Blocking out Land for Sale in Mahara - Kadawatha, 5 Jun 12:59 pm,"Kadawatha, Gampaha","1,225,000","Super Luxury land plots for sale* Rs. 1.2 mn up per perch.* 6.0 perches up* 50Meters to Kandy Rd,* 5 mins to Highway entrance* 20 feet wide road * High schools , International Schools, Higher educational centers, Private hospitals, Banks , walking distance to Jogging Tracks, Super markets, Cinemas, Fitness Centers etc..............",Mahara - Eksath Mawatha,"Commercial, Residential, Other",6.0 perches
1231,Land for Sale at - Nedagamuwa,25 Jun  9:51 am,"Gampaha, Gampaha","90,000","35 Perches Land for Sale at Sarananda Mawatha, Nedagamuwa, Gampaha, facing beautiful paddy field. just 200 meters away from Gampaha – Negombo (244) bus route. Just 15 minutes drive to Airport Colombo Ja-Ela highway Entrance, less than 20 minutes to Airport and 30 minutes to Kadawatha highway entrance, about 1 hour to Colombo Capital.","Gal Linda Road, Sarananda Mw, Nedagamuwa","Commercial, Residential, Other",35.0 perches
1232,Land for Sale - Nittambuwa, 5 Jun 12:24 pm,"Nittambuwa, Gampaha","700,000",නිට්ටඹුව සිට 500m ක් නුදුරින් නම්බාදලුව පාරේ ගලේවත්ත.මෙය සම්පූර්ණ ඉඩමකි.නිස්කලංක සුන්දර වටපිටාවක පිහිට ඇත.විදුලිය හා ජලය ඇත.,Residential,20.0 perches,
1233,Land for Sale Kadawatha, 5 Jun  1:42 pm,"Kadawatha, Gampaha","350,000","කඩවත කිරිල්ලවල හන්දියට 1.5km දුරින් වැවේ පන්සල ඉදිරිපිට පර්චර්ස් 10, ඉඩම විකිණිමට. බැංකු ණය ලබාගත හැක.",Residential,10.0 perches,
1234,Commercial / Residential 29.4 Perch Bare Land for Sale in Negombo,11 Jun  9:13 am,"Negombo, Gampaha","590,000",29.4 perch bare landHighly commercial and residential areaWith in Negombo Municipal Council LimitsFacing to 273 Negombo - Ja Ela bus rute100 meters from Pitipana church on Land side,"Pitipana,Negombo","Commercial, Residential",29.4 perches
1235,Land for Sale - Gampaha, 5 Jun  8:50 am,"Gampaha, Gampaha","450,000",2km to gampaha town..200 meaters to yakkala gampaha main road,sirimal uyana,Residential,13.0 perches
1236,Land for Sale - Kiribathgoda, 4 Jun 11:46 pm,"Kiribathgoda, Gampaha","425,000","all convenient stores are located within 100 metres. The Kelaniya raja maha viharaya is located 1.2 km from this location. Whereas, the kandy road is 1km in distance. additionally it takes 1.5 km in distance to the town.","no.707, kohalwila road, dalugama, Kiribathgoda",Residential,12.0 perches
1237,Land for Sale in - Delgoda, 9 Jul  9:02 am,"Delgoda, Gampaha","150,000","පර්චස් 12.5 ක හතරැස් ඉඩම. මෑතකදී කැබලි කරන ලද ඉඩමකි. දෙපැත්තෙන්ම අඩි 12 පාරවල් දෙකක් සහිතයි. දෙල්ගොඩ නගරයට  (නව නුවර පාරට)  කිලෝමීටර් 4 යි227 හේනේගම බස් මාර්ගයේ සිට මීටර් 250ක ඇවිදින දුර. බියගම වෙළද කලාපයට ආසන්නයේ පිහිටා ඇත. පූගොඩ- කොළඹ 224 ප්‍රධාන පාරට මීටර් 1800 යි.දෙල්ගොඩ නගරයේ සිට කිලෝමීටර් 2.2ක් ගිය පසු මූකලාන හන්දියෙන් හැරී මීටර් 1800ක් ඇතුළත ඉඩම පිහිටා ඇත. කාපට් පාරේ සිට ඉඩම දක්වා මීටර් 250ක් කොන්ක්‍රීට් මාර්ගය. යහපත් අසල්වැසි පරිසරය. පර්චසය 165,000/=.  ඉක්මනින් විකිණීමට. මිලගණන් සාකච්ඡා කරගත හැක.","Ahugammana, Delgoda.",Residential,12.5 perches
1238,Plot 15 - Gampaha Paddy Field View, 4 Jun  5:28 pm,"Gampaha, Gampaha","285,000","• 8 blocks of land facing paddy field 200m from Gampaha-Udugampola main road in Asgiriya, Gampaha along Kudakanda Road available for sale.• Electricity, Water and Clear Deeds Available• Access through wide Concrete Road• 2.5km from Gampaha railway station and proposed entrance to the Colombo-Kandy expressway• Close to all leading schools in Gampaha including Yasodara Devi Balika Vidyalaya and Rathnawali Balika Vidyalaya• Peaceful, serene environment minutes away from the Gampaha city center• Perfect location to build your home close to Gampaha city• Only serious buyers please inquire","Kudakanda Road, Asgiriya, Gampaha",Residential,22.0 perches
1239,Plot 8 - Gampaha Paddy Field View, 4 Jun  5:26 pm,"Gampaha, Gampaha","285,000","• 8 blocks of land facing paddy field 200m from Gampaha-Udugampola main road in Asgiriya, Gampaha along Kudakanda Road available for sale.• Electricity, Water and Clear Deeds Available• Access through wide Concrete Road• 2.5km from Gampaha railway station and proposed entrance to the Colombo-Kandy expressway• Close to all leading schools in Gampaha including Yasodara Devi Balika Vidyalaya and Rathnawali Balika Vidyalaya• Peaceful, serene environment minutes away from the Gampaha city center• Perfect location to build your home close to Gampaha city• Only serious buyers please inquire","Kudakanda Road, Asgiriya, Gampaha",Residential,20.0 perches
1240,Plot 7 - Gampaha Asgiriya Land Sale, 4 Jun  5:23 pm,"Gampaha, Gampaha","285,000","• 8 blocks of land facing paddy field 200m from Gampaha-Udugampola main road in Asgiriya, Gampaha along Kudakanda Road available for sale.• Electricity, Water and Clear Deeds Available• Access through wide Concrete Road• 2.5km from Gampaha railway station and proposed entrance to the Colombo-Kandy expressway• Close to all leading schools in Gampaha including Yasodara Devi Balika Vidyalaya and Rathnawali Balika Vidyalaya• Peaceful, serene environment minutes away from the Gampaha city center• Perfect location to build your home close to Gampaha city• Only serious buyers please inquire","Kudakanda Road, Asgiriya, Gampaha",Residential,21.0 perches
1241,Plot 6 - Gampaha Asgiriya Land Sale, 4 Jun  5:21 pm,"Gampaha, Gampaha","285,000","• 8 blocks of land facing paddy field 200m from Gampaha-Udugampola main road in Asgiriya, Gampaha along Kudakanda Road available for sale.• Electricity, Water and Clear Deeds Available• Access through wide Concrete Road• 2.5km from Gampaha railway station and proposed entrance to the Colombo-Kandy expressway• Close to all leading schools in Gampaha including Yasodara Devi Balika Vidyalaya and Rathnawali Balika Vidyalaya• Peaceful, serene environment minutes away from the Gampaha city center• Perfect location to build your home close to Gampaha city• Only serious buyers please inquire","Kudakanda Road, Asgiriya, Gampaha",Residential,13.8 perches
1242,Plot 5 - Gampaha Asgiriya Land Sale, 4 Jun  5:17 pm,"Gampaha, Gampaha","285,000","• 8 blocks of land facing paddy field 200m from Gampaha-Udugampola main road in Asgiriya, Gampaha along Kudakanda Road available for sale.• Electricity, Water and Clear Deeds Available• Access through wide Concrete Road• 2.5km from Gampaha railway station and proposed entrance to the Colombo-Kandy expressway• Close to all leading schools in Gampaha including Yasodara Devi Balika Vidyalaya and Rathnawali Balika Vidyalaya• Peaceful, serene environment minutes away from the Gampaha city center• Perfect location to build your home close to Gampaha city• Only serious buyers please inquire","Kudakanda Road, Asgiriya, Gampaha",Residential,23.8 perches
