,0,1,2,3,4,5,6,7
768,Land for Sale - Mirigama,26 Jun 12:36 pm,"Mirigama, Gampaha","1,188,000",මනරම් වෙල්යායකයට මායිම්වමුලික ගෙවීම ලක්ෂයක් (100000)පමණි.අප අායතනය හරහා වසර 5ක් දක්වා ගෙවීමේ පහසු ක්‍රම මීරිගම දුම්රිය ස්ථානයට විනාඩි 05න්... ඔබේ අායෝජනයට වසර 5කදී 300% ක සහතික මිලක්කොළඹ කුරුණෑගල (5 පාර) බස් පාරට විනාඩි 10න්බාඳුරාගොඩ නගරයට මීටර් 700242 මීරිගම - මීගමුව බස්පාරට මීටර් 200යියෝජිත අධිවේගී පිවිසුමට විනාඩි 5තෙකලා විදුලියකොන්ක්‍රීට් කරන ලද පුළුල් මාර්ගබැංකු ණය පහසුකම් සකසා දෙනු ලැබේ.අවසාන බිම් කොටස් 3 පමණි.වැඩි විස්තර සදහා දැන්ම අමතන්න.,Mirigama,Commercial,13.5 perches
769,Land for sale - Mirigama,26 Jun 12:28 pm,"Mirigama, Gampaha","1,410,000",මනරම් වෙල්යායකයට මායිම්වමුලික ගෙවීම ලක්ෂයක් (100000)පමණි.අප අායතනය හරහා වසර 5ක් දක්වා ගෙවීමේ පහසු ක්‍රම මීරිගම දුම්රිය ස්ථානයට විනාඩි 05න්... ඔබේ අායෝජනයට වසර 5කදී 300% ක සහතික මිලක්කොළඹ කුරුණෑගල (5 පාර) බස් පාරට විනාඩි 10න්බාඳුරාගොඩ නගරයට මීටර් 700242 මීරිගම - මීගමුව බස්පාරට මීටර් 200යියෝජිත අධිවේගී පිවිසුමට විනාඩි 5තෙකලා විදුලියකොන්ක්‍රීට් කරන ලද පුළුල් මාර්ගබැංකු ණය පහසුකම් සකසා දෙනු ලැබේ.අවසාන බිම් කොටස් 03 පමණි.වැඩි විස්තර සදහා දැන්ම අමතන්න.,Mirigama,Commercial,15.0 perches
770,125 Perch Land for Sale in Kiribathgoda - Kadawatha,26 Jun  1:38 pm,"Kiribathgoda, Gampaha","250,000","කිරිබත්ගොඩට සහ කඩවත නගරයන්ට විනාඩි 10 න් ලගා විය හෑකි, කඩවත අධිවේගී මාර්ග පිවිසුමට ආසන්නව -  පදින්චියට සුදුසු නිදහස් පරිසරයකින් යුතු, නිරවුල් ඔප්පු සහිත මනාව නඩත්තු කරන ලද පොල් ගස් 60 වගාවකින් සහ කොස් ගස් 2 කින් යුත් ළිං ජලය/ නල ජලය සහ තෙකලා විදුලිය සහිත කුඩා ගොඩනෑගිල්ලක්ද සහිත පර්චස් 125 ක් පුද්ගලිකව එකවර විකිනේ. පුද්ගලික පදංචියට හෝ ආයෝජනයක් සදහා සුදුසු ඉතා නිදහස් නිස්කලංක ස්වාභාවික වටා පිටාවක පිහිටා ඇත. බ්රොකර් වරුන් අනවශ්යයි. මිල ගණන් සාකච්ඡා කළ හැක්කේ ඉඩම පරීක්ශා කිරීමෙන් පසුව පමණි. ","Kadawatha , Kiribathgoda","Agricultural, Commercial, Residential",125.0 perches
771,Land with Banglow for Sale in Minuwangoda,26 Jun 10:15 am,"Minuwangoda, Gampaha","13,500,000",* Located just 05 minutes away from Minuwangoda town and 06 km to Gampaha city.* Only 10km to Katunayake International Air port.* Clear Titles.* 40ft Carpet road* 03 phase Electricity* with swimming pool* Suitable for small resort or personal Ban glow* Former used by a Foreigner* Can arrange bank loan* Call more information,Between Gampaha Minuwangoda main road,"Commercial, Residential, Other",70.0 perches
772,Land for Sale in Minuwangoda Road Negombo,26 Jun 12:20 pm,"Negombo, Gampaha","110,000",Nearest Heales  company,Negambo Divlapitiya  road Hora kale wattha,Residential,15.0 perches
773,Land for Sale in Veyangoda,26 Jun  9:36 am,"Veyangoda, Gampaha","148,000",වේයන්ගොඩ හීන්දෙනිය නව වෙන්දේසි ඉඩමෙහි පර්චස් 12.5 බිම්කඩක් ඉතාමත් ඉක්මනින් විකිනීමට ඇත.,"Hendeniya Pattigoda, Veyangoda","Commercial, Residential, Other",12.5 perches
774,මීගමුව නගර සීමාවෙන අගනා ඉඩමක්,26 Jun  9:19 am,"Negombo, Gampaha","7,000,000",මීගමුව loyola පාසල ඉදිරිපිට පාරේ මීටර 70ක් පමන දුරින් පිහිටි හතරැස් ඉඩම.,negombo,Other,17.0 perches
775,Land for Sale in Seeduwa,26 Jun  8:04 am,"Katunayake, Gampaha","400,000","සීදුව රද්දොළුව ඉඩමක් විකිණීමට පර්චස් 32සීදුව හන්දියට කිමී 3යිගුවන්තොටුපලට කිමී 5යිසුපිරි වෙළඳ සැල්,පාසල්,රෝහල් ඇතුළු සියලු පහසුකම් ඉතා ආසන්නව.පර්චසය ලක්‍ෂ 4යිමුළු වටිනාකම ලක්‍ෂ 128යිගණුදෙනු  කතා කර ගත හැක.","seeduwa,raddoluwa",Residential,32.0 perches
776,10 p Face to Highway Land for sale in Kiribathgoda,26 Jun  8:03 am,"Kiribathgoda, Gampaha","4,000,000",10 p LAND FOR SALE IN  kadawatha,"Kiribathgoda, Galwala junction, Daluggala rd",Residential,10.0 perches
777,15p Land for sale in - Kadawatha,26 Jun  6:57 am,"Kadawatha, Gampaha","7,900,000",15 p LAND FOR SALE IN  kadawatha,"Kadawatha, jayasiri mawatha",Residential,15.0 perches
778,High Demanding Area for Residencies,26 Jun  6:47 am,"Ja-Ela, Gampaha","800,000","60 perches land sale at kapuwatta, Jaela.Highly residential area, peaceful surrounding, good neighborhood.Easy access to Colombo Negombo main road less than 100 meters, opposite K-Zone.","Kapuwatta, Ja-ela.",Residential,60.0 perches
779,Land for Sale in Andiambalama,11 Jul  2:33 pm,"Katunayake, Gampaha","3,000,000","Katunayaka, Andiambalama, saranathissa mawatha , 12.5 perches land for sale. Clear deed.",Residential,12.5 perches,
780,2 Acre Land For Sale - Delgoda,25 Jun  7:16 pm,"Delgoda, Gampaha","140,000","Dompe – 2 Acre bare land with 15 ft access road to Indolamulla Road. 600 m to Pugoda – Colombo main road - Dompe Primary / Maha Vidyalaya junction. Quiet surrounding, suitable for residential and commercial purposes. Contact for more information","indolamulla Road, Dompe","Agricultural, Commercial, Residential",2.0 acres
781,"Land for Sale situated at Parackrama Road, Gampaha",25 Jun  5:24 pm,"Gampaha, Gampaha","875,000","10 Perches Bare Land available for Sale situated at Parackrama Road, Gampaha. Good solid rectangular shape land with all necessary facilities",Parackrama Road,"Commercial, Residential, Other",10.0 perches
782,Land For Sale at Weliweriya,25 Jun  6:58 pm,"Gampaha, Gampaha","150,000","13.5 Perches flat land with complete wellApproved land from Gampaha local authority3.4 KM from land to Delgoda town9.5 KM to Biyagama free trade zone14.5 KM to Kaduwela22 KM to battaramulla12 KM to Kadawatha Interchange16.5 KM to Kiribathgoda13.3 SapugaskandaPer Perch 150,000 Price Can be negotiable.100% clear documentsthere is a approved house plan also","Emaraluwa South, Weliweriya",Residential,13.5 perches
783,Land for Sale Kadawatha, 3 Jul  1:24 pm,"Kadawatha, Gampaha","275,000","8 perch blocks, with 20ft road access in housing scheme. WATER BOARD LINE & ELECTRICITY AVAILABLE. Just 700 mt from main road (Colombo - Delgoda bus route) bank loan facility available.","MAHENA ROAD, MEEGAWATTA",Residential,8.0 perches
784,Residential Lands for Sale in Ragama,25 Jun  4:30 pm,"Ragama, Gampaha","900,000",Resident land For Sale in Ragama 500meters to Ragama 300 metres to Ragama General hospital --------------------------Ideal For:----  / Office/Wearhouse/ Bulding/Residence etc...,Ragama Near Medical Faculty.,"Commercial, Residential",15.0 perches
785,Land for Sale Dompe,19 Jul  2:53 pm,"Delgoda, Gampaha","80,000",224 colombo-pugoda saha 207 gampaha-pugoda pradhana margayata 2km pamani.banku naya laba ganiima sadaha avashya siyaluma liyavili pavathi.adi 12 margayajalaya. viduliya. durakathana.thanithala idama,237/1 indolamulla dome,"Agricultural, Residential, Other",100.0 perches
786,Land for Sale - Batuwattha,18 Jul  5:49 pm,"Ja-Ela, Gampaha","310,000",රාගමට කිලෝමිටර 3ස්ටේෂමට විනාඩි 5 දුර979 ප්‍රධාන පාරට නුදුරින්.පර්. 34.8 යිපර්. එකක් 3.10 යිමුදල සාකච්චා කර ගත හැකිය.,"111D, Batuwattha, Ragama.",Residential,34.8 perches
787,"9 Perch Land for Sale in Dalugama, Kelaniya",25 Jun  3:42 pm,"Kelaniya, Gampaha","750,000","9 Perch land with an old house facing Dippitigoda road, Kelaniya.5 minutes to University of Kelaniya and close to Kiribathgoda.Easy access to all express way  and Negombo road.1.3 km to Colombo-Kandy main road (6th mile post).Clear deeds and titles.","Dippitigoda Road, Dalugama, Kelaniya.",Residential,9.0 perches
788,Land for Sale in - Kelaniya,25 Jun  3:32 pm,"Kelaniya, Gampaha","2,200,000",Ambatale Road10 PerchesImmediate Sale,Ambatale Road,Other,10.0 perches
789,Commercial Land for Sale Kiribathgoda,25 Jun  3:31 pm,"Kiribathgoda, Gampaha","1,800,000","15.5 commercial land for sale from Kiribathgoda Eriyavetiya Road, 20 meters to Kiribathgoda town.ව්‍යාපාරික ස්ථානයකට ඉතා සුදුසු කිරිබත්ගොඩ නගරයේ ඊරියවෑටිය පාරෙන් , නුවර කොළඹ මාර්ගයට මීටර 20කි.Vista 0767647693",Kiribathgoda Town,"Commercial, Residential",15.5 perches
790,Land for Sale - Kotugoda,25 Jun  3:03 pm,"Negombo, Gampaha","460,000",ජාඇල මිනුවන්ගොඩ ප්‍රධාන පාරට නුදුරුව පදිංචියට සුදුසු අගනා බිම් කොටසක් ඉක්මණින් විකිනීමට ඇත මිල ගණන් සාකච්චා කර ගත හැක ( මුදල් අවශ්‍යතාවක් සදහා ),No 137 / F Miriswatta Kotugoda,"Residential, Other",19.5 perches
791,Land for Sale in Makola,18 Jul  2:12 pm,"Gampaha, Gampaha","390,000","20 perch land for immediate sale in a good residential area, 300 to Kiribathgoda, Delgoda road, 4 Km to Kiribathgoda town.","Sabawa Road, Makola South.",Residential,20.0 perches
792,Land for Sale in Minuwangoda,25 Jun  2:08 pm,"Minuwangoda, Gampaha","2,950,000","Blue mountand land/near the  colombo kurunagala 05road/24 hours water supply and electricity/near the king dstar,k&k,prabavi and many other hotel/good condition for living/pur 2.95lak/1st owner/",Minuwangoda,Commercial,10.0 perches
793,Land For sale - Weyangoda,25 Jun  1:39 pm,"Veyangoda, Gampaha","5,500,000",වේයන්ගොඩ  නගරයේ නුවරට  ඉදිවෙන  හයිවේ  එකට  නුදුරින්  පිහිටි  සාරවත්  ඉඩම  සමග විදුලි බලය  සහිත  ඉඩම  විකිනීමට .,Other,60.0 perches,
794,Land for Sale in Kadawatha,25 Jun  1:31 pm,"Kadawatha, Gampaha","400,000",පර්චස් 16. 5 ඉඩම විකිණීමට ඇතකඩවත නුවර පාරට 1/2/1 වැලිවෙිරියට 2km කන්දකපාපු හන්දිය සිට වැලිවෙිරිය පාර Kadawatha highway Enterance 4km පිරිසිදු නිරවුල් ඔප්පු,kadawatha,Residential,16.5 perches
795,Land Near Nittambuwa,25 Jun  7:03 pm,"Nittambuwa, Gampaha","2,500,000",idama basement ekak dama atha.liadak atha4.5 km near nittambuwa town,"Commercial, Residential",15.0 perches,
796,173 Perches Land for Sale in Katunayake Town,25 Jun  1:15 pm,"Katunayake, Gampaha","2,000,000",173 Perches Land for Sale in Katunayake Town facing Colombo Negombo main Road. Easy access to Katunayake International Airport and Highway Entrance.,Gampaha,"Commercial, Residential, Other",173.0 perches
797,Land in Kotadeniyawa,21 Jul 10:15 pm,"Mirigama, Gampaha","2,600,000",251 ප්‍රධාන මාර්ගයේ කරුණාරත්න බෞද්ධ විද්‍යාලය අසල  සිට මිටර 500 ක් පමණ දුරින් දෙල්ගොල්ල වත්ත මාර්යේ පිහිටා ඇත. පොල් ගස් 18 පමණ ඇත.සියලු විස්තර සදහා අමතන්න .,"Delgolla, Kotadeniyawa.","Agricultural, Residential",65.0 perches
798,Land & Half Completed House for Sale in - Makewita,25 Jun 10:32 am,"Gampaha, Gampaha","285,000",1.Clear Deed2.Water / Electricity3.Easy Access to Ja-ela & new Gamapaha highways.,"Mabima,Makewita",Residential,13.5 perches
799,"Land off Kelaniya-Biyagama Road, Kelaniya.",24 Jun 10:28 pm,"Kelaniya, Gampaha","275,000","Land off Kelaniya-Biyagama Road, Kelaniya.",Residential,60.0 perches,
800,Land for Sale in Gampaha,24 Jun 10:14 pm,"Gampaha, Gampaha","300,000",Lucry land forsale in Makevita 100m from gampaha Ja ela bus road close to Ekela Gampaha town 10minutes to Ja ela town to 10minutes to Airport 15 mimutes airport Paeceful areaClear DEEDConcrete roadOne perch Rs 300000 Negotiable,"Gampaha,Makevita","Commercial, Residential, Other",10.0 perches
801,Land for Sale in Negombo City,24 Jun  8:36 pm,"Negombo, Gampaha","525,000","# මීගමුව නගර සීමාවේ , මීගමුව - මිරීගම බස් මාර්ගයට යාබදව ( මීටර 150 ක් ) , කොළඹ - හලාවත ප්‍රධාන පාරට මීටර 500 ක පමණ දුරින් , පර්චස් 14 ක හතරැස් ඉඩමක් වහාම විකිණීමට තිබේ ....# A valuable land in Negombo / Katuwapitiya with 14 perches to be sold immediately .....# This land is a bare land with clear deeds & title ...# Just walking distance to Maristella College / Hospital / St Nicolas International College / Adventist International College / Super Markets / Banks etc ....# Just 500 meters to Colombo - Chilaw Main Road # Three Phase Electricity Facility ....# Government water line facility ....# just 5 Minutes to Negombo Town ....#  20 Feet road is to the Land ....# Please call ove for more details ...",Katuwapitiya / Negombo,"Commercial, Residential",14.0 perches
802,Land for Sale in Ruggahavila,25 Jun  1:12 pm,"Nittambuwa, Gampaha","65,000","Land is situated in Kamburagalla,Ruggahavila.about 500m away from 185(Nittabuwa/Kirindiwela) bus root.Block of the land can be sell. (above 30 perches.)","Agricultural, Other",88.0 perches,
803,Land for Sale in Kandana,24 Jun  5:29 pm,"Kandana, Gampaha","450,000",Highly residential areaGood environment Clear deedPeaceful surroundings and Good neighborhood Less than 5 minutes to Kandana junction,Bollatha - Kandana road,Residential,12.75 perches
804,Land for Sale in - Udugampola,24 Jun  2:04 pm,"Gampaha, Gampaha","200,000",4.5 km from Gampaha Town3rd land from main RoadTwo sides with wallsSquare shaped landPrice negotiable,"Udugampola, Gampaha",Residential,15.0 perches
805,Land for Sale - Delgoda,24 Jun  1:11 pm,"Delgoda, Gampaha","10,500,000",විකිණීමට  234  පාඉක්මනින්රට ම් 300,mawaramadiya,Residential,35.0 perches
806,Land for Sale -Wewala,10 Jul  1:03 pm,"Ja-Ela, Gampaha","325,000",This land located near the Wewala churchsuitable for residencequote and calm area,"Wewala,Jaela",Residential,12.0 perches
807,Land for sale - කිරිදිවැල,24 Jun  2:52 pm,"Gampaha, Gampaha","5,200,000",Land for sale,"49/A,Weralugampala,Papiliyawala.",Agricultural,107.0 perches
808,"20P Land For Sale In Gampaha,Bandarawatte",15 Jul  9:36 am,"Gampaha, Gampaha","265,000",Land sale-Vidyala Mw (Gampaha town),"Gampaha, Vidyala mw, Bandarawatte",Residential,20.0 perches
809,Valuable land for sale in Negombo,24 Jun 12:12 am,"Negombo, Gampaha","700,000","Valuable land for sale Thibirigaskatuwa, negombo 2km to Colombo and negombo main road 5 minutes to negombo town and nawaloka hospital with Harischandra college 100m to st. Michael international shcool 500m to st. Nicholas international shcool and maristalla branch 8 minutes to negombo beach with tourists hotels 15 minutes to airport Clear deed","Thibirigaskatuwa, negombo Y handiya",Commercial,21.7 perches
810,"7P Land For Sale in sarasavi RD, Ragama",23 Jun 11:56 pm,"Ragama, Gampaha","5,950,000",7P LAND FOR SALE IN Ragama ,"Hospital Rd, Sarasavi Mawatha, Ragama",Residential,7.0 perches
811,Land for sale in Kelaniya - Kohalvila Road,23 Jun  8:03 pm,"Kelaniya, Gampaha","650,000",කැළණිය නගරයට සැතපුම් දෙකක් පමන නුදුරින්...නිවසක් සාදාගැනීම සදහා ඉතා සුදුසු තැනිතලා සාරවත් ඉඩම විකිනීමට තිබේ.වැඩි විස්තර සදහා අමතන්න.  Sasika -,Kelaniya - Kohalvila Road,"Agricultural, Residential",16.0 perches
812,Land for Sale in - Kalagedihena,18 Jul 12:12 pm,"Nittambuwa, Gampaha","3,000,000","Land for Sale in Kalagedihena, Kiththammahara Godalla Road. 1.5KM to the Kandy Road.8.75 perches landPRICE Rs 3,000,000 (3 Million) (price slightly negotiable)","Kalagedihena, Kiththammahara Godalla Road",Residential,8.75 perches
813,Residential Land for Sale in Kandana, 8 Jul 11:49 am,"Kandana, Gampaha","260,000","20 perch residential land for sale beside the Kandana-Ganemulla road. This is a square shaped flat land with good soiling. Ideal for building a house within peaceful surroundings. Situated within close proximity to grocery stores, post office, schools, train stations and many other facilities. Land accessible through both the Kandana-Ganemulla road (276 but route) and Ja-Ela-Ganemulla road (278 bus route). For trains, the location is both accessible via the Batuwatte and Kandana train stations. A perch priced at 260,000/= rupees. Price negotiable after inspection.Genuine buyers only. No brokers please.","Agricultural, Commercial, Residential",20.0 perches,
814,Land in Gampaha,23 Jun  5:52 pm,"Gampaha, Gampaha","110,000",202 Gampaha / Kiridiwela pradana bus parata 400 m.Waliweriya town ekata saha Kiridiwela pradana town dekata madiwa.Agana bim kotas kihipayak pamanai.Muulika mudala 10 % k gewa iyhiriya wasara 5 k dakwa gewanna ganna.Adama amathanna.,"Kiridiwela rd, waliweriya.",Residential,12.5 perches
815,Land in kiribathgoda,23 Jun  5:47 pm,"Kiribathgoda, Gampaha","375,000",Kiribathgoda / Siyabalape pradana bus parata 300 m.Kiribathgoda towan ekata winadi 5 i.Biyagama zone ekatath winadi 5 i.Nala jalaya / viduliya athulu siyalu pahasukam samagin.Pahasu geweeme kramayata saha banku naya samagin.,"Makola , Kiribathgoda.",Residential,10.0 perches
816,Land in Kiribathgoda,23 Jun  5:44 pm,"Kiribathgoda, Gampaha","450,000",234 Kiribathgoda / Delgoda pradana parata 200 m .Kiribathgoda town ekata winadi 5 i.Siyallu pahasukam walin samanwitha agana bim kotasak.High way ekata muhunala.Pahasu geweem saha banku naya samagin.,"Sabawa road, Makola, Kiribathgoda.",Residential,14.5 perches
817,Land in Gampaha,23 Jun  5:31 pm,"Gampaha, Gampaha","275,000",Kolomba / Nuwara pradana bus parata muhunala.Wadagath parisarayaka padinchiya soyana oba sadahama.Agana bim kotas kihipayak.Nala jalaya / Viduliya / Adi 30 maarga / Nirawul oppu athulu siyalu pahasukam samagin.MEMA MASA THULA MILADEE GANEEM SADAHA WISHESHA WATTAM1) MULU MUDALA EKAWARA GEWEEMEDI = 12.5% WISHSHA WATTAMAK.2) PAHASU GEWEEME KRAMAYA SADAHA 7.5% WISHESHA WATTAMAK.,"Kandy rd, Nittabuwa.","Commercial, Residential",10.0 perches
818,Gampaha Yakkala 60p Land For Sale,12 Jul  9:59 am,"Gampaha, Gampaha","320,000","යක්කල ගල්තොටමුල්ල පාරේ කිරිකිත්තමුල්ලේ පර්චස් 60 ක හතරැස් ඉඩමක් විකිනීමට ඇත. කොටස් 2කට  හෝ තනිව නුවර කොළඹ මාර්ගයට දුර 1km.යක්කල නගරයට 1.5km.ගම්පහ නගරයට 4.5 km.ගම්පහ වික්‍රමාරච්චි ආයුර්වේද රෝහලට 1km පොල් ගස් 21 ක් ඇත.තෙකලා විදුලිය, නල ජලය, දුරකථන පහසුකම්.ඉඩමට කොන්ක්‍රීට් පාර.නිරවුල් ඔප්පු.පර්චසයක් 320000 කි.","Yakkala, kirikiththamulla",Residential,60.0 perches
819,Land for Sale - Katuwapitiya,25 Jun  3:38 pm,"Negombo, Gampaha","25,000,000","Very close to leading schools, temples, church and to the hospital",kattupitiya,Residential,50.0 perches
820,Land in Gampaha,23 Jun  4:43 pm,"Gampaha, Gampaha","105,000","Kiridiwela / Nittabuwa pradana parata 300 m.Kiridiwela town ekata 2 km k pamanai.Janapriya rajaye pasal seemawen.Nala jalaya / Viduliya / Adi 30 pardana maarga athulu siyalu pahasukam samagin.Awasana bim kotas kihipayak pamanai.Adama amathanna - 0713 - 756067Muulika geweema = 150,000/- k pamanai.Ithiriya wasara 5 k dakwa gewanna.","Millathe , Kiridiwela",Residential,12.5 perches
821,Land for sale with boarding House in Biyagama - Gampaha,23 Jun  3:59 pm,"Gampaha, Gampaha","6,000,000","Land with Boarding House  for sale in Biyagama - Gampaha 12 perches Land 8 rooms with Attached bathrooms and kitchens  for each room1 .5  km to Biyagama 2.5km to New Kandy roadWater , electricity available Clear deedPrice can be negotiable ------------------------------ගම්පහ - බියගම ප්‍රදෙශයේ පර්චස් 12 ක ඉඩමක් සමඟ ආදායම් ලබන  බෝඩිමක් විකිණීමට කාමර 8 ක් සහිතයි ... සෑම කාමරයකටම නානකාමරයක් සහ කුස්සියක් ඇත. විකිනුම් මිල ලක්ෂ 60 යි.දැනට මෙම බෝඩිමෙන් රුපියල් 50 000/= ක පමණ ආදායමක් උපයයි..ටැප් ලයින් සහිතයි බියගම වැව පාරේ සිට 1.5kmනව නුවර පාරට 2.5 kmමිල ගණන් සාකච්ඡා කර ගත හැකවැඩි විස්තර සඳහා අමතන්න","Commercial, Residential",12.0 perches,
822,Land for Sale - Kadawatha,23 Jun  3:56 pm,"Kadawatha, Gampaha","275,000",කඩවත නගරයට ඉතා ආසන්නයේ නිහඩ පරිසරයක පිහිටි වටිනා ඉඩම විකිණේ.මංකඩ කඩවත ප්‍රධාන මාර්ගයට 300mකඩවත නගරයට 2km දක්ෂිණ අධිවේගි පිවිසුමට 2km  ජල විදුලිය සහිතයි.,kadawatha-mankada,Other,15.0 perches
823,Land for Sale in Mahara Kadawatha,23 Jun  3:41 pm,"Kadawatha, Gampaha","700,000",Good Residential Property in Mahara - KadawathaLocated in Jinasena MawathaClose to DSI factory ,Jinasena Mawatha - Mahara,"Agricultural, Commercial, Residential, Other",45.0 perches
824,Land for Sale in - Minuwangoda,23 Jun  2:56 pm,"Minuwangoda, Gampaha","155,000",10 meters to Minuwangoda - Katunayaka main road.4 Km to Minuwangoda.3.5 Km to Katunayaka.1 Km to Yagodamulla junction (Dhammaloka Mawatha).Ideal for Commercial / Residential / Agricultural purposes.,"Agricultural, Commercial, Residential, Other",224.0 perches,
825,Land for Sale - Kandana,10 Jul  1:03 pm,"Ja-Ela, Gampaha","1,100,000","Rilaula, Pantaliyan laneSeventhday school Road200m for Colombo - Negombo Road","Rilaula, Kandana","Commercial, Residential",27.0 perches
826,Land for Sale in - Devalapola,25 Jun 11:30 am,"Gampaha, Gampaha","5,000,000","මීගමුව නිට්ටබුව මාර්ගයේ දෙවලපොල නගරයට නුදුරින් පර්චස් 30 ක අගනා බිම් කොටසක් විදුලිය,ජලය ,පුළුල් මංමාවත් වලින් යුත් ස්බාවික උවදුරු වලින් තොර නිදහස් නිස්කලංක පරිසරයක පිහිටා ඇත නිරවුල් ඔප්පු පදිංචියට හෝ නේවාසික ඉදිකිරීම් සදහා සුදුසුවේ",Devalapola,Residential,30.0 perches
