,0,1,2,3,4,5,6,7
0,title,posted date,location,price,description,Address:,Land type:,Land size:
1,Land for Sale in Kochchikade,15 Jul  3:35 pm,"Negombo, Gampaha","200,000",Land for Sale in Kochchikade* කොච්චිකඩේ නගරයට විනාඩි 5යි.(කි.මී 1)* මීගමු නගරයට විනාඩි 15යි* පිහිටි පොළව.* ජල හා විදුලි පහසුකම් ඇත.* පොල් ගස් 10ක් පමණ ඇත.* පදින්චියට වඩාත් සුදුසු ප්‍රදේශයකි.* මිළ ගණන් සාකඡ්චා කල හැක.* ඉක්මණින් විකීනීමට.,Pathima Rd / Kochchikade,Residential,35.0 perches
2,"['Land for Sale in Kochchikade', '15 Jul  3:35 pm', 'Negombo, Gampaha', '200,000', 'Land for Sale in Kochchikade* කොච්චිකඩේ නගරයට විනාඩි 5යි.(කි.මී 1)* මීගමු නගරයට විනාඩි 15යි* පිහිටි පොළව.* ජල හා විදුලි පහසුකම් ඇත.* පොල් ගස් 10ක් පමණ ඇත.* පදින්චියට වඩාත් සුදුසු ප්\u200dරදේශයකි.* මිළ ගණන් සාකඡ්චා කල හැක.* ඉක්මණින් විකීනීමට.', 'Pathima Rd / Kochchikade', 'Residential', '35.0 perches']","['title', 'posted date', 'location', 'price', 'description', 'Address:', 'Land type:', 'Land size:']",,,,,,
3,Land for Sale in Wattala, 9 Jul  2:49 pm,"Wattala, Gampaha","1,500,000",YOUR NEXT INVESTMENT ?,"Averiwatte Road, Wattala.","Commercial, Residential, Other",63.0 perches
4,Land for Sale - Ragama,14 Jul 11:46 am,"Ragama, Gampaha","5,500,000",This land is very near to ragama church.1.5 km from ragama railway stationAll the documents are clear.Good please to build a house.Reason for selling i m going to live in Australia.You can discuss the price and more information over the phone.(),Residential,14.6 perches,
5,Land for Sale in Negombo - Dalupotha,19 Jul 11:40 am,"Negombo, Gampaha","300,000",මීගමුව – දළුපොත මීගමුව දළුපත හිර කදවුර  මාර්ගයට මුහුණලා සියලු පහසුකම් සපිරි බිම් කොටස් 2ක් සම්පුර්ණ බිම් කොටස පර්චස් 26.4 සමන්විතයි . මේය කොටස්  දෙකකට වෙන් කර ඇති බැවින් පර්චස් 13.2 බැගින් හෝ දිය හැකිය.# ප්‍රධාන පාරේ සිට අඩි 12 පාර ඉඩමටම ..# සින්නක්කර / නිරවුල් ඔප්පු ..# මීගමුව නගරයට විනාඩි 5 න් ..# කොච්චිකඩේ නගරයට විනාඩි 2 න් ..පර්චස් 13.2 ක් වුවද දිය හැක ...# අධික ඉල්ලුමක් පවතින බැවින් ඉක්මණින් විමසන්න ...# අයිතිකරුගේ දූරකථන අoකය පහතින් තිබේ,"Prison camp Road , Thibirigaskatuwa",Residential,26.4 perches
6,Land Sale in Nittambuwa,11 Jul  3:14 pm,"Nittambuwa, Gampaha","65,000",නිට්ටම්ඹුව වතුපිටිවල නගරයෙන් සුපිරිම බිම් කොටසක පදිංචි වීමට අවස්ථාවක්අත්තනගල්ල ඌරාපොල පස්යාල නිට්ටම්ඹුව නගර වලට ඉතාම ආසන්නයේවතුපිටිවල ආයෝජන කලාපයට නුදුරින්කදිම ආයෝජනයක්,"Agricultural, Commercial, Residential, Other",10.0 perches,
7,Land for Sale in Dompe, 9 Jul 11:02 am,"Delgoda, Gampaha","155,000","15 perch land. 50m from Colombo - Pugoda main road.Water, electricity.call for more information.","Agricultural, Commercial, Residential",15.0 perches,
8,12.5 Perches Residential Land available for Sale in Dompe.,22 Jul 11:05 am,"Gampaha, Gampaha","1,650,000",12.5 Perches Residential Land available for sale in Dompe in recently developed land scheme. Just few mints walk to Delgoda – Giridara main road and 10 minutes to Dompe main town. This is a rectangular shape flat solid land with very clear title.,"Mahamewna Asapuwa Rd, Palugama","Residential, Other",12.0 perches
9,Plot no. 01 Land for sale in Kiribathgoda,22 Jul 10:03 am,"Kiribathgoda, Gampaha","335,000","Fully developed land...* 15 minutes from Kiribathgoda,Kadawatha,Kaduwela & Delgoda junction...* Close to highway 8 minutes...* Close to government and international schools,banks,super markets and other establishments...* Clear Deed...* Bank loan can be arranged...* All facilities available...* Down payment 10% of land value...RESERVE YOUR DREAM LAND NOW.....පදිංචියට හොදම තැනක් ……………කිරිබත්ගොඩ, කඩවත ,කඩුවෙල සහ දෙල්ගොඩ නගර වලට විනාඩි 15 න් ළඟා විය හැකි. අධිවේගී මාර්ගයට විනාඩි 8 න් ළඟා විය හැකි.,සුපිරි වෙළදසැල්, රජයේ ප්‍රසිද්ධ පාසල්, ජාත්‍යන්තර පාසල් සදහා විනාඩි කිහිපයකින්ළගා විය හැකි සියළු පහසුකම් සහිත බිම් කොටස් ඔබේම කර ගන්න...","Pelathawana street, Dikwala road, Mawaramandiya","Commercial, Residential",10.0 perches
10,6.65 Perches Land For Sale in - Wattala,22 Jul  9:32 am,"Wattala, Gampaha","5,900,000","6.65 LAND FOR SALE IN Wattala, HunupitiyaAround 120 meters from Hunupitiya Railway crossing main road. Around 600m to Handala & wattala junction . And also close tho Kiribathgoda Junction. Rs 5,900,000/= Total price.--------------------------Ideal For:---- / Residence houseGOOD INVESTMENT","Wattala, Hunupitiya",Residential,6.65 perches
11,Land for Sale in Negombo,13 Jul  3:50 pm,"Negombo, Gampaha","140,000",පදිංචියට හොඳම තැනක්මීගමුව - මිරිස්වත්ත නගරයෙන් සියලු පහසුකම් සපිරි බිම් කොටස් 24ක්බිම් කොටසම ලක්ෂ 14 යිනල ජලය සහ විදුලිය සහිතයි,"Commercial, Residential",10.0 perches,
12,"Land for Sale in Ranmuthugala, kadawatha.",22 Jul  9:15 am,"Kadawatha, Gampaha","600,000","8 Perches Land for Sale in Ranmuthugala, kadawatha. Very close to Colombo –Kandy main road. Calm and quite area with decent neighborhood.",Ranmuthugala,"Commercial, Residential",8.0 perches
13,Land for Sale in Kiribathgoda, 6 Jul  2:16 pm,"Kiribathgoda, Gampaha","4,500,000",Highly residential land for sale in Kiribathgoda - Makola.Ten (10) perches available with ALL the clear documents (bank loans can be easily taken as ALL the documents are clear and available).Suitable for new house builders !!,Residential,10.0 perches,
14,Land for Sale Near Kadawatha Highway,22 Jul  9:10 am,"Kadawatha, Gampaha","490,000","කඩවත ඉඩමක් විකිණීමට ඇත. 9 වන සැතපුම් කණුව මංසන්ධිය, කඩවත. කඩවත මාර්ගයේ පිවිසුම විනාඩි 5ක් ඇතුළත ළඟා විය හැකිය. ඉඩම පර්චස 10කි.කඩවත සසෙක්ස් විද්යාලයට ඉතා ආසන්නයේ පිහිටා ඇත. කොළඹ-නුවර ප්රධාන මාර්ගයේ 800m ඇතුලත පිහිටා ඇත. අඩි 15 ක් පමණ ප්රවේශ මාර්ගයක් ඇත. නේවාසික සංවර්ධන සඳහා ඉතා හොඳ ස්ථානයක්. හොඳ සමාජ අසල්වැසි ස්ථානය. චතුරස්රයේ හැඩැති තැනිතලා භූමිය. පැහැදිලි ඔප්පු තිබේ. විදුලිය, ජලය ලබා ගත හැකිය. අව්යාජ ගැනුම්කරුවන් පමණි.",Kadawatha,Residential,10.0 perches
15,"20 Perch Land for Sale in - Old road, Kandana",20 Jul  9:07 am,"Kandana, Gampaha","750,000",20 Perch Land for Sale on Old Dro Road. Call for More Information.,Residential,20.0 perches,
16,Valuable Land for Sale - Makola Sabawa R D,22 Jul 11:46 am,"Kadawatha, Gampaha","450,000",20p Land Facing two roads,Makola,"Residential, Other",20.0 perches
17,Land for Sale in Thihariya,22 Jul 11:23 am,"Nittambuwa, Gampaha","900,000","15 perch land for immediate sale in thihariya 50 meters to colombo-kandy main road, walking distance  Very close to thihariya town 900,000 per perchHighly residential and commercial areaClear road access three phase electricity, water line Fully Boundary Wall DoneClear Deeds","Rupasingha Garden, Thihariya","Commercial, Residential",15.0 perches
18,Land For Sale In Gampaha Town,22 Jul  8:02 am,"Gampaha, Gampaha","11,000,000",අස්ගිරිය ගම්පහ ඇණිකට් පාරේ කෙටවල විල ආසන්නව පිහිටි ඉතා ඉහල වෙළද වටිනාකමකින් යුක්ත ඉඩම ඉතාමත් ඉක්මණින් විකිනීමට ඇත.,"Asgiriya, Gampaha","Agricultural, Commercial, Residential, Other",31.0 perches
19,Land For Sale In Kalagedihena,22 Jul 11:05 am,"Nittambuwa, Gampaha","375,000",• A square shaped land of 40 perches.• Facing to the Kalagedihena - Veyangoda road.• Including coconut plants.• Clear plans and legal documents with the approval of       pradeshiya sabha. • 1 km away from Colombo - Kandy main road.• Easy access for the veyangoda town and railway station and magalegoda railway station.,Kalagedihena - Veyangoda Road,Residential,40.0 perches
20,Land for Sale in Ragama,19 Jul 12:38 pm,"Ragama, Gampaha","800,000","LAND FOR SALE IN RAGAMA SITUATED IN THE SARASAWI MAWATHA BEHIND THE   RAGAMA GENERAL HOSPITAL ( BOUNDARY OF THE HOSPITAL )VERY CLOSE TO PRIVATE HOSPITALS (BROWNS / LEESONS) ,SUPER MARKETS , BANK,RAILALWAY STATION AND etc.NEAR THE  RAGAMA MEDICAL COLLEGE VERY GOOD  FOR DOCTORS OR COMMERCIAL PROPOSE ELECTRICITY , WATER AVAILABLE 800 000/=  PER PERCHEPRICE CAN BE NEGOTIABLE AFTER INSPECTION CALL FOR MORE INFORMATION ---------------------------රාගම නගරයේ පර්චස් 18 ක අගනා ඉඩමක් විකිණීමට රාගම ප්‍රධාන රෝහල පිටුපස , රෝහලට මායිම්ව සරසවි මාවතේ ඉඩම පිහිටා ඇත.බ්‍රවුන්ස් , ලීසන්ස් වැනි පුද්ගලික රෝහල්  ,  සුපර්මාර්කට් , දුම්රිය ස්ථාන වලට ඉතාමත් ආසන්නව හා රාගම නේවාසික වෛද්‍ය විද්‍යාලය ආසල පිහිටා ඇතවෛද්‍යවරයකුට මෙන්ම ව්‍යපාර ස්ථානයක් සඳහා ද සුදුසුයි ජල විදුලි පහසුකම් සහිතයි පර්චසයක් 800 000/=මිල ගණන් සාකච්ඡා කරගත හැක වැඩි විස්තර සඳහා අමතන්න",NEAR THE RAGAMA HOSPITAL - RAGAMA,"Commercial, Residential",18.0 perches
21,Land for Sale Delgoda, 9 Jun 10:02 am,"Delgoda, Gampaha","230,000","දෙල්ගොඩ නගරයේ නව නුවර පාරට ඇවිදින දුරින් ,අඩි 20 ප්‍රවේශ මාර්ගයකට මුහුණලා ,අගනා බිම් කොටසක් විකිණීමට.කඩුවෙල-ගම්පහ, වැලිවේරිය - පිටකොටුව , පානදුර - මහනුවර  ප්‍රධාන බස් මාර්ගයන්ට ඇවිදින දුරින් . සියලු පහසුකම් සහිතයි . බැංකු ණය පහසුකම් ලබාගත හැක.",Residential,10.0 perches,
22,Land for Sale in vebada Road sadaham mw kadawatha,22 Jul 12:31 am,"Kadawatha, Gampaha","5,000,000","Highly residence area kadawatha Kandy bus route 1km Perch 11.4Total Lan value 50 lak close by kadawatha highway entrance , banks super market, Keels Super clear documentsimmediate sale . Call Seen for appointment only genuine buyer's No BROKES DREAM HOMES REAL ESTATE","vebada Road sadaham mw,Kirillawala, kadawatha",Residential,11.4 perches
23,Land for Sale in gonahena Junction kadawatha,22 Jul 12:20 am,"Kadawatha, Gampaha","1,175,000","Highly residence area kadawatha Kandy bus route  150 meters Perch 10Per Perch 11.75 lak Verry close by kadawatha highway , banks super market,Keels clear documentsimmediate sale . Call Seen for appointment only genuine buyer's No BROKES DREAM HOMES REAL ESTATE","gonahena Junction, bankuwatta Road kadawatha",Residential,10.0 perches
24,Land for sale Jaela,21 Jul 11:31 pm,"Ja-Ela, Gampaha","3,250,000",Suitable for a business or residentialPerches 10 Near to avariyawatta RoadCalm and quiet placeAn opportunity not to be missed3.25million,"Avariyawatta Road, Batagama, Jaela","Commercial, Residential",10.0 perches
25,Land for sale Jaela,21 Jul 11:30 pm,"Ja-Ela, Gampaha","4,400,000",200m for Jaela Town200m for Colombo - Negombo road200m for highway entrance200m for Railway stationClear deeds with Bank loan facilitiesAn opportunity not to be missed4.4 million per perch,"St. Mary's Road, Jaela","Commercial, Residential",8.0 perches
26,Valuable Land for Sale in Wattala,21 Jul 10:24 pm,"Wattala, Gampaha","26,000,000",Valuable land for sale in Wattala Avriwatta20 Perch land and Square block20 feet wide excess RoadHundred metres to main roadHundred metres to at Atami International SchoolHigh residential areaPrice per perch 1.3 million negotiable,Residential,20.0 perches,
27,Land For Sale In Negombo,21 Jul  9:57 pm,"Negombo, Gampaha","4,500,000",# 500M to Mirigama - Negombo (251 Bus Route)# 600M to Divulapitiya - Negombo (242 bus Route)# 13.5 Perches Land# Fully Boundary Wall Done# Clear Deeds# SERIOUS BUYERS WELCOME,"Thimbirigaskatuwa, Negombo.",Residential,13.5 perches
28,Land for Sale - Ja Ela,21 Jul  9:28 pm,"Ja-Ela, Gampaha","3,000,000",Calm and quiet area12.5 perch3 million per perch,"St. Rita Road, Maeliya, Jaela","Commercial, Residential",12.5 perches
29,Land for Sale in Kochchikade,15 Jul  3:35 pm,"Negombo, Gampaha","200,000",Land for Sale in Kochchikade* කොච්චිකඩේ නගරයට විනාඩි 5යි.(කි.මී 1)* මීගමු නගරයට විනාඩි 15යි* පිහිටි පොළව.* ජල හා විදුලි පහසුකම් ඇත.* පොල් ගස් 10ක් පමණ ඇත.* පදින්චියට වඩාත් සුදුසු ප්‍රදේශයකි.* මිළ ගණන් සාකඡ්චා කල හැක.* ඉක්මණින් විකීනීමට.,Pathima Rd / Kochchikade,Residential,35.0 perches
30,Land for Sale Dompe,19 Jul  2:53 pm,"Delgoda, Gampaha","80,000",224 colombo-pugoda saha 207 gampaha-pugoda pradhana margayata 2km pamani.banku naya laba ganiima sadaha avashya siyaluma liyavili pavathi.adi 12 margayajalaya. viduliya. durakathana.thanithala idama,237/1 indolamulla dome,"Agricultural, Residential, Other",100.0 perches
31,Land for Sale - Katana,21 Jul  9:17 pm,"Negombo, Gampaha","115,000",# Just 900M to Katana Road (251 Mirigama Bus Route)# 15Ft Wide Access Concrete Road# Clear deeds# Immediate Sale,Katana,Residential,37.0 perches
32,Land For Sale In Yakkala,16 Jul  6:37 pm,"Gampaha, Gampaha","1,550,000",කොළඹ නුවර පාරට 750m නුදුරින් ලයිසියම් පාසලට 800m  පදිංචි සුදුසු පරිසරයක,Residential,9.0 perches,
33,Bare Land in Negombo Kadirana,13 Jul  8:57 pm,"Negombo, Gampaha","270,000","11.15 Perches270,000.00 per perch but Negotiable10 minutes to Negombo town and Airport1 km to Maris Stella Branch SchoolSwimming pool, Gym, Play Ground are available in this Scheme",Residential,11.15 perches,
34,Land for Sale - Katana,21 Jul  8:44 pm,"Negombo, Gampaha","115,000",# Just 900M to Katana Road (251 Mirigama Bus Route)# 15Ft Wide Access Concrete Road# Clear deeds# Immediate Sale,Katana,Residential,17.0 perches
35,Land for Sale in Negombo Daluwakotuwa,20 Jul  8:33 pm,"Negombo, Gampaha","850,000",# කොළඹ - හලාවත ප්‍රධාන බස් පාරට මුහුණලා ( දෙවෙනි ඉඩම ) මිගමුව / දළුවකොටුව නගරයෙන් අගනා / වටිනා පර්චස් 20 ක ඉඩමක් වහාම විකිණීමට තිබේ ....# ප්‍රධාන පාරේ සිට අඩි 12 පාර ඉඩමටම ..# සින්නක්කර / නිරවුල් ඔප්පු ..# මීගමුව නගරයට විනාඩි 5 න් ..# කොච්චිකඩේ නගරයට විනාඩි 2 න් ..# පර්චස් 15 ක් වුවද දිය හැක ...# අධික ඉල්ලුමක් පවතින බැවින් ඉක්මණින් විමසන්න ...# අයිතිකරුගේ දූරකථන අoකය පහතින් තිබේ,Daluwakotuwa / Negombo,"Commercial, Residential, Other",20.0 perches
36,ඉඩමක් සමග නිවස විකිණීම බියගම,21 Jul  5:24 pm,"Kelaniya, Gampaha","4,500,000",සුන්දර වෙල් යායකට මුහුනලා.නිසංසල පරිසරය සහිත මාතර කඩවත අධිවේගී මාර්ගයට ආසන්නව කඩුවෙල නගරයට විනාඩි දහයකින් යා හැක. කිරිබත්ගොඩ නගරයට පැය බාගය කියා හැක.බියගම ආයෝජන කලාපය ට විනාඩි 15 ක දුර.,"439/8 Kalyani Mawatha,kottunna Biyagama",Residential,29.0 perches
37,Land for Sale in Negombo,13 Jul  2:28 pm,"Negombo, Gampaha","120,000",මීගමුව – කඩවල නගරයෙන් මීගමුව දිවුලපිටිය ප්‍රධාන මාර්ගයට මුහුණලා සියලු පහසුකම් සපිරි බිම් කොටස්බිම් කොටසම ලක්ෂ 12 සිට,"Commercial, Residential, Other",10.0 perches,
38,Land for Sale in - Kadawatha,21 Jul  5:04 pm,"Kadawatha, Gampaha","475,000",~~~~~ ආයෝජනයටත් පදිංචියටත් ~~~~~~,"Ihala Biyanwila, Kadawatha","Commercial, Residential, Other",22.0 perches
39,Land for Sale Nitabuwa,16 Jul  4:48 pm,"Nittambuwa, Gampaha","190,000",LAND FOR SALE IN NITABUWAනිට්ටඹුව - නුවර - කොළඹ පාර මිටර් 750 දුරින් මනරම් වෙල්‍ යායක් ඉදිරිපිට ප‍ර්චස් 40 අගනා  පොල්  ඉඩම .පිරිසිදු ඔප්පු .වැදගත් පරිසරය පර්චස් 20 වුවද ලබා ගත හැකවාහන හුවමාරු සලකා බැලෙ .සියලුම පහසුකම් සහිතයි .මුදල් හදිස්සියක් විකිණේ  . විස්තර සදහා අමතන්න .පර්චස් එකක මිල  190000/=,නිට්ටඹුව,Residential,40.0 perches
40,Land in Kadawatha 20p,17 Jul  1:45 pm,"Kadawatha, Gampaha","650,000",Good residential land within 350m - 500m radius to Kadawatha Expressway & Suvatha Uyana Childrens park. Peaceful surrounding and good neighbourhood.,"539/1 Gramasanwardhane mw, Kadawatha",Residential,19.7 perches
41,A Land sale in kadawatha,29 May  4:41 pm,"Kadawatha, Gampaha","575,000","A land, 10.5 Perches is available for sale.It is located in Eldeniya, Near High way entrance. Exactly 300 M from Kandy Road and High way entrance. water and electricity Lines there. 575,000/- Per purchase.",Eldeniya,Residential,10.5 perches
42,Land for Sale in Veyangoda Town,21 Jul  3:40 pm,"Veyangoda, Gampaha","130,000",වේයන්ගොඩ නගරයට 100mප්‍රයිම් ලෑන්ඩ් වෙන්දේසි ඉඩමේ Block No 78ජල විදුලි පහසුකම් වැඩි විස්තර සඳහා අමතන්න,"Banduragoda Rd, Veyangoda","Agricultural, Commercial, Residential, Other",10.5 perches
43,Cinnamon land for sale in Wathurugama,20 Jul  3:27 pm,"Gampaha, Gampaha","2,500,000",Cinnamon Land for sale in Wathurugamaකොලඹ - මහනුවර ප්‍රධාන මාර්ගයේ යක්කල නගරයේ සිට 10 km ක්  දුරින් පිහිටි දැනට ආදායම් ලබන  අක්කර 1.5 ක කුරුදු වගා කර ඇති  අගනා ඉඩම විකිනීමට ඇත. සින්නක්කර ඔප්පුඅඩි 12 ක පාරලක්ෂ 25ගැනුම්කරුවන් පමනක් කතාකරන්න.,"Agricultural, Other",1.5 acres,
44,"Land Sale for Malida, Kapugoda",21 Jul  3:06 pm,"Delgoda, Gampaha","95,000","land sale for malida, kapugoda.giridara delgoda road.",Residential,13.5 perches,
45,Land for Sale Budupilima Junction - Mawaramandiya Facing Main Road,17 Jul  1:16 pm,"Kiribathgoda, Gampaha","900,000",16P BARE SQUARE BLOCK LAND FOR SALE IN BUDUPILIMA JUNCTION – MAWARAMANDIYA FACING DELGODA - KIRIBATHGODA MAIN ROAD,"Commercial, Residential, Other",16.0 perches,
46,Land for Sale Dompe,19 Jul  2:53 pm,"Delgoda, Gampaha","80,000",224 colombo-pugoda saha 207 gampaha-pugoda pradhana margayata 2km pamani.banku naya laba ganiima sadaha avashya siyaluma liyavili pavathi.adi 12 margayajalaya. viduliya. durakathana.thanithala idama,237/1 indolamulla dome,"Agricultural, Residential, Other",100.0 perches
47,40P Commercial Land Near Weliweriya Town,12 Jul  3:07 pm,"Gampaha, Gampaha","4,400,000",රතුපස්වල හේනෙගම පාරට මුහුනලා (අඩි30 ප්‍රධාන පාර).නැදුන්ගමුව සබාවේ පන්සල අසල පර්චස් 40ක ඉඩම විකිනීමට.සින්නක්කර ඔප්පු. ලෝන් පහසුකම් ලබා ගත හැක.හරි හතරැස් ඉඩමකි.ඉඩමේ එක් පැත්තකින් තාප්පය. අනෙක් පැත්තෙන් අඩි20ක පාර. ඉඩම වටේටම තාප්පයක් සදහා අත්තිවාරම්  දමා ඇත.නිස්කලංක වටපිටාව.ජල විදුලි ඇතුලු සියලු පහසුකම් සගිතව..නිවසක් ඉදිකිරීමට නැතහොත් ව්‍යාපාරික කටයුත්තකට වඩාත් සුදුසුය.හදිසි මුදල් අවශ්‍යතාවයකට ඉක්මනින් විකිනීමට. (මුලු ඉඩමම එකවර).,"Commercial, Residential",40.0 perches,
48,Prime Land for sale in Wattala,19 Jul  9:30 am,"Wattala, Gampaha","695,000","The next greatest land project by Odiliya Homes is here! The Wattala Carmel Residencies land project is not one that you can afford to miss!Just 1.5 KM to Colombo (15)Just 2.5 KM to the Negombo Main RoadJust 3 KM to the HighwaySchools, supermarkets, and hospitals all just a short walk away!# Three phase Electricity and pipe born water","Wattala, Nayakakanda Road","Agricultural, Commercial, Residential, Other",7.0 perches
49,Kadawatha Land For Sale,20 Jul 10:54 am,"Kadawatha, Gampaha","250,000","•Land for sale (24 perches). •squared shape.•Only Rs. 250,000 per perch.•3.5 Km from the highway entrance. •Clear deeds.•Can apply bank loan.•Facing to a beautiful paddy field. •Very good investment for future market and residential purposes.",Residential,24.0 perches,
50,Land for sale - Gampaha,21 Jul  2:20 pm,"Gampaha, Gampaha","170,000","Yakkala mahavita bemmulla 206 maargaye gampaha maha nagara saba anumatha pr 30 k agana bim kotasak vikinimata etha, pr 1k rs 170000. Manaram welyaayakta yabadawa idama pihita etha.",yakkala mahavita bemmulla margaye,"Residential, Other",30.0 perches
51,Land for Sale in Weliweriya,22 Jul 11:45 am,"Gampaha, Gampaha","75,000",ගම්පහ- වැලි⁣වේරිය නගරයට ආසන්න ඌරුවල ප්‍රදේශයේ පර්චස් 40ක අගනා ඉඩම. නිස්කලංක පරිසරය. පදිංචියට ඉතාමත් සුදුසුයි. පිරිසිදු සින්නක්කර ඔප්පු. වැලිවේරිය නගරයට විනාඩි 05 දුර. ගම්පහ නගරයට විනාඩි 20.,"Uruwala, Weliweriya.",Residential,40.0 perches
52,Land for Sale at Wattala,21 Jul  2:08 pm,"Wattala, Gampaha","1,000,000",Land For Sale at WATTALA5 ACRES💠 Very Use Full For  Business        For Quickly Sell☎ Call For More Details...,L-WATTALA-01,Commercial,5.0 acres
