,0,1,2,3,4,5,6,7
0,title,posted date,location,price,description,Land type:,Land size:,
1,Land for Sale in Minuwangoda,10 Jul  1:03 pm,"Minuwangoda, Gampaha","240,000","This land located in Gauravi Udyanaya, Minuwangoda100 to Colombo kurunagala main roadFull facilities available10 perches",Residential,10.0 perches,
2,"['Land for Sale in Minuwangoda', '10 Jul  1:03 pm', 'Minuwangoda, Gampaha', '240,000', 'This land located in Gauravi Udyanaya, Minuwangoda100 to Colombo kurunagala main roadFull facilities available10 perches', 'Residential', '10.0 perches']","['title', 'posted date', 'location', 'price', 'description', 'Land type:', 'Land size:']",,,,,,
3,Land for Sale in Minuwangoda,20 Jul 10:31 pm,"Minuwangoda, Gampaha","75,000","aluthapola, Karmale waththa","Aluthapola, Dunagaha",Residential,16.5 perches
4,Valuable Land for Sale - Minuwangoda,20 Jul  7:32 am,"Minuwangoda, Gampaha","4,500,000",74.6 perch flat land of coconut estate for sale at minuwangoda16KM away from Katunayake airport Naiwala 4.5KM,Minuwangoda,"Agricultural, Other",74.6 perches
5,Land for Sale Immediately - Minuwangoda,21 Jul  8:25 pm,"Minuwangoda, Gampaha","450,000",Minuwangoda Katunayaka road yatiyana 10m away from main road.,Residential,23.0 perches,
6,Land For Sale in Minuwangoda,19 Jul  1:27 pm,"Minuwangoda, Gampaha","80,000",මිනුවන්ගොඩ ඉඩම විකිණීමට ඇත============================,Residential,15.0 perches,
7,Land for Sale - Minuwangoda,19 Jul 10:03 am,"Minuwangoda, Gampaha","175,000","සීඝ්‍රයෙන් සංවර්ධනය වෙමින් දිනෙන් දින වටිනාකම් වැඩිවන නගරාසන්නයේ වින්දනීය නේවාසික /අායෝජනයට...මිනුවන්ගොඩ - ගුවන්තොටුපල ප්‍රධාන මාර්ගයට මීටර් 50ජලය විදුලිය සමග සියළු පහසුකම් සහිත සුපිරි බිම්කොටස (බිම් කොටස් අංක 6 විකීණීමට තිබේ)පර්චසයක් රු.175,000/= සිට...- බැංකු ණය ඇතුළු පහසු ගෙවීමේ ක්‍රම - එකවර ගෙවීමේදී සුවිශේෂී මිළ අඩුකිරීමක්...ඉක්මන් කරන්න..වැඩි විස්තර සඳහා දැන්ම අමතන්න...","Minuwangoda,Bulugahamulla","Agricultural, Commercial, Residential, Other",15.35 perches
8,Land for Sale Minuwangoda,19 Jul  1:38 pm,"Minuwangoda, Gampaha","70,000","Minuwangoda, nilpanagoda 29.5perches for sale.Rs.70000 per perch.prices are negotiable.","Agricultural, Commercial, Residential",29.5 perches,
9,Land For Sale - Negombo,18 Jul  6:30 pm,"Minuwangoda, Gampaha","1,500,000",කොලබ කුරුණෑගල ප්‍රධාන පාරේ සිට කිලෝමීටර් 1විදුලිය ඇත නල ලින් මෝටර් කර ඇත නිරවුල් ඔප්පු,"no.11/2, walhena, minuwangoda",Residential,15.0 perches
10,Land for Sale - Minuwangoda,21 Jul  9:52 pm,"Minuwangoda, Gampaha","11,000,000",මිනුවන්ගොඩ නගරයට නුදුරින්  වේයන්ගොඩ පාරට මීටර් 500 දුරින් පර්චස් 107 ක්  විකිණීමට ඇත .අඩි 15 ක් පලල පුද්ගලික පාර. නිරවුල් ඔප්පු. මිල ලක්ෂ 110. වැඩි විස්තර සඳහා විමසන්න,Minuwangoda,Residential,107.0 perches
11,76 Perches Land for Sale - Minuwangoda,15 Jul  3:26 pm,"Minuwangoda, Gampaha","135,000","76 Perches Land for Sale in katuwellegama, Minuwangoda. Suitable for Residential, Farming and Agriculture. 4.5 Km to Minuwangoda town. 2.5 km to Nilpanagoda Junction, 10 Minutes to Katunayake FTZ,  International Airport and easy access to Colombo via Airport Highway. 10 km to Negombo Town.",katuwellegama,"Agricultural, Commercial, Residential, Other",76.0 perches
12,Land for Sale in Nilpanagoda,17 Jul 11:48 am,"Minuwangoda, Gampaha","75,000",perches 14k saha  12.5k idam  kabali  dekak  atha. adi 12ka parak  atha. polgas  3k  atha. light saha wathura  atha.,112/1 Nilpanagoda daminnagahawaththa,Other,26.5 perches
13,Land For Sale in Minuwangoda,20 Jul 11:12 am,"Minuwangoda, Gampaha","4,500,000",74.6 perch flat land of coconut estate for sale at minuwangoda16KM away from Katunayake airport Naiwala 4.5KMWeyangoda 800M,minuwangoda,"Agricultural, Commercial, Residential, Other",74.0 perches
14,Land for Sale in Minuwangoda,20 Jul 11:14 am,"Minuwangoda, Gampaha","4,500,000",74.6 perch flat land of coconut estate for sale at minuwangoda16KM away from Katunayake airport Naiwala 4.5KMWeyangoda 800M,"Agricultural, Other",74.0 perches,
15,"Land for sale – in Gampaha Ditrict, Minuangoda, Nilpanagoda vilage",14 Jul  1:20 am,"Minuwangoda, Gampaha","90,000","20-minute drive from the airport, 1-acre land with a partition title.","Agricultural, Commercial, Residential",1.0 acres,
16,Prime Commercial Land for Sale at Airport Road Minuwangoda,13 Jul  2:55 pm,"Minuwangoda, Gampaha","525,000","Commercial Land for Sale at Airport Road, Minuwangoda facing mainroad. About 1 Km to Minuwangoda City and 5 minutes drive to Katunayake International Air Port and easy access to Colombo Katunayake Airport High way. Ideal for Hotel, Reception Hall, Apartment/ Housing Complex, Were House, Factory, Yard or any other commercial purpose.",Airport Road,"Commercial, Residential, Other",22.0 perches
17,Land in Minuwangoda,13 Jul  1:35 pm,"Minuwangoda, Gampaha","70,000","Minuwangoda / Diwlapitiya nagara walata madiwa,Agana newasika bim kotas kihipayak pamanai.Sundara wel yayakata muhunala.Awasana bim kotas kihipaya pamanai.@@@@@@ (Muulika geweema 90,000/- k pamanai)@@@@@@Ithiriya pahasu geweeme kramayata.","Diwlapitiua Rd , Minuwangoda.",Residential,15.0 perches
18,Land for Sale Minuwangoda,10 Jul  2:39 pm,"Minuwangoda, Gampaha","4,500,000","land for immediate sale .Minuwangoda , aluthapola junction.Closer to the main road 30 perches 45/=..good for business purpose.","Commercial, Residential",30.0 perches,
19,Land for Sale Minuwangoda,20 Jul 11:26 am,"Minuwangoda, Gampaha","230,000",superb residential lands5 Minutes away from Divulapitiya town7 Minutes away from Minuwangoda townClose proximity to schools and super markets.Calm and relaxing environmentFast developing areaWater/Electricity and all other convenient facilities,Land for Sale Minuwangoda,Residential,15.0 perches
20,"Land For Sale At Minuwangoda,aluthapola", 8 Jul  7:00 pm,"Minuwangoda, Gampaha","110,000","අගනා සරුසාර ඉඩමක් වගාවට, පදිංචියට 5km from Minuwangodaප්‍රධාන පාරෙහි සිට මීටර් 900ක් දුරින්",Aluthapola,"Agricultural, Residential",80.0 perches
21,Residential Land for Sale in Minuwangoda Gampaha, 8 Jul  7:27 pm,"Minuwangoda, Gampaha","90,000",Residential Land For Sale In Minuwangoda Gampaha=================================,"Minuwangoda, Gampaha",Residential,71.2 perches
22,මාබොදල අගනා ඉඩමක් විකිණිමට, 8 Jul  1:09 pm,"Minuwangoda, Gampaha","900,000","දිවුලපිටිය නගරයට කිලෝ මීටර් 3ක් දුරින් මාබොදල ප්‍රදේශයේ පිහිටි තෙකලා විදුලිය සහිත පර් 15ක අගනා ඉඩම රැ ලක්ෂ 9කට විකිණිමට ඇත. එහි මෙි වන විට,     *  කපා සකස් කොට සිලින්ඩර් යොදා ඇති ළිද,    * කපා ඇති වැසිකිළි වල සහ    * ඉඩම වටා තාප්පය බැදීම සදහා කඑ ගල් යොදා බැද ඇති අත්තිවාරම ( කණු සදහා කමිබි දමා ඇත), යන ආදිය ඉදිකර ඇත.",මාබොදල,Residential,15.0 perches
23,පර්චස් 15 බිම් කොටස් දෙකක් විකිණීමට මිනුවන්ගොඩ, 7 Jul  9:14 pm,"Minuwangoda, Gampaha","110,000",මිනුවන්ගොඩ යටියන නිස්කලංක පරිසරයක පිහිටි පර්චස් 15 බැගින් වූ යාබද බිම් කොටස් දෙකක් විකිණීමට ඇත. වැඩි විස්තර සදහා අමතන්න,"යටියන, මිනුවන්ගොඩ",Residential,30.0 perches
24,Immediate sale of Land 261.5 Perches with House for in Veyangoda, 8 Jul  1:44 am,"Minuwangoda, Gampaha","22,500,000",Property is facing a paddy field. Cleared land with a house.,"322/B Muthumini Arana, Mabodala, Veyangoda","Agricultural, Commercial, Residential",261.5 perches
25,Land for Sale in Minuwangoda,10 Jul  1:03 pm,"Minuwangoda, Gampaha","70,000",This land located in Polwatta Minuwangoda 20 perchers land with foundation 100 m to Polwatta road 1.5 km to Minuwangoda main road 2km to AirporCalm and quit area,"Polwatta , Minuwangoda",Residential,20.0 perches
26,Residential Land for Sale in Minuwangoda, 8 Jul  1:14 pm,"Minuwangoda, Gampaha","2,100,000",Three phase electricity and well water10 km for Katunayaka AirportFree trade zone Katunayaka22.5 km for Minuwangoda town,"Lot number-63,Araliya landa green city,Dungaha road,Nilpanagoda junction,Minuwangoda",Residential,15.55 perches
27,Residential/ Commercial Land for Sale in Minuwangoda, 4 Jul 10:21 am,"Minuwangoda, Gampaha","300,000","50m to Minuwangoda- Gampaha Main Road, Bus holts, Well Water, 3-Phase Power, Telephone facilites available. 3.6 Km (7 Min) to Minuwangoda, 8 Km (15 Min) to Gampaha, 11 Km (18 Min) to the Airport, 12.5 Km (20 Min) to Katunayaka Free Trade Zone. Whole land or a part to be sold. There is a hall (1900 sq.ft) with all facilities (3 years old) on the land which can be easily converted in to house. Price of the hall is 2M.","Mathammana, Salmal Unana -Welhene Road","Commercial, Residential",42.0 perches
28,Land for Sale in Minuwangoda,10 Jul  1:03 pm,"Minuwangoda, Gampaha","240,000","This land located in Gauravi Udyanaya, Minuwangoda100 to Colombo kurunagala main roadFull facilities available10 perches",Residential,10.0 perches,
29,Land for Sale in Minuwangoda,10 Jul  1:03 pm,"Minuwangoda, Gampaha","240,000","This land located in Gauravi Udyanaya, Minuwangoda100 to Colombo kurunagala main roadFull facilities available10 perches",Residential,10.0 perches,
30,Land For Sale In Minuwangoda, 3 Jul 11:51 am,"Minuwangoda, Gampaha","150,000","මිනුවන්ගොඩ නගරයට කි.මී. 5 ක නුදුරින් මිනුවන්ගොඩ කටුනායක බස් මාර්ගයේ පර්.16 ඉඩමක් විකිණීමට ඇත.* මෙම ඉඩම අඩි 20ක පිවිසුම් මාර්ගයක් සහිතයි.*ඉඩම ලිං ජලය සහ විදුලි පහසුකම්ද සහිතයි.*තුරුලතාවන්ගෙන් පිරි නිස්කලංක පරිසරයක මෙම ඉඩම පිහිටා ඇත. *කටුනායක ගුවන්තොටුපලට / කටුනායක නිදහස් වෙළඳ කලාපයට කි.මී.8 යි*හොඳින් පලදරන පොල් ගස් ද සහිතය.*පර්චසයක් රු.150,000 යි.","Minuwangoda, Air port road , Yatiyana.",Residential,16.0 perches
31,Land for Sale in Minuwangoda,10 Jul  1:03 pm,"Minuwangoda, Gampaha","130,000,000","Land in Polwatta, Minuwangoda110 perches 2km Polwatta junction for land Coconut trees in land","Polwatta, Minuwangoda","Agricultural, Residential",110.0 perches
32,Land For Sale In Minuwangoda, 1 Jul  6:29 pm,"Minuwangoda, Gampaha","130,000","minuvangoda colombo parata 300 m  k durin pihiti jalaya viduliya sahitha pulul concrete pivisum marga sahithai. asanna nagara vana minuvangoda (vinadi 15), jaela (vinadi 20) ,gampaha(vinadi (vinadi 35),veyangoda (vinadi 35),katunayaka (vinadi 15) nagara valata pahasuven langa viya hakiya.niraul sinnakkara oppu sahithai.itha ikmanin vikine.",231  samurdigama  kotugoda,Residential,39.5 perches
33,මිනුවන්ගොඩ නගර සීමාවට ආසන්නයෙන් බිම් කොටස්,28 Jun  8:20 pm,"Minuwangoda, Gampaha","180,000","මිනුවන්ගොඩ කුරුණෑගල ප්‍රධාන මාර්ගයට ආසන්නව (150m).නිල්පනාගොඩ නිස්කලංක පරිසරයක පිහිටි ඉඩමෙන් බිම් කොටස් පුද්ගලිකව විකිණේ.ඔබට අවශ්‍ය තැනින් අවශ්‍ය ප්‍රමාණයට මිලදී ගන්න (පර්චස් 12 හෝ වැඩි).ඉඩමේ සිට මිනුවන්ගොඩ නගර සීමාවට මීටර් 250 පමණයි.ඉඩමේ සිට කොළඹ කුරුණෑගල ප්‍රධාන මාර්ගයට (5 පාරට) මීටර් 150 පමණයි.පිරිසිදු සින්නක්කර ඔප්පු පර්චසය රු.180,000 ඉඩම බැලීමෙන් පසු මිල ගණන් සාකච්ඡා කල හැක.අමතන්න:","Nilpanagoda,Minuwangoda",Residential,15.0 perches
34,12.5 P 15 Lands for Sale in Minuwangoda,28 Jun  3:01 pm,"Minuwangoda, Gampaha","105,000",මිනුවන්ගොඩ නගරයට කි.මී. 3 ක නුදුරින් මිනුවන්ගොඩ දාගොන්න බස් මාර්ගයේ පර්.15 ඉඩමක් විකිණීමට ඇත.,"Dadonna Road, Boragodawatta, Minuwangoda, Katunayake","Agricultural, Residential",15.0 perches
35,Land for Sale-Minuwangoda,26 Jun  3:23 pm,"Minuwangoda, Gampaha","1,620,000","අරලිය උයන,දෙවලපොල,ඔබගේ සිහින නිවහන ඉදිකරවා ගන්න.                                                                                   - සියලුම නාගරික පහසුකම් සහිතව පදිංචියට වඩාත් සුදුසු පරිසරයක- පිරිසිදු ළිං ජලය- තෙකලා විදුලිය- කොන්ක්‍රීට් කරන ලද පුළුල් මාර්ග - නිරවුල් ඔප්පු සමග- දින 7 න් බැංකු ණය පහසුකම් හා පහසු ගෙවීමේ ක්‍රම - මිනුවන්ගොඩ නගරයට විනාඩි 5 දුරින්  - නයිවල මංසන්දියට විනාඩි 10 දුරින්  ඔබේ ආයෝජනයට වසර 5කදී 300% සහතික මිලක් සමගින් වැඩි විස්තර සදහා දැන්ම අමතන්න.",Minuwangoda,Commercial,13.5 perches
36,Land for Sales - Minuwangoda,26 Jun  3:16 pm,"Minuwangoda, Gampaha","1,543,500","අරලිය උයන,දෙවලපොල,ඔබගේ සිහින නිවහන ඉදිකරවා ගන්න.                                                                                   - සියලුම නාගරික පහසුකම් සහිතව පදිංචියට වඩාත් සුදුසු පරිසරයක- පිරිසිදු ළිං ජලය- තෙකලා විදුලිය- කොන්ක්‍රීට් කරන ලද පුළුල් මාර්ග - නිරවුල් ඔප්පු සමග- දින 7 න් බැංකු ණය පහසුකම් හා පහසු ගෙවීමේ ක්‍රම - මිනුවන්ගොඩ නගරයට විනාඩි 5 දුරින්  - නයිවල මංසන්දියට විනාඩි 10 දුරින්  ඔබේ ආයෝජනයට වසර 5කදී 300% සහතික මිලක් සමගින් වැඩි විස්තර සදහා දැන්ම අමතන්න.",Minuwangoda,Commercial,12.6 perches
37,Land for Sale - Minuwangoda,26 Jun  1:07 pm,"Minuwangoda, Gampaha","1,600,000","අරලිය උයන,දෙවලපොල,ඔබගේ සිහින නිවහන ඉදිකරවා ගන්න.                                                                                   - සියලුම නාගරික පහසුකම් සහිතව පදිංචියට වඩාත් සුදුසු පරිසරයක- පිරිසිදු ළිං ජලය- තෙකලා විදුලිය- කොන්ක්‍රීට් කරන ලද පුළුල් මාර්ග - නිරවුල් ඔප්පු සමග- දින 7 න් බැංකු ණය පහසුකම් හා පහසු ගෙවීමේ ක්‍රම - මිනුවන්ගොඩ නගරයට විනාඩි 5 දුරින්  - නයිවල මංසන්දියට විනාඩි 10 දුරින්  ඔබේ ආයෝජනයට වසර 5කදී 300% සහතික මිලක් සමගින් වැඩි විස්තර සදහා දැන්ම අමතන්න.",Minuwangoda,Commercial,12.8 perches
38,Land for sale-Minuwangoda,26 Jun  1:03 pm,"Minuwangoda, Gampaha","1,632,000","අරලිය උයන,දෙවලපොල,ඔබගේ සිහින නිවහන ඉදිකරවා ගන්න.                                                                                   - සියලුම නාගරික පහසුකම් සහිතව පදිංචියට වඩාත් සුදුසු පරිසරයක- පිරිසිදු ළිං ජලය- තෙකලා විදුලිය- කොන්ක්‍රීට් කරන ලද පුළුල් මාර්ග - නිරවුල් ඔප්පු සමග- දින 7 න් බැංකු ණය පහසුකම් හා පහසු ගෙවීමේ ක්‍රම - මිනුවන්ගොඩ නගරයට විනාඩි 5 දුරින්  - නයිවල මංසන්දියට විනාඩි 10 දුරින්  ඔබේ ආයෝජනයට වසර 5කදී 300% සහතික මිලක් සමගින් වැඩි විස්තර සදහා දැන්ම අමතන්න.",Minuwangoda,Commercial,12.8 perches
39,Land with Banglow for Sale in Minuwangoda,26 Jun 10:15 am,"Minuwangoda, Gampaha","13,500,000",* Located just 05 minutes away from Minuwangoda town and 06 km to Gampaha city.* Only 10km to Katunayake International Air port.* Clear Titles.* 40ft Carpet road* 03 phase Electricity* with swimming pool* Suitable for small resort or personal Ban glow* Former used by a Foreigner* Can arrange bank loan* Call more information,Between Gampaha Minuwangoda main road,"Commercial, Residential, Other",70.0 perches
40,Land for Sale in Minuwangoda,25 Jun  2:08 pm,"Minuwangoda, Gampaha","2,950,000","Blue mountand land/near the  colombo kurunagala 05road/24 hours water supply and electricity/near the king dstar,k&k,prabavi and many other hotel/good condition for living/pur 2.95lak/1st owner/",Minuwangoda,Commercial,10.0 perches
41,Land for Sale in - Minuwangoda,23 Jun  2:56 pm,"Minuwangoda, Gampaha","155,000",10 meters to Minuwangoda - Katunayaka main road.4 Km to Minuwangoda.3.5 Km to Katunayaka.1 Km to Yagodamulla junction (Dhammaloka Mawatha).Ideal for Commercial / Residential / Agricultural purposes.,"Agricultural, Commercial, Residential, Other",224.0 perches,
42,Agricultural and Residential Land for Sale in Minuwangoda,25 Jun  1:55 pm,"Minuwangoda, Gampaha","5,000,000","100m far from weyangoda- airport roa7d..We have lands with houses, and 2 lands....Please call us for details...","Agricultural, Residential",25.0 perches,
43,Land for Sale in Minuwangoda,20 Jun  8:39 am,"Minuwangoda, Gampaha","122,000",~~~ ආයෝජනයටත් පදිංචියටත් ~~~,Minuwangoda,Residential,12.5 perches
44,Land for sale in Minuwangoda | Yagodamulla,20 Jun  6:25 pm,"Minuwangoda, Gampaha","1,800,000",Land for sale in Minuwangoda | Yagodamulla,Minuwangoda | Yagodamulla,"Commercial, Residential",70.5 perches
45,Land for Sale with House - Minuwangoda,18 Jun 11:35 am,"Minuwangoda, Gampaha","5,400,000",.මනහර  පරිසරයක පිහිටා  ඇත.ප්‍රධාන පාරට  1kmමිනුවන්ගොඩ නගරයට  4kmගුවන් තොටුපලට  විනාඩි 8 80% වැඩ නිමවී  ඇතවිදේශ ගතවීම නිසා ඉක්මනින් විකිණේඇවිත්  බලා ගනුදෙනු කතා කරගත හැක බැංකු ණය පහසුකම්  ලබාගැනීමට  සියලුම ලිපි ලේබන සකසා දියහැකිය.,"1/14 lucky teras ,yatiyana,minuwangoda",Residential,12.45 perches
46,Land for Sale - Andiambalama,18 Jul  1:11 pm,"Minuwangoda, Gampaha","210,000","Total land divided in to 04 plots 01 plot already sold out, 03 plots are available for sale20 perches 02 plots & 15.5 perch 01 plot",No 329/A Asokarama Mawatha Andiambalama.,Residential,45.0 perches
47,15 Perch Land for Sale in Minuwangoda,18 Jun  7:37 pm,"Minuwangoda, Gampaha","155,000",Land for Sale in Minuwangoda ,"Minuwangoda Town , Pansilgoda Road","Agricultural, Commercial, Residential, Other",15.0 perches
48,Land for Sale in Udugampola Weediyawatta,14 Jun  4:47 pm,"Minuwangoda, Gampaha","4,800,000","පර්චස් 23.6ක අඩක් නිමකල නිවස සමග ඉඩම වහාම විකිණීමට.270 මිනුවන්ගොඩ පාරේ සිට මීටර් 700 ක් දුරින්පලදාව ඇති කොස් ගස් 3, පොල් ගස් 2, තැබිළි ගස් 1,වසර පුරා ජලය සහිත ලිද සහ වතුර ටැන්කියනිවසට ප්‍රාදේශිය සභා අනුමැතිය ලැබී ඇත.",Residential,23.6 perches,
49,Land in minuwangoda,13 Jun 11:30 am,"Minuwangoda, Gampaha","70,000","Minuwangoda / Diwlapitiya pradana nagarayanta madiwa.Ballapana handiyen.Sundara wel yayakata muhunala, Itha agana newasika bim kotas kihipayak.Muulika geweema 125,000k pamanai.Ithiriya wasara 5 k dakwa pahasu geweeme kramayata.","Ballapana, Minuwangoda.",Residential,15.0 perches
50,Land for Sale Raddolugama,11 Jun 12:37 pm,"Minuwangoda, Gampaha","275,000",Main road to 2km10p can be arrangeprices considergood nabhour,Seeduwa Raddolugama.,Residential,20.0 perches
51,"Land for Sale - Minuwangoda,Ballapana",10 Jul  1:03 pm,"Minuwangoda, Gampaha","110,000","This land located Minuwangoda Ballapana12.5 perches20m to Gampaha,Ballapaana main road","Ballapana,Minuwangoda","Commercial, Residential",12.5 perches
52,Commercial Land Sale Minuwangoda, 9 Jun  1:22 pm,"Minuwangoda, Gampaha","1,050,000","BARE LAND WITH HIGH COMMERCIAL VALUE FOR SALE IN MINUWANGODA TOWN, FACING KATUNAYAKE AIRPORT ROAD.",Minuwangoda - Town,Commercial,15.0 perches
53,වටිනා ඉඩමක් විකිණීමට ඇත - ම්ණුවන්ගොඩ,30 Jun  8:25 pm,"Minuwangoda, Gampaha","100,000","ම්ණුවන්ගොඩ උඩුගම්පොල පාරට නුදුරින් පර්. 19.64ක වටිනා ඉඩමක් විකිණීමට ඇත.රෙජී රණතුංග විදුහලට නොදුරින්, ළිං ජලය සහිතව,මහෝගනී ගස් 6,පොල් ගස් 7,පර්චසය රු. 100,000/-",Minuwangoda udugampola road,"Agricultural, Commercial, Residential, Other",19.64 perches
54,Land for Sale in Minuwangoda,10 Jul  1:03 pm,"Minuwangoda, Gampaha","240,000","This land located in Gauravi Udyanaya, Minuwangoda100 to Colombo kurunagala main roadFull facilities available10 perches",Residential,10.0 perches,
55,Land for Sale - Minuwangoda, 7 Jun  4:17 pm,"Minuwangoda, Gampaha","79,000",මිනුවන්ගොඩ නගරයට වි.10 ළඟා  විය හැකි සියලු පහසුකම් සහිත බිම් කොටස් කීපයක් මුලින් 40% ගෙවා ඉතිරි මුදල් බැංකු ණය මගින් මාසිකව ගෙවීමට සලසා දිය හැකිය පධාන නගර වලට කෙටි දුරින් .යකහටුව brandex ආයතනයට කෙටි දුරින්,minuwangoda .horampalla,Residential,12.5 perches
56,Land for sale - Minuwangoda, 5 Jun  3:03 pm,"Minuwangoda, Gampaha","795,000",ඉඩමට අඩි .15 කොන්ක්‍රීට්  දැමු මාර්ගය  ලක්ෂ  7.95/= ඉක්මනින්  විකිනීමට .,"මිනුවන්ගොඩ ,වටිනාපහ",Other,8.0 perches
57,12.5 p Land for Sale at Ballapana, 3 Jun  3:19 am,"Minuwangoda, Gampaha","1,375,000","Land situated on Maradahamula - Gampaha bus route,.600m to Colombo - Kurunegala road at Ballapana Junction.Auction Land.Selling Price - Rs.110,000 per purch.",Residential,12.5 perches,
