,0,1,2,3,4,5,6,7
58,Property for Sale - Minuwangoda.,25 Jun  9:50 am,"Minuwangoda, Gampaha","5,500,000","30 Perches Land for sale in Aluthapola Junction, Minuwangoda right opposite Walagamba Maha Vidyalaya. The Land situated at facing main Dunagaha road, 1 Km to Nilpanagoda Junction,  3 Km from Minuwangoda town.",Aluthapola Junction,"Commercial, Residential, Other",30.0 perches
59,Minuwangoda Land for Sale,30 May  2:29 pm,"Minuwangoda, Gampaha","255,000","NAGARA SABHA SEEMAWA THULA BUS NAWATHUMPOLE SITA 500M DURIN PIHITA WATHA..NALA JALAYA/ LIN JALAYA, VIDULIYA, DURAKATHANA PAHASUKAMImmediately Selling","BORAGODAWATHTHA, MINUWANGODA",Residential,30.0 perches
60,Land for Sale in Minuwangoda Town,10 Jun 10:26 am,"Minuwangoda, Gampaha","375,000","මිනුවන්ගොඩ උසාවිය අසල පර් 30 අගනා හරි හතරැස් ඉඩම.පොල්  ගස් 10 ක් හා කොස් ගස් 5 ක් සහ වෙනත් ගස් වර්ග සහිතයි . වේයන්ගොඩ  ප්‍රධාන මාර්ගයට මීටර 20 යි. මිනුවන්ගොඩ නගර මධ්‍යයට 1km , උසාවියට මීටර 20 යි. පොලීසියට මීටර 200. මිනුවන්ගොඩ මූලික රෝහලට මීටර් 400, මිනුවන්ගොඩ ප්‍රධාන පාසල් වෙත කි .මී 1 යි . සනස වෙළඳ සංකීරණයට මීටර 50 යි.පර්චසය 375,000/=","185/3 ,උසාවිය අසල , මිනුවන්ගොඩ .","Agricultural, Commercial, Residential, Other",30.0 perches
61,Best Commercial Land In Minuwangoda Town,27 May  7:51 pm,"Minuwangoda, Gampaha","22,500,000","Centered In Minuwangoda Town.Centered to Day and Night Resturants.Facing to the Airport road.Near the Sampath bank, Nations Trust bank, NDB bank, Janitha Bakers, MC food.Ideal BUSINESS LOCATION in Minuwangoda.",Commercial,6.29 perches,
62,"මිනුවන්ගොඩ, ඉඩමක් විකිණීමට කොළඹ කුරුණෑගල ප්‍රධාන පාරට 200මීටර්",30 May  1:28 pm,"Minuwangoda, Gampaha","8,500,000","මිනුවන්ගොඩ ජාතික රෝහල , බාලිකා හා පිරිමි ජාතික පාසලට 1.5km.සම්පූර්ණයෙන් නිමකල හා අඩක් නිමකල නිවාස 2ක්.නිස්කලංක පරිසරයක් හා පිරිසිදු ජලය. කටුනායක ගුවන්තොටුපළට 6km.(මිලගනන් පිලිබඳව වෙනසක් කරගත හැක)","79/1  මැඩෑමුල්ල, මිනුවන්ගොඩ.",Residential,57.0 perches
63,Land for Sale - Minuwangoda,27 May  2:01 pm,"Minuwangoda, Gampaha","95,000",සුන්දර වෙල්යායට මුහුණලා පර් 12.5 බිම්  කොටස් කීපයක් .මුලින් 40% ගෙවා ඉතිරි මුදල් බැංකු ණය මගින් මාසිකව ගෙවීමට සලසා දිය හැකිය .පධාන මාර්ගයට සමීප  ඡනපිුය පාසල් .සියලු පහසුකම්  සහිත බිම් කොටස් .අත්පිට විශේෂ වට්ටම්,dewalapola minuwangoda,Residential,12.5 perches
64,Land for Sale Minuwangoda,26 May  8:16 am,"Minuwangoda, Gampaha","170,000",මිනුවන්ගොඩ නගරයෙන්මමිනුවන්ගොඩ පන්සිල්ගොඩ පාරෙන්____අයිඩීයල් ග්‍රීන් වීව්____,"Pansilgoda Road,Minuwangoda",Residential,12.0 perches
