,0,1,2,3,4,5,6,7,8,9
208,Luxury three bedroom house for sale Battaramulla,28 Jun  7:47 pm,"Battaramulla, Colombo","95,000,000","Beautiful architect designed three-bedroom home for sale. Elegant living/ dining with granite flooring, front and back verandahs – back with built in bar. Front and back gardens, two car garage and salt chlorinator swimming pool with visitor’s shower and toilet. All bedrooms with fully equipped bathrooms. Master bedroom includes large walk-in closet/ dressing room. Pantry and kitchen with maid’s sitting room and kitchen courtyard. Maid’s room with bathroom. Upstair lounge/ office/ TV room and utility room with drying balcony. 5,000 Sq.Ft. on 22 perches. Private lane. Quiet neighbourhood, high security area, close to all major banks, supermarkets, restaurants, gyms, Hemas Hospital and Overseas School of Colombo. No brokers. Principals only. LKR 110,000,000 negotiable. Fast sale.",Pelawatte Battaramulla - off Akuregoda Road,3,4,"5,000.0 sqft",22.0 perches
209,B / New Two Story House - || Malabe,24 May  1:41 pm,"Battaramulla, Colombo","24,000,000","Brand New Two Story House For Sale In Pothuarawa Road, Arangala. 08 Perches with Landscaped garden area.","Pothuarawa Road, Malabe.",4,4,"2,650.0 sqft",8.0 perches
210,Brand | New Two Story House in || Malabe,24 May  1:04 pm,"Battaramulla, Colombo","22,000,000","Brand New Two Story House For Sale In Pothuarawa Road, Arangala. 07 Perches with Landscaped garden area.The house is completely tiled","Pothuarawa Road , Palawatta",4,4,"2,400.0 sqft",8.0 perches
211,B New Single Story House - Battaramulla,24 May 10:40 am,"Battaramulla, Colombo","18,000,000","Brand New Single Story house @ Robert Gunawardane Rd, Battaramulla.10.5 Perches with Landscaped garden area.","Robat Gunawardena Mw, Battaramulla.",3,3,"1,700.0 sqft",10.5 perches
212,2 Storied House for Sale in Battaramulla .,13 Jun  2:12 pm,"Battaramulla, Colombo","37,500,000","බත්තරමුල්ල කොස්වත්ත හන්දියට මීටර් 300ක් පමණ   ද  ,කොස්වත්ත  කලපලුවාව  පාරට  මීටර් 200ක් පමණ ද ,අඩි 35ක් පමණ වන පයිප්ප පාරට මුහුනත ඇති පර්චස් 15ක ඉඩමේ ,නවීකරණය කරන ලද අංගසම්පූර්ණ කාමර 5,නාන කාමර 4ක  අලංකාර නිවස ලක්ෂ 375කට විකිනීමට බබලාපොරොත්තු වේ.රජයේ හෝ පුද්ගලික ආයතනයක කාර්යාලයකට  ,ඕනෑම ව්‍යාපාරයකට ඉතාමත් සුදුසු වටිනා ස්ථානයකි . තැරව්කරුවන් අනවශ්‍යයි .සත්‍ය ගැනුම්කරුවන් සදහා පමණයි .නිවස පරීක්ෂා කිරීමෙන් පසුව සාධාරණ  ඉල්ලුමකට මිලදී   ගත  හැක .නිවස පරීක්ෂා කිරීම සදහා සාකච්ඡා කර කලින් වෙලාවක් වෙන්කර ගන්න .",PIPE ROAD  KOSWATTA BATTARAMULLA .,5,4,"3,500.0 sqft",15.0 perches
213,Battaramulla Villa For Sale,26 Jun  9:26 am,"Battaramulla, Colombo","80,000,000","Reference No- KH 12Fully furnished Two storied Villa / Bangalow at Muththettugoda Road, Thalangama, Battaramulla.Located in high tranquility and close proximity  for Supermarkets, Hospitals, International Schools, Universities (SLIIT/ SAITM/ CINEC) and highways.Available or sale, Fully Air-conditioned, Seven bedrooms (Cabled for Telephone and TV)Attached and detached washrooms,Swimming PoolPanoramic view of a paddy field to all BedroomsDriver's, Maid's room with separate toilet, Large BalconyGarage and separate parking for 8 vehiclesCCTV Cameras installedClear title",Muththettugoda Road,7,4,"4,500.0 sqft",42.0 perches
