,0,1,2,3,4,5,6,7,8,9
0,title,posted date,location,price,description,Beds:,Baths:,House size:,Land size:,
1,House for sale - Battaramulla,17 Jul  5:14 pm,"Battaramulla, Colombo","65,000,000","800m to Palwatte  junction, Facing  D.P. Wijesingha Road main road, Architecturally  designed house. Land area 16P",4,3,"3,500.0 sqft",16.0 perches,
2,"['House for sale - Battaramulla', '17 Jul  5:14 pm', 'Battaramulla, Colombo', '65,000,000', '800m to Palwatte  junction, Facing  D.P. Wijesingha Road main road, Architecturally  designed house. Land area 16P', '4', '3', '3,500.0 sqft', '16.0 perches']","['title', 'posted date', 'location', 'price', 'description', 'Beds:', 'Baths:', 'House size:', 'Land size:']",,,,,,,,
3,Newly Built House in Pelawatta, 7 Jul 10:54 am,"Battaramulla, Colombo","27,500,000","A Newly Built Two storied house with first floor fully Completed .Highly Residential Area .Closer to Security Corporate HQs and Many Government Institutions in Pelawatta , Battaramulla.Commercial Rental Agreement with a Income of Rs.40000/Month Can be Continued if Preferred .",2,1,"1,200.0 sqft",8.5 perches,
4,House for Sale in Pelawatta,18 Jul  3:34 pm,"Battaramulla, Colombo","29,000,000",House for Sale in Pelawatta=====================,3,3,"3,000.0 sqft",6.0 perches,
5,Brand New 3story Luxury House for Sale - Battaramulla,12 Jul 12:32 pm,"Battaramulla, Colombo","45,000,000","Brand new 3story luxury house for sale in baththaramulla robet gunawarddana mawatha 5bedroom, 5bathroom, A/C, cctv camera TV lobby rooftop balcony seven room, and servent bathroom, 20ft road, 400mto main road walking distance to government compaies",baththaramulla robet gunawarddana mawatha,5,5,"3,280.0 sqft",7.5 perches
6,House for Sale in Pelawatte Junction,20 Jul  7:30 pm,"Battaramulla, Colombo","49,000,000","Old House for sale or rentIn the opposite direction to the Folk Arts Center70m to parliament road300m pelawatta junction --------------------------------------බත්තරමුල්ල පැලවත්ත ජනකලා කේන්ද්‍රය ඉදිරිපිට පැරණි නිවසක් සමග ඉඩම විකිණීමට හෝ කුලියට නිවසේ කාමර 11යි (යාබද නානකාමර 10)පර්චස් 13යිපාර්ලිමේන්තු පාරට මීටර් 70යිපැලවත්ත හංදියට මීටර් 300බැංකු,ඇවිදින මන්තීරු,පාසල,රෝහල්,සුපිරි වෙළෙඳසල් ඇතුළු සියලු පහසුකම් සමඟ ආයෝජනයකට කදිම ඉඩමකි.ගෙස්ට් හවුස් හෝ වියාපාරික කටයුත්තකට සුදුසුයි.ලක්‍ෂ 500/=යිමාසික කුලිය ලක්‍ෂ 2/=යි","pelawatta,Folk Arts Center",10+,10,"5,000.0 sqft",13.0 perches
7,House for sale - Battaramulla,17 Jul  5:14 pm,"Battaramulla, Colombo","65,000,000","800m to Palwatte  junction, Facing  D.P. Wijesingha Road main road, Architecturally  designed house. Land area 16P",4,3,"3,500.0 sqft",16.0 perches,
8,Luxury House sale in Battaramulla,20 Jul 10:30 am,"Battaramulla, Colombo","35,000,000",Architects designed. Two. Storied. Luxury. House. 4. Bedrooms.3bathrooms.large. living. Area. 2. Pantry. With  cooker. And  oven. Large. T.V. lobby.Balcony.Fully  Tiled. Newzealand. Wood. Civilima.A.C.And. C.C .T .V.solar. power.Surrounding. Wall. And. Roller. Gate.nice. garden. 2 vehicle. Parking. Area.20. Feet. Road.1.5. Km. Talawatugoda.2km. Palawatta. Junction .better. environment,4,3,"3,000.0 sqft",10.0 perches,
9,Brand New luxurious 3 storied House for sale Pelawatta,19 Jul 11:14 pm,"Battaramulla, Colombo","195,000,000","Brand New | luxurious | 3 storied | House for sale @ Pelawatta________________________________________________________Land & Floor Area •20 perches, (11500 sq,ft)",Near pelawatta city limit,7,7,"11,500.0 sqft",20.0 perches
10,Newly Built | Luxury Spacious House for sale Battaramulla,19 Jul  9:59 pm,"Battaramulla, Colombo","115,000,000",Newly Built | Luxury | Spacious | House for sale @ Battaramulla______________________________________________________Land & Floor Area -,Near Paliament area,5,3,"4,000.0 sqft",43.0 perches
11,Single Story House Thalahena,19 Jul  9:27 pm,"Battaramulla, Colombo","12,500,000","Brand New 2 Storied House For Sale In Battaramulla Road, Thalahena.07 Perches with Landscaped garden area. ( 1 Year Used )The house is completely tiled","Battaramulla Road, Thalahena.",3,3,"1,200.0 sqft",7.0 perches
12,House for Sale in Battaramulla,19 Jul  2:50 pm,"Battaramulla, Colombo","75,000,000","Architect owned house in a fascinating environment (real pictures attached)- House built on 11 perches and attached bare land 12 perches- 4 Bed rooms with private gardens- 4 Bath rooms with hot water- Air conditioned bedrooms- Furnished house- CCTV- Roller shutter & wicket gate- Over head water tanks- 15ft wide road- Close proximity to Battaramulla, Pelawatta, Koswatta & Malabe- Respectable neighborhoods",4,4,"4,500.0 sqft",23.0 perches,
13,House | for Sale in Pelawatta - H0691,19 Jul  7:52 am,"Battaramulla, Colombo","180,000,000","Pallewatta Battaramulla Colombo Sri Lanka on 23 perched of Land, with a total house of 14000 Sq. ft.The Neighborhood is considered Elite and Quite.",7,7,"14,000.0 sqft",23.0 perches,
14,2Storey Luxury House For Sale- Battharamulla with Swimming Pool,18 Jul 11:00 pm,"Battaramulla, Colombo","37,000,000","2Storey Luxury House For Sale in Battharamulla with Swimming Pool400 meters to thalahen junction Battharamulla*1 km to Malabe junction. *500 meters to Thalahena junction04 Bed Rooms 01 A/C Room04 Attach Bath Rooms Living RoomDining roomPantry /kitchenveranda,TV LobyParking available for 2vehicles.Landscaped Garden / Swimming Pool2nd floor with Roof top Access Road 18 feet Road Just about 900 meters to Battaramulla town. Easy access to government office, banks, super markets etc. Close proximity to passport office, ID office and Sethsiripaya. Situated in the highly commercialized area but a calm place.Call for Seen on appointments Genuine Buyers Only PLEASE CALL FOR SEEN ON APPOINTMENTS NO BROKERS PLZZZZZ. .",400 meters to thalahen junction Battharamulla,4,4,"3,500.0 sqft",10.0 perches
15,Super Luxury Three Story House Sale For Battaramulla,18 Jul  8:41 pm,"Battaramulla, Colombo","45,000,000",Brand New Super Luxury Three Story House Sale For Robert Gunawardena Mawatha Battaramulla ,"Robert Gunawardena Mawatha, Battaramulla",4,5,"3,000.0 sqft",7.5 perches
16,2 story luxury house for sale in battaramulla,18 Jul  1:28 pm,"Battaramulla, Colombo","25,000,000","2 story luxury house for sale in Robert Gunawardena Mawatha Battaramulla.6.6 perches4 bedrooms3 bathrooms dining, pantry, and bar areaservent kitchen and bathroom3 parking 1 km to Baramulla.25 million",robert gunawardana mawatha battaramulla,4,4,"2,500.0 sqft",6.0 perches
17,3 Bedroom House with Garden for Sale in Pelawatta,18 Jul 12:35 pm,"Battaramulla, Colombo","26,500,000","3 bedroom house with separate servant quarters and storage room for sale in Pelawatta.About 1.2km to Pelawatta junction and OSC international school. Less than 2km to Thalawathugoda Hemas hospital. Very near to Passport office , Isurupaya & other government offices. Peaceful area.. master bedroom with A/C & attached bathroom. 26.5 Million without furniture. Fully furnished negotiable. For Urgent sale ! Owner migrating.. No brokers please.. genuine buyers only.","Lake road , Pelawaththa",3,2,"2,000.0 sqft",12.0 perches
18,Brand New Luxurious House for Sale - Battaramulla,18 Jul  7:42 am,"Battaramulla, Colombo","170,000,000","Brand New | luxurious | House for sale @  Battaramulla_____________________________________________Land & Floor Area -20 perches, (5544sq,ft)Fully A/C_____________________________________________Bedrooms -",Near ITN Road,6,5,"5,544.0 sqft",20.0 perches
19,Newly Built Luxury House For Sale In Pelawatta,18 Jul  6:11 am,"Battaramulla, Colombo","41,000,000",• Our Reference No SH 10471( Please quote this reference number when inquiring),"Pelawatta, Battaramulla",4,4,"4,000.0 sqft",11.5 perches
20,Luxury House for Sale - Battaramulla,20 Jul 11:12 am,"Battaramulla, Colombo","68,000,000","Architecturally designed 3 storied modern house @ Ethulkotte near Diyatha uyana in 9.5 perches. 3,600 sq.ft. 3 roof gardens + roof terrace. 5 bed rooms, 4 bathrooms, two pantries, servants room etc.. quoted price Rs. 68.0 Mn. Adjoining land with 12.5 perches is also available.",5,4,"3,600.0 sqft",9.5 perches,
21,House for Sale in Thalahena,17 Jul  2:49 pm,"Battaramulla, Colombo","38,000,000",Colonial type 2 storied house bordering a paddy field in a calm location surround with good houses. 500 M to the main Road (New Kandy road). Access road to the property is 20ft. ,"Thalahena, Kosswatta",5,4,"3,200.0 sqft",12.5 perches
22,B / New Single Storied House For Sale || Battaramulla,17 Jul  2:38 pm,"Battaramulla, Colombo","18,000,000","Brand New Single Storied House For Sale @ Robert Gunawardane Mw, Battaramulla.","Robat Gunawardena Mw, Battaramulla",3,3,"1,800.0 sqft",10.5 perches
23,House | for Sale Pelawatta - H0733-C,17 Jul  1:56 pm,"Battaramulla, Colombo","26,500,000","Luxury living in an eco-friendly setting - Lake Road, Pelawatta",4,3,"2,500.0 sqft",7.8 perches,
24,2 Storied House|| For Sale in || Battaramulla,17 Jul  2:14 pm,"Battaramulla, Colombo","33,000,000","Two Storied House For Sale In Battaramulla.Pipe Road, Koswatta, Battaramulla.","Pipe Road, Battaramulla.",6,3,"3,600.0 sqft",10.0 perches
25,2 || Storied House For Sale in Baththaramulla,17 Jul 10:40 am,"Battaramulla, Colombo","30,000,000","Two storied house @ Pothuarawa. On 16 Perch Land Malabe Rd, Pothuarawa","Pothuarawa Road, Palawatta.",5,4,"3,500.0 sqft",16.0 perches
26,House for Sale Malabe,17 Jul  8:16 am,"Battaramulla, Colombo","6,500,000",Malabe kahanthota Road Less Then 1K. M 200meters pittugala junction,Malabe kahanthota,2,1,"1,000.0 sqft",6.0 perches
27,Brand New Single Story House for Sale - Battaramulla,16 Jul  7:55 pm,"Battaramulla, Colombo","18,500,000","Brand New Single Story house - Robert Gunawardane Rd, Battaramulla.10.5 Perches with Landscaped garden area. 300 Meters  to Gunawardane Rd Main Road...............................................................................................................................................03 Bed rooms 02 bathrooms  Living room  dining room Kitchen with modern pantry cupboardsServant facilities (toilet )Pipe born water with over head water tank02 Vehicles can be Parking ","Robert Gunawardane Rd, Battaramulla.",3,3,"1,850.0 sqft",10.5 perches
28,Brand new luxurious house in battaramulla,16 Jul  8:22 am,"Battaramulla, Colombo","45,000,000","We have luxurious specious 3 storied Brand new house for special offer…… please contact - only 45 million - negotiable4000 square feet house, 4 specious bed rooms with AC & attached bath rooms. Total 6 bath rooms. 20 feet wide road. You don't find a house with this features for this price. Perfect plan.. 2 vehicles can park. Hot water with solar. Specious living & dining areas.seperate maid rooms with bath rooms. Scenic large terrace, laundry room.CCTV, AC, Roller gate, fully equip pantry cupboards. High quality wood for doors & windows. House has constructed to the highest standard using quality materials.Nice garden, peaceful well secured residential area located at battaramulla just 5 minutes to the town. Very convenience to Keels/ Cargills /Laughs supermarkets and the banks & light rail transport project…..Selling at urgently..Just completed","Densil kobbakaduwa mv, Battaramulla",5,6,"4,200.0 sqft",7.5 perches
29,Newly Built House in Pelawatta, 7 Jul 10:54 am,"Battaramulla, Colombo","27,500,000","A Newly Built Two storied house with first floor fully Completed .Highly Residential Area .Closer to Security Corporate HQs and Many Government Institutions in Pelawatta , Battaramulla.Commercial Rental Agreement with a Income of Rs.40000/Month Can be Continued if Preferred .",2,1,"1,200.0 sqft",8.5 perches,
30,House for sale - Battaramulla,17 Jul  5:14 pm,"Battaramulla, Colombo","65,000,000","800m to Palwatte  junction, Facing  D.P. Wijesingha Road main road, Architecturally  designed house. Land area 16P",4,3,"3,500.0 sqft",16.0 perches,
31,House for Sale in Battaramulla [ls17],16 Jul 12:53 am,"Battaramulla, Colombo","62,000,000","Highlights- Land extent: 18.2 Perches- Property is located facing Rohana Mawatha, Subuthipura, Battaramulla. - Approx. 250 meters from Subuthi Drive. - Approx. 750 meters from Main Street [Kotte - Bope Main Road].- Approx. 1 km meters from Parliament Junction.- The property is accessible via 20-30 foot wide access roads [Weera Mw & Rohana Mw].","Rohana Mawatha, Subuthipura, Battaramulla",4,2,"1,500.0 sqft",18.2 perches
32,Luxury House for Sale in Pelawatta Battaramulla,15 Jul  8:09 pm,"Battaramulla, Colombo","110,000,000",4 floors 5000 sqft luxury house on 20p fully furnished,"Samanala Mawatha off Kumaragewatta, Battaramulla",4,4,"5,000.0 sqft",20.0 perches
33,Two Story 6 BED 5 BAR House Thalahena,15 Jul  5:23 pm,"Battaramulla, Colombo","50,000,000","Two Storied House For Sale InThalahena Road, Malabe.17.6 Perches with Landscaped garden area.","Thalahena Rd, Halbara Gardens",6,5,"3,600.0 sqft",17.6 perches
34,House for Sale in Battaramulla,20 Jul 11:12 am,"Battaramulla, Colombo","68,000,000","3 Storied Modern House at Ethul Kotte, near Diyatha Uyanain 9.5 perches.3600sqft3 roof Gardens5 Bed Room4 bathroomstwo pantiesServants room quotedPrice 68 Million","Ethul Kotte, Baththaramulle",5,4,"3,600.0 sqft",9.5 perches
35,"Villa Type House with Swimming Pool for Sale in Pelawatte, Battaramulla.",15 Jul  4:15 pm,"Battaramulla, Colombo","85,000,000","Luxury Villa Type House with Swimming Pool for Sale in a scenic and very peaceful as well as tranquil environment in Pelawatte, Battaramulla close to Light of Asia Centre. Probably the best organized and custom design villa in Akuregoda, Battaramulla.",Pelawatte,4,3,"5,521.0 sqft",37.0 perches
36,Luxury House for Sale in Thalahena [HS32],15 Jul  2:50 pm,"Battaramulla, Colombo","97,500,000","Brand new luxury house for immediate sale in Thalahena, conveniently located approx. 1 km away from Thalahena Junction and within close proximity to all modern day conveniences. The house has been recently constructed and is offered for sale including all furniture and essential appliances. The house has been tastefully designed and constructed to exceptional standards with the use of high quality fittings and fixtures.","Himbutana Road, Thalahena",6,6,"6,000.0 sqft",23.0 perches
37,Brand New Single Storied House For Sale in Battaramulla,15 Jul 12:30 pm,"Battaramulla, Colombo","18,000,000","Brand New Single Storied House For Sale @ Robert Gunawardane Mw, Battaramulla.","Robat Gunawardena Mw, Battaramulla.",3,3,"1,800.0 sqft",10.5 perches
38,House for sale at Battaramulla,15 Jul 10:01 am,"Battaramulla, Colombo","47,500,000","2 storied old house in a residential and peaceful location in the heart of Battaramulla town( No distance to Battaramulla junction). We sell only for the land value no value hasadded for the house.Call us for more lands/ houses in Thalawathugoda, Palawatta, Malambe, Thalahena, Battaramulla and Kotte. We also have large sized lands and lands for commercial purposes.",Battaramulla,4,3,"2,100.0 sqft",10.8 perches
39,London Style Home in Battaramulla Koswatta,15 Jul  9:28 am,"Battaramulla, Colombo","20,800,000",A beautiful London Style House in the heart of Battaramulla Koswatta. ,4,2,"2,000.0 sqft",7.5 perches,
40,Two Storied 5 Bed House For Sale Battaramulla,14 Jul  6:47 pm,"Battaramulla, Colombo","30,000,000","Two storied house For Sale in Pothuarawa. On 16 Perch Land Malabe Rd, Pothuarawa","Pothuarawa Road, Palawatta.",5,4,"3,500.0 sqft",16.0 perches
41,Semi Luxury House for Sale - Battaramulla,14 Jul 11:20 am,"Battaramulla, Colombo","40,000,000","HOUSE IS OVERLOOKING VAST PADDY FIELD 10 PRIVATE DWELLINGS ONLY.TWO PANTRY AREAS,HARD KITCHEN,TV LOUNGE,STUDY ,SHRINE ROOM,TWOBALCONIES,MAIDS ROOM & TOILET,GARAGE WITH REMOTE ROLLER SHUTTER.",4,4,"4,200.0 sqft",12.0 perches,
42,Pelawattha luxury House for Sale,13 Jul  3:42 pm,"Battaramulla, Colombo","38,000,000",Pelawattha luxury House for Sale,Pelawatta,3,3,"3,500.0 sqft",9.0 perches
43,House for Sale in Battaramulla,13 Jul  4:23 pm,"Battaramulla, Colombo","11,500,000","3 bed room,living and dining room kitchen,1 bath room",3,1,"1,800.0 sqft",10.0 perches,
44,House New Tow Story for Sale Baththaramulla,13 Jul  3:02 pm,"Battaramulla, Colombo","45,000,000",45 million brend New tow story house 4 ac room Cct camera Solar hot water 500 miters Dencil kobbekaduwa meFull complete house,baththaramulla,4,5,"3,000.0 sqft",7.0 perches
45,15.8 P & Modern Two Story House Sale for Thalahena,15 Jul  8:09 am,"Battaramulla, Colombo","50,000,000",15.8 P & Modern Two Story House Sale For Thalahena,"Halbarawa, Thalahena",4,4,"6,300.0 sqft",15.8 perches
46,House at Battaramulla Kumaragewatta,13 Jul 10:37 am,"Battaramulla, Colombo","22,000,000","House selling at Land value in Battaramulla, Kumaragewatta Rd, 12.9 P land extent, 2 rooms and 2 bath rooms and separate annex with bath room, Living, Kitchen with pantry, 2 vehicle parking and only 200 m to the Pannipitiya, Borella (174 Bus Route) main rd. Walking distance ( 150 m ) to the New Arpico Out let. Asking value is only for the land value.Very convenient place with plenty access to super markets, bus route to Borella, Pannipitiya, Battarmulla, Palawatta etc. Residential area with Supermarkets, Eateries, Private Schools, Banks etc. Asking Land Value 1.7m ( negotiable)","Battaramulla, Kumaragewatta",3,3,"2,000.0 sqft",12.9 perches
47,House for Sale in Battaramulla - H0690,13 Jul 10:22 am,"Battaramulla, Colombo","42,000,000","#.2 STORIED HOUSE AT DICKLAND GARDEN, BATTARAMULLA",4,4,"3,000.0 sqft",8.8 perches,
48,Brand New Luxury Three Story House Sale At Battaramulla,13 Jul 12:33 am,"Battaramulla, Colombo","45,000,000",Brand New Super Luxury Three Story House Sale For Robert Gunawardena Mawatha Battaramulla,"Robert Gunawardena Mawatha, Battaramulla",4,5,"3,000.0 sqft",7.5 perches
49,House for Sale in - Pelawatta,13 Jul  8:41 am,"Battaramulla, Colombo","9,000,000","Single story house at Akuregoda - Jayanadhapura RoadGood Neighborhood, calm & quite area20 feet wide road access ","544/C, Thalangama South, Battaramulla",2,1,950.0 sqft,6.0 perches
50,Pelawatta House for Sale - HH733,12 Jul  7:36 pm,"Battaramulla, Colombo","110,000,000",BEAUTIFUL HOUSE AT PELAWATTA,4,4,"4,500.0 sqft",22.0 perches,
51,House for Sale in Pelawatta- HH713-A,12 Jul  7:29 pm,"Battaramulla, Colombo","180,000,000",Unusual - Unique - Multipurpose - House - Boutique Hotel - Resort,9,10,"18,300.0 sqft",60.26 perches,
52,B/New 2 BR Single Story House Battaramulla,12 Jul  4:36 pm,"Battaramulla, Colombo","18,000,000","Brand New Single Storied House For Sale @ Robert Gunawardane Mw, Battaramulla.10.5 Perch Land  ( • - 1800 Sq. Ft.) ","Robat Gunawardena Mw, Battaramulla.",3,3,"1,800.0 sqft",10.5 perches
53,03 Story House with Pool for Sale - Pelawatha,12 Jul  9:56 pm,"Battaramulla, Colombo","41,000,000",03 Story House & 10.45 P Sale For Pelawattq,Rathnayake Mawatha Pelawatha,5,4,"2,800.0 sqft",10.45 perches
54,"Luxury House for Sale in Pelawatta, Battaramulla",12 Jul 12:38 pm,"Battaramulla, Colombo","130,000,000",Luxury house for sale in Pelawatta Battaramulla,3,4,"5,000.0 sqft",22.0 perches,
55,Super Luxury House for Sale - Battaramulla,12 Jul 11:01 am,"Battaramulla, Colombo","60,000,000",400 m to pelawatta. Junction. Palamthuna junction 20 perches luxury house with 7bed 7bathroom 4story house spacious living dining. Wooden pantry servant room servant bathroom landscape garden 6 vehicle parking spaces almost brand new two roller doors highly residential area very close to Battaramulla pelawatta Rajagiriya Colombo price 60000000 no brokers genuine buyers well come after appointments,Battaramulla pelawatta. kandewatta Rd,7,7,"8,000.0 sqft",20.0 perches
56,House for sale - Battaramulla,17 Jul  5:14 pm,"Battaramulla, Colombo","65,000,000","800m to Palwatte  junction, Facing  D.P. Wijesingha Road main road, Architecturally  designed house. Land area 16P",4,3,"3,500.0 sqft",16.0 perches,
57,Newly Built House in Pelawatta, 7 Jul 10:54 am,"Battaramulla, Colombo","27,500,000","A Newly Built Two storied house with first floor fully Completed .Highly Residential Area .Closer to Security Corporate HQs and Many Government Institutions in Pelawatta , Battaramulla.Commercial Rental Agreement with a Income of Rs.40000/Month Can be Continued if Preferred .",2,1,"1,200.0 sqft",8.5 perches,
58,2 Storied House For Sale Gunawardena Mawatha Battharamulla,12 Jul  6:55 am,"Battaramulla, Colombo","50,000,000",2storied  House For Sale Gunawardena Mawatha Battharamulla  ,Robert Gunawardena Mawatha Battharamulla,5,5,"3,120.0 sqft",15.0 perches
59,Building House for Sale Battaramulla,11 Jul  4:33 pm,"Battaramulla, Colombo","9,000,000","*ඉඩම්,නිවාස,විකිනීමට, කුලියට**අගනා නේවාසික හා ව්‍යාපාරික,",Battaramulla,4,2,"2,000.0 sqft",6.0 perches
60,Two Storied House For Sale in || Baththaramulla,11 Jul 11:22 am,"Battaramulla, Colombo","30,000,000","Two storied house For Sale in  Pothuarawa. On 16 Perch Land Malabe Rd, Pothuarawa","Pothuarawa Road, Palawatta.",5,4,"3,500.0 sqft",16.0 perches
61,10.45 P and Two Story House Sale For Pelawatta,11 Jul  7:51 am,"Battaramulla, Colombo","41,000,000",10.45P & Two Story House Sale For Pelawatta ,"Rathnayaka Mawatha, Pelawatta",5,4,"2,300.0 sqft",10.45 perches
62,15.7 P & Modern Two Story House Sale for Thalahena,15 Jul  8:14 am,"Battaramulla, Colombo","50,000,000",15P & Modern Two Story House Sale For Thalahena ,"Halbarawa, Thalahena",4,4,"6,300.0 sqft",15.7 perches
63,Brand New Super Luxury Three Story House Sale For Battaramulla,10 Jul  7:00 pm,"Battaramulla, Colombo","45,000,000",Brand New Super Luxury Three Story House Sale For Robert Gunawardena Mawatha Battaramulla ,"Robert Gunawardena Mawatha, Battaramulla",4,5,"3,000.0 sqft",7.5 perches
64,Two Story House For Sale Palawatta,10 Jul  5:17 pm,"Battaramulla, Colombo","45,000,000",Two Storied House in Palawatta10 Perches with Landscaped garden area.,"Battaramulla Road, Palawatta.",4,4,"3,500.0 sqft",10.0 perches
65,Luxurious Brand New Three Storied House for Sale in Battaramulla,10 Jul  3:54 pm,"Battaramulla, Colombo","45,000,000","Owner Name : Sameera Nuwan Dharmasiri Luxurious Brand New Three Storied House 5 Min to Battaramulla townThe feature include4 Spacious bedrooms with A/C5 bathrooms with hot waterSpacious living & dining roomsSeparate maids room & bathroomScenic large roof terracePantry, Laundry room, CCTV Cameras, Landscaped Front and Rear garden.Roller doors, Parking, Facing 20 ft access roadTimber for doors & windowsHouse is constructed to the highest standard using high quality materialsClose proximity to super markets, banks, restaurants and light rail transit project.",4,6,"3,000.0 sqft",7.5 perches,
66,02 Story Luxury House Sale Battramulla,10 Jul  3:12 pm,"Battaramulla, Colombo","75,000,000",Rs 75000000.00 LAKHSTOTAL PRICENegotiable,50 METERS TO PALAM TUNA JUNCTION BATTRAMULLA,5,4,"4,250.0 sqft",10.0 perches
67,Single Storied House For Sale in Palawatta,10 Jul 11:16 am,"Battaramulla, Colombo","18,000,000","Brand New Single Storied House For Sale @ Robert Gunawardane Mw, Battaramulla.10.5 Perches with Landscaped garden area.","Robat Gunawardena Mw, Battaramulla.",3,3,"1,800.0 sqft",10.5 perches
68,House for Sale in Battaramulla,13 Jul  4:23 pm,"Battaramulla, Colombo","21,000,000",Two storey House for Sale in Diyawanna Gardens Project – Stage 2,3,3,"2,040.0 sqft",6.5 perches,
69,Morden New House for Sale in - Battharamulla, 9 Jul  2:53 pm,"Battaramulla, Colombo","31,500,000","Morden New House For Sale Battharamulla600 meters to Thalahena Junction, Battharamulla -------------------------------------------------------------* සිමෙන්ති - මහවැලි ටෝකියෝ  super හා සංස්ථා  සිමෙන්ති* යකඩ - සංස්ථා වානේ * ගඩොල් - ඉංජිනේරු ගඩොල් (8x41/2)x21/2* ටයිල්ස් - ලංකා ටයිල් * බාත් වේයා  - රෝසෙල් බාත් වේයා* දොර ජනෙල් - තේක්ක/ කොස් ----------------------------------------------------------- පහත මහල :---------------------------* විසිත්ත කාමරය සහ කෑම කාමරය හා පැන්ට්‍රි *මුළුතැන් ගෙය *අමුත්තන් සඳහා සදහා කාමරය හා යාබද ඇටෑච් බාත්රූම්*සේවක කාමර*Driver හෝ ගබඩා කාමර* සේවක වැසිකිලි *වාහන දෙකක් දැමිය හැකි ගරාජය *වොෂින් එරියා","600 meters to Thalahena Junction, Battharamulla",5,4,"3,100.0 sqft",9.5 perches
70,HS204 - Stunning House for Sale in Battaramulla, 9 Jul  2:03 pm,"Battaramulla, Colombo","60,000,000","* 06 years old house* Access road 10ft* 02 stories* Total 05 bedrooms (02 ground floors - one with a/c and one without, 03 bedrooms in 01st floor - A/c)* Total 03 bathrooms (02 Ensuit (01st floor), 01 common in the 01st floor)* 02 Balconies (One overlooking the parliament)* Garage Parking for 02+* Front Garden* Backyard* Well lit interior* Tiled Floor* Maid's Quarters* A/C Rooms* Hot Water* With the view of the Parliament & Osu Uyana* Jack wood doors and wooden ceiling",5,3,"3,024.0 sqft",15.0 perches,
