,0,1,2,3,4,5,6,7
0,title,posted date,location,price,description,Address:,Land type:,Land size:
1,අනුරාධපුර නගර සීමාවෙන් ඉඩම් කොටසක් විකිණීමට,20 Jul  3:13 pm,"Anuradhapura, Anuradhapura","300,000",* අනුරාධපුර නගර සීමාවේ පිහිටි පිරිසිදු සින්නක්කර ඔප්පු සහිත ඉඩමකි. ,"jaffna junction ,Anuradhapura","Commercial, Residential",20.0 perches
2,"['අනුරාධපුර නගර සීමාවෙන් ඉඩම් කොටසක් විකිණීමට', '20 Jul  3:13 pm', 'Anuradhapura, Anuradhapura', '300,000', '* අනුරාධපුර නගර සීමාවේ පිහිටි පිරිසිදු සින්නක්කර ඔප්පු සහිත ඉඩමකි. ', 'jaffna junction ,Anuradhapura', 'Commercial, Residential', '20.0 perches']","['title', 'posted date', 'location', 'price', 'description', 'Address:', 'Land type:', 'Land size:']",,,,,,
3,Valuable Commercial Land near Talawa Bus Station facing A28,19 Jul  4:04 pm,"Talawa, Anuradhapura","6,900,000",Foundation has been done for a 3 storey building with a basement.  You could build 3/4 small shops in the basement facing the side road goes to Talawa market.Then designed 3 stories from the A28 main road level facing the main road just like other buildings nearby. ,"Talawa Bus Station, Talawa, Anuradhapura",Commercial,6.0 perches
4,Prime Royal Terrace - Puliyankulam,24 Jul 11:18 am,"Anuradhapura, Anuradhapura","285,000","Land Details•	Project name – Royal Terrace•	Town – Anuradhapura•	City – Anuradhapura•	District – Anuradhapura•	Price P.P – 285,000/= to 610,000/=Facilities•	Electricity –Three phase•	Water – Water board line •	Tar Road – 20’ to 30’ wide Tar road",Prime Lands Pvt Ltd - Anuradhapura,"Commercial, Residential",10.0 perches
5,Prime North Star Land for Sale - Anuradhapura,24 Jul 11:17 am,"Anuradhapura, Anuradhapura","310,000",අනුරාධපුර යාපනය හන්දියෙන් ප්රධන පාරට මුහුණලා සුන්දර වෙල් යායකින් වට වූ සින්නක්කර ඔප්පු සහිත නේවාසික හා වය්යාපාරික බිම් කොටස්.- නල ජලය- තෙකලා විදුලිය- තාර යෙදූ පුලුල් මාර්ග- බැංකු ණය හා පහසු ගෙවීමේ ක්රම- පුජා නගරයට මීටර් 800- අනුරාධපුර නගරය මීටර් 600,Prime Lands Pvt Ltd - Anuradhapura,"Commercial, Residential",10.0 perches
6,Land for Sale - Anuradhapura (Near Thisa Wewa),23 Jul 10:24 am,"Anuradhapura, Anuradhapura","39,600,000",A land in an attractive place close to Thisa wewa (walking distance). Has a completed little house with electricity and water. Also included a well and a landscaped garden. Clear deeds.,"2 Kanuwa , Thisa wewa , Anuradhapura","Commercial, Residential",72.0 perches
7,Land for sale in Anuradapura,23 Jul  3:13 pm,"Anuradhapura, Anuradhapura","2,900,000",Land for sale in Anuradapura  ( Town Area )සාලිය  මාවත /  පුල්ලෙයාර් හන්දිය  /  අනුරාදපුර  Land  Size 15 Perches නුවර වැව  ආසන්න යේඅඩක් වැඩ නිමකළ  නිවසක්ද සහිතව කාමර 2 සලය / නානකාමරය  සහ කුස්සියට  ස්ලැබ් එක දමා ඇත අනුමත සැලැස්මක්  සහිතයි Price Rs 2900000 වැඩි විස්තර සදහා අමතන්න,Saliya mawatha - Pulleyar handiya  - Anuradapura,Residential,15.0 perches
8,Land and house for Sale in Anuradhapura,23 Jul  1:56 pm,"Anuradhapura, Anuradhapura","60,000",අනුරාධපුර ගුවන්තොටුපළ පාරේ ඣානික්කුලම ශ්‍රමදාන මාවතේ  පර්චස් 109 ඉඩම විකිණීමට (නුවර පාරට කි.මි.1)ජය භුමි ඔප්පු  සහිතයි අනුරාධපුර ශික්ෂණ රොහලට කි.මි 6 නව / පැරණි බස්නැවතුපලට කි මි 7.5අංගසම්පූර්ණ කාමර 3 නිවසක් සහිතයි අඹ පොල් ඇතුලු වගාවන් සහිත ජල විදුලිය සහිතයි  පවන ගාර්ඩ්න් හෝටලයට යාබදව පිහිටා ඇත,Shramadhaana mawatha ghranikkulama anuradhapura,"Agricultural, Commercial, Residential, Other",109.0 perches
9,2.5 Acres Agricultural Land and 80 Perches Bare in Thambuttegama,23 Jul  7:58 pm,"Tambuttegama, Anuradhapura","4,500,000",Paddy Land (2.5 Acres)- 100% Clear Deeds- Profitable Agricultural Land.- Good Water Supply- Clear 12 Ft Access Road- 300 M to The Main Road. ( Anuradhapura - Kurunegala Main Road)- 3 Km to Thambuttegama Town- 23 Km to Anuradhapura Main Town.,"Koonwewa, Thambuttegama (anuradhapura - Kurunegala Main Road)","Agricultural, Commercial, Residential",3.0 acres
10,Land With House For Sale In Kekirawa,23 Jul  2:10 pm,"Kekirawa, Anuradhapura","2,000,000",Land for sale in kerirawa===================,Residential,80.0 perches,
11,පොල් ඉඩම විකිණීමට මැදවච්චිය,22 Jul  2:17 pm,"Medawachchiya, Anuradhapura","5,000,000",ඉතාමත් සරු පොල් ඉඩමක් . රට යන නිසා විකුණනු ලැබේ පිදෙන පැල . වැඩි විස්තර සඳහා අමතන .,Agricultural,20.0 acres,
12,Land in Anuradhapura Nochchiyagama,22 Jul  2:07 pm,"Nochchiyagama, Anuradhapura","3,200,000","#අගනා නිවසක් (කාමර 3 , සාලය , කුස්සිය)#පොල් අක්කරයක් (මාස 1.5  වතාවක් rs 20000 ආදායමක්)# කුබුරු අක්කරයක් ( ගොඩ සහ මඩ ගොවිතැන් සිදුකල හැක)#වගා ලිදක් සහ බීමට ගන්නා වතුර ලින් 2ක්#කොස් ගස් , අබ ගස්, අලිගැටපෙර , කොකෝවා, වෙරලු, දොඩම් , දෙහි , පේර , ඇබරැල්ලා,දෙල් වැනි ගෙඩි කැඩෙන ගස් විශාල ප්‍රමානයක් ඇත.",thammannawa pahalamaragahawewa,Other,2.0 acres
13,Valuable Land for Sale - Anuradhapura,21 Jul  4:07 pm,"Mihintale, Anuradhapura","8,000,000","01 acre flat land with a small house facing to Anuradhapura,Trincomalee road at Ranpathwila.Suitable for either residential or commercial purposes","Commercial, Residential",1.0 acres,
14,අනුරාධපුර ඉඩම විකිණීමට,23 Jul 12:53 pm,"Anuradhapura, Anuradhapura","22,000","නිරවුල් පිරිසිදු ඔප්පු ,ජලය, විදුලිය ,දුරකථන ,කාමර 2ක නිවස,අඩි 20 පුලුල් මර්ගය,සාලියපුර  හමුදා කදඋර අසල ,නිවස 20 පර.","සාලියපුර ,අනුරාධපුර",Residential,64.0 perches
15,Land for Sale - Medawachchiya,20 Jul 11:56 am,"Medawachchiya, Anuradhapura","4,650,000",Nwara - Yapanaya A9 pradhana margyata munala. Wyaparika sthanayakata ho padinchiyata sudusu watapitawa.Medawachchiya town eke sita 800m dura.,"253, Kandy Road, Kanadarawa, Medawachchiya","Commercial, Residential, Other",47.0 perches
16,The Best Land for Sale in Anuradhapura,21 Jul 10:55 am,"Anuradhapura, Anuradhapura","115,000","30 perches land completely or a block of land (10 perches or 15 perches) is for sale. Clear deed (Sinnakara Oppu)Thekka has been cultivated. Calm environment for living.Face to 20ft road.Telephone,water and electricity are available.1.5 km to the Pulliyara junction1.5 km to the Jaffna junctionGROWING AREA, SO GOOD FOR INVESTMENT ALSO.A good place for SMALL SCALE ACCOMMODATION BUSINESS for travelers coming Anuradhapura.Immediate sale for urgent money requirement (මුදල් හදිසියක් බැවින් වැඩිම ඉල්ලුමට විකිණීමට .)","Saliya Mawatha, Anuradhapura",Residential,30.0 perches
17,Land with 6 Roomed House for Sale in - Anuradhapura,23 Jul  2:07 pm,"Anuradhapura, Anuradhapura","37,500,000","A Valuable Land with  6 Room House, ideal for a Hotel. House  to be renovated. Pipe borne water and 3 phase electricity .Property located at Sravastipura 300m to Kurunegala Road, 5 Km off Anuradhapura Town. Close to The Sacred City.Serene Independent Environment, No Close-By Lands or Houses.the Rail Track Is Running on The East Beyond Railway Reservation.a canal is flowing in front of the land 240 Perches in Total and the Land Is More Suitable for a Hotel with Cottages or Otherwise.a Pond Which Can Be Converted to be a Pool is available at the backside of the Land with Another Large Reservoir adjoining itiArea Is currently popular for Hotels and Lodges.","Commercial, Residential",240.0 perches,
18,Valuable Commercial Land near Talawa Bus Station facing A28,19 Jul  4:04 pm,"Talawa, Anuradhapura","6,900,000",Foundation has been done for a 3 storey building with a basement.  You could build 3/4 small shops in the basement facing the side road goes to Talawa market.Then designed 3 stories from the A28 main road level facing the main road just like other buildings nearby. ,"Talawa Bus Station, Talawa, Anuradhapura",Commercial,6.0 perches
19,Land and House for Sale in Anuradhapura,19 Jul 12:36 pm,"Anuradhapura, Anuradhapura","12,500,000",අනුරාධපුර පුජා නගරයට සමිපව නිස්කලංක පරිසරය පිහිටි අක්කරය පොල් ඉඩම   හා අංගසම්පූර්ණ නිවස විකිණීමට,"Agricultural, Commercial, Residential, Other",160.0 perches,
20,Land for Sale in - Mihinthale,24 Jul 12:01 pm,"Mihintale, Anuradhapura","175,000","- 52 කනුව ,කන්නට්ටිය ,මිහින්තලය පිහිටි පර්චස් 101 ඉඩම.- බැංකු ණය පහසුකම්,- ජල, විදුලි පහසුකම් ඇතුඵ සියලු පහසුකම් සහිතයි. - අනුරාධපුර සහ මිහින්තලය ප්‍රධාන පාරට මුහුනලා- මිහින්තලය නගරයට කිලොමීටර 3- පර්චසයක් ලක්ෂ 1.75- වැඩිම ඉල්ලුමට.",Commercial,101.0 perches,
21,Prime Freedom Square - Alankulama,18 Jul  2:45 pm,"Anuradhapura, Anuradhapura","360,000","සංවර්ධනය වෙමින් පවතින අනුරාධපුර – තලාව පාර 2 කණුව හන්දියෙන් සුන්දර වෙල් යායකින් වට වූ සින්නක්කර ඔප්පු සහිත නේවාසික බිම් කොටස්.- නල ජලය- තෙකලා විදුලිය- බැංකු ණය හා පහසු ගෙවීම්- පුජා නගරයට 2 Km- අනුරාධපුර නගරයට 1Km Google Map link – https://www.google.lk/maps/@8.3160048,80.377008,3a,75y,111.93h,73.98t/data=!3m6!1e1!3m4!1smfFYFTVUwotSz-g7xY3HhQ!2e0!7i13312!8i6656",Prime Lands Pvt Ltd - Anuradhapura,"Commercial, Residential",10.0 perches
22,Prime City point 3 -Saliyamawatha,18 Jul  2:43 pm,"Anuradhapura, Anuradhapura","100,000","Land Details•	Project name – City point 3/Saliyamawatha•	Town – Anuradhapura•	City – Anuradhapura•	District – Anuradhapura•	Price p.p. – 100,000/= up to 105,000/=",Prime Lands Pvt Ltd - Anuradhapura,Residential,10.0 perches
23,Land for Sale - Eppawala,17 Jul  2:03 pm,"Eppawala, Anuradhapura","155,000","එප්පාවල නගරයෙන් සුපිරිම බිම් කොටසක පදිංචි වීමට අවස්ථාවක්ප්‍රදාන මාර්ගයට මුහුනලා පිහිටි ඉඩමඉඩමේ සිට එප්පාවල  නගරයට (900 meters ) විනාඩි 1 යි. පිරිසිදු ඔප්පු සහිත  පර්චස් 56 ඉඩම කොටස්කර හෝ මුලු ඉඩම ලෙස විකිණීමට පර්චස් 17 , 15 කොටස්  වශයෙන් ලබාගත හැක ","Commercial, Residential",56.0 perches,
24,අනුරාධපුර නගර සීමාවෙන් ඉඩම් කොටසක් විකිණීමට,20 Jul  3:13 pm,"Anuradhapura, Anuradhapura","300,000",* අනුරාධපුර නගර සීමාවේ පිහිටි පිරිසිදු සින්නක්කර ඔප්පු සහිත ඉඩමකි. ,"jaffna junction ,Anuradhapura","Commercial, Residential",20.0 perches
25,Coconut land for sale in Thirappane Anuradhapura,22 Jul  1:33 pm,"Anuradhapura, Anuradhapura","12,000",මුදල් අවශ්‍යතාවක් නිසා අඩු මුදලකට විකිනීමට තිබේ කුබුරු යායක් අසල  ඇති නිස්කලංක තැනකි මුදල සාකච්චා කර ගත හැක සම්පුර්ණ පොල් වගා කොට ඇත අස්වනු ලබන වයසේ ඇත.,Agricultural,320.0 perches,
26,Land for Sale - Mihintale,15 Jul  7:05 am,"Mihintale, Anuradhapura","3,500,000",අනුරාධපුර ත්‍රිකුණාමලය ප්‍රධාන මාර්ගයට කි.මි 1 1/2 දුරින් මිහින්තලය කන්නටිය දර්ශනීය හල්මිල්ල වැවට මායිම් වු සුන්දර පරිසරයක පිහිටි අක්කර 1 1/2 ඉඩම විකිණීමට ජල විදුලිය සම්බන්ධව ලබාගෙන ඇතඔප්පු සහිතයි අනුරාධපුර නගරයට කි.මි. 8මිහින්තලය නගරයට කි මි  4සරුසර බිම් කොටසක්  සංචාරක ව්‍යාපාරය සදහා කදිමයිම්ල ගණන් සාකච්ඡා කරගත හැක Mihinthale land for sale11/2 acres,Kannatiya mihintale,"Agricultural, Commercial, Residential, Other",240.0 perches
27,Prime Rich City Land - Kekirawa,13 Jul 12:51 pm,"Kekirawa, Anuradhapura","65,000",සංවර්ධනය වෙමින් පවතින කැකිරාව – තලාව පාර ප්රධන පාරට මුහුණලා  සින්නක්කර ඔප්පු සහිත නේවාසික හා වය්යාපාරික බිම් කොටස්.,Prime Lands Pvt Ltd - Anuradhapura,"Commercial, Residential",10.0 perches
28,Prime Freedom Square Land for Sale - Alankulama,15 Jul  9:49 am,"Anuradhapura, Anuradhapura","360,000",සංවර්ධනය වෙමින් පවතින අනුරාධපුර – තලාව පාර 2 කණුව හන්දියෙන් සුන්දර වෙල් යායකින් වට වූ සින්නක්කර ඔප්පු සහිත නේවාසික බිම් කොටස්.- නල ජලය- තෙකලා විදුලිය- බැංකු ණය හා පහසු ගෙවීම්- පුජා නගරයට 2 Km- අනුරාධපුර නගරයට 1 Km ,Prime Lands Pvt Ltd - Anuradhapura,Residential,10.0 perches
29,Land in Anuradhapura Nochchiyagama,22 Jul  2:07 pm,"Nochchiyagama, Anuradhapura","3,200,000","#අගනා නිවසක් (කාමර 3 , සාලය , කුස්සිය)#පොල් අක්කරයක් (මාස 1.5  වතාවක් rs 20000 ආදායමක්)# කුබුරු අක්කරයක් ( ගොඩ සහ මඩ ගොවිතැන් සිදුකල හැක)#වගා ලිදක් සහ බීමට ගන්නා වතුර ලින් 2ක්#කොස් ගස් , අබ ගස්, අලිගැටපෙර , කොකෝවා, වෙරලු, දොඩම් , දෙහි , පේර , ඇබරැල්ලා,දෙල් වැනි ගෙඩි කැඩෙන ගස් විශාල ප්‍රමානයක් ඇත.",thammannawa pahalamaragahawewa,Other,2.0 acres
30,Valuable Commercial Land near Talawa Bus Station facing A28,19 Jul  4:04 pm,"Talawa, Anuradhapura","6,900,000",Foundation has been done for a 3 storey building with a basement.  You could build 3/4 small shops in the basement facing the side road goes to Talawa market.Then designed 3 stories from the A28 main road level facing the main road just like other buildings nearby. ,"Talawa Bus Station, Talawa, Anuradhapura",Commercial,6.0 perches
31,Highly Residential Land for Sale in Anuradhapura Town Area,13 Jul  7:33 am,"Anuradhapura, Anuradhapura","350,000","All Mega City Limits in Anuradhapura Are Available Within a Minute. Walking Distance to Kotipoliciya, Kada Panaha, Teaching Hospital.","Athanasara Mawatha, Anuradhapura",Residential,20.0 perches
32,Land for Sale in Anuradhapura,14 Jul 10:15 am,"Anuradhapura, Anuradhapura","23,000",අනුරාධපුරය පුජනීය ස්ථානයකට - භාවනා මධ්‍යස්ථානයකට  රැවන්වැලිමහාසෑයට  කි;මී 4.5  අභයගිරියට කි;මී 2.5 අක්කරයක්  බලපත්‍ර-ලයිට්-වතුර සහිතයි මිල ගණන් සාකච්චාකරගත හැක,"Katukeliyawa , Anuradapuraya","Agricultural, Commercial, Residential, Other",160.0 perches
33,Land for Sale in Anuradhapura,12 Jul 12:45 pm,"Anuradhapura, Anuradhapura","55,000",අනුරාධපුර ශ්‍රාවස්තිපුර තුරුලිය සෙවණ් මාර්ගයේ පර්චස් 80 ඉඩමක් විකිණීමට රන්බිම ඔප්පු ජල විදුලිය සහිතයි අනුරාධපුර කුරුණෑගල පාරට (57) මිටර් 50Anuradhapura shrawasthipura lannd for sale80 perches,thiruliya sewana road shrawasthipura anuradhapura,"Agricultural, Commercial, Residential, Other",80.0 perches
34,Freehold Title Bare Land With A House For Sale In Anuradhapura,12 Jul  3:03 am,"Anuradhapura, Anuradhapura","26,600,000","Freehold Title Old House with a Bare Land for Sale in 2nd Stage, Anuradhapura","Freeman Road, 2nd Stage","Commercial, Residential, Other",31.35 perches
35,45 Acres Land For Sale Maradankadawala,12 Jul  2:20 am,"Habarana, Anuradhapura","1,200,000",45 Acres Land for Sale Maradankadawala,Maradankadawala,"Agricultural, Commercial",45.0 acres
36,Land for sale in Anuradhapura,11 Jul 10:00 pm,"Anuradhapura, Anuradhapura","100,000",#mihinthalaya rajarata wishwa widyaayata nudurin pihita atha,Residential,20.0 perches,
37,Land for sale in Anuradhapuraya,11 Jul  3:05 pm,"Anuradhapura, Anuradhapura","149,500",අනුරාධපුර - පුත්තලම ප්‍රධාන මාර්ගයේ මහබුලන්කුලම පාසල ආසන්නයේ ප්‍රධාන මාර්ගයේ සිට දෙවෙනි බිම්කොටස විකිණීමට තිබේ.,"Anuradhapura - puttalam Rd , Mahabunkulama",Residential,11.0 perches
38,A9 Road Front Land Sale in Medawachchiya,17 Jul  1:17 pm,"Medawachchiya, Anuradhapura","35,500,000","**යාපනය- මහනුවර  A9  මාර්ගයට මුහුණලා  මැදවච්චිය නාම පුවරුව අසල මෙම ඉඩම පිහිටා ඇත.මාර්ගයට ආසන්නයේ කඩකාමර 04 කින් යුත් වෙළදසැලක් පිහිටා තිබෙන අතර එහි ඉදිරිපස කඩකාමර 02 ට කොන්ක්‍රීට් ස්ලැබ් දමා ඇත.*වෙළදසැලට පිටුපසින් අඩක් නිම කල,-කාමර 05 කින්,-විශාල සාලයකින්,-කෑම කාමරයකින්,-නාන කාමරයකින්යුත් නිවසක් පිහිටා ඇත.*මෙම ඉඩමෙහි වගා කර ඇති බෝග වර්ග: -පොල් ගස් 100 කට වැඩි ප්‍රමාණයක්(තැඹිලි, රන් තැඹිලි)-පුවක්-කුරුදු-කොස්, දෙල් -මහෝගනී-තේක්ක-කිතුල්-ගම්මිරිස්-අඹ, කෙසෙල් , ජම්බු ඇතුළු සියළුම වර්ගයේ පළතුරු ගස් හා බෙහෙත් නෙල්ලි , කටුඅනෝදා වැනි ඖෂධීය ශාක වර්ග ද මෙම ඉඩමෙහි වගා කර ඇත.*මෙම ඉඩමෙහි රජයේ ලියාපදිංචි කළ පැළ තවානක් පවත්වාගෙන යන අතර එහි විශාල හා සාමාන්‍යය ප්‍රමාණයේ විසිතුරු මල් පැළ වර්ග සිටුවා ඇත.*මෙම ඉඩමෙහි මැද්දට වන්න වගා ලිදක් පිහිටා තිබෙන අතර ඉඩමෙහි කෙළවරට වන්න වගා කල හැකි අක්කර කාලක පමණ බිම් කොටසක් ඇත.*මැදවච්චිය නගරයට, දිස්ත්‍රික් මහරෝහලට, සියළුම සුපිරි වෙළදසැල්වලට, දිවා සුරකුම් මධ්‍යස්ථානයට  1.75 KM*මෛත්‍රීපාල සේනානායක ජාතික පාසලට  2.20 KM*දුම්රිය  ස්ථානයට 3 KM*ඉන්ධන පිරවුම්හලට 0.5 KM*අනුරාධපුර නගරයට 30 KM*වව්නියාව නගරයට 21 KM  *මිළගණන් සාකච්ඡා කරගත හැක....No Brokers ......Genuine Buyers Only ...",Jaffna Road Medawachchiya,"Agricultural, Commercial, Residential",1.0 acres
39,Land Sale in Anuradhapura Town,13 Jul  3:05 pm,"Anuradhapura, Anuradhapura","360,000","1.5 km to Anuradhapura New Town, 5 minute drive Near Mango Mango, best residential area with calm environment. 50 m to main road, Water/ ElectricityClear Document (Sinnakkara)Low best price in Municipal area, selling due to money urgency","Jayanthi Mawatha, Anuradhapura","Commercial, Residential, Other",15.5 perches
40,Land for Sale Anuradhapura,11 Jul 10:46 am,"Anuradhapura, Anuradhapura","40,000","NEARLY 800M DISTANE FROM MAIN ROAD.ELECTRICITY AND WATER IS ACCECIBLE..DEAD- JAYABUMIRS.1,600,000.00Address -METH HIMI MAWATHAKALATHTHEWAඅනුරාධපුර",Residential,40.0 perches,
41,Great Land for Sale in Maradankadawala - Anuradhapura (Faced to A9 road), 7 Jul  8:02 am,"Kekirawa, Anuradhapura","9,500,000","යාපනය නුවර ප්‍රධාන මාර්ගයට යාබදව , අක්කර 1 ක ඉඩමකි.වටිනා පොල්පැල කිහිපයක් හා වගා ලිදකින් සමන්විත වන අතර අනුරාදපුර හා දබුල්ල නගර වෙත විනාඩි 40කට අඩු කාලයකින් ලගාවිය හැක.","Agricultural, Commercial",1.0 acres,
42,අනුරාධපුර රඹෑව ප්‍රධාන මාර්ගයට මායිම් වූ අගනා ඉඩමකි., 8 Jul  8:32 am,"Anuradhapura, Anuradhapura","700,000","අනුරාධපුර  රඹෑව ප්‍රධාන මාර්ගයට(A-20) මායිම්ව,  සදමල්ගම පිහිටි, පර්වස් 27ක, පොල් පැළ කිහිපයක්ද සහිත වටිනා, පදින්චියට අගනා ඉඩම විකිණීමට, ප්‍රධාන මාර්ගයේ සිට 100m, අනුරාධපුර නගරයට විනාඩි 15යි.","සමෘද්ධි මාවත, සදමල්ගම, අනුරාධපුර.",Other,27.0 perches
43,Land for Sale in Anuradhapura - Nellikulama, 6 Jul 12:30 pm,"Anuradhapura, Anuradhapura","88,500",~~~ අනුරපුර නගරයට සමීපවම පදිංචියට ~~~,Nellikulama,Residential,10.0 perches
44,Land for Sale - Anuradhapura, 5 Jul 11:17 am,"Anuradhapura, Anuradhapura","85,000","Land Details•	Project name – Golden Gate - Ulukkulama•	Town – Anuradhapura•	City – Anuradhapura•	District – Anuradhapura•	Price p.p. – 85,000/= to 225,000/= Facilities•	Electricity –Three phase•	Water – Wall Water•	Road –15’ wide road",Prime Lands Pvt Ltd - Anuradhapura,"Commercial, Residential",12.0 perches
