,0,1,2,3,4,5,6,7
45,ඉඩමක් විකිනිමට අනුරාධපුර, 4 Jul  9:19 am,"Anuradhapura, Anuradhapura","360,000","ඉසුරු භුමි ඔප්පු සහිත නිරවුල් ඉඩමකිමහ ෙරා්හලට 1.5 km (genaral hospitle)නගරයට 2.kmජලය, විදුලිය, දුරකථන පහසුකම් සහිතයි.හතරැස් ඉඩමකි.","581/22 A , තම්මැන්නා කුලම, අනුරාධපුර",Residential,12.0 perches
46,ඉපලෝගම සාරවත් වගාවන් සහිත ඉඩමක් විකිණීමට, 2 Jul 12:08 pm,"Kekirawa, Anuradhapura","25,000",# අවුරුදු 4ක් වයසැති සාරවත් පොල් වගාවක්.,ඉපලෝගම,Agricultural,480.0 perches
47,Land for Sale Anuradhapura, 2 Jul  9:10 am,"Anuradhapura, Anuradhapura","650,000",අනුරාධපුර කුරුන්දන්කුලම පිහිටි අගනා පර්චස් 20 බිම්කොටසක් විකිණීමට මිහින්තලය රජරට විශ්වවිද්‍යාලයට විනාඩි 10 දුරනල ජලය සහ විදුලිය සහිත පදිංචියට සුදුසු නිස්කලංක පරිසරය අනුරාධපුර නගරයට විනාඩි 15 ලගාවිය හැකලක්ශ 6/50,"Agricultural, Commercial, Residential",20.0 perches,
48,සින්නක්කර ඔප්පු සහිත ඉඩම - අනුරාධපුර,30 Jun  9:48 am,"Anuradhapura, Anuradhapura","75,000","සින්නක්කර ඔප්පු,250 පර්චස්,අනුරාධපුර නුවර ප්‍රධාන මාර්ගයට මුහුනලා,පොල් ගස් 10 යි,ඉඩමේ වම්පස සීමාව ඇළ මාර්ගය,ඉඩමේ දකුණු පසු සීමාව වෙල්යාය,ඉඩමේ පිටුපස සීමාව වෙල්යාය,පිට මේ ඉදිරිපස සීමාව අනුරාධපුර නුවර ප්‍රධාන මාර්ගය ,කොටස් කර හෝ මුළු ඉඩමම ඉඩම විකිණීමට ඇත.","Kandy road,kalaththewa ,kurundamkulama,Anuradhapura",Commercial,250.0 perches
49,අනුරාධපුර නගරයට නුදුරින් ඉඩමක්,29 Jun  8:28 pm,"Anuradhapura, Anuradhapura","200,000","- අනුරාධපුර නගරයට නුදුරින් සාලිය මාවතේ සින්නකර නිරවුල් ඔප්පු සහිත ඉඩම- නගරයට 5km- නල ජලය, විදුලිය , දුරකතන පහසුකම් සහිතයි",Residential,20.0 perches,
50,Lands for Hotel Anuradhapura,28 Jun  9:03 pm,"Anuradhapura, Anuradhapura","10,000,000","Marandankadawala town ekata asannynen,wewakata sima wee atha.hotel sedimata wiseshai.,2- galkulama asanyen pol akkara 5iJayawikkrama oppu sahithai,, 3-galnewa nagarayen  akkra 5 ka sahitha idamakda ethWedi wisthra sadha amathanna,,",maradankadawala,Commercial,3.0 acres
51,Land for Sale in Galnewa,18 Jul  9:06 pm,"Galnewa, Anuradhapura","4,000,000","ඓතිහාසික අව්කන රජ මහ විහාරයට නුදුරින් ප්‍රදාන මාර්ගයට ආසන්නයේ පිහිටා ඇත.විදුලිය සහා නල ජලය ලබා ගෙන ඇත.නිවසේ විසිත්ත කාමරය,මුලුතැන්ගෙය,කෑම කාමරය,වැසිකිලි නාන කාමර(අඩක්) සහා නිදන කාමරයක් සදා නිම කොට ඇත.ඉදිරියට  සෑදීමට අත්තිවාරම සකසා ඇත.ඉඩම අක්කර බාගයකට ආසන්නව ඇත.බලපත්‍ර සහිත මහවැලි ඉඩමකි.මුදල පිළිබඳ ව කතා කර ගත හැක.","සිරිමාගම පාර,අව්කන",Other,0.5 acres
52,Land in Anuradhapura Town,27 Jun  9:16 pm,"Anuradhapura, Anuradhapura","250,000",30 Perch Land for sale full land or block5 Minutes ( 2 km ) to Anuradhapura HospitalWater & electricityBest Residential AreaPrice can negotiable,Residential,30.0 perches,
53,ඉඩම සමග නිවසක් විකිණීම අනුරාධපුර,27 Jun  4:15 pm,"Anuradhapura, Anuradhapura","4,500,000","*ස්වර්ණ භුමි නිරවුල් ඔප්පු *ජල විදුලිය සමග අංග සමිපුුර්ණ නිවස*ළිද*අක්කරයක පොල් ඵලදාව සහිත *රෝහල,පොලිස් ස්ථානය,දුම්රිය ස්ථානය අතේ දුරින් පිහිටා ඇත","රෝහල පාර, පරසන්ගස්වැව, අනුරාධපුර",Residential,1.0 acres
54,අනුරාධපුර අගනා ඉඩමෙන් බිම් කොටසක් විකිණීමට,10 Jul  9:05 am,"Anuradhapura, Anuradhapura","75,000","අනුරාධපුර - රඹෑව ප්‍රධාන මාර්ගයට 1KM.වෛද්‍ය  පීඨයට 1km.කෘෂිකර්ම පීඨයට 1.5Km.අනුරාධපුර නගරයේ සිට  5km.නිදහස් පරිසරයක පදිංචියට සුදුසුයි. මාර්ගය ආසන්නයේ කඩකාමරයක්ද සමගජල, විදුලි පහසුකම් ඇත.නිරවුල් ඔප්පු සහිතයි.පර්. 15පර්. 20ප්ර්. 30",Saliyapura,Other,30.0 perches
55,Highly Residential Land for Sale in Anuradha,27 Jun  2:22 am,"Anuradhapura, Anuradhapura","7,500,000","highly residential land for sale behind filling station situated in front of koti police. 2mns to kada panaha, teaching hospital and other city limits.","rathanasara mawatha, near nuwan kade (in front of kotipoliciya), anuradhapura",Residential,20.0 perches
56,Land in Anuradhapura Nochchiyagama,22 Jul  2:07 pm,"Nochchiyagama, Anuradhapura","3,200,000","#අගනා නිවසක් (කාමර 3 , සාලය , කුස්සිය)#පොල් අක්කරයක් (මාස 1.5  වතාවක් rs 20000 ආදායමක්)# කුබුරු අක්කරයක් ( ගොඩ සහ මඩ ගොවිතැන් සිදුකල හැක)#වගා ලිදක් සහ බීමට ගන්නා වතුර ලින් 2ක්#කොස් ගස් , අබ ගස්, අලිගැටපෙර , කොකෝවා, වෙරලු, දොඩම් , දෙහි , පේර , ඇබරැල්ලා,දෙල් වැනි ගෙඩි කැඩෙන ගස් විශාල ප්‍රමානයක් ඇත.",thammannawa pahalamaragahawewa,Other,2.0 acres
57,Valuable Commercial Land near Talawa Bus Station facing A28,19 Jul  4:04 pm,"Talawa, Anuradhapura","6,900,000",Foundation has been done for a 3 storey building with a basement.  You could build 3/4 small shops in the basement facing the side road goes to Talawa market.Then designed 3 stories from the A28 main road level facing the main road just like other buildings nearby. ,"Talawa Bus Station, Talawa, Anuradhapura",Commercial,6.0 perches
58,Land with Commercial Building for Sale - Anuradhapura, 5 Jul  6:57 pm,"Anuradhapura, Anuradhapura","1,650,000",Land in Commercial area Water & Electricitydeed - SinnakkaraVery suitable for commercial Building as Supper Market20' x 108' sqft 8 perch can arrange,"3124, Stage III, Dahaiyagama Junction, Anuradhapura","Commercial, Residential",13.33 perches
59,Land for sale in Anuradhapura,25 Jun  1:39 pm,"Anuradhapura, Anuradhapura","75,000",Land for sale in Anuradhapura,Anuradhapura,"Commercial, Residential",60.0 perches
60,Land for Sale in Anuradapura,25 Jun  1:21 pm,"Anuradhapura, Anuradhapura","120,000","අනුරාධපුරය,ත්‍රිකුණාමලය (A12) මාර්ගයට මුහුනලා කුරුන්දම් කුලම අගනා පර්චස් 40. Lot 1 අනුරාධපුර නගරයට විනාඩි 10න් මිහින්තලය ටවුමට විණාඩි 10 න්. රජයේ සියළුම කන්තෝරු/ රජයේ රෝහල් පෞද්ගලික ⁣ රෝහල් / පූජා නගරයට සියළුම ස්ථාන වලට විනාඩි 10 න් පමන ලගාවීමට හැකි වීම. ඉඩම පිටුපස සිරුක්කුලම වැව. ඉතා අලංකාර පරිසරය. ජලය විදුලිය දුරකථන සහ අනෙකුත් සියළුම පහසුකම් ලබාගතහැකි වීම. නිවසකට හෝ හෝටලයකට විෂේශයි. ⁣පොල් ගස් 14 ඇත. මුදල් අවශ්‍යතාවක් නිසා ඉක්මනට විකිනීමට අවශ්‍යව ඇත. පර්චස් 1ක් ලක්ෂ 1.20 .  වැඩි විස්තර සදහා දුරකථනයෙන් හෝ පැමිණ සාකච්චා කරගතහැකිය.","kurundan Kulama,anuradapura","Commercial, Residential",40.0 perches
61,Land for sale in Nochchiyagama,23 Jun  5:57 pm,"Nochchiyagama, Anuradhapura","110,000","පුත්තලම -අනුරාධපුර ප්‍රධාන මාර්ගයට මුහුණලා නොච්චියාගම නගරයට ආසන්නව පර්. 160ක ඉඩමක් විකිණීමට ඇත. පර් 01 එක්ලක්ෂ දස දහසයි. (රු. 110,000/-) ප්‍රධාන මාර්ගයට අමතරව පිවිසුම් මාර්ග 02ක් ඇත. සියලු පහසුකම් සහිතව. තේක්ක, කොහොඹ හා පලතුරු වගාවකින් යුක්තයි. විල්පත්තු අභයභූමියට විනාඩි 15. අනුරාධපුර නගරයට විනාඩි 25. අමතන්න",Nochchiyagama,Agricultural,160.0 perches
62,Court Side Land with Commercial Property for Sale in - Thambuttegama,11 Jul  4:37 pm,"Tambuttegama, Anuradhapura","7,000,000","Opposit Magestric court thambuttegama, two storied buliding,fully claddin,can be rent two purpose, ground follor good for lawyers or something else",Anuradhapura - Kurunegala road,Commercial,10.0 perches
63,Land for Sale in Anuradhapura,24 Jun 12:20 pm,"Anuradhapura, Anuradhapura","1,000,000",* අනුරාධපුර තිසා වැව නෙල්ලිකුලම මාර්ගයේ පිළිම පන්සිය විහාරයට ආසන්නව ප්‍රධාන අතුරු මාර්ගයේ 1 1/2 km  දුරින් පිහිටි අක්කර 10 මෙම ඉඩම විකිනීමට ඇත.    * ත්‍රී පේස් කරන්ට් ලයින් එන ප්‍රධාන මාර්ගය .* නිවසක්ද ඇත. * ව්‍යාපාරයට හා වගාවට සුදුසු ඉඩමක් ට්‍රාන්ස්පොමරය ඉඩමේ මායිමේ පිහිටා ඇත . * පුජා නගරයට 4km  දුරින්.,Anuradhapura Mirichchiyamkulama,Commercial,10.0 perches
64,Land for Sale - Weluwanagama,22 Jun 11:08 am,"Anuradhapura, Anuradhapura","40,000",Air Force camp eke sita K. M. 3 k durin,weluwanagama,"Agricultural, Residential",80.0 perches
65,ඉතා වටිනා ඉඩමක් කඩිනමින් විකිණීමට - අනුරාධපුර,22 Jun 10:56 am,"Anuradhapura, Anuradhapura","100,000",නල ජලයවිදුලියරැහැන් දුරකතන මාර්ගයපුළුල් මාර්ගතිසාවැවට 0.5kmpooja නගරයට 2.5 km නුරාධපුර නව නගරයට 3.5 km,Pandulagama Anuradhapura,"Commercial, Residential, Other",42.0 perches
66,Land Sale Galnawa,21 Jun 12:30 pm,"Galnewa, Anuradhapura","12,500,000",Land Sale Galnawa,galnawa,Agricultural,3.0 acres
67,Land for Sale Anuradhapura,20 Jun  2:09 pm,"Anuradhapura, Anuradhapura","160,000","Deed- Sinnakkara, Calm and Queit Residential Place, Asphalt paved access road, 200 m from Airport Road, Water & Electricity","Abayapura housing scheme, Anuradhapura",Residential,40.0 perches
68,Prime North Lake - Thisa wewa,20 Jun  9:21 am,"Anuradhapura, Anuradhapura","345,000","Land Details•	Project name – Prime North Lake - Thisawewa •	Town – Anuradhapura•	City – Anuradhapura•	District – Anuradhapura•	Total blocks – 147•	Price P.P – 345,000/= - 2 Blocks available ",Prime Lands Pvt Ltd - Anuradhapura,Residential,10.0 perches
69,"Prime City Point 3 - Saliyamawatha, Anuradhapura",20 Jun  9:10 am,"Anuradhapura, Anuradhapura","100,000","Land Details•	Project name – City point 3/Saliyamawatha•	Town – Anuradhapura•	City – Anuradhapura•	District – Anuradhapura•	Price p.p. – 100,000/= up to 105,000/=",Prime Lands Pvt Ltd - Anuradhapura,Residential,10.0 perches
70,Land for Sale in Anuradhapura Mihintale,30 Jun  9:41 am,"Mihintale, Anuradhapura","4,000,000",Land for Sale in Anuradhapura Mihintale========================,"Mihintale, Anuradhapura","Commercial, Residential",2.0 acres
71,Land with a House for Sale in Anuradhapura, 2 Jul  2:24 pm,"Anuradhapura, Anuradhapura","18,500,000","Located at stage 2 Anuradhapura .Residential and commercial property.Clear deeds.Can easily access to new town within 5 minutes .Decent environment ,square block land.Easily access to banks,popular schools,popular restaurants(pizza hut,p&s,family bakers etc.).3 minutes to Anuradhapura hospital.House with 4 rooms.Large living area.Large kitchen with dining room.Land size 24 perches.Rs 715,000  per perch.Total price Rs 18500000","Commercial, Residential",24.0 perches,
72,Land for Sale in Anuradhapura,20 Jun  6:23 pm,"Anuradhapura, Anuradhapura","6,000,000",Near the damro showroom,"No.488/7,Maithreepala Senanayake Mawatha, Anuradhapura",Commercial,11.75 perches
73,Land for Sale in Shrawasthipura,23 Jul 12:42 pm,"Anuradhapura, Anuradhapura","110,000","This plot of land is in a quit area facing to paddy field, located around 1 Km away from Shrawasthipura ( 57 bus route) junction.","Siri Uyana, Nachchaduwa road, Shrawasthipura",Residential,17.0 perches
74,Land for sale near to Nuwara wewa in Anuradhapura,15 Jun  2:46 pm,"Anuradhapura, Anuradhapura","7,500,000",1.5 acres Land near to nuwara wewa in Anuradhapura with Coconut and teak trees.7km from Anuradhapura Town.Most Suitable to Develop a Hotel.,"Meth himi Mawatha , Anuradhapura","Agricultural, Commercial, Residential, Other",1.5 acres
75,Prime Royal Terrace - Puliyankulam,15 Jun  9:44 am,"Anuradhapura, Anuradhapura","285,000","Land Details•	Project name – Royal Terrace•	Town – Anuradhapura•	City – Anuradhapura•	District – Anuradhapura•	Price P.P – 285,000/= to 610,000/=Facilities•	Electricity –Three phase•	Water – Water board line •	Tar Road – 20’ to 30’ wide Tar road",Prime Lands Pvt Ltd - Anuradhapura,"Commercial, Residential",10.0 perches
76,Land for sale in Kekirawa,14 Jun  7:41 pm,"Kekirawa, Anuradhapura","2,000,000",කැකිරාව නගරාසන්නයේ කුඹුකෙ සිසිල අසල අක්කර දෙක මහාරක (2.5) කුඹුරක් විකිණීමට. මහවැලි බලපත්‍ර සහිතයි.,"දඹුල්ල පාර, මහා කැකිරාව, කැකිරාව.",Agricultural,2.5 acres
77,Land for Sale in Anuradhapura,23 Jul 10:05 am,"Anuradhapura, Anuradhapura","125,000",A valuable Land extent of 183 perches from  Tholuwila watta in Anuradhapura city limits just a few meters from Nuwarawewa. Only 450 meters from Mihintale Road and 670 meter distance to Jaffna junction. 10 minutes drive to Anuradhapura main sacred places from the property.,Tholuwila watta,"Agricultural, Commercial, Residential",183.0 perches
78,Land for Sale Anuradhapura Sinnakkara Deed,15 Jun  6:41 pm,"Anuradhapura, Anuradhapura","2,200,000","anuradhapura guwanthotupala pare purches 15ka sinnakkara oppu sahitha agana idamak wikineemata. maha rohalata 5km. nala jalaya, widuliya sahitha. piwisum margaya carpet.",Residential,15.0 perches,
79,Land For Sale - 4 Acres Bulnewa,11 Jun 12:09 pm,"Galnewa, Anuradhapura","8,000,000","බුල්නෑව කාපට් පාරට මුහුනල අක්කර 4ක අනගි දේපලක් විකිණීමට, ",Other,4.0 acres,
80,Land for Sale in Anuradhapura,10 Jun 10:40 pm,"Anuradhapura, Anuradhapura","160,000",අනුරාධපුර ගුවන් හමුදා කදවුර අසල භාතිය මාවතේ පිහිටි පර්චස් 20 ක ඉඩම( මුළු ඉඩමම හෝ  පර්චස් 10ක කොටසක් ) විකිනීමට ඇත.,"Bhathiya Mawatha, Wanniyankulama, Anuradhapura",Residential,20.0 perches
81,Land with House In Thambuththegama, 9 Jun  3:45 pm,"Tambuttegama, Anuradhapura","65,000","නිරවුල් අයිතියකින් යුතු තඹුත්තේගම නගරයට 1km ක් දුරින් සියළු පහසුකම් සහිත ලුණු වැවට මායීම්ව Bath room 02 & outdoor -01 washroom Fully Tiledවර්ග අඩි 2000  කට වැඩි පොල් කොස් අඹ සහ වටිනා ගෙවත්තකින් යුතු නවීන නිවස පර්චස් 150 සංචාරක ව්‍යාපාරයකට, හෝටල් කර්මාන්තයට සුදුසු වේ මිලියන 9.5 ක මිලකට විකිනීමට පවතී.අනුරාධපුර පුජා නගරයට විනාඩි 20 යි ",Thambuththegama,"Agricultural, Commercial, Residential, Other",150.0 perches
82,Land for Sale - Anuradhapura, 8 Jun 12:51 pm,"Anuradhapura, Anuradhapura","2,500,000",A land surrounded with beauty full paddy fields and suitable for a family to build your dream home in a calm and quite area.3.5 Km to Anuradhapura new town20 purchase land with Sinnakkara Deeds Also suitable for a field view Guest house ( A Cabana ) Naga Vihara Dagaba can seen from the land,"Shrawasthipura, anuradhapura",Residential,20.0 perches
83,අනුරාධපුර නගර සීමාවෙන් ඉඩම් කොටසක් විකිණීමට,20 Jul  3:13 pm,"Anuradhapura, Anuradhapura","300,000",* අනුරාධපුර නගර සීමාවේ පිහිටි පිරිසිදු සින්නක්කර ඔප්පු සහිත ඉඩමකි. ,"jaffna junction ,Anuradhapura","Commercial, Residential",20.0 perches
84,Valuable Commercial Land near Talawa Bus Station facing A28,19 Jul  4:04 pm,"Talawa, Anuradhapura","6,900,000",Foundation has been done for a 3 storey building with a basement.  You could build 3/4 small shops in the basement facing the side road goes to Talawa market.Then designed 3 stories from the A28 main road level facing the main road just like other buildings nearby. ,"Talawa Bus Station, Talawa, Anuradhapura",Commercial,6.0 perches
85,පූජා නගරයෙන් වටිනා ඉඩමක්- අනුරාධපුර, 7 Jun  4:33 pm,"Anuradhapura, Anuradhapura","85,000",පූජා නගරයෙන් වටිනා ඉඩමක්(ගල් පාලම) පර්චස් 110 විකිණීමට ඇත කොටස් වශයෙන් හෝ විකුණනු ලැබේ සිනක්කර නිරවුල් ඔප්පු..මිළ ගනන් වෙනස් කර ගත හැක,"ගල් පාලම,අනුරාධපුර","Commercial, Residential",110.0 perches
86,Land for Sale in Thisa Wewa,10 Jun 11:53 am,"Anuradhapura, Anuradhapura","345,000","Land Details•	Project name – Prime North Lake - Thisawewa •	Town – Anuradhapura•	City – Anuradhapura•	District – Anuradhapura•	Total blocks – 147•	Price P.P – 345,000/= - 2 Blocks available ",Prime Lands Pvt Ltd - Anuradhapura,"Agricultural, Commercial, Residential",10.0 perches
87,වටිනා ඉඩමක් විකිනීමට ඇත - අනුරාධපුර,27 Jun  6:24 pm,"Anuradhapura, Anuradhapura","60,000",ජයභූමි ඔප්පු සහිත ඉතා වටිනා ඉඩමක් අනුරාධපුර නුවර පාර ශී දර්මාලන්කාර පුරාන විහාරය ආසන්නයේ තම්මැන්නාපුර පාසලට නොදුරින් විකිනීමට ඇත.පිරිසිදු ඔප්පු සහිතයි.සියලු පහසුකම් සහ ජල විදුලිය සහිතයි.                  අමතන්න,"තම්මැන්නාපුර,නුවර පාර,අනුරාධපුර",Residential,40.0 perches
88,Land for Sale Anuradhapura Town Ekata Lagin, 6 Jun  7:19 pm,"Anuradhapura, Anuradhapura","1,500,000",perches 15k idamaanuradhapura town ekata ithama asannaitown ekta kilometer 3k durak tynne,"No.09,Chulani mawatha,vijayapura,anuradhapura",Residential,15.0 perches
89,Best Land for Sale Anuradhapura, 5 Jun  3:53 pm,"Anuradhapura, Anuradhapura","2,500,000",Land is situated in anuradhapura hidogama.Having coconut trees more than 600 and small house .8km to the town and 12 feet road to entrance. To Buyers can offer  prices for whole 10 acres or 5 acres each .1 acres rs.2.5 million .contact no : .(original deeds ),"Anuradhapura,hidogama.(postal code-50000 )",Agricultural,10.0 acres
90,Land for Sale - Anuradapura, 5 Jun  2:49 pm,"Anuradhapura, Anuradhapura","275,000","Near the nuwara tank , the anuradhapura sacred city is close to 2km , a suitable land for marking a dining hall , a house with all facilities is located in the land","J.A.JAYANTHI KUMARI , MATHALE RD , KURUNDANKULAMA , ANURADAPURA",Commercial,47.5 perches
91,Land for Sale - Anuradhapura, 5 Jun  9:43 am,"Anuradhapura, Anuradhapura","95,000",ජයශ්‍රී මහා බෝධියට කිලෝමීටර් 3 යි ප්‍රධාන පාරට මුහුණලා ජල විදුලිය සහිත  පිරිසිදු ඔප්පු,"Watawandanada Road, Old Town, Anuradhapura",Residential,80.0 perches
92,Land For Sale in Anuradhapura, 4 Jun  2:24 pm,"Anuradhapura, Anuradhapura","40,000,000","The 157 purches (very close to 1 acre) Land Situated in New Puttlam Road, Pothanegama, Anuradhapura. Included Jayaboomi Clear dead, Three phase Electricity, Telecom wired line telephone, Water board tap line and also well water.			Only 30m-40m to Main Road (Colombo-Puttlam Road), Only 2.8 Km to Anuradhapura Town, Only 1.4Km to Sacred place, Only 1 Km to Colombo-Kurunegala Main Road (2 Mile Post), Only 600m to ATI-Campus Anuradhapura.","Wijayamawatha , New Puttalam Road , Pothanegama , Anuradhapura","Agricultural, Residential",157.0 perches
93,Land for Sale in Anuradhapura, 3 Jun  1:28 pm,"Anuradhapura, Anuradhapura","125,000","Anuradhapura nagasena mawathata asannawa pihiti itha agana parches 59 ka oppu sahitha saha guwanthotupola, maha rohala pradana karpart parata 70 m ka durin adi 12 ka maraga pahasukam sahitha agana idama vikineemata.","Ngasena Mawatha, Anuradhapura",Residential,59.0 perches
94,Land and House for Sale in Anuradhapura, 3 Jun  1:12 pm,"Anuradhapura, Anuradhapura","1,100,000",Land with house for sale at anuradhapura stage 1388/29 Harishchanraha mawatha anuradhapura ,388/29  harischarndra mawatha anuradhapura,"Commercial, Residential, Other",34.1 perches
95,Prime North Star - Jaffna junction, 3 Jun 11:25 am,"Anuradhapura, Anuradhapura","325,000",අනුරාධපුර යාපනය හන්දියෙන් ප්රධන පාරට මුහුණලා සුන්දර වෙල් යායකින් වට වූ සින්නක්කර ඔප්පු සහිත නේවාසික හා වය්යාපාරික බිම් කොටස්.- නල ජලය- තෙකලා විදුලිය- තාර යෙදූ පුලුල් මාර්ග- බැංකු ණය හා පහසු ගෙවීමේ ක්රම- පුජා නගරයට මීටර් 800- අනුරාධපුර නගරය මීටර් 600,Prime Lands Pvt Ltd - Anuradhapura,"Commercial, Residential",10.0 perches
96,Prime Nature park - Paladikulama, 6 Jun  4:44 pm,"Anuradhapura, Anuradhapura","65,000","Land Details•	Project name – Prime Nature Park/Paladikulama•	Town – Anuradhapura•	City – Anuradhapura•	District – Anuradhapura•	Price P.P – 65,000/=Facilities•	Electricity –Three phase•	Water – Water board line •	Road – 20’ to 30’ wide road",Prime Lands Pvt Ltd - Anuradhapura,Residential,10.0 perches
97,Land for Sale - Saliyamawatha, 6 Jun  4:45 pm,"Anuradhapura, Anuradhapura","100,000","Land Details•	Project name – City point 3/Saliyamawatha•	Town – Anuradhapura•	City – Anuradhapura•	District – Anuradhapura•	Price p.p. – 100,000/= up to 105,000/=",Prime Lands Pvt Ltd - Anuradhapura,Residential,10.0 perches
