,0,1,2,3,4,5,6,7,8,9
56,"Single Storied 3BR House for Sale in Pitipana, Homagama", 9 Jul  5:11 pm,"Homagama, Colombo","6,500,000","Single Storied 3BR House for Urgent Sale in Pitipana, HomagamaSelling Price: Rs.65 Lakhs Call for More Details: 10 Perches3 Bedrooms1500 Sq.Ft.Property Fully Secured with Boundary WallPeaceful EnvironmentClear DeedMortgage to People Bank, HomagamaSpace Available for Car ParkingPublic Banks are Located Nearby800m to High-Level Road800m to Panagoda Army School800m Pitipana Cargills Food City1km to the Panagoda Army Cantonment2km from Homagama Town2km to Mahinda Rajapaksa National School2km to Homagama Central College & President College, Homagama2km to Subharathee Vidyalaya, Godagama2km to the Homagama Railway Station2.5km to the Homagama Base HospitalApproximately 4km NSBM Green UniversityFacing to D A Sudasinghe Mawatha, Mawathgama Road, Pitipana, HomagamaCurrently, This Area Land Price is Rs.15 Lakhs Per PerchTherefore, This Land is Ideal as a Future Investment to Your ChildrenVery Urgent SaleNo Brokers","D A Sudasinghe Mawatha, Mawathgama Road, Pitipana",3,1,"1,500.0 sqft",10.0 perches
57,House For sale Godagama Homagama,30 Jun  2:21 pm,"Homagama, Colombo","9,500,000",✅ සියලුම පහසුකම් වලින් සම්පුර්ණ නිවස,"95/45/02 Godagamahe waththa,godagama, homagama",3,2,"1,800.0 sqft",10.0 perches
58,House for Sale - Pitipana,10 Jul  4:14 pm,"Homagama, Colombo","8,400,000","129,190,125, බස් මාර්ග වලට කිලෝමීටර් දෙකයි, මනරම් පරිසරය",පිටිපන මීගොඩ පාර,3,3,"1,300.0 sqft",11.0 perches
59,House for Sale Homagama,10 Jul  6:44 pm,"Homagama, Colombo","4,800,000","Face to main Road and edge to paddy fieldNear the high way entrance Near the Homagama Town,Near the Mahinda Rajapaksha College,Near the railway stationunder contruction","temple junction, pitipana road, Homagama",3,1,800.0 sqft,10.0 perches
60,A House for Sale in Homagama,10 Jul  3:45 pm,"Homagama, Colombo","6,300,000",Fully Tiled 3 bedroom house1 attached bathroom1 maids room & 1 wash roomGarage facility available to park 2 vehiclesFully surrounded parapet wall with sliding gateElectricity & WaterTelephone & Internet Facilities,"Sri Rewatha Mawatha, Pitipana, Homagama",3,2,"2,995.0 sqft",11.0 perches
61,House for Sale in - Homagama, 9 Jul  7:27 pm,"Homagama, Colombo","11,500,000",Two Storied House in Kiriwattuduwa Near to Mahinda Rajapaksha Ground 2km to Highway Entrance Genuin Buyers Only,4,2,"1,900.0 sqft",15.0 perches,
62,House for Sale in - Homagama, 9 Jul  6:33 pm,"Homagama, Colombo","16,000,000","House for SaleThe property located in a highly residential area, calm and quite with extremely upright neighborhoods. only 1.5km, away from Homagama town and 5 minutes driving distance to the MahInda Rajapaksha ground and university.  It also walking distance to Homagama national School, temples, Mahinda Rajapaksha ground and university.  ",5 minutes driving distance to the MahInda Rajapaksha ground and university.,4,3,"4,000.0 sqft",11.0 perches
63,Luxury House for Sale in Homagama, 9 Jul  3:13 pm,"Homagama, Colombo","11,000,000",COLOMBO DISTANSE 15KMNSB CAMPUS 1KMPALI CAMPUS 500MPANAGODA MILITARY HEAD QURT. 1KMBASE HOSPITAL HOMAGAMA 1 1/2KM,"pitipana uthura,maiththridasa mawatha,homagama",3,1,"2,408.0 sqft",20.0 perches
64,Modern House for Sale Near Homagama Town,10 Jul 11:35 am,"Homagama, Colombo","14,000,000",Modern house for sale 1.5Km from Homagama Town. 200m for 128 Bus road.,"179/1B, Uduwana, Homagama",5,2,"2,200.0 sqft",10.0 perches
65,Godagama House for Sale, 9 Jul 11:32 am,"Homagama, Colombo","6,000,000",10 Perches Land sell with house,"Lional Jayasinghe  Mawatha, Panagoda, Homagama",2,1,972.0 sqft,10.0 perches
66,House for Sale in Homagama, 9 Jul  7:46 am,"Homagama, Colombo","4,600,000","sundara parisarayaka pihita  ethi niwasa weda awasan kara netha bus paarata 30m. homagama town ekata 4km,kottawa high way entress ekata 5km.pitipana NSBM campus ekata 2km. mahinda raajapaksha paasalata 2km.",pitipana. homagama.,3,1,"1,300.0 sqft",10.0 perches
67,House for Sale in Homagama, 8 Jul  5:34 pm,"Homagama, Colombo","6,500,000","හෝමාගම - හංවැල්ල 293 බස් මාර්ගයට යාබදව ටයිල් ෆැක්ටරියට 500 m දුරින් ජල්තර, නවෝද්‍යා මාවතේ පිහිටි පර්චස් 15 ක ඉඩම සමග නිවස විකිනීමට ඇත.* වැරැන්ඩාව * සාලය * කෑම කාමරය * නිදන කාමර 02 (ඇටෑච් බාත් රූම්)* මුළුතැන්ගෙය","Jalthara, Nawodya MW",2,2,"1,500.0 sqft",15.0 perches
68,House for Sale in - Homagama,15 Jul 12:13 pm,"Homagama, Colombo","13,500,000",හෝමාගම 128 බස් පාරේ රෝහල ආසන්නයේ  නිවස පිහිටා ඇත.-Bed rooms 5-bathroom 2*මහල් දෙකටම විදුලිය වෙන වෙනම ලබා ගෙන ඇත.*නිවස වටා තාප්ප ඉදි කර ඇත .*නිරවුල් ඔප්පු.,"480,Galawila road, homagama.",5,2,"2,200.0 sqft",10.0 perches
69,House Homagama, 8 Jul  1:21 am,"Homagama, Colombo","7,400,000","homagama town ekata 2km.kottawa highway entress ekata 3km.pitipana nsbm campus ekata  4km. mahinda raajapaksha paasalata 4km,","uduwana homagama,",3,1,"1,300.0 sqft",12.0 perches
70,House for Sale at Homagama, 7 Jul  1:18 pm,"Homagama, Colombo","6,600,000",House for Sale at Homagama Kiriwattuduwa. 2 ST House ground floor Completed. Used standard meterials.Fully tiled Rochell. All Doors & Windows used timber Jack Tree. Surronded walls. Seperate entrance for upstair. 3 Vehicle parking space.,2,2,"1,500.0 sqft",10.0 perches,
71,House with Land for Sale in - Homagama, 6 Jul  1:08 pm,"Homagama, Colombo","9,000,000",House with ShopCall for More Details,3,1,"1,000.0 sqft",10.2 perches,
72,මීගොඩ හයිලෙවෙල් පාරට නුදුරින් නවීන දෙමහල් නිවසක් විකිනීමට,20 Jul 11:17 am,"Homagama, Colombo","6,600,000","1. නිදන කාමර -  4 නාන කාමර -2 2. පලමු මහල සම්පූර්ණ කර ඇත. දෙවන මහලේ සුලු වැඩ කොටසක් පමණක් සිදු කිරීමට ඇත.3.උණු වතුර සහිත නාන කාමර, දොර ජනෙල් කොස් ලී සහ නවීන තිර රෙදි,ටයිල් රොසෙල්,4. හයි ලෙවෙල් පාරට, අර්පිකෝ සුපර් සෙන්ටෙර්, ඉන්දන පිරවුම් හලට, පාසලට,දුම්රිය නැවතුම් පොලට පයින් ගමන්කල හැකි දුර5. පන්සලට (දහම් පාසලට ) ඉතා සමීපයි6. බහුවිධ ප්‍රවාහන මධ‍ය්‍යස්තානයට කි.මී. 91. Two storied house with four (4) bedrooms (Ground floor is fully completed and Minor works to done done in upstairs.) 2. Two bath rooms - One with hot water3. Ground floor is fully tiled - Rocel4. Doors & Windows - Jack wood5. Walking distance to nearest bus stop  (level road) 6. Walking distance to Arpico Super Centre (level road) 7. 500m to Lanka filling station (level road) 8.Good neighborhood and calm environment.9. Schools, medical centres,and railway station,are near by.",4,2,"1,450.0 sqft",10.5 perches,
73,2 Story Brand New House For Sale in Homagama -Uduwana, 5 Jul 11:58 pm,"Homagama, Colombo","15,500,000",2 Story Brand New House For Sale in Homagama -Uduwana-------------------------3.5 Km  to Homagama  twon,"500meters to uduwana junction ,Homagama",4,2,"1,850.0 sqft",10.0 perches
74,House For Sale In Homgama,12 Jul  7:39 pm,"Homagama, Colombo","7,900,000",House with 4 bed rooms and 2 bathrooms (1 internal and 1 external). 10 purchase land. 30feet roads. 300m to main road and 1.5 KM to High level Road(meegoda Junction). Piped water and electricity available.,"meegoda, Homagama (Near Orange Factory)",4,2,"1,500.0 sqft",10.0 perches
75,House For Sale In Godagama, 5 Jul  6:45 pm,"Homagama, Colombo","9,800,000","අඩු මුදලකට, නිස්කලංක පරිසරයකින් අගනා නිවසක්!! නිදන කාමර 5කින් සමන්විතයි නානකාමර (ඇතුලත 2යි පිටත 2යි)අංග සම්පුරණ මුළුතැන්ගෙයකින් සමන්විතයි විශාල සාලයක් ඇත ඉඩම වටේට තාප්ප බැඳ ගේට්ටු 2කින් ද සමන්විතයි වාහන 2ක් නැවැත්වීමේ ඉඩපහසුව සහිත ගරාජයක් ඇත ",Godagama,5,3,"2,000.0 sqft",13.0 perches
76,House for Sale Homagama Godagama,19 Jul  2:24 pm,"Homagama, Colombo","7,800,000","ගොඩගම හයිලෙවල් පාරට මීටර් 75 ක් දුරින් අලුතින් නිම කල වැඩ අවසන් නිවසක් විකිණීමටඉඩම පර්චස් 06යිවිදුලිය හා නල ජලය බැංකු ණය පහසුකම්නිවසේ වටිනාකම රු. 7,800,000/-","homagama, godagama",2,1,"1,000.0 sqft",6.5 perches
77,House for sale Homagama Habarakada, 5 Jul  2:04 pm,"Homagama, Colombo","15,000,000",හෝමාගම හබරකඩ පර්චස්  21 ඉඩම සමග නිවසක් විකිණීමට මුළු ගේම ටයිල් අතුරා ලී සිවිලිම ගසා ඇත කාමර තුනයි ලොකු සාලය මුළුතැන්ගෙය යාබද නාන කාමරය හරි හතරැස් සමතලා ඉඩම හතර වටේටම තාප ගසා ඇත පොල් තැඹිලි කෙසෙල් වගාවන් දැනට ඵලදාව ලබා ගැනීමට පුළුවන ඉඩමේ වාහන කීපයක් වුවද ගාල් කිරීමට හැක වැඩි විස්තර සඳහා සීඩී ආර්යරත්න 373 1/6 සමූපකාර මාවත හබරකඩ හෝමාගම.,3,2,"2,500.0 sqft",21.0 perches,
78,02 Story Luxury House Homagama, 5 Jul 11:43 am,"Homagama, Colombo","37,500,000","A beautiful and elegant two storied luxury house including roof top, office and warehouse space in the heart of Homagama. ",KATUWANA ROAD HOMAGAMA,6,4,"3,500.0 sqft",20.0 perches
79,A Completed House for Sale in Homagama - Kiriwaththuduwa, 5 Jul 11:30 am,"Homagama, Colombo","6,800,000","‍හෝමාගම, කිරිවත්තුඩුව හන්දියට කි.මී. 01 ක් දුරින් 128 හෝමාගම - තලගල බස් මාර්ගයට  ආසන්නව පර්චස් 10  පිහිටි කාමර 03, සාලය, කෑම කාමරය, කුස්සිය සහ නාන කාමරය, අමතර නාන කාමරය සහ සේවක වැසිකිලිය ඇතුලු පහසුකම් වලින් සමන්විත අංග සම්පූර්ණ නව නිවස ඉතා ඉක්මනින් වීකිණිමට ඇත. සිවිලිම ගසා මුළු නිවසම ටයිල් කර ඇත. අඩි 12 ප්‍රවේශ මාර්ගය. නිවස සිට අඩි 40 ක් දිග පුද්ගලික මාර්ගයක් ඇත. නල ජලය , විදුලිය ඇතුලු සියලු පහසුකම් වලින් සමන්විතයි මිල ලක්ෂ 68 යි . මිලදී ගත් වහාම පදිංචියට සුදුසුය. අයිතිකරු විදෙස් ගත වන නිසා ඉක්මනින් විකිණේ.128 කොට්ටාව - තලගල මාර්ගයට සහ 280 මහරගම - ‍ හොරණ මාර්ගයට  මී. 300 129 කොට්ටාව - මොරගහහේන මාර්ගයට  මී. 700 හෝමාගමට සහ කොට්ටාවට කි.මී. 07",Pitipana South - Homagama,3,2,"1,360.0 sqft",10.0 perches
80,New House for Sale in Homagama, 5 Jul  8:07 am,"Homagama, Colombo","8,700,000",New house in Homagama pitipana3 Bedroom 2 Bathroom living room and kitchen15 ft wide Road Enters200 meter From Main road1.500 Mahinda Rajapaxsa College4 Kms from Homagama Twon6 Kms Experswey KottawaTotal price Rs 8.7 MillionClear DeedsTo inspect the Land - Please inform 2 hours before,pitipana Shout Homagama,3,2,"1,260.0 sqft",10.0 perches
81,Brand New Single Story 3br House For Sale in Homagama, 5 Jul 12:33 am,"Homagama, Colombo","11,500,000",Barnd New Singleh Story House For Sale in Homagama -------------------------Located just 500meters to Uduwana junctions highly residential area,Located just 500meters to Uduwana junctions highly residential area,3,3,"1,850.0 sqft",8.0 perches
82,House for sale in homagama, 4 Jul  7:01 pm,"Homagama, Colombo","6,500,000",House for sale in Homagama===================,2,2,"1,362.0 sqft",6.0 perches,
83,House for Sale in - Homagama, 9 Jul  7:27 pm,"Homagama, Colombo","11,500,000",Two Storied House in Kiriwattuduwa Near to Mahinda Rajapaksha Ground 2km to Highway Entrance Genuin Buyers Only,4,2,"1,900.0 sqft",15.0 perches,
84,House For sale Godagama Homagama,30 Jun  2:21 pm,"Homagama, Colombo","9,500,000",✅ සියලුම පහසුකම් වලින් සම්පුර්ණ නිවස,"95/45/02 Godagamahe waththa,godagama, homagama",3,2,"1,800.0 sqft",10.0 perches
85,House for sale in Homagama, 5 Jul  8:14 am,"Homagama, Colombo","8,000,000",House for sale in Homagama=====================,3,2,"2,178.0 sqft",10.0 perches,
86,House for Sale -Padukka, 4 Jul  4:56 pm,"Homagama, Colombo","6,500,000","Ikmanin vikinimata.salaya,2bed room ,kitchen ,dining room ,sarwent toilet 1.slab dama atha.","panaluwa,watareka,padukka.",2,1,"2,000.0 sqft",10.5 perches
87,"A House for sale in Walawwa Road, Homagama", 4 Jul  2:59 pm,"Homagama, Colombo","18,500,000",A House for Sale in Homagama =====================,"25/4,  Walawwa Road, Homagama",3,3,"2,800.0 sqft",11.0 perches
88,House for Sale - Meegoda,18 Jul  1:47 pm,"Homagama, Colombo","7,200,000",Completed house  & up stair annex for sale in meegoda wataraka. very peaceful area.Price 72/- laks . price negotiable call,"41/25/150 sampathpura , wataraka , meegoda",2,2,"1,000.0 sqft",10.04 perches
89,Half built house for sale in Uduwana, 5 Jul 12:25 pm,"Homagama, Colombo","5,500,000",Call for more information Price can be nagotiable after inspect,"No 233G, Daluggla Mawatha,pansala Para Uduwana Homagama",2,1,"1,000.0 sqft",10.0 perches
90,A Brand New House for Sale in Homagama,21 Jul 12:41 pm,"Homagama, Colombo","13,800,000",#  4km  homagama #  3 km  pitipana   temple   junction #  nearby   NSBM  campus   mahinda  rajapaksa  vidyala #  5  bedrooms #  3  bathrooms   and   servant   bathroom #  living area   and   dining area # TV  lobby #  large   balcony #  pantry #   fully   tiled #  finishing   roof #  surrounding   wall   and   roller   gate #  2 vehicle   parking area,5,4,"2,650.0 sqft",10.5 perches,
91,House for sale in Homagama, 3 Jul  3:52 pm,"Homagama, Colombo","15,900,000",Why worry to buy a land and build a house when you can buy your dream house and be hassle free! ,Homagama,3,2,"2,800.0 sqft",4.0 perches
92,Homagama Thalagala Complete House, 2 Jul  8:23 pm,"Homagama, Colombo","8,000,000",3 bed roomsBathroomsKitchen VarendaLiving area Walls GatePure waterSiting areaFans,3,1,"1,800.0 sqft",14.0 perches,
93,HOUSE for sale in Panagoda, 1 Jul  7:28 pm,"Homagama, Colombo","6,200,000","4 Bed Rooms, 1Bathroom living room and kitchenPop bom woter Electricty10 perch LAND with house15 ft wide road Enters700 meter from main road3 Kms Panagoda65% work completed .6.2 Million in Current Situation 1.5Million more to Finish Workපවතින ගොඩනැගිල්ල ලක්ෂ්‍ය 62ඉතිරි වැඩ නිමකරන්න ලක්ෂ්‍ය 10-15 පමණ යාවි කරලා දෙන්න පුලුවන්පදිංචි වෙන්න පුළුවන්",welipillewa Panagoda Homagama,4,1,"1,350.0 sqft",10.0 perches
94,තනි තට්ටුවේ අංගසම්පූර්ණ නිවසක්. හෝමාගම, 1 Jul  5:56 pm,"Homagama, Colombo","8,500,000",*මාගම්මන විද්‍යාලයට නුදුරින්.*ප්‍රධාන මාර්ගයේ සිට 100m දුරින්. *ස්ථාන මාරුවක් හේතුවෙන් ඉක්මනින්     ගැනුම්කරුවකු සොයමි.*හෝමාගම නගරයට 2.5km පමණි.,"232/2 මාගම්මන, හෝමාගම.",3,1,"2,383.0 sqft",10.5 perches
95,House for Sale In - HOMAGAMA ( Near to NSBM ), 1 Jul  6:52 pm,"Homagama, Colombo","9,500,000",House For Sale In Homagama======================,4,2,"2,000.0 sqft",7.5 perches,
96,House for Sale Homagama, 1 Jul  9:44 am,"Homagama, Colombo","8,500,000","sundara parisarayaka pihiti anga sampoorna niwasa. bus parata 200m homagama town ekata 2km,dumriya sthaanayata 1,800km. kottawa highway entress ekata 3.5km. kottawa nawa high way bus stand ekata 3.600km,  .boker warun anawashshayai.","gamunu mawataha, homagama,",3,1,"1,300.0 sqft",14.0 perches
97,A Luxurious House for Sale Homagama,30 Jun  2:26 pm,"Homagama, Colombo","18,500,000",Quality builtFine finishing4km to Godagama,4,3,"3,000.0 sqft",16.25 perches,
98,House for Sale in Homagama, 5 Jul 10:17 pm,"Homagama, Colombo","4,700,000",House for sale in Homagama - Padukka 125 road.Convenient sorrounding. Call for more info,5,2,"1,500.0 sqft",7.6 perches,
99,"Newly Constructed House for Sale in Godagama, Homagama", 4 Jul  2:46 pm,"Homagama, Colombo","12,500,000",Newly Constructed House for Sale in Godagama,"Homagama, Godagama",3,2,"1,300.0 sqft",6.5 perches
100,Newly Built Modern Architectural Home for Urgent Sale in - Meegoda,29 Jun  5:57 pm,"Homagama, Colombo","21,000,000","It Includes Jack Wood Doors and Windows, Walls Are in Bricks, Hot Water Facilities, Stylish Light Fittings, Front and Back Garden Space and An Electric Roller Gate.5 Bedrooms. Court Yard, Veranda/balcony, Car Park, Double Hight Space and Many More.",Meegoda,5,3,"3,000.0 sqft",12.0 perches
101,හෝමාගම මීගොඩ දෙමහල් නිවස විකිණීමට, 3 Jul 10:45 am,"Homagama, Colombo","4,900,000","හෝමාගම මීගොඩ පර්චස් 7.5 නිදන කාමර 5 සහිත දෙමහල් නිවස විකිණීමට ඇත .මිල රු.4,900,000.ප්‍රධාන පාරට මීටර් 700",5,2,"1,150.0 sqft",7.5 perches,
102,House || in Homagama, 8 Jul  9:25 am,"Homagama, Colombo","11,500,000","2 story brand new HouseBound to the paddy field3 bed rooms3 bath roomsLiving ,dining areaPantry & kitchenGarage with vehicle parking spaceParapet wall with roller GatePipe born water & electricityResidential area with good neighborhoodWorking distance to godagama junctionClear deeds",Near godagama junction,3,3,"1,600.0 sqft",6.5 perches
103,House for sale in Homagama,29 Jun  8:57 am,"Homagama, Colombo","6,500,000",3 bedrooms house for sale in Homagama.-Land extent 10.5 perches with parapet walls.-Separate servants toilets- Entrance from 20 feet road-2km's from Homagama town,"Magammana, Batahena Road, Homagama",3,2,"1,048.0 sqft",10.5 perches
104,House sale - Meegoda,29 Jun  8:41 am,"Homagama, Colombo","4,400,000",1 km to 125 bus route (Colombo-Padukka),"Udagawatte Road, Meegoda.",2,1,800.0 sqft,8.6 perches
105,House for Sale in Homagama Athurugiriya,28 Jun  4:02 pm,"Homagama, Colombo","11,000,000",House for sale in Homagama Athurugiriyaසම්පූර්ණයෙන්ම ටයිල් කර ස්ලැබ් සහිතයිනිදන කාමර 03 / සාලය / බාර්ත් රූම් / මැද මිදුල / පැන්ට්‍රි කබඩ් සහිත මුලුතැන්ගෙයවාහන 04ක් නවතා තැබීය හැකියහෝමාගම හා අතුරුගිරිය නගරයන්ට විනාඩි 10තාප්ප වලින් වටවූ ගේට්ටු සහිත නිවස,"Homagama,Panagoda",3,1,"1,700.0 sqft",11.5 perches
106,House for Sale - Meegoda,28 Jun  3:16 pm,"Homagama, Colombo","3,200,000",House for Sale in Meegoda=====================#     Bed Room 02#     Bath Room 01#     Kitchen 01#     Living#     Veranda,"Godagama, Meegoda",2,1,"1,200.0 sqft",10.0 perches
107,House for sale in Godagama,28 Jun  2:36 pm,"Homagama, Colombo","8,500,000","House for sale in Godagamafully tiled3 BedroomsLivingKitchen 1 bathroom1  servant bathroom2 vehicle car parkingWith a very beautiful gardenOver 300 flower pots and a dog kennel,worth  350000/= thousand20 feet road800 meters from high level road Schools,Banks,keells super,Arpico super center,singer home,food city within 1 km 4 km for athurugiriya highway entrancevery beautiful house for a very reasonable pricePls call for more Details",Homagama Godagama,3,2,"2,500.0 sqft",10.0 perches
108,Beauty House For Sale In Meegoda,28 Jun  3:55 pm,"Homagama, Colombo","8,990,000",New home Finishing whood Beauty garden 3bed Andre 1 bathCall me,3,1,"1,800.0 sqft",27.8 perches,
109,Brand New House Homagama Hanwella road,28 Jun 10:09 am,"Homagama, Colombo","8,400,000",No. 674/12/3ANandana Uyana Welipillewa Homagama.Brand new house in Homagama Hanwella road at  Welipillewa junction3 bed rooms2 toiletsLiving & dinningPantryVerendah carporchHot waterFitted pantry cupboardsAC pointsRemote roller gateSurrounded boundary wallsPipe born water and electricity20ft wide roadsVery close to main bus road - 50m4th land from the road3km to Panagoda junction5km to AthurugiriyaHighly residential areaClear deeds & all council approved docementsHouse completed on 27/06/2019,3,2,"1,300.0 sqft",7.4 perches,
110,House for sale in Homagama,30 May  4:46 pm,"Homagama, Colombo","6,900,000","3 bed roomsKitchenDining roomLiving roomTV roomOut side toiletOpen varandaCeilling and tilled50m to 128,280 bus road200m to 129 bus road7km to138 high level road4km to Mahinda Rajapaksha collage,NSBM univercity4km to Diyagama engineering univercity","thalagala junction, kiriwaththuduwa, homagama",3,2,"1,584.0 sqft",17.0 perches
111,Apartment Style Home for Sale Homagama, 6 Jul 12:03 pm,"Homagama, Colombo","12,900,000","This immaculately designed 2-story house with a private balcony, invites comfort, and includes modern elegance. With 3 bedrooms, and 2 baths, generous living space and stylish finishes, you'll enjoy a perfect setting for relaxing and entertaining, thus living upto the name of the Lotus Flower. ","Pitipana South, Homagama",3,2,"1,650.0 sqft",10.0 perches
112,House Sale - Habarakada,28 Jun  9:46 am,"Homagama, Colombo","38,250,000","Rs 40,800,000",HABARAKADA ATHURUGIRIYA,3,2,"2,600.0 sqft",34.0 perches
113,House for Sale in Homagama,27 Jun  9:44 am,"Homagama, Colombo","3,600,000",කාමර දෙකක වැඩ නිම කර ඇත .,"237/5/19,වාසනා මාවත , ලෙනගල, දැඩිගමුව.",3,2,700.0 sqft,10.0 perches
114,House For Sale In Homagama,27 Jun  8:25 am,"Homagama, Colombo","5,500,000",A house with three bed room and one bath room. 2km to Homagama Town. 3.5km to Kottawa Highway Entrance.,"Homagama, Pinketha Road",3,1,"1,000.0 sqft",12.0 perches
115,Beautiful House In Godagama,26 Jun 10:52 pm,"Homagama, Colombo","11,500,000","Two storied Brand new quality house for immediate sale….3 rooms with 2  bath rooms, large living room & kitchen, dining and carpoachcontact price 11.5 million & negotiable...6.5 perch with 20 feet road with very economical design within 6.5 perch…Fully complete house including garden, roller gate & parapet wall around the ghouse.Conveniently located in peaceful well secured residential area close to godagama & homagama towns. just 200 m to 138 bus road house with all facilities. Very convenience to all supermakets and some of the the banks. Selling at urgently..Just completed.","high level road, godagama",3,2,"1,400.0 sqft",6.5 perches
116,House For Sale Godagama,26 Jun 11:14 am,"Homagama, Colombo","5,000,000",House For Sale  in Godagama========================#    Bed Room 03#    Bath Room 01#    Kichan,Godagama Puwakwatta.,3,1,"1,300.0 sqft",7.5 perches
117,House for Sale in Homagama,26 Jun 10:53 am,"Homagama, Colombo","9,500,000","හෝමාගම, පිටිපන උතුර 128 බස් මාර්ගයේ NSBM කැම්පස් එකට නුදුරින් දෙමහල් නිවසක් විකිනීමට ඇත.නිදන කාමර 03කෑම කාමර 01බාත් රූම් 01සේවක බාත් රූම් 01විශාල සාලයක් මුළුතැන්ගෙය","Pitipana north, Homagama",3,1,"2,500.0 sqft",11.5 perches
118,House for Sale in Homagama,30 Jun  9:47 am,"Homagama, Colombo","2,950,000",House for Sale in Homagama==================,"No.244/A, Galagahahena. Pitipana south. Homagama",3,1,966.0 sqft,5.1 perches
