,0,1,2,3,4,5,6,7,8,9
0,title,posted date,location,price,description,Address:,Beds:,Baths:,House size:,Land size:
1,House For sale Godagama Homagama,30 Jun  2:21 pm,"Homagama, Colombo","9,500,000",✅ සියලුම පහසුකම් වලින් සම්පුර්ණ නිවස,"95/45/02 Godagamahe waththa,godagama, homagama",3,2,"1,800.0 sqft",10.0 perches
2,"['House For sale Godagama Homagama', '30 Jun  2:21 pm', 'Homagama, Colombo', '9,500,000', '✅ සියලුම පහසුකම් වලින් සම්පුර්ණ නිවස', '95/45/02 Godagamahe waththa,godagama, homagama', '3', '2', '1,800.0 sqft', '10.0 perches']","['title', 'posted date', 'location', 'price', 'description', 'Address:', 'Beds:', 'Baths:', 'House size:', 'Land size:']",,,,,,,,
3,House for Sale - Pitipana,10 Jul  4:14 pm,"Homagama, Colombo","8,400,000","129,190,125, බස් මාර්ග වලට කිලෝමීටර් දෙකයි, මනරම් පරිසරය",පිටිපන මීගොඩ පාර,3,3,"1,300.0 sqft",11.0 perches
4,House for Sale - Homagama,21 Jul  6:08 pm,"Homagama, Colombo","6,500,000",New house 2 bedrooms 1 office room Site & house plans are registered  SLT & Peo TV connectionTapped Well waterAll owner details are clear Genuine buyers only,3,1,"1,200.0 sqft",11.5 perches,
5,Brand New House for Sale in - Godagama,15 Jul  5:42 pm,"Homagama, Colombo","12,000,000",Brand New Two Storied House for Sale 100m to High-Level Road 400m to Godagama TownClose to Athurugiriya Highway Entrance,lional jaysinghe road godagama,3,2,"1,300.0 sqft",6.5 perches
6,First Floor Completed 3 Storied House Homagama,21 Jul  4:31 pm,"Homagama, Colombo","7,500,000","Ground floor completed 3 storied house face to beautiful paddy area at diyagama, homagamaIts beautiful residential area very close to hnd university and mahinda rajapaksha stadiumJust 300 meters to 280 main road15 feet tared roadAlso completed two concrete slabsGround floor complete with titanium floor area, one bed room, bathroom , kitchen with complete pantry, and large living areaTwo sair cases also completed.Valuable investment75 laks only.Clear titlesLoans applicable","Diyagama, homagama",1,1,"3,000.0 sqft",10.0 perches
7,Apartment Style Home for Sale Homagama, 6 Jul 12:03 pm,"Homagama, Colombo","12,900,000","This immaculately designed 2-story house with a private balcony, invites comfort, and includes modern elegance. With 3 bedrooms, and 2 baths, generous living space and stylish finishes, you'll enjoy a perfect setting for relaxing and entertaining, thus living upto the name of the Lotus Flower. ","Pitipana South, Homagama",3,2,"1,650.0 sqft",10.0 perches
8,House for Sale in Homagama,18 Jul  3:22 pm,"Homagama, Colombo","11,000,000","වර්ග අඩි 300 ක සාලය, කෑම කාමරය, ගරාජය, වට තාප්ප, ගේට්ටු, සම්පුර්ණම නිවස ටයිල් කර සිවිලිම ගසා ඇත. පොල් ගස් 09, කොස් ගස් 02 ක්, දෙල් ගස් 01  සහ පලතුරු වවා ඇත.","Pitipana South, Homagama",3,1,900.0 sqft,21.0 perches
9,3BR House for Sale in Watareka,21 Jul  3:13 pm,"Homagama, Colombo","6,500,000",• Our Reference No SH 10300( Please quote this reference number when inquiring),"Halbarawa, Watareka",3,2,"1,200.0 sqft",10.0 perches
10,House for Sale - Godagama,21 Jul 12:48 pm,"Homagama, Colombo","8,000,000","The house is 100% completed.The house is located near the high level road (5 minutes by walk), in a quiet area.The house consists of:-3 bedrooms-1 big living room-1 bathroom-1 servant toilet-   wide garden.Please contact me for more details.",3,2,"3,907.0 sqft",14.35 perches,
11,New House For Sale in Homagama | Meegoda,20 Jul 11:48 am,"Homagama, Colombo","6,100,000",Newly Built House For Sale in Meegoda,Homagama | Meegoda,2,1,"1,300.0 sqft",6.0 perches
12,Brand New House for Sale - Homagama, 9 Jul  7:17 pm,"Homagama, Colombo","9,000,000",Brand new house for sale in Homagama magammana. 200m to main road.2km to homagama town( highlevel). 3km to highway entrance . 200m to food city. 1km to mahinda rajapaksha ground. 3 bed rooms and 3 bathrooms . Fully tiled. Completed pantry.Resident area. 20 ft road .,Homagama  magammana,3,3,"1,480.0 sqft",7.5 perches
13,House for Sale Homagama,21 Jul 10:50 am,"Homagama, Colombo","4,500,000",128-280 ප්‍රධාන බස් මාර්ගයට කි මී 1 ක් දුරින් පිහිටා ඇත. විදුලිය නලජලය සහිතයි .කහතුඩුව අධිවේගී පිවිසුමට ආසන්නයි. වැඩි විස්තර සඳහා අමතන්න,4,2,"1,100.0 sqft",12.0 perches,
14,House for Sale - Godagama, 8 Jul  9:46 am,"Homagama, Colombo","4,400,000","House is located in Godagama close to the godagama railway station, Easy to commute, walk in distance to schools, supermarkets, highlevel road, 8.0p land covered with wall. Owner and family moved abroad and quick cash deal preferred.",2,1,"1,400.0 sqft",8.0 perches,
15,House for Sale in Homagama,20 Jul  9:33 pm,"Homagama, Colombo","4,500,000",පර්චස් 6.5 ඉඩමතුල නිවාස 2 ඇත.එක්‌ නිවසක කාමර 2ක්  සහ  බාත්රූම් 1 සහ කුස්සිය සහ සාලයක් ඇත.අනෙක් නිවසේ කාමර  1ක්  සහ බාත්රූම් 1 සහ කුස්සිය සහ සාලයක් ඇත.නිවාස දෙකම ලක්ෂ 45යි හෝමාගම නගරයට 1ඉතා ඉක්මනින් විකිනීමට ඇත.,"no.186D,Uduwana Homagama",2,1,"1,100.0 sqft",6.5 perches
16,House For sale Godagama Homagama,30 Jun  2:21 pm,"Homagama, Colombo","9,500,000",✅ සියලුම පහසුකම් වලින් සම්පුර්ණ නිවස,"95/45/02 Godagamahe waththa,godagama, homagama",3,2,"1,800.0 sqft",10.0 perches
17,House for Sale - Homagama,20 Jul  7:38 pm,"Homagama, Colombo","6,500,000","125 190 බස් මාර්ග වලට කිලෝමීටර් දෙකයි, දුම්රිය මාර්ගයටත් කිලෝමීටර් දෙකයි,",මීගොඩ දාම්පේ පාර,3,1,"1,300.0 sqft",35.0 perches
18,House Fro Sale in - Homagama,20 Jul 11:16 am,"Homagama, Colombo","15,000,000","4 Bed rooms, 2 Bathrooms, Living area, Kitchen, Tv lobby, Car porch, Roof top (500sqft) , Remote control  Roller shutter Gate, Servant toilet.","Homagama, Colombo.",4,2,"2,000.0 sqft",7.0 perches
19,Brand New House for Sale at Homagama,20 Jul 10:02 am,"Homagama, Colombo","11,000,000",3 Bed rooms Brand New House for Sale at Homahama Town Area withLiving RoomTV AreaDining AreaPantryBath Room with Hot WaterRocel Sanitary Fittings with Hangs Grohe Mixture TapsSuronded by Bounday Walls with Roller door & Wicket Gate1.3 Km to Homagama Town250 m to Main Road2.5 Km to Kottawe High way Entrance,"100/3, Manathunga Mawatha, Homagama",3,1,"1,350.0 sqft",8.0 perches
20,House for Sale in Homagama,20 Jul 12:09 am,"Homagama, Colombo","9,000,000","sundara parisarayaka pihiti anga sampoorna nawa niwasa ,bus paarata 300m,homagama town ekata 2 1/2km.kottawa highway entress ekata 3 1/2km.pitipana nsbm campus ekata 5 km, mahinda raajapaksha paasasalata 5km.","maagammana, homagama.",3,2,"1,200.0 sqft",7.0 perches
21,Brand New unoccupied luxury House Homagama,19 Jul  6:48 pm,"Homagama, Colombo","25,000,000","හෝමාගම - පොලීසිය පාරේ නගරයේ සිට කිලෝමීටර් 1ක් දුරින් ප්‍රධාන මාර්ගයට පෙනෙන දුරින් ප. 9.5  ඉඩමේ ඉදිකරන ලද පදිංචි නොවූ නව දෙමහල් නිවස හා නිවසට යාබඳව ඉදිකරන ලද සියලු පහසුකම් සහිත අංගසම්පූර්ණ ඇනෙක්සියක්ද ඇත.                   සම්පූර්ණ වාස්තු විද්‍යානුකූලව ඉදිකරන ලදී.                   වර්ග අඩි 3000 කි.                   නිදන කාමර 5 යි / බාත්රූම් 3 යි.                   වටේට බැල්කනි දමා මනරම් පරිසරයක පිහිටා ඇත.                   විධිමත් කානු පද්ධතියක් ඇත.                   නිවසට එන මාර්ගය අඩි 20 යි.                   විදුලිය / නලජලය සමඟින්.                   දොරවල් සහ ජනෙල් තේක්ක වලින් නිම කර ඇත.                   නීත්‍යානුකූල සියලු ලියකියවිලි සහ ප්‍රාදේශීය සභා අනුකූලතා සහතිකය ද ඇත.                   නිවසේ සියලුම දේවල් අනර්ඝ තතත්වයෙන් නිමකර ඇත.                   නගරයට සහ හෝමාගම සියලුම රජයේ ආයතනවලට හරිත පරිසරය, තාක්ෂණික පීඨය, කර්මාන්තපුරය හා අධිවේගී මාර්ග පිවිසුමට ඉතා කෙටිකාලයකින් ලඟාවිය හැකිය.රු: මිලියන: 25 යි.","Homagama පොලීසිය පාරේ,හෝමාගම",5,3,"3,000.0 sqft",9.5 perches
22,House for sale in Homagama,19 Jul  5:27 pm,"Homagama, Colombo","12,000,000",හෝමාගම මහකටුවාන පාරේ 1.5 km දුරින් නිසංසල පරිසරයක පිහිටි පර්චස් 20 ක ඉඩම සමග භාවිතා කල හැකි පැරණි නිවස ඉඩමේ මිලට ඉතා ඉක්මනින් විකිනීමට ඇත. ඉඩමේ සැලසුම අනුමත කර ඇති බැවින් ඉක්මන් ණය පහසුකම් ලබා ගත හැක.,"Homagama, Mahakatuwana Road",3,1,"1,500.0 sqft",20.0 perches
23,House for Sale - Homagama,19 Jul  4:32 pm,"Homagama, Colombo","9,000,000","හෝමාගම නගරයට විනාඩි7, කාමර 4යි, නාන කාමර උඩ.යට  2යි, සාල2යි, තාප්ප.ගේට්ටු.වාහන 3ක් සඳහා ඉඩ,ණය ගන්න පුළුවන්.4bed rooms, 2 bathrooms up&down, 3Living area, 1servent toilet, garaj-3vehicel parkin space, 1dining erea, 1kitchen, loans ok,homagama policiya road, 7minits to town ,1.7 km 138.122.,125,124,98,99,644,128,129 bus stand.",4,3,"2,000.0 sqft",10.0 perches,
24,House for Sale Homagama,18 Jul  2:37 pm,"Homagama, Colombo","7,500,000","Complet house 3 rooms, one bath room , servent toilet, walls and gate, 75m to high level road, 500m togodagama juntion 350m meegoda ecomomic center,                                 ","Godagama homagama,",3,1,"2,300.0 sqft",11.0 perches
25,House for Sale - Homagama,18 Jul  2:29 pm,"Homagama, Colombo","14,000,000","The land plot 20 perch lush green including many verities of tropical fruits like mango, avocado, rambutan, guava, olive, amberalla, jumbo, naminam, with coconut & king coconut.Build house three bedrooms two attached bathrooms, open court yard & a larg living area private garage.1.5 km to homagama town, 500 mt to high level Rd 100 mt off moragahena Rd near Pali University and 3 km to NSMB, 3km to Kottawa highway exit Price 14 mil on negotiate",3,2,"1,400.0 sqft",20.0 perches,
26,New House for Sale in Homagama,18 Jul  1:13 pm,"Homagama, Colombo","16,600,000",New House For Sale in Homagama,Homagama,4,3,"2,500.0 sqft",7.5 perches
27,House for sale in Homagama,17 Jul  2:02 pm,"Homagama, Colombo","6,800,000","හෝමාගම, පිටිපන දකුණ හරිත සරසවියට හා මහින්ද රාජපක්ෂ විද්‍යාලයට 1.5 km යි,මහරගම ගොවිජනපදය බස් පාරට 100 m යි, කොට්ටාව මොරගහහේන බස් පාරට 800 m යි, හෝමාගම පිටිපන පංසල හන්දිය බස් පාරට 500 m යි. නිදන කාමර 03 කින් සමන්විත අංග සම්පුර්ණ නිවස විකිනීමට.","Pitipana South, Homagama",3,1,"1,350.0 sqft",10.0 perches
28,House for Sale in Homagama,17 Jul  2:18 pm,"Homagama, Colombo","6,200,000",වටරැක හයිලෙවල් පාරට මීටර් 350 සම්පූර්ණ ටයිල් කල නව නිවස විකිණීමට. විශාල සාලය කාමර 2 අංග සම්පූර්ණ මුළුතැන් ගෙය. attach bathroom එකක් ඇතුලතින්. ටයිල් කල වැසිකිලියක් පිටින් ඇත. වාහන තුනක් නැවතිය හැකි වරෙන්ඩාව,"289/55, 2nd Lane, Sepalika Uyana, Highlevel Road, Watareka.",2,2,"1,200.0 sqft",11.5 perches
29,House for Sale in - Homagama, 9 Jul  7:27 pm,"Homagama, Colombo","11,500,000",Two Storied House in Kiriwattuduwa Near to Mahinda Rajapaksha Ground 2km to Highway Entrance Genuin Buyers Only,4,2,"1,900.0 sqft",15.0 perches,
30,House for Sale - Homagama,12 Jul  5:02 pm,"Homagama, Colombo","8,500,000",3 Bedroom2 BrathroomKichenVerenda Roller GateFull till,3,2,"1,280.0 sqft",11.0 perches,
31,House in Homagama,17 Jul 10:33 am,"Homagama, Colombo","24,500,000","2 story brand new House4 bed rooms 3 bath roomsSitting,dining & Tv lobbyPantry with kitchenRoof areaVehicle parking spaceParapet wall with remote gatePipe born water & electricityResidential area with good neighborhood30 feet road50m to high level road1.5km to homagama town",Homagama,4,3,"2,800.0 sqft",9.0 perches
32,New Single 10P House Sale - Homagama,17 Jul  8:28 am,"Homagama, Colombo","11,500,000",Brand New Singleh Story House For Sale  Homagama___________********____500meters to 128 Kottawa- Thalagala Bus Route.,500meters to 128 Kottawa - Thalagala,3,2,"1,650.0 sqft",10.0 perches
33,Brand New House for Sale - Meegoda,16 Jul  9:59 pm,"Homagama, Colombo","5,500,000","Newly built brand new house for sale in Homagama ,Meegoda,Walking distance to High level road,Railway station, and Padukka-Colombo route.3 bed rooms,kitchen and veranda2 cars can park easily Fully tiled and ceiling are done for all the areas.Boundary wall with steel gate,","Homagama,Meegoda",3,1,"1,200.0 sqft",8.0 perches
34,Clear Title House for Sale in - Meegoda,15 Jul  8:59 pm,"Homagama, Colombo","4,000,000","Just 700 m to Wataraka Junction & Railway Station1.2 Km to High Level Road2 Bed Rooms, Living Area, Dining Area, Car Porch, Kitchen & 2 Bath RoomsWell WaterGood Residential AreaClear Deeds & DocumentsFinishing Roof & Partly TiledSerious Buyers Only, No Brokers Pls","Wataraka, Meegoda",2,2,"1,200.0 sqft",8.0 perches
35,New House for Sale in Kahathuduwa,15 Jul  8:50 pm,"Homagama, Colombo","4,900,000",⏺️හෝමාගම කහතුඩුව නගරයෙන් ⏺️නව දෙමහල් නිවස විකිණීමට ( පලමු මහල සම්පූර්ණ වැඩ නිම කර ඇත ),"Kahathuduwa, Homagama",2,2,"1,000.0 sqft",9.5 perches
36,Land and house For Sale Homagama,15 Jul  6:57 pm,"Homagama, Colombo","8,400,000","New house for sale!!!!9.0 perches3km to NSBM(green university)camps2.5 Mahinda rajapakshaka scool4km to homagama town2km to paali camps4km to meegoda economic center .Water,current clear documentNo brokers...negotible.immediately sale....අඩක් නිමකල නව නිවස!!පර්ච් 9හරිත සරසවියට 3kmමහින්ද රාජපක්ෂ පාසලට 2.5kmහෝමාගම නගරයට 4kmපාලි විශ්වවිද්‍යාලයට 2kmමීගොඩ ආර්ථික මධ්‍යස්ථානයට 4kmජලය,විදුලිය නිරඋල් ඔප්පු,ලියකියවිලි.තැරැව්කාරයන් අනවශ්‍යයි...මුදල් හදිස්සියකි.මිල කතකරගත හැක.",3,2,"2,200.0 sqft",9.0 perches,
37,House for Sale - Homagama,15 Jul  6:50 pm,"Homagama, Colombo","3,700,000","Clear title, 300 metres away from Artigala Road, Pipe Bone water, good surround, no flood or inundation. parapet wall. 2.5 km from Highlevel Road, 3 km. from Lowlevel Road. Call for more details.","Green Way Path, Artigala Road, Panaluwa, Watareka.",3,1,"1,600.0 sqft",10.0 perches
38,Newly Built House for Sale at Homagama,15 Jul  5:06 pm,"Homagama, Colombo","11,450,000","Newly Built Two Storied House for Sale in Homagama, Berukatiya, Near faddy field. Full Tiled House with  3 bed rooms, 2 bathrooms, Living, kitchen, veranda, Full ceiling, external full height boundary wall with Alkadoor roller gate, peaceful environment. best residential area.",Berukatiya,3,2,"1,550.0 sqft",7.0 perches
39,New House for Sale in Pitipana,15 Jul  3:12 pm,"Homagama, Colombo","75,000,000",New house / fully tiledCar park spaceQuiet & peaceful areaWall around the houseCarpet roadBus routes;Horana - Maharagama (280)Kottawa - Thalagala (128)Kottawa - Maharagama (129),"Pitipana South, Homagama",3,2,"1,200.0 sqft",10.0 perches
40,House for Sale Meegoda,15 Jul 12:21 pm,"Homagama, Colombo","2,500,000","125 190 බස් මාර්ගවලට කිලෝමීටර් එකයි, බැංකු ලෝන් සදහා අමතන්න එපා",මීගොඩ පුවක්වත්ත පාර,2,4,500.0 sqft,9.0 perches
41,House for Sale in Meegoda,15 Jul 10:57 am,"Homagama, Colombo","5,000,000","125 190 බස් මාර්ග වලට කිලෝමීටර් එකයි, ඉඩමෙන් කැබැල්ල විකිණීමට හෝ තවත් ගෙයක් සෑදීමට ඉඩකඩ ඇත",පුවක්වත්ත පාර මීගොඩ,2,1,"1,100.0 sqft",20.0 perches
42,A Moden Brand New House for Sale - Homagama,21 Jul 11:00 am,"Homagama, Colombo","10,900,000","A beautiful single-story house with two bedrooms, pantry, attached bathrooms with hot water, servant room and toilet, landscaped garden, CCTV. Built for a family but selling an urgent basis. Water and electricity. Boundary wall. 4 km to Tech City. 3.5 km to Homagama Town. Great Neighbourhood. No brokers, please. Three rooms include one servent room","Pitipana South, Homagama",3,3,"1,250.0 sqft",15.0 perches
43,3 Bed Room House for Sale - Homagama,14 Jul  1:29 pm,"Homagama, Colombo","16,000,000","20 perches square plot of level land, surrounded by parapet walls.20 ft wide access road, 70m from main road, (Malabe - Godagama).3km (10 min) drive from kottawa and Athurugiriya inter-changes. 3 Phase electricity, pipe borne water/well and telecom connection.","9, Meda Mawatha,",3,2,"2,000.0 sqft",20.0 perches
44,House For Sale in Pitipana,14 Jul 12:59 pm,"Homagama, Colombo","4,800,000",NSBM විශ්වවිද්‍යාලයට නුදුරින් පිහිටා ඇත.මිල ගනන් සාකච්ඡා කර ගත හැක.වැඩි විස්තර සදහා අමතන්න.,1,1,680.0 sqft,10.3 perches,
45,Two Story House for Sale in Homagama- Meegoda,13 Jul  4:16 pm,"Homagama, Colombo","18,000,000","Two story house for sale in 34 perches land..6 Bed rooms2 Kitchens2 Bathrooms (inside), (Additionally, 1 washroom in outside)1 Garage is space for parking 2 vehicles inWater, electricity and telecom facilities are includedJust 400 m away from High Level roadClear deedsRs. 18 Million (Negotiable)","Godagama, Meegoda",6,2,"2,100.0 sqft",34.0 perches
46,House for Sale in Homagama,13 Jul  2:18 pm,"Homagama, Colombo","1,600,000","හෝමාගම නුදුරින් පර්චස් 10 ක ඉඩම සහිත නිවස වාහම විකිනීමට ඇත.කාමර 02වැසිකිලිය සාලය මුළුතැන්ගෙය ඉඩමෙහි අඹ, කෙසෙල්, අන්නාසි, මුරුංගා ගස් වගා කර ඇත.",Homagama,2,1,"1,200.0 sqft",10.0 perches
47,"House for Sale in Magammana, Homagama.",12 Jul  6:41 pm,"Homagama, Colombo","13,000,000","3.5 km from Homagama town. Ground floor area - 1,457 Sq. Ft.3 large bed rooms, sitting, dining, large kitchen, attached bath room and servant's bath room.Upper floor area - 688 Sq. Ft.Separate entrance. Separate electricity and water (both pipe born and well)1 large bed room, sitting, dining, kitchen and attached bath room.",4,3,"2,145.0 sqft",14.0 perches,
48,House for Sale - Homagama,12 Jul  5:02 pm,"Homagama, Colombo","8,500,000",3 Bedroom2 BrathroomKichenVerenda Roller GateFull till,3,2,"1,280.0 sqft",11.0 perches,
49,"Single Storied 4BR House for Sale in Pitipana, Homagama",12 Jul  3:53 pm,"Homagama, Colombo","12,500,000","Single Storied 4BR House for Sale in Pitipana, Homagama28.2 Perches1950 Sq.Ft.3 Bedrooms & 1 Visitor RoomLiving AreaDining RoomKitchen1 Bathroom + Outside ToiletVehicle Space for 3+ CarsGardenSurrounding by Wall & GateClear DeedBuilt in 2003Highly Residential AreaVery Calm & Peaceful Area10Ft. Access RoadFacing to D A Sudasinghe Mawatha, Mawathgama Road, Pitipana, Homagama900m to Highlevel Road2km from Homagama Town2km to Mahinda Rajapaksa National School2.5km to the Homagama Base Hospital2.5km to NSBM Green UniversityVery Urgent SaleNo BrokersSelling Price: Rs.125 LakhsCall for More Details","D A Sudasinghe Mawatha, Mawathgama Road, Pitipana",4,1,"1,950.0 sqft",28.2 perches
50,Half Complete House for Sale at Meegoda,11 Jul  5:10 pm,"Homagama, Colombo","3,000,000","Available for immediate Sale Half Complete House with 12 Perches Land extent situated at Nagahawatta, Meegoda.  Just 1 km to Economic center Meegoda. House Consist 3 bedrooms, boundary wall and gate.","Nagahawatta, Meegoda",3,1,"1,200.0 sqft",12.0 perches
51,House for Sale Homagama,11 Jul  1:34 pm,"Homagama, Colombo","7,500,000","පර්චස් 6.5 ඉදිකළ අංග සම්පූර්ණ නිවස විකිණීමට සම්පූර්ණ ටයිල් වලින් නිම කරන ලදකාමර 3නාන කාමර 1සාලයක් සහිතපැන්ට්‍රි සහිත මුලුතැන්ගෙයසේවක වැසිකිළියA/C සවි කිරීමට හැකි උණු ජල පද්ධතිය.වට තාප්ප සහ ගේට්ටුව සහිතවාහන නවතා ගැනීමට පහසුකම් ඇතිCOC සහතිකය,නිරවුල් ලියකියවිලි සහිත අනුමත නිවාස සැලසුම්බැංකු ණය පහසුකම් ලබා ගත හැකි,හයිලෙවල් පාරට 700mගොඩගම නගරයට 1.1km","ලයනල් ජයසිංහ මාවත, පනාගොඩ , හෝමාගම.",3,1,"1,200.0 sqft",6.5 perches
52,A Brand New House in Homagama,11 Jul 12:21 pm,"Homagama, Colombo","9,000,000",@  300m  128  kottawa  talagala bus route @  2•5km  homagama city @  3•5km  kottawa   southern high way entrance @  1•5km   diyagama   engineer university @  2•5km  homagama  NSBM campus @  3  bedrooms @  2  bathrooms @  living and dining area @  pantry @ fully tiled @  ceiling @  hot water @ surrounding wall and  gate @  2 vehicle parking area @  20  feet road @  7•5  perches @  no brokers please only genuine buyers,3,2,"1,450.0 sqft",7.5 perches,
53,House Homagama,11 Jul 12:13 pm,"Homagama, Colombo","8,500,000","idiwemin pawathina demahal niwasa.bus paarata 500m. town ekata 3,5km. highway entress ekata 4.5km. boker warun anawashshayai.",maagammana  homagama.,4,2,"3,000.0 sqft",13.5 perches
54,House For sale Homagama,11 Jul 11:19 am,"Homagama, Colombo","16,000,000","bus paarata 500m. town ekata 3,5km, ekama idamaka pihiti demahal niwasa saha thani mahal niwasa demahal niwsasa 50.000 ta kuliyata denna puluwan.wahana 3 parking atha.adi 20 paara,boker warun anawashshayi.",maagammana  homagama.,8,3,"4,000.0 sqft",12.5 perches
55,House for Sale - Homagama,11 Jul  3:20 pm,"Homagama, Colombo","5,000,000",හෝමාගම දකුණු පිටිපන පර්චස් 10 යි රූට් 8 ඉඩම සමග නිවස වැවිකිනිමට ඇත. ඉඩම වටේට තාප්පය බැද ඇත. වැඩිම ඉල්ලුම් කරුට ලබා දෙමි.නිවස - කාමර - 02නාන කාමර - 02,"No. 516/17, South Pitipana, Homagama",3,3,"2,940.3 sqft",10.8 perches
