,0,1,2,3,4,5,6,7,8,9
119,House for sale in Aluth para Meegoda,24 Jun  1:48 pm,"Homagama, Colombo","6,000,000","Meegoda, atigala mawathe viduliya mala jalaya sahitha demahal niwasa. Ikmanata vikinimata atha. Wadi visthara sadaha amathanna.",2,1,"1,361.25 sqft",7.0 perches,
120,House for Sale in - Meegoda,26 Jun  8:45 am,"Homagama, Colombo","5,450,000","Address-=Sirimedura mawata,Hettiyawatta ,meegoda.                                                                850m away from highleval road.                                    fully tilled two story house complete only ground floor.                           2 bedrooms.2bathrooms.kitchen.a car parking garage.                                                                          jac furniture  doors and windows.                                 8km to kottawa and athurugiriya highway entrance.                                                                     2 km to godagama junction.                                   Have a coc certificate.approved house plane.",2,2,900.0 sqft,7.0 perches,
121,Single Storied House in Thalagala,24 Jun 12:22 pm,"Homagama, Colombo","6,900,000","Small single storied house including,",Homagama,2,1,852.0 sqft,7.0 perches
122,House for Sale Moharagahahena,26 Jun  8:11 am,"Homagama, Colombo","9,500,000","නවීන සැලැස්මකට අලුතින් ඉදිවෙමින් පවතින නිවස සම්පූර්නකර විකිනීමට. තනි මහල් නිවසේ වහලේ උස අඩි 22කි වට තාප්ප ගසා ඇත, රෝලර් ගේට්ටු දෑමීමට ඇත. වෙල් යායකට මුහුනලා ඇත. නැමැවුම් වහල ගසා සම්පූර්නයෙන්ම ටයිල් අතුරා සෝලා පවර් හොට් වෝටර් සහ එක් කාමරයක් A/C කර, ගාර්ඩ්න් එක ලෑන්ස්කේප් කිරීමටද නියමිතයි. වැඩ සම්පූර්නයෙන්ම අවසන් කර විකිනේ. මොරගහහේන පිලියන්දල බස් මාර්ගයේ සිට නිවසට මීටර් 800යි, මොරගහහේන ටවුමට 2km. නිවස තෙක් වාහන 2ක් මාරු විය හැකි මාර්ගය.",3,1,"1,300.0 sqft",12.0 perches,
123,Two Story House in Homagama Panagoda,24 Jun  7:22 am,"Homagama, Colombo","12,700,000",15 perch LAND in HOUSE7 Bedroom 2 Bathroom living room and kitchen Pentry  office Room20  ft wide Road Enters3 Vehicles Parking1.400 Kms from Main road6 Kms from Homagama Twon85 % work completed 12.7/ Million in Current Situation 2 Million more to Finish Work Please inform 3 hours before you leave to inspect the House,Panagoda Homagama,7,2,"2,860.0 sqft",15.0 perches
124,Quick Homagama House for Sale,23 Jun  6:03 pm,"Homagama, Colombo","4,800,000",Well maintained house Built in 2017Around 2.5 km from HomagamaExtremely close to NSBM Campus129 Kottawa Moragahane roadBuses are available every 15 minsClose to Godagama,2,1,"1,824.08 sqft",6.7 perches,
125,House with land for Sale in Moragahahena,23 Jun 11:55 am,"Homagama, Colombo","7,000,000","කාමර 03, සාලය, නාන කාමරය, කුස්සිය. අංගසම්පූර්ණ නිවස. මුළු ගණන ලක්ෂ 70යි. ලක්ෂ 50 අතට. ඉතිරිය පදිංච් වූවාට පසු වාරික වශයෙන් ගෙවීමට සාදා ඇත.",Moragahahena,3,1,"1,200.0 sqft",12.0 perches
126,House for Sale in Homagama,19 Jul 12:49 pm,"Homagama, Colombo","6,000,000",3 Bedrooms 14x14 (Big rooms)Leving Room kitchen & Barthroom 2km to Homagama Junction1Km For Pitipana Junction  129 Bus Root 1Km For Pali University 2Km to NSBM Campus and Mahinda rajapaksha collage1Km to pitipana railway station1km to 122/125/99 High level road,"466/8, Pitipana North, Homagama",3,1,"2,613.6 sqft",9.6 perches
127,House for Sale in Homagama - Diyakada Junction, 6 Jul  4:15 pm,"Homagama, Colombo","7,500,000","House in beautiful surrounding area in colombo district.* Bed rooms 3*Bathroom  1*Living and dining.* Kitchen  pantry.*Water board water  supply and electricity  and clear deeds.* 200m to Piliyandala Bandaragama 149 bus route .*2 km to Kahathuduwa junction .කොළඹ දිස්ත්‍රික්කයේ අගනා පරිසරයක පිහිටි නිවස විකිණීමට .*නිදන කාමර 3.*නාන කාමරය සහ සේවක වැසිකිලිය.*විසිත්ත කාමරය.*මුලුතැන්ගෙය.*පිරිසිදු ළිං ජලය හා වෝටර් බොඩ් ජල සැපයුම, විදුලි බලය.*නිරවුල් ඔප්පු.* 200 m පිලියන්දල බණ්ඩාරගම 149 බස් මාර්ගයට.* 2 km කහතුඩුව මංසන්ධියට.",3,1,"1,097.0 sqft",11.5 perches,
128,House for Sale in Homagama,21 Jun  5:02 pm,"Homagama, Colombo","5,700,000","හෝමාගම, කිරිවත්තුඩුව, අඹගස් හන්දියේ සිට 500 m ක් නුදුරින් වට තාප්ප, ගේට්ටු සහිත අංග සම්පුර්ණ නිවසක් විකිනීමට ඇත.කාමර 03, බාත් රූම් 02 (ඇතුලත හා පිටත), කෑම කාමරය, මුළුතැන්ගෙය, වාහන 02 ක් නැවතීමට ඉඩකඩ සහිත ගරාජය.හෝමාගම නගරයට 5 km යි.මිල ලක්ෂ 57/- යි. (සාකච්චා කර ගත හැක.)","Homagama, Kiriwattuduwa, Ambagaha junction",3,2,"1,200.0 sqft",11.0 perches
129,House for sale in Homagama,21 Jun  4:55 pm,"Homagama, Colombo","30,000,000","House for sale in Pitipana Homagama24 perchSurrounded by very beautiful area3 store building and 8 perch bear land 7 bedrooms,1 common bathroom and kitchen in ground floor2 bedrooms,1 bathroom,living and kitchen in 2nd floor 2 storeroom in 2nd floor2000 sqt1 km from panagoda army camp 2 km for NSBM2 km for Mahinda Rajapaksha National School2 km for Homagama townIn front of  Buddhist and Pali University of HomagamaSuitable for  ResidentialPls call for more Details",Pitipana Homagama,9,2,"2,000.0 sqft",24.0 perches
130,House for Sale- Homagama,21 Jun  2:53 pm,"Homagama, Colombo","7,500,000","Brand New Full Completed House with,Living Room03 BedroomsKitchenVerandaBathroom",Pitipana-Dolahena,3,1,"1,150.0 sqft",10.0 perches
131,House With Land For Sale In Homagama,20 Jun  3:16 pm,"Homagama, Colombo","8,500,000","හෝමාගම,ගොඩගම හයිලෙවල් පාරට මීටර් 200 නුදුරින් පර් 10 ක ඉඩම විකිනීමට තිබේ.ජලය විදුලියද සහිතයි .අඩි 20 පාරවල් දෙකකට මායිම්ව පවතින අතර පිටුපස මාර්ගයෙන් අතුල් විය හැකි පරිදි නිවාසය සහිතයි .ඉඩම පොල් ගස් වවා සංවර්ධනය කර ඇත.පහල නිවසය තනාඅති කොටස සමග බැලූ විට පර් 15 ක් වේ.",Homagama,3,3,540.0 sqft,15.0 perches
132,Panagoda House for Sale,19 Jun  6:15 pm,"Homagama, Colombo","5,000,000",Panagoda walipillewa house for sale2 bed roomLiving roomDining room KichenBathroomliving room and 1 bed room tiledPrice 50 laks,2,1,"2,200.0 sqft",9.0 perches,
133,House for Sale in Homagama Meegoda,19 Jul 12:37 pm,"Homagama, Colombo","14,000,000",4 bed roomsBig living roomBig garden,New Road meegoda 400 m for bus road,4,2,"2,350.0 sqft",30.0 perches
134,2 Story House for Sale in - Meegoda,18 Jun  6:09 pm,"Homagama, Colombo","9,000,000","2 Story House for Sale Meegoda HomagamaFully Tiled, Finishing RoofAttached Barth Room - 1calm environment 750m to High level Road Meegoda Town1.5 km to Meegoda Railway Station & Dedicated Economic Center IMMEDIATE SALE  No Brokers Price can be Negotiated",4,2,"2,350.0 sqft",9.1 perches,
135,Fully Finished House for Sale Kahathuduwa,18 Jun  3:32 pm,"Homagama, Colombo","11,000,000","Fully finished3 bedroom2 living areasKitchen , Dining Bathroom with hot waterSaparate kitchen area and bathroomLandlineFully tiltedGarden Round wall and two gatesGood environment2 minutes kahathuduwa highway entrance 5 minutes mahindra rajapaksha ground 120,128,280 bus route s 1 minutes",434/2/1/D Andiyamulla kiriwaththuduwa,3,2,"1,350.0 sqft",20.0 perches
136,House for Sale - Homagama, 1 Jul  7:38 am,"Homagama, Colombo","6,500,000","මීගොඩ, පුවක්වත්ත පාර (මීගොඩ ආයුර්වේදය ඉදිරිපිට පාර), ගජුගහයට දෙණිය, දෙමටගහලන්ද පාර වාස්තු විද්‍යා උපදෙස් සැලකිල්ලට ගෙන තනන ලද නිස්කලංක පරිසරයක පිහිටි ඉතා වාසනාවන්ත නිවස. ඉඩම පර්චස් 17.5 කි සම්පූර්ණයෙන් ටයිල් අතුරා, සිවිලින් සහ මුළුතැන්ගෙහි පැන්ට්‍රි කබඩ් ගසා ඇත... නිදන කාමර 03, නාන කාමර 01, සේවක වැසිකිලි 01. ළිං ජලය වතුර මෝටරය සහ ටැංකිය සහිතය. වටිනා ගස් කොළන් සහිත විශාල ගෙවත්තක් සහිතය. වාහන 05 කට වඩා නැවතීමේ ඉඩ පහසුකම්. හිමිකරු විදේශගත වන බැවින් වහා විකිණේ.. දියගම මහින්ද රාජපක්ෂ විදුහල සහ NSBM Green University සමීපයෙන්.","Puwakwatta Road, Kadjugahayata deniya",3,1,"1,000.0 sqft",17.5 perches
137,House for Sale - Homagama,12 Jul  5:02 pm,"Homagama, Colombo","8,500,000",3 Bedroom2 BrathroomKichenVerenda Roller GateFull till,3,2,"1,280.0 sqft",11.0 perches,
138,House for Sale in - Homagama, 9 Jul  7:27 pm,"Homagama, Colombo","11,500,000",Two Storied House in Kiriwattuduwa Near to Mahinda Rajapaksha Ground 2km to Highway Entrance Genuin Buyers Only,4,2,"1,900.0 sqft",15.0 perches,
139,හෝමාගම කිරිවත්තුඩුවෙන් නිවසක්,11 Jul  2:47 pm,"Homagama, Colombo","7,500,000","සියලු පහසුකම් සහිතයි. 280/128 ප්‍රධාන බස්පාරට මීටර් 100ක් දුරින් පිහිටා ඇත. මහරගම, හෝමාගම, හොරණ, සදහා  බස් පහසුකම් ඇත. Cargils, ATM පහසුකම් , perera and sons 2.5 km දුරින් පිහිටා ඇත. අධිවේගි මාර්ගයට 5km . ටෙලිකොම්, WiFi, Pio Tv පහසුකම් ඇත. වැඩි විස්තර සදහා විමසන්න. හදිසි අවශ්‍යතාවයකට විකුනනු ලබයි. (දිස්ත්‍රික්කය කොළඹ.)","නො:44/7, කැන්ද කැටිය, කිරිවත්තුඩුව, හෝමාගම.",3,1,"2,705.0 sqft",10.0 perches
140,House for Sale in Homagama, 8 Jul  4:32 pm,"Homagama, Colombo","4,500,000","මීගොඩ - වටරැක 20 කනුව හන්දියෙන් සෝමරතන පාරේ 800 m දුරින් 3 වන පටුමගේ පර්චස් 11.5 ක ඉඩම සමග නිවස විකිනීමට ඇත.කෑම කාමරය, සාලය, මුළුතැන්ගෙය සහිතයි.ජනෙල්, දොරවල් සවිකර ඇත.ජලය, විදුලිය සහිතයි.","Meegoda, Watareka, 20 Kanuwa, Somarathana MW",3,1,"1,800.0 sqft",11.5 perches
141,Brand New House - Homagama,15 Jun 12:55 pm,"Homagama, Colombo","11,300,000","Brand new house fot sale in Homagama ,Magammana Road 500m to main road.2.5 km to Homagama     * 3 Bedrooms    * 2 Bathrooms     * kichen / pantry / cooker and cokker hood     * Hotwater     * CCTV camera     * Elcardoor Roller gate     * Jack timber     * vehicles parking space",Somalankara road,3,2,"1,268.0 sqft",7.5 perches
142,හෝමාගම අලුත් නිවසක් විකිණීමට, 6 Jul  3:20 pm,"Homagama, Colombo","6,900,000","හෝමාගම සිට 129 බස් මර්ගයේ, මොරගහහේන නගරයේ වර්ග අඩි 1300ක අගනා අලුත් නිවසක් විකිණීමට ඇත. වට තාප්පය සාදා රෝල දොර සවි කර ඇත.පර්චස් - 11නිවස වර්ග අඩි - 1300සම්පූර්න ටයිල්නිදන කාමර 3ප්‍රදාන සාලය 1කෑම කාමරය 1බාත් රූම් 1මුලුතැන්ගෙය 1වට තාප්පRoller Door","Thalagala, Homagama",3,1,"1,300.0 sqft",11.0 perches
143,House in Homagama.,30 Jun  8:23 pm,"Homagama, Colombo","7,500,000","sundara parisarayaka pihita ethi anga sampoorna nawa niwasa,moragahahena town ekata 800m. bus paarata 700m, mema bus maargaye meepe paadukka horana homagama piliyanadala kaluthara paanadura trinco yaapanaya nuwara bus daawanayawe,","moragahahena. homagama,",3,1,"1,200.0 sqft",11.0 perches
144,House for Sale in Godagama,15 Jun  7:40 am,"Homagama, Colombo","8,500,000",House for rent or sale in Godagama Naduhena. Fully tiled with pipe bone water and servants toilet.,3,1,"1,100.0 sqft",17.5 perches,
145,House For Sale in Homagama,14 Jun  6:48 pm,"Homagama, Colombo","4,300,000","හෝමාගම, කිරිවත්තුඩුව අඹගස් හන්දිය, ගල්කන්ද පාර, 7වන පටුමගකාමර 3බාත්රූම් 1කුස්සියසාලය සහිත තෙමහල් නිවස විකිණීමට.වර්ග අඩි 1200ජලය, විදුලිය සහිතයි.අඩි 20 පාරනිරවුල් ඔප්පුවට තාප්ප, ටයිල් නැත.නිවස සහිත පර්චස් 10 ඉඩමනිරවුල් ඔප්පුලක්ෂ 43","Abagus Junction, Galkanda Road, Kiriwaththuduwa, Homagama",3,1,"1,200.0 sqft",10.0 perches
146,House for sale in Homagama,14 Jun  4:51 pm,"Homagama, Colombo","9,700,000","හෝමාගම, මාගම්මන පාරේ පර්චස් 7 ක ඉඩම සහිත අංග සම්පුර්ණ නව නිවසක් විකිනීමට තිබේ.","Magammana, Homagama",3,2,"1,250.0 sqft",7.0 perches
147,House for sale in Homagama,14 Jun 11:38 am,"Homagama, Colombo","17,500,000",හෝමාගම - අතුරුගිරිය පාරේ හෝමාගමට ඉතා ආසන්න පර්චස් 48 ක ඉඩම සමග එහි ඇති නිවස (ඉදිකිරීම 1992 වසර) විකිනීමට (ප්‍රධාන පාරට ආසන්නව පිටුපස වෙලකට මායිම්ව).නිරවුල් ඔප්පු.,"Homagama, Athurugiriya Road",3,2,"1,400.0 sqft",48.0 perches
148,House for Sale in Homagama,14 Jun  9:57 am,"Homagama, Colombo","5,000,000","PAYMENT PLANReservation Fee – LKR 100,000 only!30% of the total value is payable within two weeks of the reservation been madeYou have two options for the remaining 70%You can pay the remaining amount in interest free installments up to 12 monthsWe can help you arrange a bank loan for up to 25 years.SWIMMING POOLYour dream home now gives you the ability to take a leisurely dip in our swimming pool on a?sunny day?or simply unwind after work.",House For Sale,2,1,720.0 sqft,6.0 perches
149,Architect Designed 03 Story House Sale in Homagama, 3 Jul  9:32 am,"Homagama, Colombo","31,500,000",Architect Designed 03 Story House With Roof Top For Sale In Homagama,600 M From Homagama Base Hospital,5,4,"4,000.0 sqft",6.0 perches
150,House in Homagama,30 Jun  8:23 pm,"Homagama, Colombo","7,400,000",sundara parisarayaka pihita ethi anga sampoorna nawa niwasa.128 thalagala kottawa bus maargayata saha 280 horana maharagama bus maargayata 800m raigam aayatahanaya lanagata 300m .bokerwarun anawashshayai.,"kiriwaththuduwa, homagama,",3,1,"1,200.0 sqft",10.0 perches
151,House for Sale in Meegoda,30 Jun  9:41 am,"Homagama, Colombo","2,500,000",House for Sale in Meegoda=================,"No.130/4C, Sawindu Uyana, Dampe, Meegoda",2,1,"1,300.0 sqft",10.0 perches
152,Homagama - House for immediate Sale, 1 Jul  2:38 pm,"Homagama, Colombo","8,500,000","House with 2 units (can be used as 2 houses) in a quiet residential neighborhood which can be used as business enterprise too (60ft access road).  Each unit has a separate entrance, and separate water and  3 phase electricity. Includes 5 bedrooms, 3 bathrooms and 2 kitchen areas and 2 living room areas, garage, a well and a garden area.Can be accessed: closest bus halt - 50m, 293 bus root, and 3 other bus roots about 1km away.5km to Athurugiriya town, 6km to Hanwella town, 6km to Homagama town.",5,3,"1,600.0 sqft",16.0 perches,
153,Two Storied House for Sale in Homagama,30 Jun  9:41 am,"Homagama, Colombo","13,300,000",Two Storied House for Sale in Homagama==========================,"Pitipana, Homagama",3,2,"2,700.0 sqft",11.0 perches
154,House for Sale with A Land in Highlevel Road Meegoda,14 Jun  8:26 am,"Homagama, Colombo","17,500,000","Three bedrooms with one attached bathroom, Boundary wall with gate, fully tiled.700 meters to HIgh level road, facing Daham Mawatha,",3,1,"2,000.0 sqft",25.0 perches,
155,House With 40P Land in Homagama,10 Jun  8:55 pm,"Homagama, Colombo","9,500,000","House with 40 Perch Land for sale in Meegoda, Homagama4 Bed Rooms2 Bath Rooms Living roomDining room Kitchen Parapet wallSq.ft 1750Bank loan can be obtained150 m to 219 bus route4.5 km to High-level road2.5 km to low-level roadFor immediate saleClear deeds Loan facility obtained from HNBNegotiable after inspection",Thelumpitiya rd Meegoda Homagama,4,2,"1,750.0 sqft",40.0 perches
156,House for Sale in Homagama,10 Jun  4:29 pm,"Homagama, Colombo","12,950,000","Fully Completed House for Sale in Homagama, Pitipana3 Bedrooms1 BathroomLiving RoomKitchenClear deedElectricity Tap water150m to 129 bus route 3km to Mahinda Rajapaksha School, NSBM Campus and NATO Tech Institute Fast Developing AreaGood neighborsImmediate Sale","557/47 Pitipana, South",3,1,"2,500.0 sqft",37.0 perches
157,House for Sale - Homagama (pitipana),10 Jun 10:43 am,"Homagama, Colombo","7,000,000","Beautiful house with 3 bedrooms, 2 bathrooms, dinning, kitchen, car porch & servant toilet located on 18 perch land for immediate sale. Close proximity to NSBM green university, Sri Lanka Institute of Nanotechnology (SLINTEC) & Mahinda Rajapakse college. Call Cynthia on  or Roger on  for more details and appoinments for inspections. Price is negotiable.",3,2,"1,500.0 sqft",18.0 perches,
158,brand new two story House, 8 Jun  8:21 pm,"Homagama, Colombo","12,000,000",Homagama godagama linal jayasingha mawatha 3bedrooms and 2bathroom TV lobby balcony garage roller door to high level road 300m 20ft road,Homagama goadagama,3,2,"1,880.0 sqft",6.5 perches
159,B/N House for Sale Homagama, 8 Jun  9:53 am,"Homagama, Colombo","4,950,000","# Newly build House for sale Homagama / Padukka# Easy access from 125 Colombo / Padukka main Highlevel road & 315 Meepe / Horana Bus roads# 2km to Padukka main town# 800m to Railway station# Fully Tiled | 1200sft | 8 perches | 2 Bedrooms | 2 Kitchen | Slab | Boundary with wall & gate | In door bathroom with Tiled | Out door bathroom | Kitchen | Living room | Water & Electricity | Vehicles parking | Varenda ect..# Facing to Beautiful big Paddy feild# Clear deeds with Approved plan | Any Bank loan facility # Very close to Schools, Banks, Hospitals & Supermarkets / very peaceful Environment & good NeighboursPrice Negotiable for Genuine Buyers..","Homagama, Padukka / Liyanwala.",2,2,"1,200.0 sqft",8.0 perches
160,Brand New Single Story House Sale in Homagama, 7 Jun  9:48 pm,"Homagama, Colombo","11,200,000",Barnd New Singleh Story House For Sale in Homagama -------------------------Located just 500meters to Uduwana junctions highly residential area,"500meters to Uduwana junction ,Temples Road,Homagama",3,3,"1,580.0 sqft",8.0 perches
161,House for Salet in Meegoda, 7 Jun  1:31 pm,"Homagama, Colombo","7,000,000",House for Salet in Meegoda=====================#   Land 10P#   House 1200Sqf#   මීගොඩ ආර්ථීක මධ්‍යස්ථානයට     තැපැල් කාර්යාලයට     පොලිස් ස්ථානයට     පාසලට කිලෝමීටර් 01යි.     අඩි 20 පුළුල් මාර්ග තාර දමා ඇත. #    පිරිසිදු ඔප්පු #  ඉක්මනින් විකිණීමට,"Godagama, Meegoda",2,1,"1,200.0 sqft",10.0 perches
162,"House for Sale - Homagama, Watareka",10 Jun  9:22 am,"Homagama, Colombo","3,500,000","Land for sale - Homagama, Watareka===================👉🏿  6 Perches land👉🏿  3 Bed Room / Living Room / Kitchen / Bathroom👉🏿  500m to 125 Ingiriya - Colombo 125 Main road👉🏿  Clam and quite place, ideal for living==================ජීවත් වීමට ඉතා සුදුසු ස්වාභාවික පරිසරයක පිහිටා ඇති නිදන කාමර 3 / සාලය / කෑම කාමරය / නාන කරමරය සහිත නිවස පිහිටා ඇති පර්චස් 6 ක ඉඩම විකිණීමට ඇත.මිල ගණන් සාකච්චා කිරීමට පැමිණ විමසන්න.","37/3/B, Galabedihena Road, Watareka, Homagama",3,1,"1,200.0 sqft",6.0 perches
163,House for Sale in Liyanwala,11 Jun  3:36 pm,"Homagama, Colombo","3,700,000","House for Sale  Liyanwala, Watareka Padukka.#     කාමර 03 යි#     සාලය ටයිල් කර ඇත.#     කුස්සිය#     බාත්රෑම් 01 යි#     මුළු නිවසට සිවිලින් ගසා ඇත.#     විදුලිය සහ ජලය ඇත.#     ඉඩමේ තව නිවසක් සාදා ගැනීමට තරම් ඉඩ ඇත‍.","Liyanwala, Watareka , Padukka",3,1,"1,100.0 sqft",15.0 perches
164,A Completed House for Sale in Homagama - Kiriwaththuduwa, 5 Jul 11:30 am,"Homagama, Colombo","6,800,000","‍හෝමාගම, කිරිවත්තුඩුව හන්දියට කි.මී. 01 ක් දුරින් 128 හෝමාගම - තලගල බස් මාර්ගයට  ආසන්නව පර්චස් 10  පිහිටි කාමර 03, සාලය, කෑම කාමරය, කුස්සිය සහ නාන කාමරය, අමතර නාන කාමරය සහ සේවක වැසිකිලිය ඇතුලු පහසුකම් වලින් සමන්විත අංග සම්පූර්ණ නව නිවස ඉතා ඉක්මනින් වීකිණිමට ඇත. සිවිලිම ගසා මුළු නිවසම ටයිල් කර ඇත. අඩි 12 ප්‍රවේශ මාර්ගය. නිවස සිට අඩි 40 ක් දිග පුද්ගලික මාර්ගයක් ඇත. නල ජලය , විදුලිය ඇතුලු සියලු පහසුකම් වලින් සමන්විතයි මිල ලක්ෂ 68 යි . මිලදී ගත් වහාම පදිංචියට සුදුසුය. අයිතිකරු විදෙස් ගත වන නිසා ඉක්මනින් විකිණේ.128 කොට්ටාව - තලගල මාර්ගයට සහ 280 මහරගම - ‍ හොරණ මාර්ගයට  මී. 300 129 කොට්ටාව - මොරගහහේන මාර්ගයට  මී. 700 හෝමාගමට සහ කොට්ටාවට කි.මී. 07",Pitipana South - Homagama,3,2,"1,360.0 sqft",10.0 perches
165,Apartment Style Home for Sale Homagama, 6 Jul 12:03 pm,"Homagama, Colombo","12,900,000","This immaculately designed 2-story house with a private balcony, invites comfort, and includes modern elegance. With 3 bedrooms, and 2 baths, generous living space and stylish finishes, you'll enjoy a perfect setting for relaxing and entertaining, thus living upto the name of the Lotus Flower. ","Pitipana South, Homagama",3,2,"1,650.0 sqft",10.0 perches
166,House for Sale in Homagama, 4 Jun 10:45 pm,"Homagama, Colombo","15,000,000","House for sale in homagama. 200m to high level road, 800m to high way entrance, 5Bedroom ,3barthroom,Two pantry, can be used separate house",Homagama Town,4,3,"2,280.0 sqft",11.0 perches
167,New Home for Sale in - Kiriwattuduwa, 4 Jun  3:58 pm,"Homagama, Colombo","7,400,000","3 Bedrooms, 1 Bathroom and 1 Servant Bathroom, Living Room, Kitchen,Three pase Electricity,Complete Water System,Brand new Home,Clear Documents,Near to Raigam Factory.Near to 128, 280 Main Bus Roads (1km).","Pitipana South, Koswatta, Kiriwattuduwa",3,1,"1,300.0 sqft",10.0 perches
