,0,1,2,3,4,5,6,7,8,9
168,House for sale in Homagama, 4 Jun  2:42 pm,"Homagama, Colombo","9,300,000","හෝමාගම, මාගම්මන, බටහෙන පාරේ නිවස සමග පර්චස් 17 ක ඉඩම විකිනීමට ඇත.වැරන්ඩාව,සාලය ටයිල් කර ඇත.කාමර 03 යි, බාත්රූම් 02, ගරාජය, වට තාප්ප ගේට්ටු සහිතයි.තව ඇනෙක්සියක් සෑදීමට ඉඩමේ ඉඩකඩ ඇත.බස් පාරට 50 m යි.හෝමාගම ටවුමට 3 km යි.","Homagama, Magammana, Batahena Road",3,2,"1,200.0 sqft",17.0 perches
169,House for Sale in - Homagama, 4 Jun 12:37 pm,"Homagama, Colombo","28,000,000","Property Has a Two Storied House with Fully Tiled  5 Bed Rooms  & 3 Bathroom | 1 Servant Bathroom , Two Halls (up Stair & Down Stair) , Car Parking ,two Dinning Areas , Pantry , Garden Area , up Stair Leisure Are Facing to Beautiful Paddy Field , Adsl Peo Tv Internet Connection , Peaceful Environment , Covered with High Wall , Back Side Facing to Paddy Field , Remote Control Rolling Gate , Clear Deeds , 15.5 Perches , Well Water",House for Sale in Homagama Panagoda,5,4,"25,000.0 sqft",15.5 perches
170,House for Sale - Homagama, 4 Jun 11:34 am,"Homagama, Colombo","20,000,000",Newly build house with completed facilities.  Located close to the paddy field with superb environment15 - minit drive to hi way enterance20 M.,Homagama,5,3,"2,800.0 sqft",10.5 perches
171,House for sale in Jalathara Housings Scheme, 4 Jun 10:45 am,"Homagama, Colombo","3,400,000","Fully tiled, located ground floor, one vehicle parking area,",Jalathara Housings Scheme,2,1,750.0 sqft,3.5 perches
172,House for Sale Homagama,18 Jun  2:51 pm,"Homagama, Colombo","5,250,000",හෝමාගම පිටිපන මහින්ද රාජපක්ෂ විද්‍යාලයට ආසන්නව තලගල හංදියේ අලුතින් ඉදිකල නිවස විකිණීමට . සියලු පහසුකම් සහිතයි . රමණීය වෙල් යායකට මුහුණලා පිහිටා ඇත .නිස්කලංක පරිසරය . නිවස සම්පූර්ණයෙන් ටයිල් කර සිවිලිම සවිකර  ඇත. 128 ප්‍රධාන බස් පාරට මීටර් 100යි.,3,1,800.0 sqft,7.5 perches,
173,House for Sale - Homagama,30 Jun  8:23 pm,"Homagama, Colombo","17,500,000","SUNDARA PARISARAYAKA PIHITA ETHI ANGA SAMPOORNA DEMAHAL NIWSA AHOMAGAMA TOWN EKATA 100M DUMRIYA STHANAYATA 200M PAASAL WALATA AWIDAGENA YA HEKI, DURA  BUS STAND EKATA  200M.",homagama.homagama.,4,2,"2,600.0 sqft",11.0 perches
174,House in Jalthara Houseing Scheme Homagama, 3 Jun  1:28 pm,"Homagama, Colombo","5,000,000",*  50m  homagama  hanwella  bus route (293)*  4km   low leave  road *  2  bedrooms *  bathroom * living area *  kitchen *  fully tiled *  30  feet road *  one   vehicle parking area *house   located  ground   floor,2,1,850.0 sqft,3.5 perches,
175,Brand New House Homagama Godagama, 3 Jun 11:00 am,"Homagama, Colombo","7,950,000",37/B/10Lionel Jayasinghe MawathaPanagoda HomagamaBrand new house in Homagama Godagama3 bed rooms2 toiletsLiving and dinningPantry Verendah and car porchFully tilledHot waterFitted pantry cupboardsAC pointSurrouded boundary walls with gateLandscape gardenPipe born water and electricityLocated in Lionel Jayasinghe Mawatha500m to main highlevel road (122 bus route)750m to Godagama junctionGood nabourhoodClear deedsAll approved council documents with COCHouse completed on 12/05/2019,3,2,"1,250.0 sqft",7.0 perches,
176,House for Sale in Meegoda,21 Jun  5:58 pm,"Homagama, Colombo","17,000,000","A newly build two story luxury house situated at Samanala Thanna Gardens (Sepalika Mawatha), MeegodaGood Neighborhood & Calm & quiet area","Samanala Thanna Gardens, Megoda",5,2,"2,950.0 sqft",11.9 perches
177,"Single Storied 3BR House for Sale in Pitipana, Homagama", 9 Jul  5:11 pm,"Homagama, Colombo","6,500,000","Single Storied 3BR House for Urgent Sale in Pitipana, HomagamaSelling Price: Rs.65 Lakhs Call for More Details: 10 Perches3 Bedrooms1500 Sq.Ft.Property Fully Secured with Boundary WallPeaceful EnvironmentClear DeedMortgage to People Bank, HomagamaSpace Available for Car ParkingPublic Banks are Located Nearby800m to High-Level Road800m to Panagoda Army School800m Pitipana Cargills Food City1km to the Panagoda Army Cantonment2km from Homagama Town2km to Mahinda Rajapaksa National School2km to Homagama Central College & President College, Homagama2km to Subharathee Vidyalaya, Godagama2km to the Homagama Railway Station2.5km to the Homagama Base HospitalApproximately 4km NSBM Green UniversityFacing to D A Sudasinghe Mawatha, Mawathgama Road, Pitipana, HomagamaCurrently, This Area Land Price is Rs.15 Lakhs Per PerchTherefore, This Land is Ideal as a Future Investment to Your ChildrenVery Urgent SaleNo Brokers","D A Sudasinghe Mawatha, Mawathgama Road, Pitipana",3,1,"1,500.0 sqft",10.0 perches
178,House for Sale at Homagama, 2 Jun  2:48 pm,"Homagama, Colombo","16,500,000","Two Story House For Sale at Homagama-------------------------Located just 350 meters to 697/698 Homagama - Kaduwela route to residential area1.5 km to Homagama junction1 km to Homagama Railway Station, Post office, Pradeshiya Sabhava, Divistional Secretary office, Two Schools (Homagama Central and Homaga3.7 Km to Kottawa Highway entrance","Manathunga Mawatha, Homagama",4,2,"1,700.0 sqft",7.5 perches
179,House for Sale - Pitipana (near to NSBM), 2 Jun 11:08 am,"Homagama, Colombo","8,500,000",පිටිපන පන්සල හන්දිය සිට උඩුවන පාරේ 300M අඩි 15 ඇතුළු වීමේ පාරක් සහිතයි ,"Pansala Handiya, Pitipana North, Homagama",3,1,"1,200.0 sqft",10.0 perches
180,New House for Sale in Moragahahena, 7 Jul  8:00 pm,"Homagama, Colombo","3,500,000","මොරගහහේන පිලියන්දල ප්‍රදාන බස් පාරට මීටර් 700ක් දුරින් සහ මොරගහහේන ටවුමට 3km දුරින්,වට තාප්ප ගසා ගේට්ටු දමා ඇත,නිදන කාමර 3යිනාන කාමර 1යි,විසිත්ත කාමරය, කෑම කාමරය සමග පැන්ට්‍රිය.නිවස සම්පූර්නයෙන්ම ටයිල් කර සිවිලිම ගසා ඇත,නිවස තෙක් අඩි20 පාර.පර්චස් 12‍යි ඉඩමේ සැලසුම සහ නිවසේ සැලසුම අනුමත වී ඇත. බැංකු නය පහසුකම් ලබාගත හැක. සම්පූර්න විකුනුම් මිල ලක්ශ 65 යිවටිනාකමෙන් 1/2ක් ගෙවා ඉතිරිය අවුරුද්දට 10% ක පොලියකට වාරික වශයෙන් ගේවාගෙන යාමටද හැක. (ලක්ශ 35ක් ගෙවා ඉතිරිය මාසික වාරික වශයෙන් ගෙවීමට හැක.)නිවසේ වැඩ නිමකර මාස 3යිපර්චස් 6ක නිවස පමනක්ද ලබාගත හැක ලක්ශ 58කටවැඩි විස්තර",3,1,"1,800.0 sqft",12.0 perches,
181,House for Sale - Homagama, 1 Jun 12:05 pm,"Homagama, Colombo","5,800,000",💜 House for sale 💜  Homagama=====================✅   පර්චස් 80ක නිවස සමග ඉඩම විකිණීමට ඇත✅   වටරුක දුම්රිය ස්ථානයට කි.මි. 1 ක් පමණ දුරින් පිහිටා ඇත✅   දුරකථන  / විදුලිය / උල්පත් ජලය / නල ජලය සහිතයි✅   රබර් වගාව සහිත ස්වාභාවික පරිසරයකි.✅   අධිවේගී මාර්ග කොට්ටාව පිවිසුමට මි.20කින් ලගාවිය හැක.✅   හෝමාගමට කි.මි. 8 ක් සහ පාදුක්කට කි.මි. 2 ක් පමණ ඇත.✅   අඩි 40 පළල 125 ඉංගිරිය කොළඹ කාපට් මාර්ගයට ආසන්නව පිහිටා ඇත.💜   නිවස සමග ඉඩමෙන් කොටසක් අවශ්‍යනම් වෙන් කර ලබා ගත හැක.💜   වැඩි විස්තර සඳහා විමසන්න.,"Watareka, Homagama",3,1,"2,000.0 sqft",80.0 perches
182,House For Sale In Homagama, 1 Jun 10:27 am,"Homagama, Colombo","3,800,000",walking distance to main road(High Level Road) Fully Tiled Public Water & Electricity Immediately sale,"Pothuhena watta,Godagama,Homagama.",2,1,"2,000.0 sqft",9.5 perches
183,House for sale in Homagama,30 May  4:46 pm,"Homagama, Colombo","6,900,000","3 bed roomsKitchenDining roomLiving roomTV roomOut side toiletOpen varandaCeilling and tilled50m to 128,280 bus road200m to 129 bus road7km to138 high level road4km to Mahinda Rajapaksha collage,NSBM univercity4km to Diyagama engineering univercity","thalagala junction, kiriwaththuduwa, homagama",3,2,"1,584.0 sqft",17.0 perches
184,House for sale in Homagama,30 May  3:11 pm,"Homagama, Colombo","17,500,000","හෝමාගම, පිටිපන මහින්ද රාජපක්ෂ ජාතික පාසල හා NSBM විශ්ව විද්‍යාලය පෙනෙන දුරින් අංග සම්පුර්ණ නිවස සහිත පර්චස් 40 ක ඉඩම විකිනීමට ඇත.ජල, විදුලි, දුරකථන පහසුකම් සහිතයි.සිසු නේවාසිකාගාරයකට ඉතා සුදුසුයි.හෝමාගම නගරයට විනාඩි 10 කි.","Homagama, Pitipana",3,1,"1,500.0 sqft",40.0 perches
185,House for sale in Homagama,30 May  4:59 pm,"Homagama, Colombo","13,500,000","Homagama, Katuwana, Kulasiri Kumarage MW, 3 Story House facing a large paddy field. 3 large bed rooms, Servant bath room with attach bath room. Wall around the House. 5  minutes to main town and Express way.11.01 perches. Lower ground floor 695 sqft, First floor 721 sqft, Upper ground floor 963 sqft.","Homagama, Katuwana, Kulasiri Kumarage MM",4,4,"2,379.0 sqft",11.01 perches
186,New house for sale - Homagama Madulawa,26 Jun 10:26 am,"Homagama, Colombo","3,850,000",New House for saleMadulawa Homagama=========================👉🏿 අංක 366 හෝමාගම හල්බරාව ප්‍රධාන බස් මාර්ගයට මී 75 ආසන්යේ අළුතින් සාදන ලද නව නිවස විකිණීමට ඇත👉🏿 ස්වාභාවික නිදහස් නිස්කලංක පරිසරයක පිහිටා ඇති ජීවත් වීම සඳහා ඉතා සෞම්‍ය පරිසරයකි👉🏿 බිම් කොටස පර්චස් 10 ක් වේ.👉🏿 පිරිසිදු ලිං ජලය සහිත👉🏿 පිරිසදු ඔප්පු සහිත👉🏿 නිදන කාමර 2 යි👉🏿 කෑම කාමරය👉🏿 විසිත්ත කාමරය👉🏿 අංග සම්පූර්ණ නාන කාමරය👉🏿 මුළුතැන්ගෙය සහ පැන්‍ට්‍රිය👉🏿 අලංකාර වැරෙන්ඩාව👉🏿 සිවිලිම සහිත අංග සම්පූර්ණ නිවස👉🏿 සම්පූර්ණ මිල රු. ලක්ෂ 38.50 කි.,Horagala Padukka,2,1,"1,000.0 sqft",10.0 perches
187,House for Sale in Kahathuduwa Homagama, 8 Jun  3:55 pm,"Homagama, Colombo","3,000,000","හෝමාගම කහතුඩුව මහේෂි උයනෙහි  පිහිටි කාමර 3 අඩක් නිමකළ නිවස වහාම විකිනීමට.120 හොරණ පාරට මීටර් 800 දුරින්කහතුඩුව අධිවේගී පිවිසුමට විනාඩි 5 යි.පිරිසිදු ළිං ජලය,නිස්කලංක පරිසරය ,පිරිසිදු ඔප්පු,ඉකමිනින් විකිනීමට","Polgasowita, Kahathuduwa, Mahesi uyana",3,1,"1,300.0 sqft",10.0 perches
188,House for sale in Homagama,29 May 11:58 am,"Homagama, Colombo","7,500,000","Single storied house for sale in Mahinda Mawatha, Homagama","Mahinda Mawatha, Homagama",3,1,"1,200.0 sqft",10.0 perches
189,House || in Homagama, 8 Jul  9:25 am,"Homagama, Colombo","21,000,000","2 story brand new house4 bed rooms with A/C4 bath rooms (1 attach)Sitting,dining Long living areaNedun PantryCar porchParapet wall with Roller Gate Pipe born water & electricity400m to 190 bus road300m to 698 bus road2km to athurugiriya high way entrance2.5km to kottawa high way entranceResidential area with good neighborhoodClear deeds",Homagama,4,4,"2,800.0 sqft",8.0 perches
190,Newly Built House for Sale in Homagama,30 Jun  9:40 am,"Homagama, Colombo","11,000,000",Newly Built House for Sale in Homagama===============================,"Berukatiya, Homagama",3,2,"1,560.0 sqft",7.0 perches
191,House for Sale in - Meegoda,26 Jun  8:45 am,"Homagama, Colombo","5,450,000","Address-=Sirimedura mawata,Hettiyawatta ,meegoda.                                                                850m away from highleval road.                                    fully tilled two story house complete only ground floor.                           2 bedrooms.2bathrooms.kitchen.a car parking garage.                                                                          jac furniture  doors and windows.                                 8km to kottawa and athurugiriya highway entrance.                                                                     2 km to godagama junction.                                   Have a coc certificate.approved house plane.",2,2,900.0 sqft,7.0 perches,
192,A Completed House for Sale in Homagama - Kiriwaththuduwa, 5 Jul 11:30 am,"Homagama, Colombo","6,800,000","‍හෝමාගම, කිරිවත්තුඩුව හන්දියට කි.මී. 01 ක් දුරින් 128 හෝමාගම - තලගල බස් මාර්ගයට  ආසන්නව පර්චස් 10  පිහිටි කාමර 03, සාලය, කෑම කාමරය, කුස්සිය සහ නාන කාමරය, අමතර නාන කාමරය සහ සේවක වැසිකිලිය ඇතුලු පහසුකම් වලින් සමන්විත අංග සම්පූර්ණ නව නිවස ඉතා ඉක්මනින් වීකිණිමට ඇත. සිවිලිම ගසා මුළු නිවසම ටයිල් කර ඇත. අඩි 12 ප්‍රවේශ මාර්ගය. නිවස සිට අඩි 40 ක් දිග පුද්ගලික මාර්ගයක් ඇත. නල ජලය , විදුලිය ඇතුලු සියලු පහසුකම් වලින් සමන්විතයි මිල ලක්ෂ 68 යි . මිලදී ගත් වහාම පදිංචියට සුදුසුය. අයිතිකරු විදෙස් ගත වන නිසා ඉක්මනින් විකිණේ.128 කොට්ටාව - තලගල මාර්ගයට සහ 280 මහරගම - ‍ හොරණ මාර්ගයට  මී. 300 129 කොට්ටාව - මොරගහහේන මාර්ගයට  මී. 700 හෝමාගමට සහ කොට්ටාවට කි.මී. 07",Pitipana South - Homagama,3,2,"1,360.0 sqft",10.0 perches
193,House for Sale in Homagama,27 May  7:23 am,"Homagama, Colombo","8,000,000","Watareka Facing to Somarathana mawatha, 500m Highlevel Road, 600m to 125 bus route, clear deed, square land, pipe borne water, 8 millions negotiable.",3,1,"1,200.0 sqft",11.0 perches,
194,House for Sale in Homagama,25 May  7:32 pm,"Homagama, Colombo","5,300,000",house for sale in Homagama600 m to 128 Homagama - Thalagala bus route.500 m to 697 Homagama - Kaduwela bus route.1.5 Km to Homagama town.,"739/2, Gamunu Mawatha, Homagama",2,1,700.0 sqft,6.0 perches
195,House for Sale in Homagama,25 May  2:01 pm,"Homagama, Colombo","6,700,000",අංගසම්පූර්ණ නිවසක් හා ඉඩම.හදිසි විකිනීමටහෝමාගමට විනාඩි 20යි.හොරණට විනාඩි 30.මන්තීරු 4ක මාර්ගයක් ඉදි වෙමින් පවතියි.විදුලිය/නල ජලයප්‍රධාන මාර්ගයට විනාඩි 5යි(පෙනෙන දුරින්)සියලු ලියකියවිලි නිරවුල්,"Yakahaluwa, Thalagala, Kiriwaththuduwa",3,1,560.0 sqft,10.0 perches
196,House for sale Homagama,25 May 10:10 am,"Homagama, Colombo","18,500,000","නිවස සමග පර් 32 ඉඩම විකිණීමටකාමර 4මුළුතැන්ගේ 2සාලයකෑම කාමරයනාන කාමර 2වැරැන්ඩාකිරිවත්තුඩුව හංදිය (128- තලගල කොට්ටාව, 280- මහරගම හොරණ ප්‍රධාන බස් මාර්ගයට විනාඩි 2යි)අධිවේගී පිවිසුමට කිමී 4යි120 (කොලඹ- හොරණ මාර්ගයට විනාඩි 10යිමහින්ද රාජපක්ෂ ක්‍රීඩාංගනයට සහ තොරතුරු තාක්ෂන විශ්ව විද්‍යාලයට විනාඩි 10යිNSBM විශ්ව විද්‍යාලයට විනාඩි 10යිඉඩම වටා ශක්තිමත් තාප්පයවිදුලිය නලජලය,  ලිං ජලය, දුරකතනපොල්,කොස් ඇතුලු ගස් වර්ග රාශියක්ඉතා නිස්කලංක පරිඅරයමිලගණන් සාකච්ඡා කල හැක.",4,2,"2,000.0 sqft",32.0 perches,
197,Brand New Singleh Story House For Sale - Homagama,25 May  7:22 am,"Homagama, Colombo","9,000,000",Barnd New Singleh Story House For Sale in Homagama --------------------------Located just 128 bus Routs thalagala-Kiriwaththuduwa  highly residential area,Located just 128 bus Routs thalagala-Kiriwaththuduwa  highly residential area,3,2,"1,580.0 sqft",7.0 perches
198,Under Construction House in Meegoda, 8 Jul  9:24 am,"Homagama, Colombo","12,000,000",2 story under construction houseBeautiful location 2 bathrooms1 bath roomsLiving / dining / sitting areaPantry with kitchen areawater & electricity2km to meegoda economic center4km to high level roadClear deed,Meegoda,2,1,"1,500.0 sqft",30.0 perches
199,Luxury House For Sale In Homagama, 4 Jul  4:10 pm,"Homagama, Colombo","9,400,000",Brand New Luxury House Sale in Homagama,"Samagi Mawatha, Pitipana North, Homagama",3,2,"1,426.0 sqft",6.65 perches
200,Three Storey House for Sale in Homagama,30 Jun  9:40 am,"Homagama, Colombo","19,000,000","Three Storey House for Sale in Homagama=======================* Location - Magammana, Homagama* Land Size - 28.10* House Size - 3200sqft* Bedroom - 05* Bathroom - 04 (attached)* Servant bathroom - 01* Price - 17500000/-   ( Negotiable )",5,5,"3,200.0 sqft",28.1 perches,
201,"Homagama, Godagama - House for sale",23 May  1:08 pm,"Homagama, Colombo","6,000,000","Naduhena junction Gamini jayasooriya mawathaSingle store new house with slab  in homagama, godagamaGround floor fully completed Fully tilledVerendahSurrounded boundary walls2 km to high level road (122 bus route)299,299/1,299/2 bus routeApproved plans & clear deed","School lane, Nawalamulla",3,1,"1,200.0 sqft",10.0 perches
202,Single story house for sale in Homagama,23 May 12:36 pm,"Homagama, Colombo","9,000,000","Single story house for sale in Homagama, MagammanaLocated 500 m to 128 Homagama - Thalagala bus route.","Magammana, Homagama",3,1,"1,200.0 sqft",10.0 perches
203,New House for Sale - Homagama,23 May  8:48 am,"Homagama, Colombo","25,500,000",Newly built house for same at Homagama - Panagoda500m to Highlevel Road and 200m Godagama Malabe Road2km to Homagama TownKottawa highway entrance 3kmAthurugiriya highway entrance 4km,5,2,"3,200.0 sqft",14.8 perches,
204,Brand New Modern House in Homagama, 4 Jun  5:43 pm,"Homagama, Colombo","15,800,000",*  300m  high  level   road * 1  km  homagama   city *  2km  N S B M  campus *  4  bedrooms * 2  bathrooms * large   living   area  and   dining   area *  large   T v  lobby *  large   balcony *  pantry *  roof   top* fully   tiled * 2  vehicle   parking  area *  surrounding   wall *  roller   gate *  20  feet   road *  6•5  perched *  2800  sqpt *hot   water * CCTV,homagama,4,2,"2,800.0 sqft",6.5 perches
